job_id,published_date,title,description,career_page_name,type,application_deadline,is_remote_work,city,state,country,job_url,disabilities,workplace_type,submitted
6496726,2023-12-28T21:36:23.644Z,Analista de Planejamento e Operação Comercial Pleno,"Buscamos pessoas inquietas por inovação, que procuram soluções criativas e novas perspectivas, que tenham o olhar direcionado ao cliente, e que reconheçam que a curadoria e o conhecimento compartilhado são as melhores maneiras de construir relações de confiança. Identificou-se? Então a Víssimo é para você. Venha fazer parte do nosso time!Responsabilidades e atribuiçõesComo Analista de Planejamento e Operação Comercial, você vai:Precificar e gerenciar as ofertas disponíveis no site de acordo com o planejamento;Ser responsável pelo foco de crescimento de vendas e controle da margem;Realizar a criação e gestão do calendário comercial;Acompanhar o forecast mensal/anual do catálogo;Ser responsável pela gestão de produtos e ofertas nas categorias disponíveis;Fazer a gestão dos produtos de Confraria;Elaborar análises de vendas de produtos;Realizar análises de perfil de cliente;Fazer o acompanhamento de KPIs e elaboração de reports gerenciais.Requisitos e qualificaçõesPara isso, a gente espera que você tenha:Ensino uperior completo em Engenharia, Administração, Marketing, Publicidade ou correlatas;Conhecimento intermediário / avançado em Excel;Excelente capacidade analítica e estratégica;Seja comunicativo, muito focado em resultados, pró-ativo e goste de trabalhar em equipe;Boa conversa e senso de humor ;)E nos surpreenderia se tivesse:Experiência em Marketing Digital, E-commerce ou Assinaturas;Experiência com ferramentas analíticas de análise de dados;Conhecimentos de programação;Inglês intermediário / avançado.Todas as vagas são abertas para pessoas com deficiência (PcD)Nos processos seletivos da Víssimo Group, não há qualquer tipo de distinção em virtude de gênero, orientação sexual, religião, crença, condição social ou raça.Informações adicionaisAqui você vai encontrar:Espaço para criar e colaborar com a área, imprimindo o seu jeito de ser e conhecimentos que deram certo em outros lugares;Cultura de crescimento e muita aprendizagem;Benefícios como: Vale-transporte, Vale-refeição/Alimentação, Assistência médica e Odontológica, Convênio Farmácia, Seguro Pet, Betterfly, Total Pass, Day Off de Aniversário, Desconto na Wine Locals, Creditas e Clube de desconto em produtos Evino e Grand Cru.No dress code! Aqui você pode ser quem você é, e vir trabalhar como se sentir à vontade;Ambiente descontraído e divertido;Jornada Hibrida (3 dias de Home-Office por semana);All Hands quinzenais: bate papo com os nossos Co-CEOs e diretores;E sim! Você pode tomar vinho enquanto trabalha! [Se for maior de idade, é claro :)] Onde estamos localizados?Rua Bela Cintra, 986 - 8 andar - Consolação - SPSiga-nos nas redes:instagram: @Vissimogroup | @evino | @grandcruvinhoshttps://www.linkedin.com/company/vissimo-group/ linkedin.com/company/evino / linkedin.com/company/grand-cru-importadora-ltda/facebook.com/evino / facebook.com/grandcruvinhostwitter: @evinoyoutube.com/evino / youtube.com/c/grandcru /",Víssimo,vacancy_type_effective,,False,São Paulo,São Paulo,Brasil,https://vissimo.gupy.io/job/eyJqb2JJZCI6NjQ5NjcyNiwic291cmNlIjoiZ3VweV9wb3J0YWwifQ==?jobBoardSource=gupy_portal,True,hybrid,True
5766971,2023-12-28T21:25:12.158Z,ANALISTA TESOURARIA CORPORATIVA PL,"Nós somos a CVC Corp, o maior grupo de viagens das Américas, formado por unidades de negócios que atuam com marcas distintas nos segmentos de viagens de férias e de lazer, viagens corporativas e relacionadas a cursos e intercâmbio cultural no exterior. A evolução, a expertise e o pioneirismo das nossas marcas impactam o mercado, a economia e a vida de milhões de pessoas. Aqui, formamos um time que busca evolução constante, protagonismo e bons motivos para continuar transformando o mundo com o nosso negócio.  A nossa bandeira é o respeito. E para fortalecer a nossa diversidade, queremos expandir a pluralidade da nossa gente buscando equidade e valorizando diferentes perspectivas, pautadas nos pilares de Gênero, LGBTI+, Raça, Pessoas com Deficiência e 50+ tornando o nosso ambiente mais diverso e representativo Venha com a gente fazer parte desta transformação, Confira abaixo as oportunidades que temos no time:  #somoscvccorpResponsabilidades e atribuiçõesFechamento de câmbio e e controlar a exposição cambial para fechamento de hedge através de derivativos de câmbio (NDF);Atualização e validação mensal da marcação a mercado das operações de hedge;Fluxo de Caixa: monitorar e gerenciar o fluxo de caixa direto e indireto, prevendo necessidades de fundos e otimizando o uso de recursos;Preparar apresentações corporativas;Entregar relatórios de fechamento mensal e conciliações financeiras;Realizar conciliação financeira mensal dos câmbios fechados.Requisitos e qualificaçõesFormação em Finanças, Administração ou área relacionada;Domínio avançado de Microsoft Excel;Experiência prévia em tesouraria ou funções financeiras similares;Experiência em Derivativos (Imprescindível);Conhecimento do Terminal Bloomberg (Imprescindível);Conhecimento em fluxo de caixa e gestão de derivativos (NDF).DESEJÁVEL:VBA (fórmulas, macros e power query)Informações adicionaisPARA O SEU DIA A DIA:• Vale Refeição e/ou Alimentação;• Vale Transporte;• Auxílio Creche e Filho com Deficiência.CUIDAR DA SAÚDE E BEM-ESTAR• Assistência Médica com isenção de mensalidade para você e seus dependentes (filhos(as) e cônjuge) (SulAmérica - com coparticipação);• Assistência Odontológica (SulAmérica);• Seguro de Vida;• Convênios Farmácia (Univers);• Academia (Total Pass);• Programa “Amor de Mãe” – para o cuidado das gestantes, sejam as pessoas colaboradoras ou cônjuges, durante o pré-natal.• Empréstimo Consignado;• E, ainda, as Licenças Estendidas para maternidade (180 dias), paternidade (20 dias) e adoção (entre 135 a 180 dias, dependendo da idade da criança).CURTIR A VIDA• Programa Minha Viagem: descontos na compra de pacotes e passagens aéreas, hospedagem, entre outros produtos, benefício extensível para seus dependentes e ascendentes”• Convênio com o SESC;• Day Off no mês do seu aniversário;• Cinemark: Parceria atrativa com a rede.POTENCIALIZAR O SEU DESENVOLVIMENTO• Universidade Corporativa;• Parcerias com instituições de Ensino.#EmbarqueCVCCorp",CVC Corp,vacancy_type_effective,,False,Santo André,São Paulo,Brasil,https://cvccorp.gupy.io/job/eyJqb2JJZCI6NTc2Njk3MSwic291cmNlIjoiZ3VweV9wb3J0YWwifQ==?jobBoardSource=gupy_portal,True,on-site,True
6523260,2023-12-28T21:19:21.871Z,Analista de Suprimentos JR ,"A Wilson Sons é uma das maiores operadoras de serviços portuários, marítimos e logísticos do Brasil, e iniciou suas atividades em 1837, em Salvador, Bahia. Nesses 180 anos de existência, a Companhia se estabeleceu como renomada prestadora de serviços pela competente gestão de seus negócios nos segmentos em que atua.Quem Somos?Somos conexões que acompanham as tendências do mercado, investem em infraestrutura e tecnologia, inovam em processos e antecipam necessidades. É o nosso olhar para o futuro que garante as melhores oportunidades para os nossos parceiros.Nossa equipe é composta por pessoas que compartilham os valores e princípios que norteiam a visão de futuro da Wilson Sons. São pessoas engajadas e comprometidas com a qualidade de entrega de nossos serviços, o que reflete diretamente na produtividade da companhia. Em nossa Visão, assumimos o compromisso de ser a primeira escolha dos colaboradores e de crescer de forma arrojada, sinérgica e sustentável. Nesse desafio, buscamos promover e manter um alto nível de engajamento de equipe.Buscamos pessoas que desejam entregar o seu melhor para crescermos juntos.  Junte-se a nós! Conheça Melhor a Wilson Sons!Site: www.wilsonsons.com.brInstagram: wilsonsonsLinkedin: www.linkedin.com/company/wilsonsons/Responsabilidades e atribuiçõesComo Analista de Suprimentos JR você será responsável pela negociação, contração, gestão de Acordos comerciais/contratos e seleção / desenvolvimento de fornecedores. Seus de desafio serão:Realizar pedidos de compras, desde à solicitação (rc) até a execução do serviço e pagamento do mesmo;Análise, negociação e elaboração de acordos/contratos comerciais e/ou formalização junto ao jurídico;Desenvolvimento e captação de fornecedores;Realizar e acompanhar o processo de compras, realizar contratação de serviços, consertos e reparos para a operação e manutenção (exemplo: serviços para bombas, motores, equipamentos elétricos e mecânicos, usinagem etc.);Solicitar o cadastro de materiais e fornecedores;Análise e criação de relatórios que ajudam no acompanhamento do dia-a-dia da equipe. Sistemas mais utilizados Coupa (plataforma de sourcing), Klassmatt (cadastro de serviços), SAP (ERP), Looker Studio Google, Excel e Google plans (planilhas eletrônicas).Requisitos e qualificaçõesO que você precisa para participar:Formação: Administração, Engenharia de Produção, Estatística e áreas afins;Excel Intermediário/Avançado (Será testado);Google Data Studio;Desejável:Conhecimento nos sistemas: Google Data Studio, SAP e Coupa.Informações adicionaisNos preocupamos com o bem-estar das nossas pessoas, por isso oferecemos benefícios e cuidados que permitem uma vida com mais qualidade.Cuidados com a alimentação: Vale Alimentação/Refeição, com um bônus no Natal;Cuidados com a saúde: Plano de Saúde, Plano Odontológico, Seguro de Vida, Telenutrição e telemedicina para você e seus dependentes;Cuidados com a sua saúde mental: Telepsicologia para você e seus dependentes;Cuidados com o seu desenvolvimento: Plataforma de cursos; Outros: Vale transporte; PLR anual;Etapas do Processo:TriagemEntrevistas com RHTeste ExcelEntrevistas com as lideranças Exame admissionalContratação",Wilson Sons,vacancy_type_temporary,,False,Rio de Janeiro,Rio de Janeiro,Brasil,https://wilsonsons.gupy.io/job/eyJqb2JJZCI6NjUyMzI2MCwic291cmNlIjoiZ3VweV9wb3J0YWwifQ==?jobBoardSource=gupy_portal,True,hybrid,True
6438628,2023-12-28T21:18:17.477Z,Analista de Gestão de Ativos TI Jr,"Está preparado(a) para cultivar novas experiências em uma equipe que joga junto e valoriza o melhor de cada um(a), atuando na Raízen, uma das maiores empresa do país? Aqui, os desafios tornam-se oportunidades de inovação que podem impactar sua trajetória profissional e a vida de milhões no Brasil e no mundo.A pessoa Analista de Gestão de Ativos JR na área de Gestão de Ativos de TI atuará gerenciando os recursos de Tecnologia da Informação (TI) na Raízen. Isso envolve o controle e a administração de ativos físicos ou tecnológicos para milhares de usuários da Raízen e empresas do grupo Cosan. Inclui o atendimento de chamados envolvendo ativos e periféricos, monitoramento, aquisição, recepção, inventário, controle de estoque e envio para outras unidades.O cargo descrito está focado principalmente na administração e gerenciamento de recursos de TI, portanto, embora possa incluir o atendimento de chamados, estes atendimentos estarão mais restritos a um escopo alinhado com a gestão de recursos físicos e tecnológicos destes ativos e não ao suporte técnico de TI como Analista de Suporte Técnico ou cargos similares.Ainda assim, é esperado ter uma formação concluída ou em andamento na área de TI a fim de potencializar o entendimento das solicitações, facilitar a comunicação com os clientes internos e fornecedores, aprimorar a eficiência na resolução de problemas e agregar de outras maneiras.Buscamos pessoas cheias de energia e prontas para abraçar novas oportunidades, que realizem um trabalho que gere valor para nossos clientes e colaboradores.Local: CAR - PiracicabaHorário: Administrativo - modalidade 100% presencial.Responsabilidades e atribuições🎯COMO SERÁ O SEU DIA A DIA:Realizar atendimento ao usuário via chamados pela plataforma de TIAtender receptivamente clientes internos e fornecedoresRecepcionar, analisar, comprar equipamentos (periféricos e ativos) e solucionar problemasSer responsável pelo atendimento ao cliente, tirando dúvidas e fornecendo informações claras e objetivas, conforme procedimentos e política da companhiaAcompanhar e fazer follow-up de chamadosRealizar inventários periódicos do estoque de TI nas unidades da RaízenManter o estoque atualizado e organizado de acordo com o inventárioControlar o ciclo de vida dos equipamentos (reparo, estoque e descarteGerar melhoria contínua nos processos, em busca de eficiência e produtividadeRequisitos e qualificações🔎O QUE VOCÊ PRECISA TER:Curso técnico ou graduação em Tecnologia da Informação ou áreas correlatas (em andamento ou concluído)Experiência com atendimento ao clienteConhecimento na área de TI (principalmente com hardware), através de cursos técnicos, graduação ou outras fontes de conhecimentosTer iniciativa, boa comunicação (verbal e escrita), curiosidade, organização, flexibilidade e agilidade.Facilidade com trabalho em equipeFoco no atingimento de metas, prazos e solução de problemas.Conhecimento em Excel será um diferencialConhecimento em melhoria contínua, 5S e metodologia lean será um diferencialInformações adicionaisETAPAS DO PROCESSO SELETIVO:Nosso processo contempla 3 etapas principais (podem ter outras, e você ficará por dentro caso avance):Inscrição - preenchimento deste formulário e de dados adicionais, caso necessário.Entrevista com o RH - um bate-papo para nos conhecermos.Entrevista com a liderança: bate-papo mais técnico para contar ainda mais sobre o dia a dia e os desafios.Nossa comunicação será por e-mail e telefone - confira se seus dados estão atualizados. CONHEÇA MAIS SOBRE O QUE É SER RAÍZENQue tal conhecer mais sobre como é fazer parte da Raízen e entender como a nossa cultura RAIZ contribui para um ambiente de trabalho em que você terá oportunidade de promover um impacto positivo no mundo?Nosso Instagram de Carreiras: @raizencarreirasNão é essa a vaga ideal? Volte para a página principal: https://carreiras.raizen.com.br/Também quer receber novidades sobre a Raízen no e-mail? https://chat.sparkrh.com/gente-raizen/news#VemSerRaízen",Raízen ,vacancy_type_effective,,False,Piracicaba,São Paulo,Brasil,https://genteraizen.gupy.io/job/eyJqb2JJZCI6NjQzODYyOCwic291cmNlIjoiZ3VweV9wb3J0YWwifQ==?jobBoardSource=gupy_portal,False,on-site,True
6515931,2023-12-28T21:13:36.559Z,Analista de BI (plataformas),"Buscamos uma pessoa para atuar como Analista de BI (plataformas) na MRM Brasil, uma agência full-service, com maior foco em digital, do McCann Worldgroup, unidade do Grupo Interpublic (IPG). Uma agência que acredita no poder das intersecções entre estratégia, criatividade e tecnologia, suportado por dados, para criar experiências totalmente humanas. Atuamos a partir do modelo híbrido de agência e consultoria de transformação digital, ajudando a fortalecer o relacionamento entre negócios e pessoas, ajudando marcas a encontrarem seu propósito, aprofundar suas relações e criar experiências que gerem crescimento.Venha fazer parte de um time Better Together onde sua individualidade é respeitada e valorizada em todos os sentidos!Responsabilidades e atribuiçõesEstruturação, consolidação e validação de dados para fechamentos e reportsBuscar o entendimento de cenários através da relação de dados e processos e/ou regras de negócioElaboração de análises, insights e estratégiasConstrução de relatórios, dashboards e apresentações de desempenhoRequisitos e qualificaçõesRequeridosFormação em estatística, publicidade, marketing, matemática ou áreas relacionadas à ciências da computação, engenharias ou tecnologiaDomínio das ferramentas Microsoft Excel, Adobe Analytics, Adobe CampaignPelo menos 2 anos de experiência em plataformas digitaisForte capacidade analítica com foco em qualidade e em resultadosDesejávelInglêsEspanhol Informações adicionaisModelo de trabalho híbrido.Ferramentas de trabalho fornecidas pela empresa.Benefícios:VA/VR: valor fixo de R$902,00 mensais;Assistência médica (100% coberto pela empresa);Seguro de vida de até 12 salários;Day off de aniversário;Plataforma de desenvolvimento e aprimoramento acadêmico e profissional;",Vagas MRM Brasil,vacancy_type_effective,2024-01-31T00:00:00.000Z,False,São Paulo,São Paulo,Brasil,https://mrm.gupy.io/job/eyJqb2JJZCI6NjUxNTkzMSwic291cmNlIjoiZ3VweV9wb3J0YWwifQ==?jobBoardSource=gupy_portal,True,hybrid,True
6502204,2023-12-28T21:09:25.552Z,Analista de Crédito Sênior- Curitiba - PR🤝🏭,"Aqui no Itaú nós trabalhamos todos os dias para sermos líderes em satisfação do cliente. Você será fundamental para a construção de um relacionamento sustentável com grandes e médias empresas da região, trabalhando para oferecer soluções financeiras personalizadas que se adequem aos seus desafios, além de participar ativamente na prospecção de novos clientes. Nós acreditamos que uma instituição financeira deve ajudar a realizar sonhos e investir em grandes ideias. Somos um banco que incentiva as empresas a progredir e é assim que guiamos nossos negócios. Buscamos um analista de crédito, com postura provocativa, flexibilidade nas discussões, que conheça a gama de produtos bancários, tenha experiência com clientes para gerir uma carteira de crédito que atende clientes de porte varejo.Responsabilidades e atribuiçõesGestão de Carteira de clientes PJ que faturam entre R$ 3 MM e R$ 60 MM atuando na concessão e na gestão dos riscos já alocados.Visitas de crédito, em média 2 por semana, com análise de 15 propostas por dia.Modelo de trabalho: Híbrido com escala.Requisitos e qualificaçõesGestão de crédito e risco de sua carteira de clientes;Estar atento ao mercado econômico e suas tendências.Realizar rotinas comerciais e administrativas (controle e organização dos atendimentos diários e vendas);Formação: Superior Completo - Economia , Superior Completo - Ciências Contábeis , Superior Completo - Administração ou área correlatas.Tecnologia: Excel , Powerpoint e outros.Além disso, é importante que você:- Seja planejado e organizado;- Seja um bom negociador e tenha uma postura consultiva;- Goste de aprender todos os dias;- Tenha o cliente como centro de todas suas ações;- Lembre-se: gente é tudo pra gente.Informações adicionaisO Itaú irá utilizar os dados fornecidos para fins de processos seletivos, inclusive em bancos de vagas alocados em plataformas terceiras. Caso deseje solicitar oposição a este uso, ou exercer quaisquer um dos seus direitos, entre em contato através de nossos canais, disponíveis na Política de Privacidade de candidatos do Itaú Unibanco (https://www.itau.com.br/privacidade/candidatos/). Não há necessidade de aceitar, trata-se apenas de uma ciência.",Itaú Unibanco,vacancy_type_effective,,False,Curitiba,Paraná,Brasil,https://vemproitau.gupy.io/job/eyJqb2JJZCI6NjUwMjIwNCwic291cmNlIjoiZ3VweV9wb3J0YWwifQ==?jobBoardSource=gupy_portal,False,hybrid,True
6523284,2023-12-28T21:08:14.423Z,Analista de BackOffice- Junior,"Basta conversar um pouquinho com nosso time para entender que somos apaixonados por impacto! 💜 A Incentiv é uma startup de inovação tributária (taxtech) que conecta o ecossistema de leis de incentivo fiscal para que pessoas e empresas possam investir parte dos seus impostos em projetos que resolvam problemas coletivos, contribuindo para um mundo mais justo e inclusivo. Nós existimos para transformar impostos em inovação social e tecnológica!Que tal ser um agente de transformação? 😍 Como Analista de BackOffice você terá a missão Oferecer suporte à equipe de relacionamento, contribuindo com a organização e registro de dados e utilizar inteligência de dados para analisar o comportamento dos clientes e identificar padrões para ajudar a alcançar os marcos de sucesso do cliente proponente.Responsabilidades e atribuiçõesTrabalhar com CSMs para identificar padrões em dados comportamentais e para direcionar a estratégia de modo a alcançar os marcos de sucesso do cliente;Identificar oportunidades e melhorias em atividades para retenção do cliente;Identificar tendências para ajudar a determinar melhorias na estratégia e no processo de relacionamento com o cliente proponente;Usar dados quantitativos e qualitativos para identificar oportunidades para novos recursos voltados para o cliente;Organizar e estruturar o banco de dados da área;Garantir a atualização da gestão à vista da área;Elaborar relatórios para proponentes com informações de venda das unidades de negócio da Incentiv;Realizar a divisão de carteira com base na Matriz BCG e ser responsável por sua constante manutenção independentemente da ferramenta utilizada;Atuar de forma próxima à coordenação e à gestão operacional para contribuir com atividades relacionadas à gestão do time; Auxiliar no desenho dos fluxos e processos da área Garantir que o play book e bancos de respostas estejam sempre atualizados; Monitorar as atualizações de proponentes Monitore e Conecta para repasse ao time sempre que necessário.Requisitos e qualificaçõesObrigatórios:Graduação completa, em administração, relações internacionais, produção cultural, comércio exterior, comunicação social, ciências sociais, gestão de políticas públicas, direito ou áreas correlatas; Experiência anterior no atendimento a clientes empresas; Conhecimento em leis de incentivo fiscal, mecanismos de incentivo/dedução fiscal; Conhecimento em Google Workspace (G Suite) , pacote office e CRM.Desejável Conhecimento em métodos ágeis, CRM (Sales force), pacote office.Habilidades e atitudes:Comunicação e escrita; Autonomia, Flexibilidade e resiliência; Proatividade na resolução de problemas; Trabalho em equipe; Criatividade e pensamento estratégico; Relacionamento interpessoal;Criticidade.Informações adicionaisO que oferecemos?Saúde:⛑Plano de saúde Sul América Nacional (sem desconto de mensalidade para colaborador(a) apenas coparticipação); 💬Programas de apoio Ana Health (Atendimento de Saúde online com custo abaixo do tradicional de mercado, consultas psicológicas e algumas especialidades médicas);Qualidade de Vida:💻Modalidade de trabalho 100% home office;💰Auxilio home office;🥘Vale alimentação(sem desconto em folha);💰Com base em performance e alinhamento cultural, possibilidade de prêmio anual;Bem-Estar:🤩Day off de aniversário;🎁Presente de aniversário;👶Auxílio creche para filhas(os) na faixa etária de 0 a 6 anos de idade;🤝Parceria com SESC (com o Cartão Sesc, os colaboradores tem acesso a atividades físicas, nutrição, dentista, educação infantil, hotéis, cursos de artes, entre outros serviços com valores diferenciados).Educação Continuada:📚Trilhas de capacitação (treinamentos);📈Programas de desenvolvimento corporativo;📖Parceria com as escolas de Idiomas Open English e Influx, sendo uma de modalidade on-line e a outra presencial, obtendo um desconto especial;🎉Semana de Convenção, 3 dias com tudo pago para todos os colaboradores, anualmente.   Aqui você encontrará gente do bem, positiva, que ama o que faz e que faz acontecer!Gente que acredita na riqueza da diversidade, por isso todas as nossas vagas são trabalhadas pensando em promover e valorizar uma cultura inclusiva que busque a equidade em relação a Gênero, LGBTQI+, Pessoas com Deficiência, Etnia e Regionalidades.E aí, se identificou com essa oportunidade?Bora fazer parte desse time? A nossa história está só começando e nós sonhamos grande!",Incentiv,vacancy_type_effective,2024-01-18T00:00:00.000Z,True,,,Brasil,https://incentivme.gupy.io/job/eyJqb2JJZCI6NjUyMzI4NCwic291cmNlIjoiZ3VweV9wb3J0YWwifQ==?jobBoardSource=gupy_portal,True,remote,True
