job_id,published_date,title,description,career_page_name,type,application_deadline,is_remote_work,city,state,country,job_url,disabilities,workplace_type,submitted
6509089,2023-12-26T16:45:18.270Z,Analista de E-commerce e BI - Para atuar em Esteio/RS,"Você gosta de gerar soluções criativas com entregas de qualidade? Já pensou em atuar em uma empresa sólida, com marcas líderes em seus mercados? Com sede em Esteio/RS e na região Paulista/PE, também operando com um Centro de Distribuição em Araçariguama/SP, há mais 75 anos, a InBetta, através das suas unidades de negócio, fabrica ampla linha de produtos em diferentes segmentos, sendo referência nos seus mercados de atuação.Se você também acredita que a criatividade facilita a vida, confira as oportunidades disponíveis.Responsabilidades e atribuiçõesDesenvolver ações e estratégias de Sell Out (Calendário Anual);Responsável pelo cumprimento das metas de Sell In e desenvolvimento do JBP dos clientes assim como os KPIs de produtividade (Custo de Servir, Investimentos, Entregas);Responsável pelo gerenciamento e controle dos investimentos comerciais sejam descontos, acordos ou bonificações; Garantir a execução da marca on line;Requisitos e qualificaçõesEnsino Superior completo;Profissional com experiência comprovada E-Commerce de performance de Beleza;Experiência em times multifuncionais digitais, preferencialmente nos grandes players do mercado; Formação em BI e data driven (Power BI);Profundo entendimento do Full Funnel de vendas além das engrenagens do canal CRM, CTA, Social, etc.Pacote office avançado;Informações adicionaisBenefícios: Assistência MédicaAssistência OdontológicaAuxílio Farmácia Auxílio ÓticaAuxílio CrecheModelo de trabalho: hibridoTransporte FretadoBicicletárioEstacionamentoCesta Básica/Cartão AlimentaçãoRefeitórioConsignadoParticipação nos Lucros ou ResultadosSeguro de Vida",Oportunidades InBetta,vacancy_type_effective,,False,Esteio,Rio Grande do Sul,Brasil,https://inbetta.gupy.io/job/eyJqb2JJZCI6NjUwOTA4OSwic291cmNlIjoiZ3VweV9wb3J0YWwifQ==?jobBoardSource=gupy_portal,True,hybrid,True
6484942,2023-12-26T16:33:46.775Z,Pessoa Analista Dados Sênior ,"Somos aproximadamente 50k Minsaiters no Mundo e mais de 9k Minsaiters no Brasil e estamos presentes nas maiores empresas em todos os setores. Nossa estrutura permite participar de projetos globais e proporciona um ambiente colaborativo que nos certifica em GreatPlacesToWork e planos diferenciados para Jovens Profissionais também reconhecidos pela Employers for Youth. Você atuará no nosso time de Serviços Financeiros em um projeto estratégico, utilizando metodologias ágeis e em um ambiente de inovação.Buscamos profissionais com senso de dono, comprometidos com o sucesso do nosso cliente e com o desenvolvimento da sua carreira dentro da MinsaitVocê será um pilar fundamental nos melhores e maiores projetos de TI do Brasil e em nível global.Venha ser um Minsaiter!Responsabilidades e atribuições💼 Responsabilidades:Responsabilidades:Integrar visualizações de dados impactantes e eficazes. utilizando ferramentas como Power BI e/ ou Tableau, para fornecer insigths significativos aos usuários.Projetar e otimizar Consultas SQL para garantir desempenho e eficiente do banco de dados.Aplicar os conceitos de UX para criar experiências de usuário intuitivas e envolventes.Utilizar as melhores práticas de desenvolvimento e padrões de design para garantir códigos robustos e de alta qualidade.Participar ativamente em revisões de código, promovendo a colaboração e aprimoramento contínuo.Identificar e resolver problemas de forma eficaz, fornecendo suporte técnico às equipes internas e externas.Manter-se atualizado com as tendências de tecnologia, especialmente aquelas relacionadas a Dataviz, UX/UI e .NET.Requisitos e qualificações📚 Requisitos:Experiência prática na criação de visualizações de dados eficazes usando Power BI e/ou Tableau.Proficiência em consultas SQL e otimização de desempenho de banco de dados.Habilidade desenvolvida em UX/UI, com experiência em colaboração efetiva com equipes de design.Capacidade de traduzir requisitos de negócios em soluções técnicas e funcionalidades de UX/UI.Forte habilidade analítica e de resolução de problemas.Experiência em ambientes ágeis de desenvolvimento.Desejável:Certificações relevantes em .NET, Power BI, Tableau ou UX.Familiaridade com metodologias ágeis de desenvolvimento.Experiência em integração de sistemas e APIs.Se você possui a experiência e as habilidades necessárias para se destacar como Analista Dados Sênior, candidate-se! ✨ Aguardamos ansiosamente para conhecer você e discutir como sua expertise pode contribuir para o sucesso de nossa equipe!Informações adicionaisTRABALHE NA MINSAITModelo de contratação CLT.Plano de Saúde subsidiado pela empresa para o titular.Opção de inclusão de dependentes no Plano de Saúde com desconto em folha de pagamento.Assistência Odontológica (opcional).Opção de inclusão de dependentes no Plano de Assistência Odontológica com desconto em folha de pagamento.Vale Refeição ou Vale Alimentação.Vale Transporte (opcional).POP - Programa de Orientação Pessoal que visa oferecer suporte emocional e aconselhamento com orientação confidencial nas áreas psicológica, jurídica, financeira, social e pet sem custo para titular e dependentes legais.Gympass (Acesso a mais de 700 academias em todo o Brasil com planos a partir de R$ 39,90 descontado em folha de pagamento).Opção de inclusão de dependentes no Gympass (até 03 dependentes - pago via cartão de crédito).Parcerias com grandes marcas de consumo.Convênio com o SESC para titular e dependentes.Convênios para descontos com instituições de ensino (graduação e pós-graduação) e escola de idiomas.Seguro de vida em grupo.Nosso compromisso com a diversidade é um elemento-chave da nossa cultura: Igualdade de oportunidades, respeito pelas pessoas e não discriminação são princípios de atuação para todos os profissionais da Minsait. Integramos o Bloomberg Gender-Equality Index (GEI) 2021 em termos de diversidade e igualdade de gênero.Todas as nossas vagas são abertas também para PCDs.",Minsait an Indra Company,vacancy_type_effective,2024-01-26T00:00:00.000Z,False,Osasco,São Paulo,Brasil,https://minsait.gupy.io/job/eyJqb2JJZCI6NjQ4NDk0Miwic291cmNlIjoiZ3VweV9wb3J0YWwifQ==?jobBoardSource=gupy_portal,True,hybrid,True
6458249,2023-12-26T16:30:42.621Z,ANALISTA FINANCEIRO PL,"Conhecendo um pouco mais sobre o grupo Limppano S/A.Somos um time que cuida da limpeza do seu lar gerando bem-estar, no qual combinamos determinação e comprometimento para entregarmos produtos de qualidade.Entendemos que para obter os melhores resultados, precisamos dos melhores profissionais.Estamos à procura de talentos que sejam criativos, inovadores e ousados na busca por conhecimento, que tragam resultados sustentáveis ao Grupo Limppano. Se você tem prazer em contribuir, gosta do que faz, e é focado em resultados essa VAGA é para VOCÊ!Responsabilidades e atribuiçõesSeus desafios diários Contas a pagar/ tesouraria • Acompanhar e validar os saldos dos lançamentos de pagamentos realizados banco x sistema;• Controle e operações de caixa interno;• Negociações de prazos com fornecedores, com base no fluxo operacional;• Conferência e consolidação dos impostos fiscais (agrupa as notas do período por competência);• Realizar os lançamentos de provisões para futuras entradas de pagamentos;• Acompanhar o comportamento e baixa das provisões em relação às realizações do fluxo de caixa, através do relatório de entradas diárias;• Montar e analisar o fluxo de caixa projetado com relação aos pagamentos e recebimentos para curto, médio e longo prazo;• Autorizar os pagamentos diários na ausência da Gerente Financeira em conjunto com a Diretoria Financeira;• Realizar fechamento de câmbio (cotações direto com o banco);• Realizar contato com os bancos, parametrizações das permissões de acesso e atualização de cadastros dos usuários;• Controlar e baixar os adiantamentos solicitados x prestações de contas (contas a pagar);• Controlar os saldos e baixar os relatórios de despesa dos promotores/ vendedores x prestação de contas;• Realizar a montagem da posição de fluxo de caixa diário da a movimentação financeira diária;• Gestão da conciliação bancária, abertura de saldo e cobertura de contas; • Integração dos saldos do financeiro x contabilidade;• Acompanhar e atualizar as informações das provisões e alterações das importações;• Controlar PEFINS e PROTESTOS, acompanhar e solucionar com as áreas;• Controlar, analisar e realizar pagamentos x recebimentos intercompany. Contas a receber / cobrança• Encarregado de acompanhar o processamento das transações do contas a receber, dentro do prazo estipulado, fazer avaliação contínua de políticas atuais e recomendação sobre melhoria de processos;• Dar suporte a tesouraria nas conciliações bancárias dos recebimentos dos clientes;• Gerar relatório dos títulos em aberto e segmentar as cobranças, identificando as ações que devem ser tomadas; • Identificar os problemas classificando os motivos padrões no sistema e registrar no histórico as ocorrências; • Verificação e acompanhamento das pendências de outros setores que impactam na inadimplência (monitoramento/ logística);• Verificação dos clientes DDE, conferência dos canhotos assinados, atualizar as datas de vencimento x site clientes, e reportar as informações à tesouraria para justificativas das variações diárias no fluxo de caixa; • Cobrança de débitos em aberto por e-mail e por telefone, priorizar as cobranças do dia anterior e semanalmente dos demais títulos inadimplentes; • Emitir e enviar segunda via de boletos solicitados os clientes e/ou área comercial Empresa; • Acompanhar, analisar e propor melhorias no controle da inadimplência.Requisitos e qualificaçõesPara você fazer parte da nossa equipe, você precisa ter:• Ensino Superior em Administração, Contabilidade, Economia ou Gestão Financeira.Você será um diferencial se apresentar:• Pacote Office – Principalmente Excel Avançado;• Matemática financeira• Conhecimento com o sistema Sankhya;• Ter capacidade analítica;• Excelente habilidade interpessoal;• Lidar com informações sigilosas de modo confidencial;• Ser organizado e proativo;• Autodesenvolvimento, busca constante de melhorias do processo e planejamento;• Excelentes habilidades de comunicação verbal e escrita;• Ter comprometimento com prazos e qualidade.Informações adicionaisOferecemos ao nosso time:• Salário compatível com o mercado;• Plano de Saúde;• Plano Odontológico;• Refeição no local;• Seguro de vida;• Convênio com faculdades;• Convênio com farmácias;• Vale Alimentação;• Descontos nos nossos produtos em nossa loja online.",Limppano,vacancy_type_effective,,False,Rio de Janeiro,Rio de Janeiro,Brasil,https://grupolimppano.gupy.io/job/eyJqb2JJZCI6NjQ1ODI0OSwic291cmNlIjoiZ3VweV9wb3J0YWwifQ==?jobBoardSource=gupy_portal,True,on-site,True
6285559,2023-12-26T16:30:19.515Z,Analista Agronômico,"Venha fazer parte do nosso time!Se você deseja trabalhar em uma empresa pioneira em Inteligência Agronômica Artificial, líder no mercado agro, criadora incansável de soluções inovadoras e fazer parte de um time que revoluciona a agricultura, chegou o momento!Para acompanhar e fazer parte do crescimento da empresa, estamos à procura de ANALISTA AGRONÔMICO que tenha inovação, criatividade, organização e pro atividade em seu DNA.Confira o perfil abaixo e venha ser um SMARTBREEDER!Responsabilidades e atribuições📌O que você vai fazer no seu dia a dia: ✅Diagnóstico e triagem de demandas oriundas dos clientes;✅Atendimento e suporte técnico às plataformas fornecidas pela Smartbreeder, definição de prioridades nos atendimentos, manutenção das configurações das plataformas, validações de chamados, gerações de agendas de levantamento e recomendações;✅Fornecer suporte agronômico ao cliente, relativo às plataformas comercializadas pela Smartbreeder, condução das atividades analíticas junto ao Consultor Técnico Agronômico, validação da correção de chamados de integração de dados, bugs e melhorias.Requisitos e qualificações⚠️Superior em: Engenharia Agronômica/Agronomia📌 Seria legal se você tivesse conhecimento em:✅Conhecimento em Pacote Office;✅Boa comunicação;✅Organização.Informações adicionais📌 O que oferecemos?✅ Auxílio mobilidade no cartão Caju;✅ Auxílio Alimentação no cartão Caju;✅ Voucher Aniversário;✅ Lanche da tarde;✅ Gympass;✅ Seguro de vida;✅ Seguro Saúde Unimed Nacional sem coparticipação;✅ Programa de capacitação em parceria com a Alura;✅ Parceiras com instituição de ensino, hamburguerias, restaurantes, óticas e farmácias.",SMARTBREEDER - trabalhe conosco,vacancy_type_effective,,False,Piracicaba,São Paulo,Brasil,https://sejaumsmartbreeder.gupy.io/job/eyJqb2JJZCI6NjI4NTU1OSwic291cmNlIjoiZ3VweV9wb3J0YWwifQ==?jobBoardSource=gupy_portal,True,on-site,True
6209982,2023-12-26T16:24:32.379Z,ANALISTA SEGURANCA PL,"Somos a maior multinacional brasileira e estamos entre as 100 maiores empresas de TI do mundo.Estamos presentes em 41 países com +30k colaboradores. A Stefanini tem como principal objetivo auxiliar os clientes a encontrar, por meio de soluções personalizadas, a maneira ideal para alcançar seus desafios, impulsionando a inovação digital.E queremos mais!Requisitos e qualificaçõesMonitoramento de Seguranca:Monitorar os sistemas e redes em busca de atividades suspeitas ou indicadores de comprometimento.Analisar alertas de seguranca para determinar a natureza e a gravidade dos incidentes.Examinar logs de sistemas e redes para identificar padroes de comportamento anomalo.Desenvolver e executar planos de resposta a incidentes para conter, mitigar e remediar violacoes de seguranca.Identificar e analisar malwares para entender suas funcionalidades e formas de mitigacao.Trabalhar com ferramentas de seguranca, como SIEM (Security Information and Event Management), IDS/IPS (Intrusion Detection/Prevention Systems), Firewalls,SIEMA-s, entre outras.Preparar relatorios detalhados sobre incidentes, incluindo analise de raiz e recomendacoes de mitigacao.Participar de iniciativas para melhorar a postura de seguranca, como configuracoes seguras, atualizacoes e treinamentos.Manter-se atualizado sobre as ameacas atuais e as taticas utilizadas pelos adversarios.Trabalhar em estreita colaboracao com equipes de TI, desenvolvimento e compliance para alinhar as praticas de seguranca.Requisitos:Experiencia Previa:Conhecimento Tecnico:Proficiencia em sistemas operacionais (Windows, Linux), protocolos de rede, firewalls, IDS/IPS, SIEM QRADAR E Sentinel.Certificacoes:Certificacoes relevantes, como CompTIA Security+, CEH (Certified Ethical Hacker), GSEC (GIAC Security Essentials), sao uma vantagem.Habilidades de Programacao e Scripting:Conhecimento em Python, PowerShell ou outras linguagens e uma vantagem.Compreensao de Vulnerabilidades:Conhecimento de vulnerabilidades comuns e metodos de exploracao.Comunicacao Eficaz:Boas habilidades de comunicacao escrita e verbal sao essenciais para a documentacao de incidentes e a colaboracao com outras equipes.Gestao de Prioridades:Capacidade de gerenciar e priorizar varias tarefas de forma eficaz, especialmente em cenarios de incidentes criticos.Mentalidade Proativa:Ser proativo na identificacao e mitigacao de riscos de seguranca antes que se tornem incidentes.Trabalho em Equipe:Capacidade de trabalhar efetivamente em equipe e colaborar com membros de diferentes departamentos.Superior CompletoInformações adicionaisO que te oferecemos:🍛 Vale Alimentação ou Vale Refeição;👨🏼‍🎓 Desconto em cursos, universidades e instituições de idiomas; 📚 Academia Stefanini - plataforma com cursos online, gratuitos, atualizados e com certificado; 🗣 Mentoring;🏫 Auxílio Creche; 💉 Clube de vantagens para consultas e exames;🏥 Assistência Médica;🦷Assistência Odontológica; 💰 Clube de vantagens e descontos nos melhores estabelecimentos;👂🏾 Atendimento psicológico online ao colaborador e seus dependentes;🛫 Clube de viagens;🐶 Convênio para Pet;e muito mais...",Stefanini Group,vacancy_type_effective,,False,São Paulo,São Paulo,Brasil,https://stefanini.gupy.io/job/eyJqb2JJZCI6NjIwOTk4Miwic291cmNlIjoiZ3VweV9wb3J0YWwifQ==?jobBoardSource=gupy_portal,True,hybrid,True
6419135,2023-12-26T16:23:14.938Z,Analista de Suporte III | CORPORATIVO,"Que tal trabalhar como Analista de Suporte em uma das maiores administradoras de hotel do Brasil? Responsabilidades e atribuiçõesResponsabilidades:  Controle de chamados. Suporte ao usuário. Solucionar problemas do usuário.Instalação de Windows, pacote office, impressoras Criação de e-mails. Sólidos conhecimentos de hardwareSólidos conhecimentos em Windows Cliente e Server Sólidos conhecimentos de Sharepoint e Microsoft 365 Sólidos conhecimentos de Redes Lan, Wan e VPN Experiência em Windows Server (AD, DHCP, DNS, GPO) Conhecimento em Telecomunicações (PABX, VOIP, Telefones SIP) Experiência prévia em Infraestrutura (Servidores, Storage,firewall,switches (HP, CISCO) Access points Ubiquiti.Requisitos e qualificaçõesRequisitos e Qualificações:• Ensino Superior• Pacote Office• Redes de computadoresInformações adicionaisBenefícios:  • Convênio Médico• Convênio Odontológico• Seguro de Vida• Vale Transporte• Vale Alimentação ou Vale Refeição",Atlantica Hospitality International,vacancy_type_effective,,False,Barueri,São Paulo,Brasil,https://vagasahi.gupy.io/job/eyJqb2JJZCI6NjQxOTEzNSwic291cmNlIjoiZ3VweV9wb3J0YWwifQ==?jobBoardSource=gupy_portal,False,on-site,True
6508892,2023-12-26T16:21:05.176Z,Analista de Custos Sr,"Está sob as responsabilidades de um Analista de Custos realizar trabalhos de análise dos custos dos produtos, verificando a incidência ou apropriando os valores de mão-de-obra, matéria prima, fretes, impostos etc., realizações de projeções como Budget, Forecast e acompanhamento dos custos reais vs projetado. Vem fazer parte do nosso Time Softys Brasil !Responsabilidades e atribuiçõesRealizar semanalmente projeção dos custos diretos e custos fixos, análise e elaboração do orçamento da empresa apresentando e justificando as variações encontradas para correções e aplicações para o próximo período;Coletar informações para a composição do custo dos produtos analisando os valores de compra das matérias-primas, incidência de mão-de-obra, despesas de frete, impostos etc. para sugerir alterações de preço ou indicar a necessidade de rever fornecedores, condições de compra etc. Apropria despesas diversas para apuração dos custos baseando-se no Plano de Contas, estrutura dos custos ou orientações do superior.Realizar comparações entre os valores reais apurados no processo produtivo e os valores orçados. Sugere alterações na eventualidade de divergências para a fixação de novos preços ou cobra providências das áreas envolvidas para a manutenção dos padrões estabelecidos (compras, importação, contratação de fretes, custo de mão-de-obra e outros).Mensalmente prepara relatórios gerenciais informando o consumo de matéria-prima utilizada no período, custos fixos, custos variáveis, para apuração dos custos dos itens produzidos bem como elaborar demonstrativos gerenciais para apuração e análise dos gastos fixos, por centro de custo;Eventualmente faz simulações de preços de novos produtos conforme a composição dos custos dos mesmos. Além de fazer apropriações de despesas, detalhar o valor da composição do produto, estimar o custo de mão-de-obra, calcular as margens, etc. e informar às áreas envolvidas para apreciação e tomada de decisões sobre a viabilidade de sua produção e comercialização;Prepara e/ou sugere a redação de procedimentos que normatizem os processos de custeio e apuração de custos, estoques e inventário. Requisitos e qualificaçõesCurso superior completo (Ciências contábeis, Engenharia, Administração);Pacote office avançado;Conhecimento em SAP;Desejável conhecimento em Power B.I;Espanhol no mínimo básico;Conhecimento das normas contábeis (BR GAAP e IFRS);Comunicação objetiva, clara e concisa.Informações adicionaisBenefícios:Horário de Trabalho: seg. a sex. 08:00 ás 17:00 (Hibrido sendo 3 dias no escritório e 2 home office); PPR: Programa de Participação nos Resultados, conforme acordo coletivo anual;Refeitório no Local; Vale Alimentação;Seguro de Vida;Assistência médica;Auxílio Creche;Auxílio por Filho Excepcional;Licença Maternidade;Licença Paternidade;Assistência odontológica;Convênio Farmácia;Kit Escolar para filhos e dependentes que estejam cursando de 1ª série a 9ª série;Dia Feliz, no seu aniversário você ganha meio período de folga remunerada;Dias Personales: Você terá direito há 2 dias de folga no ano, sendo 1 dia no primeiro semestre e 1 dia no segundo semestre, sem descontos para resolver coisas que o impossibilitaria de resolver em um dia de trabalho;Loja Softys: compra de produtos com 30% de desconto em nossa loja on-line;Kit Natalino;Brinquedo para os filhos(as) no final do Ano;Programa de cuidado social para nossos colaboradores(as) e seus dependentes: Consultoria especializada formada por profissionais focados em serviço social, com assistentes sociais que dão suporte aos funcionários e dependentes em diversas situações. O programa oferece alternativas e encaminhamento para problemas de ordem social e pessoal como por exemplo orientação jurídica, saúde financeira e despesas pessoais, atendimento psicológico etc.",Softys Brasil,vacancy_type_effective,2024-01-01T00:00:00.000Z,False,Caieiras,São Paulo,Brasil,https://querosersoftys.gupy.io/job/eyJqb2JJZCI6NjUwODg5Miwic291cmNlIjoiZ3VweV9wb3J0YWwifQ==?jobBoardSource=gupy_portal,True,hybrid,True
6506728,2023-12-26T16:02:31.609Z,Analista de Risco ,"Já pensou em fazer parte de uma empresa que inova para movimentar o mundo?Se você está em busca de crescimento, aprendizado, gosta de desafios e é comprometido..CHEGOU A SUA OPORTUNIDADE DE FAZER PARTE DO NOSSO TIME!!🚀 Topa vir com a gente nessa jornada? Então vamos te explicar mais!🧡 Quem somos?Somos voltados para soluções que facilitam a vida dos clientes e motoristas. Gerenciamos operações conectando digitalmente todo ecossistema e simplificando a forma de operar. Comprometidos com a alta performance, inovamos processos por meio de tecnologias que reduzem custos e aumentam a eficiência.O que você encontra aqui:Liberdade para expor ideias;Integração entre os times;Desenvolvimento profissional;Compromisso com a diversidade;Um ambiente leve e inovador.Responsabilidades e atribuiçõesSeu desafio será:Irá apoiar o cliente quanto aos processos de GR, inclusão de informação e apoio a central de rastreamentoRealizar tratativas para eventos de sinistro de natureza Perdas, Danos eOcorrências;Realizar o atendimento de ligações de clientes, parceiros e fornecedorespara esclarecimentos e orientações relacionadas às viagens rastreadas e/ou monitoradas;Manuseio dos sistemas internos (SGR, Rastrear 4.0, SIL)Requisitos e qualificaçõesRequisitos e qualificações:Ensino médio completo;Conhecimento básico de informática;Desejável conhecimento ou vivência em empresas de transporte ou logística;Informações adicionaisO que oferecemos:Um ambiente dinâmico, inovador e colaborativo, com foco em resultados e integração entre os times e muita abertura para novas ideias;🚌 Vale transporte;🍔 Vale Alimentação/Refeição no cartão Ticket;🏥 Plano de Saúde com cobertura nacional;😁 Plano Odontológico;💪 Gympass, fique em forma e cheio de energia com acesso a academias e atividades físicas;🧘 Zenklub, cuide do seu bem-estar mental com sessões de terapia online;🌟 Programa de indicação premiada;💊 Convênio com farmácias;🌈 Seguro de vida;📚 Parceria com instituições de ensino e idiomas;📝 Contratação CLT;🏢 Modelo de trabalho presencial.E aí? Deu match? 🚀Junte-se à nossa equipe.Estamos aqui para cuidar de você enquanto trabalhamos juntos para alcançar grandes conquistas 💼✨Inscreva-se e aguarde os próximos passos.",#VEMPRAOPEN,vacancy_type_effective,,False,Campinas,São Paulo,Brasil,https://opentechgr.gupy.io/job/eyJqb2JJZCI6NjUwNjcyOCwic291cmNlIjoiZ3VweV9wb3J0YWwifQ==?jobBoardSource=gupy_portal,True,on-site,True
