job_id,published_date,title,description,career_page_name,type,application_deadline,is_remote_work,city,state,country,job_url,disabilities,workplace_type,submitted
6263082,2023-12-11T11:58:43.162Z,Analista de Atendimento a Clientes Pleno - Ribeirão Preto,"Execução de atividades relacionadas ao cadastro de pedidos e de novos clientes, execução de atividades para realizar a entrega do pedido, acompnhamento do faturamento do pedido realizando as interações necessárias para que a emissão da nota fiscal e entrega do pedido acontençam, calendaraização e distribuição do pedido, acompanhamento do pedido desde a entrada até a entrega, acompanhamento do estoque dos produtos para alinhar com a calendarização dos pedidos. (Input do pedido no ERPConferência do pedidoLiberação comercial Calendarização – Revisão, ajustes e confirmaçãoStatus de entregaReuniõesTreinamentosAnalise e gestão da carteiraFaturamentoOrdem de carregamentoEnvio de documentos ao clienteResponsabilidades e atribuiçõesCadastro de pedidos nos ERPs, Conferência do pedido, Liberação Comercial, Liberação do Crédito, Faturamento, Ordem de Carregamento, Envio de documentação dos clientes, Calendarização da entrega do pedido - revisão, ajustes e confirmação. Acompanhamento status da entrega, ser um multiplicador de conhecimento aplicando treinamento para o time comercial. Análise da Carteira de clientes, gestão de contas, cadastro de clientes e inventário.Requisitos e qualificaçõesSuperior Completo – preferencialmente Administração, Economia e Engenharia (Engenharia Agrônomica será um diferencial);Fundamental Conhecimento em sistemas ERP preferencialmente SAP;Experiencia com Gestão de Pedidos e Gestão de Carteira;Experiencia com Processos Financeiros e de Faturamento Experiência no relacionamento com áreas de apoio e de negócios. Soft skills: foco do cliente, saber trabalhar em equipe, estabelecer parcerias e ter bom relacionamento interpessoal.Informações adicionaisMinimo 2 anos a posição, ter conhecimento dos produtos do agro, conhecimento em pacote office avançado, conhecimento em ERP.Disponibilidade para viagens",Confidencial,vacancy_type_effective,,False,Rio Verde,Goiás,Brasil,https://vagasconfidenciais2022.gupy.io/job/eyJqb2JJZCI6NjI2MzA4Miwic291cmNlIjoiZ3VweV9wb3J0YWwifQ==?jobBoardSource=gupy_portal,True,on-site,True
6176689,2023-12-11T11:58:35.957Z,Pessoa Analista de Laboratório de Ecotoxicologia - Charqueada,"Reconhecemos que o nosso pessoal é o nosso diferencial e os diversos talentos que trazemos para nossa força de trabalho global estão diretamente relacionados ao nosso sucesso!Diversidade é um tema de muita relevância para o nosso negócio e a sociedade como um todo, valorizamos e respeitamos as diferenças, pois entendemos que ela estimula a inovação, permitindo soluções e uma comunicação assertiva para os mais diversos públicos. Aqui todes são bem-vindes, queremos ser uma empresa cada vez mais plural e diversa! O nosso objetivo é formar o melhor time de encantadores de pessoas sem distinção de nacionalidade, cor, gênero, religião, deficiência e outros.﻿Por isso, aqui você vai encontrar pessoas de diferentes lugares, histórias, mas que acreditam na importância da união e no poder do apoio e do acolhimento.Responsabilidades e atribuiçõesBUSCAMOS ALGUÉM QUE JÁ TENHA EXPERIÊNCIA COM ANÁLISES EM ECOTOXICOLOGIA- Realizar a rotina operacional da equipe técnica;todo o processo de análise e execução dos estudos sob sua responsabilidadeexecutar testes ecotoxicológicosavaliação e manutenção da saúde dos organismosdiscussão dos resultados- Realizar entregas e resultados e implementar melhorias de processos;- Participar do processo de implementação de novos métodos;- Participar de Auditorias Internas e Externas;INMETRO: BPLClientes- Dar os treinamentos necessários à equipe;Requisitos e qualificações- Conhecimento em testes de ecotoxicidade com diferentes organismos;- Graduação em Biologia, biotecnologia ou áreas correlatas;- Boa comunicação;- Organização;- Proatividade;- Adaptabilidade.Informações adicionaisHORÁRIO: Segunda a sexta das 07:00 as 16:48 (100% presencial) LOCAL: UNIDADE - CHARQUEADA - SÃO PAULO O QUE TE OFERECEMOS: 🍽 Vale Refeição / Alimentação; 🔃 Vale transporte; 🚑 Assistência Médica / Seguro de Vida; 🦷 Assistência Odontológica; 🏋️ Auxilio Academia e Bem estar;  💊 Convênio Farmácia; 📚 Parcerias e convênios com faculdades e escolas de idiomas;",ALS LIFE SCIENCES,vacancy_type_effective,,False,Charqueada,São Paulo,Brasil,https://alslifesciences.gupy.io/job/eyJqb2JJZCI6NjE3NjY4OSwic291cmNlIjoiZ3VweV9wb3J0YWwifQ==?jobBoardSource=gupy_portal,False,on-site,True
6263058,2023-12-11T11:58:00.189Z,Analista de Marketing ,"Que tal fazer parte de um importante capítulo dentro da história da 6ª empresa mais longeva do Brasil?Pois é... a Karsten S/A é uma empresa com mais de 140 anos, e está transformando-se todos os dias.Com um misto de gostar e cuidar de gente, aconchego para você e sua família, tecnologia e inovação, venha fazer parte do time Karsten 🚀.Responsabilidades e atribuições​Planejamento de mídias das nossas lojas;Calendário de campanhas: semanal e mensal – alinhamento semanal com marketing e e-commerce​;Análise, contratação e acompanhamento das mídias e ações​;Desenvolvimento de briefing para criação de artes e campanhas​;Acompanhamento e planejamento de orçamento de marketing varejo​;Elaboração de eventos, ações internas em loja como live, parcerias voltadas para lojas​;Criação de briefing e aprovações para artes e conteúdos​;Planejamento e controle de mídias digitais junto com planejamento de performance;Gestão das mídias sociais (Instagram);Gestão google meu negócio;Relacionamento com fornecedores e veículos de comunicação​;eDesenvolvimento de briefing para criação de artes e campanhas.Requisitos e qualificaçõesGraduação completa em Marketing ou Publicidade e Propaganda; Pós Graduação completa ou em curso será um diferencial; e Conhecimento em pacote office avançado.Informações adicionaisPlano de Saúde Unimed – Pra cuidar de você e sua família em qualquer momento.Assistência Médica e Odontológica na Empresa – Aqui gostamos de gente e cuidamos de gente ❤Seguro de Vida - Não se preocupe, mas temos também hehe.Vale Transporte – Uma forma de te auxiliar no caminho. Topic – Idas e Vindas com segurança para a Karsten.Restaurante na Empresa – Comida caseira? Temos também.Mercadinho da Confiança - Fome apertou, no mercadinho passou 😎Convênio Farmácia – Se cuidar é preciso sempre.Parceiros Descontos – Para você aproveitar várias coisas da vida.Associação Desportiva – Corpo e mente em exercício.Auxílio Educação – Auxiliando na sua jornada de aprendizagem.PLR - Participação de Lucros e Resultados – Construímos e comemoramos nossos resultados juntos.",Karsten,vacancy_type_effective,,False,Blumenau,Santa Catarina,Brasil,https://karsten.gupy.io/job/eyJqb2JJZCI6NjI2MzA1OCwic291cmNlIjoiZ3VweV9wb3J0YWwifQ==?jobBoardSource=gupy_portal,True,on-site,True
6263034,2023-12-11T11:54:08.999Z,Analista da Garantia - Operações													,"A área de Operações de Garantia do Produto realiza ações que asseguram os processos de pagamentos que envolvem casos da garantia de um produto. Gerencia as cobranças e débitos efetuados em garantia e da performance dos Concessionários.O Analista será responsável em realizar estudos técnicos e financeiros que asseguram o controle de pagamentos dos processos da Garantia do Produto, e analisar tecnicamente falhas de produto que possam impactar nos custos dos reparos e trocas de peças em Garantia.Responsabilidades e atribuiçõesOrganizar reuniões técnicas com informações estratégicas das ações relacionadas as falhas de produto com impacto nos custos de Garantia.Realiza análise junto as áreas técnicas referente informativos de peças a serem substituídas em um determinado reparo, tendo como base de consulta os procedimentos descritos no sistema Volkswagen.Analisar e controlar as cobranças de pagamentos de reparos (peças e mão de obra) efetuadas em Garantia, e emite relatórios analíticos de controle gerencial.Conduzir os processos técnicos da Garantia dentro do Pós-Vendas e em outras áreas corporativas como: Controller, Finanças, Qualidade e Engenharia do Produto.Requisitos e qualificaçõesCurso Superior Completo em: Administração ou áreas correlatas;Conhecimento do Pacote Office, Excel Avançado.Conhecimento em mecânica e peças automotivas será um diferencial.Experiência mínima de 5 anos comprovada em atividades relacionadas aos processos de Garantia.CNH - BTer linguagem técnica e comercial para atendimento aos concessionários em casos de dúvidas dos processos da Garantia.Ser proativo, empático, habilidades para trabalho em equipe e bom relacionamento interpessoal, orientado à resultado e com senso de urgência.Informações adicionaisNome do Cargo: Analista de GarantiaLocal de trabalho: São Bernardo do Campo/SPModelo de trabalho híbrido flexível (2x na semana no escritório e 3x na semana em home office)Plataforma de treinamentos online gratuitoPrograma de Saúde e Bem-estarBenefícios:Compra de veículo com descontoGympassEstacionamento no local - gratuitoÔnibus fretadoPPR anualRefeitório no localPlano de SaúdePrevidência PrivadaPlano PecúlioZenklub - plataforma de saúde mental e bem-estar emocional",Volkswagen do Brasil,vacancy_type_effective,,False,São Bernardo do Campo,São Paulo,Brasil,https://vwbrasil.gupy.io/job/eyJqb2JJZCI6NjI2MzAzNCwic291cmNlIjoiZ3VweV9wb3J0YWwifQ==?jobBoardSource=gupy_portal,False,hybrid,True
6263001,2023-12-11T11:52:33.741Z,Analista de compras,"Realiza atividades administrativas visando auxílio aos vendedores e gerência, imprime relatórios, verifica não conformidades do setor, solicita recolhimento de produtos vencidos e acompanha o estoque físico.Responsabilidades e atribuiçõesRealiza atividades administrativas visando auxílio aos vendedores e gerência, imprime relatórios, verifica não conformidades do setor, solicita recolhimento de produtos vencidos e acompanha o estoque físico;Imprimir relatórios gerenciais acerca de faturamento do período, positivação, Mark up, rentabilidade, toneladas, fornecedores e produtos para encaminhar aos supervisores e gerência;Emitir relatórios relacionados a média de itens, volume de vendas, inadimplência, média ponderada, positivação, cobertura de objetivo e devolução de mercadoria, alimentando e relacionando em planilhas as informações geradas com períodos anteriores;Cadastrar produtos de grupos de fornecedores novos no sistema, como também, realizar a manutenção dos cadastros;Analisar o estoque físico contido no sistema, comparando ao seu giro a data de validade para alertar aos supervisores e planejar ações de vendas;Solicitar recolhimento de produtos vencidos nos clientes, a partir de um relatório enviado por email ou fax para a troca imediata;Realizar análise dos produtos recolhidos, definindo o valor de ressarcimento do cliente a partir do valor estipulado para venda à vista dos mesmos;Preencher planilhas de ressarcimento, especificando os descontos e as bonificações demonstrados pelo sistema para enviar aos fornecedores, visando que os mesmos reembolsem a empresa;Verificar os emails enviados pelos fornecedores comunicando sobre os pagamentos referentes ao reembolso dos descontos e bonificações;Acessar aos portais dos fornecedores para enviar e receber informações acerca de custos, estoque, positivação e produtos para compra;Requisitos e qualificaçõesEnsino superior completo ou cursando Administração, Comércio Exterior, Economia ou Ciências Contábeis;Conhecimento Avançado em Excel, Word, Power Point e Sistema Microsiga;Residir em Arapiraca/AL ou proximidades.Informações adicionaisAssistência Médica;Assistência Odontológica;Seguro de Vida;Incentivo Educação.",Asa Branca Distribuidora,vacancy_type_effective,,False,Arapiraca,Alagoas,Brasil,https://asabranca.gupy.io/job/eyJqb2JJZCI6NjI2MzAwMSwic291cmNlIjoiZ3VweV9wb3J0YWwifQ==?jobBoardSource=gupy_portal,True,on-site,True
6184501,2023-12-11T11:45:11.809Z,ANALISTA DE ADMINISTRAÇÃO DE PESSOAL PL (TEMPO DETERMINADO ATÉ SETEMBRO),"JUNTE-SE À CSN!A Companhia Siderúrgica Nacional busca atrair e desenvolver profissionais que se identifiquem com a sua cultura, valorizando sempre a diversidade. Venha você também fazer parte da história do maior complexo siderúrgico da América Latina, um grupo que tem como essência “fazer bem, fazer mais e fazer para sempre”.Responsabilidades e atribuiçõesPara atuar no nosso time, suas principais responsabilidades serão: • Execução do processo de admissão digital (operacional através da ferramenta Único RH, para recebimento de documentação e integração para o SAP); • Emissão de carta de desligamento e envio para assinatura, com agendamento de exame demissional e homologação. Realização de baixa no sistema SAP. Emissão de Seguro Desemprego; • Acompanhamento de férias agendadas pelos gestores, garantindo o cumprimento da legislação (compulsórias e regras); • Manutenção cadastral dos colaboradores (dados pessoais, dependentes, documentos, formação escolar, endereço, benefícios conforme elegibilidade para movimentações e transferências); • Realização de auditorias cadastrais para cumprimento dos controles SOx. • Atuar como Key user SAP HCM, pela frente de PA - Cadastro, realizando abertura de chamados para correções de erros e a realização de testes integrados para implantação de novas unidades e melhorias sistêmicas.Requisitos e qualificaçõesAdministração de Empresas; Ciências Econômicas; Ciências Contábeis; Recursos Humanos e áreas afins.Pacote Office avançado (Excel, Word, Power Point);Conhecimento legislação trabalhista.Você se destaca se tiver: Conhecimento sistema SAP/HCM e SAP/ERP;Experiência como keyuser HCM, pela frente de Cadastro - PA.Experiência em CSC - Centro de Serviço Compartilhado. 04753-080Informações adicionaisNossos benefícios são:Assistência médica;Assistência odontológica;Vale refeição;Vale alimentação;Vale transporte;Previdência privada com participação da empresa no mesmo percentual definido pelo colaborador, podendo variar entre 3% e 6%;Bonificação de férias de 70% (1/3 conforme legislação + 1/3);Total Pass;Remuneração Variável Anual: Condicionada à satisfação das metas da empresa e a depender da implementação do Programa de Remuneração Variável à época do respectivo exercício.Benefícios vigentes em Julho/23, com regras e especificações estabelecidas em Acordo Coletivo, Convenção Coletiva, Acordo de PPR e/ou Política/Diretriz de RH, podendo sofrer alterações.",CSN - Companhia Siderúrgica Nacional,vacancy_type_effective,,False,São Paulo,São Paulo,Brasil,https://csn.gupy.io/job/eyJqb2JJZCI6NjE4NDUwMSwic291cmNlIjoiZ3VweV9wb3J0YWwifQ==?jobBoardSource=gupy_portal,False,on-site,True
6041633,2023-12-11T11:32:23.324Z,PESSOA ANALISTA ADMINISTRATIVO PL ,"Enxergar o outro como parte da nossa família é um dos valores da Bauducco. Por isso, aqui você vai encontrar pessoas de diferentes lugares, histórias, mas que acreditam na importância da união de um time e no poder do apoio e do acolhimento, que trabalham com paixão. Aqui, valorizamos e investimos nas relações humanas, proporcionando um ambiente participativo, diverso, integrado e comprometido. Queremos que você seja a melhor versão de si e se sinta bem onde estiver. O que você vai encontrar na Bauducco é gente que gosta do que faz e inquieta para trilhar uma carreira de sucesso, crescendo junto com a empresa.  Você será parte importante da nossa equipe  por auxiliar nas atividades diárias da área Logística da Casa Bauducco. Se essa vaga é a sua cara, você também é apaixonado pelo que faz, venha conhecer o desafio que a Bauducco está te oferecendo!Responsabilidades e atribuiçõesResponsável por auxiliar nas atividades diárias da área Logística da Casa Bauducco, pelo cumprimento das normas, procedimentos internos e instruções operacionais em relação às questões de ambiente, saúde e segurança do trabalho.Um dia típico inclui: - Resolver ocorrências no sistema de abertura de chamado Soluto;- Preparar documentação de Faturamento para Terceiros e Pandurata - WFS;- Realizar follow-up das entregas;- Intermediar relação entre Operador Logístico, CAF e Franqueado;- Confeccionar Relatório de Performance Operacional de Frete;- Monitorar e prestar suporte na roteirização;- Acompanhar toda rotina de faturamento.Requisitos e qualificaçõesO que você precisa ter?- Curso superior em andamento preferencialmente em Administração de Empresas, Logística ou áreas - 1 ano de experiência na área de logística;- Conhecimento no Pacote Office, principalmente Excel;- Boa comunicação com outras áreas.Informações adicionaisTraduzimos nosso Jeito de Fazer em 10 essências, são elas:  ·        Adaptabilidade: É saber contornar situações inesperadas e conviver com as diferenças, buscando sempre um melhor caminho.  ·        Protagonismo: Ser responsável pela evolução da sua carreira. Executar suas atividades com autonomia, superando obstáculos e prevendo situações adversas.  ·        Inspiração: É capaz de contagiar e motivar as pessoas a se comprometerem e darem o melhor de si. Equipes mais colaborativas e alinhadas aos valores e princípios da empresa, geram valores sustentáveis.  ·        Colaboração: Compartilhar informações e conhecimentos é o que nos une e o que nos torna cada dia mais fortes. É tratar cada um de nós com respeito e transparência. ·        Compromisso: Somos capazes de assumir responsabilidades sobre o impacto das nossas atitudes para o resultado da empresa e da sociedade. Sucesso responsável é quando está atrelado ao comprometimento, transparência, responsabilidades e protagonismo nas tarefas.  ·        Agilidade: Já organizou o seu tempo hoje? Capacidade de responder rápido a forças externas, aproveitar melhor as oportunidades e manter o mesmo padrão de entrega, custo e qualidade requeridos por seus clientes (internos e externos).   ·        Foco: Saber priorizar é fundamental. Dando foco ao que é realmente importante ao negócio, otimizando recursos e conseguindo de forma mais estratégica, alcançar nossos resultados.  ·        Inclusão e Diversidade: Acolher todas as pessoas nas suas diferenças e multiplicidades culturais, sociais, gênero, crenças e raças.   ·        Inovação: Ser inquieto e estar antenado com tudo o que acontece no mundo. Propor novas ideias e abordagens diferentes, frente aos desafios do negócio.  ·        Foco no consumidor: Trabalhar com paixão, com vontade de fazer o melhor para a empresa e superar as expectativas do consumidor.   Se identificou? #VEMPRABAUDUCCO  “A Bauducco não discrimina por motivos de raça, religião, cor, sexo, idade, deficiência não incapacitante para a função, nacionalidade, orientação sexual, identidade ou expressão de gênero, ou por nenhum outro motivo proibido pela legislação local. Essa oportunidade é extensiva a todas as pessoas com deficiência. Solicitamos que seja descrito no currículo o tipo de deficiência, bem como se requer algum recurso especial para desenvolver seu trabalho”. ",Bauducco,vacancy_type_effective,,False,Rio Largo,Alagoas,Brasil,https://bauducco.gupy.io/job/eyJqb2JJZCI6NjA0MTYzMywic291cmNlIjoiZ3VweV9wb3J0YWwifQ==?jobBoardSource=gupy_portal,True,on-site,True
6227170,2023-12-11T11:29:28.523Z,Analista de Expansão | Unicred Porto Alegre - POA/RS ,"Atualize seus dados no cadastro como contato telefônico, e-mail, escolaridade, endereço e experiências profissionais. Um cadastro completo não apenas nos permite conhecê-lo melhor, mas também nos ajuda a entender suas habilidades, experiências e aspirações de maneira mais detalhada, aumentando suas chances no processo . Boa sorte! Na Unicred Porto Alegre, acreditamos na força da Economia colaborativa, em pessoas apaixonadas pelo que fazem e como fazem, e que tem como propósito o desenvolvimento sustentável, projetos economicamente viáveis, ambientalmente corretos e socialmente justos.A Unicred Porto Alegre tem o compromisso de um ambiente de trabalho psicologicamente seguro, diverso e inclusivo. Valorizamos a Diversidade e estamos comprometidos com a promoção da equidade no tratamento dos nossos times.Nos orgulhamos em oferecer oportunidades iguais ao contratar pessoas qualificadas, independentemente de gênero, raça, orientação sexual, religião, entre outros.Se você é essa pessoa, venha fazer parte do nosso sistema Cooperativista, venha fazer parte do time Unicred Porto Alegre.OBS.: se você já faz parte do nosso sistema, esta oportunidade também é para você, converse com seu gestor e venha.💚🌲🌈Responsabilidades e atribuiçõesSe você possui a vontade de fazer parte do nosso sistema, possui pós-graduação, certificação financeira ativa e possui experiência na área backoffice, esta é a sua oportunidade de se cadastrar no nosso processo seletivo de Analista de Expansão.Nesta oportunidade, você vai encontrar alguns dos seguintes desafios: 1. Monitorar o cumprimento de normas e processos de prevenção à fraude e lavagem de dinheiro.2. Assessorar a coordenação da área realizando controles de atingimento de metas individuais e da equipe, desenvolvendo análises, relatórios e controles para avaliação do trabalho da equipe e planejamento de ações futuras.;3. Estabelecer e aprimorar o relacionamento com áreas correlatas que interagem com a equipe da expansão, tais como, áreas administrativas e de apoio da Cooperativa e suas agências, Central e UBR;4. Prover insumos para colaborar com o desenvolvimento e revisão das estratégias da área de Expansão, através da análise do orçamento, previsões, e definições de prioridades, visando o cumprimento dos objetivos desenhados para esta área em relação à Cooperativa.Requisitos e qualificaçõesRequisitos:Graduação Completa, Pós Graduação em andamento;Experiência em Instituição Financeira;Grafodocumentoscopia;Possuir certificação, ativa, CPA-10.Diferencial:CPA 20Pós Graduação CompletaExperiência em Instituição Financeira Cooperativa.Premissas exclusivas para colaboradores da Unicred Central Geração:O colaborador(a) sistema Unicred deverá possuir no mínimo 1 ano de admissão e possuir perfil mínimo necessário para a vaga em questão (requisitos). Após recebimento das inscrições, a Gestão de Pessoas da Unicred Central Geração conduzirá o processo internamente e encaminhará as informações necessárias.Informe seu gestor imediato sobre seu interesse neste processo.  Prazo para inscrição interna: 18/12/2023 Informações adicionaisAmplo pacote de benefícios:Vale Refeição;Vale Alimentação;Vale Natalino;Seguro de Vida;Vale Cultura;Convênio Rede Panvel – clube de descontos;Cartão farmácia;Gratificação semestral (14º e 15º);Assistência Médica - Unimed|Unimax;Odontológica – Uniodonto;Auxílio Educação;Auxílio Creche;Previdência (Precaver);Auxílio Dress Code;Auxílio Bem-estar;Folga de aniversário;Licença PaternidadePossibilidade e benefício de ser Cooperado;Horário: Seg à sex 8h30-17h30Local de trabalho: Avenida Venâncio Aires, 1049",UNICRED CENTRAL GERAÇÃO,vacancy_type_effective,,False,Porto Alegre,Rio Grande do Sul,Brasil,https://unicred.gupy.io/job/eyJqb2JJZCI6NjIyNzE3MCwic291cmNlIjoiZ3VweV9wb3J0YWwifQ==?jobBoardSource=gupy_portal,True,on-site,True
6208160,2023-12-11T11:28:17.888Z,ANALISTA SUPORTE SR,"Somos a maior multinacional brasileira e estamos entre as 100 maiores empresas de TI do mundo.Estamos presentes em 41 países com +30k colaboradores. A Stefanini tem como principal objetivo auxiliar os clientes a encontrar, por meio de soluções personalizadas, a maneira ideal para alcançar seus desafios, impulsionando a inovação digital.E queremos mais!Responsabilidades e atribuiçõesAtendimento ao usuário, Field ServiceRequisitos e qualificaçõesConhecimento em office 365Manutenção de impressorasManutenção em hardwareConhecimento em infraestruturaLocal de trabalho: R. Cel. Jairo Pereira, 597 - Palmares, Belo Horizonte, MGHorario de trabalho: quarta a domingo, das 9h as 18h48Informações adicionaisO que te oferecemos:🍛 Vale Alimentação ou Vale Refeição;👨🏼‍🎓 Desconto em cursos, universidades e instituições de idiomas; 📚 Academia Stefanini - plataforma com cursos online, gratuitos, atualizados e com certificado; 🗣 Mentoring;🏫 Auxílio Creche; 💉 Clube de vantagens para consultas e exames;🏥 Assistência Médica;🦷Assistência Odontológica; 💰 Clube de vantagens e descontos nos melhores estabelecimentos;👂🏾 Atendimento psicológico online ao colaborador e seus dependentes;🛫 Clube de viagens;🐶 Convênio para Pet;e muito mais...",Stefanini Group,vacancy_type_effective,,False,Belo Horizonte,Minas Gerais,Brasil,https://stefanini.gupy.io/job/eyJqb2JJZCI6NjIwODE2MCwic291cmNlIjoiZ3VweV9wb3J0YWwifQ==?jobBoardSource=gupy_portal,True,on-site,True
