job_id,published_date,title,description,career_page_name,type,application_deadline,is_remote_work,city,state,country,job_url,disabilities,workplace_type,submitted
6267001,2023-12-11T17:25:05.709Z,ANALISTA RH I (RECRUTAMENTO E SELEÇÃO) ,"Somos o Grupo Energisa! Com mais de cem anos de história, a Energisa é o maior grupo privado com controle 100% nacional do setor elétrico brasileiro. Nosso portfólio diversificado abrange 11 distribuidoras, 12 concessões de transmissão, geração de grande porte renovável, uma marca inovadora de soluções energéticas – a (re)energisa –, com geração distribuída por fonte renovável, comercialização de energia no mercado livre e serviços de valor agregado, além de uma central de serviços compartilhados, uma empresa de contact center e a fintech Voltz, a primeira do nosso setor no mercado de contas digitais. Transformamos, através de nossos mais de 17.000 colaboradores, energia em conforto e desenvolvimento para mais de 20 milhões de pessoas. Acreditamos na força da diversidade e da pluralidade para gerar inovação e atingir resultados incríveis. Aqui todos são muito bem-vindos! Quer fazer parte desta história? Confere se esta oportunidade tem match com o seu perfil e vem conosco participar desta jornada de seleção!Responsabilidades e atribuiçõesAtuar com recrutamento e seleção de alta volumetria de vagas;Garantir execução da política de Recrutamento e seleção; Executar projetos e implementar para a melhoria da jornada de seleção e experiência dos candidatos;Controlar ações e indicadores de Recrutamento e seleção (SLA de vagas), apontando plano de ação para dificuldades ou desvios de processo;Apoiar e esclarecer dúvidas dos gestores envolvidos no processo;Elaborar relatório indicando vagas fechadas no mês, pendências, apontando plano de ação; Propor revisões e melhorias do fluxo dos processos de R&amp;S.Requisitos e qualificaçõesEnsino superior nas áreas de administração, psicologia ou áreas afins;Pacote Office intermediário (Power Point e Excel indispensáveis);Vivência e expertise em processos de Recrutamento e Seleção. Informações adicionaisAs PESSOAS aqui são nossa maior ENERGIA. Pensando em seu bem-estar, oferecemos um leque de benefícios. Da só uma conferida no que você terá:• Vale alimentação ou Refeição para fazer as compras para sua casa ou comer no seu restaurante preferido;• Plano de saúde e odontológico para você e sua família;• Previdência privada para sua reserva financeira e investimentos;• Auxílio Creche para te apoiar nos primeiros anos com seus filhos;• Seguro de Vida, para dar mais tranquilidade a você e a quem você ama;• Participação nos lucros, como incentivo pelo seu trabalho e resultados;• Programas de qualidade de vida que garantem o bem-estar e promovem a saúde dos nossos colaboradores;• Programas de Bolsa de Estudo para te apoiar em qualificação profissional;• Gympass que te dá acesso a mais de 18 mil academias no Brasil.Se você possui os pré-requisitos da vaga, faça sua candidatura e fique atento nas dicas:• Durante a jornada do processo de seleção, a comunicação será via e-mail ou por telefone. Certifique que seus dados estão atualizados e fique de olho na sua caixa de e-mail, sem esquecer da caixa de spam. Fique atento nas ligações, os nossos telefones corporativos possuem variação de DDD.• Caso receba um feedback negativo, não desanime, fique atento a outras oportunidades.",Energisa,vacancy_type_temporary,2023-12-15T00:00:00.000Z,False,Cuiabá,Mato Grosso,Brasil,https://grupoenergisa.gupy.io/job/eyJqb2JJZCI6NjI2NzAwMSwic291cmNlIjoiZ3VweV9wb3J0YWwifQ==?jobBoardSource=gupy_portal,True,hybrid,True
6267374,2023-12-11T17:23:56.367Z,Analista Júnior de Controladoria,"Que tal fazer participar de um processo seletivo em uma empresa Great Place to Work?Estamos buscando um profissional proativo, ágil com interesse em processos de controladoria. Aqui, todas as vagas são abertas às pessoas com deficiência (PCD)Vaga destinada Distrito FederalResponsabilidades e atribuiçõesLevantamento, análise e apresentação de dados relacionados aos custos;Elaboração e acompanhamento do Orçamento dos Departamentos;Levantar e analisar as diferenças entre o Custos Padrão e o Custo Real;Destacar vendas realizadas fora da política de Pricing;Elaborar, atualizar e apresentar indicadores de custos e desempenho.Requisitos e qualificaçõesConhecimento avançado - Microsoft Excel.Conhecimento básico - Pacote Office.Formação superior ou cursando Administração, Economia, Ciências Contábeis ou áreas relacionadas.Capacidade de gerenciar várias tarefas e prioridades, cumprindo prazos.Organização para manter registros e informações relacionadas aos custos.Atenção aos detalhes para garantir a precisão nos cálculos e nas análises.Habilidade de trabalhar em equipe.Diferenciais: Vivência nas áreas de Custos, Controladoria, Contabilidade ou Financeiro.Informações adicionaisBenefícios: Vale alimentação/ refeição;Plano de saúde com coparticipação;Plano odontológico coparticipação;Seguro de vida;Gympass;Convênio com a Estácio e a FIAP;Convênio com o SESC;Day-Off no aniversário;Apoio psicológico interno;Aconselhamento jurídico interno;Avaliação nutricional;Licença maternidade / Paternidade Estendidas ;Auxílio creche; Università4u (Universidade Coorporativa).Regime de contratação:  CLT (Efetivo)Horário: De segunda a sexta das 9h às 18hSalário: R$ 2.500,00",Cidadania4u,vacancy_type_effective,,False,Brasília,Distrito Federal,Brasil,https://cidadania4u.gupy.io/job/eyJqb2JJZCI6NjI2NzM3NCwic291cmNlIjoiZ3VweV9wb3J0YWwifQ==?jobBoardSource=gupy_portal,True,on-site,True
6267484,2023-12-11T17:21:09.012Z,Analista de Migração Pleno,"Nós da Matrix existimos para acelerar a transformação do mercado energético brasileiro. Atuamos no Mercado Livre de Energia, comercializando energia renovável, competitiva e certificada para consumidores livres.Somos uma empresa de pessoas inovadoras, dinâmicas, ágeis e acreditamos que os resultados e desempenho dos nossos colaboradores devem ser reconhecidos.Somos uma das melhores empresas para trabalhar, certificados pela GPTW.Responsabilidades e atribuiçõesSeu dia a dia na Matrix:Tratar o processo e manter relacionamento com distribuidoras e clientes;Intermediar a comunicação entre distribuidoras e clientes;Gerir documentação de migrações da carteira;Gerir processo de migração em plataforma interna da Matrix;Alinhamento do processo de migração com demais áreas da empresa, sobretudo Pós-vendas e Gestão;Reuniões com clientes sobre o andamento da migração;Mapear processos internos de migração, propor e implementar melhorias;Acompanhar mudanças regulatórias.  Realizar a migração de novos clientes ao mercado livre de energia e operacionalizar o cadastramento e habilitação nos sistemas da CCEE;Requisitos e qualificaçõesPara assumir esse desafio, precisamos que você tenha:Superior completo em: Engenharias, Administração ou Ciências Contábeis;Disponibilidade para trabalhar no modelo híbrido;Perfil analítico;Boa comunicação;Experiência com mercado livre de energia;Pacote Office Completo, principalmente Excel. Será um diferencial de tiver:Conhecimento sobre o processo de migração de consumidores para o mercado livre;Cursos da CCEE.Informações adicionais",Matrix Energia,vacancy_type_effective,,False,São Paulo,São Paulo,Brasil,https://matrixenergia.gupy.io/job/eyJqb2JJZCI6NjI2NzQ4NCwic291cmNlIjoiZ3VweV9wb3J0YWwifQ==?jobBoardSource=gupy_portal,False,hybrid,True
6267418,2023-12-11T17:19:43.262Z,ANALISTA LOGISTICA RODOVIARIO SR ,"Exercer atividades relacionadas a logística do produto Etanol, atuando na contratação de frete rodoviário, relacionamento com transportadores e prospecção de novos. Realizar analise e reporte do mercado de fretes e combustíveis. Organizar e acompanhar as programações de expedição para clientes e terminais, acompanhando os indicadores da área e atuando sempre que necessário.Responsabilidades e atribuiçõesEstabelecer contato e atendimento as transportadoras, realizar negociação e contratação de frete rodoviário;Realizar a prospecção de novos transportadores;Realizar reporte de mercado de fretes e cenários do combustível;Realizar Input dos dados das negociações de frete no ERP;Realizar a formalização das negociações via e-mail;Realizar Input dos dados de contratação e programação de pedidos na ferramenta de agendamento;Realizar o atendimento das ocorrências da rotina de carregamento e descarga;Realizar o alinhamento com a equipe as prioridades de pedidos;Analisar pedidos e execução da programação de expedição;Atualizar controles de expedição e planejamento das operações rodoviárias. Elaborar relatórios da área de contratação x plano de demanda;Manter sinergia entre as operações de combustível e dos demais segmentos logísticos.Propor melhorias nos processos, rotina de trabalho e controles.Acompanhar desempenho das transportadoras, nos quesitos quantitativos e qualitativos, para gestão da carteira de transporte.Realizar o monitoramento e acompanhamento da performance de carregamento e aderência programação das frotas.Acompanhar performance de carregamentos das Usinas e terminais.Realizar alinhamento e programação, com a equipe responsável pelas operações com mais de um modal de frete.Propor acordos e ou contratos de transporte rodoviários para atendimento aos clientes.Criar ações que melhorem as condições e os processos existentes, identificar oportunidades de melhoria, gerar ideias e implementar soluções.Promover capacitação e apoio aos demais colaboradores do setor, garantindo a qualidade de execução dos processos da área.Gerir de modo efetivo o tempo e os próprios recursos para garantir que o trabalho seja concluído de maneira eficiente.Executar as atividades da função respeitando todas as normas e procedimentos de segurança, saúde e meio ambiente do trabalho, estabelecidos pela organização, bem como, utilizar constantemente todos os EPIs de uso obrigatório no desenvolvimento das atividades do cargo e do setor. Tendo a responsabilidade de informar ao seu superior imediato qualquer atividade que apresente risco a sua saúde ou dos demais colegas de trabalho.Exercer as atividades em comum acordo com os valores, políticas, diretrizes, procedimentos e processos da empresa, sempre focando nas metas organizacionais, e mantendo sigilo e protegendo as informações da companhia.Manter a disciplina no programa 5S, objetivando um trabalho seguro por meio da manutenção da organização, padronização e limpeza do ambiente de trabalho.Zelar pelas propriedades da empresa sob sua responsabilidade, informando ao superior imediato qualquer problema ou avaria detectada.Requisitos e qualificaçõesEnsino superior completo;Informações adicionaisBenefícios: Vale alimentação; Plano de saúde (Unimed); Plano odontológico; Vale transporte; PPR; Gympass; Refeição na empresa.",Inpasa Brasil,vacancy_type_effective,,False,Nova Mutum,Mato Grosso,Brasil,https://inpasabrasil.gupy.io/job/eyJqb2JJZCI6NjI2NzQxOCwic291cmNlIjoiZ3VweV9wb3J0YWwifQ==?jobBoardSource=gupy_portal,True,on-site,True
5936194,2023-12-11T17:16:35.798Z,Analista de Controle e Performance Jr,"Se Ligga no nosso Manifesto de Cultura! Paixão pelo CLIENTE - Sem cliente, não há Ligga. Trabalhamos para que todos os clientes (internos e externos) tenham sempre uma experiência surpreendente.Obsessão pelo RESULTADO - Somos obcecados por entregas. Muitas, rápidas e ótimas. Um dia sem entregas é um dia perdido.Crença na TRANSPARÊNCIA - Abrimos caixas, dados e ideias. Guardar informações é um erro inaceitávelIncentivamos o PROTAGONISMO - Desafios são oportunidades para quem quer brilhar. Se há um problema , pegue pra você e resolva.Criamos CONEXÃO - Não existe um indivíduo sem um todo. Não existe uma área sem uma empresa. Levantamos e criamos contato próximo e autêntico com nossos colegas.Buscamos uma TRANSFORMAÇÃO - Muito mais que inovar, queremos ser um marco na vida dos nossos clientes, fornecedores e funcionários. Entendemos que repetir as mesmas fórmulas não irá iniciar a transformação. Se identificou? Venha fazer parte desse time! Conheça mais sobre nós: https://youtu.be/ODBrON4jjb0Responsabilidades e atribuiçõesBuscamos uma pessoa para Acompanhar o orçamento da área e seus lançamentos, em nosso time de Planejamento e Controle B2B/B2C! Contaremos com essa pessoa para:Gerir o processo de pagamento de licenciados via Sistema SAP (Requisições e Pedidos);Gerir o processo de pagamento de licenciados via Sistema SAP (Requisições e Pedidos);Realizar processos de pagamentos de Notas Fiscais respeitando prazos e regras da companhia;Validar as Notas Fiscais recebidas conforme o escopo / medição do serviço prestado;Controlar saldo de Pedidos de Compras, Contratos e outros documentos financeiros;Realizar gestão de orçamento Opex contemplando análise de orçado x realizado;Identificar desvios de performance na análise de Opex, mapeando as causas e justificativas das áreas;Criar e gerir planos de ação para desvios relacionados à performance financeira;Interface com processo anual de orçamento e forecast;Analisar performance dos canais de vendas; Requisitos e qualificaçõesEnsino Superior Completo ou Cursando em Administração, Ciências Contábeis, Economia e afins; Perfil crítico, analítico, proativo, organizado e resiliente;Habilidades de negociação, de comunicação, de disciplina para execução e de aprendizado rápido;Conhecimento Intermediário em Pacote Office; Experiência em processos de gestão financeira;Também serão considerados fortes diferenciais se você tiver:Experiência em sistema SAP﻿*Incentivamos a diversidade! Todas as nossas vagas estão abertas a profissionais com deficiência ou reabilitados.Informações adicionaisAqui na LIGGA nos preocupamos com você e com seu bem-estar. Fique por dentro dos nossos benefícios:🤗👇🚑 Plano de Saúde Unimed.🦷 Plano Odontológico DentalUni.🍽️ Vale refeição e alimentação em cartão híbrido.👨‍⚕️ Seguro de Vida.🚍 Vale transporte.🦾 TotalPass para realização de atividades físicas.📶Desconto Colaborador: 50% Off na contratação de qualquer plano de Internet.🤍 Parceria com a Vittude para terapia online.😍Programa Empresa Cidadã: Extensão da licença-maternidade e paternidade.Além disso, nosso dia a dia conta com uma cultura que promove:🏖️ Day Off de aniversário.😀 Ambiente descontraído, no dress code.🍉Temos frutas no escritório e ☕ quentinho. Pensando no cuidado com sua saúde e bem-estar temos Shiatsu e Ginástica Laboral.🚀Oportunidade de trabalhar e se desenvolver em uma empresa que está crescendo a cada dia e é um dos maiores players em sua área de atuação no Paraná.",LIGGA,vacancy_type_effective,,False,Curitiba,Paraná,Brasil,https://liggatelecom.gupy.io/job/eyJqb2JJZCI6NTkzNjE5NCwic291cmNlIjoiZ3VweV9wb3J0YWwifQ==?jobBoardSource=gupy_portal,True,on-site,True
6159603,2023-12-11T17:14:43.218Z,Analista Administrativo ,"Buscamos um analista administrativo que será responsável pela validação de processos internos para pagamento, análise das despesas da empresa, negociação com fornecedores, compras internas.Deve ser organizado, ter boa comunicação oral e escrita, pois será necessário a comunicação com diversas áreas da empresa.Responsabilidades e atribuiçõesGeração de PO'sCompras InternasValidação de processos para pagamentoValidação de reembolsoControle e validação do cartão de crédito corporativoNegociação com fornecedoresProjeção de pagamentosValidação de budgetAnálise de relatóriosCriação de relatórios para o financeiroRequisitos e qualificaçõesSuperior completoConhecimento pacote officeInformações adicionaisA maioria dos processos são realizados na ferramenta Totvs.",CONFIDENCIAL,vacancy_type_effective,2024-01-11T00:00:00.000Z,False,Barueri,São Paulo,Brasil,https://vagasconfidencialholding.gupy.io/job/eyJqb2JJZCI6NjE1OTYwMywic291cmNlIjoiZ3VweV9wb3J0YWwifQ==?jobBoardSource=gupy_portal,True,hybrid,True
6214188,2023-12-11T17:11:39.153Z,Analista de logística Planejamento | Centro Distribuição Tijucas,"Que tal integrar uma marca considerada referência global em inovação, qualidade e design? Se você é da área Logística, é organizado e sente-se motivado com desafios, venha somar sua experiência à nossa!Responsabilidades e atribuições•	Monitorar as métricas operacionais dos centros de distribuição, sugerindo e implementando melhorias;•	Realizar analises operacionais para identificação das causas raízes;•	Comunicação clara e assertiva, para apresentar os problemas e propor soluções aos times responsáveis;•	Atuar e dar apoio na gestão de armazenamento, inventários e estoques;•	Desenvolver melhorias constantes para regras do WMS, visando a melhor produtividade operacional.•	Desenvolvimento e gestão de base de dados e indicadores de performance de armazém e controle de estoque.•	Ser uma pessoa organizada e que consiga atuar nas atividades prioritárias;•	Trabalhar de forma independente, multitarefa e ter atenção aos detalhes.Requisitos e qualificações•	Cursando nível superior;•	Conhecimento em Pacote Office avançado;•	Experiência em gerenciamento de estoque e WMS. •	Conhecimento em SQL e Tableau será um diferencial.•	Conhecimento em lean six sigma será um diferencial.•	Inglês intermediário será um diferencial.Informações adicionaisO que oferecemos aos Portobello Lovers:Remuneração atrativa.Seguro de vida;Assistência médica e odontológica;Vale-refeição, ou refeitório no local;Vale-transporte;Participação nos Lucros e Resultados;Reembolso farmácia;Rede de descontos - parcerias com diversas instituições;Desconto na compra de produtos Portobello;Abono Férias;Auxílio Mamãe Portobello - para compra do enxoval do bebê;Auxílio babá;Assistência a dependentes PCD's;Fazer parte de uma empresa líder;Trocas constantes com profissionais de referência.Aguardamos seu cadastro para ser um #portobellolover 💙Todas as nossas vagas também são destinadas às pessoas com deficiência.",Portobello Shop,vacancy_type_effective,,False,Tijucas,Santa Catarina,Brasil,https://portobelloshop.gupy.io/job/eyJqb2JJZCI6NjIxNDE4OCwic291cmNlIjoiZ3VweV9wb3J0YWwifQ==?jobBoardSource=gupy_portal,False,on-site,True
6267220,2023-12-11T17:09:26.143Z,Analista de Gestão de Clientes Sênior,"Nós da Matrix existimos para acelerar a transformação do mercado energético brasileiro. Atuamos no Mercado Livre de Energia, comercializando energia renovável, competitiva e certificada para consumidores livres.Somos uma empresa de pessoas inovadoras, dinâmicas, ágeis e acreditamos que os resultados e desempenho dos nossos colaboradores devem ser reconhecidos.Somos uma das melhores empresas para trabalhar, certificados pela GPTW.Responsabilidades e atribuiçõesSeu dia a dia na Matrix:﻿Será responsável por gerenciar uma carteira de clientes, criando e desenvolvendo relacionamento com os cliente; Avaliará e prospectará possíveis projetos e soluções para a carteira; Será responsável por desenhar soluções; Conduzirá projetos de melhoria; Realizará análise de viabilidade de migração; Realizará o cálculo de TUSD, balanço e curto prazo; Fará operações de SWAP e analisará dados da CCEE.Conduzirá processos de recontratação dos clientes da carteira, criar ferramentas e sugerir melhorias para a área.Requisitos e qualificaçõesPara assumir esse desafio, precisamos que você tenha:Ensino Superior em Engenharia Elétrica, Engenharia de Energia e afins;Excel intermediário;Experiência na área de gestão de clientes e análise de dados;Informações adicionais",Matrix Energia,vacancy_type_effective,,False,São Paulo,São Paulo,Brasil,https://matrixenergia.gupy.io/job/eyJqb2JJZCI6NjI2NzIyMCwic291cmNlIjoiZ3VweV9wb3J0YWwifQ==?jobBoardSource=gupy_portal,False,hybrid,True
6177583,2023-12-11T17:08:07.492Z,Analista de Investimento Social Jr,"Aqui somos feitos de valores e, para nós, o cooperativismo é mais que um modelo de negócios: é estabelecer relações com a comunidade a qual estamos inseridos buscando as melhores oportunidades para todos. O setor de Cidadania e Sustentabilidade localizado no Centro Administrativo em Chapecó(SC), está buscando profissional para fazer parte do time. O nosso propósito é ""Conectar pessoas para promover justiça financeira e prosperidade"". Você se identifica com ele, com o modelo de negócio do cooperativismo e ama trabalhar com pessoas? Então essa oportunidade é para você! :) Venha fazer parte!Responsabilidades e atribuiçõesParticipar das análises e apoiar o desenvolvimento e implementação de projetos sociais e de sustentabilidade;Analisar, registar e prestar suporte as ações de desenvolvimento econômico social da cooperativa, implementando o plano de ação e a estruturando projetos sociais e estratégicos, realizando o acompanhamento e monitoramento das ações;Elaborar propostas e oportunidades de aprimoramento em processos de negócios relacionados ao terceiro setor e investimento social;Apoiar e organizar as atividades do Instituto Sicoob, integrando pessoas, interagindo com as lideranças das áreas para promover a cultura cooperativista e o desenvolvimento sustentável da comunidade;Prestar suporte e registros para as ações de desenvolvimento econômico social e promover uma conduta diferenciada junto aos associados, estimulando-os a desenvolver atividades de educação cooperativista.Requisitos e qualificaçõesResidir em Chapecó (SC) ou cidades próximas;Graduação em andamento em Administração, Serviço Social ou áreas afins;Conhecimento em software de gestão de projetos, planilhas eletrônicas, sistemas de monitoramento e avaliação;Cursos e certificações relacionados à área serão considerados um diferencial.Informações adicionaisBenefícios:Vale alimentação;Plano de saúde Nacional sem custo de mensalidade ao colaborador;Plano odontológico;Programa de Participação nos Resultados;Treinamentos Regulares;Benefício Educacional;Previdência privada;Anuênio;Auxílio infantil;Vale transporte.",Sicoob MaxiCrédito: viva conosco a essência do Cooperativismo!,vacancy_type_effective,2023-12-21T00:00:00.000Z,False,Chapecó,Santa Catarina,Brasil,https://sicoobmaxicredito.gupy.io/job/eyJqb2JJZCI6NjE3NzU4Mywic291cmNlIjoiZ3VweV9wb3J0YWwifQ==?jobBoardSource=gupy_portal,True,on-site,True
6267168,2023-12-11T17:07:52.501Z,Analista de e-commerce Júnior,"Que tal fazer parte de um importante capítulo dentro da história da 6ª empresa mais longeva do Brasil?Pois é... a Karsten S/A é uma empresa com mais de 140 anos, e está transformando-se todos os dias.Com um misto de gostar e cuidar de gente, aconchego para você e sua família, tecnologia e inovação, venha fazer parte do time Karsten 🚀.Responsabilidades e atribuiçõesResponsável pela gestão das contas de Marketplace;Buscar informações, dados internos e externos que apoiem na tomada de decisão de vendas nos canais marketplaces;Gestão de preços das contas de marketplace, sendo o principal contato dos atendimentos das plataformas;Garantir a disponibilidade dos itens nas plataformas de marketplace.Buscar oportunidades de promoções e divulgações nos marketplaces, oportunidades de sortimento para marketplaces.Realizar pesquisa constante para análise de novos parceiros de Marketplace de acordo com os interesses da marca;Acompanhar indicadores dos marketplaces e recomendar ações;Acompanhar o desempenho das campanhas dentro dos marketplaces;Buscar ações com cada Marketplace para melhorar o posicionamento da marca dentro dos canais; eAcompanhar o fluxo de integrações necessárias para os canais.Requisitos e qualificaçõesEnsino superior completo em administração, economia, publicidade e propagando ou marketing;Conhecimento em rotinas de E-commerce e/ou Marketplace;Experiência com gestão de anúncios em Marketplace; Experiência com elaboração de relatórios de indicadores;Vivência com análise de mercado; ePacote Office intermediário/avançado.Informações adicionaisPlano de Saúde Unimed – Pra cuidar de você e sua família em qualquer momento.Assistência Médica e Odontológica na Empresa – Aqui gostamos de gente e cuidamos de gente ❤Seguro de Vida - Não se preocupe, mas temos também hehe.Vale Transporte – Uma forma de te auxiliar no caminho. Topic – Idas e Vindas com segurança para a Karsten.Restaurante na Empresa – Comida caseira? Temos também.Mercadinho da Confiança - Fome apertou, no mercadinho passou 😎Convênio Farmácia – Se cuidar é preciso sempre.Parceiros Descontos – Para você aproveitar várias coisas da vida.Associação Desportiva – Corpo e mente em exercício.Auxílio Educação – Auxiliando na sua jornada de aprendizagem.PLR - Participação de Lucros e Resultados – Construímos e comemoramos nossos resultados juntos.",Karsten,vacancy_type_effective,,False,Blumenau,Santa Catarina,Brasil,https://karsten.gupy.io/job/eyJqb2JJZCI6NjI2NzE2OCwic291cmNlIjoiZ3VweV9wb3J0YWwifQ==?jobBoardSource=gupy_portal,True,on-site,True
