job_id,published_date,title,description,career_page_name,type,application_deadline,is_remote_work,city,state,country,job_url,disabilities,workplace_type,submitted
6263396,2023-12-11T12:27:16.056Z,Analista de Controles Internos Pleno ,"Nosso time é formado por pessoas com brilho no olho e vontade de fazer a diferença.Temos objetivo de encantar clientes do Brasil e do mundo, com propósito de Interpretar Tendências e Despertar Desejos.Se você também faz com paixão, tem flexibilidade, transparência, envolvimento, gosta de trabalhar com união e desafio, a Arezzo&amp;Co pode ser o lugar certo para você!Queremos cada vez mais construir um ambiente diverso e inclusivo, por isso, nossa política de contratação não discrimina gênero, raça/cor, religião, orientação sexual, idade, condição de HIV e deficiência intelectual ou física.Venha evoluir com a gente, em cada passo da nossa jornada. RUMO A 2154!Responsabilidades e atribuiçõesApoiar na condução da Gestão dos Controles Internos e Gestão por processos;Realizar o mapeamento e revisão de processos, buscando a melhoria e aperfeiçoamento contínuo dos processos internos;Identificar, avaliar, revisar e propor controles em conjunto com as áreas internas buscando o cumprimento de diretrizes e políticas estabelecidas;Colaborar na elaboração, revisão e aprovação de políticas, processos, procedimentos e documentos internos;Monitorar processos e controles aplicáveis, executando testes periódicos de efetividade dos controles;Colaborar na criação, revisão e acompanhamento de indicadores para monitoramento contínuo dos resultados da organização;Sugerir, elaborar e auxiliar no desenvolvimento e implementação de planos de ação, visando a melhoria contínua dos processos e controles;Monitorar andamento de planos de ação, realizando follow up com as áreas internas;Criar e conduzir treinamentos e capacitações sobre gestão da qualidade e controles internos;Criar materiais de divulgação e comunicação das atividades da área;Colaborar na disseminação da Cultura de Controles InternosApoiar na elaboração de apresentações e reportes periódicos ao Comitê de Riscos, Auditoria e Finanças e aos demais interessados;Colaborar com a equipe de gestão de riscos na identificação, análise e avaliação dos riscos corporativos considerando o mapeamento e os controles do processo;Colaborar e dar suporte para a Auditoria Interna e Externa, se aplicável;Colaborar com a equipe de Compliance em atividades afins;Apoiar no desenvolvimento do Processo de Gestão da Continuidade de Negócios / Gestão de Crises.Requisitos e qualificaçõesSuperior Completo em Administração, Ciências Contábeis, Engenharias ou cursos afins;Desejável Pós Graduação, Auditoria, Controladoria, Gestão de Riscos e/ou Controles Internos;Conhecimentos em gestão de riscos e controles internos;Conhecimento de frameworks de gestão de riscos e controles internos como COSO, SOX e/ou ISO;Metodologia de gerenciamento de riscos;Conhecimentos em gestão de processos, modelagem de processos e gestão da qualidade;Conhecimento em Pacote Office intermediário;Desejável inglês Intermediário/Avançado;Desejável conhecimento em SAP.Informações adicionaisVaga em modelo de trabalho presencial na cidade de Campo Bom/RS.Benefícios:🍛 Vale Alimentação/Refeição - Para que possa ter mais autonomia, você pode optar entre o Vale Alimentação para utilizar em mercados e fazer sua própria comida, ou pelo Vale Refeição, para utilizar em restaurantes e pedir seu lanche; 🚌 Vale Transporte - Oferecemos o vale transporte para o transporte público, conforme sua necessidade de itinerário ; 🩺 Plano de Saúde e Plano Odontológico - Para cuidar sua saúde e dos seus dependentes, oferecemos Plano de Saúde da Unimed, com abrangência regional (Vale dos Sinos) e nacional, bem como Plano Odontológico Bradesco; 💪 Gympass - Quer manter a saúde física ativa? Oferecemos o Gympass, também extensivo aos seus dependentes;  🧠 Psicologia Viva – Em relação a sua saúde psicológica, oferecemos o Psicologia Viva, uma plataforma de atendimento psicológico online; 🏷 New Value - clube de benefícios com ofertas exclusivas; 👨‍👧‍👦 Licença Paternidade - Oferecemos aos papais licença paternidade estendida para 20 dias; 💸 Desconto nas marcas – Desconto exclusivo para colaboradores em todas as marcas da Maior House Of Brands do Brasil! ⛱ DayOff - No mês do seu aniversário você pode escolher um dia de folga remunerada para aproveitar mais um ano de vida com quem mais ama;  💲 PPR - Participação de Lucros conforme atingimento de metas da companhia/área.",Arezzo&CO,vacancy_type_effective,,False,Campo Bom,Rio Grande do Sul,Brasil,https://arezzoeco.gupy.io/job/eyJqb2JJZCI6NjI2MzM5Niwic291cmNlIjoiZ3VweV9wb3J0YWwifQ==?jobBoardSource=gupy_portal,True,on-site,True
6222780,2023-12-11T12:24:49.207Z,ANALISTA LABORATORIO JUNIOR,"Produzir alimentos é mais que desenvolver práticas de fabricação, é gostar de oferecer sabor e qualidade para as mesas das famílias, seja no dia a dia, ou naqueles momentos memoráveis. Se você, assim como nós, deseja transformar essa missão na sua satisfação, confira nossas oportunidades, que uma delas, pode ser a sua!Todas as vagas também estão disponíveis para Pessoas com Deficiência (PCDs).Se as vagas disponíveis não atendem seu sonho atual, faça parte do nosso banco de talentos.Assim que surgir uma oportunidade que faça sentido para você, entraremos em contato!-Observação: Esta oportunidade também aceita candidaturas de colaboradores.Se você é colaborador e tem interesse nessa oportunidade:-&gt; Atente-se aos requisitos da vaga;-&gt; Informe o seu gestor da sua intenção em participar do processo através do Formulário de Recrutamento Interno;-&gt; Lembre-se de se identificar como colaborador no momento da inscrição.Período de inscrições internas: até 14/12/2023Analista de Gente responsável pelo processo: Linete LauermannResponsabilidades e atribuiçõesColaborar com as atividades de análise e interpretação dos dados físico-químicos e/ou microbiológicos de amostras de matéria prima (leite);Colaborar na elaboração e/ou realização de treinamentos em programas de qualidade;Executar a coleta de amostras de matéria-prima (leite);Elaborar relatórios de análises preliminares, submetendo-os ao supervisor da área para aprovação;Elaborar relatórios demonstrativos dos principais indicadores da área;Manter e controlar o estoque de materiais de consumo da área;Colaborar na realização das demais atividades da área.Requisitos e qualificaçõesEnsino médio completo;Disponibilidade para atuar em escala de trabalho 6x2;Horário de trabalho 05h as 14h;Mínimo de 5 meses na função atual (para inscrições internas de colaboradores da Piracanjuba);Diferencial:Curso superior em químicas, engenharia de alimentos e áreas afins.Disponibilidade de horários.Informações adicionaisO que oferecemos?Vale Alimentação;Refeição na Empresa (Marmitex);Plano de Saúde;Plano Odontológico;Seguro de Vida;Cartão de Natal;Empréstimo Consignado;Bolsa de Estudos;Desconto em Consultas Psicológicas;PLR - Participação nos Lucros e Resultados.",Piracanjuba,vacancy_type_effective,,False,São Paulo das Missões,Rio Grande do Sul,Brasil,https://piracanjuba.gupy.io/job/eyJqb2JJZCI6NjIyMjc4MCwic291cmNlIjoiZ3VweV9wb3J0YWwifQ==?jobBoardSource=gupy_portal,True,on-site,True
6208324,2023-12-11T12:22:20.537Z,Analista Customer Service,"Relacionamento com os clientes Loja;Análise de indicadores, performance, SLA;Buscar soluções para os ofensores do dia a dia;Gerar relatórios;Realizar reuniões com os clientes.Responsabilidades e atribuiçõesSenso de dono;Analisar e acompanhar a carteira de clientes.Requisitos e qualificações• Ensino superior completo ou cursando;• Excel intermediário;• Ideal residir em POA e região metropolitana.Informações adicionais",BBM Logística,vacancy_type_effective,,False,Porto Alegre,Rio Grande do Sul,Brasil,https://bbmlogistica.gupy.io/job/eyJqb2JJZCI6NjIwODMyNCwic291cmNlIjoiZ3VweV9wb3J0YWwifQ==?jobBoardSource=gupy_portal,False,hybrid,True
6163819,2023-12-11T12:16:06.267Z,"
Analista de PCP JR","Na Britvic Brasil trabalhamos com a missão de nos tornarmos a empresa de bebidas não alcoólicas mais dinâmica do mundo para criar um amanhã melhor, com o propósito de estar sempre aproveitando os momentos da vida. Aqui, #SomosOusados para atingir todos os dias resultados inovadores. #SomosÁgeis e vencemos a complexidade para criar novas oportunidades. Buscamos trabalhar todos os dias guiados pelo sentimento de ownership, pois todos #SomosDonos do agora e do futuro da nossa companhia. #NósCuidamos de nossas marcas, do nosso papel na sociedade e do impacto no planeta. Mas, acima de tudo, é a felicidade do nosso time que sempre vêm em Primeiro lugar, por isso acreditamos verdadeiramente que #JuntosSomosMaisFortes.Responsabilidades e atribuiçõesRealizar o plano mensal de materiais (analise estoques, validades e consumo previsto), para suportar as demandas de compras; Realizar follow-up dos pedidos com fornecedores semanalmente, para que as entregas ocorram dentro dos prazos programados; Programar os pedidos de exportação, para abastecer a fábrica com materiais e insumos; a fim de garantir os produtos necessários para a produção. Acompanhar diariamente a produção planejada x realizada, para atender eventual variação de demanda comercial Elaborar relatórios mensais de giro dos estoques, divulgando para gerência e diretoria os resultados da área. Realizar análise sobre o consumo de materiais e insumos, acompanhando o esgotamento de estoques em descontinuação, evitando assim descarte de produtos.Requisitos e qualificaçõesConhecimento intermediário de Pacote Office – Word, Excel e Power Point é essencial; Experiência em planejamento de produção é essencial; Ensino Superior nas áreas: Administração, Engenharia de Produção ou cursos afins é essencial; Capacidade de raciocínio logico é altamente desejável; Inglês intermediário é desejável.Informações adicionaisBenefícios Remuneração Fixa: R$ Plano de Saúde - Unimed Seguro de Vida Convênio Gympass Refeição no local Parceiros de descontos Vale Alimentação Cartão Farmácia Convênio Odontológico",Britvic Brasil,vacancy_type_effective,,False,Araguari,Minas Gerais,Brasil,https://vemprabritvicbrasil.gupy.io/job/eyJqb2JJZCI6NjE2MzgxOSwic291cmNlIjoiZ3VweV9wb3J0YWwifQ==?jobBoardSource=gupy_portal,True,hybrid,True
6263297,2023-12-11T12:09:26.937Z,Analista da Garantia -  Administração e Estratégia da Garantia,"Responsável por organizar reuniões do Fórum de discussão de processos de Garantia que envolve atendimento a clientes.Terá como objetivo estruturar ações para tomada de decisão entre as áreas envolvidas buscando a solução de casos críticos.Responsabilidades e atribuiçõesO Analista será responsável em elaborar a agenda diária com as tarefas tratadas nas reuniões para que os times envolvidos possam atuar nos casos pendentes.Irá desenvolver minutas e relatórios gerencias dos resultados dos casos atendidos, referente a trocas e reparos de veículos e seu tempo de atendimento.Conduzirá os processos da Garantia dentro do Pós-Vendas e áreas relacionadas como: CRC, Regionais, Jurídico e Finanças.Irá desenvolver relatórios gerenciais e realizar fazer follow-up em tarefas diárias e plano de ação.Requisitos e qualificaçõesCurso Superior Completo em: Administração ou áreas correlatas;Conhecimento do Pacote Office, Excel Avançado.Conhecimento em mecânica e peças automotivas será um diferencial.Ter linguagem técnica e comercial para atendimento aos concessionários.Ter conhecimento Jurídico e do Codigo de Defesa do Consumidor.CNH - BSer proativo, empático, habilidades para trabalho em equipe e bom relacionamento interpessoal, orientado à resultado e com senso de urgência. Experiência mínima de 5 anos comprovada em atividades relacionadas aos processos de Garantia.Informações adicionaisNome do Cargo: Analista de GarantiaLocal de trabalho: São Bernardo do Campo/SPModelo de trabalho híbrido flexível (2x na semana no escritório e 3x na semana em home office)Plataforma de treinamentos online gratuitoPrograma de Saúde e Bem-estarBenefícios:Compra de veículo com descontoGympassEstacionamento no local - gratuitoÔnibus fretadoPPR anualRefeitório no localPlano de SaúdePrevidência PrivadaPlano PecúlioZenklub - plataforma de saúde mental e bem-estar emocional",Volkswagen do Brasil,vacancy_type_effective,,False,São Bernardo do Campo,São Paulo,Brasil,https://vwbrasil.gupy.io/job/eyJqb2JJZCI6NjI2MzI5Nywic291cmNlIjoiZ3VweV9wb3J0YWwifQ==?jobBoardSource=gupy_portal,False,hybrid,True
6222818,2023-12-11T12:04:31.838Z,Analista de Recursos Humanos Júnior (Exclusivo para Candidatas (os) com Deficiência),"Buscamos uma (um) Analista de Recursos Humanos Júnior (Exclusivo para Candidatas (os) com Deficiência) para a unidade de negócio Corporativo.Se você tem atitude de dono, acredita na liderança pelo exemplo e tem interesse em fazer parte de um ambiente colaborativo, que fomenta a inovação e acredita na diversidade, o seu ambiente é aqui na Dexco.Inscreva-se e venha fazer parte da nossa jornada de transformação.Com o propósito de oferecer Soluções para Melhor Viver, nós somos parte do dia a dia das cidades e da vida das pessoas por meio das marcas Deca, Hydra, Ceusa, Portinari, Durafloor e Duratex. Temos 5 unidades florestais (MG, SP e RS) e 16 unidades industriais no Brasil (MG, SC, RS, SP, PB, PE, SE e RJ), 3 fábricas na Colômbia e 100% da plataforma Viva Decora.Responsabilidades e atribuiçõesRealizar processos seletivos de posições de aprendiz, estágio, auxiliar, assistente, analista jr, do início ao fim (alinhamento e validação de perfil, publicação de oportunidades, entrevistas por competências, análise comportamental, elaboração de pareceres, apresentação de proposta ao candidato ), assegurando o cumprimentos das políticas e diretrizes da companhia;Realizar controles, relatórios e apoiar nas apresentações da área;Apoiar no monitoramento da plataforma Gupy, levantando as oportunidades de melhoria e direcionamento dos usuários;Apoiar a operacionalização e suportar a área em projetos e programas;Apoiar na área de Diversidade, Equidade e Inclusão.Requisitos e qualificaçõesGraduação Completa em Administração ou Psicologia;Conhecimentos em processos de Atratividade e Seleção e Entrevista por Competências;Conhecimento intermediário em Pacote Office;Experiência com sistema de atratividade e seleção Gupy será um diferencial.Informações adicionaisLocal de Trabalho: Av. PaulistaModelo de Trabalho: 4 dias presenciais e 1 dia home office.Alinhada à nossa cultura organizacional, cuidamos da vida onde ela estiver, e por aqui, investimos em pessoas e construímos times incríveis, por isso, a Dexco oferece benefícios e facilidades para seus colaboradores e familiares. Confira:*Mais detalhes e condições sobre os itens abaixo são informados no momento da proposta à pessoa selecionada.•	Assistência médica para o colaborador e seus dependentes;•	Assistência odontológica para o colaborador e seus dependentes;•	Seguro de vida para o colaborador e seu cônjuge (a adesão é opcional);•	TotalPass: Plataforma que permite ao associado frequentar diversas academias parceiras, por um valor fixo mensal. Além disso, dá acesso aos aplicativos Receitas Fit, Queima Diária e TotalZen;•	Convênio Farmácia: Garante a compra de medicamentos por um valor mais acessível;•	De Bem com a Mente: Programa que promove o cuidado com a saúde mental, por meio de medidas de prevenção, identificação, apoio e reabilitação;  •	Pronto Atendimento Pessoal: Programa de apoio que ampara e orienta em assuntos nas áreas: financeira, psicológica, jurídica e serviços sociais;•	Gestar Juntos: Programa para as gestantes da Dexco e dependentes, que oferece orientações sobre maternidade;•	Auxílio-creche: Apoio financeiro para o responsável legal na mensalidade de creches, escolas e babás de crianças até que completem 24 meses;•	Refeição: Vale-refeição para colaboradores alocados no Escritório Central, localizado na Avenida Paulista (São Paulo). E para as demais unidades, refeitório no local e cesta básica;•	Cartão de Natal;•	Transporte: Vale-transporte ou fretado (dependendo da unidade de trabalho);•	Participação de Lucros e Resultados (PLR) de acordo com os resultados atingidos pela companhia e o cumprimento das metas individuais;•	Previdência Privada: você investe uma porcentagem do seu salário e a Dexco contribui com o mesmo valor (a adesão é opcional);•	Empréstimo Fundação Itaúsa Industrial: para os nossos colaboradores participantes do Plano de Previdência Privada, a Fundação disponibiliza empréstimos com condições diferenciadas às praticadas pelo mercado;•	Empréstimo consignado: viabilizamos, para os profissionais com mais de seis meses de empresa e correntistas do Banco Itaú, a contratação de empréstimos consignados com taxas especiais;•	UniDexco: plataforma online com conteúdo, cursos e treinamentos para seu desenvolvimento profissional;•	Clube de Parcerias Dexco: portal de benefícios e descontos com quase 700 parceiros;•	Loja Dexco: desconto na compra de produtos selecionados das marcas Dexco.",DEXCO,vacancy_type_effective,,False,São Paulo,São Paulo,Brasil,https://dexco.gupy.io/job/eyJqb2JJZCI6NjIyMjgxOCwic291cmNlIjoiZ3VweV9wb3J0YWwifQ==?jobBoardSource=gupy_portal,True,on-site,True
6262829,2023-12-11T12:02:34.947Z,Analista Comunicação e Marketing Sr,"Já pensou em transformar o mundo por meio da educação? A área Comunicação e Marketing do Marista Brasil está em busca de um profissional que busca protagonizar as transformações necessárias aos novos tempos, construindo pontes e impactando, positivamente, a vida de milhares de crianças e jovens.﻿Responsabilidades e atribuiçõesCriar estratégias de divulgação e realizar gestão, implementação e mensuração dos planos de comunicação estratégicos da área;Propor ações e planos de comunicação alinhados as iniciativas estratégicas da instituição;Gestão das demandas de comunicação dos clientes internos e interface com agência - desenvolvimento de briefing, alinhamento com áreas cliente, coordenação de fornecedores, orçamento, apresentações, mensuração, etc;Zelar pela construção de imagem das marcas da educação básica, avaliando criticamente peças de comunicação, considerando a relevância das informações divulgadas, alinhamento com Brandbooks e suas contribuições para o alcance dos objetivos estratégicos;Monitorar e acompanhar dados dos planos de comunicação, sugerindo oportunidades de melhorias para melhor obtenção dos resultados;Controlar o calendário de social media, encontrando oportunidades sazonais e garantindo resposta a todos os usuários engajados nos perfis da instituição;Revisar conteúdos produzidos pela agência, avaliando qualidade do conteúdo e adequação aos canais de distribuição;Conhecimento de técnicas de SEO, acompanhando o cumprimento do plano e identificando pontos de melhoria;Estabelecer rotina de análise de métricas e otimização das campanhas;Apresentar os resultados das ações para áreas clientes da instituição;Interface diária com as demais unidades da instituição;Possuir facilidade na condução e facilitação de dinâmicas de Comunicação e MarketingRequisitos e qualificaçõesSuperior completo Comunicação Social, Publicidade e Propaganda, Marketing, Jornalismo ou Relações Públicas;Conhecimentos avançados: administração e fluxos de agências de comunicação. Word, PowerPoint, Excel. Conhecimento Idioma inglês- nível técnica;Conhecimentos intermediários: pesquisa quantitativa, pesquisa qualitativa. Análise de dados.Desejável conhecimento em metodologias ágeis. Informações adicionaisSomos presença significativa em 78 países. No Brasil, são 98 unidades de Educação Básica em 20 estados e Distrito Federal e uma missão que fica cada vez mais forte. Somos uma história escrita por muitas pessoas, unidas para encarar desafios e ir além todos os dias. Se você deseja fazer parte de uma família que tem muitos sotaques, mas uma só voz, queremos te conhecer. Junte-se a nós e venha transformar o mundo por meio da educação. Marista Brasil - Muitas histórias. Um só propósito.",Marista Brasil,vacancy_type_effective,2024-01-12T00:00:00.000Z,False,Curitiba,Paraná,Brasil,https://maristabrasil.gupy.io/job/eyJqb2JJZCI6NjI2MjgyOSwic291cmNlIjoiZ3VweV9wb3J0YWwifQ==?jobBoardSource=gupy_portal,True,hybrid,True
6231851,2023-12-11T12:01:50.684Z,Pontotel - Analista Financeiro (remoto),"Aqui você terá a chance de crescer e construir com o time um ambiente agradável, descontraído e desafiador, trabalhando em colaboração com profissionais de produto, marketing, desenvolvimento, comercial e sucesso do cliente. Não somos designers de balcão de pedidos, somos parte do fluxo, do processo e das ideias.Todas as ideias são ouvidas, respeitadas e levadas em consideração. Além disso, a equipe é incentivada a sair da zona de conforto e trazer soluções inovadoras. Que tal fazer parte desse time?Responsabilidades e atribuiçõesBuscamos um colaborador(a) dedicado(a) e experiente para integrar nosso time financeiro, onde possa contribuir com habilidades abrangentes em contas a pagar, contas a receber, faturamento e processos contábeis. Esta cadeira te desafiará a aplicar seus conhecimentos financeiros em um ambiente dinâmico, onde a precisão, organização e a capacidade de gerenciar múltiplas tarefas são essenciais.Contas a Pagar:Gerenciar e processar pagamentos a fornecedores.Gerenciar e processar pagamentos internos.Manter registros e reconciliar discrepâncias nas faturas.Contas a Receber:Garantir que todas as faturas sejam emitidas corretamente e enviadas dentro dos prazos.Resolver questões relacionadas a faturamento com clientes.Monitorar clientes e propor estratégias para redução da inadimplência.Processos Contábeis:Realizar conciliação bancária regularmente.Colaborar com a equipe contábil para garantir conformidade com normas fiscais e contábeis.Requisitos e qualificaçõesEnsino superior completo em Administração, Ciências Contábeis, Economia ou áreas afins.Experiência com contas a pagar, contas a receber e atividades administrativas financeiras.Experiência com práticas contábeis e normas fiscais (desejável).Excelente capacidade analítica e atenção aos detalhes.Comprometimento com prazos e qualidade.Fortes habilidades de comunicação e negociação.Conhecimento em Excel/Planilhas Google (desejável).Informações adicionaisTrabalho 100% remotoAmbiente casual e aprendizado constanteHorário flexívelAuxílio home office pago via cartão CajuVale Refeição pago via cartão CajuPlano de saúde UnimedSeguro de VidaLicença Maternidade estendidaAuxílio CrecheDay-off no mês do seu aniversárioHappy Hour por conta da Pontotel",Pontotel,vacancy_type_effective,2024-01-31T00:00:00.000Z,True,,,Brasil,https://pontotel.gupy.io/job/eyJqb2JJZCI6NjIzMTg1MSwic291cmNlIjoiZ3VweV9wb3J0YWwifQ==?jobBoardSource=gupy_portal,True,remote,True
6175883,2023-12-11T12:00:16.746Z,Pessoa Analista de Laboratório de Ecotoxicologia - Charqueada,"Reconhecemos que o nosso pessoal é o nosso diferencial e os diversos talentos que trazemos para nossa força de trabalho global estão diretamente relacionados ao nosso sucesso!Diversidade é um tema de muita relevância para o nosso negócio e a sociedade como um todo, valorizamos e respeitamos as diferenças, pois entendemos que ela estimula a inovação, permitindo soluções e uma comunicação assertiva para os mais diversos públicos. Aqui todes são bem-vindes, queremos ser uma empresa cada vez mais plural e diversa! O nosso objetivo é formar o melhor time de encantadores de pessoas sem distinção de nacionalidade, cor, gênero, religião, deficiência e outros.﻿Por isso, aqui você vai encontrar pessoas de diferentes lugares, histórias, mas que acreditam na importância da união e no poder do apoio e do acolhimento.Responsabilidades e atribuiçõesBUSCAMOS ALGUÉM QUE JÁ TENHA EXPERIÊNCIA COM ANÁLISES EM ECOTOXICOLOGIA- Realizar a rotina operacional da equipe técnica;todo o processo de análise e execução dos estudos sob sua responsabilidadeexecutar testes ecotoxicológicosavaliação e manutenção da saúde dos organismosdiscussão dos resultados- Realizar entregas e resultados e implementar melhorias de processos;- Participar do processo de implementação de novos métodos;- Participar de Auditorias Internas e Externas;INMETRO: BPLClientes- Dar os treinamentos necessários à equipe;Requisitos e qualificações- Conhecimento em testes de ecotoxicidade com diferentes organismos;- Graduação em Biologia, biotecnologia ou áreas correlatas;- Boa comunicação;- Organização;- Proatividade;- Adaptabilidade.Informações adicionaisHORÁRIO: Segunda a sexta das 07:00 as 16:48 (100% presencial) LOCAL: UNIDADE - CHARQUEADA - SÃO PAULO O QUE TE OFERECEMOS: 🍽 Vale Refeição / Alimentação; 🔃 Vale transporte; 🚑 Assistência Médica / Seguro de Vida; 🦷 Assistência Odontológica; 🏋️ Auxilio Academia e Bem estar;  💊 Convênio Farmácia; 📚 Parcerias e convênios com faculdades e escolas de idiomas;",ALS LIFE SCIENCES,vacancy_type_effective,,False,Charqueada,São Paulo,Brasil,https://alslifesciences.gupy.io/job/eyJqb2JJZCI6NjE3NTg4Mywic291cmNlIjoiZ3VweV9wb3J0YWwifQ==?jobBoardSource=gupy_portal,False,on-site,True
