job_id,published_date,title,description,career_page_name,type,application_deadline,is_remote_work,city,state,country,job_url,disabilities,workplace_type,submitted
6515837,2023-12-28T20:45:24.323Z,Analista de Produtos (2023),"Como Analista de Produtos aqui na ammo.varejo, você será responsável por elaborar as fichas técnicas e cadastro de produtos nacionais e importados, garantindo que todos os envolvidos no processo de produção estejam alinhados com as especificidades dos produtos, além de apoiar na busca por referências no mercado, desenvolvendo cartela de cores, auxiliando em materiais de treinamento e apresentações. Responsabilidades e atribuiçõesElaboração das fichas técnicas de produto nacional e importado, atualizando sempre que necessário, além de realizar manutenção das informações do departamento de Produto; Realizar e acompanhar a criação de cadastro e SKUs dos itens, além de controlar follow-up de desenvolvimento com fornecedores;Contato direto com gerência e equipe de designers de forma a eliminar dúvidas e garantir tração no processo;Recebimento e controle das amostras, bem como avaliação e retorno de aprovação com as áreas envolvidas;Contribuir na seleção de produtos para coleção, buscando referências em sites diversos e seleção de itens dos fornecedores, além de dar suporte na elaboração de cartelas de cores.Requisitos e qualificaçõesExperiência nas atividades descritas e relacionadas ao desenvolvimento de produto têxtil;Desejável atuação anterior em empresas do segmento Varejo;Ensino superior completo em Design de Moda, Negócios da Moda ou áreas correlatas;Conhecimento do Pacote Office ou Ferramentas Google, em especial Excel / Planilhas em nível intermediário;Desejável experiência anterior com sistemas ERP;Conhecimento de Illustrator intermediário;Inglês intermediário (fichas técnicas de produtos importados e contato com fornecedores internacionais).Informações adicionaisO que temos pra você :)Assistência Médica e OdontológicaVale Refeição / Alimentação ou Refeitório no Local (no caso de Vinhedo)Vale Transporte ou Estacionamento (no caso de Vinhedo)Super descontos em produtos das nossas marcasJornada Flexível e Home Office 2 vezes por semanaDress Code informalConvênio com SescCrédito ConsignadoClube de Benefícios: frequentemente estabelecemos parcerias incríveis pensando no bem estar e desenvolvimento dos nossos colaboradores, como: escolas de idiomas, incentivo educacional, cursos com desconto na PUC, FIA, Descomplica, SkillHub, Unifaj, FIAP, entre outras.Parceria com empresa de planejamento financeiro pessoal e familiar, formada por profissionais de mercado e professores de finançasBenefícios que Humanizam:Day off no aniversário;Licença paternidade estendida (20 dias corridos);Licença luto estendida (3 dias úteis em casos de falecimento de cônjuges, filhos ou pais, e 2 dias úteis para avós ou tios)TotalPass:8 opções de plano para você escolher com + 8.000 academias e estúdios, + 250 modalidades e o Total Play - uma plataforma exclusiva com treinos online, receitas e muito mais.Além de atuar em time colaborativo, onde terá a oportunidade de aprender e trocar experiências com pessoas referência de mercado, você irá atuar em ambiente informal e ser parte de um time apaixonado por moda lar e decoração, que respira soluções inovadoras e experiências incríveis que afetam o conforto e a qualidade de vida de milhares de pessoas!",ammo varejo,vacancy_type_effective,,False,Vinhedo,São Paulo,Brasil,https://carreirasammo.gupy.io/job/eyJqb2JJZCI6NjUxNTgzNywic291cmNlIjoiZ3VweV9wb3J0YWwifQ==?jobBoardSource=gupy_portal,True,hybrid,True
6523121,2023-12-28T20:40:49.167Z,J&F Mineração - Analista Comercial Sênior (Belo Horizonte),"Nasce em 2022 a J&amp;F Mineração ,com ativos de produção de minérios granulados e de alto teor.Mineração Corumbaense Reunida (MCR)As operações da MCR incluem duas minas em Corumbá, no Mato Grosso do Sul: Santa Cruz, de minério de ferro, e Urucum, a única mina subterrânea de manganês e o Porto Gregório Curvo (PGC).Missão:Sermos os melhores naquilo que nos propusermos a fazer, com foco absoluto em nossas atividades, garantindo os melhores produtos e serviços aos clientes, solidez aos fornecedores, rentabilidade aos acionistas e a oportunidade de um futuro melhor a todos os colaboradores.Valores: Atitude de dono, determinação , disponibilidade, humildade, simplicidade, disciplina e franqueza.J&amp;F Mineração, a nova força da mineração brasileira!Responsabilidades e atribuiçõesPlanejar compras de minério de ferro para entrega em Mato Groso do Sul, São Paulo e Minas Gerais, interagindo com os times de Planejamento, Assistência Técnica, Logística, Jurídica, Tributária, Controladoria e Meio Ambiente;Desenvolver opções de produtos e fornecedores em conjunto com outras áreas.Acompanhar estoque e consumo;Analisar preços, cálculo de composição de preços e custos do produto final;Programar entregas;Elaborar e gerir contratos comerciais,;Emitir pedidos de compras;Realizar cálculo de fechamento de ajustes de qualidade de minério;Acompanhar a retirada do material e do pagamentos aos fornecedores.Requisitos e qualificaçõesEnsino superior completoExperiência em empresas de mineração;Conhecimento em inglês.Informações adicionais",J&F Mineração,vacancy_type_effective,2024-01-10T00:00:00.000Z,False,Belo Horizonte,Minas Gerais,Brasil,https://jfmineracao.gupy.io/job/eyJqb2JJZCI6NjUyMzEyMSwic291cmNlIjoiZ3VweV9wb3J0YWwifQ==?jobBoardSource=gupy_portal,True,on-site,True
6523168,2023-12-28T20:39:00.548Z,Analista de Licitação Pleno - São Paulo ,"Todas as vagas também estão abertas para PcDs e reabilitados do INSSResponsabilidades e atribuições    Consolidar informações para a participação no pregão     Suporte aos sistemas de nossos fornecedores, inserindo informações de credenciamento, resultados, e outras informações necessárias    Cadastrar solicitações de credenciamentos nos sistemas dos fornecedores e acompanhar o andamento até a finalização    Informar resultados das Licitações participadas nos sistemas dos fornecedores seguindo os processos específicos de cada Indústria/fornecedor.    Gestão do processo de preço durante o Pregão    Análise do Edital de forma profundaRequisitos e qualificaçõesVivência na área de LicitaçãoConhecimento pacote office (principalmente Excel)Conhecimento de sistemas de LicitaçãoDesejável conhecimento na Lei de LicitaçãoEnsino Superior Completo Informações adicionaisVale Refeição/AlimentaçãoVale TransportePPRSeguro de vidaPrevidência PrivadaAssistência MédicaAssistência OdontológicaCartão FarmáciaHorário de Trabalho:08:00 ás 18:00 (segunda á sexta-feira) Zona Sul - São Paulo",Oportunidade de Vaga - Confidencial,vacancy_type_effective,,False,São Paulo,São Paulo,Brasil,https://oportunidade_conf.gupy.io/job/eyJqb2JJZCI6NjUyMzE2OCwic291cmNlIjoiZ3VweV9wb3J0YWwifQ==?jobBoardSource=gupy_portal,True,on-site,True
6523184,2023-12-28T20:37:39.657Z,Banco de Talentos - Analista de Atendimento ,"Apostamos e investimos no desenvolvimento da nossa Gente, então venha TransformAR o seu futuro! Estamos buscando profissionais para fazer parte do nosso Banco de Talentos no time de Atendimento.Se você é resolutivo, inconformado, organizado e processual, essa vaga é para você!Responsabilidades e atribuiçõesDe maneira geral:Entender as necessidades dos clientes e atendê-los a fim de informar sobre possíveis dúvidas e soluções de problemas em sua compra, produto ou instalação.Como será o seu dia a dia por aqui:Receber contato do consumidor através dos canais de comunicação disponíveis, analisar e endereçar as respectivas tratativas;Atender com empatia, buscando a satisfação do cliente e qualidade do processo;Realizar pesquisas no banco de dados da empresa para analisar histórico dos clientes, buscando oportunidades de melhoria no atendimento;Garantir a compreensão do cliente quanto as informações prestadas em toda a etapa do processo de atendimento;Realizar follow-ups junto aos clientes sobre o andamento do seu processo de atendimento;Atender casos de Reclame Aqui, Mídias Sociais, buscando solução junto ao cliente, de acordo com o Código de Defesa do Consumidor;Atender aos prazos estipulados, política e processos da empresa;Tratar com terceiros (transportadores, fabricantes, técnicos) sobre o atendimento ao consumidor;Realizar negociações com prestadores de serviços buscando garantir uma boa apresentação de serviços e cumprir a política orçamentária da empresa.Requisitos e qualificaçõesSe você:Tem Ensino Superior completo/cursando em Administração, Contábeis, Engenharias e correlatas;Tem experiência com atendimento ao cliente focado em resolução de problemas, busca por melhorias;Tem habilidade em Excel.Informações adicionaisHorário de trabalho: Segunda a Sexta-feira das 07:42-12:00 e 13:30-18:00;Modelo: Presencial (Araçatuba);Contrato: CLT.",CentralAr.com,vacancy_type_effective,,False,Araçatuba,São Paulo,Brasil,https://centralar.gupy.io/job/eyJqb2JJZCI6NjUyMzE4NCwic291cmNlIjoiZ3VweV9wb3J0YWwifQ==?jobBoardSource=gupy_portal,True,on-site,True
6523118,2023-12-28T20:33:55.141Z,Analista Remuneração,"Quer fazer parte de um time focado em contribuir para potencializar o vínculo entre a empresa e seus colaboradores por meio de estratégias de remuneração que promovam engajamento? Então esse desafio é para você!#VEMCOMAGENTEResponsabilidades e atribuiçõesExecutar as rotinas para implementação dos processos, políticas e procedimentos para estrutura organizacional de Cargos e Salários;Organizar e executar os programas de remuneração variável (Bônus, PPR, Comissão, Premiação);Organizar a tabela salarial vigente, acompanhando as alterações referente a dissídio;Aplicar as políticas de Cargos e Salários na gestão de movimentações, promoções e reajustes salariais;Conduzir a realização de pesquisas de remuneração junto ao mercado, participando do processo de escolha das empresas, itens e materiais de coleta, visando a correta comparação e análise com o mercado, bem como responder pesquisas solicitadas por outras empresas, realizar análises, elaborar relatórios e sugerir recomendações de alterações estruturais e de cargos, ajustes salariais e revisão dos critérios, programas e políticas para administração da remuneração;Acompanhar e monitorar os resultados, cálculo, apurações dos indicadores e divulgação da PPR, bem como as políticas de comissão, bônus e premiação;Realizar a análise, descrição, avaliação, classificação e padronização dos cargos;Manter indicadores de desempenho da área atualizados.Requisitos e qualificaçõesPara essa vaga precisamos que você tenha:Graduação completa em Administração, Recursos Humanos e/ou correlatas;Conhecer profundamente e atuar com metodologias e sistemas de remuneração (Pontos, Hay e Mercer);Sólida atuação dedicada a remuneração/cargos e salários em indústria, participando do processo de implantação/estruturação;Domínio Pacote Office.Será um diferencial se você tiver:﻿Conhecimento em sistema TOTVS.Informações adicionaisNos preocupamos com o bem-estar das nossas pessoas, por isso oferecemos um pacote de benefícios que promovam o cuidado para uma vida mais saudável e completa:·       Plano de saúde para colaboradores e dependentes;·       Plano odontológico para colaboradores e dependentes;·       Participação nos resultados da empresa;·       Refeição no local;·       Cesta básica;·       Fretado;.       Parceria com instituições para descontos nas mensalidades tanto para colaboradores quanto dependentes;·       Seguro de vida.",Vagas Valgroup,vacancy_type_effective,2024-01-19T00:00:00.000Z,False,Lorena,São Paulo,Brasil,https://valgroup.gupy.io/job/eyJqb2JJZCI6NjUyMzExOCwic291cmNlIjoiZ3VweV9wb3J0YWwifQ==?jobBoardSource=gupy_portal,True,hybrid,True
5922675,2023-12-28T20:32:58.990Z,Analista de negócios digitais 🧡," Vem fazer o Itaú_Somos o Maior banco da América Latina, a marca mais valiosa do Brasil e a segunda melhor empresa para trabalhar segundo o ranking da Great Place to Work US 2022, estamos presentes em 18 países impactando diariamente mais de 55 milhões de clientes através dos nossos produtos e soluções. Queremos ser uma empresa onde pessoas de todos os gêneros, raças, idades, orientação sexual e com deficiência escolham para se desenvolver, com pessoas diversas, tecnologias, produtos, soluções e faremos isso com você!Não queremos você apenas por achar que tem a nossa cara. Queremos ter um pouco da sua também! Modelo de trabalho: Híbrido com escalaResponsabilidades e atribuiçõesManipular e analisar dados para gerar ideias e propostas para o negócio Gestão de indicadores e análise e consolidação de dados  Propor melhorias nos fluxos de processos que podem ser automatizados ou transformadosRequisitos e qualificaçõesCompetências: Capacidade analítica , Colaboração , Raciocínio Lógico Tecnologia: SAS , SQL , Excel Informações adicionaisEstamos em constante transformação e esperamos que você nos ajude nessa jornada!Se identificou? Quer fazer parte do nosso time? Inscreva-se no nossa oportunidade.#vemproItaúO Itaú irá utilizar os dados fornecidos para fins de processos seletivos, inclusive em bancos de vagas alocados em plataformas terceiras. Caso deseje solicitar oposição a este uso, ou exercer quaisquer um dos seus direitos, entre em contato através de nossos canais, disponíveis na Política de Privacidade de candidatos do Itaú Unibanco (https://www.itau.com.br/privacidade/candidatos/). Não há necessidade de aceitar, trata-se apenas de uma ciência.",Itaú Unibanco,vacancy_type_effective,,False,Sao Paulo,São Paulo,Brasil,https://vemproitau.gupy.io/job/eyJqb2JJZCI6NTkyMjY3NSwic291cmNlIjoiZ3VweV9wb3J0YWwifQ==?jobBoardSource=gupy_portal,True,hybrid,True
6312016,2023-12-28T20:31:47.410Z,Analista de Educação (Libras) - Analista II,"Participar do planejamento e implementação das ações educacionais, desenvolvendo atividades ligadas à elaboração de projetos, estudos e medidas voltadas para a melhoria dos processos pedagógicos e prestando suporte, organizando e apoiando a realização dos cursos, programas e demais atendimentos ligados à área.Responsabilidades e atribuiçõesApoiar o planejamento e a implementação das ações educacionais;Apoiar a elaboração dos planos de ensino;Orientar os docentes nas questões relativas aos planos de ensino, à didática, às metodologias e técnicas de ensino;Participar da organização e da realização das reuniões pedagógicas com os docentes da escola;Participar de reuniões com pais de alunos e familiares;Motivar e despertar no aluno o interesse pelas questões da indústria, demonstrando e evidenciando a importância do segmento para a economia, Estado, trabalho e sociedade em geral;Apoiar e participar na elaboração do plano de capacitação dos docentes;Orientar os docentes na elaboração e no uso dos materiais didáticos e instrucionais;Participar do planejamento e da programação das atividades do início e encerramento dos períodos letivos;Participar da elaboração do calendário escolar, organizando turmas, horários e distribuição dos alunos (as);Participar do monitoramento e da avaliação dos resultados do desempenho de alunos (as);Apoiar a realização de processo seletivo de docentes, desenvolvendo instrumentos de avaliação e/ou participando de banca avaliadora;Participar das ações voltadas para a inovação, apoiando a implementação de programas de tecnologia educacional;Desenvolver projetos e propor medidas voltadas para a melhoria dos processos pedagógicos;Orientar as escolas na organização de atividades individuais e coletivas;Executar rotinas operacionais e administrativas, prestando apoio e suporte às atividades de sua área de atuação;Atender publico interno e externo, recebendo solicitações ou prestando informações;Representar a instituição em eventos ligados à sua área de atuação;Interagir com órgãos e entidades ligadas ao fomento de ações didático pedagógicas;Produzir relatórios e outros documentos analíticos, atendendo a demanda da Direção da Unidade e do Regional;Executar outras atividades compatíveis e relacionadas à função.Requisitos e qualificaçõesRequisitos da VagaEnsino Superior Completo em Letras;Formação em Libras;Possuir CNH ""B"";Disponibilidade para realizar viagens e trabalhar aos finais de semana.Conhecimentos EspecíficosDomínio da Língua Brasileira de Sinais;Libras: conceitos, definições, características, parâmetros e significados; Estrutura gramatical da Libras;Leitura e interpretação; Expressões não manuais e de sinais em seus diferentes contextos;Compreensão de significação contextual e de sinais; Técnicas de Atendimento;Informática Básica (Pacote office).Informações adicionaisNº de Identificação do Processo Seletivo: 63120162023 SENAI EAD  Etapas do processo seletivo:Etapa – Análise CurricularEtapa – Avaliação Teórica (Questões de conhecimentos gerais como português/matemática/raciocínio lógico e de conhecimentos específicos, sendo eles: Domínio da Língua Brasileira de Sinais – Libras; Libras: conceitos, definições, características, parâmetros e significados; Estrutura gramatical da Libras; Leitura e interpretação – Libras; Expressões não manuais e de sinais em seus diferentes contextos; Compreensão de significação contextual e de sinais; Composição de sinais em libras;Acesso colaborador Artefatos culturais do povo surdo; Narrativas em Libras; Libras: L1 e L2; Fraseologismo em língua de sinais e tradução; Tecnologia para surdos;)Etapa – Avaliação de Competência TécnicaEtapa – Avaliação de Potencial Informações de contratação:Local de Trabalho: Avenida Anhanguera, Setor Central, 5440, Goiânia, Goiás, Brasil, 74280-370Vaga (s): 01Carga Horária Prevista: 40h semanaisEscala de Trabalho: 08h00min às 17h00minRemuneração: 4.053,00Contrato de trabalho: Temporário por 12 meses Nossos principais benefícios:Plano de Saúde (coparticipação);Subsídio para Alimentação em Restaurantes Conveniados;Bolsa de Estudos;Vale Transporte;Seguro de Vida;Incentivos Educacionais;Descontos em Serviços prestados pelo SESI e SENAI – GO;Benefícios da associação de empregados.  *Os empregados contratados em regime horista com jornada igual ou inferior a 30 horas semanais, bem como aqueles contratado nos termos do art. 443,§3° da CLT (intermitente), não fazem jus aos benefícios de plano de saúde e bolsa de estudos e aqueles empregados contratados em regime horista com jornada inferior a25 horas, não fazem jus ao benefício de auxílio refeição. *Em se tratando de contrato de trabalho sob regime horista, a carga horária semanal prevista poderá variar por mais ou para menos conforme programação de turmas ou demandas.  Inscrições:﻿Inscrições até:  02/01/2024  Acesse nosso Regulamento de Processo Seletivo e compreenda as normas e procedimentos de seleção da nossa Instituição.",SENAI - GO,vacancy_type_temporary,2024-01-02T00:00:00.000Z,False,Goiânia,Goiás,Brasil,https://senaigo.gupy.io/job/eyJqb2JJZCI6NjMxMjAxNiwic291cmNlIjoiZ3VweV9wb3J0YWwifQ==?jobBoardSource=gupy_portal,True,on-site,True
6523115,2023-12-28T20:30:04.661Z,Analista de Departamento Pessoal.,"É uma empresa sediada em Recife, fundada em abril de 2009, com vasta experiência na administração e gestão de estacionamentos. Participa de cada projeto em regime de parceria, desde o planejamento a operação com estudos de localização, layout, mobilidade, automação, sistemas de controle e diferentes formas de concessão de vagas. Tudo isso, visando o conforto, qualidade, praticidade, segurança e cordialidade nos serviços prestados aos seus clientes.Responsabilidades e atribuiçõesAtuar como Analista de Departamento Pessoal, com experiência em Folha de Pagamento, encargos, DCTFWeb, Vale Transporte, Vale Alimentação, Admissão, Demissão, Férias, Homologação, atendimento aos funcionários, e demais atividades relacionadas ao setor.Requisitos e qualificaçõesEnsino Superior Completo em Administração, Ciências Contábeis ou Recursos Humanos.Conhecimento no sistema Alterdata será um diferencial.Informações adicionaisAssistência médicaAssistência odontológicaVale-alimentaçãoVale-transporteSalário R$2.500,00",Leve Mobilidade ,vacancy_type_effective,,False,Recife,Pernambuco,Brasil,https://levemobilidade.gupy.io/job/eyJqb2JJZCI6NjUyMzExNSwic291cmNlIjoiZ3VweV9wb3J0YWwifQ==?jobBoardSource=gupy_portal,False,on-site,True
6522952,2023-12-28T20:27:28.135Z,Analista de TI SAP Senior ,"Analista de TI SAP Sênior desempenha um papel de gestão, otimização e inovação dos sistemas SAP.Responsabilidades e atribuiçõesFormulação e implementação de estratégias para aprimorar os sistemas SAP em alinhamento com os objetivos de negócios.Participação ativa em decisões estratégicas de TI relacionadas ao SAP BasisLiderança de projetos complexos de implementação, atualização e expansão dos sistemas SAP.Análise avançada de processos de negócios, identificando oportunidades para otimização e eficiência.Implementação de soluções avançadas para melhorar o desempenho dos sistemas SAP.Resolução de problemas técnicos complexos e fornecimento de suporte avançado aos usuários SAP.Colaboração com equipes internas e fornecedores para garantir alta disponibilidade e desempenho.Auditorias regulares para assegurar a segurança e integridade dos dados.Requisitos e qualificaçõesExperiência com as atividades supracitadas;Graduação Completa em TI ou áreas correlatas;Disponibilidade para atuar presencialmente em Campinas/SP.Informações adicionaisO que oferecemos para você? ✔Vale Refeição ou Alimentação; ✔Vale Transporte;✔Assistência médica e Odontológica; ✔Convênio Farmácia (descontos na compra de medicamentos); ✔Seguro de Vida; ✔Convênio Academia;✔TIVIT Club (descontos e parcerias com as melhores lojas);✔PAC - Programa de aceleração de carreira; ✔Reembolso para certificações; ✔MOBIFLIX – Nossa academia corporativa tem cursos presenciais e online, alinhados as novas tendências do mercado de tecnologia; ✔Plataforma online de crédito consignado, a TIVIT te ajuda a realizar os seus objetivos pessoais como reforma no seu apê/casa, financiar estudos e quitar dívidas, de acordo com as regras e políticas da cia; ✔Programa de Apoio Pessoal com orientação psicológica, financeira e jurídica em parceria com a Alelo. Acreditamos que o presente é plural e a inclusão transforma, por isso, todas as pessoas são bem-vindas em nossas vagas, para promovermos um ambiente de trabalho inclusivo, de respeito, justiça e equidade. Topa embarcar nesse desafio com a gente?  #vemserTIVIT",TIVIT,vacancy_type_effective,,False,Campinas,São Paulo,Brasil,https://tivit.gupy.io/job/eyJqb2JJZCI6NjUyMjk1Miwic291cmNlIjoiZ3VweV9wb3J0YWwifQ==?jobBoardSource=gupy_portal,True,on-site,True
6522594,2023-12-28T20:26:41.061Z,Pessoa Analista de RH com foco em DP,"Aqui na Nasajon valorizamos pessoas e a qualidade de vida por meio de um ambiente de trabalho agradável e harmônico.Buscamos os melhores talentos, dispostos a vestir a camisa, direcionados pelos nossos valores e comprometidos com a qualidade de tudo que fazem e que esteja sempre em busca de novos conhecimentos técnicos.Responsabilidades e atribuiçõesConhecimento de toda a rotina e manutenção de fechamento de folha de pagamento;Conhecimento da legislação trabalhista;Capacidade analítica para geração e análise de relatórios;Controle período aquisitivo de férias por funcionário;Negociação e administração de benefícios (VT, VA, VR, Plano de saúde e odontológico, Seguro de vida, Seguro funerário...);Prestar atendimento e suporte a clientes internos;Requisitos e qualificaçõesDomínio do sistema de processamento de folha de pagamento, preferencialmente Nasajon;Boa relação interpessoal e facilidade na comunicação;Domínio do pacote Office (Word, Excel...);Superior Completo ou em andamento em Administração, Gestão em RH e Ciências Contábeis;Desejável experiência em empresas de terceirização de folha de pagamento ou tecnologia.Informações adicionaisPossuir estrutura completa (mobiliário e equipamentos) para trabalhar home - office.",Nasajon,vacancy_type_effective,,True,,,Brasil,https://nasajon.gupy.io/job/eyJqb2JJZCI6NjUyMjU5NCwic291cmNlIjoiZ3VweV9wb3J0YWwifQ==?jobBoardSource=gupy_portal,True,remote,True
