job_id,published_date,title,description,career_page_name,type,application_deadline,is_remote_work,city,state,country,job_url,disabilities,workplace_type,submitted
6098122,2023-11-29T20:06:33.130Z,Analista Financeiro,"A Geopixel está com vaga aberta para Analista Financeiro.Se você possui conhecimento em contas a receber, faturamento e fechamento mensal, venha fazer parte no nosso time!! #vempraGEOResponsabilidades e atribuiçõesCONTAS A RECEBERFollow up de inadimplentes;Relacionamento com clientes. FATURAMENTOEmissão de notas fiscais de Serviço e DANFE via ERP financeiro;Envio de Notas Fiscais aos Clientes;Follow up dos faturamentos e recebimentos;Atualização de controle de faturamento;Atualização de previsão de impostos sobre a receita/ faturamento;Conferência das guias de impostos sobre faturamento.Lançamento e acompanhamento de cronogramas de projetos; FECHAMENTO MENSAL FISCALRelacionamento com escritório contábil para fechamento mensal contábil e fiscal;Preparação da projeção de impostos;Acompanhamento as demandas do escritório externo de contabilidade.Suporte ao Contas a Pagar e Tesouraria.Requisitos e qualificaçõesSuperior Completo em áreas de Ciências Econômicas, Ciências Contábeis, Administração de Empresas e/ ou Experiência comprovada na área.Conhecimentos Desejáveis:Conhecimento/ experiência com emissão de NFS-e e NF-e;Conhecimento intermediário em MS Office principalmente Excel (tabelas, fórmulas, formatação);Conhecimentos gerais de contabilidade e fiscal;Noções para fechamento de câmbio e recebimento de remessas do exterior;Conhecimento sobre tributação e conferências das notas fiscais;Apoio no acompanhamento e instrução técnica aos membros da equipe;Conhecimento em ERP.Informações adicionaisPlano de Saúde Unimed Regional (100% custeado pela empresa). O atendimento Regional contempla as cidades do Vale do Paraíba e Litoral Norte e o atendimento Nacional para Urgência e Emergência pelo Sistema Unimed;Convênio odontológico SulAmérica (opcional);Cartão Flash flexível para ser utilizado como VR e VA;VT em cartão de transporte público (opcional);Cooperativa de crédito Sicoob;Seguro de vida em grupo;Day-off no mês de aniversário;Ginástica laboral 2x por semana (presencial e on line);Parceria com as farmácias do Grupo Farmaconde e desconto em folha;Parceria com SESC (utilização das sedes e descontos em eventos);Parceria com psicóloga (valor social);Parceria com agência de turismo (descontos em pacotes de viagens);Parceria com Empório Nestlé (descontos na loja física em Caçapava);Parceria com UNIVAP (descontos nos colégios de educação básica e cursos superiores);O local da empresa dispõe de estacionamento e segurança 24horas. ",Geopixel,vacancy_type_effective,,False,São José dos Campos,São Paulo,Brasil,https://geopixel.gupy.io/job/eyJqb2JJZCI6NjA5ODEyMiwic291cmNlIjoiZ3VweV9wb3J0YWwifQ==?jobBoardSource=gupy_portal,True,on-site,True
6098116,2023-11-29T19:57:40.174Z,Analista Forças de Vendas Sênior,"Somos uma empresa de materiais de construção e soluções sustentáveis. Temos um time que faz, que acredita e que constrói. Sempre juntos e com excelência, para chegarmos cada vez mais longe. Acreditamos que cada pessoa é única e aqui todos são tratados com equidade. Todos os dias, temos a chance de realizar algo novo e você pode fazer parte disso. #VemSerVCResponsabilidades e atribuiçõesSuporte e tomadas de decisões táticas: Definir ações táticas para direcionar a força de vendas de todo BR com objetivo de cumprir a estratégia e maximizar os resultados. Responsável pelo planejamento e gestão da roteirização diária da força de vendas; Criação de visões de georreferenciamento auxiliar na tomada de decisão;Visão estratégica: Através de uma visão sistêmica de todas as iniciativas comerciais, realizar estudos e recomendações de alocação da força de vendas, distribuição de clientes por tipo de vendedor. Construção e gestão do backlog de melhorias processuais e sistêmicas;Gestão da efetividade da força de vendas: Monitorar efetividade do cumprimento dos direcionamentos, aderência à roteirização; Realizar análises prescritivas e preditivas através da correlação dos diferentes indicadores; Construir e monitorar ações táticas para garantir o cumprimento do plano estratégico;Relacionamento com o time comercial: Através de análises de dados e georreferenciamento, definir as priorizações das rotas em conjunto com todo time comercial da VC, além da condução de discussões estratégicas em diversos níveis dentro da companhia (do nível operacional até a C-level).Principais Responsabilidades:- Responsável pela gestão do processo de roteirização da força de vendas Brasil, garantindo o direcionamento dos vendedores conforme estratégia da trilha e otimizando as rotas através da ferramenta de Roteirização, de forma a maximizar os resultados financeiros da companhia;- Realizar análises e gerar recomendações de dimensionamento da força de vendas, alocação ótima de vendedores e redistribuição otimizada de carteiras;- Assegurar no planejamento a priorização dos clientes a serem visitados conforme critérios estabelecidos através das análises avançadas de dados e georreferenciamento em conjunto com as regras do negócio;- Utilização e domínio da ferramenta de roteirização para gerar rotas presenciais e remotas otimizadas a serem seguidas pela força de vendas, além da execução do processo de priorização dos clientes conforme KPIs estratégicos;- Tratativa com o time comercial para discussão dos planejamentos, acompanhamento dos resultados, saneamento de coordenadas geográficas e melhoria contínua, buscando evoluir em execução comercial;- Responsável pela gestão das carteiras dos vendedores, monitoramento dos KPIs de roteirização e condução de análises de distribuição por georreferenciamento;- Desenvolvimento de dashboards e KPIs de acompanhamento da qualidade dos planejamentos gerados.- Atenderá as Regionais Sul e Sudeste.Requisitos e qualificaçõesFormação necessária:Superior completo em Administração de Empresas, Engenharia, Estatística ou compatível.Conhecimentos técnicos:- Conhecimentos em Excel (Nível Avançado).- Conhecimento intermediário de estatística (correlações, regressão linear, testes A/B, etc)Informações adicionaisValorizamos todas as formas de diversidade e encorajamos você a conhecer melhor essa oportunidade abaixo. Candidate-se para a vaga, e nos mostre a sua história e potencial. Se você sentir aquele frio na barriga é um ótimo sinal, pois esse pode ser o primeiro passo da nossa história!",Votorantim Cimentos,vacancy_type_effective,2023-12-07T00:00:00.000Z,False,São Paulo,São Paulo,Brasil,https://votorantimcimentos.gupy.io/job/eyJqb2JJZCI6NjA5ODExNiwic291cmNlIjoiZ3VweV9wb3J0YWwifQ==?jobBoardSource=gupy_portal,True,hybrid,True
6095212,2023-11-29T19:54:42.961Z,ANALISTA REDES SR,"Somos a maior multinacional brasileira e estamos entre as 100 maiores empresas de TI do mundo.Estamos presentes em 41 países com +30k colaboradores. A Stefanini tem como principal objetivo auxiliar os clientes a encontrar, por meio de soluções personalizadas, a maneira ideal para alcançar seus desafios, impulsionando a inovação digital.E queremos mais!Requisitos e qualificaçõesHabilidades avancadas (especialista) em engenharia de rede de dados e radio frequencia e conhecimento avancado de produtos e solucoes.Conhecimento para projetar e gerenciar redes sem fio e tomar decisoes em situacoes criticas de negocios. Conhecimento solido das tecnologias de voz: telefonia analogica, Link Digital E1, call center, canal de voz, URA, 0800, linhas analogicas. Conhecimento e experiencia avancada necessaria para ser um membro da equipe de arquitetura de rede envolvendo solucoes de voz e video. Conhecimento e habilidades para implementar, manter e apoiar solucoes abrangentes de seguranca da informacao para as redes, usando as melhores e mais recentes praticas do setor e as melhores tecnologias. Monitores, sites e componentes de infraestrutura de desempenho, a fim de detectar desvios no ambiente e evitar a indisponibilidade, registrar falhas de ocorrencia e acompanhar a resolucao de incidentes. Profissional com experiencia comprovada maior que 10 anos em monitoramento de ambientes de tecnologiaHabilidade e conhecimento em Tecnologia Rajant, Redes Moveis (LTE, 5G, EPC, Sinalizacao, produtos eNodeB, MME, SGW/PGW), Hirschmann, Radwin e Sistemas de Transmissao (SDH, MPLS, DWDM)Conhecimento avancado em protocolos de monitoramento rede.Habilidade e conhecimento avancado em Zabbix, Grafana, Ansible e ELK.Habilidade e conhecimento avancado de sistema operacional Linux HeadRat Enterprise.Habilidade e conhecimento avancado em Banco de Dados MySQL, PostgreSQL, Oracle e MongoDB.Habilidade e conhecimento avancado em linguagem de programacao Python, Perl e shell scripts.Habilidade e conhecimento avancado em seguranca de ambientes de servidores em rede.Habilidade e conhecimento avancado em Cloud AWS, Azure e GCP.Ingles Avancado ou Fluente. Nivel desejavel de experiencia como especialista: Alto.2. Grau CompletoTempo de ExperiAancia: 1 anos e 0 meses.Informações adicionaisO que te oferecemos:🍛 Vale Alimentação ou Vale Refeição;👨🏼‍🎓 Desconto em cursos, universidades e instituições de idiomas; 📚 Academia Stefanini - plataforma com cursos online, gratuitos, atualizados e com certificado; 🗣 Mentoring;🏫 Auxílio Creche; 💉 Clube de vantagens para consultas e exames;🏥 Assistência Médica;🦷Assistência Odontológica; 💰 Clube de vantagens e descontos nos melhores estabelecimentos;👂🏾 Atendimento psicológico online ao colaborador e seus dependentes;🛫 Clube de viagens;🐶 Convênio para Pet;e muito mais...",Stefanini Group,vacancy_type_effective,,False,Linhares,Espírito Santo,Brasil,https://stefanini.gupy.io/job/eyJqb2JJZCI6NjA5NTIxMiwic291cmNlIjoiZ3VweV9wb3J0YWwifQ==?jobBoardSource=gupy_portal,True,on-site,True
6014007,2023-11-29T19:53:55.311Z,Analista Fiscal Pleno,"O timaço Conquer é composto por profissionais que desde o primeiro momento foram escolhidos a dedo! Todos com o mesmo sonho, que é revolucionar a educação formando os profissionais que fazem a diferença no país. E sabe como isso é possível? Vivenciando nossos valores dia a dia: Com autorresponsabilidade, tamo junto e inovação, constantemente. ✨Oferecemos um ambiente completamente colaborativo (aqui é #tamojunto mesmo) e com muitos desafios, o que promove um aprendizado e crescimento contínuo. #LonglifeLearningPor aqui, valorizamos muito todos os perfis e nossas oportunidades são para todos. Buscamos profissionais que realmente queiram fazer acontecer, proporcionando sempre a melhor experiência aos nossos alunos! 💛Responsabilidades e atribuiçõesJob description:Os conquers têm muita liberdade para propor e desenvolver projetos inovadores, com autonomia e protagonismo, em um ambiente de colaboração e criatividade. Aqui, o propósito, a vontade de aprender e a mão na massa fazem toda a diferença.Seu dia típico de trabalho incluirá:Verificar documentos fiscais, assegurando sua conformidade legal;Efetuar o registro preciso de todas as transações fiscais de entrada;Classificar corretamente as transações para os rateios e centros de custos;Realizar lançamentos contábeis relacionados às entradas, sabendo distinguir custo e despesa;Validações de integrações realizadas pelo sistema; Apuração de PIS e COFINS dos regimes cumulativo e não cumulativo; Apuração de ISS s/ faturamento;Apuração dos impostos retidos (PIS/COFINS/CSLL, IRRF e INSS);Apuração dos impostos diretos (IRPJ e CSLL);Apuração dos impostos a recolher sobre invoceis (entradas e saídas);Emissão das guias dos impostos para recolhimento;Elaboração de obrigações acessórias como ECF, SPED Contribuições, SPED Fiscal, DCTF, DCTF Web, Reinf, DIRF e declarações municipais; Escrituração de créditos extemporâneos;Compensação de impostos via Perdcomp;Conciliação dos impostos na contabilidade;Atendimento à auditoria externa (tax);Estabelecer e manter comunicação eficaz com o financeiro, a fim de garantir junto aos fornecedores soluções das discrepâncias dos documentos fiscais;Manter-se atualizado sobre as mudanças nas leis fiscais e garantir a conformidade da empresa;Trabalhar em estreita colaboração com outros departamentos, para garantir a exatidão das informações;Acompanhar o cronograma de fechamento fiscal mensal.Requisitos e qualificaçõesO que você precisa ter:Competências técnicas:Ensino superior completo ou cursando em Ciências Contábeis;Imprescindível conhecimento intermediário em Excel;Habilidade de utilizar sistemas ERP;Conhecimento intermediário no Pacote Office;Conhecimento nos validadores da Receita Federal;Experiência prévia em rotinas fiscais;Experiência em atendimento à auditoria externa;Conhecimento em ERP Sênior será considerado diferencial. Competências comportamentais:Senso de reponsabilidade e urgência;Proatividade;Atenção aos detalhes e habilidades analíticas;Trabalho em equipe;Planejamento e organização;Relacionamento interpessoal.Informações adicionaisO que você pode esperar de nós:Autonomia para realizar seu trabalho e atingir resultados, colaboração entre times, crescimento acelerado e a possibilidade de impactar a vida de muitas pessoas através da educação. Nosso plano de carreira está atrelado ao seu desempenho e para auxiliar nesse processo, temos uma cultura de feedback.Além disso é claro, oferecemos:Vai rolar aquele date presencial com a equipe?! Então vamos de Vale-transporte para garantir a decolagem. 🚀Saúde é #paposério, então bora se cuidar. E para isso, oferecemos: Plano de Saúde (com inclusão de dependentes e coparticipação). 🩺👨‍⚕️Plano Odontológico para deixar esse sorrisão ainda mais bonito. 😁🪥E o que não pode ficar de fora?! A nossa saúde mental e para isso nós temos um plano com a Vittude para você manter a terapia em dia. 🗣️💛Calma! Ainda não acabou! Sabe aquela vida fitness?! Está garantida, pois temos Gympass para você se movimentar no dia a dia. ‍️🤸‍♂️🏋️‍♂️Alguém disse Seguro de Vida?! Sim, nós temos!Além de muitas outras vantagens como:Em ritmo de festa, no mês do seu aniversário você tem direito a um Day Off, bom demais né?! 🥳Conhece o SESC?! Sim, temos convênio com o SESC! Tem muita coisa legal para você aproveitar! Bora de #spoiler?! Viagens com custos acessíveis, participação em eventos culturais, uso de instalações esportivas, academias e demais formas de lazer, e muito mais.Precisa comprar aquele remédio urgente?! #nãoesquenta, pois temos Convênio Farmácia.Quer assistir aquele filme que acabou de lançar no cinema?! A Conquer tem uma super parceria com o Cinemark. 🎥Desenvolvimento é com a gente! Os conquers têm bolsa integral no Conquer Plus (nossa plataforma de streaming) e 50% de desconto em cursos ao vivo. 💻📗Sem contar os Treinamentos e Workshops que rolam internamente por aqui.Valorizamos demais a pluralidade, em todos os seus aspectos, trabalhamos com a convicção de que ela nos possibilita criar vínculos com pessoas incríveis, tornando assim nosso dia a dia Conquer ainda melhor. Queremos estabelecer conexões duradouras independentemente das diferenças.Você também compartilha desse ideal? Nossas vagas estão abertas para todas as pessoas, sempre dando espaço a diversidade e inclusão. Queremos te conhecer! Então se candidata aí! 💛🤘",Conquer Business School,vacancy_type_effective,,True,,,Brasil,https://conquer.gupy.io/job/eyJqb2JJZCI6NjAxNDAwNywic291cmNlIjoiZ3VweV9wb3J0YWwifQ==?jobBoardSource=gupy_portal,True,remote,True
6076500,2023-11-29T19:52:23.880Z,Analista de Abastecimento Pleno (Temporário),"Em Supply Chain você vai encontrar pessoas flexíveis, inovadoras e dinâmicas. Essa área faz a integração eficaz de todos os membros e processos da cadeia de suprimentos, sendo composta pelos setores de Gestão de Abastecimento, Operações Logísticas e Planejamento Logístico. Tem interesse em atuar conosco nesse ecossistema? Então, #EscolhaGPA e venha fazer parte desse time!Responsabilidades e atribuiçõesResponsável pelo Fluxo Diário de Abastecimento das LojasResponsável pelas Dinâmicas de Abastecimento de Oferta e SazonalidadeAcompanhar e atuar sobre os Níveis de Estoque e Ruptura nas Lojas e CDsResponsável pelo auxilio e execução das parametrizações das lojasFazer a interface entre logística e a unidade de negócio drogaria (Operações e comercial)Auxiliar na elaboração de relatórios para indicadoresRequisitos e qualificaçõesSuperior CompletoPós-graduação desejávelPacote officeInformações adicionaisSalário compatível com o mercadoPLRAssistência médica e odontologiaVale refeiçãoVale transportePrevidência PrivadaGympassParceria com universidade e escola de línguasDescontos em produtosCooperativa de crédito (crédito consignado com taxas mais baixas)",GPA,vacancy_type_effective,2023-12-18T00:00:00.000Z,False,São Paulo,São Paulo,Brasil,https://corporacaogpa.gupy.io/job/eyJqb2JJZCI6NjA3NjUwMCwic291cmNlIjoiZ3VweV9wb3J0YWwifQ==?jobBoardSource=gupy_portal,False,hybrid,True
6097320,2023-11-29T19:52:22.856Z,Pessoa Analista de Projetos Pleno,"Aqui na Agrotools é assim…A cada dia, um novo desafio surge, um novo projeto inovador começa.Somos ousados para buscar superar nossos objetivos e crescer exponencialmente.Entregamos resultados de excelência, comprometidos em atingir um crescimento sustentável e rentável.Nós acertamos e erramos como equipe e crescemos com a empresa.Assumimos riscos, valorizamos a experimentação e incentivamos fazer coisas que nunca foram feitas antes.Adaptação e aprendizado contínuo é como vamos sobreviver e prosperar juntos.Caminhamos unidos na mesma direção para alcançar nosso propósito.Sabemos que a força da Agrotools está na experiência e conhecimento de cada Agrotooler de forma combinada e que nossos melhores resultados são produzidos quando atuamos de forma integrada e colaborativa.Aqui você vai ser quem você é... Afinal, nossa gente é o que nos torna únicos!Na Agrotools nós sonhamos grande! Junte-se a nós para construir e fazer parte dessa história! #VenhaSerUmAgrotoolerResponsabilidades e atribuiçõesRealizar atividades da área, prestando suporte a equipe e atendimento aos clientes;Manter os cronogramas de projetos atualizados em relação ao prazo, custo, qualidade, documentação envolvida e demais itens pertinentes;Levantar indicadores relacionados a prazos, custos, qualidade e documentação dos projetos em geral, bem como compará-los a dados de demais projetos em andamento;Monitorar o projeto através de indicadores, acompanhando e garantindo o atendimento deste contrato;Apoiar na análise, elaboração e manutenção da documentação e dos manuais de procedimentos de projetos; Trabalhar junto às equipes técnicas, no gerenciamento de projetos através de aplicação de conhecimentos e técnicas na elaboração de atividades relacionadas para atingir um conjunto de objetivos pré-definidos otimizando recursos;Atuar e conduzir reuniões com clientes.Requisitos e qualificaçõesResidir em São José dos Campos, São Paulo ou região;Graduação completa - Engenharias: Zootecnia, Ambiental, Agronomia e áreas correlacionadas;Experiência em atendimento a clientes em diferentes níveis de hierarquia acima de 3 anos;Inglês intermediário ou avançado;Entendimento de metodologias ágeis e gestão de projetos.         Desejável:Espanhol;Excel avançado; Conhecimento em Power BI;Atuação ou experiência anterior em ESG;Conhecimento no segmento do Agronegócio; Informações adicionaisQueremos que sua história na Agrotools seja marcada por experiências únicas. Aqui o nosso regime de contratação é pela CLT, onde nos encontramos no modelo hibrido em São José dos Campos/São Paulo!E preparamos um conjunto de benefícios para você! Confira o que oferecemos para sua saúde ficar em dia e o bem-estar lá em cima!🩺Saúde é o que interessa e priorizamos a sua! Pensando nisso, oferecemos o convênio médico Bradesco Saúde, com cobertura nacional;🦷 E como sabemos que a vida fica mais alegre com sorrisos, você também pode ter o convênio odontológico Bradesco Dental;🙏🏻Queremos estar sempre por perto, dando suporte até em momentos mais desafiadores. Conte com seguro de vida e assistência funeral;🏋🏻‍♀️Para o seu bem-estar ser completo, escolha aquela atividade que mais te deixa feliz no Gympass.Alimentação ou refeição? Você divide como quiser!😋 Temos o Cartão Flash, para você decidir onde e como usar. Seja alimentação ou refeição, no seu mercado preferido ou naquele restaurante especial.Vem decolar com a Agrotools!🚀 Seja o protagonista da sua jornada profissional! Oferecemos oportunidades integradas a um plano de carreira que identifica seus talentos e destaca o melhor que há em você;🎓 Queremos seu desenvolvimento a todo vapor. Por isso, temos parceria com instituições de ensino.De conforto nós entendemos!💻 Aquela área de trabalho remoto bem equipada fica por nossa conta. Enviamos para você notebook, mouse, mousepad e fone de ouvido; ✌🏻 Alô, descansinho! Todo esforço deve ser recompensado, não é? Por isso, nós trabalhamos com banco de horas a cada 6 meses, de modo flexível e acordado;🏡 Também tem auxílio home office mensal de R$ 100 esperando por você.👶🏻 Hey, papais!! Não se preocupa com a logística da creche, a gente tá aqui pra ajudar, oferecemos um auxilio creche no valor de R$ 250;🎈 Quem quer se preocupar com compromissos quando pode estar celebrando a própria existência, né? Que tal pegar um dia útil do mês de seu aniversário e curtir com zero responsabilidades;👊🏼É aquilo né, gente boa só conhece gente boa! Então, bora indicar quem você conhece? Além de indicar novos talentos para uma AgTech, você ainda ganha R$400,00.",AGROTOOLS,vacancy_type_effective,,False,São Paulo,São Paulo,Brasil,https://agrotools.gupy.io/job/eyJqb2JJZCI6NjA5NzMyMCwic291cmNlIjoiZ3VweV9wb3J0YWwifQ==?jobBoardSource=gupy_portal,False,hybrid,True
6098073,2023-11-29T19:50:54.415Z,Analista de Rádio Frequência,"Eiii! Você acha que sempre tem um jeito diferente e melhor para fazer as coisas? Vem inovar e se transformar aqui no nosso Mundo Azul!A pessoa que procuramos é aquela engajada com inovação, que contribuirá para a construção de nosso futuro.Esta e as demais vagas anunciadas estão disponíveis para PcD ♿Responsabilidades e atribuiçõesAcompanhar e validar a documentação pertinente à implantação de rede móvel como projeto preliminar (PPI) e a autorização de ocupação (RFI);Definição e ajuste de modelos de propagação, análise, roll-out, otimização, resolução de problemas;                                                                         Realizar levantamentos de campo, quando necessário;Coordenação de atividades de implantação de rede móvel. Elaborar metodologias de processo de coleta de medições e validação de dados práticos de campo (drive test), incluindo geração e análise de relatórios de conformidade;Análise, monitoramento e otimização de KPI’s visando incremento de performance física e lógica da rede móvel;Contato com torreiras.Requisitos e qualificaçõesHabilidades:Flexibilidade e adaptabilidade aos negócios, às pessoas e aos processos; Boa comunicação;Senso de inovação;Experiência em planejamento;Noções de Rádio Frequência;Pacote Office;Inglês.Formação:Ensino Superior Completo em Engenharia Elétrica e/ou Telecomunicações.Requisito: Possuir CNH.Diferencial: Experiência em Planet | RF Planning and Optimization Software.Informações adicionaisHorário de trabalho: 08h às 12h e das 13h12 às 18h de Segunda a Sexta-feira.Oportunidade para trabalhar presencialmente, na cidade de Timbó/SC.",Unifique Telecomunicações,vacancy_type_effective,,False,Timbó,Santa Catarina,Brasil,https://vemserunifique.gupy.io/job/eyJqb2JJZCI6NjA5ODA3Mywic291cmNlIjoiZ3VweV9wb3J0YWwifQ==?jobBoardSource=gupy_portal,True,on-site,True
