job_id,published_date,title,description,career_page_name,type,application_deadline,is_remote_work,city,state,country,job_url,disabilities,workplace_type,submitted
6509754,2023-12-27T13:18:07.366Z,Analista de Suporte,"Se você gosta de desafios e tem vontade de trabalhar em uma empresa com uma cultura forte e em constante crescimento, a qual você terá oportunidade de desenvolver novas ideias, novas metodologias e com o máximo de autonomia, a Trixlog é para você!Estamos buscando uma pessoa para nos apoiar neste crescimento, desempenhando o papel de Técnico de Apoio ao Usuário.E ai‌, topa fazer parte desse time?Responsabilidades e atribuiçõesComo Técnico de Apoio ao Usuário, você será responsável por:Classificar, monitorar, analisar e solucionar os chamados informando aos usuários o status dos chamados;Avaliar e gerar estatísticas dos atendimentos;Encaminhar para o time de Produto, os incidentes ou requisições que se enquadram em tal classificação;Registrar na base de conhecimento os procedimentos/soluções de contorno ou definitivas; utilizadas em atendimentos concluídos e que não constam na base de conhecimento;Realizar contatos com os usuários sobre os chamados abertos a fim de obter detalhes sobre o problema;Registrar no sistema Jira todo e qualquer andamento, observação relevante, informação fornecida pelo usuário ou outras equipes, referentes aos chamados;Requisitos e qualificaçõesHabilidades desejadas:● Conhecimento intermediário em Excel;● Experiência em trabalhar diretamente com os clientes;● Pensamento estratégico.Diferenciais (gostaríamos, mas não são um pré-requisito):● Ter trabalhado com produto de tecnologia;● Experiência com software com alta complexidade;● Conhecimento na plataforma Jira.Informações adicionaisBenefícios Da EmpresaCultura que valoriza o 1:1 feedback e a autonomiaOs melhores planos de saúde com subsídio de até 50%.Benefício Flexível (Vale refeição / Vale alimentação)Day Off – folga no AniversárioDesconto em planos odontológicosDesconto na academia Central do Corpo DunasDesconto nas barracas de praia América do Sol e Terra do Sol (Fortaleza-CE)",Trixlog,vacancy_type_effective,,False,Fortaleza,Ceará,Brasil,https://trixlog.gupy.io/job/eyJqb2JJZCI6NjUwOTc1NCwic291cmNlIjoiZ3VweV9wb3J0YWwifQ==?jobBoardSource=gupy_portal,False,on-site,True
6513547,2023-12-27T13:15:50.964Z,ANALISTA DE BENEFICIOS - TEMPORARIA ,"Programa de Atenção Integral à Saúde (PAIS) e Educação - são gerenciadas por profissionais de alta capacitação técnica e notável saber.Assim, a SPDM contribui de forma efetiva para a melhoria contínua dos serviços prestados pelo Sistema Único de Saúde do Brasil, visando principalmente garantir a universalidade e as oportunidades de acesso à saúde, necessárias ao desenvolvimento humano e social do cidadão. Para tanto, associa o melhor da tecnologia com atendimento médico de alta qualidade, respaldado por equipes multiprofissionais, formadas por enfermeiros, fisioterapeutas, farmacêuticos, nutricionistas, fonoaudiólogos, bioquímicos, psicólogos, tecnólogos, assistentes sociais e dentistas, entre outros.O Programa de Atenção Integral à Saúde iniciou suas atividades no ano de 2001 no município de São Paulo, se estendendo para outros municípios e estados. Desde o início de suas atividades, o PAIS busca, em parceria com a gestão pública, o crescimento e a consolidação dos serviços de saúde ofertados aos usuários do SUS.Responsabilidades e atribuiçõesAnalisar as rotinas gerais de movimentações de benefícios tais como inclusão, exclusão, alteração;Analisar pedidos de benefícios, bem como lançá-los em Sistema;Analisar e responder a prestação de contas, bem como rateios referentes aos custos de benefícios disponibilizados aos funcionários;Manter atualizados os controles e lançamentos em folha de pagamento referente aos benefícios, tais como descontos e rateios contábeis;Realizar solicitação de pedidos de benefícios, conferência e fechamento; Analisar e providenciar pagamentos e rateios dos benefícios mensalmente;Confeccionar e analisar relatórios e demonstrativos de indicadores;Efetuar cálculos proporcionais de valores dos benefícios para desconto em rescisão;Manter atualizados os valores dos benefícios mediante acompanhamento do reajuste anual de acordo com a Convenção Coletiva de Trabalho, e atualizações de fornecedores;Realizar atendimento e suporte aos empregados com orientações de benefícios;Realizar o controle benefícios de empregados afastados e demitidos, bem como articular com as Áreas de referência; Realizar as atividades das áreas/setores, seguindo as determinações do Gestor imediato e padronizações da Instituição.  Requisitos e qualificaçõesEnsino Superior Completo em Administração de Empresas, Recursos Humanos e áreas afins;Pós-graduação cursando em Recursos Humanos ou áreas afins;Experiência em rotinas da Área de Benefícios considerando todos os processos;Pacote Office Completo, desejável conhecimento em RM Labore Excel Intermediário. Informações adicionaisLocal de trabalho próximo a estação do metrô VergueiroTrabalho 100% presencial",SPDM/PAIS,vacancy_type_temporary,,False,São Paulo,São Paulo,Brasil,https://spdmpais.gupy.io/job/eyJqb2JJZCI6NjUxMzU0Nywic291cmNlIjoiZ3VweV9wb3J0YWwifQ==?jobBoardSource=gupy_portal,True,on-site,True
6511493,2023-12-27T13:14:36.599Z,Analista de Cultura I – Auxiliar de Biblioteca - Freguesia do Ó - SP,"Se você se identifica com as áreas da educação, cultura, esporte e terceiro-setor, confira as vagas abertas para fazer parte do time do Instituto Baccarelli.Responsabilidades e atribuiçõesAcolher, orientar e estimular o público para utilização da biblioteca e seu acervo;Auxiliar na realização de pesquisas bibliográficas;Organizar o acervo da biblioteca; Atender as necessidades informacionais do público que utiliza a biblioteca; Realizar cadastramento de usuários; Executar inventário anual do acervo;Realizar empréstimos e monitoramento por meio do Sistema Integrado de Acervos;Registrar e documentar todas as atividades realizadas na biblioteca; Desenvolver as atividades de ação cultural, orientação e mediação de leitura;Colaborar com o plano de trabalho e com sugestões de atividades culturais; Zelar pelo acervo e espaço da Biblioteca.Requisitos e qualificaçõesO que você precisa ter: Ensino Médio Completo;Experiência comprovada na área de Biblioteconomia ou na área de Arte Educação ou na área Cultural;Curso Técnico em Biblioteconomia será considerado um diferencial;Conhecimento em Informática (pacote Office).Seria bom se tiver : Residir próximo aos CEUs sob a gestão do Instituto Baccarelli Conhecimento em softwares de gestão bibliotecária, em especial o Alexandria do Sistema Integrado de Acervos da Secretaria Municipal de Educação.Informações adicionaisConheça nossos benefícios: Vale transporte;Vale alimentaçãoVale refeição;Day off de Aniversário; ﻿Competências desejáveis:Comunicação interpessoal (atendimento ao público);Adaptabilidade; Pro atividade;Criatividade;Trabalho em equipe;Organização e comprometimento.",INSTITUTO BACCARELLI ,vacancy_type_effective,,False,São Paulo,São Paulo,Brasil,https://institutobaccarelli.gupy.io/job/eyJqb2JJZCI6NjUxMTQ5Mywic291cmNlIjoiZ3VweV9wb3J0YWwifQ==?jobBoardSource=gupy_portal,False,on-site,True
6508310,2023-12-27T13:13:54.815Z,Analista de Cultura III - Bibliotecário - Parque Novo Mundo - São Paulo - SP,"Se você se identifica com as áreas da educação, cultura, esporte e terceiro-setor, confira as vagas abertas para fazer parte do time do Instituto Baccarelli.Responsabilidades e atribuições Organizar e realizar o preparo técnico do acervo da biblioteca (classificação e catalogação);Atender as necessidades informacionais do público que utiliza a Biblioteca; Realizar cadastramento de usuários; Realizar empréstimos e monitoramento por meio do Sistema Integrado de Acervos; Executar inventário anual do acervo; Registrar e documentar todas as atividades realizadas na biblioteca; Desenvolver as atividades de ação cultural, orientação e mediação de leitura; Colaborar com o plano de trabalho e com sugestões de atividades culturais;Zelar pelo acervo e espaço da Biblioteca;Orientar e supervisionar a manutenção, preservação, recuperação e atualização dos diferentes tipos de acervos das bibliotecas dos CEUs e dos Polos da UniCEU;Planejar e organizar o espaço da biblioteca, de acordo com os princípios da Biblioteconomia, harmonizados às características das bibliotecas dos CEUs.Requisitos e qualificaçõesO que você precisa ter: Graduação em Biblioteconomia; Registro ativo no Conselho Regional de Biblioteconomia - CRB 8a. Região; Conhecimento em Informática (pacote Office);Conhecimento em softwares de gestão bibliotecária, em especial o Alexandria do Sistema Integrado de Acervos da SME (diferencial);Habilidades com planilhas e domínio de Excel Experiência com processos técnicos e administrativos da rotina de uma biblioteca.Seria bom se tiver : Experiência em biblioteca escolar/universitária e/ou pública; Especialização em áreas correlatas.Informações adicionaisConheça nossos benefícios: Vale transporte;Vale alimentaçãoVale refeição;Day off de Aniversário;﻿Competências desejáveis:Inovação e Flexibilidade;Adaptabilidade;Proatividade;Criatividade;Liderança e Trabalho em equipe;Organização e Comprometimento.",INSTITUTO BACCARELLI ,vacancy_type_effective,,False,São Paulo,São Paulo,Brasil,https://institutobaccarelli.gupy.io/job/eyJqb2JJZCI6NjUwODMxMCwic291cmNlIjoiZ3VweV9wb3J0YWwifQ==?jobBoardSource=gupy_portal,False,on-site,True
6511545,2023-12-27T13:12:42.245Z,Analista de Cultura I – Auxiliar de Biblioteca (BEBETECA)  - CEU Freguesia do Ó,"Se você se identifica com as áreas da educação, cultura, esporte e terceiro-setor, confira as vagas abertas para fazer parte do time do Instituto Baccarelli.Responsabilidades e atribuiçõesAcolher, orientar e estimular o público para utilização da Bebeteca, Biblioteca e seu acervo;Desenvolver as atividades de ação cultural, orientação e mediação de leitura ao público da Bebeteca e Biblioteca;Organizar o acervo da biblioteca; Atender as necessidades informacionais do público que utiliza os espaços; Realizar cadastramento de usuários;Realizar empréstimos e monitoramento por meio do Sistema Integrado de Acervos;Registrar e documentar todas as atividades realizadas na biblioteca; Colaborar com o plano de trabalho e com sugestões de atividades culturais; Zelar pelo acervo e espaço da Biblioteca.Requisitos e qualificaçõesO que você precisa ter: Ensino Médio Completo;Experiência comprovada na área de Biblioteconomia ou na área de Arte Educação ou na área Cultural;Conhecimentos em atividades com primeira infância será considerado um diferencial;Curso Técnico em Biblioteconomia será considerado um diferencial;Conhecimento em Informática (pacote Office).Seria bom se tiver : Residir próximo aos CEUs sob a gestão do Instituto Baccarelli;Conhecimentos em atividades arte-educativas com primeira infância; Conhecimento em softwares de gestão bibliotecária, em especial o Alexandria do Sistema Integrado de Acervos da Secretaria Municipal de Educação.Informações adicionaisConheça nossos benefícios: Vale transporte;Vale alimentaçãoVale refeição;Day off de Aniversário; ﻿Competências desejáveis:Comunicação interpessoal (atendimento ao público);Adaptabilidade; Pro atividade;Criatividade;Trabalho em equipe;Organização e comprometimento.",INSTITUTO BACCARELLI ,vacancy_type_effective,,False,São Paulo,São Paulo,Brasil,https://institutobaccarelli.gupy.io/job/eyJqb2JJZCI6NjUxMTU0NSwic291cmNlIjoiZ3VweV9wb3J0YWwifQ==?jobBoardSource=gupy_portal,True,on-site,True
6508734,2023-12-27T13:11:01.914Z,Analista Fiscal Junior,"A Indigo é uma multinacional francesa, líder mundial em gestão de estacionamentos e mobilidade individual.Esta vaga é para atuar no nosso time fiscal de São Paulo ou Porto Alegre, em regime híbrido, como analista júnior.Estamos procurando um Analista de Faturamento e Recebimento fiscal para realizar operações em nosso departamento de fiscal. Nosso objetivo é contar com um profissional que emita faturas com um alto grau de precisão para garantir nossa receita.O Analista deFaturamento deve ter um olhar aguçado para detalhes. Também deve se sentir confortável trabalhando com pouca supervisão para cumprir prazos apertados.Responsabilidades e atribuiçõesEmitir e distribuir faturasReceber e revisar notas fiscais de entradaColaborar com outros departamentos paragarantir exatidão no faturamentoResponder a perguntas e lidar comreclamações de clientesMonitorar contas a receber e transaçõesAuxiliar nas reconciliações de contas de clientesResolver quaisquer problemas ou errosRequisitos e qualificaçõesNecessário, pacote Office (Excel intermediário, no mínimo);Formação acadêmica em contabilidade ou administração;Experiência de, no mínimo, 2 anos na área, ou 2 anos no cargo;ExcelConhecimento no sistema ProtheusExcelente capacidade de comunicaçãoHabilidades organizacionais e de gestão de tempoAtenção aos detalhesCapacidade de trabalhar em equipeCapacidade de trabalhar de forma independente e cumprir prazosInformações adicionaisBom relacionamento interpessoal;Atitude colaborativa;Saber trabalhar sob pressão;Vivência no cumprimento de prazos;Compromisso com suas entregas;Disciplina e autocontrole emocional.",Indigo,vacancy_type_effective,,False,Porto Alegre,Rio Grande do Sul,Brasil,https://jobsindigo.gupy.io/job/eyJqb2JJZCI6NjUwODczNCwic291cmNlIjoiZ3VweV9wb3J0YWwifQ==?jobBoardSource=gupy_portal,False,hybrid,True
6513028,2023-12-27T13:10:45.429Z,ANALISTA DE MARKETING SR - VALTRA / FENDT,"UMA EMPRESA BRASILEIRA, FEITA DE TALENTOS, PAIXÃO, MUITO ENTUSIASMO E DESAFIOS!Oi, somos a VAMOS! Um ecossistema único em alternativas para a renovação e expansão da frota brasileira. Com isso, desenvolvemos nosso negócio diariamente em cima de dois pilares: renovar e inovar, contribuindo sempre para melhorar a performance e aumentar a rentabilidade dos nossos clientes.Nossa jornada é movida pela responsabilidade com cada CLIENTE, pelo comprometimento com a nossa GENTE, pela SIMPLICIDADE do Nosso Jeitão de ser e realizar, pela ATITUDE DE DONO em nosso dia a dia, assegurando a SUSTENTABILIDADE em tudo o que fazemos e tendo o LUCRO como garantia da renovação dos nossos ciclos.Buscamos pessoas que apresentam simplicidade, paixão por servir e que tenham interesse em aprender, desafiar-se e desenvolver-se junto ao crescimento da empresa. Se você tem esse perfil e quer trabalhar em um local em que a nossa Gente faz a diferença, confira nossas vagas ou cadastre seu currículo em nosso banco de talentos.Todos os processos seletivos conduzidos pela VAMOS são afirmativos, inclusivos e não discriminatórios.Responsabilidades e atribuiçõesMissão do cargo: Ser um agente de transformação cultural, zelar pela padronização de PDV que gera a melhor experiência para o nosso cliente e colaborar com a construção de uma marca em consolidação no mercado.Ser o principal responsável pela padronização da comunicação visual das concessionárias da regional, zelando pela melhor experiência de compra do nosso cliente bem como a conformidade do manual do concessionário.   Produzir e acompanhar eventos e feiras locais junto aos times responsáveis.Implantar todas as ações do calendário anual de ações de MKT das marcas.Acompanhar o planejamento e garantir a efetividade das ações táticas definidas para os canais de forma completa, cuidando do desenvolvimento, produção, implantação e mensuração de resultados, junto as agências e sempre alinhando e comunicando bem com os times de marketing e comercial com report à gestão direta;Suportar os gestores de loja com materiais de PDV, promoções e campanhas.Cumprir uma agenda de visitas às lojas para treinamentos e reuniões presenciais em todas as unidades da regional.Controlar e gerir os investimentos via sistema interno, garantindo o cumprimento do plano de investimento da área de canais; Entender as principais oportunidades e fazer análise dos clientes detratores junto à área de NPS, e trazer propostas de plano de ação;Desenvolver planilhas e relatórios de controles mensais com detalhamentos de dados dos investimentos e das ações de canais com foco nos resultados; Gestão e produção de conteúdos regionais para as plataformas de redes sociais das marcas. Acompanhar tendências de mercado, gerar insights e oportunidades, sendo ponto focal entre equipe de marketing e comercial;Requisitos e qualificaçõesGraduação em Marketing / Jornalismo / Administração ou áreas correlatas. Mas, se você tem muita vontade de aprender com espírito inovador e cheio de energia, sua área de formação não será um impeditivo para sua contratação.Power Point Intermediário;Excel Intermediário;Residir na cidade de Ponta Grossa/PRDisponibildiade de Viagem pela Empresa, para participação e organização de eventos. (Feiras, Workshop)Comportamentais:Experiência anterior com marketing de concessionárias e ou varejo;Vivência com análise de indicadores de performance;Excelente comunicação verbal e escrita; Iniciativa e proatividadeSentimento de Liderança  Irá se destacar se:Tiver experiência com marketing de varejo;Tiver conhecimento em pacote Adobe.Tiver conhecimento no Canva.Informações adicionaisGENTE É O NOSSO NEGÓCIO E É POR ISSO QUE VALORIZAMOS NOSSOS COLABORADORES DE DIVERSAS FORMAS! Os benefícios tradicionais que você já conhece, nós também temos. Queremos te mostrar que vamos além. Saiba mais! LIGADO EM VOCÊ: Atendimento especializado para a nossa gente e familiares por meio de uma central 24 horas para apoio psicológico, sobre saúde, social, familiar, financeiro e/ou jurídico e tudo isso com sigilo absoluto. Licença Maternidade e Paternidade estendidas + Kit nascimento para recém-mamães e recém-papais. Sabemos o quanto a educação das crianças e adolescentes é importante. Aqui na VAMOS, damos aquela ajuda na compra do kit escolar para os filhos da nossa gente. Nossa gente tem acesso exclusivo a uma plataforma de descontos em viagens, cultura e entretenimento, serviços, gastronomia, educação e bem-estar. Pela Universidade VAMOS, a nossa gente aprende e potencializa seu desenvolvimento profissional, tornando cada um(a) protagonista de sua carreira. Sonha em ser voluntário(a)? Faça parte do VAMOS Fazer o Bem, onde nossos colaboradores geram impactos positivos por meio de pequenas ações.﻿Reconhecemos e valorizamos a nossa gente veterana que completa anos de casa. Quem possui mais de 15 anos, ainda tem um evento mega especial.Cantinho da Mamãe: O espaço, na Matriz no Itaim Bibi e Sede Administrativa em Mogi das Cruzes, é dedicado as mamães que retornam de licença maternidade e querem seguir com o aleitamento materno. No local, há todos os itens para retirar e armazenar o leite, com privacidade e conforto. Se identificou com essa vaga? Conheça as nossas vagas, inscreva-se e vamos juntos participar dessa Empresa que cresce todos os dias.",Grupo Vamos,vacancy_type_effective,,False,Ponta Grossa,Paraná,Brasil,https://vamos.gupy.io/job/eyJqb2JJZCI6NjUxMzAyOCwic291cmNlIjoiZ3VweV9wb3J0YWwifQ==?jobBoardSource=gupy_portal,True,on-site,True
6192338,2023-12-27T13:08:43.862Z,ANALISTA PCM AUTOMOTIVO,"Procuramos por profissionais talentosos e dedicados, que desejam fazer a diferença em nosso setor de atuação. Se você é resiliente, possui habilidades interpessoais e está em busca de um ambiente desafiador, essa vaga é para vocêResponsabilidades e atribuiçõesAcompanhar a equipe na elaboração dos planejamentos preventivo, corretivo e preditivoControlar KPIs , como CRM, tempo meio de reparo, tempo médio de falhas, consumo de lubrificantes e combustível, manutenção preventiva, corretiva e primária, metas de assertividadeResponsabilizar se pela analise de fluido e motivos da troca, gerando relatórios e estudos de utilização, visando identificar motivos de quebra e mal usoRegistrar todos os equipamentos, considerados como “grande quebra” , através de fotos, laudos e demais registros que se fizerem necessáriosControlar todos os componentes reservas, realizando toda a manutenção necessário e disponibilizando para oficinaRealizar reunião de backlog para identificar pontos críticos e definir prioridades      Requisitos e qualificaçõesEnsino MédioDisponibilidade de horárioVivencia na área de PCM automotivoInformações adicionaisConvênio de saúde,Convênio odontológico;Convênio farmácia;Ticket alimentação;Transporte;Refeitório;Seguro de vida;PPR",Usina Cerradão ,vacancy_type_effective,,False,Frutal,Minas Gerais,Brasil,https://cerradao2006.gupy.io/job/eyJqb2JJZCI6NjE5MjMzOCwic291cmNlIjoiZ3VweV9wb3J0YWwifQ==?jobBoardSource=gupy_portal,False,on-site,True
6512943,2023-12-27T13:05:56.158Z,Analista Fiscal Pleno - SEDE,"O Grupo Muffato é uma empresa que está em constante transformação, na busca de sempre trazer o que há de melhor a nossos clientes.O Analista Fiscalserá responsável por realizar a conferencia dos registros de notas de entrada e saída, buscando identificar possíveis erros na aplicação das regras de SPED ICMS IPI e Contribuição, evitando assim riscos de eventual auto de infração e garantindo que a empresa esteja recolhendo os impostos de forma correta sem prejuízo por recolhimentos a maior.Se interessou? Faça já a sua inscrição!Responsabilidades e atribuiçõesConferência do registro de notas fiscais de entrada e saída.Aplicação de correções no sistema.Analise de erros afim de identificar o que deve ser ajustado na operação ou no sistema para que os erros sejam eliminados.· Geração/Correção e Transmissão do SPED ICMS e Contribuições.Demais atividades do setor.Requisitos e qualificaçõesExperiência na função, será um diferencial;Conhecimento em entrega de Obrigações Fiscais (SPED ICMS e Contribuições); Conhecimento da legislação de ICMS/PIS/COFINS.Ensino Superior completo ou Cursando área Contábil;Informações adicionaisRefeição/alimentação;Descontos em empresas parceiras;Cartão convênio;Treinamentos e formações pela nossa Universidade corporativa - UniffatoCarreira",Grupo Muffato,vacancy_type_effective,,False,Londrina,Paraná,Brasil,https://grupomuffatovagas.gupy.io/job/eyJqb2JJZCI6NjUxMjk0Mywic291cmNlIjoiZ3VweV9wb3J0YWwifQ==?jobBoardSource=gupy_portal,True,on-site,True
