job_id,published_date,title,description,career_page_name,type,application_deadline,is_remote_work,city,state,country,job_url,disabilities,workplace_type,submitted
6108621,2023-11-30T14:23:20.867Z,Analista de Talent Acquisition Sênior - Temporário,"Inclusão e respeito à diversidade e equidade fazem parte do DNA da KPMG. Aqui valorizamos todas as pessoas, encorajando e empoderando os nossos profissionais para que se sintam parte das nossas conquistas.Independente da sua idade, gênero, raça, cor, credo, orientação, sexual, etnia, origem nacional ou deficiência, te convidamos a fazer a diferença. Venha fazer parte do time KPMG! 🏳️‍🌈 🏳️‍⚧️ ♿ ✊🏿 ✝️ 🕎 Siga a KPMG nas redes sociais.           Vaga destinada à KPMG Consultoria LTDA.Qual o seu momento de carreira? Você se identifica com a área de People Performance and People? Possui experiência com Recrutamento e Seleção? Gosta de lidar com desafios? Tem alto nível de comprometimento, habilidade de negociação e excelente comunicação com o público ?Tem interesse em fazer parte do nosso time de Talent Acquisition, na área de Infraestrutura e trabalhar em nossa estrutura em São Paulo-SP?A área de Talent Acquisition tem como objetivo de atrair e contratar profissionais inovadores, especialistas e extraordinários! Trabalhamos para fortalecer a nossa imagem como marca empregadora e atuamos como parceiros estratégicos de todas as áreas do negócio, recrutando profissionais em todos os níveis da Organização – de trainees a cargos mais sêniores. Navegue pelos menus abaixo e saiba mais sobre nossa atuação.Inspire Confidence. Empower Change.Aqui na KPMG:•      Fazemos o que é certo #Integrity•      Aprendemos e nos aprimoramos #Excellence•      Pensamos e agimos de maneira arrojada #Courage•      Respeitamos uns aos outros e nos e nos fortalecemos com nossas diferenças #Together•      Fazemos o que realmente importa #For BetterResponsabilidades e atribuiçõesCaso seja aprovado(a), você terá a oportunidade de:Executar todo o ciclo do processo de recrutamento e seleção, desde a definição de requisitos até a seleção final do candidato controlando e reportando a performance e indicadores;Colaborar com os gestores das vagas para entender as necessidades de contratação e desenvolver perfis dos cargos solicitados, atuando de forma consultiva;Utilizar estratégias criativas de recrutamento para identificar e atrair candidatos qualificados, incluindo redes sociais, grupos privados, plataformas de emprego e outras fontes relevantes;Realizar triagem curricular, entrevistas individuais e avaliação de candidatos, garantindo um processo de seleção objetivo e eficiente;Conduzir entrevistas comportamentais e técnicas, avaliando habilidades, experiência e cultura;Fornecer feedback construtivo e detalhado aos candidatos e garantir uma experiência positiva para todos os envolvidos no processo;Colaborar com os gestores para finalizar ofertas de emprego, incluindo negociações salariais, negociação de perfil e senioridade (perfil consultivo e técnico é o que esperamos);Manter um banco de dados atualizado de candidatos e acompanhar métricas de recrutamento para análise e melhoria contínua;Requisitos e qualificaçõesO que procuramos em você?Formação acadêmica em Recursos Humanos, Psicologia, Administração ou áreas relacionadas;Experiência comprovada como Analista de Recrutamento e Seleção, em nível sênior;Sólida compreensão das práticas de recrutamento e seleção, incluindo a utilização de ferramentas de busca, entrevistas comportamentais e técnicas de avaliação;Habilidades de comunicação verbal e escrita, com foco na construção de relacionamentos tanto com candidatos quanto com gestores;Capacidade de trabalhar de forma autônoma e em equipe, com alto nível de proatividade e senso de responsabilidade;Conhecimento de sistemas e ferramentas de rastreamento de candidatos (ATS) e de plataformas de recrutamento online;Capacidade de avaliar candidatos não apenas por habilidades técnicas, mas também pela adequação cultural à organização;Excelente capacidade de gerenciamento do tempo e organização, com atenção aos detalhes;Atitude consultiva, habilidade em negociação, embasamento técnico;Habilidade em reportar, apoiar e interagir em todos os níveis corporativos; Amplo conhecimento em processos voltados para TAX.Informações adicionaisQuais as vantagens de ser KPMG?•   Aqui atuamos com as mais novas tecnologias;•   Nossos profissionais são referência no mercado;•   Somos uma das maiores empresas de prestação de serviço do mundo; Quais benefícios oferecemos? •   Vale Refeição•   Vale Alimentação•   Assistência Médica•   Assistência Odontológica•   Vale Transporte•   Benefício Bem-estar (Academia)•   Convênio Farmácia•   Seguro de Vida•   Auxílio Creche•   Incentivo a Graduação•   Subsídio de Órgão de Classe•   Brinde Casamento•   Brinde Nascimento•   Short Friday•   Licença Maternidade Extendida•   Jornada de Trabalho Flexível•   Incentivo à Idiomas•   PPL",KPMG Brasil,vacancy_type_temporary,2023-12-08T00:00:00.000Z,False,São Paulo,São Paulo,Brasil,https://kpmgbrasil.gupy.io/job/eyJqb2JJZCI6NjEwODYyMSwic291cmNlIjoiZ3VweV9wb3J0YWwifQ==?jobBoardSource=gupy_portal,True,hybrid,True
6010595,2023-11-30T14:21:31.179Z,Analista de Tech Support - Field Services,"RELEVO LAB.Somos uma empresa de tecnologia com mais de 6 anos de atuação, vivemos e respiramos tecnologia, batalhamos incansavelmente para ser um lugar incrível para se trabalhar, onde as pessoas são tratadas com igualdade, gostem de trabalhar, se sintam em casa e esse é certamente o lugar onde queremos estar.Estamos à procura de pessoas do bem, comprometidas e que queiram crescer junto com a gente!Se você se enquadra neste perfil, é você que queremos!Responsabilidades e atribuiçõesO contratado será responsável por prestar atendimento em campo para necessidades e problemas técnicos relacionados a hardwares e softwares. Deverá ter a habilidade de trabalhar tanto com público VIP quanto convencional, oferecendo soluções eficazes e um atendimento de alta qualidade. Jornada de trabalho: Segunda a Sexta, das 9h às 18h (1h de intervalo para almoço)Tipo de Vaga: PresencialLocalidade: São Paulo - SPContratação: CLTTempo de alocação: 09 meses, podendo ser prorrogado para tempo indeterminado.Requisitos e qualificaçõesO que queremos que você tenha:Conhecimento em microinformáticaExperiência em resolução de problemas técnicos relacionados a hardwares e softwaresHabilidade em atendimento em campo (Hands &amp; Eyes)Competências de comunicação eficazFamiliaridade com o suporte a público VIP e convencionalO que seria muito legal se você tivesse:Certificações técnicas em hardwares ou softwaresConhecimento em sistemas operacionais específicosInformações adicionaisO que oferecemos:Pacote de remuneração e benefícios competitivo com o mercado.Gostou? Acesse nossa página de carreira em https://relevo.gupy.io/Super Importante!Se os seus conhecimentos forem aderentes à vaga, é tudo o que importa.Aqui nós abraçamos a diversidade e contratamos pessoas com capacidade e vontade de transformar, independente de qual seja a sua localização, raça, cor, religião, identidade de gênero, orientação sexual ou formação.",Relevo,vacancy_type_effective,,False,São Paulo,São Paulo,Brasil,https://relevo.gupy.io/job/eyJqb2JJZCI6NjAxMDU5NSwic291cmNlIjoiZ3VweV9wb3J0YWwifQ==?jobBoardSource=gupy_portal,True,on-site,True
5994647,2023-11-30T14:20:47.877Z,"Pessoa Analista de Laboratório - Vila Romana, SP","Reconhecemos que o nosso pessoal é o nosso diferencial e os diversos talentos que trazemos para nossa força de trabalho global estão diretamente relacionados ao nosso sucesso!Somos uma empresa que oferece oportunidades iguais e valorizamos muito a diversidade e a inclusão em nossa empresa.Você está pronto para fazer a diferença na ALS e se juntar a nós nessa jornada?Responsabilidades e atribuiçõesPreparar amostras e soluções;Preparar os ensaios/testes conforme agenda estabelecida; Analisar amostras e resultados de analises;Auxiliar o coordenador no atendimento técnico de clientes (quando autorizado);Assinar Relatórios de Ensaio/Estudos quando autorizado; Preparar padroes reagentes; Preparar curvas de calibrações; Realizar procedimentos de preventivas; Solicitar entrega e devolução de amostras; Comunicar adversidades nas amostras; Controlar padroes. reagentes e insumos; Auxiliar no descarte de residuos; Acompanhar serviços externos;Ministrar treinamentos técnicos para a equipe; Orientar e treinar os estagiários na execução dos procedimentos operacionais. Requisitos e qualificaçõesDiferencial ter atuado com ensaios de cromatografia Liquida e cromatografia gasosa; sistema de qualidade ISO 17025; Preparo de soluções; e Análises físico-químicas.Será interessante se você tiver organização, pró-atividade, comunicar se bem e trabalho em equipeGraduação concluído em Química ou áreas correlatas. Informações adicionaisHORÁRIO: Segunda a sexta das 08:00 as 17:48LOCAL : UNIDADE - VILA ROMANA - SÃO PAULOO QUE TE OFERECEMOS:🍽 Vale Refeição / Alimentação;🔃 Vale transporte;🚑 Assistência Médica / Seguro de Vida;🦷 Assistência Odontológica;🏋️ Auxilio Academia e Bem estar; 💊 Convênio Farmácia;📚 Parcerias e convênios com faculdades e escolas de idiomas;",ALS LIFE SCIENCES,vacancy_type_effective,,False,São Paulo,São Paulo,Brasil,https://alslifesciences.gupy.io/job/eyJqb2JJZCI6NTk5NDY0Nywic291cmNlIjoiZ3VweV9wb3J0YWwifQ==?jobBoardSource=gupy_portal,False,on-site,True
6027952,2023-11-30T14:19:32.775Z,ANALISTA DE MARKETING JR,"Sobre IT UNIVERSESomos uma empresa conceituada no mercado de TI com mais de 13 anos de história. Integradora de soluções de TI com amplo portfólio de produtos e serviços, atua em empresas de diversos portes e estamos presentes no Brasil, Estados Unidos e México.O que nos orienta?Felicidade - Promover a felicidade dentro da nossa empresa é a nossa missão diária. Pessoas felizes vivem mais, são mais otimistas e trabalham melhor. A felicidade gera resultado.Enxergar nossos clientes, parceiros e colaboradores como principais responsáveis pelo sucesso dos projetos e crescimento da empresa.Relações éticas trazem prestígio e reconhecimento que são os maiores bens que uma empresa pode ter.Proporcionamos sempre a melhor experiência de atendimento aos nossos clientes.A busca por novas tecnologias é um esforço diário. Acompanhar a evolução do mercado é a chave para atender com excelência.Responsabilidades e atribuiçõesHabilidades:Elaboração de textos para redes sociais e site institucional (instagram, linkedin e tiktok);Criação de artes para as redes sociais;Criação e edição de vídeos para redes sociais (feed, reels e tiktok) e vídeos internos institucionais;Acompanhar presença nas redes sociais, gerar relatórios de desempenho etc;Planejar e elaborar calendário editorial de postagens.Requisitos e qualificaçõesPré-requisitos essenciais:Ser heavy user das redes sociais; ter conhecimento intermediário em Adobe Photoshop e Adobe Première;Boa escrita (saber escrever textos simples, mas envolventes, criativos e com boa gramática); Se sentir à vontade em frente às câmeras; ter conhecimento em Trello; gostar do mundo da tecnologia e empreendedorismo.Pro atividadeSaber todas as informações sobre a área, estar apta a resolver eventuais problemas que possam surgir. CordialidadeContornar situações difíceis de forma cordial e ser uma referência positiva do nome da empresa que representa. DiscriçãoManter a discrição é fundamental para o bom trabalho de uma profissional, seja na forma de se relacionar com os clientes, nas conversas com outros colaboradores. Boa ComunicaçãoTer boa comunicação, ser criativo(a) e autodidata;OrganizaçãoConseguir lidar com todas as demandas e manter a organização de tarefas.Cursos: Publicidade e propaganda, marketing ou áreas correlatasInformações adicionais🩺 Plano de Saúde;🦷 Plano Odontológico (Opcional);🏋🏾‍♂️ Gympass (plataforma de saúde e bem-estar através da atividade física que dá acesso a academias e/ou treinos on-line);💳 Vale-Refeição e VT, cartão de benefícios aceito por milhares de estabelecimentos;🏥 Convênio Farmácia;📝 Feedback 1:1 mensal entre líder e liderado, para uma cultura transparente e de alta performance. Nós conversamos sobre desenvolvimento e damos/recebemos feedbacks, para uma relação duradoura 🚀;🎓 PDI - Plano de Desenvolvimento Individual: construído entre o líder e o liderado para o seu desenvolvimento;🌟 Treinamentos (individuais e para os times);🎯 Programa de desenvolvimento de liderança (PDL): incentivo a desenvolver futuros líderes. ",IT Universe,vacancy_type_effective,,False,Osasco,São Paulo,Brasil,https://ituniverse.gupy.io/job/eyJqb2JJZCI6NjAyNzk1Miwic291cmNlIjoiZ3VweV9wb3J0YWwifQ==?jobBoardSource=gupy_portal,False,hybrid,True
6109607,2023-11-30T14:18:49.220Z,Analista de Desenho de Automação Pleno,"Por que fazer parte do #PosiTime?Acreditamos que a tecnologia existe para impulsionar vidas, por isso, todos os dias construímos novas soluções que tornam a vida das pessoas melhor e mais inteligente! Ágeis, vibrantes, ousados, inovadores, diversos, conectados, dinâmicos, empreendedores e resilientes: mais que uma equipe, somos o #PosiTime.Se você se identifica com o nosso propósito, e procura um lugar para crescer e somar, te esperamos de braços abertos!Responsabilidades e atribuições•	Gerenciar a implementação de projetos de automatização em todo seu ciclo de vida que envolverem criação e atualização de serviços de TI, considerando aspectos como acompanhamento do desenvolvimento, homologação e implantação da solução; •	Criar as especificações necessárias para atender as necessidades do negócio com base nas definições fornecidas pelo cliente; •	Assegurar que os usuários do nosso cliente tenham uma compreensão clara e comum dos requisitos de negócio a serem adotados; •	Acompanhar o status das atividades junto ao cliente, garantindo a entrega do produto automatizado conforme especificado e acordado; •	Avaliar o impacto das mudanças no projeto quanto às variáveis (tempo, escopo, custo e qualidade);•	Avaliar o impacto das mudanças nos processos da empresa; •	Desenhar os fluxos e serviços que serão digitalizados;•	Levantar requisitos funcionais e técnicos; •	Desenhar a solução técnica geral (visão sistêmica);•	Acompanhar de perto o desenvolvimento técnico da solução; •	Interagir com o cliente para validar os serviços digitais e regras de negócios. Requisitos e qualificaçõesGraduação completa em Análise de Sistema, Processamento de Dados, TI ou áreas relacionadas;Conhecimento intermediário no Pacote Office;Experiência em lidar com altas demandas e gestão de prioridades;Vivência com melhoria de processos e procedimentos;Estar aberto/aberta a novos desafios; Disponibilidade para trabalho híbrido em Curitiba.Informações adicionaisDiferenciais:-Experiência com BOT´s;-Conhecimento em CRM. ",Positivo Tecnologia,vacancy_type_effective,,False,Curitiba,Paraná,Brasil,https://positivotecnologia.gupy.io/job/eyJqb2JJZCI6NjEwOTYwNywic291cmNlIjoiZ3VweV9wb3J0YWwifQ==?jobBoardSource=gupy_portal,True,hybrid,True
6109620,2023-11-30T14:16:12.395Z,Analista - Processos de Manufatura,"VENHA FAZER PARTE DA NOSSA EQUIPE!A Engbras, fundada em 2001, nasceu com o propósito de trazer inovações ao mercado, e principalmente, fornecer aos nossos clientes as soluções para problemas específicos de engenharia, atuando nas etapas de criação do produto como um todo. Nosso diferencial é criar soluções específicas tanto para uma fase no projeto, como propor a melhoria do processo de fabricação de um produto, desde sua concepção até seus testes finais, englobando todas as fases e resultando em aspectos positivos de performance e tempo de projeto.Responsabilidades e atribuiçõesDescrição de cargoElaboração de Projetos de Dispositivos e Ferramentas de Montagens;Elaboração de Layouts das áreas de instalações, linhas de montagens e pré-montagens com foco em montagem final;Análise prévia da viabilidade dos projetos EOL (End of Line);Desenvolvimento e implementação de novos processos;Elaboração da instrução de trabalho dos postos planejados;Requisitos e qualificaçõesPré-requisitos obrigatóriosSuperior completo em Engenharia Mecânica, Mecatrônica ou áreas correlatas;Conhecimentos em processos de produção, automação industrial e novas tecnologias;Conhecimentos em indústria digital 4.0;Conhecimento em Gestão dos Projetos;Conhecimento em FMEA;Inglês Avançado.Informações adicionaisBenefícios: Refeitório no local, vale transporte, assistência médica, assistência odontológica e convênios com instituções de ensino (gradução, pós graduaçao e escola de idiomas) e seguro de vida.",Engbras,vacancy_type_effective,2024-02-05T00:00:00.000Z,False,São Bernardo do Campo,São Paulo,Brasil,https://engbras.gupy.io/job/eyJqb2JJZCI6NjEwOTYyMCwic291cmNlIjoiZ3VweV9wb3J0YWwifQ==?jobBoardSource=gupy_portal,True,on-site,True
6109614,2023-11-30T14:15:18.742Z,Analista Compliance Jr ,"Vem pra NÚCLEA!Já imaginou se os meios de pagamento parassem de funcionar? Pois é, isso nem passa pela nossa cabeça, porque trabalhamos com inovação, confiabilidade e tecnologia de ponta para que você, pequenas ou grandes empresas possam fazer suas transações com total segurança e agilidade, a qualquer hora do dia ou da noite.Nosso ambiente é feito de gente movida pela vontade de interagir de forma colaborativa e disposta a se desafiar todos os dias. Estamos cheios de energia para continuar transformando o mercado financeiro. Temos muito Orgulho de Ser NÚCLEA.Sobre a NÚCLEAhttps://www.nuclea.com.br/Para todas as posições consideramos diversidade e inclusão.Na Núclea, valorizamos muito o respeito e a diversidade em nossas equipes, aqui, acreditamos que nossas diferenças são nossas maiores forças.De acordo com nossos valores, as pessoas estão no centro do nosso negócio e somente elas são capazes de movimentar a economia digital em benefício de toda a sociedade.Essa é a chance para você mudar a sua vida, corra e se inscreva!Responsabilidades e atribuiçõesExperiência em Compliance de Mercado de Capitais ou Mercado Financeiro, conhecimento de regulamentações da CVM, Anbima, BCB, SUSEP, etc.;Experiência e conhecimentos generalistas de Gestão de Projetos, Controles Internos, Gestão de Riscos, Integridade e Compliance (regulatório, com interpretação de leis e normas e emissão de parecer; ética e conduta, atuação consultiva);Experiências em tratativas com reguladores, especificamente com a CVM/ANBIMA (atendimento à inspeção, reuniões com reguladores, envio de informações, controles regulatórios);Atuação preferencialmente em Compliance de IMF (registradoras, depositária central, câmaras de liquidação, de registro, etc.) ou Compliance de Instituição Financeira (Compliance de asset, corretora, corporativo, etc); ou em Jurídico de IMF ou de Instituição Financeira destas áreas.Requisitos e qualificaçõesFormação: Direito;Inglês: Intermediário;Experiência em Compliance de Mercado de Capitais ou Mercado Financeiro, conhecimento de regulamentações da CVM, Anbima, BCB, etc.;Conhecimento em LGPDConhecimento em Monetização de DadosPacote Office: mínimo intermediário – desejável: AvançadoDesejável se conhecer outras ferramentas de dados de forma a conseguir aprofundar conforme eventuais demandas (ex.: Python, Power BI, Access).Informações adicionaisModelo de Trabalho Home First ( Maior parte Home Office com frequência mínima quinzenal no escritório).Salário compatível com o mercado - CLTBenefícios:Convênio Médico e OdontológicoVale Refeição/ Alimentação - CajuSeguro de VidaAuxilio educaçãoAuxilio homefirstPLRPrevidência PrivadaAuxílio creche",Núclea,vacancy_type_effective,,False,São Paulo,São Paulo,Brasil,https://nuclea.gupy.io/job/eyJqb2JJZCI6NjEwOTYxNCwic291cmNlIjoiZ3VweV9wb3J0YWwifQ==?jobBoardSource=gupy_portal,True,hybrid,True
6109634,2023-11-30T14:11:48.400Z,Analista de Treinamento Desenvolvimento,"Somos o setor de recursos humanos da maior rede varejista 100% nacional. Estamos buscando um profissional que esteja atento as mudanças na gestão de pessoas, que tenha desejo em crescer e proporcionar o crescimento da empresa.Você será nosso parceiro no setor de desenvolvimento de pessoas, capacitando nossos colaboradores a atingir seu melhor potencial .E ai, Se você já se identificou com a vaga, faça agora mesmo sua candidatura e venha fazer parte do nosso time de sucesso.Aguardamos você!Responsabilidades e atribuiçõesElaborar materiais de treinamento;Realizar mensalmente treinamento para os colaboradores do grupo;Acompanhar e dar suporte aos analistas de desenvolvimento de pessoas de outras regionais;Realizar cadastramento no sistema de todos os treinamento ministrados;Controlar e orientar referente aos treinamento ministrados nas filais;Organizar a logística de treinamentos ministrados (orçamentos, alimentação, transporte, entre outros);Executar outras atividades de acordo com os critérios estabelecidos pela Coordenação do setor;Requisitos e qualificaçõesEnsino superior completo em gestão de recursos humanos, psicologia ou áreas correlatas;Experiência no cargo será um diferencial;Atender o cliente conforme os padrões de atendimento exigidos pela empresaCumprir os procedimentos operacionais exigidos do cargo;Conhecimento pacote Office (Excel, Word, Power Point e demais programas);Perfil comunicativo e organizado;Saber lidar com diferentes pessoas de maneira cordial;Iniciativa;Flexibilidade;Criatividade;Informações adicionaisRefeição/alimentação;Descontos em empresas parceiras;Cartão convênio;Treinamentos e formações pela nossa Universidade corporativa - UniffatoCarreira",Grupo Muffato,vacancy_type_effective,,False,Cascavel,Paraná,Brasil,https://grupomuffatovagas.gupy.io/job/eyJqb2JJZCI6NjEwOTYzNCwic291cmNlIjoiZ3VweV9wb3J0YWwifQ==?jobBoardSource=gupy_portal,True,on-site,True
6109130,2023-11-30T14:03:11.313Z,Analista Financeiro,"VENHA FAZER PARTE DA NOSSA EQUIPE!A Engbras, fundada em 2001, nasceu com o propósito de trazer inovações ao mercado, e principalmente, fornecer aos nossos clientes as soluções para problemas específicos de engenharia, atuando nas etapas de criação do produto como um todo. Nosso diferencial é criar soluções específicas tanto para uma fase no projeto, como propor a melhoria do processo de fabricação de um produto, desde sua concepção até seus testes finais, englobando todas as fases e resultando em aspectos positivos de performance e tempo de projeto.Responsabilidades e atribuiçõesDescrição de cargoRealizar o planejamento financeiro da área de Engenharia de Manufatura;Construir forecast e explicar as variações de realizado vs forecast;Pilotar reuniões sobre forecast mensal, semestral e anual da área;Preparar indicadores de performance dos projetos em andamento;Levantamento de oportunidades de redução de custos considerando legislação de incentivos fiscais (Rota 2030).Requisitos e qualificaçõesPré-requisitos obrigatóriosFormação em Economia, Ciências Contábeis, administração ou área correlatas;Conhecimento avançado em Power BI;Conhecimento em Excel avançado, macro e VBA;Conhecimento em SAP;Bom relacionamento interpessoal e trabalho em equipe.Inglês nível Intermediário;Informações adicionaisBenefícios: Refeitório no local, vale transporte, assistência médica, assistência odontológica, auxílio creche e convênios com instituções de ensino (gradução, pós graduaçao e escola de idiomas) e seguro de vida.",Engbras,vacancy_type_effective,,False,São Bernardo do Campo,São Paulo,Brasil,https://engbras.gupy.io/job/eyJqb2JJZCI6NjEwOTEzMCwic291cmNlIjoiZ3VweV9wb3J0YWwifQ==?jobBoardSource=gupy_portal,True,on-site,True
6106873,2023-11-30T14:01:59.484Z,Analista de Curadoria de Book Pleno,"Por que fazer parte do #PosiTime?Acreditamos que a tecnologia existe para impulsionar vidas, por isso, todos os dias construímos novas soluções que tornam a vida das pessoas melhor e mais inteligente! Ágeis, vibrantes, ousados, inovadores, diversos, conectados, dinâmicos, empreendedores e resilientes: mais que uma equipe, somos o #PosiTime.Se você se identifica com o nosso propósito, e procura um lugar para crescer e somar, te esperamos de braços abertos!Responsabilidades e atribuiçõesAcompanhar e aprimorar Dashboards para controle dos indicadores de performance;Acompanhar e aprimorar relatórios de acompanhamento operacional e gerencial da empresa;Estabelecer métricas para medir a efetividade das iniciativas de transformação digital;Monitorar e analisar todos os indicadores do setor afim de identificar possíveis problemas e propor soluções.Requisitos e qualificaçõesGraduação completa em Análise de Sistema, Processamento de Dados, TI ou áreas relacionadas;Conhecimento intermediário no Pacote Office;Power BI intermediário para avançado;Experiência em lidar com altas demandas e gestão de prioridades;Estar aberto/aberta a novos desafios; Disponibilidade para trabalho híbrido em Curitiba.Informações adicionais",Positivo Tecnologia,vacancy_type_effective,,False,Curitiba,Paraná,Brasil,https://positivotecnologia.gupy.io/job/eyJqb2JJZCI6NjEwNjg3Mywic291cmNlIjoiZ3VweV9wb3J0YWwifQ==?jobBoardSource=gupy_portal,True,hybrid,True
