job_id,published_date,title,description,career_page_name,type,application_deadline,is_remote_work,city,state,country,job_url,disabilities,workplace_type,submitted
6263934,2023-12-11T14:32:14.373Z,Analista de Global Mobility,"Vaga para o time de Recursos Humanos.Buscamos pessoas que assim como a gente, sejam inovadoras, práticas, objetivas, tenham paixão pelo que fazem e visem a excelência. Então, você se encaixa neste perfil?Responsabilidades e atribuiçõesFornecer orientação e suporte aos funcionários expatriados, abordando questões práticas, culturais e logísticas; Garantir que os expatriados tenham acesso a serviços essenciais, como assistência médica, moradia e transporte; Elaborar cartas convite e atuar na confecção e conferência de documentos relativos a expatriados; Conduzir o processo de solicitação de visto para expatriados; Atuar na gestão de apartamentos dos expatriados, garantindo a manutenção predial e instalação de equipamentos e serviços;Assegurar a conformidade com leis locais e manter registros atualizados de documentos em todas as fases da mobilidade global;Conduzir avaliações contínuas, coletando feedback de expatriados e partes interessadas para aprimorar estratégias de mobilidade global.Requisitos e qualificaçõesNecessário ensino superior completo em Administração de Empresas ou áreas correlatas;Necessário conhecimento de Pacote Office;Necessário Inglês avançado;Disponibilidade para atuação presencial em Campinas/SP.Informações adicionaisAqui na BYD priorizamos o bem-estar de nossos colaboradores e estamos em busca constante de melhorias para o nosso pacote de benefícios. Seu pacote vai contar com:Convênio médico e odontológico coparticipativo para você e seus dependentes;Programas de saúde e bem-estar para a melhoria da sua qualidade de vida;Cartão Golden Farma para compras em farmácias cadastradas com desconto diretamente em folha, valendo tanto para medicamentos como para itens de higiene e beleza;Gympass para cuidar da sua saúde física e mental;Restaurante na planta para nossas unidades de Campinas, com opções de café da manhã, almoço, jantar e ceia, tudo de qualidade e com foco na saúde;Vale Alimentação para te ajudar nas compras do mês;Vale Transporte ou estacionamento na empresa;Trabalhamos com horário flexível, para melhor organização da sua vida pessoal;Licença maternidade de 6 meses e licença paternidade de 20 dias, além de um Kit Maternidade para o seu bebê;Seguro de vida coletivo Porto Seguro, sem desconto em folha;Auxílio creche para dependentes até 2 anos, conforme regras de elegibilidade.",BYD Brasil,vacancy_type_effective,,False,Campinas,São Paulo,Brasil,https://bydbrasil.gupy.io/job/eyJqb2JJZCI6NjI2MzkzNCwic291cmNlIjoiZ3VweV9wb3J0YWwifQ==?jobBoardSource=gupy_portal,True,on-site,True
6208871,2023-12-11T14:31:24.193Z,Analista de Dados,"Sobre a green4T:Valorizamos ações assertivas, orientadas para a eficiência e embasadas pelo know-how. Buscamos novas formas de olhar e encarar desafios, sempre com uma postura resiliente e perseverante. Nos antecipamos às situações, garantindo a minimização do risco. Somos pragmáticos, com foco em resultados e em nossos clientes, e prezamos pela excelência.A green4T é uma empresa líder em soluções de tecnologia e infraestrutura digital. Fundada em 2016 e presente em 12 países da América Latina, contamos com 30% das 1.000 maiores empresas do Brasil em nossa carteira de clientes.Gerimos nossos negócios de forma socialmente responsável. Temos o compromisso de desenvolver soluções de tecnologia e infraestrutura para a transformação digital de empresas, cidades e nações de forma eficiente e sustentável para o planeta. Vamos juntos #Begreen nessa transformação?Responsabilidades e atribuiçõesResponsabilidades e Atribuições:Estamos buscando um(a) Analista de Dados para atuar desenvolvendo as seguintes atividades: Analisar e reportar indicadores ao acompanhar as etapas de gestão de projetos desde a iniciação, planejamento, execução, controle e encerramento; Construção de indicadores e seus painéis de acompanhamento através da Análise de Dados;Construção e desenvolvimento de ferramentas para gestão de indicadores;Apoiar a Liderança nos projetos, processos e tarefas, visando a otimização da eficiência operacional, a minimização de riscos e a redução de custos.Seguir os KPIs adequados, tendo a mentalidade orientada para os resultados, orientando as rotinas diárias sobre KPIs e PIs adequados.Colaborar na implementação de rotinas e mentalidades de melhoria contínua na equipe, visando o aumento da eficiência dos processos, redução de custos e otimização de recursos no atendimento de exigências regulares e extraordinárias.Engajar com as equipes visando aumentar a aderência das ferramentas, painéis e indicadores construídos através das disciplinas de Gestão de Mudança Organizacional.Requisitos e qualificaçõesPacote OfficeIntermediárioMetrologia básicaDesejávelOrganizaçãoBoa comunicação e redaçãoPowerBI AvançadoHabilidades Comportamentais:Observações:ComprometimentoDetalhista eInformações adicionaisBenefícios:Vale-transporte;Vale Refeição ou Vale Alimentação no valor de R$ 28,83 por dia;Plano de saúde;Plano odontológico;Seguro de Vida;Gympass;Subsídios em medicamentos, terapias, telemedicina e hospital digital, coleta de exames em casa, acompanhamento nutricional e programa de gestantes.",green4T,vacancy_type_effective,,False,São Paulo,São Paulo,Brasil,https://green4t.gupy.io/job/eyJqb2JJZCI6NjIwODg3MSwic291cmNlIjoiZ3VweV9wb3J0YWwifQ==?jobBoardSource=gupy_portal,True,on-site,True
6265104,2023-12-11T14:28:26.692Z,Analista de Planejamento de Mídia,"Na Ogilvy, Diversidade e Pluralidade são pautas importantes e as apoiamos em todas as suas formas de expressão ✊🏿♿Venha fazer parte de um grande time de trabalho com CORAGEM para inovar e que traduz o sucesso da agência. Para os processos de recrutamento, estamos sempre em busca de pessoas com FRANQUEZA, CURIOSIDADE E ESPÍRITO LIVRE. Encontrar a fórmula certa para recrutar o nosso time, se deve a uma dose de INTUIÇÃO, inclusão e diversidade, acreditando que a busca pela pessoa ideal exige PERSISTÊNCIA, empatia, sempre pautadas em IDEALISMO, proporcionando a você, uma jornada de grandes aprendizados, responsabilidades e DIVERSÃO.O nosso processo seletivo está separado em algumas etapas essenciais:Inscrição (a que você finalizou aqui na Gupy);Entrevista com o nosso time de Talent Acquisition + Gestor(a) da área;Avaliação técnica (se necessário), através de testes, case ou apresentação de portfólio;PROPOSTA 🚀Não foi aprovade? Analisamos todas as pessoas de forma individual, e temos o compromisso para que a sua experiência seja o mais importante durante todo o processo. Por isso, nossos feedbacks são enviados por aqui independente se for uma resposta positiva ou não. 😉Responsabilidades e atribuições  Apoiar time de Mídia com análise de mercado, investimento, audiência, comportamento e consumo; Apoiar as defesas comerciais da Mídia, Atendimento e projetos de Planejamento;Acompanhamento semanal de audiência NET, GSP e RJ Programação Globo (Jornal Nacional, Novelas 1, 2 e 3)Acompanhamento semanal de audiência 4 principais emissoras de TV aberta com visualização por dia e linha para cada programa;Envio semanal de relatório de fiscalização e concorrentes para o time de Planejamento;Raio-x(paper) de programas em que temos patrocínio e projetos adquiridos, de forma semanal; Mapa de Calor de Programação Globo, Net e demais 12 mercados disponíveis com base em audiência média dos programas Jornal Nacional e Novelas 1, 2 e 3;Atualizar planilha da cliente com a média semanal do programa dentro do mês;Atender demandas pontuais de novos projetos com dados e insights;Produzir reporte de análise de concorrência com base em investimento publicitário;Requisitos e qualificaçõesFormação e Publicidade e PropagandaExperiência em mídia off-lineAtuação em agencia de Publicidade   Ter conhecimento nas ferramentas KANTAR IBOPE (Instar Analytics, Ad Performance, TGINDEX, Monitor Evolution, Easymedia);  Informações adicionaisNossos benefícios:Para cuidar da sua saúde:·        Assistência médica – Sul América·        Assistência Odontologia – Sul América·        Programa de Apoio ao Empregado (PAE)*O PAE oferece assistência profissional e confidencial para uma ampla gama de questões pessoais, de saúde mental e financeira. É elegível para todas as pessoas funcionárias e seus dependentes, e não possui custo para usar. Para a sua alimentação:·        A pessoa funcionária e estagiária terá direito ao Ticket Refeição ou Ticket Alimentação, no valor de R$ 41,00 por dia útil. Nosso modelo de trabalho é híbrido, com ida a agência 3 vezes por semana. Por isso, oferecemos alguns benefícios para a sua comodidade:·        VT;·        Parceria com restaurantes locais;·        Parceria com empresas de massagem e manicure, instaladas na nossa agência;·        Oferecemos também uma academia de ginastica gratuita, para uso interno da pessoa funcionária, enquanto estiver na agência; ·        Day Off no seu aniversário. Parceria de milhões:A Ogilvy possui parcerias com diversos parques e atrações de São Paulo que oferecem descontos para a pessoa funcionária e dependentes.Para você e sua família: LICENÇA MATERNIDADE: 6 meses de licença;LICENÇA PATERNIDADE: 20 dias de licença;LICENÇA PET: 2 dias de licença.Se você se identificou com nosso perfil e requisitos abaixo, se candidate! Venha fazer parte do nosso time 😊.",Ogilvy,vacancy_type_effective,2024-01-31T00:00:00.000Z,False,São Paulo,São Paulo,Brasil,https://ogilvy.gupy.io/job/eyJqb2JJZCI6NjI2NTEwNCwic291cmNlIjoiZ3VweV9wb3J0YWwifQ==?jobBoardSource=gupy_portal,True,hybrid,True
6179899,2023-12-11T14:21:17.291Z,Analista Financeiro Júnior,"Está preparado(a) para cultivar novas experiências em um time que joga junto e valoriza o melhor de cada um(a)? Aqui, os desafios se tornam oportunidades de inovação que podem impactar na sua trajetória profissional e na vida de milhões no Brasil e no mundo. Nós buscamos pessoas cheias de energia e prontas para agarrar novas oportunidades, que realizem um trabalho que gere valor a nossos clientes e funcionários(as).Buscamos uma(a) Analista Financeiro Júnior, para atuar em nossa unidade em Piracicaba- SP.Responsabilidades e atribuiçõesRotinas de aprovação de investimento e liberação de ordens de manutenção;Acompanhamento orçamentário de despesa diretas; Realizar análises de variações entre orçado e realizado, identificando desvios e propondo ações corretivas.Relacionamento e comunicação com stakeholders internos.Requisitos e qualificaçõesEnsino superior completo ou cursando;Conhecimento em contabilidade / custeio;Habilidades técnicas desejáveis: Conhecimento em SAP, COGNOS e Power BIInformações adicionaisETAPAS DO PROCESSO SELETIVO:Nosso processo contempla 3 etapas principais (podem ter outras, e você ficará por dentro caso avance):Inscrição - preenchimento deste formulário e de dados adicionais, caso necessário.Entrevista com o RH - um bate-papo para nos conhecermos.Entrevista com a liderança: bate-papo mais técnico para contar ainda mais sobre o dia a dia e os desafios.Nossa comunicação será por e-mail e telefone - confira se seus dados estão atualizados. CONHEÇA MAIS SOBRE O QUE É SER RAÍZENQue tal conhecer mais sobre como é fazer parte da Raízen e entender como a nossa cultura RAIZ contribui para um ambiente de trabalho em que você terá oportunidade de promover um impacto positivo no mundo?Nosso Instagram de Carreiras: @raizencarreirasNão é essa a vaga ideal? Volte para a página principal: https://carreiras.raizen.com.br/Também quer receber novidades sobre a Raízen no e-mail? https://chat.sparkrh.com/gente-raizen/news#VemSerRaízen",Raízen ,vacancy_type_effective,,False,Piracicaba,São Paulo,Brasil,https://genteraizen.gupy.io/job/eyJqb2JJZCI6NjE3OTg5OSwic291cmNlIjoiZ3VweV9wb3J0YWwifQ==?jobBoardSource=gupy_portal,False,hybrid,True
6265038,2023-12-11T14:15:26.075Z,Analista Administrativo - Presidente Prudente,"Nos tornamos referência em distribuição de autopeças para veículos pesados no Brasil.E o que nos torna grandes é muito mais que tamanho e capacidade, é nossa paixão por veículos comerciais e pesados, que transportam pessoas e insumos que constroem um Brasil cada vez mais forte e grandioso.São quase 1.000 colaboradores trabalhando focados em atender o cliente com a rapidez, a cortesia e a simpatia que só a Pacaembu tem.Responsabilidades e atribuiçõesIrá atuar com a liderança da filial, será a linha de frente dos processos administrativos, esclarecimento de dúvidas dos colaboradores, envio de informações sobre os colaboradores para matriz, envio de informações para a área fiscal, contábil e demais informações pertinentes.Requisitos e qualificaçõesEnsino superior completo. Desejável curso de especialização na área. Experiência comprovada em Carteira. Pacote Office Intermediário Noções de legislação tributária e Trabalhista Informações adicionaisBenefícios: Vale transporte, Assistência médica, Assistência odontológica, Vale alimentação ou Vale refeição, Gympass e Parceria de estudos com o SENAC e Parceria com o SESC. Venha fazer parte dessa história, vem ser Pabu!!!",Pacaembu Autopeças,vacancy_type_effective,,False,Presidente Prudente,São Paulo,Brasil,https://pabu.gupy.io/job/eyJqb2JJZCI6NjI2NTAzOCwic291cmNlIjoiZ3VweV9wb3J0YWwifQ==?jobBoardSource=gupy_portal,True,on-site,True
6227139,2023-12-11T14:13:49.808Z,ANALISTA SUPORTE BILINGUE JR N1,"Somos a maior multinacional brasileira e estamos entre as 100 maiores empresas de TI do mundo.Estamos presentes em 41 países com +30k colaboradores. A Stefanini tem como principal objetivo auxiliar os clientes a encontrar, por meio de soluções personalizadas, a maneira ideal para alcançar seus desafios, impulsionando a inovação digital.E queremos mais!Responsabilidades e atribuiçõesAtendimento de demandas do Data Center , por telefone e e-mailControle de acessosAtendimento ao cliente e indicadoresRegistrar, comunicar, direcionar e analisar todos os chamados sejam eles incidentes reportados, solicitações de serviço e informaçõesMonitorar o cicio de vida dos incidentes e requisiçõesRegistrar e acompanhar todos os incidentes e solicitações de serviço visando o cumprimento do Nível Minimo de Servico (SLA)Realizar o encaminhamento de chamados. fazendo escalonamento e acompanhamento de resoluçãoMonitorar e acompanhar o status de todos os chamados registrados, mantendo os usuários informados do andamento dos atendimentosRequisitos e qualificaçõesExperiência como técnico de suporteInglês avançadoVivência em Redes, NOC ou MonitoramentoHorario: escala 12x36, das 19h as 7hLocal: Brasilia/DFInformações adicionaisO que te oferecemos:🍛 Vale Alimentação ou Vale Refeição;👨🏼‍🎓 Desconto em cursos, universidades e instituições de idiomas; 📚 Academia Stefanini - plataforma com cursos online, gratuitos, atualizados e com certificado; 🗣 Mentoring;🏫 Auxílio Creche; 💉 Clube de vantagens para consultas e exames;🏥 Assistência Médica;🦷Assistência Odontológica; 💰 Clube de vantagens e descontos nos melhores estabelecimentos;👂🏾 Atendimento psicológico online ao colaborador e seus dependentes;🛫 Clube de viagens;🐶 Convênio para Pet;e muito mais...",Stefanini Group,vacancy_type_effective,,False,Brasília,Distrito Federal,Brasil,https://stefanini.gupy.io/job/eyJqb2JJZCI6NjIyNzEzOSwic291cmNlIjoiZ3VweV9wb3J0YWwifQ==?jobBoardSource=gupy_portal,True,on-site,True
5589890,2023-12-11T14:10:32.020Z,ANALISTA SUPORTE BILINGUE JR N1,"Somos a maior multinacional brasileira e estamos entre as 100 maiores empresas de TI do mundo.Estamos presentes em 41 países com +30k colaboradores. A Stefanini tem como principal objetivo auxiliar os clientes a encontrar, por meio de soluções personalizadas, a maneira ideal para alcançar seus desafios, impulsionando a inovação digital.E queremos mais!Responsabilidades e atribuiçõesAtendimento de demandas do Data Center , por telefone e e-mailControle de acessosAtendimento ao cliente e indicadoresRegistrar, comunicar, direcionar e analisar todos os chamados sejam eles incidentes reportados, solicitações de serviço e informaçõesMonitorar o cicio de vida dos incidentes e requisiçõesRegistrar e acompanhar todos os incidentes e solicitações de serviço visando o cumprimento do Nível Minimo de Servico (SLA)Realizar o encaminhamento de chamados. fazendo escalonamento e acompanhamento de resoluçãoMonitorar e acompanhar o status de todos os chamados registrados, mantendo os usuários informados do andamento dos atendimentosRequisitos e qualificaçõesExperiência como técnico de suporteInglês avançadoVivência em Redes, NOC ou MonitoramentoHorario: escala 12x36, das 7h as 19hLocal: Brasilia/DFInformações adicionaisO que te oferecemos:🍛 Vale Alimentação ou Vale Refeição;👨🏼‍🎓 Desconto em cursos, universidades e instituições de idiomas; 📚 Academia Stefanini - plataforma com cursos online, gratuitos, atualizados e com certificado; 🗣 Mentoring;🏫 Auxílio Creche; 💉 Clube de vantagens para consultas e exames;🏥 Assistência Médica;🦷Assistência Odontológica; 💰 Clube de vantagens e descontos nos melhores estabelecimentos;👂🏾 Atendimento psicológico online ao colaborador e seus dependentes;🛫 Clube de viagens;🐶 Convênio para Pet;e muito mais...",Stefanini Group,vacancy_type_effective,,False,Brasília,Distrito Federal,Brasil,https://stefanini.gupy.io/job/eyJqb2JJZCI6NTU4OTg5MCwic291cmNlIjoiZ3VweV9wb3J0YWwifQ==?jobBoardSource=gupy_portal,True,on-site,True
6264697,2023-12-11T14:07:51.111Z,Analista de Marketing Digital - SEDE ,"O Grupo Muffato é uma empresa que está em constante transformação, na busca de sempre trazer o que há de melhor a nossos clientes.Se interessou? Faça já a sua inscrição!Responsabilidades e atribuições• Cadastrar e atualizar informações detalhadas dos produtos, incluindo descrições, imagens e atributos específicos.• controlar a padronização de imagens de produtos do catálogo, incluindo lâminas, vídeos, etc• Mapeamento e criação e manutenção das árvores de categorias e marcas;​• Garantir a consistência e precisão das informações dos produtos em todas as plataformas.• Colaborar com equipes internas para garantir que os produtos sejam exibidos de maneira eficaz e estratégica.• Realizar pesquisas de mercado para otimizar as descrições e estratégias de apresentação de produtos.• Acompanhar métricas de desempenho relacionadas às páginas de produtos, identificando oportunidades de melhoria.• Trabalhar em estreita colaboração com a equipe de marketing para garantir que as campanhas promocionais estejam alinhadas com as informações do produto.• Manter-se atualizado sobre tendências de e-commerce e práticas recomendadas.Requisitos e qualificaçõesFormação em Administração, Marketing e áreas afins;Conhecimento de informática avançado;Conhecimento sobre os sistemas e ferramentas utilizados no setor;Conhecimento sobre as rotinas do setor relacionadas à elaboração e divulgação de mídias digitais;Domínio das Ferramentas pagas (Facebook ADS e Google ADS). Informações adicionaisAlimentação no local;Descontos em empresas parceiras;Cartão convênio;VTTreinamentos e formações pela nossa Universidade corporativa - UniffatoPlano Carreira",Grupo Muffato,vacancy_type_effective,,False,Londrina,Paraná,Brasil,https://grupomuffatovagas.gupy.io/job/eyJqb2JJZCI6NjI2NDY5Nywic291cmNlIjoiZ3VweV9wb3J0YWwifQ==?jobBoardSource=gupy_portal,True,on-site,True
6264701,2023-12-11T14:05:58.140Z,Analista de Custos SR,"Buscamos pessoas que sejam movidas por paixões como a que inspirou o nascimento do Grupo L’Occitane, e que juntamente conosco, estejam dispostas a assumirem os desafios e continuarem escrevendo nossa história!L'OCCITANE é uma empresa de igualdade de oportunidades. Isso significa que, ao tomar decisões sobre a carreira de nossos L’Occitaners, nossas principais considerações são sua capacidade de realizar seu trabalho e se desenvolver em suas funções.Uma maneira de cultivar a mudança é criando um ambiente de trabalho mais diverso e inclusivo, como cultura organizacional. Para isso, estamos comprometidos em construir um ambiente que seja livre de discriminação e assédio onde todas as pessoas se sintam respeitadas e valorizadas.Nós recrutamos pessoas de mente positiva que compartilham nossos valores fundamentais e nosso compromisso com Sustentabilidade.Venha fazer parte do nosso time! 💛🌿Nosso escritório está localizado em São Paulo/SP no bairro Chácara Santo Antônio (região do Morumbi) e atuamos em formato híbrido (3x presencial e 2x home office)Responsabilidades e atribuiçõesAnalise custo médio de estoque;Cálculo em IFRS / BRGAAP de custo de revenda;Cálculo e analise custo a nível SKU, Marca, Canal, Categoria, Etc...Análise de GM de Produto e GM de Canal a nível SKU, Marca, Categoria, Etc..Realizar lançamento contábeis, assim com rodar rotinas de ajuste de estoque no Sistema SAP;Preparar e Reportar relatórios a Matriz;Revisar e Reportar para Gerencia as conciliações de todo grupo de Estoque;Montar e enviar para a diretoria relatórios mensais de comparação de GM entre Actual x BDG x REF x LY;Analisar Movimentos de estoque por planta e deposito no SAP;Calculo e apuração de custo real de produtos importados e nacionais;Efetuar calculo de estudo de viabilidade de novos projetos de lançamento;Coordenação de cronograma e alinhamento das atividades para calculo de BDG/REFs;Projeção e calculo de Custo de Produto para BDG/REF, de 100% das linhas CMV;Analise das variações entre BDG/REF vs. LY vs. Actual.Requisitos e qualificaçõesEnsino Superior Completo em Contabilidade ou área similar;Excel Avançado;Vastos Conhecimentos do ERP SAP;Conhecimento das Normas Internacionais de Contabilidade (IAS / IFRS);Experiencia com elaboração e apresentação de Relatórios Gerenciais;Informações adicionaisBenefícios:VR/VA (Flash)VT ou EstacionamentoSeguro de VidaAssistência médicaAssistência odontológicaPrograma Soul (programa de saúde psicológica e bem estar)Day off de aniversário e vale presenteTotal PassDescontos L'Occitane",Grupo L'Occitane,vacancy_type_effective,2023-12-18T00:00:00.000Z,False,São Paulo,São Paulo,Brasil,https://sejaloccitane.gupy.io/job/eyJqb2JJZCI6NjI2NDcwMSwic291cmNlIjoiZ3VweV9wb3J0YWwifQ==?jobBoardSource=gupy_portal,True,hybrid,True
