job_id,published_date,title,description,career_page_name,type,application_deadline,is_remote_work,city,state,country,job_url,disabilities,workplace_type,submitted
6420852,2023-12-26T18:23:37.427Z,ANALISTA CORP SSMA JR,"Buscamos pessoas que sejam inovadoras, que possuam foco nos resultados, preocupação com a segurança e que sejam compromissadas com as pessoas. Acreditamos que nossa força vem de um trabalho colaborativo. Sempre buscamos inovar para oferecer as melhores soluções aos nossos clientes internos e externos. Por isso, nos dedicamos à busca contínua da excelência. Se você acredita que pode fazer a diferença, junte-se ao nosso time. Incentivamos a candidatura de pessoas negras, pessoas com deficiência, LGBTQIAPN+ e/ou de diferentes gerações. #VemSerTelemont.Responsabilidades e atribuiçõesResponsável pela análise dos indicadores de gestão, através da aplicação dos métodos de solução de problemas, elaborando e acompanhando os planos de ação, controles e relatórios que suportam a tomada de decisão bem como implementando a estratégia de cada regional no que tange a segurança, saúde e meio ambiente;Apoiar na execução dos planos de ação com o objetivo de alcançar a melhoria contínua dos processos e resultados.Realizar à compilação dos indicadores de segurança, saúde e meio ambiente, elaborando, atualizando e divulgando os devidos reportes à Segurança do Trabalho Corporativa e líderes visando maior transparência às atividades do setor.Solicitar e propor plano de ação quando os índices não atingirem as metas, visando a melhoria dos processos;Avaliar e consolidar os indicadores dos comitês, ausência, pautas, realização das reuniões, performance das reuniões, com o objetivo de avaliar a participação das demais regionais.Identificar, avaliar e consolidar a aderência das Boas Práticas;Identificar oportunidades de melhoria do sistema de gestão propondo novas medições e aperfeiçoamento do método;Elaborar plano de comunicação de SSMA;Realizar a gestão de indicadores e documentos de terceiros;Executar outras atividades de mesma natureza, nível de complexidade e responsabilidadeRequisitos e qualificaçõesEnsino superior em andamento em Administração, Economias, Engenharias e áreas afins.Desejável 06 meses na função.Pacote office intermediário com ênfase em Excel.Conhecimento de requisitos legais de Saúde e Segurança.Conhecimento em Indicadores de Desempenho.Desejável conhecimento em BI.Desejável conhecimento em PDCA.Informações adicionaisBenefícios:Assistência médica;Assistência odontológica;Auxílio academia;Vale refeição ou alimentação;Vale-transporte;Seguro de vida;Descontos em farmácias e lojas parceiras.Horário de Trabalho: comercial, de segunda a sexta-feira.",TELEMONT,vacancy_type_effective,,False,Belo Horizonte,Minas Gerais,Brasil,https://telemont.gupy.io/job/eyJqb2JJZCI6NjQyMDg1Miwic291cmNlIjoiZ3VweV9wb3J0YWwifQ==?jobBoardSource=gupy_portal,True,hybrid,True
6509960,2023-12-26T18:22:28.767Z,Analista Fiscal Sênior (Temporário),"Aprender, desaprender e reaprender faz parte da nossa rotina! #SomosGente e temos um olhar aberto ao mundo e a todas as possibilidades que ele nos oferece. Se você é apaixonado por descomplicar, costuma pensar com ousadia e foco em resultados, dá uma olhadinha em nossas oportunidades e #VemFazerAcontecer junto com a gente! #VemSerBern Estamos com uma vaga para atuar como Analista Fiscal Sênior - Temporário para atuar dentro de um dos nossos clientes!! 🚀😍Responsabilidades e atribuiçõesComo será o seu dia a dia?Realizar análise detalhada das informações contábeis, fiscais e financeiras para a elaboração da Declaração de Imposto de Renda da Pessoa Jurídica (IRPJ) para empresas tributadas pelo lucro real.Assegurar a conformidade com as normas fiscais e regulamentações vigentes, acompanhando alterações na legislação e aplicando as devidas atualizações.Participar de estratégias de planejamento tributário para otimizar a carga fiscal da empresa, identificando oportunidades legais para redução de impostos.Colaborar com processos de auditoria fiscal, preparando documentação e fornecendo suporte para garantir a conformidade e transparência nas operações fiscais.Manter uma comunicação proativa com órgãos fiscais, respondendo a consultas, resolvendo pendências e garantindo o cumprimento de prazos.Requisitos e qualificaçõesHard SkillsFormação superior em Ciências Contábeis, Administração ou áreas relacionadas.Experiência sólida em análise fiscal, com foco específico em Imposto de Renda da Pessoa Jurídica (IRPJ).Conhecimento profundo das normas fiscais, especialmente aquelas relacionadas à tributação pelo lucro real.Habilidade em planejamento tributário e aplicação prática das leis tributárias. Soft SkillsCapacidade de trabalhar com precisão e atenção aos detalhes.Informações adicionais#SomosGente e por isso apoiamos e valorizamos nossos colaboradores! Veja alguns benefícios que oferecemos para nossos #BernsLovers:⭐ Plano de saúde;⭐ Plano odontológico;⭐ Swile Alimentação⭐ Swile mobilidade (quando for ao escritório);⭐ Programa de incentivo à saúde física: Gympass;⭐ Programa de incentivo à saúde emocional: Moodar;⭐ Regime híbrido (de segunda a sexta-feira);⭐ Localização: Jaboatão dos Guararapes - PEAlém de um ambiente descontraído e de muito aprendizado! Massa, né não?! #VemSerBern 💙",Bernhoeft,vacancy_type_temporary,,False,Recife,Pernambuco,Brasil,https://vemserbern.gupy.io/job/eyJqb2JJZCI6NjUwOTk2MCwic291cmNlIjoiZ3VweV9wb3J0YWwifQ==?jobBoardSource=gupy_portal,True,hybrid,True
6509992,2023-12-26T18:22:06.331Z,JBS Couros | Analista de Projetos,"Olá! Estamos com uma oportunidade para Analista de Projetos na nossa unidade de Porangatu-GO.Responsabilidades e atribuiçõesAnalisar o desenvolvimento de processos industriais, englobando maquinários, ergonomia, pessoas, objetivando melhoria de produtividade, qualidade e redução de desperdícios;Análise crítica das técnicas e equipamentos empregados no processo industrial analise de tempo e métodos;Implementação de melhorias e solução de problemas PDCA;Desenvolver projetos de melhoria continua dos processos existentes, seja para adaptação de métodos de trabalho ou implementação de tecnologias mais modernas e inovadores;Implementar e realizar auditorias do Sistema de Manufatura;Avaliar oportunidade, custo, tempo.Requisitos e qualificaçõesEnsino superior completo ou cursando Engenharia da Produção (ou áreas afins);Conhecimento avançado no Pacote Office (Excel, Word e Power Point);Disponibilidade para viagens.Informações adicionaisRestaurante da unidadeTransportePlano OdontológicoTelemedicinaAdiantamento salarial - PicPayConvênio com Instituição de Ensino (EAD)Seguro de vidaCesta básicaGympass",JBS,vacancy_type_effective,,False,Porangatu,Goiás,Brasil,https://jbs.gupy.io/job/eyJqb2JJZCI6NjUwOTk5Miwic291cmNlIjoiZ3VweV9wb3J0YWwifQ==?jobBoardSource=gupy_portal,True,on-site,True
6509930,2023-12-26T18:20:12.324Z,ANALISTA ATUARIAL SR  ,"Atuar nas atividades de diversas complexidades nos processos de precificações, analisar e efetuar cálculos de reajustes dos contratos, por meio de projeções, subsidiando a Área Comercial com dados e argumentos de negociação junto ao cliente, com o objetivo de manter o equilíbrio da carteira de clientes da Unimed Nacional, analisar e efetuar cálculos de reajuste de prestadores e cálculos de impacto nos custos, atendendo as demandas atuariais, visando o controle e crescimento dos negócios da organização.Responsabilidades e atribuiçõesOrientar e realizar levantamentos de dados e cálculos estatísticos para as demandas da empresa, analisando as informações, e gerando relatórios paraanálise e tomada de decisão;Calcular os reajustes de projeções a fim de assistir a área de negócios nas negociações com os clientes;Orientar e realizar cálculos estatísticos visando o provisionamento necessário para garantia do cumprimento da regulamentação da ANS, providenciando a elaboração de nota técnica atuarial de Provisões (ANS);Orientar e realizar a precificação (análise de preços de produtos de assistência à saúde, saúde ocupacional e acidente de trabalho) por meio de cálculos atuariais com o objetivo de assistir a área de negócios no fechamento de novos contratos, atuando com autonomia;Efetuar cálculo dos impactos dos reajustes dos custos assistenciais, verificando e quantificando as alterações nas despesas, para o reajuste de Médicos, Rede Direta e Rede Indireta;Atender a demandas variadas com o cunho matemático/atuarial solicitadas por Gerências, e Diretorias, bem como esclarecer dúvidas as demais áreas da empresa referente assuntos técnicos atuariais;Realizar atividades para a Auditoria Médica e Medicina Preventiva, com o objetivo de dar subsídios para determinação de ações de auditoria e prevenção;Realizar a validação dos dados do SIP (Sistema de Informações de Produtos), referente a toda a utilização do custo assistencial informações quantitativas (internações /exames, etc.), e custo;Cumprir o regulamento interno, os requisitos dos sistemas de gestão da qualidade, observação e cumprimento das regulamentações da ANS, bem como das normas e procedimentos de saúde, higiene e segurança do trabalho inerentes ao setor, a utilização de EPI's/EPC's (Equipamento de proteção individual/Equipamento de proteção coletivo) quando a atividade assim o exigir.Requisitos e qualificaçõesSuperior em Ciências Atuariais;Desejável cursos de especialização ou MBA;Técnicas atuariais de análise de carteira, produtos, contratos e operadora;Conhecimento em regulação do mercado de saúde;Domínio do Pacote Office;Conhecimento em pacotes estatísticos.Conhecimento em linguagem de programação (SQL, SAS e/ou R serão diferenciais).Informações adicionaisModelo Híbrido.",Unimed Nacional,vacancy_type_effective,2024-01-15T00:00:00.000Z,False,São Paulo,São Paulo,Brasil,https://unimednacional.gupy.io/job/eyJqb2JJZCI6NjUwOTkzMCwic291cmNlIjoiZ3VweV9wb3J0YWwifQ==?jobBoardSource=gupy_portal,True,hybrid,True
6507102,2023-12-26T18:17:29.332Z,Analista de Privacidade - CE,"No nosso dia a dia trabalhamos para deixar uma marca positiva no mundo, resolver os principais problemas dos nossos clientes e inspirar os outros a fazê-lo. Somos pessoas corajosas, ousadas, honradas, confiantes, inspiradoras e fortes.﻿MISSÃO: Operacionalizar com excelência o Microcrédito líder do Brasil, criando oportunidades, desenvolvendo e valorizando as pessoas.VISÃO: Ser reconhecida pela excelência na operacionalização dos serviços de microfinanças e referência no desenvolvimento das pessoas.VALORES: Ética e Transparência; Compromisso e Excelência; Empatia e Cuidado; Criatividade e Inovação; Respeito e Inclusão.A pessoa Analista de Privacidade será responsável por executar e acompanhar as atividades referente a Lei Geral de Proteção de dados, promovendo alinhamento dos processos, elaboração e atualização de Programa de Privacidade e Proteção de Dados Pessoais e demais normativos relacionados ao tema, garantindo o atendimento às diretrizes da LGPD. Se esta função está alinhada ao seu propósito profissional, vem pra CAMED MICROCRÉDITO!Responsabilidades e atribuiçõesGarantir a adequação à Lei Geral de Proteção e Dados (LGPD) por parte das empresas;Apoiar no desenvolvimento, análise e implementação das políticas, normas e procedimentos internos de proteção de dados e privacidade, bem como normas cujo impacto é direto em iniciativas da área;Apoiar para manter o mapeamento de fluxos de dados pessoais atualizado (ROPA);Auxiliar no processo de mapeamento, classificação e gestão de riscos das operações de tratamento de dados pessoais;Analisar e implementar medidas necessárias para minimizar os riscos relacionados à privacidade e proteção de dados pessoais;Apoiar na avaliação da proteção de dados pessoais em terceiros (Due Diligence);Apoiar as Áreas de Negócio na elaboração e atualização nos Relatórios de Legítimo Interesse e no Relatório de Impacto à Proteção de Dados;Analisar e validar bases legais de tratamento de dados pessoais;Realizar registro dos controles internos, propositura de planos de ação e diretrizes de monitoramento de privacidade de dados pessoais;Criar e implementar treinamentos e atividades de conscientização de colaboradores a respeito da privacidade e da proteção de dados; entre outras.Avaliar projetos com relação aos requisitos de privacidade e proteção de dados (privacy by design);Apoiar no processo de registro, tratamento de incidentes de segurança de dados pessoais e comunicação à Autoridade Nacional de Proteção de Dados - ANPD;Acompanhar e monitorar ações de redução de danos, em casos de incidentes de segurança de dados (vazamentos, alterações, perdas, etc); Participar da implementação de indicadores relacionados ao Programa de Privacidade e Proteção de Dados Pessoais;Prestar suporte e orientação às áreas internas nas questões relacionadas a privacidade e proteção dos dados pessoais;Entre outras atividades inerente ao cargo.Requisitos e qualificaçõesRequisitos obrigatórios:Ensino superior completo em Administração, Ciências Contábeis, Economia, Direito, Sistemas da Informação, Tecnologia da Informação ou áreas correlatas;Cursos relacionados à Privacidade e Proteção de Dados e temas correlatos;Conhecimentos e vivência voltados à Lei Geral de Proteção de Dados (LGPD), Privacidade e Segurança;Desejável experiência em processos de adequação à LGPD;Conhecimento em nível intermediário ou avançado em Pacote Office;Certificações em proteção de dados pessoais (EXIN, IAPP, etc) são diferenciais;Conhecimento em Segurança da Informação, identificação de vulnerabilidades e riscos, estabelecimento e análise de controles;Desejável conhecimento de normas de certificação (NIST, ISO 27001 e ISO 27701).Informações adicionaisSalário: Salário Base de R$ 3.558,86.Benefícios:Treinamentos;Seguro de vida;Plano de saúde;Vale transporte;Plano odontológico;Plano de previdência privada;Reembolso creche/babá para filhos de até 06 anos;Programa de incentivo a saúde através do GYMPASS;Auxílio alimentação e auxílio cesta básica somando o total de R$ 1.334,77.Horário de trabalho: Das 08:00h às 17:00h (Segunda à Sexta).",Camed Microcrédito,vacancy_type_talent_pool,2024-01-03T00:00:00.000Z,False,Fortaleza,Ceará,Brasil,https://camedmicrocredito.gupy.io/job/eyJqb2JJZCI6NjUwNzEwMiwic291cmNlIjoiZ3VweV9wb3J0YWwifQ==?jobBoardSource=gupy_portal,True,on-site,True
6039119,2023-12-26T18:16:32.421Z,Analista de Sucesso do Cliente B2B (Operadoras de Saúde/ SP) ,"Somos a Conexa, ecossistema digital de saúde integral , líder na América Latina. Contamos com milhares de médicos, psicólogos, nutricionistas e enfermeiros que, por meio de nossa plataforma, conseguem cuidar de pacientes em qualquer lugar que eles estejam. Unimos pacientes, profissionais, empresas e operadoras com o objetivo de reduzir as ineficiências de custo e qualidade de atendimento do sistema de saúde brasileiro.Nascemos com o objetivo de democratizar o acesso à saúde de qualidade, e acreditamos que corpo e mente precisam ser tratados de forma integrada para que o paciente tenha uma vida saudável.Atualmente, realizamos mais de 400 mil consultas por mês, sendo 180 mil em saúde mental. Com o nosso modelo de negócios, conseguimos cobrir 24 milhões de vidas.Temos um time formado por pessoas apaixonadas pelo que fazem e que acreditam em um futuro com mais saúde física e mental para todos!Responsabilidades e atribuiçõesAssegurar bom relacionamento com operadoras e/ou seguradoras de médio/grande porte;Promover ações de engajamento e encantamento com os pontos de contato nas operadoras de saúde;Participar de reuniões, alinhamentos, palestras e encontros com os pontos focais dos clientes;Apoiar o cliente a estruturar melhor divulgação e programas de saúde digital aos seus beneficiários;Mapear e executar ações de comunicação e engajamento dos beneficiários da carteira;Aumentar o nível de receita gerada com operadoras;Apresentar relatórios periódicos aos clientes, no intuito de demonstrar o ROI e melhoria de indicadores;Acompanhar o cliente em toda sua jornada, desenhando marcos de sucesso e traçando planos estratégicos de uso da solução;Responsável por acompanhar o comportamento do cliente frente ao mercado e novas iniciativas para que possamos sempre somar ao nosso produto;Centralizar a estratégia, contato, intermediação e definição das estratégias dos clientes em suas mãos;Demandar necessidades e atividades operacionais aos times internos com foco no atendimento ágil do cliente;Identificar novas oportunidades com as operadoras realizando Cross-selling e Upselling.Requisitos e qualificaçõesSuperior completo;Disponibilidade para trabalho híbrido (residir ou ter fácil acesso a Vila Olímpia/SP)Experiência de 02 anos ou mais com relacionamento e gestão de contratos pós-vendas B2B -diretamente com operadoras de saúde (imprescindível);Ter atuado na área de Sucesso do Cliente B2B - diretamente com operadoras de saúde (imprescindível);Conhecimento dos processos de Saúde Suplementar;Entendimento dos conceitos básicos de faturamento, TISS e TUSS;Excel intermediário/avançado;Comunicação assertiva e alta capacidade de se relacionar de forma estratégica com lideranças de operadoras e/ou seguradoras;Visão Client Centric e de Encantamento/Sucesso de Clientes.Visão de Novos Negócios e Crescimento de Receita;Visão de Vendas, Onboarding e Jornada do cliente.Informações adicionaisAqui você vai encontrar:Ambiente descontraído;Oportunidade de crescimento;Benefício Flexível (VA, VR, Mobilidade, Auxilio Home-Office, Saúde, Cultura);Plano de Saúde;Birthday off;Crédito Consignado;Seguro Vida;Programas de Bem-estar;Plataforma de Desenvolvimento;Modelo de Trabalho Híbrido(3x presencial e 2x homeoffice)",CONEXA,vacancy_type_effective,2024-01-31T00:00:00.000Z,False,São Paulo,São Paulo,Brasil,https://conexasaude.gupy.io/job/eyJqb2JJZCI6NjAzOTExOSwic291cmNlIjoiZ3VweV9wb3J0YWwifQ==?jobBoardSource=gupy_portal,True,on-site,True
6350901,2023-12-26T18:14:48.230Z,Analista de Sucesso do Cliente PL ( Empresas B2B  / SP),"Somos a Conexa, ecossistema digital de saúde integral , líder na América Latina. Contamos com milhares de médicos, psicólogos, nutricionistas e enfermeiros que, por meio de nossa plataforma, conseguem cuidar de pacientes em qualquer lugar que eles estejam. Unimos pacientes, profissionais, empresas e operadoras com o objetivo de reduzir as ineficiências de custo e qualidade de atendimento do sistema de saúde brasileiro.Nascemos com o objetivo de democratizar o acesso à saúde de qualidade, e acreditamos que corpo e mente precisam ser tratados de forma integrada para que o paciente tenha uma vida saudável.Atualmente, realizamos mais de 400 mil consultas por mês, sendo 180 mil em saúde mental. Com o nosso modelo de negócios, conseguimos cobrir 24 milhões de vidas.Temos um time formado por pessoas apaixonadas pelo que fazem e que acreditam em um futuro com mais saúde física e mental para todos!Responsabilidades e atribuiçõesSer responsável pela carteira de empresas B2B Middle Touch, tendo como ponto focal nos clientes o RH (benefícios) e/ou área da saúde;Compreender os objetivos dos clientes e ajudá-los desenvolvendo estratégias durante a parceria para alcançar os objtivos específicos do cliente com o programa;Acompanhar o cliente em toda sua jornada, desenhando marcos de sucesso e traçando planos estratégicos de uso da solução;Realizar reuniões periódicas com os clientes de forma virtual ou presencial para apresentar indicadores, identificar novas oportunidades e acompanhar o funcionamento do programa, garantindo que esteja alinhado com os objetivos do cliente;Definir estratégias de divulgação e eventos para aumentar o engajamento e adesão dos serviços em conjunto com o cliente;Aumentar a receita do cliente realizando: Renovações de contrato, Cross-sell e Upsell;Ter interface com as áreas internas, como: suporte, financeiro, marketing, produto, implantação e áreas de saúde para direcionar as demandas e necessidades dos clientes;Ser responsável por acompanhar o comportamento do cliente frente ao mercado e novas iniciativas para que possamos sempre somar ao nosso produto.Requisitos e qualificaçõesSuperior completo;Experiência mínima de 02 anos em pós-vendas B2B como Customer Success, Key Account Manager ou Gerente de Contas com foco em clientes RH (benefícios) e/ou área da saúde (imprescindível);Experiência nas áreas de relacionamento pós-vendas responsável por carteira de empresas B2B Middle Touch (imprescindível);Excel intermediário/avançado(imprescindível);Comunicação assertiva e alta capacidade de se relacionar de forma estratégica com lideranças dos clientes(imprescindível);Visão Client Centric e de Encantamento/Sucesso de Clientes.Visão de Novos Negócios e Crescimento de Receita;Visão de Vendas, Onboarding e Jornada do cliente.Informações adicionaisAqui você vai encontrar:Ambiente descontraído;Oportunidade de crescimento;Benefício Flexível (VA, VR, Mobilidade, Auxilio Home-Office, Saúde, Cultura);Plano de Saúde;Seguro de Vida;Programas de Bem-estar (Telemedicina, Telepsicologia);Birthday off;Crédito consignado;Plataforma de Desenvolvimento;Modelo de Trabalho Híbrido(3x presencial e 2x homeoffice).",CONEXA,vacancy_type_effective,,False,São Paulo,São Paulo,Brasil,https://conexasaude.gupy.io/job/eyJqb2JJZCI6NjM1MDkwMSwic291cmNlIjoiZ3VweV9wb3J0YWwifQ==?jobBoardSource=gupy_portal,False,hybrid,True
6509918,2023-12-26T18:10:39.675Z,PESSOA ANALISTA DE TESTES / QA PL   ,"A NAVA está em busca de uma Pessoa Analista de Testes / QA PLENO para fazer parte do nosso time de pessoas incríveis!  Por que trabalhar na NAVA?Somos uma empresa de tecnologia que atende as maiores companhias dos setores financeiro, seguros, meios de pagamento, telecomunicações, energia e varejo do país. Inspiramos nossos times a criar soluções para que essas companhias transformem e impactem positivamente o mundo.  Temos um time curioso, criativo, energético e inspirador, com grande foco nas pessoas para gerar inovação, transformação e crescimento. Dentro de um ambiente dinâmico e ágil, o nosso time está em expansão para acompanhar o crescimento exponencial da NAVA e dos nossos Clientes. Responsabilidades e atribuiçõesComo será o seu dia a dia?Planejamento dos testes e elaboração do plano de testes visando reutilização;Identificação e definição dos testes exigidos;Monitoramento do processo de teste em detalhes e seus respectivos resultados;Deve garantir a qualidade dos componentes produzidos por meio da verificação de evidência de testes e utilização de técnicas especializadas em testes de programas e sistemas;Registra não conformidades relativas à arquitetura e/ou modelagem dos sistemas.Elabora os cenários e casos de testes, especifica a massa de dados para testes, elabora e implementa os procedimentos (scripts) e roteiros de teste.Avalia os riscos e impactos nos testes, valida a configuração do ambiente necessário para realização dos testes.Desenvolvimento, manutenção e execução de testes automatizados (conhecimento de plataformas tais como Selenium, Lean FT, JMeter, etc)Conhecimento logico de analise de sistemas para alicerce na execução dos testesRequisitos e qualificaçõesConhecimentos técnicos:Selenium, Lean FT, JMeterCompetências Desejadas:Conhecimento / Vivencia ( diferencial relevante )Conhecimento no mercado de CapitaisConhecimento do mercado bancarioSistemas de Negociação de Bolsa de ValoresCMACedroSistemas de Pós NegociaçãoSinacorInoaCIR - Calculadora de IRInternet BankingSistemas Mobile Conhecimento lógico de Infra-EstruturaRedesTelecomunicaçõesPerimetros (Firewall)WindowsLinuxAmbientes On PremissesNuvemAWSAzureMetodosAgilKanbanScrumSafeItil Ferramentas de gestãoJiraService NowInformações adicionaisHorário de trabalho: Comercial Modelo de trabalho para este projeto/cliente: Híbrido Local de trabalho: São PauloAlém de ser uma empresa certificada Great Place to Work, você vai encontrar na NAVA: ✅ Oportunidades de carreira 🚀✅ Liberdade para escrever seu próprio código 🏆✅ Diversidade e diferentes formas de ver o mundo 🌈✅ Comunidades que incentivam o crescimento de todos 📚✅ Treinamento In Company 💻✅ Um time incrível 😎✅ Empresa engajada no Pacto Global da ONU 💪🏼✅ Projetos inovadores 💡✅ Alta avaliação no Glassdoor 📣 ",NAVA | Technology for Business,vacancy_type_effective,,False,São Paulo,São Paulo,Brasil,https://nava.gupy.io/job/eyJqb2JJZCI6NjUwOTkxOCwic291cmNlIjoiZ3VweV9wb3J0YWwifQ==?jobBoardSource=gupy_portal,True,hybrid,True
