job_id,published_date,title,description,career_page_name,type,application_deadline,is_remote_work,city,state,country,job_url,disabilities,workplace_type,submitted
6522332,2023-12-28T19:18:28.205Z,Analista de Atração e Seleção Sênior ,"Abraçamos a missão de prestar serviços jurídicos de máxima qualidade, com agilidade, atendimento personalizado e disponibilidade integral ao cliente. Não abrimos mão da ética e da transparência em nossos negócios e relações cotidianas, pois, somente dessa forma, garantimos relações sustentáveis e de longo prazo.Promovemos um ambiente que valoriza a autonomia e as entregas diferenciadas e, com isso, o dia a dia do profissional conta com inúmeros desafios enriquecedores.Responsabilidades e atribuiçõesSer responsável pela rotina de atração e seleção, desde o alinhamento do perfil até a fase de admissão.Conduzir o alinhamento de perfis junto a liderança da vaga, alinhando o perfil comportamental de forma estratégica.Garantir divulgações, entrevistas e propostas.Atuar com as melhores práticas, focando na experiência do profissional apoiando a melhoria de processos e busca por novos talentos.Mapeamento estratégico de mercado.Ações de Marca Empregadora.Relacionamento com as faculdades.Auxiliar em demandas extras de RH.Requisitos e qualificaçõesSuperior Completo: Administração, Psicologia ou áreas relacionadas.Conhecimentos específicos: pacote office.Habilidades comportamentais: agilidade, bom relacionamento interpessoal, senso de urgência, orientação a resultado, atenção difusa, resiliência, iniciativa e autonomia.Diferencial: experiência como Headunter, Recruiter e/ou experiência em escritório de advocacia.Informações adicionaisLocal: Botafogo/RJ  (regime híbrido) Benefícios:PLR;Vale-refeição ou alimentação;Vale-transporte;Assistência médica;Assistência odontológica; Seguro de vida em grupo;Previdência privada;Auxílio creche. Nós queremos ser a sua escolha!",Bichara Advogados,vacancy_type_effective,2024-01-29T00:00:00.000Z,False,Rio de Janeiro,Rio de Janeiro,Brasil,https://bichara-advogados.gupy.io/job/eyJqb2JJZCI6NjUyMjMzMiwic291cmNlIjoiZ3VweV9wb3J0YWwifQ==?jobBoardSource=gupy_portal,True,on-site,True
6522090,2023-12-28T19:16:24.627Z,Analista de Marketing Branding e Digital Pleno,"Na Britvic Brasil trabalhamos com a missão de nos tornarmos a empresa de bebidas não alcoólicas mais dinâmica do mundo para criar um amanhã melhor, com o propósito de estar sempre aproveitando os momentos da vida. Aqui, #SomosOusados para atingir todos os dias resultados inovadores. #SomosÁgeis e vencemos a complexidade para criar novas oportunidades. Buscamos trabalhar todos os dias guiados pelo sentimento de ownership, pois todos #SomosDonos do agora e do futuro da nossa companhia. #NósCuidamos de nossas marcas, do nosso papel na sociedade e do impacto no planeta. Mas, acima de tudo, é a felicidade do nosso time que sempre vêm em primeiro lugar, por isso acreditamos verdadeiramente que #JuntosSomosMaisFortes.Responsabilidades e atribuiçõesConhecimento e experiência em Marketing Digital, Marketing de influência e Comunicação (Branding &amp; PR);Desejável conhecimento em SEO e gestão das métricas junto às agências de Digital (CPA, CPV, CPC, CTR) noções de ROI, Canais de Mídia e Tráfego Pago);Gestão e orientação de campanhas de performance;Experiência em Branding e estratégia de marca;Apoiar o desenvolvimento, gestão, implementação e execução das estratégias de marcas;Dar suporte aos projetos de marketing, acompanhando todos os passos junto às áreas responsáveis e assegurando que todos os desdobramentos no Digital sejam realizados;Realizar interface com agências de comunicação, influenciadores, assessoria de imprensa, fornecedores e mídia;Realizar ações de marketing de influência, relações públicas e oportunidades de visibilidade para as marcas do portfólio no ambiente digital;Dar suporte à implementação do plano de marketing: execução de ações e eventos das marcas, desenvolvimento de apresentações da área de Marketing;Contato direto com o time de E-commerce e Marketing Corporativo;Apoiar a execução do Plano de Marketing no canal Digital: desdobramento das campanhas, calendário nas mídias, conteúdos, mídia;Gerenciar orçamento do departamento por marca fazendo controle do realizado VS projetado em Digital, padronizar envio de relatórios mensais;Contribuir com o êxito no lançamento de produtos, acompanhando o desenvolvimento de materiais promocionais junto à área de trade, apresentações, materiais para cadastro no cliente e cronograma.Requisitos e qualificaçõesFormação Superior Completa em Marketing, Publicidade e Propaganda, Administração de Empresas e Relações Públicas, ou áreas correlatas;Pós Graduação em áreas relacionadas é desejável;Inglês Avançado é essencial;Pacote Office é essencial;Experiência prévia em bens de consumo é desejável. Informações adicionais·        Plano de Saúde;·        Plano odontológico;·        Seguro de vida em grupo;·        Vale Refeição;·        Compra fácil dos nossos produtos com desconto;·        Desconto em instituições parceiras de ensino e lazer;·        Gympass;·        Cartão Farmácia.",Britvic Brasil,vacancy_type_effective,,False,São Paulo,São Paulo,Brasil,https://vemprabritvicbrasil.gupy.io/job/eyJqb2JJZCI6NjUyMjA5MCwic291cmNlIjoiZ3VweV9wb3J0YWwifQ==?jobBoardSource=gupy_portal,True,on-site,True
6522305,2023-12-28T19:16:13.344Z,Analista de Risco de Mercado e Liquidez Junior/Pleno,"A área de Riscos de Mercado, Liquidez e Capital alocada na Diretoria de Riscos e Compliance desempenha funções de forma corporativa atendendo às empresas do Conglomerado Fator. Realizando atividades para o controle e gerenciamento dos Riscos de Mercado, Liquidez e Capital, o acompanhamento e interpretação de normativos regulatórios, com o objetivo de manter os níveis desses riscos adequados às expectativas das empresas e produtos e aderentes às exigências dos reguladores e autorreguladores.Responsabilidades e atribuiçõesCálculo, análise, reporte e manutenção dos limites de riscos de mercado e liquidez do Banco Fator e dos fundos geridos pela FAR – Fator Administração de Recursos;Acompanhamento, cálculo e análise dos limites operacionais com base no capital;Confecção, análise e envio dos relatórios diários e mensais ao Banco Central, relativo aos riscos de mercado, liquidez e capital;Elaboração de material para o atendimento em processos de due diligences, questionamentos dos auditores ou órgãos reguladores;Condução de projetos de Risco de Mercado, Liquidez e Capital com áreas de suporte e de negócios relacionadas.Requisitos e qualificaçõesSuperior completo em Engenharia, Exatas, Administração, Economia ou cursos relacionados;Conhecimento com arcabouço normativo da CVM, Anbima e BACEN para as áreas de atuação do Fator;Conhecimento de precificação de instrumentos financeiros, inclusive crédito privado;Conhecimentos em Excel, VBA e Banco de Dados (Access e SQL).DIFERENCIALConhecimento na execução e validação dos documentos DDR, DRM e DRL;Conhecimento em análises na identificação, mensuração e controle do risco de variação das taxas de juros em instrumentos classificados na carteira bancária (IRRBB).Informações adicionaisAssistência Médica;Programa que cuida de você e seus familiares, com apoio psicológico, nutricional, fisioterápico e educador físico;Quick Massage;Gympass;Vale Refeição;Vale Alimentação;Vale Transporte ou Auxílio Estacionamento;Auxílio Creche e Babá;Day Off;Jornada de trabalho híbrida.",Vem Ser Fator,vacancy_type_effective,,False,São Paulo,São Paulo,Brasil,https://carreirasfator.gupy.io/job/eyJqb2JJZCI6NjUyMjMwNSwic291cmNlIjoiZ3VweV9wb3J0YWwifQ==?jobBoardSource=gupy_portal,False,hybrid,True
6522222,2023-12-29T02:11:32.755Z,Cientista de Dados Pleno,"Buscamos Cientista de DadosResponsabilidades e atribuiçõesEste profissional será a referência analítica do projeto, possuindo expertise técnica e raciocínio lógico. Sua responsabilidade principal é analisar dados, realizar segmentações e medir resultados, sendo mais voltado para análise do que modelagem de dados.Requisitos e qualificaçõesBom raciocínio lógicoAlto comprometimentoCenso de propriedadeRequisitos:SQLPYTHONInformações adicionaisO que oferecemos:. Vale Refeição (inclusive no mês das férias)· Vale Transporte· Assistência Médica· Assistência Odontológica· Seguro de Vida· Auxílio Creche. PLR· Auxílio Educacional. Parcerias com diversas instituições de ensino. Convênio com Cinemark. Programa interno de orientação psicológica, financeira e jurídica. Happy Day (day off no dia do aniversário)· Gympass. Ginástica Laboral. Banco de Horas",Confidencial,vacancy_type_effective,,False,São Paulo,São Paulo,Brasil,https://areaconfidencial.gupy.io/job/eyJqb2JJZCI6NjUyMjIyMiwic291cmNlIjoiZ3VweV9wb3J0YWwifQ==?jobBoardSource=gupy_portal,False,hybrid,True
6517060,2023-12-28T21:57:45.579Z,PREPARADOR DADOS,"Somos a maior multinacional brasileira e estamos entre as 100 maiores empresas de TI do mundo.Estamos presentes em 41 países com +30k colaboradores. A Stefanini tem como principal objetivo auxiliar os clientes a encontrar, por meio de soluções personalizadas, a maneira ideal para alcançar seus desafios, impulsionando a inovação digital.E queremos mais!Requisitos e qualificaçõesPREPARACAO DE DADOS3.4.1. NECESSIDADESa) As posicoes de servicos de preparacao de dados a serem contratadas deverao apresentar os seguintes requisitos minimos:A- Ter boa comunicacao, fluencia verbal e habilidade no trato com as pessoas;A- Ter escolaridade minima de 2o Grau;A- As posicoes de servicos de preparacao de dados deverao ter idade acima de 18 (dezoito) anos;b) A contratada designara pelo menos 01 (um) lider de equipe para cada localidade dentre a equipe alocada para a prestacao dos servicos, exceto na localidade do cliente Defensoria Publica;c) Os salarios iniciais a serem pagos as posicoes de servicos de preparacao de dados nao poderao ser inferiores aos praticados hoje na prestacao destes servicos;d) Apenas como informacao, o piso salarial normativo da categoria do sindicato A-SINDPD, da convencao coletiva atual, tem os salarios iniciais a serem pagos aos prestadores de servicos nao podem ser inferior a R$ R$ 1.204,95 (hum mil, duzentos e quatro reais e noventa e cinco centavos) aplicavel aos empregados integrantes da menor funcao e/ou atividade administrativa para a jornada de 40 (quarenta) horas semanais.2. Grau CompletoInformações adicionaisO que te oferecemos:🍛 Vale Alimentação ou Vale Refeição;👨🏼‍🎓 Desconto em cursos, universidades e instituições de idiomas; 📚 Academia Stefanini - plataforma com cursos online, gratuitos, atualizados e com certificado; 🗣 Mentoring;🏫 Auxílio Creche; 💉 Clube de vantagens para consultas e exames;🏥 Assistência Médica;🦷Assistência Odontológica; 💰 Clube de vantagens e descontos nos melhores estabelecimentos;👂🏾 Atendimento psicológico online ao colaborador e seus dependentes;🛫 Clube de viagens;🐶 Convênio para Pet;e muito mais...",Stefanini Group,vacancy_type_effective,,False,Sao Paulo,São Paulo,Brasil,https://stefanini.gupy.io/job/eyJqb2JJZCI6NjUxNzA2MCwic291cmNlIjoiZ3VweV9wb3J0YWwifQ==?jobBoardSource=gupy_portal,True,on-site,True
6522861,2023-12-28T20:29:32.772Z,Engenharia de Dados - Vaga afirmativa para Mulheres e/ou Pessoas Pretas/Pardas e/ou PCD,"A gente tem uma paixão enorme por dados e acreditamos que, pra continuar promovendo a transformação digital da maior cervejaria do planeta, precisamos de pessoas engajadas e dispostas a embarcar junto nessa jornada. A área engenharia de dados da Ambev Tech busca desenvolver soluções de dados que alimentem os dashboards e algoritmos utilizados nas areas estrategicas da maior cervejaria do mundo. Queremos democratizar o acesso aos dados, aproximando a companhia cada dia mais de uma cultura Data Driven. Nosso desejo é ter a máxima eficiência e assertividade na tomada de decisão, e qual a melhor forma de fazer isso senão com dados?  Responsabilidades e atribuiçõesAtuará no desenvolvimento de novas soluções para a área de Engenharia de Dados da Ambev Tech provendo dados aos times de Business Intelligence e Cientista de Dados;Automatizar os processos de ingestão de dados no Data Lake da maior cervejaria do mundo;Colaborar nas estratégias que potencializem a cultura Data Driven dentro da Ambev;Estar em constante interação com o time de plataforma de dados, propondo melhorias nas ferramentas de desenvolvimento em Analytics;Propor estratégias e ferramentas de monitoramento continuo das ingestões, performance e qualidade dos dados;Idealizar boas praticas de estruturação para as bases de dados, visando assegurar adequação, exatidão, alta performance e segurança das informações; Garantir as boas práticas de desenvolvimento no time, respeitando as diretrizes e padronizações do time de plataforma de dados;Trabalhar em ambiente ágil, entendendo prioridades de entregas e relacionamento entre os demais times; Ser a pessoa embaixadora da democratização de dados da maior cervejaria do mundo; Nossos valores são muitos importantes pois foram eles que nos trouxeram até aqui. Se você gosta de trabalhar em equipe, veste a camisa e lida com projetos de forma proativa, essa vaga é para você. Requisitos e qualificaçõesConhecimento sólido em  ferramentas voltadas a análise e manipulação de dados (Databricks, Datafactory); Criação e orquestração de pipelines utilizando o Azure Datafactory e o Airflow;Visão E2E de Arquitetura de Dados visando a integração do datalake com diferentes sistemas;Experiência nas ferramentas Azure voltada para soluções de dados; Experiência em processamento e transformação de dados utilizando Spark, Python/PySpark e SQL;Experiência em processamento de dados de mensageria (RabbitMQ, Service Bus); Versionamento de código em GitHub e CI/CD com Azure Devops; Informações adicionaisJornada de trabalho de 40 horas semanais;Vale refeição ou alimentação;Vale transporte;PPR;Plano de saúde e Telemedicina;Convênio odontológico;Auxílio educação;Self Learning (auxílio em cursos, certificações e idiomas);Seguro de vida;Empresa cidadã (licença maternidade e paternidade) e presente do bebê;Mercadotech (aplicativo de desconto nos produtos Ambev);Day off de aniversário;Banco de horas;Brahma Express;Gympass;14º salário;Self-friday (sexta-feira à tarde livre para estudos e autocuidado).",Ambev Tech,vacancy_type_effective,,True,,,Brasil,https://ambevtech.gupy.io/job/eyJqb2JJZCI6NjUyMjg2MSwic291cmNlIjoiZ3VweV9wb3J0YWwifQ==?jobBoardSource=gupy_portal,True,remote,True
6502236,2023-12-28T20:11:12.367Z,ANL ENGENHARIA DE DADOS PL - Atlas,"Você será responsável por capturar e armazenar dados brutos, modelar os datasets para catalogação e transformá-los em formatos prprios para consumo analítico e geração de valor;  Desenhar, desenvolver, implementar e operar pipelines de dados em uma arquitetura de Data Mesh para suportar as áreas de negcios;  Criação e evolução dos padrões e conceitos nas esteiras de dados;  Protagonista na disseminação da cultura data driven no dia a dia do projeto. Modelo de trabalho: Híbrido sem escalaResponsabilidades e atribuiçõesExperiência em ETL/ELT, Data Quality.  Vivencia em arquiteturas de dados Streaming e Batch.  Requisito conhecimento em pelo menos uma das linguagem: SQL, Python, Java, Scala.  Stack: AWS (s3, DynamoDB, Lambda, Athena, Glue, EMR, SNS, SQS, CloudFormation),  Stack: Open Source (Hadoop, Spark, Hive, Terraform)  Diferencial: Certificações AWS Requisitos e qualificaçõesInformações adicionaisVem ser Ituber &amp; vem fazer Itaú_ (colar no primeiro quadrado)O Itaú é a marca mais valiosa do Brasil, a melhor empresa para trabalhar segundo o Great Place to Work e o maior banco da América Latina. Nós impactamos diariamente mais de 60 milhões de clientes em 18 países. Somos feitos de pessoas e acreditamos que ter um quadro com pluralidade de origens, culturas, crenças, experiências, raças, deficiências, gêneros, orientações afetivo-sexuais e gerações ampliam as perspectivas e contribuem para um clima de respeito e valorização das diferenças. Não queremos você apenas por achar que tem a nossa cara. Queremos ter um pouco da sua também! O que você precisa para ser um Ituber? (colar no segundo quadrado)Estamos buscando pessoas que queiram se desenvolver e aprender constantemente, compartilhando, colaborando, inovando e entregando valor para todos os nossos clientes. Aqui a gente não sabe tudo, a gente vai de turma_Como é o dia a dia de um Ituber nessa área? (colar no terceiro quadrado)• (Descrever como é o dia a dia do profissional da área e/ou desafios) – Campo do Gestor/RecruiterNo que você precisa mandar bem? (colar no terceiro quadrado)• (Descrever os requisitos mínimos para a vaga) – Campo do Gestor/RecruiterAo se tornar um Ituber você tem_ (manter nesse quadrado)• Vale Transporte• Vale Refeição (Restaurantes) / Vale Alimentação (Supermercados)• Convênio médico e odontológico• Seguro de Vida• PLR – Participação nos Lucros e Resultados (Mediante resultados do banco)• Previdência privada• Descontos exclusivos em nossos produtos financeiros• Licença maternidade estendida &amp; paternidade• Auxílio Creche / Babá (para papais e mamães)• Incentivo a estudos• GymPass ou TotalPass• Acesso aos Clubes Itaú (Guarapiranga / Itanhaém e São Sebastião)• + Algumas vantagens que você pode conhecer durante o processo*Estimulamos candidaturas de pessoas com deficiência em todas as nossas posições, sendo assim, sinta-se à vontade para se candidatar em vagas sinalizadas como exclusivas ou não para pessoas com deficiência. Somos comprometidos com a inclusão e valorizamos a diversidade. #VemProItaú #VemSerItuber",Itaú Unibanco,vacancy_type_effective,,False,Sao Paulo,São Paulo,Brasil,https://vemproitau.gupy.io/job/eyJqb2JJZCI6NjUwMjIzNiwic291cmNlIjoiZ3VweV9wb3J0YWwifQ==?jobBoardSource=gupy_portal,False,hybrid,True
5795751,2023-12-28T19:42:23.050Z,ENGENHEIRO DE DADOS PL(RIO DE JANEIRO)- PRESENCIAL,"Nosso time é formado por excelentes profissionais da área da tecnologia.Colaboração e comprometimento fazem parte do nosso dia-a-dia, quando desenvolvemos novas funcionalidades, construindo um produto robusto e escalável.Fazendo parte de nossa equipe, seu trabalho irá impactar em milhares de usuários que utilizam nossa solução diariamente.Responsabilidades e atribuições  Atividades  Construir ferramentas e ambientes para gerenciar, otimizar, supervisionar e monitorar a recuperação, armazenamento, distribuição, transformação e qualidade de dados, uso de big data, elaboração de modelos e soluções analíticas,  construção de painéis/dashboards,  acompanhamento do ciclo de vida dos modelos analíticos e propor soluções que atendam às necessidades de negócio da BB ASSET. Requisitos e qualificaçõesFormação: Formação de nível superior na área de Ciência da Computação ou áreas afins.                  Conhecimento Técnico e experiência exigida:                   Python, SQL, governança de dados, Json, web scrapping, ETL, Spark, Hadoop e Nifi, experiência com análise, preparo e modelagem de dados Certificação: Não é exigida Informações adicionaisNossos benefícios:Plano de Saúde;Plano Odontológico;Seguro Prudential: é concedido ao colaborador, de forma gratuita o seguro de vida, auxílio funeral e cesta natalidade, conforme regras específicas da seguradora;Vale Refeição ou Vale Alimentação;Vale Transporte: é concedido ao colaborador, para uso no trajeto residência – trabalho – residência, e será descontado mensalmente o percentual de 6% sob o valor do salário, limitado ao valor do benefício (opcional);Day off: será concedido ao colaborador folga em virtude do dia do aniversário, devendo este ser usufruído na mesma data e/ou no mês do aniversário;Empréstimo Consignado;Convênios e Parcerias (Instituições de Ensino, Academias, Cursos de Idiomas entre outros);Ginástica Laboral.",Seja Globalweb,vacancy_type_effective,,False,Rio de Janeiro,Rio de Janeiro,Brasil,https://sejaglobalweb.gupy.io/job/eyJqb2JJZCI6NTc5NTc1MSwic291cmNlIjoiZ3VweV9wb3J0YWwifQ==?jobBoardSource=gupy_portal,False,on-site,True
6522357,2023-12-28T19:20:36.993Z,Cientista de Dados - Consultor,"Vem pra NÚCLEAJá imaginou se os meios de pagamento parassem de funcionar? Pois é, isso nem passa pela nossa cabeça, porque trabalhamos com inovação, confiabilidade e tecnologia de ponta para que você, pequenas ou grandes empresas possam fazer suas transações com total segurança e agilidade, a qualquer hora do dia ou da noite.Nosso ambiente é feito de gente movida pela vontade de interagir de forma colaborativa e disposta a se desafiar todos os dias. Estamos cheios de energia para continuar transformando o mercado financeiro. Temos muito Orgulho de Ser NÚCLEA.Sobre a NÚCLEAhttps://www.nuclea.com.br/Para todas as posições consideramos diversidade e inclusão.Na Núclea, valorizamos muito o respeito e a diversidade em nossas equipes, aqui, acreditamos que nossas diferenças são nossas maiores forças.De acordo com nossos valores, as pessoas estão no centro do nosso negócio e somente elas são capazes de movimentar a economia digital em benefício de toda a sociedade.Essa é a chance para você mudar a sua vida, corra e se inscreva!Responsabilidades e atribuiçõesProduzir, testar e experimentar modelos estatísticos aplicados as diferentes áreas de negócioCriar, manter e atualizar relatórios analíticos para a squad e para o negócioTrazer insigths e conduzir experimentos junto as áreas de negóciosAuxiliar o time de negócios e comercial em apresentações de produtos da empresa para potenciais clientesDesenvolver modelos preditivos com técnicas de machine learning para resolução de problemas de negócioElaborar apresentações técnicas para discussão e demonstração de resultados de análises e modelos para stakeholders técnicos da companhiaElaborar apresentações executivas para demonstração de resultados e produtos para executivos da companhia Requisitos e qualificaçõesFormação Acadêmica: Ensino Superior Completo em uma ou mais destas áreas:Ciência da computaçãoEstatísticaEngenhariasEconomiaMatemáticaÁreas congêneresDiferenciais:MBA, mestrado ou doutorado nas áreas acima Idiomas:Inglês (requisitos mínimos)Leitura: avançadoEscuta: intermediárioFala: intermediárioEscrita: básico Experiência:3 anos ou mais como cientista de dados Conhecimentos específicos:Pacote OfficeExcelMachine LearningClassificação e regressãoAvaliação de modelosEstatísticaConceitos básicosTestes de hipótesesDistribuiçõesAmostragemInferência estatísticaProgramaçãoPythonPyspark (diferencial)Informações adicionaisModelo de trabalho - Home First ( Maior parte Home Office com frequência mínima quinzenal no escritório)Salário compatível com o mercado - CLTBenefícios:Convênio Médico e OdontológicoVale Refeição/ Alimentação - CajuSeguro de VidaAuxilio educaçãoAuxilio homefirstAuxílio CrechePLR",Núclea,vacancy_type_effective,,False,São Paulo,São Paulo,Brasil,https://nuclea.gupy.io/job/eyJqb2JJZCI6NjUyMjM1Nywic291cmNlIjoiZ3VweV9wb3J0YWwifQ==?jobBoardSource=gupy_portal,True,hybrid,True
