job_id,published_date,title,description,career_page_name,type,application_deadline,is_remote_work,city,state,country,job_url,disabilities,workplace_type,submitted
6511144,2023-12-26T20:26:56.625Z,Analista de Implantação Contábil Fiscal- Nova Lima/BH,"Estamos em busca de uma pessoa para atuar como Analista de implantação de ERP, com foco em contábil/fiscal em Nova Lima/BH.O time de Serviços é um dos times chave dentro da empresa que atua diretamente no crescimento da Sankhya e na satisfação de nossos clientes, oferecendo a implementação do nosso Software, para que atenda de fato a necessidade de quem confia em nosso propósito e em nossos serviços: Nossos clientes e talentos. Aqui na Sankhya estamos de olhar atento às novidades do mercado, buscamos trabalhar nossas formas de solução, para que sejam cada vez mais menos complexas e únicas. E com isso queremos alcançar lugares ainda mais altos!Se você deseja crescer e quer para sua carreira profissional novos desafios, e um lugar onde trabalhar não seja um peso, seu lugar é aqui!Vem com a gente transformar a sociedade, e construir um ambiente diverso de crescimento acelerado.Topa o desafio?#VemserSankhyaResponsabilidades e atribuiçõesParametrizar o sistema conforme a definição de processosSimular e homologar as rotinas implantadas com os usuários nos clientesAcompanhar a colocação do sistema em produção e do desempenho após implantaçãoContribuir com a aplicação das melhores práticas de gestão aplicadas no mercado/segmento de atuação do cliente, com o objetivo de apoiá-lo na evolução do seu negócio, garantindo que os benefícios da solução sejam perceptíveisRequisitos e qualificaçõesSuperior Completo em: Administração, Ciências Contábeis, ou áreas correlatasConhecimento em ERP,  processos  contábeis e financeirosConhecimentos específicos da área fiscal, tributação, e contabilização de impostos.Experiência anterior com rotinas contábeis.Informações adicionaisAqui na Sankhya, nós prezamos muito pelo equilíbrio entre o lado humano, que envolve profissional e pessoal. Sabemos que tudo hoje é interligado e, no fim das contas, é tudo sobre gente. Por isso, nossos benefícios são personalizados para Sankhers, confira!O que a Sankhya te oferece:🥗 Seu vale, vale: liberdade! Chega de escolher entre alimentação ou refeição, oferecemos um cartão bandeira ELO em parceria com o Ifood e eu #SóVejoBenefícios nessa parceria!🤩Plano de saúde 100% grátis para colaborador(a)😁 Plano odontológico🏋️ Gympass💰 Programa de gamificação, participe e concorra a prêmios!💵 Participação nos Lucros e Resultados (PLR) mediante atingimento de metas e performance📚 Auxílio desenvolvimento (Edupass, Auxilio Idiomas, Universidade Corporativa, Descola💻)🤰 Licença Maternidade/Paternidade estendida🤱Presente pro(a) seu(a) Baby Sankher!💻 Equipamentos fornecidos pela empresa🪑 Empréstimo consignado 🚍 Precisa trabalhar presencial? Oferecemos VT. 💆‍♀ Massoterapia no escritório 🎯 Pagamento por Indicação de profissionais assertivos🎉 DayOFF Sankhya O niver é seu, e para comemorar nada melhor que uma folguinha né?E MAIS IMPORTANTE AINDA:🧑‍🦽Todas as nossas vagas estão disponíveis para pessoas com deficiência!Está esperando o que para fazer parte de nosso time?#VemserSankhya!",Sankhya Gestão de Negócios,vacancy_type_effective,2024-01-31T00:00:00.000Z,False,Nova Lima,Minas Gerais,Brasil,https://sankhya.gupy.io/job/eyJqb2JJZCI6NjUxMTE0NCwic291cmNlIjoiZ3VweV9wb3J0YWwifQ==?jobBoardSource=gupy_portal,True,on-site,True
6511145,2023-12-26T20:24:19.904Z,ANALISTA COMERCIAL JUNIOR,"UMA EMPRESA BRASILEIRA, FEITA DE TALENTOS, PAIXÃO, MUITO ENTUSIASMO E DESAFIOS!Oi, somos a VAMOS! Um ecossistema único em alternativas para a renovação e expansão da frota brasileira. Com isso, desenvolvemos nosso negócio diariamente em cima de dois pilares: renovar e inovar, contribuindo sempre para melhorar a performance e aumentar a rentabilidade dos nossos clientes.Nossa jornada é movida pela responsabilidade com cada CLIENTE, pelo comprometimento com a nossa GENTE, pela SIMPLICIDADE do Nosso Jeitão de ser e realizar, pela ATITUDE DE DONO em nosso dia a dia, assegurando a SUSTENTABILIDADE em tudo o que fazemos e tendo o LUCRO como garantia da renovação dos nossos ciclos.Buscamos pessoas que apresentam simplicidade, paixão por servir e que tenham interesse em aprender, desafiar-se e desenvolver-se junto ao crescimento da empresa. Se você tem esse perfil e quer trabalhar em um local em que a nossa Gente faz a diferença, confira nossas vagas ou cadastre seu currículo em nosso banco de talentos.Todos os processos seletivos conduzidos pela VAMOS são afirmativos, inclusivos e não discriminatórios.Responsabilidades e atribuiçõesMissão do cargo:  incorporar todas as fontes de receitas possíveis em uma transação de venda de veículos e, dessa forma, aumentar a lucratividade na operação.Responsabilidades:·      Cadastro de clientes e propostas para análise aos bancos;·      Emissões e Pagamentos de Contratos;·      Suporte a Equipe Comercial;Requisitos e qualificaçõesRequisitos técnicos: Conhecimento em Pacote Office;Conhecimento em Excel Intermediário /Avançado;Conhecimento em Rotinas Administrativas;Residir de fácil acesso para a região de Mogi das CruzesComportamentais:                                                                                                                                                                                     Trabalho em equipeOrganização;Atendimento ao público; Comprometimento;.Informações adicionaisGENTE É O NOSSO NEGÓCIO E É POR ISSO QUE VALORIZAMOS NOSSOS COLABORADORES DE DIVERSAS FORMAS! Os benefícios tradicionais que você já conhece, nós também temos. Queremos te mostrar que vamos além. Saiba mais! LIGADO EM VOCÊ: Atendimento especializado para a nossa gente e familiares por meio de uma central 24 horas para apoio psicológico, sobre saúde, social, familiar, financeiro e/ou jurídico e tudo isso com sigilo absoluto. Licença Maternidade e Paternidade estendidas + Kit nascimento para recém-mamães e recém-papais. Sabemos o quanto a educação das crianças e adolescentes é importante. Aqui na VAMOS, damos aquela ajuda na compra do kit escolar para os filhos da nossa gente. Nossa gente tem acesso exclusivo a uma plataforma de descontos em viagens, cultura e entretenimento, serviços, gastronomia, educação e bem-estar. Pela Universidade VAMOS, a nossa gente aprende e potencializa seu desenvolvimento profissional, tornando cada um(a) protagonista de sua carreira. Sonha em ser voluntário(a)? Faça parte do VAMOS Fazer o Bem, onde nossos colaboradores geram impactos positivos por meio de pequenas ações.﻿Reconhecemos e valorizamos a nossa gente veterana que completa anos de casa. Quem possui mais de 15 anos, ainda tem um evento mega especial.Cantinho da Mamãe: O espaço, na Matriz no Itaim Bibi e Sede Administrativa em Mogi das Cruzes, é dedicado as mamães que retornam de licença maternidade e querem seguir com o aleitamento materno. No local, há todos os itens para retirar e armazenar o leite, com privacidade e conforto. Se identificou com essa vaga? Conheça as nossas vagas, inscreva-se e vamos juntos participar dessa Empresa que cresce todos os dias.",Grupo Vamos,vacancy_type_effective,,False,Mogi das Cruzes,São Paulo,Brasil,https://vamos.gupy.io/job/eyJqb2JJZCI6NjUxMTE0NSwic291cmNlIjoiZ3VweV9wb3J0YWwifQ==?jobBoardSource=gupy_portal,True,on-site,True
6506470,2023-12-26T20:21:41.079Z,Analista de Compliance Sênior (PLD-FT) ,"A Caixa Vida e Previdência tem uma grande variedade de seguros de vida, planos de previdência e prestamista. Por aqui, trabalhamos com soluções de todos os tipos e custos para atender diferentes perfis de clientes. Afinal, o nosso propósito é cuidar das famílias brasileiras. Diariamente, olhamos para o Brasil para entender o presente e contribuir com o planejamento do futuro.  A CVP existe para quem quer complementar a aposentadoria, garantir a faculdade dos filhos, comprar a casa própria e para talentos que querem embarcar em uma nova jornada profissional em direção ao sucesso.  A vaga para Analista de Compliance Sênior está aberta para fortalecer o nosso time de Compliance. Se você é uma pessoa que reconhece o valor de cuidar dos brasileiros e quer crescer com a Caixa Vida e Previdência, vem que as portas estão abertas.  Inscreva-se agora! ✨ Responsabilidades e atribuiçõesComo Analista de Compliance, você será responsável por:Atuação na gestão e implementação das diversas frentes e controles para adequação regulatória do Programa de Prevenção a lavagem de dinheiros e financiamento do terrorismo e Prevenção a fraudes;Atuação no mapeamento de processos, identificando e mapeando os riscos associados à lavagem de dinheiro e fraudes, classificando e monitorando os riscos identificados de acordo com sua gravidade, probabilidade de ocorrência e impacto;Atuação com controles e processos de 2º nível de PLD-FT – Prevenção a lavagem de dinheiro e combate ao terrorismo, contemplando adequação da legislação vigente (Circular Susep 612/20);Revisar periodicamente e promover a melhoria contínua do processo de análise de riscos e impacto de PLD-FT e Prevenção a fraudes, bem como acompanhar através de indicadores e monitoramentos contínuos a gestão de riscos de PLD-FT e prevenção a fraudes;Prestar consultoria para as diversas áreas da empresa na disseminação das Políticas, Procedimentos relacionados à PLD-FT e Prevenção a fraudes e Avaliação interna de riscos de PLD-FT, bem como apoio na implementação e estabelecimento de controles adequados e em conformidade com as legislações vigentes e normativos internos;Apoiar as áreas de negócio através de emissão de pareceres e avaliações de riscos sobre PLD-FT e Prevenção a fraudes;Apoiar atendimentos a fiscalizações Susep, auditorias internas, externas levantando os subsídios requisitados e acompanhando eventuais desdobramentos desses atendimentos;Atuação em programas de treinamentos e planos de comunicação de novas legislações e notícias sobre lavagem de dinheiro e fraudes que impactam o Mercado Segurador e de Previdência;Elaboração e atualização das Política de PLD-FT e Política de Prevenção a fraudes;Suporte na elaboração de relatórios gerenciais, reportes e apresentações aos acionistas, Diretoria e Comitês Executivos.Requisitos e qualificaçõesConheça os requisitos antes de se candidatar:Ensino superior completo, preferencialmente em Administração de Empresas, Direito, Economia ou áreas de humanas;Conhecimento dos controles e regulamentação relacionada ao tema de Prevenção à Lavagem de Dinheiro e Financiamento do Terrorismo Lei 9613/98 e as regras elegíveis ao Mercado Segurador (como Circular SUSEP 612/20) e prevenção a fraudes;Conhecimento do arcabouço regulatório internacional direcionados à PLD-FT e Prevenção a fraudes será um diferencial;Ter conhecimentos de gestão de riscos de compliance, atuação regulatória no mercado segurador e mapeamento de processos será um diferencial; Pacote office avançado;Desejável certificação em compliance, estudos ou cursos sobre leis, conformidade, programas de prevenção (PLD, Fraude, gestão de integridade de terceiros);Desejável Inglês e/ou Francês Avançado;Desejável Pós-graduação / MBA.*Todas as vagas divulgadas são destinadas prioritariamente a pessoas com deficiência. Se você se identificou com a nossa oportunidade, venha fazer parte do TIME Caixa Vida e Previdência.Informações adicionaisEstes são os nossos benefícios: Participação nos LucrosApós atingir as metas, merecemos um pagamento adicional, né? Trabalho híbridoSão três dias no escritório e dois em casa de acordo com a sua atuação. Horário flexívelVocê poderá chegar das 8h até as 10h e sair das 17h até as 19h. Vale Alimentação e RefeiçãoUm cartão para mercado e outro para almoçar com os colegas de trabalho. Se preferir, você pode receber os dois valores em um só cartão. GympassSaúde é o que interessa! Colaboradores da CVP usam Gympass Gold sem custo. Vale transporteÉ só informar o seu itinerário diário para receber o benefício. Plano de saúdeSem coparticipação e sem desconto mensal para você cuidar da sua saúde e de seus dependentes. Plano odontológicoVamos celebrar as nossas conquistas e sair na foto com um sorriso bem bonito. Auxílio FarmáciaConte com o aplicativo Vidalink para conseguir descontos em milhares de farmácias. Auxílio creche e babáAjuda de custo para sua criança ficar em boas mãos enquanto você trabalha. Seguro de vidaBenefícios para você e sua família, principalmente nos momentos mais difíceis. Seguro-viagemPara suas viagens nacionais e internacionais, garantimos um seguro totalmente sem custo. Plano de previdênciaA Caixa Vida e Previdência dobra a contribuição do plano que você escolher. Kit maternidadeNovas mamães e novos papais recebem um presente da Caixa Vida e Previdência. Licença maternidadeSão até 180 dias de licença. A CVP aderiu ao Programa Empresa Cidadã. Licença paternidadeAqui na CVP, papais podem aproveitar um tempinho a mais os primeiros dias do bebê.",Caixa Vida e Previdência,vacancy_type_effective,,False,São Paulo,São Paulo,Brasil,https://caixavidaeprevidencia.gupy.io/job/eyJqb2JJZCI6NjUwNjQ3MCwic291cmNlIjoiZ3VweV9wb3J0YWwifQ==?jobBoardSource=gupy_portal,True,hybrid,True
6511116,2023-12-26T20:13:19.623Z,Analista de Gente&Gestão | Cresol Integração ,"Estamos em busca de um Analista de Gente&amp;Gestão para somar no nosso time!Buscamos profissionais com propósito, que sonham grande e que acreditam na força da Cooperação! Nossa cultura é focada em um ambiente inclusivo, diverso e colaborativo, permitindo que as pessoas possam ser elas mesmas! Juntos, construímos valores que são aplicados em nosso dia a dia, no relacionamento com cada cooperado, com o compromisso de tornar a Cresol cada vez mais forte!  Vem ser Cresol você também! Responsabilidades e atribuiçõesRealizar atividades de recrutamento e seleção, treinamento, sendo ponte para o desenvolvimento dos colaboradores, apoiando o negócio, realizando diagnósticos, acompanhando e levantando necessidades com objetivo de potencializar resultados e o clima organizacional, visando estreitar laços entre as áreas de Recursos Humanos e Negócios.Requisitos e qualificaçõesEnsino Superior completo;Pós Graduação em Gestão de Pessoas ou correlatas;Experiência na área de Gestão de Pessoas;Carteira de Habilitação Categoria B;Disponibilidade para viagens.Informações adicionaisBenefícios:Vale Transporte - com ele garantimos condições de ir e vir de casa para o trabalho por meio do sistema de transporte coletivo público;Vale Alimentação e/ou Refeição – para comprar seu alimento e aproveitar do seu jeito;Seguro de Vida - um cuidado a mais que também pode ser acionado em casos de Doenças Graves e Auxílio Funeral, aquela ajuda na hora que mais precisamos;Plano de Saúde - a mensalidade é um presente da Cresol para o colaborador, estamos sempre juntos;Plano Odontológico - a mensalidade é um presente da Cresol para o colaborador;Auxílio Pós-Graduação - a Cresol acredita e investe no desenvolvimento dos seus colaboradores; Previdência Privada - a Cresol se preocupa com seu futuro;PPR (Programa de Participação nos Resultados) – conquistamos juntos e celebramos juntos;  Cartão Natal – a Cresol fornece um cartão no Natal no final do ano, assim a ceia é do jeito que o colaborador gosta;Adicional por Tempo de Serviço - porque nosso desejo é que o colaborador faça sua carreira na Cresol;Auxílio Creche - a Cresol cuida também do bem estar dos filhos dos colaboradores; Licenças Estendidas – a Cresol possui licença maternidade e paternidade estendidas, para aproveitar ao máximo esse momento; Auxílio Casamento - a Cresol apoia o casamento e celebra esse momento junto com o colaborador;  Bônus Papai e Mamãe – a Cresol apoia esse momento na vida dos colaboradores; Desenvolvimento – a Cresol acredita no desenvolvimento dos colaboradores e investe nele durante o ano; Cresol Acolhe – para o colaborador e sua Família, aqui oferecemos desde suporte a dúvidas jurídicas como dicas para seu Pet, por meio de ligações de qualquer lugar do Brasil;Licença Luto - em caso de morte de pais, filhos, irmãos ou cônjuge são concedidos mais 3 dias uteis de licença, além dos 2 dias previstos em lei.Férias – a Cresol disponibiliza também a possibilidade dos colaboradores tirarem suas férias em até 3 períodos. Prêmio de Reconhecimento - é uma ação voltada para reconhecer os profissionais que atuam na Cresol e que completam tempo de casa, as premiações acontecem quando os colaboradores completam 1, 5, 10, 15, 20, 25 e 30 anos de Cresol.Cresol Longevidade - incentivo aos colaboradores a realizarem uma reserva para o futuro; Day off de Aniversário - para o colaborador aproveitar um dia do seu jeito, é um benefício concedido no mês do aniversário do colaborador, sendo um dia de folga dentro do mês;Gympass - acesso a academias físicas e aulas de Yoga, Meditação e Funcional ao vivo, um benefício completo para o seu Bem Estar.Kit do Bebê - no nascimento do filho(a) dos colaboradores, seja Papai ou Mamães, eles irão receber um presente da Cresol para alegrar ainda mais esse momento especial;Auxílio Material Escolar - este é um benefício pago no mês de janeiro, para apoiar na vida de ensino dos filhos dos colaboradores de até 12 anos de idade matriculados em uma instituição de ensino;Licença PETernidade - a nossa Cresol é para todos, e quando se fala em Família existem vários formatos de Famílias! Por isso, ao adotar um animal de estimação (cães ou gatos), o colaborador terá direito a dois dias de folga (limitado a até 2 adoções no ano); Doação de Sangue - para salvar vidas e fazer uma corrente do bem, fomentando cada vez mais a Cooperação, a Cresol fornece um incentivo em forma de cartão presente para o colaborador que doar sangue durante o ano.Auxílio Falecimento - este benefício é disponibilizado aos dependentes declarados pelo INSS do colaborador falecido em forma de cartão, com auxílio mensal podendo chegar até um ano. Uniforme - pensando também no conforto e no fortalecimento da nossa marca, a Cresol disponibiliza uniformes para todos os colaboradores do sistema. Ginástica Laboral - a Cresol proporciona momentos de alongamento durante o horário de trabalho, a fim de melhorar a saúde dos colaboradores e evitar lesões pelo esforço diário, e com isso busca incentivar que os colaboradores pratiquem e criem esse hábito diário.",Cresol Oficial,vacancy_type_effective,2024-01-07T00:00:00.000Z,False,Toledo,Paraná,Brasil,https://cresolcarreiras.gupy.io/job/eyJqb2JJZCI6NjUxMTExNiwic291cmNlIjoiZ3VweV9wb3J0YWwifQ==?jobBoardSource=gupy_portal,True,on-site,True
6470208,2023-12-26T20:10:14.803Z,FARM GLOBAL | Analista de Operações I ,"FARM é mais do que apenas roupas, é um estilo de vida despreocupado, abraçando a beleza natural e a confiança sem esforço em ser fiel a si mesmo. Valorizamos a cultura local e estamos sempre criando novas experiências para se conectar com o público. A natureza e a cultura brasileira servem como nossas maiores inspirações!A FARM Global nasceu com o objetivo de expandir os horizontes e conquistar o mundo com as cores e a paixão única do Brasil! Já deixamos a nossa marca nos Estados Unidos e agora o foco é conquistar a Europa em 2022!A área de Operações exerce um papel fundamental na evolução contínua da companhia, buscando garantir excelência no atendimento ao cliente, desde o primeiro contato.Nosso time está crescendo e precisamos de pessoas analíticas, com boa capacidade de comunicação e apaixonadas pelo negócio para garantir o total funcionando da cadeia de operações, desenvolvendo análises, indicadores e melhorias nos fluxo, cumprindo prazos de pré-estabelecidos,Responsabilidades e atribuições·     Gerenciamento de ordens e retornos·     Execução de tarefas para garantir o workflow dos processos de entrega das ordens para os clientes·     Desenvolvimento de indicadores da performance das entregas do segmento do atacado·     Interação direta com diversas equipes (planejamento, financeiro, cobrança, etc) para garantir as entregas de maneira eficiente e dentro do prazo·     Atualização de CRM com informações de contato e follow up com clientes quando necessário·    Analisar, sugerir e implementar melhorias de processo - garantir a melhor eficiência possível nos tempos das entregas previstas.Requisitos e qualificações·       Ensino superior/técnico (completo) em Administração, Gestão Financeira, Economia e/ou áreas relacionadas;·       Inglês fluente (obrigatório), contato direto com clientes e fornecedores que são estrangerios;·       Goste de atuar em contato com clientes e tarefas operacionais;·       Boa comunicação oral e escrita (Inglês e Português);·       Conhecimento avançado do Pacote Office, especialmente Excel e Outlook.·       Conhecimento em Power BI (Bonus)·       Capacidade de atuar em um ambiente dinâmico e ágil;·       Ser organizado(a) e ter capacidade de autogestão;Informações adicionais·       Comprometimento·       Autonomia·       Interesse em solucionar problemas·       Analítico·       Senso de Urgência",GRUPO SOMA,vacancy_type_effective,,True,Rio de Janeiro,Rio de Janeiro,Brasil,https://gruposoma.gupy.io/job/eyJqb2JJZCI6NjQ3MDIwOCwic291cmNlIjoiZ3VweV9wb3J0YWwifQ==?jobBoardSource=gupy_portal,True,remote,True
6511066,2023-12-26T20:09:51.785Z,Analista de Informações Pleno - Ouvidoria,"O que estará sobre seus cuidados:Responsável por elaborar relatórios para a Ouvidoria e áreas internas solicitantes, bem como os indicadores, monitoria de qualidade do trabalho de atendimento e atuação nos processos de riscos e controles.Responsabilidades e atribuiçõesAlém de cuidar, você precisa ter conhecimento em:Elaborar relatórios com base em dados e avaliar, periodicamente, a eficácia e necessidade dos reportes;Elaborar e monitorar os indicadores em tempo real, apoiando a liderança;Elaborar diagnósticos de reclamações recebidas na Ouvidoria;Promover melhorias e ações corretivas com base nas reclamações recebidas e acompanhar o plano de ação, a fim de garantir o cumprimento dos prazos de implantação e a eficácia das ações indicadas;Identificar oportunidades, conduzir e implementar projetos identificados na Ouvidoria;Elaborar o relatório semestral de Ouvidoria, em atendimento a regulamentação SUSEP vigente;Executar obrigações regulamentares como, emissão do banco de dados de reclamações de Ouvidoria – BDPO (Banco de Dados de perdas Operacionais), BDRO (Banco de Dados de Reclamações de Ouvidoria) para a SUSEP e demais obrigações regulamentares vigentes;Acompanhar legislações e regulamentações sobre Ouvidoria e assuntos relacionados ao atendimento ao cliente, bem como realizar a adequação dos processos internos a estes;Promover melhorias internas no processo de Ouvidoria e, sempre que necessário, liderar os ajustes sistêmicos no CRM;Atuar como ponto focal para melhorias e implantações no CRM da Companhia;Apoiar no processo de monitoria do atendimento e analisar o que está sendo reportado;Acompanhar inovações de mercado aplicáveis à Ouvidoria e ao processo de atendimento ao cliente;Elaborar apresentações da área;Interagir com as áreas intervenientes para elaboração de fluxos e/ou alinhamentos operacionais para tratamento das reclamações recebidas na Ouvidoria, bem como conduzir a implantação se necessário;Acompanhar e atuar nas demandas de relacionamento institucional com a CNSEG, ABRAREC, IBHE e outras que a Ouvidoria participar.Requisitos e qualificaçõesSuperior Completo(Administração, Sistemas de Informação, Estatística e/ou Matemática);Pacote office avançado;Banco de Dados SQL Avançado;Excel Avançado;Vivência com mercado de seguros e áreas de análise como auditoria e ouvidoria. Informações adicionaisComo cuidamos de você:Benefícios:Seguro Saúde;Seguro Odontológico;Seguro Decesso;Vale TransporteVale Refeição;Vale Alimentação;13ª Cesta de Alimentação;Seguro de Vida em Grupo;Plano de Previdência Privada;Auxílio Creche e/ou Babá;Participação nos Lucros e Resultados (PLR);Gympass;Day off para comemorar seu aniversário;Universidade Corporativa com mais 300 cursos;Skillhub: descontos em diversas instituições de ensino;English Pass: plataforma de estudos e ferramenta de interação no inglês;Programa de Saúde Integrada: mental, social, financeira e física;Onde ficamos?Nossa sede fica localizada na zona sul de São Paulo, próximo a estação de trem Morumbi (linha 9 – Esmeralda), na região do bairro Chácara Santo Antônio. ",Brasilseg,vacancy_type_effective,,False,São Paulo,São Paulo,Brasil,https://brasilseg.gupy.io/job/eyJqb2JJZCI6NjUxMTA2Niwic291cmNlIjoiZ3VweV9wb3J0YWwifQ==?jobBoardSource=gupy_portal,True,on-site,True
