job_id,published_date,title,description,career_page_name,type,application_deadline,is_remote_work,city,state,country,job_url,disabilities,workplace_type,submitted
6506779,2023-12-26T13:52:59.790Z,Analista de Power BI,"Vaga para o time de POWER BI.Buscamos pessoas que assim como a gente, sejam inovadoras, práticas, objetivas, tenham paixão pelo que fazem e visem a excelência. Então, você se encaixa neste perfil?Responsabilidades e atribuiçõesColeta de informações: Será responsável pela comunicação e coordenação com diversos departamentos, entendendo as necessidades de análise de dados, obtendo as informações básicas mais recentes e compartilhando-as com o departamento em tempo real;Processamento de dados: Coleta e gerenciamento de banco de dados original, incluindo consulta básica de dados e articulação de dados;Atualização de dados: Será responsável por atualizar diariamente os resultados das análises, desenhar e compartilhar templates customizados de resultados de análises de acordo com as necessidades dos diferentes departamentos de negócios;Auditoria de dados: Verificar discrepâncias de dados e identificar causas raízes. Requisitos e qualificaçõesPossuir Graduação Completa em Estatística, Ciência da Computação, Engenharia ou correlatas;Possuir nível de Inglês Intermediário para Avançado para Leitura, Escrita, Compreensão e Conversação, bem como, possuir habilidades de traduzir análises complexas;Possuir bons conhecimentos em Excel, habilidades de utilizar suas fórmulas para análises de dados e seus processos;Disponibilidade para atuação presencial em São Paulo.Requisito Desejável:Atuação anterior em indústrias automotivas ou em segmentos correlatos. Informações adicionaisAqui na BYD priorizamos o bem-estar de nossos colaboradores e estamos em busca constante de melhorias para o nosso pacote de benefícios. Seu pacote vai contar com:·       Convênio médico e odontológico coparticipativo para você e seus dependentes;·       Programas de saúde e bem-estar para a melhoria da sua qualidade de vida;·       Cartão Golden Farma para compras em farmácias cadastradas com desconto diretamente em folha, valendo tanto para medicamentos como para itens de higiene e beleza;·       Gympass para cuidar da sua saúde física e mental;·       Vale Alimentação para te ajudar nas compras do mês;·       Auxílio Combustível;·       Vale Refeição;·       Vale Transporte;·       Trabalhamos com horário flexível, para melhor organização da sua vida pessoal;·       Licença maternidade de 6 meses e licença paternidade de 20 dias, além de um Kit Maternidade para o seu bebê;·       Seguro de vida coletivo Porto Seguro, sem desconto em folha;·       Auxílio creche para dependentes até 2 anos, conforme regras de elegibilidade.",BYD Brasil,vacancy_type_effective,2024-01-22T00:00:00.000Z,False,São Paulo,São Paulo,Brasil,https://bydbrasil.gupy.io/job/eyJqb2JJZCI6NjUwNjc3OSwic291cmNlIjoiZ3VweV9wb3J0YWwifQ==?jobBoardSource=gupy_portal,True,on-site,True
6507531,2023-12-26T13:51:51.831Z,Analista de Desenvolvimento do Cooperativismo - Sede Administrativa - Lucas do Rio Verde MT,"Responder pelas atividades operacionais e de suporte dos Programas gerenciados na área Desenvolvimento do Cooperativismo, tais como organização de eventos, contas a pagar, registro de participações nas ferramentas sistêmicas, controles diversos e suporte aos Assessores e Gerente.Cooperativa Sicredi Ouro Verde MT - Sede Administrativa - Lucas do Rio Verde MT.Responsabilidades e atribuições·      Responsável por compras de materiais e pagamentos da área Desenvolvimento do Cooperativismo;·      Responsável pelo controle de orçamento da área, fornecendo informações para Assessores, Gerente e Diretoria;·      Responsável pela Organização de Eventos, prestando suporte na organização dos eventos da área, realizando orçamentos, contatos com fornecedores, visando promover a imagem do Sicredi e potencializar o investimento;·      Responsável por manter atualizados relatórios periódicos sobre os programas para áreas afins e apoiar as agências nos registros nas Ferramenta de gestão dos programas;Requisitos e qualificaçõesÁrea de formação concluída ou em andamento: Administração de Empresas, Marketing, Comunicação Social, Assistência Social, Letras, Publicidade e Propaganda, Pedagogia ou Áreas correlatas.Experiência Profissional: Mínimo de 1 ano de atuação em Sistema de Cooperativas ou similares no mercado ou experiência em áreas administrativas e de suporte.Habilidades e Temas de conhecimento desejáveis: Cooperativismo e sociedades cooperativas, Metodologias de ensino, Produtos e serviços instituição financeira, Sustentabilidade, Planejamento Estratégico.Deverá residir em Lucas do Rio Verde-MT.Informações adicionaisAtuará na área de Desenvolvimento do Cooperativismo, na Sede Administrativa em Lucas do Rio Verde MTGestão Imediata: Katiuscy ArantesHorário de trabalho das 08:00 as 17:00 horas de segunda a sexta-feira.Salário Bruto + pacote de benefícios.Atenção: nosso contato será através do seu e-mail e telefone cadastrado, aqui na plataforma Gupy você poderá acompanhar sua evolução nas etapas do processo seletivo.Importante: a etapa online ""queremos te conhecer, tem caráter desclassificatório, caso não seja realizada. após conclusão do cadastro por completo, você será automaticamente movimentado para a próxima etapa. Atender a todos os requisitos descritos na vaga para seguir no processo seletivo. Dica: quanto mais completo e detalhado estiver sua inscrição/cadastro, mais contribuirá para nossa triagem de currículos.",Sicredi,vacancy_type_effective,2024-01-22T00:00:00.000Z,False,Lucas do Rio Verde,Mato Grosso,Brasil,https://sicredi.gupy.io/job/eyJqb2JJZCI6NjUwNzUzMSwic291cmNlIjoiZ3VweV9wb3J0YWwifQ==?jobBoardSource=gupy_portal,True,on-site,True
6506868,2023-12-26T13:49:50.125Z, Analista de Licitações - RJ,"Estamos sempre em busca de talentos que acreditam que podem mais! Somos uma empresa de valores, comprometidos com o bem-estar dos nossos colaboradores. Queremos atender nossos clientes com responsabilidade e qualidade, para isso, precisamos de profissionais dispostos a vestir a nossa camisa e ingressar no mundo Vertical.Se você é Organizado, Responsável, Detalhista essa oportunidade é para você!estamos aguardando a sua candidatura!Responsabilidades e atribuições✅Captação de editais✅Preparação e participação em pregões eletrônicos e demais processos licitatórios✅Controle de documentações e relatóriosRequisitos e qualificações✅Formação nível superior Direito será um diferencial✅Pacote Microsoft Office e conhecimento das Leis 8666 e 14133 (preferencialmente com curso sobre os assuntos) são necessários✅Conhecimento dos portais Conlicitação e RHS Licitações será um diferencial✅Organização e disciplina são características necessárias para a funçãoInformações adicionais🛒 Vale alimentação: Cartão Benefício🚌 Vale Transporte🚗 Auxílio combustível🩺 Plano de Saúde: (coparticipativo);🦷 Plano Odontológico: Amil (Opcional);📚 Treinamentos sem custo;📈 Plano de Cargos e Salários;🎓 Crédito educativo (após 1 ano de empresa)",Grupo Vertical,vacancy_type_effective,,False,Rio de Janeiro,Rio de Janeiro,Brasil,https://grupovertical.gupy.io/job/eyJqb2JJZCI6NjUwNjg2OCwic291cmNlIjoiZ3VweV9wb3J0YWwifQ==?jobBoardSource=gupy_portal,True,on-site,True
6506805,2023-12-26T13:48:35.608Z,Analista de Cadastros - Caxias do Sul | RS,"Estamos buscando uma pessoa dedicada, com experiência prévia em funções relacionadas a cadastro de produtos e que queira fazer parte de um time altamente capacitado e responsável, nos temos essa oportunidade para você.Venha fazer parte do nosso time!#VEMSERELETRONOR ! #VEMSERSONEPAR!Responsabilidades e atribuiçõesGerenciar todos os processos relacionados a cadastro de produtos;Observar e fazer cumprir o tempo de resposta de cadastro, bem como manter organizada as rotinas administrativas da área;Interagir diretamente com os compradores de forma proativa para manter a base de dados do cadastro de produtos sempre atualizada;Demostrar o resultado de seu trabalho de forma clara e objetiva através de indicadores.Requisitos e qualificaçõesCapacidade analítica;Boa comunicação;Criatividade e Inovação;Foco em melhoria contínua;Ensino Superior em Administração de Empresas, Engenharia de Produção ou Tecnólogos em áreas técnicas voltadas para Elétrica ou Automação.Informações adicionaisVale refeição;Focamos em apoiar os nossos colaboradores e familiares em programas voltados para qualidade de vida e bem estar emocional para isso contamos com benefícios como o Gympass e Auster;Plano de saúde (mensalidade) integral para o colaborador;Participação nos lucros e resultados;Cartão de crédito Bulllaene;Convênio Odontológico;Vale transporte;Day off de aniversário;Seguro de vida coletivo;Plano de cargos, carreira e performance;Bônus Indicação - Indique um amigo para trabalhar conosco!",Eletronor,vacancy_type_effective,,False,Caxias do Sul,Rio Grande do Sul,Brasil,https://eletronor.gupy.io/job/eyJqb2JJZCI6NjUwNjgwNSwic291cmNlIjoiZ3VweV9wb3J0YWwifQ==?jobBoardSource=gupy_portal,True,on-site,True
6506267,2023-12-26T13:42:35.298Z,Analista de Pré-Vendas (SDR),"Somos um time com o propósito de impulsionar vendas e sonhos de muitos empreendedores, agimos de forma positiva, transparente, buscamos a excelência na execução, enfrentamos desafios diariamente e valorizamos o protagonismo na atuação. Se você se identifica com os nossos valores e gosta de criar soluções com impacto positivo na vida das pessoas, queremos te conhecer!🚀 Como você pode impulsionar vendas (e sonhos) de muitos empreendedores?Esta é uma vaga 100% presencial e a logística de trabalho é perfeita para quem mora em Curitiba!Sua função será qualificar os leads dos gerados pelo departamento de marketing e agendar reuniões entre os leads e os vendedores 💪.E aí, topa?Responsabilidades e atribuiçõesComo #SDR, seu papel será:Garantir um atendimento de excelência a todos os potenciais clientes que forem atendidosEstudar sobre o cliente para determinar a técnica de abordagemAgendar reuniões de apresentação e fechamento (venda) para os closersRealizar calls de qualificação seguindo o processo previamente definido pelo playbookAtuar sempre com foco no cliente, gerando engajamento em todas as calls que forem agendadasDesenvolver técnicas de como evitar o ""no show"" (não comparecimento)Manter a organização de agenda e as informações atualizadas de todos os leadsRealizar registros ricos e preencher o formulário de qualificação  de informações de cada lead, estando atento a clareza do que é escrito e a ortografia utilizadaEstar presente e participar de forma ativa em todos os treinamentos com a equipeEntendimento e acompanhamento dos KPIs individuaisEnvio diário do report com todos KPI's individuais com causa, efeito e plano de ação para o próximo diaConhecer e executar todos os processos definidosRequisitos e qualificações✍O que esperamos de você:Conhecimento com estratégias de vendas (Inbound e Outbound Mkt)Conhecimento com CRMConhecimento com metodologias de vendas (Spin Selling e GPCT);Sales Pitch.Comunicação assertiva;Escuta ativa;Resiliência; Organização;Foco no cliente.Informações adicionaisE o que oferecemos em troca?$ Premiação por resultado;💳 Cartão Flash (alimentação, mobilidade, cultura, educação)💊 Plano de Saúde e Odontológico (s/ mensalidade e coparticipação)🐶 Plano de saúde Pet - Guapeco🎁 Day Off no mês de Aniversário💬 Programa de saúde mental e bem-estar (Clude)👚 Sem dress code: você pode se vestir como preferir🏆 Programa de indicação de talentos👶🏼 Licença maternidade e paternidade📝 Parcerias com restaurantes, universidades, rede de turismo👴 Educação financeira - Somos Leve🏋️‍♀️ Total Pass - para você se exercitar e manter a saúde física em dia.",Leads2b,vacancy_type_effective,,False,Curitiba,Paraná,Brasil,https://leads2b.gupy.io/job/eyJqb2JJZCI6NjUwNjI2Nywic291cmNlIjoiZ3VweV9wb3J0YWwifQ==?jobBoardSource=gupy_portal,True,on-site,True
6507413,2023-12-26T13:41:35.791Z,Analista de aprovativos Jr,"Trabalhamos com negócios únicos para clientes especiais e para continuar atuando de forma expressiva nos mercados de shopping centers, fashion retail, hospitalidade, gastronomia e desenvolvimento imobiliário, buscamos um(a) Analista de aprovativos/legalização que queira melhorar a qualidade de vida dos nossos clientes, dando suporte as áreas de negócio, com atenção aos detalhes e comprometimento em cada entrega.Responsabilidades e atribuições•	Profissional com vivência em legalização e licenciamento de loteamentos;•	Acompanhamento de processos junto as Prefeituras Municipais, entre outros Órgãos Públicos; •	Análise e interpretação de legislações municipais, estaduais e federais; •	Experiência em compatibilização de projetos, montagem de pacote e tramitação do processo para licenciamento Graprohab; •	Contratação de fornecedores e análise dos Projetos da etapa Legal (regularização, levantamento planialtimétrico, urbanístico, terraplenagem, infra estrutura, ambiental, EIV, etc.)•	Acompanhamento e análise de documentação técnica para registro de incorporação junto a Cartório de Imóveis;•	Profissional pro ativo, inovador e comprometido. Boa comunicação;•	Formação superior em Arquitetura ou Engenharia Civil ou Engenharia Ambiental;•	Habilidade em AutoCad e Pacote Office;•	ArcGIS é um diferencial;Requisitos e qualificaçõesFormação: Arquitetura e Urbanismo",JHSF | Negócios Imobiliários,vacancy_type_effective,,False,São Paulo,São Paulo,Brasil,https://jhsf-ni.gupy.io/job/eyJqb2JJZCI6NjUwNzQxMywic291cmNlIjoiZ3VweV9wb3J0YWwifQ==?jobBoardSource=gupy_portal,False,on-site,True
6506776,2023-12-26T13:40:54.172Z,Analista de Infra e Cloud Pleno,"Que tal fazer parte do nosso time de Technology como Analista de Infra e Cloud?Sua missão será manter e evoluir o ambiente de tecnologia da Bridge (Azure e AWS) e a arquitetura estruturada para atendimento a clientes externos de acordo com boas práticas de mercado em infraestrutura, cloud e segurança da informação. Atuará desde a concepção de projetos até a operação do dia a dia (DevSecOps/FinOps). Exercerá um papel crucial nas discussões de arquitetura dos projetos de tecnologia, em especial Dados/Analytics, RPA/IA e ITSM. Também exercerá o papel de consultor interno para enriquecer e apoiar projetos de outras Squads nos temas de seu conhecimento.Essa é uma oportunidade para atuação híbrido (Rio de Janeiro/São Paulo)Responsabilidades e atribuiçõesComo Analista de Infra e Cloud, você focará em:Realizar a manutenção e evoluir a infraestrutura de TI que atende a empresa, em especial MS365, Azure e AWS;Administrar e evoluir os ambientes em nuvem da operação interna e de clientes;Monitorar os serviços e custos dos ambientes cloud, focando na otimização de custo e garantia de qualidade e disponibilidade (FinOps/DevSecOps);Apoiar a construção da arquitetura on premise e cloud de soluções de tecnologia;Participar de reuniões e processos de pré-venda (apoio a clientes/comercial);Participar da gestão de fornecedores de tecnologia, em especial de infraestrutura, hardware, software e cloud;Contribuir para o aprendizado de recursos menos seniores dentro do time de tecnologia;Participar dos projetos da Bridge nos temas de infraestrutura, arquitetura e de segurança da informação.Requisitos e qualificaçõesComo requisitos básicos, buscamos:Ensino superior completo em cursos de Tecnologia e Engenharias;Possuir a certificação AZ 104 e desejável a AZ 305;Ter vivência em projetos de infraestrutura e computação em nuvem e/ou projetos de dados em nuvem.Requisitos Gerais:Sistemas Operacionais (Windows e Linux);Redes de computadores;Segurança da Informação;Arquitetura de soluções on premise e cloud;Integrações e consumo de APIs. Microsoft Office 365:Enterprise Mobility Security e Intune;Gestão de acessos, contas, equipes e grupos;Gestão da plataforma Sharepoint;Gestão da solução de DLP (principalmente sensitivity labels);Gestão de Endpoints. Amazon Web Services (AWS)Experiência com IAM, EC2, ECS, ELB, RDS e DynamoDB;Experiência em gestão de custos em nuvem.Você se destaca se tiver:Cursos, Certificações ou Pós-graduação em Arquitetura de Software, Desenvolvimento Seguro, Cloud e/ou DevSecOps.Informações adicionaisO que você irá encontrar por aqui? Acreditamos que um bom profissional, antes de tudo, é uma pessoa que cuida do seu corpo e da sua mente. E, para isso, você poderá contar com alguns benefícios como: Plano de saúde (nosso plano possui uma excelente cobertura e você irá contribuir com apenas 20% do valor - sem coparticipação) Plano odontológico (o valor fica por nossa conta!) Caju: vale refeição/alimentação flexível Totalpass: Auxílio a academia Seguro de vida 8 days off por ano Horário de trabalho flexívelModelo de contratação híbrido flexível (Rio de Janeiro/São Paulo)Apoiamos também a busca pela excelência no conhecimento e nossos Bridge’s contam com alguns incentivos: Descontos em certificações com instituições parceiras Plataforma interna de treinamentos com assuntos de diversas áreas de conhecimento Canais internos de troca de conhecimento Se inscreva, e embarque nessa jornada com a gente! 🚀",Bridge & Co.,vacancy_type_effective,,False,Rio de Janeiro,Rio de Janeiro,Brasil,https://bridge.gupy.io/job/eyJqb2JJZCI6NjUwNjc3Niwic291cmNlIjoiZ3VweV9wb3J0YWwifQ==?jobBoardSource=gupy_portal,True,hybrid,True
6465736,2023-12-26T13:34:36.702Z,Analista de DHO (Treinamento)  ,"Estamos em busca de um Analista de Treinamento e Desenvolvimento Pleno altamente motivado e experiente para se juntar à nossa equipe de Recursos Humanos. O candidato ideal deverá ter conhecimento em estratégias de aprendizagem corporativa, desenvolvimento de programas de treinamento eficazes e habilidades para avaliar as necessidades de capacitação dos colaboradores. Você será fundamental para promover o crescimento profissional e pessoal dos nossos colaboradores, contribuindo diretamente para o sucesso da nossa organização.Somos uma empresa de transportes renomada, especializada em fornecer soluções de transporte de carga fracionada de alto valor agregado. Nossa missão é entregar com excelência e segurança, atendendo às demandas específicas dos nossos clientes. Agora, estamos expandindo nossa equipe e buscamos um Analista de Treinamento e Desenvolvimento dedicado a promover o desenvolvimento e a progressão de carreira dos nossos colaboradores.Se você é um profissional comprometido(a) com o desenvolvimento e o crescimento dos colaboradores, aguardamos sua candidatura. Junte-se à nossa equipe e ajude-nos a impulsionar o sucesso dos nossos talentos e da organização como um todo.Mais do que contratar pessoas, queremos gerar oportunidades para todos, garantindo a inclusão de perfis cada vez mais diversos para somar com NOSSA GENTE! Se você também pensa assim, que tal fazer parte desse time?Responsabilidades e atribuiçõesSuportar os BPs de Gente para identificar as necessidades de treinamento e desenvolvimento dentro da organização;Projetar, desenvolver e implementar programas de treinamento presenciais e online, alinhados com os objetivos estratégicos da empresa;Criar materiais didáticos, como apresentações, guias de treinamento e recursos visuais, para apoiar os programas de capacitação;Facilitar sessões de treinamento interativas para grupos de funcionários de diferentes níveis hierárquicos;Avaliar a reação e eficácia dos programas de treinamento por meio de feedback dos participantes e outras métricas relevantes;Manter um cronograma organizado de treinamentos, garantindo que as datas e os recursos necessários estejam disponíveis e prontos;Colaborar na construção de um ambiente de aprendizagem contínua, promovendo uma cultura de desenvolvimento dentro da organização.Requisitos e qualificaçõesRequisitos inegociáveis:• Superior completo em Recursos Humanos, Psicologia, Administração ou área relacionada;• Experiência com programa de Integração de novos colaboradores e trilha • Vivência com construção de trilhas de aprendizagem e metodologias de treinamento;• Experiência com ferramentas de criação de conteúdo e plataformas de aprendizagem online (LMS).• Experiência com gestão de indicadores de treinamento; Não é obrigatório, mas se você tiver será legal:Pós graduação na área.Será um diferencial conhecimento com trilhas de Liderança;Informações adicionaisNossos benefícios:Remuneração competitiva;Oportunidades de desenvolvimento profissional e crescimento na carreira;Ambiente de trabalho colaborativo e estimulante;Vale-Refeição;Assistência Médica (Bradesco Saúde);Assistência Odontológica (Bradesco Dental);Cesta Básica;Seguro de Vida;Convênio Farmácia;Parceria de apoio psicológicoParceria com a Gympass.",Jamef Transportes,vacancy_type_effective,,False,São Paulo,São Paulo,Brasil,https://jamef.gupy.io/job/eyJqb2JJZCI6NjQ2NTczNiwic291cmNlIjoiZ3VweV9wb3J0YWwifQ==?jobBoardSource=gupy_portal,True,on-site,True
6495173,2023-12-26T13:34:28.997Z,Analista de Cobrança SR,"Somos a primeira Instituição Financeira Agro, voltada a apoiar o produtor rural, PF ou PJ em sua cadeia produtiva. Por isso somos a Creditá, proporcionando recursos financeiros para atender as demandas do Campo.Estamos em desenvolvimento do nosso time de Crédito que tem como atribuição, desde a concessão até a recuperação do crédito. Esse profissional vem para agregar na parte da Cobrança e Recuperação do Crédito, organizar processos, manuais e indicadores, além da parte operacional.Se você gosta de estruturar área e é focado em atingir resultados, vem trabalhar com a gente! Certamente faremos juntos a história da nossa empresa.Responsabilidades e atribuiçõesCobrança e recuperação de crédito da carteira de clientes da CreditáPreparação e encaminhamento de processos de cobrança judicialGestão da provisãoNegociação, emissão de aditivos de renegociaçãoAssunção de dívidas, prorrogação, repactuação, composição de dívidas, encaminhamento ao Serasa, protesto, notificações extra judicial e envio de boletos para cumprimento da régua de cobrançaCálculos financeiros de juros nas negociaçõesBom relacionamento com time comercial e clientesRequisitos e qualificaçõesGraduação completaExperiência de no mínimo 2 anos no cargo em Instituições FinanceirasDomínio em cálculos financeiros e planilhas de Excel para geração de indicadoresDesenvolvimento de dashboard e uso do Power BI para acompanhamento de indicadoresInformações adicionaisVale Refeição;Plano de Saúde Unimed;Plano Odontológico Uniodonto;Seguro de Vida;PLR Anual;14º e 15º salário",CREDITÁ,vacancy_type_effective,,False,Porto Alegre,Rio Grande do Sul,Brasil,https://credita.gupy.io/job/eyJqb2JJZCI6NjQ5NTE3Mywic291cmNlIjoiZ3VweV9wb3J0YWwifQ==?jobBoardSource=gupy_portal,True,on-site,True
