job_id,published_date,title,description,career_page_name,type,application_deadline,is_remote_work,city,state,country,job_url,disabilities,workplace_type,submitted
6269504,2023-12-11T19:24:02.125Z,Analista de RH - Temporário,"Somos uma empresa que visa atender os requisitos aplicáveis priorizando a segurança e o meio ambiente, trabalhando por Zero defeito em produtos entregues, pontualidade na entrega, buscando sempre a melhoria contínua.Buscamos candidatos que amem aprender constantemente e que tenham muita força de vontade para fazer a GDBR cada vez mais forte.Somos one team, one TG.Responsabilidades e atribuiçõesRH generalista, com vivencia em:Relatórios de indicadores de desempenho (KPI)headcountBudgetApresentações institucionaisRequisitos e qualificaçõesSuperior Completo nas áreas de RH | ADM ou correlatosPacote Office, principalmente Microsoft Excel e Power Point.TOTVS (desejável)ComunicaçãoOrganizadoConcentraçãoPontual (atendimento a prazos)Pró-atividadeDinâmicoResponsávelRespeito a hierarquiaCNH - BInformações adicionaisConvênio MédicoVale AlimentaçãoFretadoAlimentação na empresaTotalPassPLRSeguro de vidaConvênios com descontos: (Odontológico, papelaria, Farmácia, faculdades, colégios, escolas de inglês, SESI, Fishing Park)",GDBR Toyoda Gosei,vacancy_type_temporary,,False,Itapetininga,São Paulo,Brasil,https://gdbr.gupy.io/job/eyJqb2JJZCI6NjI2OTUwNCwic291cmNlIjoiZ3VweV9wb3J0YWwifQ==?jobBoardSource=gupy_portal,False,on-site,True
6269581,2023-12-11T19:22:43.979Z,Analista Contabil I ,"Tudo o que fazemos só é possível com as pessoas no centro, por isso, somos comprometidos com a inclusão e valorizamos as diferentes formas de contribuir com a criação de um amanhã mais positivo. Queremos uma Auren ainda mais diversa! Encorajamos que pessoas com deficiência se candidatem, como também mulheres, pessoas LGBT+, pessoas negras e indígenas, de diferentes idades e regiões! Estamos em busca de profissional com experiência na área de Contabilidade e reportes financeiros, bem como em assuntos relacionados.Responsabilidades e atribuições● Apoio as rotinas de fechamento contábil em parceria com o CSC (Centro de Serviços Compartilhados);● Apoio às revisões das Demonstrações financeiras trimestrais e anuais;● Atendimento a auditoria externa e demandas de áreas internas da Companhia;● Execução dos controles internos da área; ● Apoio à gestão das contratações de serviços da área;● Apoio nas rotinas de gestão de ativo imobilizado como acompanhamento dos projetos em andamento, ativação, movimentação e baixa.Requisitos e qualificações● Bacharelado em Ciências Contábeis● Excel Intermediário● Conhecimentos do setor de energia e sistema integrado SAP ERP será um diferencialInformações adicionaisNa Auren Energia, acreditamos que o futuro passa por ideias inovadoras, atitudes sustentáveis e um mundo mais positivo; e o que faz a diferença para criar a nossa sinergia é com quem vamos! Vem com a gente, vem ser Auren Energia!!",Auren Energia,vacancy_type_effective,,False,São Paulo,São Paulo,Brasil,https://aurenenergia.gupy.io/job/eyJqb2JJZCI6NjI2OTU4MSwic291cmNlIjoiZ3VweV9wb3J0YWwifQ==?jobBoardSource=gupy_portal,True,hybrid,True
6201370,2023-12-11T19:22:41.590Z,Analista Logística Armazenamento Jr.,"Já pensou em fazer parte de uma empresa que é a maior referência global em Bioenergia? Ou na empresa que é a quarta maior em rentabilidade financeira? Pois é! A Raízen é esse lugar! 🥰﻿Está preparado(a) para cultivar novas experiências em um time que joga junto e valoriza o melhor de cada um(a)? Aqui na Raízen, os desafios se tornam oportunidades de inovação que podem impactar na sua trajetória profissional e na vida de milhões no Brasil e no mundo. Nós buscamos pessoas cheias de energia e prontas para agarrar novas oportunidades, que realizem um trabalho que gere valor a nossos clientes e funcionários(as).Estamos buscando um(a) Analista de Logística e Armazenamento Júnior que irá atuar em uma jornada híbrida no escritório corporativo de Piracicaba- SP.Responsabilidades e atribuições🎯COMO SERÁ O SEU DIA A DIA:Realizar análise da curva de consumo e manutenção nos parâmetros MRP; Analisar o estoque e as oportunidades de transferências intercompany; Participar do planejamento de compra de peças/materiais para entressafra; Se envolver nos projetos da área; Identificar os estoques em excesso e obsoleto; Elaborar os indicadores de performance da área; Criar procedimentos e padronização dos processos dos almoxarifados.Requisitos e qualificações🔎O QUE VOCÊ PRECISA TER:Ensino superior cursando ou completo em Administração, Logística, Engenharias ou áreas correlatas;Conhecimento intermediário/avançado em Pacote Office (Excel, Power Point, Word);Conhecimento em SAP (módulo MM);Experiência prévia com cadeia de Supply Chain;Desejável conhecimento em ferramentas de gestão de estoque e planejamento de demanda (S&amp;OP);Será um diferencial ter habilidade analítica para validação e conferência de dados;Mobilidade para atuar em Piracicaba/SP em uma jornada híbrida.Informações adicionaisETAPAS DO PROCESSO SELETIVO:Nosso processo contempla 3 etapas principais (podem ter outras, e você ficará por dentro caso avance):Inscrição - preenchimento deste formulário e de dados adicionais, caso necessário.Entrevista com o RH - um bate-papo para nos conhecermos.Entrevista com a liderança: bate-papo mais técnico para contar ainda mais sobre o dia a dia e os desafios.Nossa comunicação será por e-mail e telefone - confira se seus dados estão atualizados. CONHEÇA MAIS SOBRE O QUE É SER RAÍZENQue tal conhecer mais sobre como é fazer parte da Raízen e entender como a nossa cultura RAIZ contribui para um ambiente de trabalho em que você terá oportunidade de promover um impacto positivo no mundo?Nosso Instagram de Carreiras: @raizencarreirasNão é essa a vaga ideal? Volte para a página principal: https://carreiras.raizen.com.br/Também quer receber novidades sobre a Raízen no e-mail? https://chat.sparkrh.com/gente-raizen/news#VemSerRaízen",Raízen ,vacancy_type_effective,,False,Piracicaba,São Paulo,Brasil,https://genteraizen.gupy.io/job/eyJqb2JJZCI6NjIwMTM3MCwic291cmNlIjoiZ3VweV9wb3J0YWwifQ==?jobBoardSource=gupy_portal,False,hybrid,True
6269534,2023-12-11T19:15:15.518Z,ANALISTA DE LOGÍSTICA II,"Crescer juntos sempre foi nosso jeito!As pessoas são a força do nosso trabalho. A soma das nossas diferenças, com colaboração, criatividade e aprendizado contínuo, impulsionam voos mais altos. Venha fazer parte do nosso time e nos ajude a transformar o universo lácteo. #VemSerAlvoarLácteosResponsabilidades e atribuiçõesControlar a roteirização de entregas;Ministrar a disponibilização de veículos terceiros;Fazer a gestão dos agendamentos de entregas de produtos acabados;Acompanhar diariamente o status das entregas;Monitorar junto ao time sobre a chegada dos veículos para posterior carregamento e saída para entregas;Ser responsável pelos cadastros no SAP de motoristas e transportadoras;Elaborar relatórios de roteirização extraindo a informação dos sistemas vigentes e exportando em formato de relatórios.Requisitos e qualificaçõesEnsino Superior Completo em Logística, Administração ou área afins;;Experiência na área;Pacote Office Avançado será um diferencial;Conhecimento em SAP e Sistemas WMS.Competências: Comunicação, Foco no Cliente, Iniciativa, Foco em Resultado, Resiliência, Agilidade e Inovação.Informações adicionaisSalário compatível com o mercado;Vale Alimentação;Plano de saúde Unimed por adesão;Plano Odontológico por adesão;Loja virtual para compra de produtos com desconto;Material para filhos de colaboradores até o 5º anoLeite em Pó para filhos de colaboradores de 1 á 5 anosPlataformas de cursosPLR conforme atingimento de metas",Alvoar Lácteos,vacancy_type_effective,,False,Lagoa da Prata,Minas Gerais,Brasil,https://alvoarlacteos.gupy.io/job/eyJqb2JJZCI6NjI2OTUzNCwic291cmNlIjoiZ3VweV9wb3J0YWwifQ==?jobBoardSource=gupy_portal,True,on-site,True
6122429,2023-12-11T19:08:32.244Z,Analista de Gestión y Procesos,"¡Hidrovias do Brasil promueve la conexión de América del Sur con innovación, eficiencia y sostenibilidad! A través de nuestras soluciones logísticas integradas queremos impulsar el desarrollo del continente sudamericano.Operando desde 2010, Hidrovias do Brasil opera con transporte acuático, operación de terminales, cabotaje e integración de servicios logísticos. Tenemos operaciones estratégicas en el Corredor Norte de Brasil (Pará), Corredor Sur (hidrovía Paraguay-Paraná), Operación Cabotaje (Pará) y Puerto de Santos.Creemos en aprovechar el potencial del agua para mover nuestra riqueza y conectar América del Sur.¿Quieres embarcarte con nosotros en este viaje hacia un futuro mejor?Estamos buscando una persona Analista de Gestión y Procesos que tendrá la misión de acompañar y garantizar la implementación de las iniciativas/acciones relacionadas con el cumplimiento de los requisitos de las Normas ISO 9001, ISO 14001 y Código IGS, así como, la ejecución de las actividades relacionadas al Programa de Excelencia Operacional.Responsabilidades e atribuiçõesComo Analista de Gestión y Procesos usted será responsable de:Verificar el cumplimiento de procesos internos del SGI, especialmente a bordo;Acompañar auditorías internas y externas del sistema de gestión;Apoyar a las diversas áreas en la creación, revisión y/o aprobación de procedimientos e instructivos del SGI;Registrar desvíos, no conformidades, oportunidades de mejora, control de cambios, reclamos de clientes y apoyar en la implementación de planes de acción correctivos;Acompañar y ejecutar las actividades relacionadas al Programa de Excelencia Operacional en la Operación Sur.Requisitos e qualificaçõesSi usted tiene:Formación en Ingeniería, Tecnología de Producción, Administración de Empresas y/o afines (deseable);Curso de Normas ISO 9001 e ISO 14001 (deseable);Manejo de Paquete Office (deseable);Curso de idioma Portugués (deseable); Será un plus si tienes:Experiencia en el área de Calidad y participación en auditorías internas y externas de las normas ISO 9001 y/o ISO 14001 (deseable).Curso de Código IGS (deseable).Informações adicionais¿Qué ofrecemos?⏰ Horarios y modalidades de trabajo flexibles según elegibilidad (presencial, híbrido o remoto);💲 Beneficio de participar en el PPR (Programa de Participación en Resultados);🩺 Para cuidar tu salud, ofrecemos Asistencia Médica y Dental básica extensible a dependientes y Seguros de Vida;🥗 ¡Bono de comida para dietas equilibradas!🚍 Bono de transporte (exclusivo para vacantes en el modelo híbrido o presencial);🍼 Sala de lactancia equipada para que las mamás la utilicen en cualquier momento;🗨️ Acceso a PAPO - Programa de asistencia profesional y confidencial para orientación sobre problemas personales, psicológicos, financieros y legales de forma totalmente gratuita;🏅 ¡Hidrovias do Brasil está certificada como “Mejores Empresas para Trabajar”, ​​reconocida por Great Place to Work! Aquí encontrará un ambiente de trabajo colaborativo, innovador, que respeta y cree en la diversidad y las diferencias;📚Promovemos un ambiente seguro y una cultura diversa, inclusiva y de desarrollo continuo. Para ello contamos con una plataforma de formación llamada Academia Hidrovias, que ofrece diversos cursos, así como programas para fomentar la educación, la formación y los idiomas.¿Por qué trabajar en Hidrovías do Brasil?Creemos que la cocreación y la innovación son esenciales para nuestro crecimiento. Por eso contamos con el Programa de Mejora Continua, que brinda a los empleados la oportunidad de compartir ideas innovadoras para la Compañía, además de ofrecer visibilidad y exposición al alto liderazgo;Contamos con un Comité de Clima dedicado a promover acciones, eventos y celebraciones para un ambiente aún más relajado;Diálogo abierto con nuestro equipo de Recursos Humanos, con ciclos de conversación y escucha activa con todos los empleados;Comunicación de puertas abiertas y accesibilidad con el liderazgo;Hidrovias do Brasil creó varias metas de cuidado ambiental y desarrollo social para los próximos años. Puede obtener más información visitando: https://sustentabilidade.hbsa.com.br/es/ ¡Ven a navegar con nosotros!",Hidrovias do Brasil - Sul,vacancy_type_effective,,False,Villa Hayes,,Paraguai,https://hidroviases.gupy.io/job/eyJqb2JJZCI6NjEyMjQyOSwic291cmNlIjoiZ3VweV9wb3J0YWwifQ==?jobBoardSource=gupy_portal,True,hybrid,True
6267591,2023-12-11T19:02:29.111Z,ANALISTA DE TREINAMENTO E DESENVOLVIMENTO,"Você é apaixonado por desenvolver e capacitar pessoas?Possui um bom relacionamento interpessoal, comunicação eficaz, gestão de tempo e capacidade de análise?Então essa vaga é para você!Responsabilidades e atribuiçõesAvaliar as necessidades de treinamento dentro da organização por meio de análises de desempenho, feedbacks e orientações da gestão;Criar materiais didáticos, módulos de treinamento e recursos educacionais alinhados aos objetivos estratégicos da empresa;Administrar programas de treinamento, workshops e eventos educacionais, garantindo a participação ativa dos colaboradores.Requisitos e qualificaçõesSuperior completo;Necessário 1 ano de experiência na área;Conhecimentos necessários: Gestão de pessoas, Treinamento e desenvolvimento, design instrucional.Informações adicionaisOferecemos:salário fixo;vale transporte;seguro de vida;convênio médico;convênio odontológico;credencial plena do SESC;PPR;programa de saúde financeira;ticket. ",GVC SOLUÇÕES EM COBRANÇA,vacancy_type_effective,,False,São José do Rio Preto,São Paulo,Brasil,https://gvcsolucoes.gupy.io/job/eyJqb2JJZCI6NjI2NzU5MSwic291cmNlIjoiZ3VweV9wb3J0YWwifQ==?jobBoardSource=gupy_portal,False,on-site,True
6269144,2023-12-11T19:01:40.517Z,Analista SR de Sistemas (Engenharia de Dados) RPC Curitiba ,"Estamos em busca de um profissional experiente para ocupar a posição de Analista de Sistemas Sr. na área de Tecnologia – Desenvolvimento de Sistemas da RPC em Curitiba-PR. O que fazemos?Operamos com base em um conjunto de metodologias, com destaque para o Lean e suas entregas contínuas. Nossa equipe é dedicada à criação de produtos altamente disponíveis, sempre com foco em privacidade e segurança. Se você é um profissional analítico, curioso, gosta de trabalho em equipe e tem a energia para aprender, além de atenção aos detalhes e busca constante por inovação, queremos conhecê-lo!Responsabilidades e atribuiçõesConheça o dia a dia desse profissional: O Analista de Sistemas, especializado na área de Engenharia de dados e Análise de sistemas, desempenha um papel crucial na RPC. Interagindo com clientes internos, participando ativamente do desenvolvimento de inovações e gerenciando sistemas essenciais como Negócios RPC, Aplicativo Você na RPC, Aplicativo de Interatividade, Pós-vendas, entre outros.Requisitos e qualificaçõesO que buscamos em você:Resolução de Problemas: Habilidade para identificar e resolver problemas complexos de forma eficiente, buscando soluções inovadoras quando necessário. Comunicação e Trabalho em Equipe: Capacidade de se comunicar claramente com outros membros da equipe, entender requisitos e contribuir de forma colaborativa para projetos. Mapeamento de processos: Capacidade de entender os requisitos de sistemas, mapear os processos ASIS e TOBE e documentação.Engenharia de dados:Experiência em realizar processos de ETL usando Python;Proficiência em SQL e modelagem de dados;Conhecimentos sólidos em Data Warehouse e Data Lake;Experiência em MySQL, PostgreSQL, BigQuery;Conhecimento em ferramentas de visualização de dados: Looker Studio e Power BI.Linguagens de Programação:Experiência sólida em Python;Proficiência em SQL. API Rest:Habilidade para desenvolver e consumir APIs REST.Controle de Versão e Colaboração:Experiência com Git para controle de versão;Capacidade de trabalhar em equipe e colaborar efetivamente usando Git.Contêinerização e Virtualização:Familiaridade com Docker para virtualização e containerização. Sistema Operacional:Conhecimento Linux.Outras Skills:Experiência em AWS;Experiência em GCP;Experiência com metodologias ágeis. Diferencial:Conhecimento de técnicas de IA e Machine Learning;Conhecimento de Data Science.OBS: Vaga no modelo Hibrido (Disponibilidade para residir em Curitiba/PR). Informações adicionaisO que temos aqui:Salário compatível com o mercadoAutonomia para assumir grandes responsabilidadesOportunidades de Carreira e DesenvolvimentoAssistência Médica e OdontológicaSeguro de VidaPrograma de Participação de ResultadosVale-transporteDay off (aniversário)GympassAuxilio alimentaçãoCesta de natalVale brinquedoDesconto para atendimento psicológico - VittudeAuxilio crecheLicença paternidade e maternidade estendidaPlataforma de Educação CorporativaOportunidade para associar-se ao Clube Gazeta do Povo com desconto de até 50% em mais de 1.200 estabelecimentos credenciados.Estamos ansiosos para lhe conhecer.Vaga também disponível para profissional PCD",GRPCOM,vacancy_type_effective,2023-12-24T00:00:00.000Z,False,Curitiba,Paraná,Brasil,https://grpcom.gupy.io/job/eyJqb2JJZCI6NjI2OTE0NCwic291cmNlIjoiZ3VweV9wb3J0YWwifQ==?jobBoardSource=gupy_portal,False,hybrid,True
6269104,2023-12-11T19:00:52.667Z,2023-088 Analista de Facilities e Logística Pleno,"A Atech é uma empresa do Grupo Embraer. Desenvolvemos soluções tecnológicas com DNA 100% nacional, por meio de sistemas que controlamos voos, que atuam na defesa do ar, terra e mar, simuladores e também soluções aplicadas ao mercado corporativo. Acreditamos no potencial humano: transitamos entre a experiência e a juventude, sabemos que somos diversos e pensamos fora da caixa diante de cada desafio. É da Atech, em parceria com a Força Aérea Brasileira, o desenvolvimento do sistema de gestão e controle de tráfego brasileiro que é, reconhecidamente, um dos melhores do mundo. Atech não está somente por trás da segurança e eficiência dos voos no Brasil, mas também desenvolve projetos estratégicos na área de Defesa e Segurança, que envolvem sistemas para a tomada de decisão, simulação, sistemas embarcados, entre outros. A empresa é uma das únicas latino-americanas a dominar tecnologias ligadas a sistemas de instrumentação e controle na área nuclear.A inovação e a visão tecnológica levaram a Atech a criar, uma área Corporativa, com o objetivo de levar a inovação para o segmento privado. Atualmente, a Atech desenvolve soluções para as áreas de Logística, Gestão de Ativos e Energia. E contamos com você, novo talento que deseja aprender e inovar para juntos continuarmos construindo soluções que impactam e trazem segurança a nossa sociedade. Responsabilidades e atribuiçõesPrincipais Atividades:No dia a dia você será responsável pela gestão de contratos terceirizados, como limpeza, recepção, copa e manutenção predial. Apoio direto ao time de SP com acompanhamento de obras e manutenções locais. Apoiar no controle e gerenciamento do orçamento da área, bem como propor ideias de melhorias de processo voltadas a cultura Lean, apoio em eventos corporativos e atendimento ao cliente interno do site.Atuará também como responsável pelo controle de estoque, recebimento e liberação de materiais para solicitantes internos e externos, embalar e desembalar materiais e endereçamento. Estará sob a sua responsabilidade também, todo o fluxo de entrada de material no sistema e o controle dos materiais nela, identificação de materiais ativos da empresa e de terceiros e repasse de informações referente ao controle de estoque ao time contábil. Requisitos e qualificaçõesRequisitos:Domínio de pacote office (Excel);Experiência anterior em Facilities e/ou Logística e almoxarifado;Formação superior em áreas correlatas.Informações adicionaisLocal de Trabalho: Rio de Janeiro/RJ (Atuação Presencial)",Atech ,vacancy_type_effective,2025-01-28T00:00:00.000Z,False,Rio de Janeiro,Rio de Janeiro,Brasil,https://atech.gupy.io/job/eyJqb2JJZCI6NjI2OTEwNCwic291cmNlIjoiZ3VweV9wb3J0YWwifQ==?jobBoardSource=gupy_portal,True,on-site,True
6168361,2023-12-11T18:59:23.447Z,Analista de Insights e Report em Mídias Sociais Pleno,"A BR Media Group é um hub de conteúdo referência no mercado para a economia de criadores, tem mindset data-driven e lidera soluções de influência e conteúdo para as principais marcas do mundo.Buscamos um profissional para atuar na área de Report de Insights em mídias sociais. Esse profissional será responsável pelo monitoramento de resultados e métricas das marcas, garantindo que os KPIs estejam alinhados às expectativas dos clientes. Sua atuação será cross-company, com foco em métricas e resultados utilizados para auxílio na tomada de decisão.Responsabilidades e atribuiçõesDesenvolvimento de relatórios ao clienteMonitoramento de bases de dados feitas pelos Analistas jrs e estagiáriosMonitoramento e edição de dashboards ao clienteReuniões e apresentações de relatoria junto ao clienteComunicação integrada com área comercial, planejamento e atendimento para soluções estratégicas e insightsIdentificação de oportunidades para o cliente com base na performance e em social listeningAcompanhamento e monitoramento de todas as entregas ao clienteFluxo com o time comercial para utilização dos insights de campanha em novos projetosRequisitos e qualificaçõesExperiência com métricas de mídia (Alcance, Impressões, CTR, Engajamento etc)Ótima comunicação oral e domínio da língua portuguesaSer heavy user de redes sociais e ter conhecimento de META, TikTok, YouTube, Twitch, Twitter, Serviços de Streaming, etc;Inglês IntermediárioEstar ligado às tendências do mercado publicitárioConhecimento intermediário/avançado das principais ferramentas de criação de dashboard e análise de dados; (looker studio, power BI, etc)Pacote office avançado (Excel e PowerPoint)Facilidade com números e visão sistêmicaTer habilidades analíticas e raciocínio lógicoFlexibilidade e resolução de problemasOrganização e gestão de tempo Diferencial (não eliminatório): Conhecimento de TI, Banco de Dados, Big Data e IAExperiência no mercado de Marketing de InfluênciaInformações adicionaisVale Refeição de R$41,00 no Flash🦩;Estacionamento ou Vale Transporte no Flash🦩;Gympass💪;Plano de Saúde Amil;Day Off de aniversário🎂;Convênio médico;Auxílio creche para crianças de até 6 anos (benefício só para mamães);Dress Code casual;Regime de contratação CLTModelo de trabalho: Presencial (próximo ao Shopping Morumbi em São Paulo/SP)",BR Media Group,vacancy_type_effective,,False,São Paulo,São Paulo,Brasil,https://br-mediagroup.gupy.io/job/eyJqb2JJZCI6NjE2ODM2MSwic291cmNlIjoiZ3VweV9wb3J0YWwifQ==?jobBoardSource=gupy_portal,False,on-site,True
6269071,2023-12-11T18:57:34.781Z,Analista de Marketing Pleno,"Somos uma das mais admiradas incorporadoras do setor imobiliário brasileiro e buscamos pessoas que, assim como nós, são apaixonadas por criar soluções inovadoras e proporcionar experiências únicas aos clientes. Mais do que empreendimentos, entregamos sonhos.Responsabilidades e atribuiçõesElaboração de briefings e interface com agências de publicidade, eventos e promoção;Planejamento, execução e acompanhamento das ações de marketing (campanha publicitária, ações promocionais, ações de endomarketing, etc);Planejamento e controle orçamentário de ações e campanhas;Acompanhamento e mensuração de resultados das campanhas e ações, para manutenção ou mudança da estratégia;Responsável pela contratação, acompanhamento e manutenção da comunicação;Planejamento, execução e acompanhamento de eventos; Interface com área comercial e empresas de vendas parceiras;Aprovação de plano de mídia e layout de materiais gráficos;Planejar e coordenar a execução de plano de comunicação para produtos de alto padrão e luxo, a fim de acelerar as vendas, aumentar o número de leads e contribuir com a segmentação da marca no segmento de design e luxo.Requisitos e qualificaçõesFormação superior completa em publicidade e propaganda, marketing, administração ou áreas de comunicação em geral;Pacote Office - Avançado;Conhecimento em plano de mídia off e on;Planejamento e organização de eventos;Atuação na área de marketing em alguma empresa que atua no segmento de alto padrão e/ou luxo.Será um diferencial se você tiver:Atuação prévia na área de marketing no mercado imobiliário;Conhecimento das etapas de um lançamento imobiliário.Informações adicionaisLocal de Trabalho: Avenida PaulistaModelo de trabalho: HíbridoBenefícios:Assistência Médica Sul América;Assistência Odontológica Sul América;Vale Refeição;Vale Transporte;Seguro de Vida;Gympass/TotalPass;Day off de Aniversário;Frutas e Café no Escritório;Auxílio Bebê após o nascimento (6 meses);Licença Casamento Estendida;Licença Paternidade Estendida;Bônus Anual;Porto Pet Love (Convênio médico para o seu PET).Atenção Candidato: Fique atento à GUPY, toda a nossa comunicação será realizada por aqui!",Confidencial,vacancy_type_effective,2024-01-11T00:00:00.000Z,False,São Paulo,São Paulo,Brasil,https://confidencial18.gupy.io/job/eyJqb2JJZCI6NjI2OTA3MSwic291cmNlIjoiZ3VweV9wb3J0YWwifQ==?jobBoardSource=gupy_portal,True,hybrid,True
