job_id,published_date,title,description,career_page_name,type,application_deadline,is_remote_work,city,state,country,job_url,disabilities,workplace_type,submitted
5971879,2023-11-30T18:44:20.529Z,Analista de Laboratório B HERINGER PAULÍNIA-SP,"Estamos em busca de uma pessoa com energia vibrante e em sintonia com nosso DNA de crescimento. Buscamos alguém para atuar no grupo EuroChem (Fertilizantes Tocantins, Heringer e Salitre) e colaborar com nosso propósito de prover fertilizantes para a cadeia de alimentos mundial, com muitas oportunidades de aprendizados e desenvolvimento pessoal!Se você é uma pessoa que se identifica com nossos pilares de Confiança, Transparência e Colaboração, a EuroChem é o seu lugar! Incentivamos a diversidade e inclusão. Queremos pessoas de diferentes nacionalidades, raças, gênero, idade, orientação sexual, religião e quaisquer outras diferenças que agreguem ao nosso time, diferentes visões, conhecimentos e opiniões. Venha nos ajudar nessa jornada de prover alimento para o mundo!Responsabilidades e atribuiçõesExecutar suas atividades em consonância com as normas e procedimentos de Qualidade, Saúde, Segurança do Trabalho e Meio Ambiente, definidas pela empresa;Executar recebimento, coleta e preparação das amostras conforme os procedimentos, utilizando todas as operações unitárias necessárias, homogeneização, quarteamento, filtragem, secagem, moagem e pulverização;Executar análises granulométricas, de umidade e percentagem de sólidos de amostras;Executar análise química de amostras dos processos utilizando técnicas instrumentais;Executar análise química por via úmida, através dos métodos: volumétrico, gravimétrico e colorimétrico; Executar preparação e fatoração de soluções padrão e solução para limpeza de itens do laboratório;Executar pequenas manutenções nos equipamentos conforme procedimento, realizando sua limpeza para evitar contaminação das amostras;Apresentar propostas de revisão de procedimentos do Laboratório, através de observação e/ou pesquisas, quais as possibilidades de alterações, visando à melhoria continua;Fazer verificação de confiabilidade dos instrumentos de medição conforme plano;Executar tarefas de descarte de resíduos, provenientes das análises realizadas;Executar avaliação crítica dos dados e inserção em ERP;Realizar decisão de utilização no sistema SAP dos produtos;Manter limpo seu local de trabalho, como exigido pelas boas práticas de laboratório;Comunicar ao superior imediato a ocorrência de desvios de resultados, gerando uma investigação laboratorial, verificando e apresentando alternativas para resolução;Executar a capacitação dos auxiliares;Executar outras tarefas afins e correlatas;Trabalhar em turno de revezamento.Requisitos e qualificaçõesMANDATÓRIO:Superior ou Técnico na área Química com registro no CRQ ativo;Conhecimento em coleta, identificação, preparação e arquivamento de amostras;Conhecimento em pacote office (Word e Excel);Conhecimento em análises via úmida;Conhecimento no processo de análise instrumental (Plasma, Ultra Violeta, Absorção Atômica);DESEJÁVEL:Inglês (Diferencial);Ter trabalhado em empresas do segmento de fertilizantes (Diferencial).Informações adicionais💙 TEMOS MUITOS BENEFÍCIOS ESPERANDO VOCÊ AQUI🚑 Plano de saúde para titular e dependentes🦷 Plano odontológico para titular e dependentes💖 Seguro de Vida🤑 Programa de Previdência Privada💸 PLR atrelado às metas💳 Vale Alimentação ou Refeição para o seu dia a dia🥘 Refeitório no local (dependendo da localidade)﻿👩🏽 Licença maternidade de 6 meses (Programa Empresa Cidadã)👨🏽 Licença paternidade de 20 dias (Programa Empresa Cidadã)🧘🏽‍♀️ Temos um Programa especial de Apoio e Cuidado para colaboradores e familiares🏋🏽‍♀️ Você poderá contar com uma plataforma de atividades físicas: Gympass📚 Programa de Educação e Idiomas (de acordo com a política da empresa)",EuroChem,vacancy_type_effective,,False,Paulínia,São Paulo,Brasil,https://carreiras.gupy.io/job/eyJqb2JJZCI6NTk3MTg3OSwic291cmNlIjoiZ3VweV9wb3J0YWwifQ==?jobBoardSource=gupy_portal,False,on-site,True
6022504,2023-11-30T18:42:28.440Z,Analista Sênior,"Multinacional AmericanaResponsabilidades e atribuiçõesDesenvolver um plano de projeto/lista de tarefas usando ferramentas de planejamento adequada.Gerenciamento de partes interessadas: Conhecimento das principais partes interessadas em áreas funcionais.  Gerenciar um plano de comunicação entre as partes interessadas. Revisão técnica, validando os requisitos técnicos de serviços dos projetos e contratados, para garantir às necessidades da companhia.Gerenciamento da fila de chamados da área. Processar as solicitações abertas pelos colaboradores da companhia analisando o problema e analisando a causa raiz do serviço afetado, fornecer orientação a outros analistas /equipes quando necessárioApoiar o processo de aquisição de itens necessários para entregar produtos/serviços para companhia, em colaboração com o departamento de compras e em conformidade com os processos de aquisição.Realizar o desenho de aplicações de voz.Realizar desenho, topologia e conectividade nos projetos da companhia. Suporte e operação nos sistemas de telefonia da companhia em redes LAN, WAN e SDWAN. Configuração, administração e suporte de equipamentos de telefonia sendo PABX IP, analógico e hibrido. Gestão de fornecedores e acompanhamento de indicadores de performance. Análise e troubleshooting de telefonia.Gerenciar toda plataforma de voz e vídeo da companhia. Requisitos e qualificaçõesFormação completo superior em áreas afins;Experiência prévia nas atividades do cargo;Certificações em PABX 3CX ou solução de voz de mercado como CISCO, Avaya, Panasonic;Conhecimento em LAN fabricantes Fortinet, HP / Aruba / Dell;Conhecimento em QoS em Fortinet;Informações adicionaisModelo de trabalho: PresencialLocal de Trabalho: Zona Oeste.",Confidencial - Usar esta,vacancy_type_effective,,False,Rio de Janeiro,Rio de Janeiro,Brasil,https://empresadaareadesaude.gupy.io/job/eyJqb2JJZCI6NjAyMjUwNCwic291cmNlIjoiZ3VweV9wb3J0YWwifQ==?jobBoardSource=gupy_portal,True,on-site,True
6113203,2023-11-30T18:40:45.060Z,Analista de Suprimentos - Junior ,"NOSSO MAIOR OBJETIVO É SALVAR VIDAS!Na Americas Health, levamos acesso à saúde de qualidade para os brasileiros, permitindo que as pessoas sejam tratadas próximas de suas casas e famílias. Fazemos isto por meio de um portfólio integrado de serviços, que combinam tecnologias inovadoras e cuidados personalizados.Nosso portfólio inclui hospitais líderes em tecnologia, unidades de terapia intensiva (UTI), serviços de radiologia, hemodiálise e internação domiciliar, além de tecnologias inovadoras que possibilitam às pessoas cuidarem da própria saúde.Isto nos possibilita estender nossa linha de cuidados ao longo da cadeia de saúde e acompanhar a jornada do paciente, antes, durante ou após uma internação hospitalar.Responsabilidades e atribuiçõesProcessos Chave:1. Pesquisa de mercado e cotação de preços;2. Negociação com fornecedores.Entregáveis:1. Responsável por realizar a pesquisa de mercado para cotações de preços e negociações com fornecedores, analisando, emitindo pedidos e acompanhando a entrada de notas fiscais no sistema.2. Manter o cadastro de fornecedores sempre atualizado e acompanhar relatórios para análise da performance dos fornecedores;3. Responsável por pesquisar novos fornecedores de produtos e serviços, visando desenvolver fontes alternativas de suprimentos, melhores condições de preços, produtos, qualidade, prazos de pagamento e entrega.4. Realizar tarefas referentes ao suporte administrativo nos processos de compras dos diversos materiais utilizados na empresa, realizar acompanhamento das requisições de compras e realizar cotações diversas.Requisitos e qualificaçõesGraduação completaExperiência na funçãoTer senso de urgência, Comunicação assertiva e Técnicas de negociação; Conhecimento do pacote office. Informações adicionaisHorário comercial;Benefício flexível;Assiduidade;",Confidencial,vacancy_type_effective,,False,Goiânia,Goiás,Brasil,https://confidencial223344.gupy.io/job/eyJqb2JJZCI6NjExMzIwMywic291cmNlIjoiZ3VweV9wb3J0YWwifQ==?jobBoardSource=gupy_portal,True,on-site,True
6112933,2023-11-30T18:40:25.257Z,Analista de FP&A Sênior ,"Nosso time é formado por pessoas com brilho no olho e vontade de fazer a diferença.Temos objetivo de encantar clientes do Brasil e do mundo, com propósito de Interpretar Tendências e Despertar Desejos.Se você também faz com paixão, tem flexibilidade, transparência, envolvimento, gosta de trabalhar com união e desafio, a Arezzo&amp;Co pode ser o lugar certo para você!Queremos cada vez mais construir um ambiente diverso e inclusivo, por isso, nossa política de contratação não discrimina gênero, raça/cor, religião, orientação sexual, idade, condição de HIV e deficiência intelectual ou física.Venha evoluir com a gente, em cada passo da nossa jornada. RUMO A 2154!Responsabilidades e atribuiçõesPreparar material para reuniões de resultado para Diretoria executiva;Gestão e organização do tempo com as demandas extras;Sugestão de oportunidades para resultado;Melhorias nos processos que já são executados na área;Acompanhamento de Receita de vendas;Construção de forecast com as áreas dos novos negócios;Análise de Resultado;Participação ativa na construção de Orçamento;Participação ativa no acompanhamento de Orçamento;Fechamento Mensal gerencial ;Análise e acompanhamento de forecast;Preparar ferramentas para divulgação de resultados;Apoiar nas demais demandas do time.Apoiar/ participar de forma ativa de novos projetos.Requisitos e qualificaçõesFormação superior completa em Ciências Contábeis, Administração, Economia, Engenharia ou áreas afins.Domínio em Pacote Office, Excel avançado; Experiência de no mínimo dois anos em FP&amp;A;Vivência em construção de Orçamento.Profissional com perfil comunicativo, resiliente, analítico, flexível, pró ativo e com curiosidade para se desenvolver em novas atividades. Informações adicionaisVaga em modelo de trabalho presencial na cidade de Campo Bom/RS.Benefícios:🍛 Vale Alimentação/Refeição - Para que possa ter mais autonomia, você pode optar entre o Vale Alimentação para utilizar em mercados e fazer sua própria comida, ou pelo Vale Refeição, para utilizar em restaurantes e pedir seu lanche; 🚌 Vale Transporte - Oferecemos o vale transporte para o transporte público, conforme sua necessidade de itinerário ; 🩺 Plano de Saúde e Plano Odontológico - Para cuidar sua saúde e dos seus dependentes, oferecemos Plano de Saúde da Unimed, com abrangência regional (Vale dos Sinos) e nacional, bem como Plano Odontológico Bradesco; 💪 Gympass - Quer manter a saúde física ativa? Oferecemos o Gympass, também extensivo aos seus dependentes;  🧠 Psicologia Viva – Em relação a sua saúde psicológica, oferecemos o Psicologia Viva, uma plataforma de atendimento psicológico online; 🏷 New Value - clube de benefícios com ofertas exclusivas; 👨‍👧‍👦 Licença Paternidade - Oferecemos aos papais licença paternidade estendida para 20 dias; 💸 Desconto nas marcas – Desconto exclusivo para colaboradores em todas as marcas da Maior House Of Brands do Brasil! ⛱ DayOff - No mês do seu aniversário você pode escolher um dia de folga remunerada para aproveitar mais um ano de vida com quem mais ama;  💲 PPR - Participação de Lucros conforme atingimento de metas da companhia/área.",Arezzo&CO,vacancy_type_effective,,False,Campo Bom,Rio Grande do Sul,Brasil,https://arezzoeco.gupy.io/job/eyJqb2JJZCI6NjExMjkzMywic291cmNlIjoiZ3VweV9wb3J0YWwifQ==?jobBoardSource=gupy_portal,True,on-site,True
6050387,2023-11-30T18:39:15.200Z,ANALISTA I,"Executar a elaboração, cobrança e monitoramento de chamados de atendimento corretivos e preventivos, através de ações ativas, controles e acompanhamentos de relatórios, visando garantir o prazo desejado e estabelecido pela cliente..Responsabilidades e atribuições     Monitorar ativamente os chamados abertos pelo cliente e direcionar para o prestador de serviço adequado para especificidades do serviço e localização geográfica. Utilizar uma ferramenta web fornecida pelo cliente para gerenciar os chamados. Manter um alto padrão de atendimento ao cliente e garantir a satisfação do cliente. Otimizar os recursos gerando sinergia e economia em mão de obra e deslocamento.   Acompanhar o progresso e a resolução de cada chamado. Dentro do prazo, custo, qualidade e escopo estabelecidos. Utilizar uma ferramenta web fornecida pelo cliente para gerenciar os chamados. Análise crítica da evolução das atividades.   Identificar e solucionar potenciais problemas de forma proativa, realizando a interlocução entre o cliente e os prestadores de serviço. Utilizar uma ferramenta web fornecida pelo cliente para gerenciar os chamados. Outlook, teams ou call Atender a expectativa do que foi solicitado e buscar/propor alternativas   Comunicar-se regularmente com clientes e prestadores de serviços garantindo o entendimento do escopo e as especificidades de cada serviço. Outlook, teams ou call Realizar Fup garantindo transparência no processo e segurança ao cliente.   Priorizar e atribuir chamados com base na urgência e complexidade, além de avaliar o roteiro adequado para ganho de sinergia, Outlook, teams ou call Atender a expectativa do que foi solicitado e buscar/propor alternativas   Mapear riscos e impactos na execução da atividade, identificar os gaps e adequações operacionais  Power point, Excel ou ferramenta própria. implementar as mudanças garantindo que todos os envolvidos estejam cientes e preparados   Buscar melhorias nos processos, visando produtividade, eficiência, mitigação de riscos e melhoria na qualidade dos serviços prestados. normas, procedimentos, comunicados, fluxos, manuais. implementar as mudanças garantindo que todos os envolvidos estejam cientes e preparados     Requisitos e qualificações  Escolaridade Cursando ensino superior.  Conhecimentos Excel mínimo Intermediário;   Competências Pensamento crítico;Adaptável a circunstâncias, ambientes, mudanças e inovações;Habilidade com novas formas de trabalho (Remoto, Home Office, Sistema Hibrido, etc);Desejável conhecimento em metodologias ágeis e Facilites manager;  ",Serviços Integrados -  Grupo TecBan,vacancy_type_effective,,False,Cotia,São Paulo,Brasil,https://servicosintegradostecban.gupy.io/job/eyJqb2JJZCI6NjA1MDM4Nywic291cmNlIjoiZ3VweV9wb3J0YWwifQ==?jobBoardSource=gupy_portal,False,hybrid,True
6009660,2023-11-30T18:38:12.904Z,Analista Garantia da Qualidade Júnior,"Venha fazer parte da #GeraçãoAché!Somos um time diverso, com diferentes competências, experiências, pensamentos, crenças, etnias, idades, gêneros, culturas e conhecimentos, que se somam fazendo do Aché uma empresa de trajetória vencedora.Buscamos profissionais que, assim como nós, buscam incessantemente a excelência, com disposição para evoluir e crescer sempre. Compartilhando dos mesmos valores, trabalhamos pelo propósito de levar mais vida às pessoas onde quer que elas estejam.Inscreva-se!Responsabilidades e atribuiçõesData limite para inscrição: 05/12/2023Auxiliar na investigação dos desvios de qualidade, identificação da causa raiz e definição das ações corretivas e preventivas;Auxiliar no monitoramento da implementação e eficácia dos planos de ação;Realizar a disposição (aprovação e/ou reprovação) de materiais;Treinar e orientar os colaboradores da área e das demais plantas quanto aos procedimentos operacionais e normas da qualidade;Acompanhar auditoria interna e autoinspeção;Acompanhar os indicadores da área;Gerenciar cronogramas de projetos;Acompanhar o mapeamento de processos BPDAT e garantir que estejam em conformidade com os requisitos regulatórios;Gerir documentos do Sistema da Qualidade, utilizando Sistema Se Suite participando do fluxo de elaboração, revisão e homologação das Políticas, Manuais, Procedimentos, Guias, Instruções de Trabalho e demais documentos pertinentes a Gestão de Documentos;Elaborar, treinar e orientar os colaboradores quanto aos procedimentos operacionais e normas da qualidade;Realizar follow-up das atividades todos os níveis hierárquicos da empresa.Requisitos e qualificaçõesPré-Requisitos: Imprescindível:Formação - Superior completo ou estar no último de Farmácia, Química, Engenharia Química e/ou áreas afins;Conhecimento intermediário no Pacote Office;Facilidade e expertise em indicadores;Interesse no desenvolvimento técnico;Ter facilidade para leitura e edição de textos. Desejável:Conhecimento em Sistema de Gestão de Documentos (Se Suite - Módulo Documentos);Conhecimento em Sistema de Gestão de Desvios (Se Suite - Módulo Ações);Conhecimento em software SAP;Conhecimento em ferramentas da Qualidade, como por exemplo: Análise de Risco, Análise SWOT, Fluxograma, Diagrama de Pareto, 5W2H, etc.  Obs.: O Aché valoriza e fomenta a diversidade, abrindo oportunidades para todos com igualdade.Informações adicionaisLocal de trabalho: Guarulhos - Rodovia Presidente Dutra, Km 222 ou Guarulhos - NEOLOG - Av. Julia Gaiolli, 740. Regime de Trabalho: Híbrido, sendo três dias presenciais. (Atuação na unidade Neolog e ter disponibilidade para idas na planta de Guarulhos)",Aché Laboratórios Farmacêuticos,vacancy_type_effective,2023-12-05T00:00:00.000Z,True,,,Brasil,https://vagasache.gupy.io/job/eyJqb2JJZCI6NjAwOTY2MCwic291cmNlIjoiZ3VweV9wb3J0YWwifQ==?jobBoardSource=gupy_portal,False,remote,True
6112949,2023-11-30T18:34:38.384Z,Analista de Finanças Sr. (Contas a Receber e Cobrança) - Terceirizada,"Buscamos por profissionais das áreas de Finanças para desenvolverem suas habilidades e fazer parte do time de Finanças da PETRONAS!Responsabilidades e atribuiçõesPreparar e encaminhar cobranças aos bancos;Auxiliar na cobrança dos valores em atraso dos clientes, visando o recebimento dos valores;Analisar os débitos dos clientes sobre o ponto de vista de prazo e recebimento, para receber os valores no menor prazo possível;Auxiliar no acompanhamento e controle os trabalhos de cobrança realizados por empresas contratadas;Analisar os boletos gerados nos registros bancários, avaliando as inconsistências de pagamento e suas causas;Analisar o recebimento, identificando aspectos relacionados à incorreção de pagamento, pagamento em duplicidade, pagamento sem juros, menor/maior, entre outros, tratando as inconsistências para a solução de problemas;Negociar condições de pagamento com clientes inadimplentes;Realizar a provisão de bonificação nos mercados, conferindo todos os pedidos de compra e inserindo os dados no sistema;Ajustar duplicatas, alterando e gerando novas duplicatas, realizando posterior comunicação aos clientes;Auxiliar na conciliação de contas de crédito não identificadas, crédito por retorno e adiantamento de clientes;Auxílio no controle e baixa de títulos de clientes de exportação e do mercado interno, identificando o autor do crédito com base em extrato e swift;Auxiliar e orientar os clientes sobre dúvidas de pagamento, fornecendo instruções pertinentes ou direcionando para o atendimento pela área de atendimento ao cliente;Auxiliar nas auditorias internas e externas e na fiscalização do governo, fornecendo informações sobre os clientes e elaborando relatórios específicos para os auditores, esclarecendo dúvidas.Requisitos e qualificaçõesEnsino Superior completo em áreas correlatas (Administração, Contabilidade e afins);Conhecimento/Experiência em Crédito e Cobrança;Excel avançado;Word avançado;Inglês intermediário/avançado.REQUISITOS DESEJÁVEISConhecimento em Power BI.Informações adicionais📍 LOCALIDADE DA VAGA: Contagem/MG🏘️ REGIME DE TRABALHO: híbrido.⏳ ETAPAS DO PROCESSO SELETIVO:Análise dos currículos recebidos;Etapa de entrevista com o RH;Etapa de entrevistas com a liderança;Avaliação Comportamental;Feedback aos candidatos.",PETRONAS,vacancy_type_outsource,2023-12-20T00:00:00.000Z,False,Contagem,Minas Gerais,Brasil,https://petronas.gupy.io/job/eyJqb2JJZCI6NjExMjk0OSwic291cmNlIjoiZ3VweV9wb3J0YWwifQ==?jobBoardSource=gupy_portal,True,hybrid,True
6004227,2023-11-30T18:33:25.594Z,Analista de Criação Sr,"Sobre a InfracommerceA Infracommerce é o maior ecossistema agnóstico de comércio digital da América Latina, que possibilita a marcas e varejistas o utilizarem de forma completa ou modular e oferecerem a melhor experiência de compra aos seus clientes com escalabilidade para ser competitivo no contexto atual.A Infracommerce nasceu da percepção de que a maioria das marcas não têm escala para competir contra os grandes marketplaces e, portanto, precisam participar de um ecossistema para ter sucesso no mundo digital. O objetivo do nosso negócio é oferecer aos clientes, da indústria e do varejo, a melhor experiência em cada etapa da sua jornada de compra, seja no mundo físico, no virtual ou na integração de ambos, com fluidez para transitar pelo caminho mais conveniente até aquilo que deseja.Sobre o time de CriaçãoVocê é apaixonado por criar e inovar? 🤩Estamos em busca de um Analista de Criação Sênior para se juntar à nossa equipe! 🚀 Se você possui habilidades excepcionais em concepção visual, pensamento estratégico e liderança criativa, esta é a oportunidade perfeita para você.Responsabilidades e atribuiçõesColaborar no desenvolvimento de campanhas visuais alinhadas às necessidades do cliente e objetivos de marketing;Interagir de modo abrangente com diferentes áreas internas;Efetuar o gerenciamento eficiente dos recursos da equipe, alinhando-os com a fila de atividades;Supervisionar o design das peças/campanhas produzidas pela equipe para manter a identidade da marca em todos os canais;Validar e aprovar materiais criativos.Garantir a entrega pontual de acordo com os prazos estabelecidos.Monitorar tendências e inovações no campo da criação, aplicando esses insights de forma estratégica em nosso trabalho.Requisitos e qualificaçõesGraduação em Publicidade e Propaganda ou Design;Experiência prévia comprovada na área;Apoio técnico de profissionais da equipe;Demonstrar habilidades estéticas e criatividade;Excelente comunicação e habilidade para trabalhar em equipe;Domínio sólido em tipografia, diagramação e no Pacote Adobe.Informações adicionaisJornada de trabalhoRegime de contratação – CLTHíbrido (presencial + home office)",Infracommerce,vacancy_type_effective,,False,São Paulo,São Paulo,Brasil,https://infracommerce.gupy.io/job/eyJqb2JJZCI6NjAwNDIyNywic291cmNlIjoiZ3VweV9wb3J0YWwifQ==?jobBoardSource=gupy_portal,False,hybrid,True
6112966,2023-11-30T18:32:35.458Z,Banco de Talentos - Analista de Atendimento,"Apostamos e investimos no desenvolvimento da nossa Gente, então venha TransformAR o seu futuro! Estamos buscando profissionais para fazer parte do nosso Banco de Talentos no time de Atendimento.Se você é resolutivo, inconformado, organizado e processual, essa vaga é para você!Responsabilidades e atribuiçõesDe maneira geral:Entender as necessidades dos clientes e atendê-los a fim de informar sobre possíveis dúvidas e soluções de problemas em sua compra, produto ou instalação.Como será o seu dia a dia por aqui:Receber contato do consumidor através dos canais de comunicação disponíveis, analisar e endereçar as respectivas tratativas;Atender com empatia, buscando a satisfação do cliente e qualidade do processo;Realizar pesquisas no banco de dados da empresa para analisar histórico dos clientes, buscando oportunidades de melhoria no atendimento;Garantir a compreensão do cliente quanto as informações prestadas em toda a etapa do processo de atendimento;Realizar follow-ups junto aos clientes sobre o andamento do seu processo de atendimento;Atender casos de Reclame Aqui, Mídias Sociais, buscando solução junto ao cliente, de acordo com o Código de Defesa do Consumidor;Atender aos prazos estipulados, política e processos da empresa;Tratar com terceiros (transportadores, fabricantes, técnicos) sobre o atendimento ao consumidor;Realizar negociações com prestadores de serviços buscando garantir uma boa apresentação de serviços e cumprir a política orçamentária da empresa.Requisitos e qualificaçõesSe você:Tem Ensino Superior completo/cursando em Administração, Contábeis, Engenharias e correlatas;Tem experiência com atendimento ao cliente focado em resolução de problemas, busca por melhorias;Tem habilidade em Excel.Informações adicionaisHorário de trabalho: Segunda a Sexta-feira das 07:42-12:00 e 13:30-18:00;Modelo: Presencial (Araçatuba);Contrato: CLT.",CentralAr.com,vacancy_type_effective,,False,Araçatuba,São Paulo,Brasil,https://centralar.gupy.io/job/eyJqb2JJZCI6NjExMjk2Niwic291cmNlIjoiZ3VweV9wb3J0YWwifQ==?jobBoardSource=gupy_portal,True,on-site,True
