job_id,published_date,title,description,career_page_name,type,application_deadline,is_remote_work,city,state,country,job_url,disabilities,workplace_type,submitted
6648198,2024-01-26T11:25:53.898Z,JBS - Analista de Sistemas Pleno,"A JBS é uma das maiores empregadoras, liderando globalmente em diversos segmentos e negócios.Há quase 70 anos trabalhamos com foco em excelência, inovação, segurança dos alimentos e práticas de sustentabilidade. Somos um Time de mais de 260 mil pessoas, alimentando o mundo com o que há de melhor!Venha fazer parte da JBS!Responsabilidades e atribuiçõesNossa missão é criar e sustentar soluções em sistemas que suportam e impulsionam uma das maiores empresas do Brasil. Trabalhando de forma colaborativa e dinâmica, sempre em conjunto com os negócios, desenvolvemos produtos personalizados que contribuem de forma significativa para a empresa se manter competitiva.Atuamos nos inúmeros negócios da companhia: Carnes, Couros, Ambiental, Combustível, Higiene e Limpeza, Colágeno, Embalagens Metálicas, Insumos Farmacêuticos, Transportadora, Envoltórios, Energia, Comunicação, Fertilizantes, Escola de Negócios. Desenvolvemos soluções em conjunto com nossos clientes internos, atuando praticamente em todas as áreas da empresa: Auditoria, Comercial, Compliance, Compra de Gado, Contabilidade, Corporativo, Controladoria, Indústria, Manutenção, Engenharia, Financeiro, Importação, Jurídico, Logística, Planejamento, Pricing, Qualidade, Recursos Humanos, Suprimentos, Sustentabilidade, Tecnologia, Tributos.A atuação de nossos analistas vai desde o entendimento do projeto com o cliente, passando pelo desenvolvimento, chegando até a implantação e sustentação da solução.Nosso principal produto é o ERP da companhia. Ele está presente em mais de 100 plantas com mais de 18.000 usuários ativos atuando nos diversos negócios da empresa espalhados pelo Brasil. Toda esteira do desenvolvimento é suportada e administrada por nossa equipe. Temos um processo bem estabelecido e controlado por ferramenta proprietária e Azure DevOps.Atuar com análise de sistemas e levantamento de processos;Programação na linguagem C# (Windows Forms, desejável Windows Service e WebService, .NET);Atuação com banco de dados SQL Server (modelagem, procedures, functions, views, etc).Requisitos e qualificaçõesEnsino Superior completo em Análise e Desenvolvimento de Sistemas e/ou áreas relacionadas a Tecnologia da Informação;Experiência com análise e desenvolvimento de sistemas, utilizando C#;Facilidade de comunicação com áreas clientes interna da empresa;Ampla experiência em SQL e .Net.Informações adicionais• Horário de trabalho das 08:00 às 18:00 com 01:12 de almoço;• Atuação 100% presencial;• Restaurante no local;• Estacionamento gratuito;• Fretado no trajeto: Estação Domingos de Morais x JBS / JBS X Estação Domingos de Morais;• Vale-transporte;• Vale-Alimentação;• Assistência Médica facultativa por modelo de parcerias;• Assistência Odontológica facultativa por modelo de parcerias;• Seguro de vida por modelo de parceria;• PLR (de acordo com o ciclo da contratação) no valor de R$ 1.250,00;• Descontos em Instituições de Ensino e de Idiomas;• Descontos e promoções em produtos exclusivos para colaboradores;• Gympass.",JBS,vacancy_type_effective,,False,São Paulo,São Paulo,Brasil,https://jbs.gupy.io/job/eyJqb2JJZCI6NjY0ODE5OCwic291cmNlIjoiZ3VweV9wb3J0YWwifQ==?jobBoardSource=gupy_portal,False,on-site,True
6674279,2024-01-25T21:30:35.378Z,Analista de Aquisição e Automação de Dados,"Respondendo à estrutura da Tecnologia, esta posição é responsável pela aquisição e automação de dados.Responsabilidades e atribuiçõesRealizar atividades de aquisição de dados relacionadas a eficiência energética e projetos de O&amp;M de usinas solares, além de outras atividades relacionadas à automação;Garantir a operacionalidade e funcionalidade da arquitetura de hardware e software de nossos produtos de gerenciamento de energia e supervisão, implementando melhorias contínuas;Criar códigos em Python para processamento de dados, adaptando-os de acordo com as necessidades dos projetos, por exemplo, variando o tipo de dispositivo de medição, protocolos de comunicação, etc.;Gerenciar a integração de dados de hardware de campo com o Azure, garantindo requisitos de conectividade e comunicação entre equipamentos de campo e infraestrutura de nuvem, incluindo protocolos OT/IoT específicos como ModBUS, LoRA, Sigfox, etc.;Gerenciar o middleware e adaptações necessárias na plataforma de gerenciamento de energia, implementando, operando e mantendo a camada de integração entre OT e TI, relacionada à eficiência energética e outros sistemas de controle e automação, incluindo software usado para controle remoto de O&amp;M (SCADA) e gestão de consumo;Implementar protocolo de comunicação entre Azure e a Plataforma, para criar pontos de monitoramento para dados de consumo de eletricidade, vapor, gás, entre outros;Promover segurança, atualização tecnológica e adequação técnica funcional à solução da empresa, visando diagnósticos que suportem a área de Eficiência Energética e O&amp;M;Colaborar com a equipe de Entrega na configuração dos pontos de medição;Identificar oportunidades de melhoria nas plataformas;Administrar a arquitetura Azure, gerenciando a aquisição, armazenamento e processamento de dados;Auxiliar na resolução de problemas, diagnóstico e reparo de questões de plataformas.Analisar os dados das plataformas, criando painéis de controle para apoiar os negócios de eficiência energética e O&amp;M;Garantir, junto com o responsável por segurança da informação da empresa, a segurança dos dados apresentados.Requisitos e qualificaçõesGraduação em Engenharia, Ciência da Computação ou correlatas;Inglês avançado;Experiência mínima de 2 anos em Tecnologia Operacional, com implementação de projetos e sua arquitetura;Experiência mínima de 2 anos em aquisição de dados;Experiência em conectividade, integração OT via APIs e protocolos web;Experiência em redes Ethernet (TCP/IP) e protocolos industriais (MODBUS RTU, MODBUS TCP/IP);Experiência em programação (PLC) e experiência com processamento/tratamento de dados;Experiência na linguagem Python;Experiência em gerenciamento de projetos de TI, especialmente em arquiteturas baseadas em nuvem (preferencialmente Azure);Desejável proficiência em arquiteturas de nuvem (preferencialmente AZURE), capaz de criar e manter arquiteturas funcionais e escaláveis, assim como soluções de armazenamento de dados em nuvem e IoT;Conhecimento amplo de questões de conectividade, arquiteturas de nuvem e middleware OT/IT.Conhecimento amplo de dispositivos OT e seus protocolos;Conhecimento em arquitetura OT;Conhecimento em Power BI;Conhecimento em plataformas de monitoramento.",Helexia Brasil,vacancy_type_effective,,False,Rio de Janeiro,Rio de Janeiro,Brasil,https://helexiabrasil.gupy.io/job/eyJqb2JJZCI6NjY3NDI3OSwic291cmNlIjoiZ3VweV9wb3J0YWwifQ==?jobBoardSource=gupy_portal,True,hybrid,True
6673867,2024-01-25T20:09:05.342Z,Cientista de Dados,"O Cientista de Dados será uma peça importante no desenvolvimento de modelos analíticos inovadores cumprindo tarefas de desenvolver e manter os modelos analíticos, prover insights negociais e transformá-los em modelos para agregar valor para a empresa.Responsabilidades e atribuiçõesDesenvolvimento de linguagem em SAS, Python, Scala ou R;Manipular e analisar dados estruturados, semi estruturados e não estruturados;Responsável por gerar a seleção de variáveis para modelos de análise de dados;Responsável com análises python e bibliotecas de ml/dl (scikit-learn, numpy, pandas, matplotlib, keras, tensorflow, pytorch, nltk);Responsável pela criação de modelos de aprendizagem de máquina utilizando SAS, python, scala ou R;Conhecimento SAS guide, data stage e power bi;Metodologia ágil de desenvolvimento de SW (scrum e/ou kanban).Requisitos e qualificaçõesExperiência mínima de 5 anos com dados;Conhecimento das ferramentas da AWS ou Azure;Diferencial: Experiência em Proteína animal / Varejo;Experiência em segmento varejo ou proteína animal; Conhecimento em bancos de dados relacionais;Experiência com queries SQL Avançadas;Elaboração de produtos de visualização interativa de dados (Spotfire ou PowerBI ou Cognos);Conhecimento de ferramentas para análise, armazenamento e recuperação de dados em ecossistemas big data;Experiência com extração, transformação, limpeza e carga de dados (ETLl) através de ferramentas especializadas, incluindo ferramentas para big data;Experiência prévia como engenheiro de dados;Experiências anteriores como desenvolvedor/engenheiro de software.Informações adicionaisLocal de Trabalho: Guarulhos / SPHorário: Das 08h00 às 18h00 de segunda a sexta-feira (Presencial). Na Aurora Coop você receberá os benefícios de:Plano de SaúdePlano OdontológicoSeguro de VidaParticipação por Resultados - PPRPremiação por Tempo de ServiçoPrevidência PrivadaVale TransporteConvêniosAuxílio EducaçãoAlimentação na Empresa",Aurora Coop,vacancy_type_effective,2024-02-04T00:00:00.000Z,False,Guarulhos,São Paulo,Brasil,https://auroracoop.gupy.io/job/eyJqb2JJZCI6NjY3Mzg2Nywic291cmNlIjoiZ3VweV9wb3J0YWwifQ==?jobBoardSource=gupy_portal,True,on-site,True
6671488,2024-01-25T20:04:12.812Z, Pessoa Engenheira de Dados Sênior ,"Estamos procurando por uma pessoa (Engenheira de Dados Sênior )  que seja apaixonada por tecnologia e, claro, tenha vontade de fazer parte de algo grandioso. Na MaxMilhas, já negociamos mais de 70 bilhões de milhas e tornamos possíveis mais de 7 milhões de viagens. Temos um modelo de negócio pioneiro, que revolucionou o mercado de viagens, e queremos voar ainda mais alto. Nosso time conta com pessoas motivadas para entregar um produto de alta qualidade, trabalhando em um ambiente colaborativo e leve Responsabilidades e atribuiçõesComo Pessoa Engenheira de Dados Sênior você terá o desafio de criar pipelines de dados eficientes e sustentáveis, se preocupando sempre com o retorno do investimento aplicado na construção de soluções de dados. Trabalhar junto com a área de negócio e analistas de dados para criar as camadas de dados ideais para dar a resposta correta às áreas.No dia a dia, você será responsável por: Construir soluções para obter, processar e armazenar dados de várias fontes; Abordagem analítica e de resolução de problemas, entendimento de regras de negócio, e Identificar oportunidades de melhoria em processos existentes. Acompanhamento de implantações em produção dos serviços de dados. Coletar, organizar e disponibilizar dados estruturados de/para/entre aplicações e para áreas de negócio.Requisitos e qualificaçõesRequisitos técnicos obrigatórios:Experiência em Python.Conhecimento avançado em SQL. Conhecimento em arquitetura de dados ETL, DW. Experiência em ecossistemas de Big Data Spark.Experiência em Docker.Experiência Cloud AWS como DMS, Glue, S3, Athena.Experiência em CI / CD. Experiência em IaC (Terraform). Conhecimento em arquitetura de dados ETL, ELT e DW.Conhecimento em Linux.Informações adicionaisBenefícios:Vale refeição ou alimentação no cartão CAJU, valor de R$ 672,00 por mês, inclusive nas férias, sendo descontado apenas R$ 3,00/mêsPlano de Saúde e Odontológico Sulamérica sem Coparticipação.  .De malas Prontas ( 500 reais para utilizar com passagens em suas férias para você curtir ao máximo) Auxílio educação ( 20% do seu salário para utilizar em uma  plataforma parceira que temos de capacitação profissional. ) Somos uma empresa cidadã: Oferecemos licença paternidade (20 dias consecutivos) e maternidade (6 meses) estendidas. Gympass. Convênio com o SESC.Day Off no dia do aniversário.Consultoria de bem-estar financeiro com a nossa parceira Leve.Auxílio Creche no valor de até R$350,00 por mês por filho até 5 anos de idade.Procuramos por uma pessoa dinâmica, capaz de tratar com autonomia as tomadas de decisões e que, principalmente, esteja de braços abertos para compartilhar o que sabe e aprender com todo mundo. Se essa pessoa é você, então candidate-se à vaga ;)",MaxMilhas,vacancy_type_effective,2024-02-29T00:00:00.000Z,True,,,Brasil,https://maxmilhas.gupy.io/job/eyJqb2JJZCI6NjY3MTQ4OCwic291cmNlIjoiZ3VweV9wb3J0YWwifQ==?jobBoardSource=gupy_portal,True,remote,True
6672042,2024-01-25T19:56:15.554Z,Analista de Dados com Power BI,"Sobre o ambiente de trabalho, é importante você saber que:Somos guiados por atitudes claras e transparentes em nossa rotina, que nos permitem fazer o máximo para nossos clientes. Trabalhamos de modo colaborativo, o que significa que confiamos nas pessoas que estão do nosso lado.﻿Aqui ninguém é empregado de ninguém. O ambiente é o mais horizontal possível, possibilitando a sua autonomia para tomar as melhores decisões para as atividades pelas quais você é responsável. Não espere pelos outros aquilo que você pode fazer por si mesmo.Responsabilidades e atribuiçõesRESPONSABILIDADES E ATRIBUIÇÕESAlguns dos desafios que você vai encarar:Criar relatórios no Power BI para fornecer insights para os clientes.Coletar, limpar e transformar dados brutos em formatos adequados para análise.Desenvolver modelos de dados eficientes no Power BI e utilizar linguagem M para realizar transformações complexas.Trabalhar com APIs e outras fontes de dados externas para integrar dados adicionais aos relatórios.Colaborar com os clientes para entender suas necessidades e requisitos de relatórios.Apresentar os resultados da análise de forma clara e compreensível, adaptando a comunicação para diferentes públicos.Identificar oportunidades de melhoria e otimização dos relatórios existentes.Requisitos e qualificaçõesREQUISITOS E QUALIFICAÇÕESPré-requisitos para candidatura:Experiência comprovada na criação de relatórios no Power BI, incluindo habilidades avançadas de visualização de dados.Conhecimento de linguagem M.Familiaridade com a utilização de APIs para integração de dados.Sólida compreensão de conceitos de modelagem de dados e experiência em desenvolver modelos eficientes.Capacidade de compreender e traduzir as necessidades dos clientes em requisitos de relatórios eficazes.Informações adicionaisCOMPETÊNCIASDesejável, mas não eliminatório:Habilidades analíticas e atenção aos detalhes para garantir a precisão e a qualidade dos dados.Habilidades de comunicação verbal e escrita, com capacidade de interagir e apresentar informações de forma clara e compreensível para clientes.Visão de negócios (estratégia);Capacidade de trabalhar de forma autônoma e gerenciar projetos com múltiplas tarefas simultaneamente.Flexibilidade/Resiliência.",Unidades V4 Company,vacancy_legal_entity,,True,,,Brasil,https://franquiasv4.gupy.io/job/eyJqb2JJZCI6NjY3MjA0Miwic291cmNlIjoiZ3VweV9wb3J0YWwifQ==?jobBoardSource=gupy_portal,False,remote,True
6673339,2024-01-25T19:05:30.823Z,Analista de Dados Pleno | International Business - Inglês Avançado,"Nosso time é formado por pessoas com brilho no olho e vontade de fazer a diferença.Temos objetivo de encantar clientes do Brasil e do mundo, com propósito de Interpretar Tendências e Despertar Desejos.Se você também faz com paixão, tem flexibilidade, transparência, envolvimento, gosta de trabalhar com união e desafio, a Arezzo&amp;Co pode ser o lugar certo para você!Queremos cada vez mais construir um ambiente diverso e inclusivo, por isso, nossa política de contratação não discrimina gênero, raça/cor, religião, orientação sexual, idade, condição de HIV e deficiência intelectual ou física.Venha evoluir com a gente, em cada passo da nossa jornada. RUMO A 2154!Responsabilidades e atribuições• Produzir análises e insights para identificar ofensores de resultados (Receita, Margem Bruta, EBITDA) e suportar a tomada de decisão do E-commerce;• Realizar análise de performance dos canais de aquisição demonstrando através de dashboards ou relatórios;• Produzir análise de funil de venda, identificando possíveis fricções na jornada de compra e contribuindo com insights para recuperação de resultados, aumento da taxa de conversão, incremento de receita;• Projetar resultados através da elaboração de cenários de ativações promocionais antes de sua execução, com simulação de receita, margem bruta, desconto e outros indicadores necessários para a avaliação do nível de agressividade e intensidade promocional de cada ação;• Contribuir com propostas para ativações comerciais, sugerindo produtos (categorias, preços, descontos) para campanhas em banners, e-mails e outros veículos por meio da análise de segmentação, tendência e predição com apoio e interação com área de operações;• Processar indicadores, KPIs e metas da área, interpretando os dados e consolidando as informações em ferramentas de BI, como PowerBI, Tableau e outras adotadas;• Realizar forecast mensais, com projeções de resultado por canal englobando todos os KPIS (tráfego, taxa de conversão, AOV, preço médio, desconto, taxa de devoluções, investimentos de mídia, AdCost, ROAS, entre outros), além de diarização de metas;• Conduzir reuniões de forecast mensais com o time financeiro;• Realizar a construção de budget e avaliação de cenários;• Realizar a construção de estrutura e matriz de custos para P&amp;L;• Prestar suporte na definição de ordenamento de produtos no site (VM) através de indicadores (pageviews, cliques, conversão) por produto (SKU, modelo, categoria).Requisitos e qualificaçõesGraduação completa em Matemática, Estatística, Engenharia, Tecnologia da Informação e áreas afins;Conhecimento prévio de ferramentas de análise de dados (PowerBI, Tableau, Clickview, etc);Conhecimento prévio do mercado fashion ou de e-commerce será considerado um diferencial;Inglês avançado – necessário conseguir compreender e se comunicar.Informações adicionaisVaga em modelo de trabalho presencial na cidade de Campo Bom/RS. Benefícios: 🍛 Vale Alimentação/Refeição - Para que possa ter mais autonomia, você pode optar entre o Vale Alimentação para utilizar em mercados e fazer sua própria comida, ou pelo Vale Refeição, para utilizar em restaurantes e pedir seu lanche; 🚌 Vale Transporte - Oferecemos o vale transporte para o transporte público, conforme sua necessidade de itinerário; ⛽ Ajuda de Custo - Para os colaboradores que não residem em Campo Bom, Novo Hamburgo e Sapiranga; 🩺 Plano de Saúde - Para cuidar da sua saúde e dos seus dependentes, oferecemos Plano de Saúde, com abrangência regional (Vale dos Sinos) e nacional; 🦷 Plano Odontológico - Para cuidar da sua saúde bocal e dos seus dependentes, oferecemos Plano Odontológico, com abrangência regional (Vale dos Sinos) e nacional; 🔐 Seguro de Vida - Cobertura com capital de 12 salários múltiplos; 💪 Gympass - Quer manter a saúde física ativa? Oferecemos o Gympass, também extensivo aos seus dependentes; 🏃‍♂ SESI - Parceria com diversos benefícios e descontos para os colaboradores da indústria; 💆 Quick Massagem - Ajuda a reduzir o estresse, melhora a concentração, alivia dores musculares e contribui para um ambiente de trabalho mais saudável e feliz; 🤸‍♀ Ginastica Laboral - Prática que visa promover a saúde e o bem-estar dos colaboradores dentro do ambiente de trabalho; 🧠 Psicologia Viva - Em relação a sua saúde psicológica, oferecemos o Psicologia Viva, uma plataforma de atendimento psicológico online; 📚 Incentivo Educacional - Parceria com instituições de ensino superior e escolas de idiomas; 👨‍👧‍👦 Licença Paternidade - Na jornada da paternidade estendida para 20 dias, cada dia é uma oportunidade única de fortalecer laços, construir memórias e ser o herói na história do seu pequeno; 👩‍👧‍👦 Licença Maternidade - Oferecemos mais do que uma maternidade estendida de 180 dias, proporcionamos um capítulo extra de conforto, apoio e momentos especiais para que cada mãe escreva a história do seu bebê com tranquilidade e plenitude; 🧸 Auxilio Creche - Para colaboradores com filhos de até 4 anos de idade, caso não haja vagas em creches municipais e que recebam até 3 salários mínimos; 🏷 New Value - Clube de benefícios com ofertas exclusivas; 💳 GoodCard - Cartão pós pago utilizado em estabelecimentos credenciados: farmácia, posto de gasolina, mercado após três meses de experiencia; 💸 Desconto nas Marcas - Desconto exclusivo para colaboradores em todas as marcas da Maior House Of Brands do Brasil!; ⛱ DayOff - No mês do seu aniversário você pode escolher um dia de folga remunerada para aproveitar mais um ano de vida com quem mais ama; 🎁 Presente de Aniversário - Em seu dia especial, receba nosso presente como expressão de gratidão pela sua dedicação no site do ZZ Mall; 💲 PPR - Participação de Lucros conforme atingimento de metas da companhia/área.",Arezzo&CO,vacancy_type_effective,,False,Campo Bom,Rio Grande do Sul,Brasil,https://arezzoeco.gupy.io/job/eyJqb2JJZCI6NjY3MzMzOSwic291cmNlIjoiZ3VweV9wb3J0YWwifQ==?jobBoardSource=gupy_portal,True,on-site,True
6673384,2024-01-25T19:02:44.360Z,ESTAGIARIO (A) DE ANALISE DE DADOS ,"UMA EMPRESA BRASILEIRA, FEITA DE TALENTOS, PAIXÃO, MUITO ENTUSIASMO E DESAFIOS!Oi, somos a VAMOS! Um ecossistema único em alternativas para a renovação e expansão da frota brasileira. Com isso, desenvolvemos nosso negócio diariamente em cima de dois pilares: renovar e inovar, contribuindo sempre para melhorar a performance e aumentar a rentabilidade dos nossos clientes.Nossa jornada é movida pela responsabilidade com cada CLIENTE, pelo comprometimento com a nossa GENTE, pela SIMPLICIDADE do Nosso Jeitão de ser e realizar, pela ATITUDE DE DONO em nosso dia a dia, assegurando a SUSTENTABILIDADE em tudo o que fazemos e tendo o LUCRO como garantia da renovação dos nossos ciclos.Buscamos pessoas que apresentam simplicidade, paixão por servir e que tenham interesse em aprender, desafiar-se e desenvolver-se junto ao crescimento da empresa. Se você tem esse perfil e quer trabalhar em um local em que a nossa Gente faz a diferença, confira nossas vagas ou cadastre seu currículo em nosso banco de talentos.Todos os processos seletivos conduzidos pela VAMOS são afirmativos, inclusivos e não discriminatórios.Responsabilidades e atribuiçõesVai trabalhar em estreita colaboração com o especialista da área e terá orientação direta pelo coordenador da área;Vai aprender a desenvolver os dashboards em Power BI de acordo com os requisitos negociados pelo especialista da área;Vai aprender como funciona a arquitetura dos dashboards do Power BI na nuvem da Microsoft;Vai aprender a acompanhar a sustentação dos dashboards em produção;Vai aprender as funcionalidades de um Data Lake, tais como ingestão de dados, manutenção e automação para carga automática das diversas fontes de dados;Acompanhar as melhores práticas e tendências do mercado de BI.Requisitos e qualificaçõesCursando graduação em áreas relacionadas a Tecnologia da Informação ou afins;Conhecimento básico de Power BI ou outras ferramentas de BI;Conhecimento básico de SQL ou outras linguagens de consulta a dados;Facilidade de aprendizado e boa comunicação.Informações adicionaisGENTE É O NOSSO NEGÓCIO E É POR ISSO QUE VALORIZAMOS NOSSOS COLABORADORES DE DIVERSAS FORMAS! Os benefícios tradicionais que você já conhece, nós também temos. Queremos te mostrar que vamos além. Saiba mais! LIGADO EM VOCÊ: Atendimento especializado para a nossa gente e familiares por meio de uma central 24 horas para apoio psicológico, sobre saúde, social, familiar, financeiro e/ou jurídico e tudo isso com sigilo absoluto. Licença Maternidade e Paternidade estendidas + Kit nascimento para recém-mamães e recém-papais. Sabemos o quanto a educação das crianças e adolescentes é importante. Aqui na VAMOS, damos aquela ajuda na compra do kit escolar para os filhos da nossa gente. Nossa gente tem acesso exclusivo a uma plataforma de descontos em viagens, cultura e entretenimento, serviços, gastronomia, educação e bem-estar. Pela Universidade VAMOS, a nossa gente aprende e potencializa seu desenvolvimento profissional, tornando cada um(a) protagonista de sua carreira. Sonha em ser voluntário(a)? Faça parte do VAMOS Fazer o Bem, onde nossos colaboradores geram impactos positivos por meio de pequenas ações.﻿Reconhecemos e valorizamos a nossa gente veterana que completa anos de casa. Quem possui mais de 15 anos, ainda tem um evento mega especial.Cantinho da Mamãe: O espaço, na Matriz no Itaim Bibi e Sede Administrativa em Mogi das Cruzes, é dedicado as mamães que retornam de licença maternidade e querem seguir com o aleitamento materno. No local, há todos os itens para retirar e armazenar o leite, com privacidade e conforto. Se identificou com essa vaga? Conheça as nossas vagas, inscreva-se e vamos juntos participar dessa Empresa que cresce todos os dias.",Grupo Vamos,vacancy_type_internship,,False,Mogi das Cruzes,São Paulo,Brasil,https://vamos.gupy.io/job/eyJqb2JJZCI6NjY3MzM4NCwic291cmNlIjoiZ3VweV9wb3J0YWwifQ==?jobBoardSource=gupy_portal,True,on-site,True
