job_id,published_date,title,description,career_page_name,type,application_deadline,is_remote_work,city,state,country,job_url,disabilities,workplace_type,submitted
6596246,2024-01-11T12:05:04.718Z,Analista Comercial - Curitiba (PR) ,"A BMC está em constante busca por pessoas que pensam diferente, que buscam fazer diferente, que se sintam confortáveis com a constante inovação. Esse tipo de pessoa não pode ter medo de errar. Temos uma frase de nosso CEO que diz: “o que fazemos hoje é exatamente o que não queremos fazer amanhã”. Nossa gente precisa buscar constantemente seu autodesenvolvimento, portanto, estamos sempre em busca de profissionais interessados em aprender e contribuir para o crescimento da empresa. Nossa gente precisa ser obcecada por ser protagonista e colaborativa com os demais.Procuramos pessoas que levem produtividade a todo lugar!E, por sermos uma empresa comercial, também prezamos pela paixão pelo cliente, seja ele interno ou externo.Responsabilidades e atribuiçõesExecutar Pipeline com time de vendas diariamente no CRM;Conduzir o preenchimento das informações de negócios no CRM, status financeiro, carregamento, entrega técnica, etc;Acompanhar e direcionar e propor soluções de crédito junto aos agentes financeiros e time de vendas;Desenvolver análises de vendas a cada 15 dias (simuladores de margem, preenchimento de análises de vendas, cálculos de comissões e DRE);Executar entradas e emissões de notas fiscais de vendas de máquinas novas e usadas de acordo com a necessidade;Formalizar informações diversas de negócios especiais e opcionais com a fábrica;Organizar, programar e liberar os carregamentos das máquinas vendidas;Controlar as comissões de vendas conforme regra: auditar, elaborar pedido, enviar ao vendedor e dar entrada em notas fiscais mensalmente;Desenvolver e/ou apoiar nas melhorias constantes do processo de administração de venda da regional.Atuará de forma ativa com um time de 10 vendedores entre externos e internos.Requisitos e qualificaçõesBuscamos uma pessoa dinâmica, com boa comunicação, e que goste da rotina corrida de vendas do dia-dia. Que tenha atitude positiva, que goste e saiba trabalhar em equipe, organizada para cuidar de seu tempo e dos processos formais da regional, além de ser adaptável em mudanças constantes.Excel Avançado, Experiência na área Comercial, Boa comunicação; Agilidade e com bastante Energia; atenção aos detalhes; saibam priorizar demandas concorrentes; se sintam desafiadas em um ambiente que muda constantemente; tenham habilidade de influenciar e focar em resultados em um ambiente dinâmico.Informações adicionaisVale Transporte;Horário Flexível;Assistência médica (Bradesco);    Assistência Odontológica (Bradesco); Vale Alimentação;Vale Refeição;Seguro de Vida; Participação nos Lucros e Resultados (Semestral);BMC Pass (Academias, Natação e demais atividades físicas)Day Off AniversárioVale aniversário",BMC Hyundai,vacancy_type_effective,2024-03-31T00:00:00.000Z,False,Curitiba,Paraná,Brasil,https://bmchyundai.gupy.io/job/eyJqb2JJZCI6NjU5NjI0Niwic291cmNlIjoiZ3VweV9wb3J0YWwifQ==?jobBoardSource=gupy_portal,False,on-site,True
6596247,2024-01-11T12:04:47.119Z,Analista de RH - Generalista,"Diagnosticar e propor soluções para os clientes internos de RH, através da prática das políticas e dos programas de Recursos Humanos, no que tange a Recrutamento e Seleção, Treinamento e Desenvolvimento, Administração de Pessoal, Programa de Benefícios, Responsabilidade Social e Segurança do Trabalho.Responsabilidades e atribuições Retroalimentar a área de RH com as demandas e apontamentos das áreas clientes; Acompanhar o negócio da área cliente conhecendo-o em maior profundidade e propriedade; Ser suporte ao cliente interno no que tange ao tema Gestão de Pessoas;Acompanhar e controlar os planos de ação da Pesquisa Interna; Acompanhar e auxiliar os planos de desenvolvimento individual dos supervisores; Coordenar as implantações de novos clientes de acordo com as demandas; Atuar como suporte do RH quando adequado e necessário; Atuar como preposto da empresa quando necessário; Requisitos e qualificaçõesSuperior Completo em áreas afim.Conhecimento em atividades relacionadas à áreaConhecimento em ExcelDiferencial conhecimento em Power BiInformações adicionaisRefeição no local de trabalhoVale AlimentaçãoVale TransportePlano de SaúdePlano OdontológicoConvênio FarmáciaSeguro de VidaSubsídio óculosKit Material escolarKit Maternidade/PaternidadeClube de descontosAssessoria jurídicaEstacionamentoUniversidade Corporativa com Cursos 100% Online e GratuitosDescontos em Diversas Instituições de EnsinoEsta vaga também se destina a pessoa com deficiência (PCD) ou reabilitadoHorário: 08h00 - 17h30 seg a sex",Grupo Risotolândia,vacancy_type_effective,,False,Araucária,Paraná,Brasil,https://gruporisotolandia.gupy.io/job/eyJqb2JJZCI6NjU5NjI0Nywic291cmNlIjoiZ3VweV9wb3J0YWwifQ==?jobBoardSource=gupy_portal,True,on-site,True
6352558,2024-01-11T12:01:31.600Z,ENGENHEIRO(A) DADOS II,"QUEM SOMOS?Prazer, somos a Suzano!Aqui a gente acredita que inovação e sustentabilidade caminham juntas. Dessa união, nasce uma atitude plena de significado: a inovabilidade. Pautados por ela, pensamos fora da caixa e enxergamos longe para lidar com os desafios do século 21. Nós plantamos e cultivamos árvores para transformar essa matéria-prima renovável em Bioprodutos para o dia a dia de mais de 2 bilhões de pessoas. Cultivamos a vida na folha do caderno que alfabetiza as crianças, na fralda que protege os bebês, no copo de café que não prejudica o meio ambiente, em papéis absorventes e na comodidade do uso de uma embalagem sustentável.PLURALIguais e diferentes. Singulares e plurais. Acreditamos que a diversidade nos fortalece, por isso, não fazemos distinção entre candidatos seja por deficiência, gênero, orientação sexual, raça/etnia, idade, origem, constituição familiar ou estética. Aqui você pode descobrir novos desafios, novos horizontes, novos objetivos e até mais sobre si mesmo!Responsabilidades e atribuiçõesDADOS:GS: 15Local: Escritório Central SPInscrições até:O QUE VOCÊ VAI FAZER?Requisitos e qualificaçõesQUEM NOS INSPIRA?Alguém que acredite em nossos valores;Com iniciativa;Perfil analítico;Que proponha ideias e soluções.O QUE A SUZANO ESPERA DE VOCÊ?Informações adicionaisNÓS TEMOS MUITO MAIS QUE UM PAPEL NA SUA VIDA!Cuidados da sua saúde: Plano Médico, Odonto e Seguro de Vida;VR ou Refeitório, VA para ajudar nas compras do mercado e, no final do ano, VA adicional;Sabemos que a renda fixa é importante, mas, além disso, oferecemos uma renda extra por meio do nosso Programa de Remuneração Variável (Anual);Para você se preparar para o futuro temos a Previdência privada;Praticamos o home office em áreas corporativas, a flexibilidade de horários, além do dress code casual;Para gerar e compartilhar valor disponibilizamos cursos e treinamentos E-learning em nossa plataforma digital, o UniverSuzano;Na Suzano, só é bom para nós se for bom para o mundo! Por isso, durante o ano realizamos muitas ações legais e você poderá se tornar um voluntário do nosso programa Voluntariar;Também contamos com um Clube de Descontos, com diversos parceiros, para você aproveitar! PARA A FAMÍLIAComo empresa cidadã, entendemos a importância da chegada de uma criança. Por isso, oferecemos extensão da licença paternidade para 20 dias e maternidade para 180 dias. O benefício também vale para papais e mamães que adotarem ou obtiverem a guarda judicial da criança e para casais homo afetivos;Para as mamães retornarem tranquilas ao trabalho, oferecemos um auxílio creche bem bacana.Pensando em oferecer sempre as melhores condições para nosso time e suas família, disponibilizamos um auxílio mensal em dinheiro que se aplica ao pai ou mãe que tiver sob sua guarda filho ou filha com alguma necessidade especial;Aqui seus filhos e filhos não ficam de fora, oferecemos um vale brinquedo e um kit material escolar recheado! E, se no final do ano os filhos mandarem bem na escola, reconheceremos o seu esforço por meio do nosso programa Estudar é Crescer, com um prêmio em dinheiro que poderão usar como preferir. SUZANO FAZ BEMVocê poderá...Participar do #GrupoDeCorridaSuzano , um projeto pensado para manter a sua saúde em dia;Receber atendimento nutricional;Praticar ginástica laboral;Usar o Gympass na academia de sua preferência, salas com manicure e massagem;Aproveitar o Espaço Faz Bem com mesas de jogos. E, se você jogar um bolão, por aqui sempre realizamos e incentivamos os campeonatos internos!Contar com a assessoria do Disque Viver Bem, para atendimentos via 0800 com psicólogos, assistentes sociais, nutricionistas, pet consultoria, educadores físicos e profissionais da área jurídica.#VemSerSuzano #PlantamosOCuidado #OrgulhoEmPertencer ",Suzano,vacancy_type_effective,2024-01-21T00:00:00.000Z,False,,,Brasil,https://suzano.gupy.io/job/eyJqb2JJZCI6NjM1MjU1OCwic291cmNlIjoiZ3VweV9wb3J0YWwifQ==?jobBoardSource=gupy_portal,True,on-site,True
6595841,2024-01-11T11:01:12.646Z,MONTADOR ACABAMENTO BANCO DE DADOS - SÃO MATEUS/ES,"Você gosta de trabalhar na área produtiva?Gostaria de trabalhar em uma grande empresa?Venha com a gente construir a Marcopolo do Futuro!Cadastre-se para vaga de Montador(a) Mecânico #vemcomagenteMarcopolo #marcopolodofuturo #aquitemtrabalhoemequipeResponsabilidades e atribuiçõesEfetua a montagem e desmontagem de peças, conjuntos e componentes dos sistemasmecânicos, hidráulicos e pneumáticos como: tanque de combustível, filtros de ar e óleo, limpador de para-brisa, entre outros.Monta e desmonta a tubulação do escapamento de ar do motor, unindo pontos com solda e fazendo medições, corte e ajustes.Monta e desmonta sistemas pneumáticos, sistemas hidráulicos, tanques de sanitárias eválvulas das portasRequisitos e qualificaçõesEnsino Médio Completo;Cursos (Obrigatórios): Pneumática e Eletropneumática Veicular Ferramentas Manuais e Pneumáticas;Curso Desejável: Leitura e Interpretação de Desenho e Metrologia.Informações adicionaisAcreditamos e investimos no potencial daqueles que embarcam com a gente nessa jornada. Por isso nossos benefícios são pensados para integrar e convergir o desenvolvimento, reconhecimento e promoção da saúde, bem-estar e qualidade de vida de nossos colaboradores: SAÚDE:Plano de saúde para colaboradores e dependentesProgramas de saúde: Controle e acompanhamento de doenças crônicas, Bebê Chegando, Campanha de Vacinação contra a Gripe RECONHECIMENTO:Programa de Participação nos Lucros e Resultados (SOMAR)Plano de Carreira DESENVOLVIMENTO:Programa de Recrutamento InternoUniversidade MarcopoloEm caso de dúvidas, entrar em contato com o suporte no link https://support-candidates.gupy.io/hc/pt-br/requests/new",Marcopolo S.A,vacancy_type_effective,2024-01-31T00:00:00.000Z,False,São Mateus,Espírito Santo,Brasil,https://carreiramarcopolo.gupy.io/job/eyJqb2JJZCI6NjU5NTg0MSwic291cmNlIjoiZ3VweV9wb3J0YWwifQ==?jobBoardSource=gupy_portal,True,on-site,True
6558857,2024-01-10T21:01:58.582Z,Especialista em Ciência de Dados I (Diretoria de Dados),"Nosso espírito inquieto nos faz estar sempre de olho nas tendências futuras. A tecnologia é fundamental para revolucionar toda a nossa jornada, da pesquisa e desenvolvimento de produtos até a venda final para nossos consumidores - e é através dela que estamos construindo o maior ecossistema de beleza do mundo.Cada novo processo, cada novo lançamento e cada nova solução exigem eficiência, habilidade e inovação. Só assim é possível manter a velocidade e o dinamismo do nosso crescimento e entregar beleza em cada canto do Brasil e em mais de 15 países. E é isso que o time do gb.tech está fazendo no Grupo Boticário.Responsabilidades e atribuiçõesEntender o modelo de negócios de franqueados e conhecer o ecossistema, seus dados e conceitos sendo a referência sobre franquias.Construir modelos explicativos e preditivos que ajudem áreas a entenderem: performance de franqueado, mercado endereçável para cada franqueado, oportunidades de atuação dos nossos franqueados. Construir e controlar roadmap de construção e manutenção de produtos de dados, organizando agendas, alinhando conceitos e ajudando áreas parceiras a tomarem melhores decisões com base em dados.Requisitos e qualificaçõesBigQuery / SQL - avançado. Python - avançado. GitHub - Intermediário.Prompt engineering - básico. Inferência Causal - interessante mas não obrigatório. Experiência com:Machine Learning. Modelos de Categorização e métricas de performance. Modelos de Segmentação e métricas de performance.Modelos de Clusterização e métricas de performance. Modelos de regressão e séries temporais e métricas de performance. Informações adicionaisO Grupo Boticário promove a diversidade e queremos conosco pessoas que mudem o jogo e façam bonito, independente do gênero, raça, orientação sexual, religião, nacionalidade, idade ou deficiência.Nos preocupamos com o bem-estar das nossas pessoas, por isso oferecemos um pacote de benefícios que permitem uma vida mais saudável e completa.Nossa jornada de trabalho tem carga horária flexível e sustentável. Vai trabalhar em modelo híbrido ou remoto? Oferecemos o auxílio home-office.Todo mundo merece um momento para cuidar da alimentação, certo? Aqui você poderá contar com o vale refeição e/ou vale alimentação (conforme elegibilidade), mas se você for trabalhar em uma das nossas fábricas ou centros de distribuição temos restaurante;Tá, mas e a sua saúde? Para nós a sua saúde é prioridade, aqui oferecemos plano de saúde e programas com foco em saúde e bem estar:Central de Saúde 24hA Família CresceuAtendimento Social2ª Opinião MédicaTelemedicina - dentro do plano de saúdePsicologia on-lineOrientação JurídicaOrientação FinanceiraOrientação PsicológicaEntre nós - apoio a vítimas de violênciaRodas de Conversa com foco físico e emocionalCuidado com o colaborador durante o afastamentoCampanhas de prevenção em saúdeVacinação gratuita contra gripe para colaboradores e dependentesExames periódicosAvaliação ergonômicaTambém nos preocupamos com a sua segurança financeira e de sua família, garantindo cobertura de previdência privada, empréstimos com taxas diferenciadas e seguro de vida.Sabe a vida fitness? Deixa com o Gympass;E as crianças? Disponibilizamos o Auxílio para o Material Escolar;Falando em crianças, aqui no Grupo Boticário, acreditamos que todos possuem o direito a uma licença parental igualitária. Por isso oferecemos 120 dias de Licença Parental para papais e mamães;Todo mundo faz aniversário e, já que você está de parabéns, oferecemos o Day Off de Aniversário.Desconto de até 40% em nossos produtos! Agora sim viu vantagem, né? Além de convênios e parcerias diversas através da Associação de Colaboradores.Tá afim de fazer o bem? Aqui no GB proporcionamos oportunidades de participar em várias ações de voluntariado.Se identifica com o nosso jeito? Então vem fazer beleza com a gente!",Grupo Boticário,vacancy_type_effective,2024-01-27T00:00:00.000Z,True,,,Brasil,https://grupoboticario.gupy.io/job/eyJqb2JJZCI6NjU1ODg1Nywic291cmNlIjoiZ3VweV9wb3J0YWwifQ==?jobBoardSource=gupy_portal,True,remote,True
6564100,2024-01-10T20:55:48.000Z,Pessoa Coordenadora de Analytics Engineering (Diretoria de Dados) - Vaga Afirmativa para Talentos Diversos,"Nosso espírito inquieto nos faz estar sempre de olho nas tendências futuras. A tecnologia é fundamental para revolucionar toda a nossa jornada, da pesquisa e desenvolvimento de produtos até a venda final para nossos consumidores - e é através dela que estamos construindo o maior ecossistema de beleza do mundo.Cada novo processo, cada novo lançamento e cada nova solução exigem eficiência, habilidade e inovação. Só assim é possível manter a velocidade e o dinamismo do nosso crescimento e entregar beleza em cada canto do Brasil e em mais de 15 países. E é isso que o time do gb.tech está fazendo no Grupo Boticário.Por que essa vaga é afirmativa para pessoas com deficiência, pessoas negras (pretas e pardas) e mulheres.Temos o compromisso em construir um ambiente cada vez mais diversos e inclusivo. Valorizamos a Diversidade e estamos comprometidos com a promoção da inclusão e equidade em nossos times.Queremos ter mais pessoas diversas ocupando posições dentro dos nossos times e por isso usamos vagas reservadas para pessoas talentos diversos para alavancar a nossa representatividade. Essa ação faz parte de uma estratégia maior ligada aos nossos compromissos e fortalecimento de nossa cultura equânime.Conheça mais sobre nossos compromissos de ESG em: https:https://www.grupoboticario.com.br/esg/Responsabilidades e atribuiçõesLiderar tecnicamente um time composto por Analista de Domínio de Dados, Data Engineers e Analytics Engineers; Estruturar o roadmap da squad, negociando e definindo o backlog junto aos líderes das Value Streams atendidas por sua squad;Garantir a qualidade e cronograma das entregas, dentro do custo previsto;Garantir que a equipe atue de forma alinhada aos objetivos estratégicos da empresa;Liderar dinâmicas e cerimônias de práticas ágeis, bem como o realizar o acompanhamento diário das tarefas do time;Atuar na contratação, engajamento e retenção de talentos da equipe;Aplicar feedbacks, conduzir reuniões de 1:1 quinzenais e auxiliar seus liderados na elaboração e acompanhamento do PDI;Participar ativamente de discussões e definições técnicas com engenheiros de dados, arquitetos de dados, analistas de dados, desenvolvedores, líderes técnicos e áreas de negócios;Participar ativamente nas agendas de KRs, negociando alocações, priorizações e se comprometendo com o atingimento dos resultados;Solucionar conflitos e situações de pressão de áreas, equipes pares e liderados;Ser um influenciador de uma cultura orientada a dados.Requisitos e qualificaçõesExperiência anterior liderando equipes de dados;Experiência como frameworks e metodologias ágeis;Experiência em gestão de projetos e produtos de dados;Comunicação fluída e assertiva, seja públicos técnicos, como não técnicos.Desejável:Experiência prática modelagem de dados;Experiência prática na implementação de Data Marts, Data Warehouses e Data Lakes;Experiência prática com ferramentas de BI (Ex. Qlik, Power BI, Looker, Tableau etc);Experiência em ambientes de dados On Premises e em nuvens públicas (AWS, GCP ou Azure).Informações adicionaisO Grupo Boticário promove a diversidade e queremos conosco pessoas que mudem o jogo e façam bonito, independente do gênero, raça, orientação sexual, religião, nacionalidade, idade ou deficiência.Nos preocupamos com o bem-estar das nossas pessoas, por isso oferecemos um pacote de benefícios que permitem uma vida mais saudável e completa.Nossa jornada de trabalho tem carga horária flexível e sustentável. Vai trabalhar em modelo híbrido ou remoto? Oferecemos o auxílio home-office.Todo mundo merece um momento para cuidar da alimentação, certo? Aqui você poderá contar com o vale refeição e/ou vale alimentação (conforme elegibilidade), mas se você for trabalhar em uma das nossas fábricas ou centros de distribuição temos restaurante;Tá, mas e a sua saúde? Para nós a sua saúde é prioridade, aqui oferecemos plano de saúde e programas com foco em saúde e bem estar:Central de Saúde 24hA Família CresceuAtendimento Social2ª Opinião MédicaTelemedicina - dentro do plano de saúdePsicologia on-lineOrientação JurídicaOrientação FinanceiraOrientação PsicológicaEntre nós - apoio a vítimas de violênciaRodas de Conversa com foco físico e emocionalCuidado com o colaborador durante o afastamentoCampanhas de prevenção em saúdeVacinação gratuita contra gripe para colaboradores e dependentesExames periódicosAvaliação ergonômicaTambém nos preocupamos com a sua segurança financeira e de sua família, garantindo cobertura de previdência privada, empréstimos com taxas diferenciadas e seguro de vida.Sabe a vida fitness? Deixa com o Gympass;E as crianças? Disponibilizamos o Auxílio para o Material Escolar;Falando em crianças, aqui no Grupo Boticário, acreditamos que todos possuem o direito a uma licença parental igualitária. Por isso oferecemos 120 dias de Licença Parental para papais e mamães;Todo mundo faz aniversário e, já que você está de parabéns, oferecemos o Day Off de Aniversário.Desconto de até 40% em nossos produtos! Agora sim viu vantagem, né? Além de convênios e parcerias diversas através da Associação de Colaboradores.Tá afim de fazer o bem? Aqui no GB proporcionamos oportunidades de participar em várias ações de voluntariado.Se identifica com o nosso jeito? Então vem fazer beleza com a gente!",Grupo Boticário,vacancy_type_effective,2024-01-27T00:00:00.000Z,True,,,Brasil,https://grupoboticario.gupy.io/job/eyJqb2JJZCI6NjU2NDEwMCwic291cmNlIjoiZ3VweV9wb3J0YWwifQ==?jobBoardSource=gupy_portal,True,remote,True
6594377,2024-01-10T20:48:27.580Z,Analista de Dados - Ibirapuera (SP),"Você é apaixonado por dados, análises e busca incessante por insights? Estamos à procura de um Analista de Dados talentoso e motivado para se juntar à nossa equipe e contribuir para a excelência em nossas operações.Candidate-se hoje!Responsabilidades e atribuiçõesCriar painéis para controle de indicadores do setor;Realizar pesquisas de oportunidades de negócio;Construir conteúdos da trilha de conhecimento do Analytics;Controlar o comitê de iniciativas de pesquisas;Conduzir interação dos analytics das áreas de negócio.Requisitos e qualificaçõesEnsino Superior Completo;Experiência como Analytics ou Cientista de Dados, gestão de dados;Conhecimento de Gestão por Processos;Conhecimento do Tableau ou Power BI.Informações adicionaisO que a Autoglass proporciona?  Pra cuidar da sua saúde física e mental: 🩺 Plano de saúde Unimed e Plano odontológico Bradesco, extensivos a seus dependentes; 💙 Atendimento psicológico e nutricional; 💙 Seguro de vida; 💙 Programa da Gestante com licença maternidade estendida; 💙 Espaço Cuidar - Salão de beleza; 🏋️‍♀️ Gympass (Desconto em academias); 💆  Para tornar o seu dia mais leve, na Autoglass você recebe massagem relaxante em seu posto de trabalho.   Pra apoiar seu dia a dia: 🚌 Vale transporte; 🛒 Vale Refeição e Alimentação (Cartão FLASH); 📚 Descontos em creches e escolas para os papais e mamães; 📚 Descontos em Instituições de Ensino; ☕ Café da manhã e da tarde;😎 Oportunidade de trabalhar e trocar conhecimentos diários com um time incrível e acolhedor; 🏠 Oportunidades Home Office; 💺 Trabalho de modo confortável! Caso necessário, enviaremos toda mobília para equipar o seu ambiente Home Office; 👥 Programa Indica Tech - bônus por indicar novos talentos para fazerem parte do time. ⏰ Programa Logoff - Que tal sair 2h mais cedo na sexta, ou chegar 2h mais tarde na segunda? Um esticada no final de semana; Pra desenvolver sua carreira: 🚀 Trilha de Desenvolvimento estruturada; 🚀 Acesso ao Portal de Educação Corporativa Autoglass com mais de 200 cursos gratuitos e com emissão de certificado;🚀 Treinamentos e programas de mentorias frequentes; 🚀 Acesso GRATUITO e EXCLUSIVO à plataforma Alura ou Udemy; 🚀 Programa de Incentivo à Certificação; 🚀 Um ambiente de trabalho altamente colaborativo e desafiador.Na Autoglass, você encontrará oportunidade de crescimento e uma cultura de inovação e melhoria contínua muito forte. ",Autoglass Tech,vacancy_type_effective,,False,São Paulo,São Paulo,Brasil,https://autoglasstech.gupy.io/job/eyJqb2JJZCI6NjU5NDM3Nywic291cmNlIjoiZ3VweV9wb3J0YWwifQ==?jobBoardSource=gupy_portal,True,hybrid,True
