job_id,published_date,title,description,career_page_name,type,application_deadline,is_remote_work,city,state,country,job_url,disabilities,workplace_type,submitted
6935928,2024-03-27T12:05:15.377Z,AMBIPAR RESPONSE ES - Analista Ambiental - Socioambiental,"Essa oportunidade é para fazer parte da nosso corpo técnico localizado na sede em Vitória/ES Esse profissional irá apoiar nas atividades levantamento de informações técnicas, avaliações e elaboração de produtos técnicos, bem como ser referência para os projetos voltados para área socioambiental.RP-1452Responsabilidades e atribuiçõesExecutar amostragens, caracterizar e medir parâmetros ambientais;Planilhar dados de estudos técnicos e interpretar dados de campo e laudos;Desenvolver atividades de educação ambiental;Execução técnica de projetos de Socio economia;Execução de Programas de Educação Ambiental e Comunicação Social;Elaboração de estudos e diagnósticos socioambientais;Atender as demandas de projetos conforme as necessidades dos clientes;Dentre outrasRequisitos e qualificaçõesFormação superior em: Engenharia Ambiental, Biologia, Oceanografia, Saneamento e/ou Meio Ambiente, ou correlatosVivência com elaboração de diagnósticos e estudos para educação ambiental, comunicação social e execução de projetos na área socio econômica ambientalExperiência em consultoria ambiental será um diferencial;Desejável CNH B vigenteRegistro Profissional ativo, se aplicávelInformações adicionaisNossa sede encontra-se em uma localização privilegiada na capital Vitória/ES e nas instalações temos: vestiário, refeitório, copa e um cafézinho para manter a energia durante o dia!Você contará ainda com estes benefícios:Vale Alimentação ou Refeição (cartão Caju);Vale Transporte (opcional);Assistência Médica;Assistência Odontológica;Seguro de Vida.﻿Esta oportunidade também é disponível para candidatos PcD. Mantenha seu cadastro sempre atualizado e deixe seu e-mail e telefone com acesso do WhatsApp. É através destes canais que possivelmente faremos contato.",Ambipar Response ES S/A,vacancy_type_effective,,False,Vitória,Espírito Santo,Brasil,https://ambipar.gupy.io/job/eyJqb2JJZCI6NjkzNTkyOCwic291cmNlIjoiZ3VweV9wb3J0YWwifQ==?jobBoardSource=gupy_portal,True,on-site,True
6942913,2024-03-27T12:27:59.075Z,Cientista de Dados Pl / Sr - Segmento Financeiro,"O que vamos construir juntos?Nosso time é preocupado em propor as melhores soluções baseado em excelência técnica, pensando em alternativas que agreguem valor, com mindset ágil e cultura de colaboração. Nós respeitamos a diversidade e acreditamos que times diversos contribuem para construir ideias mais inovadoras.Responsabilidades e atribuiçõesNos ajude a desenhar a solução!Se você gosta de trabalhar com desafios, curte implementar soluções baseadas em boas práticas e topa trabalhar em times que respeitam quem você é e as suas opiniões, você está MUITO perto de integrar nosso time DB.Requisitos e qualificaçõesREQUISITOS E QUALIFICAÇÕESConhecimento em analise de negócios;Conhecimento em metodologias ágeis;Noção de gestão de projetos de engenharia e ciência de dados;Conhecer metodologias CRISP-DM e TDSP;Conhecimentos em processamento em nuvem, ferramentas Azure e arquiteturas modernas de dados;Conhecimentos em SQL, Python e Databricks para Data Science;Conhecimento sobre algoritmos de aprendizado de máquina de classificação, regressão e clusterização;Experiência com frameworks e bibliotecas específicas de ciências de dados como: Pytorch, Tensorflow, Scikit-Learn, Pycaret, etc;Desejável capacidade de conduzir, ou intermediar, conversas sobre inteligência artificial com diferentes áreas de negócio, estruturar e realizar projetos experimentais e de prova de conceito, além de mentorar pessoas em desenvolvimento;Desejável conhecimento em plataformas/ferramentas de AutoML e técnicas de MLOps;Desejável conhecimento em ferramentas de visualização de dados e construção de produtos para monitoramento de modelos; Informações adicionaisPor aqui você terá:Remuneração compatível com o mercado;Vale Refeição;Plano de Saúde e Odontológico;Subsídio para o home-office;Seguro de Vida;Horário flexível;Home office;TotalPass: cuidado com a sua Saúde física e mental.﻿",DB,vacancy_type_effective,2024-04-30T00:00:00.000Z,True,,,Brasil,https://db.gupy.io/job/eyJqb2JJZCI6Njk0MjkxMywic291cmNlIjoiZ3VweV9wb3J0YWwifQ==?jobBoardSource=gupy_portal,True,remote,True
6916617,2024-03-27T12:13:24.226Z,Engenheiro(a) de Dados PL,"A EQI segue na sua trajetória de crescimento, quebrando barreiras entre as pessoas e o mercado. Venha fazer parte do maior fenômeno dos últimos tempos no mundo das finanças.Tudo nos trouxe até aqui e convidamos você a irmos ainda mais longe.A área de Data Analytics é responsável por gerenciar e desenvolver todas as aplicações que envolvem o consumo, tratamento e distribuição de dados de fontes diversas.Entregamos dados para todos os departamentos da EQI, ou seja, temos que atuar com diferentes negócios para atender entre financeiro, jurídico, vendas, marketing, etc.Buscamos um(a) profissional para atuar como Engenheiro(a) de Dados PLENO no modelo híbrido. (Florianópolis ou Itajaí)Então se você tem conhecimento em desenvolvimento de Pipelines, ETL, Python, Azure (ADF) e gosta do universo de dados, se inscreva!Você poderá fazer parte de uma equipe multidisciplinar responsável por todo o ciclo de vida de desenvolvimento de projeto, desde a concepção até a implantação. Atuamos em formato de Squad focados na implementação de soluções escaláveis que atendam as necessidades do nosso negócio.Responsabilidades e atribuiçõesExperiência com implantação de arquitetura de dados e modelagem de camadas de dados;Ingestão de dados;Conhecimento em Cloud (preferencialmente Azure);Experiência em Python;Experiência em SQL, com domínio de queries complexas, índices e particionamento;Experiência e domínio da modelagem de objetos complexos em grandes negócios, com alta volumetria de dados e diversidade de dados;Construção de Pipelines de ingestão e manipulação de dados (ETL/ELT), com foco em Azure Data Factory;Conhecimento em banco de dados (SQL Server);#LI-BP1Requisitos e qualificaçõesPerfil analítico com ótimo raciocínio lógico;Experiência como desenvolvedor Python;Experiência com bancos de dados relacionais e não relacionais;Experiência com mapeamento de dados;Experiência com construção de pipelines e ETL;Vontade de aprender, com aprendizado rápido;Excelentes habilidades de comunicação e trabalho em equipe;Será um diferencial experiência em Azure Data Factory.Informações adicionaisO processo seletivo está dividido em quatro etapas:- Etapa 1: Triagem (avaliação do cadastro e teste de perfil);- Etapa 2: Entrevista por competências com a área de Talent Acquisition da EQI;- Etapa 3: Entrevista com gestor(a) a área;- Etapa 4: Desafio técnico de algoritmo; Obs: Cada etapa do processo seletivo possui caráter eliminatório.Se você se identificou com a nossa empresa e tem os pré-requisitos da vaga, se candidate! Será um prazer receber sua candidatura, e, quem sabe, ter você dentro do time da EQI Investimentos. 🚀🧡Boa sorte! 🍀✨",EQI Investimentos,vacancy_type_effective,,False,Florianópolis,Santa Catarina,Brasil,https://eqiinvestimentos.gupy.io/job/eyJqb2JJZCI6NjkxNjYxNywic291cmNlIjoiZ3VweV9wb3J0YWwifQ==?jobBoardSource=gupy_portal,False,hybrid,True
6918403,2024-03-26T23:32:20.357Z,Auxiliar de PCP - Conferente de Dados 1T - NV,"Monitorar os rendimentos da producao visando prestar informacoes a supervisao quanto os produtos.Responsabilidades e atribuiçõesMonitorar os rendimentos da produção visando prestar informações a supervisão quanto os produtos.Cumprir e fazer cumprir a legislação vigente normas e regulamentos da empresa.  Buscar e propor novas ações atuando sempre com uma visão critica sobre os processos a fim de otimizar a execução das atividades/processos de sua área.  Realizar atribuições correlacionadas a critério de seu superior imediato. Realizar coleta de dados nos produtos visando monitorar rendimentos de produção.Requisitos e qualificaçõesEnsino médio completo.Conhecimento básico em informática. Informações adicionaisOferecemos uma lista completa de benefícios incluindo: Planos de saúde e odontológicos com preços especiais.Vale-alimentação.Gympass com planos promocionais. Seguro de vida coletivo e treinamento.Capacitação continuados. Além disso tudo, incluímos também alguns benefícios com o olhar SSA Fazer parte de uma das 10 melhores empresas do Centro - Oeste Trabalhar e trocar conhecimentos diários com um time referência no mercado;Participar deste time incrível, de uma cultura forte.Trabalhar em uma empresa que preza pelo trabalho em equipe, diversidade e acredita que a diferença é um dos maiores fermentos para nosso crescimento;Criar um produto que brilha os olhos de clientes e usuários. Com muito orgulho, podemos dizer que somos a São Salvador Alimentos, que mais cresce no Brasil. #VemPraSSA 🚀💛💚 ",SSA - São Salvador Alimentos,vacancy_type_effective,2024-04-01T00:00:00.000Z,False,Nova Veneza,Goiás,Brasil,https://ssa.gupy.io/job/eyJqb2JJZCI6NjkxODQwMywic291cmNlIjoiZ3VweV9wb3J0YWwifQ==?jobBoardSource=gupy_portal,False,on-site,True
6942102,2024-03-26T22:36:15.761Z,Consultor de Produtividade e Efetividade I (Foco em Dados e BI),"Somos uma empresa farmacêutica brasileira que há mais de 65 anos trata da vida. Com o propósito de ""transformar conhecimento em saúde pra sua vida"", construímos nossa história com ousadia, inovação e espírito visionário. Nossa razão de existir é promover saúde de alta qualidade para que as pessoas possam aproveitar cada momento. Temos um amplo portfólio de medicamentos de diversas especialidades, como ginecologia, oncologia e cardiologia, para atender os pacientes em sua integralidade e individualidade, com formulações eficientes e inovadoras. São mais de 100 marcas em mais de 200 apresentações. Queremos que aqui você encontre o seu lugar! Somos considerados um excelente lugar pra se trabalhar, segundo o GPTW. Estabelecemos relações de transparência e confiança com nossos mais de 3 mil colaboradores e estimulamos a mobilidade como ferramenta de desenvolvimento profissional. A saúde e bem-estar norteiam nossas decisões. #PorqueSeTratadaVida Responsabilidades e atribuições🎯No dia a dia você irá:Realização de análises exploratórias, estatísticas e comparativas para a obtenção de insights valiosos;Automatizar processos na área visando otimização das atividades;Explorar propor e aprimorar continuamente os modelos de controle e estimativas da área;Estabelecer a interface eficiente com analistas de negócios para o desenvolvimento de ferramentas e soluções;Criar e gerir tabelas, dashboards e painéis para monitoramento dos resultados de diversas iniciativas;Possuir atitude propositiva, apresentando soluções e alternativas diante de desafios ou necessidade de ajustes de direção;Demonstrar proatividade, foco em resultados e disposição para execução prática;Adaptar-se com facilidade a mudanças e capacidade de prosperar em ambientes dinâmicos;Possuir compreensão aprofundada das demandas, permitindo a priorização eficiente das execuções;Busca constante pela excelência operacional;Possuir habilidade em mapear dificuldades para possibilitar a colaboração efetiva do time.Requisitos e qualificações📝 Para participar do nosso processo:Formação Superior completa em Economia, Administração, Tecnologia, Matemática, Atuariais, Marketing ou áreas correlatas;Experiência anterior com práticas consultivas;Conhecimento em PBI avançado;Conhecimento em Excel avançado;Conhecimento sobre Banco de Dados SQL (para construção de consultas a tabelas);Vivência anterior em estruturas comerciais e/ou marketing, fornecendo dados, indicadores e análises que suportem a tomada de decisão.⭐ Você se destacará se tiver:Conhecimento em Databricks;Conhecimento em Veeva CRM;Conhecimento sobre ""Phynton"" ou ""R"".Informações adicionais+ Informações 📍 Local de trabalho (Base): Teletrabalho (disponibilidade para encontros presenciais em São Paulo de maneira planejada);🕑 Horário: Segunda à Sexta – Horário Móvel (Entrada entre 7h – 9h e saída entre 16h – 18h)🔖 Para colaboradores Libbs As inscrições serão até 01/04/2024;Os requisitos diferenciais poderão ser priorizados para a seleção dos candidatos para a próxima etapa;Não é permitida a participação em processos seletivos internos diferentes simultaneamente.📌 Benefícios pra você!Vale Refeição; Vale Alimentação;Medicamentos Libbs - 100%;Convênio Farmácia – Vidalink;PPR - Programa de Participação dos Lucros e Resultados da companhia;Estacionamento, vale transporte ou fretado (aplicável somente para atuação em turnos);Programa USE: subsídio para compra do equipamento que será utilizado para o trabalho, podendo utilizá-lo para fins pessoais;Benefícios flexíveis (TotalPass, seguro de vida, previdência privada, assistência médica, odontológica e auxílio alimentação). ",Libbs Farmacêutica,vacancy_type_effective,2024-04-01T00:00:00.000Z,True,,,Brasil,https://vempralibbs.gupy.io/job/eyJqb2JJZCI6Njk0MjEwMiwic291cmNlIjoiZ3VweV9wb3J0YWwifQ==?jobBoardSource=gupy_portal,True,remote,True
6894243,2024-03-26T21:18:30.249Z,Pessoa Arquiteta de Domínio III (Diretoria de Dados) - Vaga Afirmativa para Talentos Diversos,"Nosso espírito inquieto nos faz estar sempre de olho nas tendências futuras. A tecnologia é fundamental para revolucionar toda a nossa jornada, da pesquisa e desenvolvimento de produtos até a venda final para nossos consumidores - e é através dela que estamos construindo o maior ecossistema de beleza do mundo.Cada novo processo, cada novo lançamento e cada nova solução exigem eficiência, habilidade e inovação. Só assim é possível manter a velocidade e o dinamismo do nosso crescimento e entregar beleza em cada canto do Brasil e em mais de 15 países. E é isso que o time do gb.tech está fazendo no Grupo Boticário.Por que essa vaga é afirmativa para talentos diversos (pessoas pretas ou pardas, mulheres, pessoas com deficiência, pessoas 50+)?Temos o compromisso em construir um ambiente cada vez mais diversos e inclusivo. Valorizamos a Diversidade e estamos comprometidos com a promoção da inclusão e equidade em nossos times.Queremos ter mais pessoas diversas ocupando posições dentro dos nossos times e por isso usamos vagas reservadas para pessoas talentos diversos para alavancar a nossa representatividade. Essa ação faz parte de uma estratégia maior ligada aos nossos compromissos e fortalecimento de nossa cultura equânime.Conheça mais sobre nossos compromissos de ESG em: https:https://www.grupoboticario.com.br/esg/Responsabilidades e atribuiçõesResponsável por arquitetar e desenhar soluções para projetos/produtos de Analytics e Big Data e evoluir plataforma de dados com foco em definições de políticas, regras e governança dos dados de modo a apoiar na evolução e construção de uma plataforma de Dados mais organizada e padronizada.Fará parte do seu trabalho discutir e definir regras e implementações das políticas para uso e construção da nossa plataforma de dados. Além disso, no dia a dia você irá participar da construção dos DoDs, Arquiteturas de Referências, RFCs e apoiar no aculturamento do uso correto da plataforma de Dados.Requisitos e qualificaçõesConhecimento sobre o ecossistema e conceitos de Big Data;Experiência em alguma Cloud Computing (desejável GCP);Experiência prévia como Arquiteto de Dados, com foco em soluções;Experiência em soluções de dados escaláveis;Conhecimento sobre bancos de dados relacionais e não relacionais;Conhecimento em tecnologias de ETL/ELT;Conhecimento em Governança de DadosHabilidade em gerenciar a integridade, qualidade e segurança dos dados;Boa comunicação e autogestão do tempo e prioridades;Capacidade analítica e resolução de problemas diante a múltiplas variáveis de cada cenário;Conhecimento em métodos ágeis.Gostar de entender o negócio e converter necessidades em solução de Dados.DIFERENCIAISExperiência e certificação em Google Cloud Platform (GCP);Conhecimento em Python / PySpark;Ter atuado como Engenheiro ou Analista de Dados;Ter atuado como Analista de DomíniosTer atuado como Arquiteto de Soluções em projetos de Big Data ou soluções Analytics.Informações adicionaisNOSSOS BENEFÍCIOSJá falamos que o Grupo Boticário é o melhor e maior ecossistema de beleza, né? E quando falamos dos Benefícios, oferecemos um pacote super diferenciado e pensado para estar presente em todos os momentos da vida dos colaboradores.Confere só um resumo dos benefícios* que temos por aqui:Alimentação-Vale Refeição-Vale Alimentação-Auxílio Natal  Bem-Estar e Qualidade de vida -Gympass-Meu Pet Club (plano de saúde para pets)-Auxílio home office (modelos híbrido e remoto)-Desconto de até 40% em nossos produtos-Associação para colaboradores (convênios e parcerias, loja multimarcas, academias total pass, cursos e muito mais!)-Programa de Viagens e Hospedagens (Travel Cash)-Day off de aniversárioFamília - Auxílio Educação Infantil- Nutrição Infantil- Auxílio Babá- Kit Educação-Orientação jurídica, psicológica e social- Apoio País Atípicos-Licença Parental estendida (180 dias para mães e 120 dias para pais)Saúde -Assistência médica e odontológica-Auxílio Medicamentos-Vale saúde para familiares -Plataforma de psicoterapiaSeguridade -Seguro de Vida -Previdência Privada-Empréstimos consignados Mobilidade -Vale Combustível -Vale Transporte e Estacionamento (modelos híbrido e presencial)*Pacote de benefícios conforme regras de elegibilidade",Grupo Boticário,vacancy_type_effective,2024-04-06T00:00:00.000Z,True,,,Brasil,https://grupoboticario.gupy.io/job/eyJqb2JJZCI6Njg5NDI0Mywic291cmNlIjoiZ3VweV9wb3J0YWwifQ==?jobBoardSource=gupy_portal,True,remote,True
6817337,2024-03-26T19:27:15.924Z,14836-ADMINISTRADOR BANCO DE DADOS SR,"Na Global Hitss, a inovação é o nosso combustível, a curiosidade é o nosso motor e o respeito pelo cliente é o nosso guia. Se você é movido pela paixão em criar soluções tecnológicas disruptivas, se busca constantemente desafios que ampliem os limites do possível e se acredita que colocar o cliente em primeiro lugar é a chave para o sucesso, então você está no lugar certo.Queremos pessoas que se destaquem, que pensem fora da caixa e estejam dispostas a desbravar novos horizontes. Aqui, cada ideia é valorizada, cada pergunta é incentivada e cada desafio é encarado como uma oportunidade de aprendizado e crescimento.Junte-se a nós e faça parte de uma cultura vibrante, onde a inovação é alimentada pela curiosidade incessante e onde o respeito pelo cliente permeia todas as nossas ações. Aqui, você terá a liberdade de explorar suas habilidades, colaborar com mentes brilhantes e transformar o futuro da tecnologia.Se você está pronto para fazer parte de uma empresa que acredita que o talento é a chave para o sucesso, envie seu currículo e junte-se à nossa equipe.Estamos ansiosos para conhecer você e impulsionar juntos a próxima geração de soluções tecnológicas.Venha ser um Hit!Responsabilidades e atribuiçõesPrincipais Atribuições da Função:Atender, documentar, analisar e executar planos de contingência e retornos operacionais;Solucionar incidentes e problemas relacionados às bases de dados;Criar, administrar, manter e monitorar propagação e replicação de bases de dados;Executar, manter, gerenciar, validar, melhorar, evoluir e corrigir rotinas de backup e restauração de bases;Criação e manutenção de bases DB2: Database, Tablespace,Indexspace,Tables,Views,Storage Group com utilização do SMS, análise de performance.  Requisitos e qualificaçõesRequisitos necessários:Ensino Superior completo em TI;DBA de DB2 com experiência em administração e Manutenção a bases de dados em SGBD em ambiente mainframe com Sistema operacional z/OS;Criação e manutenção de bases DB2: Database, Tablespace,Indexspace,Tables,Views,Storage Group com utilização do SMS, análise de performance;  Conhecimentos em Utilitários: Unload, Load, Reorg,Recover,Image Copy;Conhecimentos em Produtos: DB2 AdministrationTool,DB2 Object Comparison Tool,TSO,SPUFI;DBA Xpert, File Aid Erwi,STROBE, Main View, Omegamon;Conhecimentos em Infraestrutura: Implementação  do  produto DB2  em  novas  LPAR’s;Administração  em  geral  do  produto  DB2, espaço  em disco, extents diretório e catálogo, alteração de parâmetros na ‘ ZPARM ‘.    Informações adicionaisQuer conhecer todas as nossas vagas? Acesse a nossa página:Global Hitss - Trabalhe Conoscohttps://globalhitss.gupy.io/Importante: Todas as nossas vagas são elegíveis para profissionais com deficiência, equidade de gênero e raça/ etnia.",GLOBAL HITSS,vacancy_type_effective,,False,Brasília,Distrito Federal,Brasil,https://globalhitss.gupy.io/job/eyJqb2JJZCI6NjgxNzMzNywic291cmNlIjoiZ3VweV9wb3J0YWwifQ==?jobBoardSource=gupy_portal,True,on-site,True
6942686,2024-03-27T12:08:38.034Z,"Técnico de instalações II - Missão Crítica, Data Center.","Estamos buscando Técnico de instalações II com experiência profissional com pleno conhecimento em Data center e obras de Missão Critica.Em uma evolução constante, buscamos profissionais especializados que possam agregar e crescer juntos, estando alinhados com a nossa missão que é ""Ser a melhor e mais eficiente empresa brasileira em soluções de engenharia para o mercado de infraestrutura"".Somos uma construtora especializada na implementação de infraestrutura para telecomunicações, data centers, instalações industriais e sistema de energia.Com 29 Anos de existência, atendemos grandes players do setor, fornecendo soluções Turnkey e serviços diversos com grande qualidade e precisão.Convidamos você a se inscrever e vir fazer parte da nossa equipe, para que possamos juntos, crescer e aprender.Responsabilidades e atribuiçõesExecução das Instalações Elétricas;Realizar a instalação de cabos, eletrodutos, quadros elétricos, disjuntores, luminárias e demais componentes elétricos de acordo com os projetos aprovados, normas técnicas e boas práticas de engenharia;Assegurar a qualidade da execução, inspecionando os materiais e serviços para garantir a conformidade com as especificações técnicas, normas e normas de segurança;Monitorar o andamento da obra, identificando e resolvendo problemas técnicos de forma proativa;Manter a organização do local de trabalho, garantindo a segurança e higiene do ambiente;Gestão de Materiais e Ferramentas;Realizar o recebimento, armazenamento e utilização correta dos materiais elétricos, ferramentas e equipamentos, de acordo com os procedimentos da empresa e normas técnicas;Controlar o estoque de materiais, evitando desperdícios e garantindo a disponibilidade dos recursos necessários para a execução da obra;Assegurar a utilização dos equipamentos alugados dentro do prazo contratado, evitando custos extras, por meio de comunicação ao fiscal / engenheiro responsável da obra.Requisitos e qualificaçõesExperiência comprovada na execução de instalações elétricas em Data Centers;Conhecimento profundo dos sistemas elétricos presentes em Data Centers, incluindo geradores, nobreaks, sistemas de aterramento, etc...;Familiaridade com as normas técnicas e legislações relacionadas à instalação elétrica em Data Centers;Leitura e interpretação de projetos elétricos, cadernos de especificações e normas técnicas;Conhecimento de eletrotécnica, incluindo princípios básicos de eletricidade, circuitos elétricos, dimensionamento de cabos e equipamentos;Habilidade para realizar testes e medições em sistemas elétricos;Domínio de ferramentas e equipamentos utilizados na instalação elétrica;Conhecimento em montagem de SPDA, montagem de banco de baterias, PDU e execução de testes de instalações de baixa tensão e média tensão;Elaboração de listas de materiais.Informações adicionaisVale refeição ou alimentação;Plano de Saúde com coparticipação;Plano Odontológico;Convênio Farmácia;Vale Transporte;Seguro de vida em grupo.",Ageplan,vacancy_type_effective,2024-04-15T00:00:00.000Z,False,São Paulo,São Paulo,Brasil,https://ageplan.gupy.io/job/eyJqb2JJZCI6Njk0MjY4Niwic291cmNlIjoiZ3VweV9wb3J0YWwifQ==?jobBoardSource=gupy_portal,False,on-site,True
