job_id,published_date,title,description,career_page_name,type,application_deadline,is_remote_work,city,state,country,job_url,disabilities,workplace_type,submitted
7303903,2024-06-13T12:16:32.516Z,Dev Java SR     ,"A NAVA está em busca de um Dev Java SR para fazer parte do nosso time de pessoas incríveis!  Por que trabalhar na NAVA?Somos uma empresa de tecnologia que atende as maiores companhias dos setores financeiro, seguros, meios de pagamento, telecomunicações, energia e varejo do país. Inspiramos nossos times a criar soluções para que essas companhias transformem e impactem positivamente o mundo.  Temos um time curioso, criativo, energético e inspirador, com grande foco nas pessoas para gerar inovação, transformação e crescimento. Dentro de um ambiente dinâmico e ágil, o nosso time está em expansão para acompanhar o crescimento exponencial da NAVA e dos nossos Clientes. ﻿Acolhemos as diferenças porque acreditamos que um ambiente diverso contribui para a inovação e uma sociedade mais justa e equânime e convidamos você à assumir esse compromisso junto com a gente.Responsabilidades e atribuiçõesComo será o seu dia a dia?Um ambiente desafiador, criativo e com muita demanda que oferece oportunidades para o crescimento e o aprimoramento de conhecimentos. É um ambiente que exige esforço e dedicação.Um ambiente onde os profissionais são constantemente estimulados a aprender e a se desenvolver, são confrontados com problemas e desafios que as fazem a pensar fora da caixa e a encontrar novas soluções. Isso pode ser muito estimulante e gratificante, pois permite que alcancem o seu potencial máximo.Requisitos e qualificaçõesO que esperamos de você?Analista BackendJava 8 e 9 +Frameworks Spring (Boot, JPA, Security)Git e GitflowConsumo de Apis Rest e SoapConhecimento em DockerConhecimentos e experiência em Framework Apache Camel e Apigee.Experiência em esteira Devops (deploys, testes unitários, análise de erros em esteiras cloudbees);Experiência em metodologias Agile na função de DEV.Informações adicionaisHorário de trabalho: 09h00 ás 18h00Modelo de trabalho para este projeto/cliente: híbrida 3x por semana presencialLocal de trabalho: Zona Sul Além de ser uma empresa certificada Great Place to Work, você vai encontrar na NAVA: ✅ Oportunidades de carreira 🚀✅ Liberdade para escrever seu próprio código 🏆✅ Diversidade e diferentes formas de ver o mundo 🌈✅ Comunidades que incentivam o crescimento de todos 📚✅ Treinamento In Company 💻✅ Um time incrível 😎✅ Empresa engajada no Pacto Global da ONU 💪🏼✅ Projetos inovadores 💡✅ Alta avaliação no Glassdoor 📣 ",NAVA | Technology for Business,vacancy_type_effective,2024-07-31T00:00:00.000Z,False,São Paulo,São Paulo,Brasil,https://nava.gupy.io/job/eyJqb2JJZCI6NzMwMzkwMywic291cmNlIjoiZ3VweV9wb3J0YWwifQ==?jobBoardSource=gupy_portal,True,hybrid,True
7301844,2024-06-12T19:55:17.591Z,Dev Java SR  ,"A NAVA está em busca de um Dev Java SR  para fazer parte do nosso time de pessoas incríveis!  Por que trabalhar na NAVA?Somos uma empresa de tecnologia que atende as maiores companhias dos setores financeiro, seguros, meios de pagamento, telecomunicações, energia e varejo do país. Inspiramos nossos times a criar soluções para que essas companhias transformem e impactem positivamente o mundo.  Temos um time curioso, criativo, energético e inspirador, com grande foco nas pessoas para gerar inovação, transformação e crescimento. Dentro de um ambiente dinâmico e ágil, o nosso time está em expansão para acompanhar o crescimento exponencial da NAVA e dos nossos Clientes. ﻿Acolhemos as diferenças porque acreditamos que um ambiente diverso contribui para a inovação e uma sociedade mais justa e equânime e convidamos você à assumir esse compromisso junto com a gente.Responsabilidades e atribuiçõesComo será o seu dia a dia?Um ambiente desafiador, criativo e com muita demanda que oferece oportunidades para o crescimento e o aprimoramento de conhecimentos. É um ambiente que exige esforço e dedicação.Um ambiente onde os profissionais são constantemente estimulados a aprender e a se desenvolver, são confrontados com problemas e desafios que as fazem a pensar fora da caixa e a encontrar novas soluções. Isso pode ser muito estimulante e gratificante, pois permite que alcancem o seu potencial máximo.Requisitos e qualificaçõesO que esperamos de você?Participar das cerimônias (review, retrospectiva, planning, refinamentos)Desenvolvimento das soluçõesCriação de testes unitáriosApoio nos testes/homologação das soluções desenvolvidasImplantação e estabilização das soluçõesManutenção das soluçõesProfissional com experiência em desenvolvimento Java, especializado em arquitetura de micro serviços e integração com serviços REST. Possui conhecimentos sólidos em frameworks como Spring Boot e Hibernate, além de expertise em bancos de dados relacionais e não relacionais. Experiência em desenvolvimento Cloud, DevOps e ferramentas de controle de versão como Git e Docker. Familiaridade com AWS é essencial, especialmente em serviços como Apigee e AWS Gateway.Conhecimentos Técnicos:Java 8 e 9 +Frameworks Spring (Boot, JPA, Security)Git e GitflowConsumo de Apis Rest e SoapConhecimento em DockerConhecimentos e experiência em Framework Apache Camel e Apigee.Experiência em esteira Devops (deploys, testes unitários, análise de erros em esteiras cloudbees);﻿Será considerado diferencial se você tiver:Atuação em projetos do setor financeiro.Informações adicionaisHorário de trabalho: Comercial Modelo de trabalho para este projeto/cliente: Híbrido - 3x por semana presencial Local de trabalho: Zona Sul -SP (Santo Amaro)Além de ser uma empresa certificada Great Place to Work, você vai encontrar na NAVA: ✅ Oportunidades de carreira 🚀✅ Liberdade para escrever seu próprio código 🏆✅ Diversidade e diferentes formas de ver o mundo 🌈✅ Comunidades que incentivam o crescimento de todos 📚✅ Treinamento In Company 💻✅ Um time incrível 😎✅ Empresa engajada no Pacto Global da ONU 💪🏼✅ Projetos inovadores 💡✅ Alta avaliação no Glassdoor 📣 ",NAVA | Technology for Business,vacancy_type_effective,,False,São Paulo,São Paulo,Brasil,https://nava.gupy.io/job/eyJqb2JJZCI6NzMwMTg0NCwic291cmNlIjoiZ3VweV9wb3J0YWwifQ==?jobBoardSource=gupy_portal,True,hybrid,True
7301278,2024-06-12T19:07:47.155Z,Dev Java SR ,"A NAVA está em busca de um Dev Java SR  para fazer parte do nosso time de pessoas incríveis!  Por que trabalhar na NAVA?Somos uma empresa de tecnologia que atende as maiores companhias dos setores financeiro, seguros, meios de pagamento, telecomunicações, energia e varejo do país. Inspiramos nossos times a criar soluções para que essas companhias transformem e impactem positivamente o mundo.  Temos um time curioso, criativo, energético e inspirador, com grande foco nas pessoas para gerar inovação, transformação e crescimento. Dentro de um ambiente dinâmico e ágil, o nosso time está em expansão para acompanhar o crescimento exponencial da NAVA e dos nossos Clientes. ﻿Acolhemos as diferenças porque acreditamos que um ambiente diverso contribui para a inovação e uma sociedade mais justa e equânime e convidamos você à assumir esse compromisso junto com a gente.Responsabilidades e atribuiçõesComo será o seu dia a dia?Um ambiente desafiador, criativo e com muita demanda que oferece oportunidades para o crescimento e o aprimoramento de conhecimentos. É um ambiente que exige esforço e dedicação.Um ambiente onde os profissionais são constantemente estimulados a aprender e a se desenvolver, são confrontados com problemas e desafios que as fazem a pensar fora da caixa e a encontrar novas soluções. Isso pode ser muito estimulante e gratificante, pois permite que alcancem o seu potencial máximo.Requisitos e qualificaçõesO que esperamos de você?Participar das cerimônias (review, retrospectiva, planning, refinamentos)Desenvolvimento das soluçõesCriação de testes unitáriosApoio nos testes/homologação das soluções desenvolvidasImplantação e estabilização das soluçõesManutenção das soluçõesProfissional com experiência em desenvolvimento Java, especializado em arquitetura de micro serviços e integração com serviços REST. Possui conhecimentos sólidos em frameworks como Spring Boot e Hibernate, além de expertise em bancos de dados relacionais e não relacionais. Experiência em desenvolvimento Cloud, DevOps e ferramentas de controle de versão como Git e Docker. Familiaridade com AWS é essencial, especialmente em serviços como Apigee e AWS Gateway.Conhecimentos Técnicos:Java 11+Desenvolvimento de micro serviçosSpring Boot, HibernateIntegração com serviços RESTAPI Gateway (Apigee | AWS Gateway)Bancos relacionais e não relacionais (MySQL, PostgreSQL, MongoDB, DocumentDB)Integração com filas (MQ, RabbitMQ, SQS)Conhecimentos em design patterns, SOLID, hexagonal architecture e clean architectureExperiência em desenvolvimento CloudDevOps, Git / GitFlow, DockerConhecimento em pelo menos uma das plataformas: Quarkus, Spring Boot, Kafka﻿Será considerado diferencial se você tiver:Certificação ou conhecimento em Kubernetes, AKS ou EKSIntegration Framework - CamelNoções de arquitetura CloudArquitetura orientada a eventosFerramentas de análise de código (Jenkins)Monitoramento: DynatraceInformações adicionaisHorário de trabalho: Comercial Modelo de trabalho para este projeto/cliente: Híbrido - 3x por semana presencial Local de trabalho: Zona Sul -SP Além de ser uma empresa certificada Great Place to Work, você vai encontrar na NAVA: ✅ Oportunidades de carreira 🚀✅ Liberdade para escrever seu próprio código 🏆✅ Diversidade e diferentes formas de ver o mundo 🌈✅ Comunidades que incentivam o crescimento de todos 📚✅ Treinamento In Company 💻✅ Um time incrível 😎✅ Empresa engajada no Pacto Global da ONU 💪🏼✅ Projetos inovadores 💡✅ Alta avaliação no Glassdoor 📣 ",NAVA | Technology for Business,vacancy_type_effective,,False,São Paulo,São Paulo,Brasil,https://nava.gupy.io/job/eyJqb2JJZCI6NzMwMTI3OCwic291cmNlIjoiZ3VweV9wb3J0YWwifQ==?jobBoardSource=gupy_portal,True,hybrid,True
7306340,2024-06-13T16:44:09.430Z,Estagiário(a) Back Office ,"Somos um banco de atacado com mais de 30 anos de presença no Brasil. Estamos passando por um momento de grandes transformações, investindo em um novo modelo operacional para atender o crescimento estratégico com excelência operacional com qualidade de entrega aos nossos clientes.Trabalhando no Banco ABC Brasil, o profissional irá conviver com colaboradores experientes, em um ambiente colaborativo, que estimula o crescimento de todos, incentivando novas ideias, projetos e protagonismo na evolução da própria carreira.Responsabilidades e atribuiçõesElaborar os planos de trabalho e cronogramas das suas próprias atividades aplicando ferramentas de gestão de projetos.Fazer o levantamento dos processos da manufatura através de entrevistas e levantamento de dados da operação do banco com visão cliente “end to end” dos processos de tratamento dos produtos do banco.Elaborar relatório e apresentação em Power Point com a análise final do trabalho demonstrando a situação atual, melhorias e ações de melhorias recomendadas.Aplicar em suas análises as principais ferramentas de gestão, destacando: Matriz SWOT; Business Model Canvas; Matriz BCG; 5W2H; diagrama de Ishikawa, e; Ciclo PDCA.Requisitos e qualificaçõesEstar cursando os cursos de Economia, Administração, Engenharia, Análise e Desenvolvimento de Sistemas, Ciência da Computação ou áreas correlatas;Conhecimento do pacote Office, com especialidade em Excel com utilização de macros e programação VBA;Conhecimento de ferramentas ou técnicas de gestão de projetos tais como Kamban, Trello, MS Project,Habilidade analítica e capacidade de avaliação da criticidade da informação baseada em dados e construção de indicadores de performance;Visão disruptiva e proativa em busca de soluções inovadoras;Protagonismo e facilidade de adaptação em ambiente desafiador e em transformação;Capacidade de colaborar eficazmente com diversos departamentos e níveis da organização;Inglês Intermediário. Informações adicionaisAssistência Médica;Seguro de Vida;Vale Refeição;Vale Transporte;Auxílio Home Office;",Quem somos,vacancy_type_internship,,False,São Paulo,São Paulo,Brasil,https://abcbrasil.gupy.io/job/eyJqb2JJZCI6NzMwNjM0MCwic291cmNlIjoiZ3VweV9wb3J0YWwifQ==?jobBoardSource=gupy_portal,False,hybrid,True
7304006,2024-06-13T12:30:31.947Z,Tech Lead Back-End | Caju Despesas,"Caju é uma empresa de tecnologia, fruto do empreendedorismo brasileiro, criada para transformar a relação entre empresas e colaboradores, com soluções inovadoras e flexíveis.Desenvolvemos uma plataforma para que as empresas possam fazer a gestão de diversas soluções no mesmo lugar, e para os colabores um único cartão com diversas possibilidades. Continuamos crescendo o nosso time de Back-End, buscando por novos talentos que queiram transformar o mundo de benefícios com soluções inovadoras. Aqui na Caju, aprendemos sempre, e nos tornamos cada vez melhores em um ambiente colaborativo e divertido!São muito bem-vindas candidaturas de pessoas negras, mulheres, indígenas, LGBTQIA+, ou outros grupos minorizados. 🧡Inscreva-se e conheça mais sobre nosso time 🧡Responsabilidades e atribuiçõesParticipar ativamente de decisões para auxiliar na definição de arquitetura, tecnologias, padrões e boas práticas de programação;Ser referência técnica, apoiar e colaborar com o desenvolvimento da equipe;Ajudar na melhoria contínua do processo de desenvolvimento;Ser o facilitador para remover impedimentos técnicos que a equipe possa ter, garantindo foco e dando o seu melhor para a entrega de valor ao produto e usuários;Auxiliar no recrutamento e seleção dos profissionais de desenvolvimento e áreas correlatas (Produto);Prevenir e antecipar possíveis problemas técnicas e propor melhorias;Ser ponto focal técnico do time;Requisitos e qualificaçõesSólidas experiências em desenvolvimento e definição de arquitetura back-end;Fundamentos de ciências da computação;Práticas de programação funcional;Experiência com desenvolvimento e consumo de APIs (GraphQL ou REST);Conhecimento em banco relacional e não relacional;Experiência com mensageria assíncrona (Kafka, Azure, RabbitMQ);Conhecimentos em telemetria e monitoramento (Datadog);Hoje Trabalhamos Com:Kotlin, Scala e framework Micronaut;Banco relacional e não relacional - MySQL e MongoDB;Mensageria - Kafka;Monitoramento - Datadog;Informações adicionaisO que oferecemos:💳 Cartão Caju, com mais liberdade para usar seus benefícios (Refeição, Alimentação, Mobilidade, Saúde, Home Office, Cultura e Educação);🏥 Plano de Saúde sem coparticipação;🧘🏿‍♀️ Zenklub, com consultas onlines com terapeutas e coaches para cuidar da sua saúde mental;🏋🏿‍♀️ Gympass🗣️ Aqui também estimulamos o aprendizado de idiomas, com a parceria da Rosetta Stone;📚 Parceria com Alura;💆🏽 Dia de recarregar - day off; 🧑🏿‍⚕️ Conexa Saúde - consulta médica online;👶🏿 Auxílio Creche;👨🏿‍💻 Trabalho Remoto, para você trabalhar de onde quiser dentro do Brasil;💻 Oferecemos equipamento de trabalho;🚀 Muitas possibilidades de crescimento - temos muito a crescer e esperamos fortemente que você nos ajude com isso!A Caju é uma empresa brasileira e aceita pessoas de todas as regiões do país.Trabalhamos em um modelo 100% remoto(quem tiver interesse de conhecer ou trabalhar no escritório, localizado em São Paulo, estaremos de portas abertas).Se interessou? #VemSerCaju 🧡",Caju Benefícios,vacancy_type_effective,,True,,,Brasil,https://caju.gupy.io/job/eyJqb2JJZCI6NzMwNDAwNiwic291cmNlIjoiZ3VweV9wb3J0YWwifQ==?jobBoardSource=gupy_portal,True,remote,True
7298074,2024-06-13T14:18:49.143Z,Desenvolvedor Full Stack Java Pleno - Tecnologia,"A Tecnologia sendo o motor propulsor de inovaçôes e evoluções:Desenvolver soluções inovadoras baseadas nas melhores tecnologias e boas práticas do mercado com propósito de potencializar a gestão empresarial sempre foi a missão da Viasoft e também é o propósito do time de tecnologia. O time de tecnologia trabalha para proporcionar aumento de produtividade e competitividade para os demais times da VIASOFT bem como para otimizar e criar inovações e evoluções tecnológicas para nossos clientes.Full Stack Java PlenoTambém conhecido como “Analista Programador Pleno”, é o profissional que possui experiência desempenhando a função de desenvolvedor JAVA e conhecimentos de tecnologias e metodologias de programação, como lógica, estruturas de dados, laços de repetição e instruções SQL. Além de ter domínio nas tecnologias utilizadas, o Analista Programador Pleno deve contribuir tecnicamente no desenvolvimento, orientação e apoio aos desenvolvedores de nível Júnior.Deve buscar priorizar principalmente a qualidade das suas tarefas, ter senso de urgência, foco e concentração, raciocínio lógico e capacidade de resolver problemas. Ter senso crítico e inconformismo, buscando sempre pela melhoria contínua dos processos e metodologias de desenvolvimento, para facilitar seu trabalho e aumentar sua produtividade. É de responsabilidade do Analista Programador Pleno a busca contínua por aprendizagem, solicitando auxílio à equipe quando necessário. Para desenvolver suas atividades, o profissional terá contato com colaboradores e lideranças e utilizará ferramentas para controle de suas tarefas como JIRA, Intellij, Bitbucket, Jenkins e outras.Responsabilidades e atribuiçõesDesenvolver códigos estáveis, confiáveis e que sejam fáceis de manter. Queremos código limpo e que funcione bem;Desenvolver códigos e soluções sempre pensando em eficiência, escalabilidade e estabilidade. Queremos garantir nosso crescimento super acelerado e um software escalável;Cumprir com prazos acordados para entrega de atividades.Requisitos e qualificaçõesExperiência com Java;Conhecimento com Angular, JavaScript, TypeScript, HTML e CSS;Conhecimento com Spring Boot;Conhecimento com uso de containers Kubernets.Familiaridade com Linux e Docker;Experiência com ferramenta de versionamento de código (GIT);Conhecimento em microsserviços;Conhecimento em testes unitários;Conhecimento com integração entre serviços por meio de API RESTExperiência com Nginx;Noções de Clean Code e Design Patterns;Conhecimento em banco de dados relacional, preferencialmente MySQL;Informações adicionaisEssa oportunidade de carreira só faz sentido para quem:É apaixonado pela área de tecnologia e almejar construir uma carreira sólida na área de desenvolvimento; Preza pela excelência, busca um código estável, confiável e de fácil manutenção;Tem uma atitude flexível, que goste de desafios e busque aprendizado constantemente; É obcecado por evolução e conhecimento;Quer ser protagonista na sua carreira profissional;Busca ser eficaz nas atividades, realizando com agilidade, mas também com a acabativa necessária para desenvolver e entregar suas demandas;É organizado, realizando as atividades diárias planejadas conforme estimado;É aberto a dar e receber feedbacks (escuta feedbacks, busca por feedbacks, apresenta plano de melhoria pró-ativamente).Trabalhando conosco você terá acesso:Vale alimentação ou refeição - Você escolhe!Auxílio transporte;Plano de saúde;Plano odontológico;Auxílio pós graduação de 70% da mensalidade;Auxílio a cursos online;Cadastro nas plataformas educacionais Alura e DevMedia; Seguro de vida;Sendo Home Office Full Time haverá auxílio financeiro para os custos;Prêmio indicação;Eventos constantes de desenvolvimento técnico e comportamental;Gestão de carreira estruturado;Programa de análise de desempenho;Feedbacks e Plano de Desenvolvimento Individual;Programa de mentoria. Super importante: Se você atende os requisitos e vê sentido em fazer parte do nosso time, isso é tudo o que importa! Aqui procuramos pessoas com capacidade e vontade de transformar, de serem protagonistas, independente do lugar que reside, idade, raça, cor, religião, ser PcD, identidade de gênero ou orientação sexual. Seu perfil e valores condizem com os nossos? Então venha fazer parte da VIASOFT!",Viasoft,vacancy_type_effective,,True,,,Brasil,https://viasoft.gupy.io/job/eyJqb2JJZCI6NzI5ODA3NCwic291cmNlIjoiZ3VweV9wb3J0YWwifQ==?jobBoardSource=gupy_portal,True,remote,True
7300816,2024-06-13T13:07:08.122Z,Desenvolvedor(a) Full Stack .NET Sr.,"O propósito é o que nos guia e nos faz avançar! Conectar o nosso propósito ao seu é o que transforma a pecuária de ponta a ponta. Por isso, queremos catalisar a transformação tecnológica no agronegócio brasileiro e mundial com informação de confiança que gera sustentabilidade e inteligência estratégica. 🚀🐂Se você quer crescer junto com a gente, tem uma oportunidade que pode ser para você!Estamos com vaga para Desenvolvedor Full Stack .NET Sr., confira logo abaixo as informações! 👇Responsabilidades e atribuiçõesDesenvolver aplicações com as tecnologias da framework .NET (ASP, C#, Core, WPF, Windows Forms);Atuar em melhoria de performance e correções de bugs das aplicações .NET;Gerar relatórios com ferramentas de design de relatórios da Ponta e consultas em SQL;Desenvolver APIs REST para aplicações backend com autenticação usando JWT e com documentação embarcada Swagger;Documentar aplicações em código, readme (markdown), diagramas (se complexo).Requisitos e qualificaçõesPara isso, é importante que você tenha conhecimento em:Framework NET Core MVC e ASP.MVC;Orientação a Objetos e Padrões de Projetos;Versionamento com GIT;Intermediário de SQL;Framework Net Core MVC 3.1;Scrum / Kanban (Jira).E será considerado diferencial se você tiver conhecimento em:Javascript;SQLFramework;ASP.MVC (Net Framework);Desktop WPF (MVVM) (Net Framework);MicroORM Dapper;PostgreSQL; SQLite;Visual Studio 2022;Linux Server e Windows Desktop;Documentação com Confluence.Informações adicionaisInformações:👩‍💻 Local de trabalho: Home Office👉 Modelo de Contrato: CLTNossos benefícios são incríveis, olha só! 👇🍕 Vale Alimentação/Refeição no cartão Flash: você escolhe se vai usar no mercado ou em restaurantes;💰 Ajuda de Custo Home Office;🔒 Seguro de Vida;🏥 Plano de Saúde;🦷 Plano Odontológico;🥳 Dayoff no mês do aniversário + um crédito no cartão Flash de presente pra aproveitar da forma como quiser!;🧘 Gympass: Pra você e seus dependentes cuidarem da saúde física e mental;🎯 E a chance de você crescer aqui dentro é grande: temos plano de carreira!Deu match? Então se inscreve aí! 💚#VemPraPonta",Ponta,vacancy_type_effective,,True,,,Brasil,https://vempraponta.gupy.io/job/eyJqb2JJZCI6NzMwMDgxNiwic291cmNlIjoiZ3VweV9wb3J0YWwifQ==?jobBoardSource=gupy_portal,True,remote,True
7304445,2024-06-13T13:12:10.227Z,Desenvolvedor Fullstack RP 1085089,"Vamos juntos mudar o mundo?  Você valoriza a Ética acima de tudo, tem Visão Compartilhada, acredita na Sustentabilidade Sistêmica, em entregar resultados com Excelência e é apaixonado por Inovação?﻿Se a sua resposta foi SIM, então nós queremos conhecer você! Responsabilidades e atribuiçõesDescrição SumáriaAtuar no desenvolvimento fullstack;Atuar com a documentação de software;Atuar na produção de API Rest;Atuar com aplicação de práticas DevOps.Requisitos e qualificaçõesConhecimentos Técnicos RequeridosConhecimentos em linguagem de programação Backend como: Java, C# e Python;Conhecimento em framework front-end como: Bootstrap ou Angular;Conhecimentos em práticas DevOps; Conhecimento em API Rest.Conhecimentos DesejáveisConhecimentos em ambiente Cloud;Informações adicionaisEssa é uma vaga de Contrato por Tempo Indeterminado (Efetivo).Sendo assim, essa é a nossa proposta salarial e benefícios para a vaga em questão com esse tipo de vínculo:Avaliaremos a pretensão salarial;Vale Transporte;Vale Alimentação/Refeição;Plano de Saúde, extensivo a dependentes;Vitalmed para atendimento de urgência e emergência domiciliar, extensivo a dependentes;Seguro contra Acidentes Pessoais;Convênio SESI - Programa Odontológico;Plano de Previdência Privada;Benefício Previdenciário (em casos de afastamento, o sistema FIEB complementa o suporte financeiro não oferecido pelo INSS);Auxílio Creche exclusivo para mulheres; Rede de parceiros CIEB - Convênios e Parcerias com academias, escolas de idiomas, espaços de eventos, seguradoras de veículos, hotéis, entre outros.Unindustria - Portal com várias capacitações online e gratuitas para o colaborador.Descontos nos cursos SENAI e SENAI CIMATEC para colaboradores e dependentes. Após 1 ano, pode haver ajuda no custeio de treinamento de longa duração, tais como Graduação, Especializações, Mestrado e Doutorado em qualquer Instituição, de acordo com o cargo e função exercido. Quer fazer parte da nossa Instituição e mudar o mundo conosco? Inscreva-se já em nossa vaga e venha fazer parte do nosso time! Estamos te aguardando! Vem ser SENAI CIMATEC!",SENAI CIMATEC ,vacancy_type_effective,,False,Salvador,Bahia,Brasil,https://senaicimatec.gupy.io/job/eyJqb2JJZCI6NzMwNDQ0NSwic291cmNlIjoiZ3VweV9wb3J0YWwifQ==?jobBoardSource=gupy_portal,False,hybrid,True
