job_id,published_date,title,description,career_page_name,type,application_deadline,is_remote_work,city,state,country,job_url,disabilities,workplace_type,submitted
7306078,2024-06-13T17:29:15.723Z,Pessoa Desenvolvedora Mobile Sênior,"Somos aproximadamente 50k Minsaiters no Mundo e mais de 9k Minsaiters no Brasil e estamos presentes nas maiores empresas em todos os setores. Nossa estrutura permite participar de projetos globais e proporciona um ambiente colaborativo que nos certifica em GreatPlacesToWork e planos diferenciados para Jovens Profissionais também reconhecidos pela Employers for Youth. Você atuará no nosso time em um projeto estratégico, utilizando metodologias ágeis e em um ambiente de inovação.Buscamos profissionais com senso de dono, comprometidos com o sucesso do nosso cliente e com o desenvolvimento da sua carreira dentro da MinsaitVocê será um pilar fundamental nos melhores e maiores projetos de TI do Brasil e em nível global.Venha ser um Minsaiter!Responsabilidades e atribuiçõesEstamos buscando um profissional altamente experiente e motivado para ocupar a posição de Desenvolvedor Mobile Sênior em nossa equipe. Este papel é fundamental para o desenvolvimento e aprimoramento contínuo de nossos sistemas e aplicativos, garantindo sua robustez, escalabilidade e desempenho excepcional.Responsabilidades:Atuará como Desenvolvedor app;Atuará com análise, desenvolvimento e manutenção de aplicativos;Desenvolverá aplicativos Modulares;Criará frameworks dinâmicos e bibliotecas estáticas para Android;Trabalhará em equipe de forma colaborativa, compartilhando conhecimentos e experiências para o sucesso coletivo dos projetos.Identificar, analisar e resolver problemas de forma proativa, garantindo a estabilidade, confiabilidade e segurança dos sistemas em produção.Implementar medidas preventivas e corretivas para garantir a continuidade operacional dos sistemas.Requisitos e qualificaçõesDominar o processo de melhores práticas de desenvolvimento para aplicativos IOS e Android;Vivência anterior no desenvolvimento de aplicativos IOS e Android e publicação de aplicativos na Apple Store e Google Play;Vivência com boas práticas seguindo o Style Guide Kotlin;Conhecimento e domínio da linguagem Kotlin;Forte capacidade analítica, resolução de problemas e habilidades de comunicação interpessoal.Capacidade de trabalhar de forma colaborativa em equipes ágeis, participando ativamente de rituais como Scrum, Kanban, entre outros.Informações adicionaisTRABALHE NA MINSAITModelo de contratação CLT.Plano de Saúde subsidiado pela empresa para o titular.Opção de inclusão de dependentes no Plano de Saúde com desconto em folha de pagamento.Assistência Odontológica (opcional).Opção de inclusão de dependentes no Plano de Assistência Odontológica com desconto em folha de pagamento.Vale Refeição ou Vale Alimentação.Vale Transporte (opcional).POP - Programa de Orientação Pessoal que visa oferecer suporte emocional e aconselhamento com orientação confidencial nas áreas psicológica, jurídica, financeira, social e pet sem custo para titular e dependentes legais.Gympass (Acesso a mais de 700 academias em todo o Brasil com planos a partir de R$ 39,90 descontado em folha de pagamento).Opção de inclusão de dependentes no Gympass (até 03 dependentes - pago via cartão de crédito).Parcerias com grandes marcas de consumo.Convênio com o SESC para titular e dependentes.Convênios para descontos com instituições de ensino (graduação e pós-graduação) e escola de idiomas.Seguro de vida em grupo.Nosso compromisso com a diversidade é um elemento-chave da nossa cultura: Igualdade de oportunidades, respeito pelas pessoas e não discriminação são princípios de atuação para todos os profissionais da Minsait. Integramos o Bloomberg Gender-Equality Index (GEI) 2021 em termos de diversidade e igualdade de gênero.Todas as nossas vagas são abertas também para PCDs.",Minsait an Indra Company,vacancy_type_effective,,False,João Pessoa,Paraíba,Brasil,https://minsait.gupy.io/job/eyJqb2JJZCI6NzMwNjA3OCwic291cmNlIjoiZ3VweV9wb3J0YWwifQ==?jobBoardSource=gupy_portal,True,hybrid,True
7268979,2024-06-13T17:04:06.150Z,Desenvolvedor(a) Full Stack Sênior - Ruby on Rails,"Nós nascemos para revolucionar a mobilidade urbana. Nosso propósito é cuidar de toda gestão de transportes, usando a tecnologia como principal base de apoio para soluções inovadoras e de sucesso.Somos mais que uma empresa. Temos uma cultura forte e autêntica que fortalece nossas transformações e nos fazem encarar nossos desafios com coragem e espírito de dono.O Fretadão é movido por pessoas e para pessoas. Para fazermos tudo isso acontecer, temos um time que respira nossos valores e os coloca em prática todos os dias.Responsabilidades e atribuiçõesPropósito do cargo:Buscamos um(a) Desenvolvedor(a) Full Stack Sênior especializado(a) em Ruby on Rails para integrar nosso time de tecnologia e liderar o desenvolvimento de soluções inovadoras. O propósito deste cargo é garantir a criação, manutenção e melhoria contínua de aplicações web robustas, escaláveis e de alta performance, com foco em bancos de dados relacionais e não relacionais, bem como em APIs de geolocalização. Nosso objetivo é proporcionar uma experiência excepcional aos usuários finais, mantendo sempre os mais altos padrões de qualidade e segurança.Como Fretonauta você será responsável por:Desenvolvimento de Aplicações: Contribuir para o desenvolvimento e liderança de novas funcionalidades e melhorias em nossas aplicações web, utilizando Ruby on Rails.Manutenção e Suporte: Identificar e resolver problemas técnicos, realizando manutenção preventiva e corretiva das aplicações existentes.Integração de APIs: Desenvolver e integrar APIs, com foco especial em APIs de geolocalização, garantindo a troca eficiente e segura de informações.Gerenciamento de Bancos de Dados: Trabalhar com bancos de dados relacionais (PostgreSQL) e não relacionais (Redis), garantindo a otimização e eficiência na gestão de dados.Qualidade do Código: Escrever código limpo, eficiente e bem documentado, seguindo as melhores práticas de desenvolvimento de software.Testes e Validação: Implementar testes automatizados e realizar testes manuais para garantir a qualidade e a estabilidade das funcionalidades desenvolvidas.Mentoria e Colaboração: Orientar e apoiar desenvolvedores juniores e plenos, promovendo um ambiente de aprendizado contínuo e colaborativo.Atualização e Aprendizado Contínuo: Manter-se atualizado com as últimas tendências e tecnologias em desenvolvimento de software, participando de treinamentos e eventos da área.Requisitos e qualificaçõesRequisitos Obrigatórios:Formação: Graduação em Ciência da Computação, Engenharia de Software, Sistemas de Informação ou áreas correlatas.Experiência: Mínimo de 5 anos de experiência comprovada como Desenvolvedor(a) Full Stack, com pelo menos 3 anos utilizando Ruby on Rails.Linguagens de Programação: Proficiência em Ruby on Rails, JavaScript, HTML, CSS, e experiência com frameworks de front-end como React ou Vue.js.Banco de Dados: Experiência avançada com PostgreSQL e Redis.APIs: Experiência na criação, consumo e integração de APIs, incluindo APIs de geolocalização.Controle de Versão: Conhecimento avançado em Git e práticas de versionamento de código.Metodologias Ágeis: Experiência em trabalhar com metodologias ágeis (Scrum, Kanban).Desenvolvimento de APIs: Experiência na criação e consumo de APIs RESTful e/ou GraphQL.Diferenciais:Cloud Computing: Experiência com serviços de nuvem (AWS, Azure, Google Cloud).DevOps: Conhecimento em CI/CD, Docker, Kubernetes e automação de deploy.Segurança: Conhecimento em práticas de segurança de software e PSI.Soft Skills: Habilidade para trabalhar em equipe, boa comunicação, proatividade e capacidade de resolução de problemas.Informações adicionaisNossos Benefícios:Cartão Flex Food Swile R$770,00 mensais;Home office;No Dress Code (Não temos um código de vestimenta, você pode trabalhar da forma que se sentir mais confortável);Day Off (aniversário);",Fretadão,vacancy_type_autonomous,,True,,,Brasil,https://fretadao.gupy.io/job/eyJqb2JJZCI6NzI2ODk3OSwic291cmNlIjoiZ3VweV9wb3J0YWwifQ==?jobBoardSource=gupy_portal,True,remote,True
7306553,2024-06-13T17:04:01.212Z,Desenvolvedor Sr ,"Queremos você para gerar ainda mais valor!A Núclea é uma empresa que acredita no futuro com ações no presente com transações financeiras feitas de forma rápida, segura e acessível. Somos especialistas em infraestrutura e soluções de pagamentos digitais, e trabalhamos para transformar o mercado financeiro, tornando-o mais eficiente e inclusivo.Nossos valores são a base de tudo o que fazemos.Apaixonados por clientes. Estamos sempre buscando entender suas necessidades e encontrar soluções que atendam às suas expectativas.Gente que gosta de gente. Investimos no desenvolvimento de nossos colaboradores e criamos um ambiente de trabalho que valoriza a diversidade e a inclusão.Integridade faz parte do nosso DNA. Agimos com ética e transparência em todos os nossos relacionamentos.Somos direcionados por dados. Análise e solução ágil fazem parte da empolgação em ter consistência no uso de inteligência de dados.Inovação na veia. Estamos sempre buscando novas soluções para atender às necessidades de nossos clientes e do mercado.Fanáticos por resultados. Nos movem e nos motivam a assertividade para nossos parceiros e clientes. Sobre a Núcleahttps://www.nuclea.com.br/A Núclea é uma empresa brasileira de tecnologia com sede em São Paulo. Fundada em 2010, a empresa oferece uma ampla gama de soluções de infraestrutura e pagamentos digitais para empresas de todos os portes.A Núclea é uma empresa comprometida com a responsabilidade social e ambiental. A empresa acredita que a tecnologia pode ser usada para promover o desenvolvimento sustentável e a inclusão social.Para todas as posições consideramos DIVERSIDADE E INCLUSÃO!Se você é apaixonado(a) por tecnologia, quer fazer a diferença na vida das pessoas e acredita em um futuro mais eficiente e inclusivo, a Núclea é o lugar certo para você. Essa é a chance para você mudar a sua vida, corra e se inscreva!Responsabilidades e atribuiçõesSugerir soluções tecnológicas e inovadoras, baseando-se nas melhores práticas de mercado, arquiteturas de referência, todas as políticas da CIP de segurança, riscos, controles Internos, TI e padrões, garantindo disponibilidade, escalabilidade, alta performance e a segurança para o negócio;Orientar e capacitar sobre aspectos técnicos e de negócios, disseminando conhecimento, garantindo a qualidade do software e assegurando a continuidade do negócio com base na metodologia utilizada;Apoiar Analistas de Sistemas TI nas definições técnicas, através de reuniões, levantamento de dados e análise de impacto garantindo a qualidade e coerência dos requisitos;Garantir a qualidade dos softwares implementando as melhores práticas de testes de software, junto a equipe de Qualidade Assegurada (QA) para correção de falhas, erros e defeitos com o objetivo de verificar e validar a entrega dos produtos finais clientes e áreas de Atendimento ao Cliente;Sustentar e apoiar equipes de infraestrutura e suporte, em momentos de crise, através de validações sistêmicas, checagem de ambiente, análise de logs e de negócio, com o objetivo de restabelecer a saúde do ambiente. Acompanhar e apoiar a execução das mudanças através de conferências, validando a efetividade dos procedimentos e garantindo que o objetivo proposto foi atingido;Garantir a gestão de configuração através do controle das releases e promoção dos pacotes, utilizando as ferramentas disponibilizadas pela Área de Qualidade, garantindo a evolução, integridade e continuidade do código-fonte dos produtos;Suporte as áreas de Atendimento ao Cliente e Líder de sistemas através do atendimento de eventos e incidentes a fim de atender as dúvidas, problemas e demais solicitações.Requisitos e qualificaçõesFormação Acadêmica: Ensino Superior Completo - Administração de Empresas, Ciências da Computação, Economia, Engenharia Java SE, Java EE, JUnit - Avançado Spring - Avançado Banco de Dados (DML, DDL, Oracle, SQL, DB2, PostgreSQL) - Avançado Controlador de Versão (SVN, RTC, GIT) - Avançado XML, XSD, Json - Avançado Modelagem de dados - Avançado Websphere Application Server, JBoss, Websphere MQ – Intermediário Maven, Nexus, Jenkins, Sonar, Docker - Intermediário Python, Shell Script - Intermediário RUP, UML - Intermediário Webservice (SOA, REST) – Intermediário Springboot/Microsserviços/Rest - Intermediário Sistema Operacional (Linux, UNIX,) - Básico HTML, JavaScript, CSS, Wicket - Básico Connect Direct, XFB, CFT - Básico AWS – Básico Metodologia ágil/Scrum Pacote Office  Conhecimentos desejáveis (opcionais) Segurança (Criptografia, Certificado Digital, Protocolo SPB) Negociação Teste de Perfomance Angular, Javascript, Typescript Meios de pagamentos  Informações adicionaisModelo de Trabalho Home First ( Maior parte Home Office com frequência mínima quinzenal no escritório).Salário compatível com o mercado - CLTBenefícios:Convênio Médico e OdontológicoVale Refeição/ Alimentação - CajuSeguro de VidaAuxilio educaçãoAuxilio homefirstAuxílio CrechePLR",Núclea,vacancy_type_effective,,False,São Paulo,São Paulo,Brasil,https://nuclea.gupy.io/job/eyJqb2JJZCI6NzMwNjU1Mywic291cmNlIjoiZ3VweV9wb3J0YWwifQ==?jobBoardSource=gupy_portal,True,hybrid,True
7305652,2024-06-13T17:03:27.353Z,Pessoa Desenvolvedora Frontend - Pleno ,"A FCamara está em busca de uma Pessoa Desenvolvedora Frontend - Pleno para atuar em uma das maiores empresas da América Latina líder no mercado em exames diagnósticos clínicos.Responsabilidades e atribuiçõesRequisitos e qualificaçõesHard Skills:﻿Conhecimentos em HTML e HTML5Conhecimentos em CSS e SASS (Flexbox, Grids, MediaQueries)Conhecimentos em Javascript e jQueryConhecimentos em WordpressConhecimentos em GraphQLConhecimentos avançados de ReactJS e React Hooks (useState, useEffect, useContext, etc.)Conhecimentos em estilização com Styled ComponentsExperiencia com bibliotecas como BootstrapGerenciadores de pacotes como Yarn, NPM, GulpUtilização do Figma para as interfacesConhecimentos de CI/CD (Jenkins e Docker)Informações adicionaisDIFERENCIAISConhecimento de GatsbyJS",VENHA SER #SANGUELARANJA 🧡🚀,vacancy_legal_entity,,True,,,Brasil,https://fcamara.gupy.io/job/eyJqb2JJZCI6NzMwNTY1Miwic291cmNlIjoiZ3VweV9wb3J0YWwifQ==?jobBoardSource=gupy_portal,True,remote,True
7298494,2024-06-13T16:47:11.856Z,Desenvolvedor Front End Pleno (App e Web),"A Leega é uma empresa focada no atendimento eficiente e inovador em seus clientes. Isso não poderia ser diferente com o nosso principal combustível: as pessoas!  Nossa cultura é inspiradora e nossos valores estão presentes no dia a dia: ética e transparência, excelência de qualidade, trabalho em equipe, responsabilidade econômica, social e ambiental, relações humanas e credibilidade.Buscamos profissionais inovadores que sejam movidos por desafios e focados em resultados.Se você busca uma empresa dinâmica e parceira e que investe em seus colaboradores através de capacitação constante, a Leega é o lugar para você!Ficaremos muito felizes em ter você em nosso time. Venha fazer parte da nossa história e da construção do nosso futuro. Cadastre-se agora mesmo em nossas vagas!Responsabilidades e atribuiçõesColaborar com equipes multifuncionais para definir, projetar e lançar novos recursos.Elaborar e conduzir refinamentos técnicos de demandas trazidas pelo time de produtos;Atuar na manutenção da saúde e qualidade do codebase, equilibrando novas funcionalidades com resolução de débitos técnicos;Atuar na manutenção dos testes automatizados, incluindo criação de novos;Orientar desenvolvedores de menor senioridade e auxiliar no desenvolvimento destes;Traduzir designs em código de alta qualidade.Ser o guardião do fluxo de release da App Livelo;Participar das cerimônias junto com os demais integrantes da equipe.Requisitos e qualificaçõesExperiência em desenvolvimento de aplicativos/front-end com React Native e React;Experiência com Javascript/Typescript;Experiencia com Next.js, React Hooks, Styled Components, Axios;Experiência com Git e Versionamento de Código;Experiência com Testes Unitários (Jest) e TDD;Experiência com Html e CSS;Experiência com arquitetura de Microfrontend (MFE)Conhecimento de Clean Code, Clean Architecture e Modularização;Gerenciamento de memória;Persistência de dados;Firebase (Remote Config);Boas práticas de código, documentação e desenvolvimento de telas e componentes;Experiência com em metodologias ágeis;Experiência com Selenium + Cucumber ou framework semelhante para testes automatizados;Excelentes habilidades para resolução de problemas e atenção aos detalhes;Estar disposto a buscar novos conhecimentos e encarar novos desafios;Diferencial:Conhecimento das ferramentas Grafana e Dynatrace;Experiência com Java 17 (11, 8), Spring Boot e Hibernate;Experiência com NodeJS + NestJS;Experiência Bancos de Dados (SQL e NoSQL);Informações adicionaisProfissional seguirá o calendário de SPModelo de trabalho: Remoto ",Leega Consultoria,vacancy_type_effective,,True,,,Brasil,https://leega.gupy.io/job/eyJqb2JJZCI6NzI5ODQ5NCwic291cmNlIjoiZ3VweV9wb3J0YWwifQ==?jobBoardSource=gupy_portal,False,remote,True
7277741,2024-06-13T15:46:46.852Z,PESSOA DESENVOLVEDORA PLENO MOBILE,"Nós somos a Quality Digital! Saiba mais sobre a gente:Uma frase que nos define - Somos especialistas em soluções de TI e apaixonados por inovação! 🚀Ao infinito e além - Somos #semfronteiras. Nosso time está espalhado pelo Brasil e pelo mundo 🌎Nossa cultura - Mesmo distantes, estamos juntos 🧡 Temos cerimônias para estarmos mais próximos, compartilhar conhecimento e ficar por dentro das novidades da nossa empresa!Somos diversos - Um dos nossos compromissos é fazer da companhia um ambiente cada vez mais diverso, inclusivo e respeitoso, valorizando e promovendo a pluralidade. Por isso, aqui temos espaço para todas as pessoas, independente de raça, gênero, idade, orientação sexual, crença religiosa ou deficiência. 🏳️‍🌈👩🏾‍🦽Nosso objetivo - Potencializar os negócios dos nossos clientes através de soluções inovadoras e sustentáveis. Topa vir com a gente nessa? 🎯Responsabilidades e atribuiçõesO que buscamos? Um profissional comprometido, com bom relacionamento e comunicação para atuar em um time de App mobile de uma rede de varejo.Como será o seu dia a dia: Criar testes unitários e de integração de baixa complexidade, bem como identificar oportunidades de melhorias e inclusão de testes em soluções previamente criadas;Apoiar o time na identificação de problemas e propor formas de solucioná-los;Conhecer a saúde dos projetos em que está atuando e tentar identificar possíveis pontos de falha antecipadamente;Aplicar os conceitos e práticas de segurança;Começará a conhecer sobre métricas e como identificar e traduzir modelos arquiteturais;Visão de feature e quebrá-la em partes menores para que seja executada por si ou outra pessoa;Apoiar o time sempre que solicitado;Apoiar as iniciativas que envolvem o time, liderando cerimônias e fórum necessários para seu desenvolvimento profissional e do grupo.Requisitos e qualificaçõesConhecimento em:Desenvolvimento de sistemas;Padrões e práticas de frontend e backend;Práticas de segurança e performance para Aplicativos;Desenvolvimentos de NodeJs, React Native, Angular, GraphQL e Maven;Design patterns;Testes unitários e conhecimento em Logs no DataDog, Git;Experiência com banco de dados;Conhecimento em SOLID, Clean Code e SCRUM;Experiência em Vtex.Serão diferenciais Experiência com Firebase.OBS.: Hey! Caso você não preencha todos os requisitos da vaga, te convidamos a se candidatar mesmo assim, ok? Faremos uma análise cuidadosa do seu perfil considerando todas as suas qualificações 😉Informações adicionaisO que você vai encontrar aqui:Um ambiente propício para aprendizado e crescimento profissional 🎯Avaliação de desempenho e feedbacks, visando o desenvolvimento contínuo das nossas pessoas 📊Vale alimentação e/ou refeição para suas compras de mercado e refeições 🍴Assistência médica e odontológica para que você e sua família estejam com a saúde em dia 💙Convênio com farmácias para descontos em medicamentos 💊Auxílio creche de acordo com política vigente 🍼Convênio academia para te incentivar a se exercitar 🤸‍♀️🤸‍♂️Parceria com o SESC para programações variadas de cultura e lazer ✈Parcerias para seus estudos de idiomas, tecnologia e plataforma de cursos 📚Empréstimo consignado com taxas atrativas + programa de educação financeira 💰Universidade Corporativa e trilhas de conhecimento com conteúdos diversos de tecnologia, soft skills, tendências de mercado e muito mais 👨‍💻Programa de Indicações com possibilidade de prêmios e bonificações 🎁 Seguro de vida coletivo ⛑",Quality Digital,vacancy_type_effective,,True,,,Brasil,https://qualitydigital.gupy.io/job/eyJqb2JJZCI6NzI3Nzc0MSwic291cmNlIjoiZ3VweV9wb3J0YWwifQ==?jobBoardSource=gupy_portal,False,remote,True
7305385,2024-06-13T15:28:46.285Z,Desenvolvedor FullStack - Pleno/Senior,"﻿Nosso time é composto por pessoas especializadas na construção de produtos e soluções tecnológicas, capacitadas para desenhar a melhor abordagem e implementação para nossos clientes. Nossos profissionais atuam em todo o ciclo de vida da solução, desde o planejamento, design e dimensionamento das demandas, passando pela implementação, testes, até o monitoramento e manutenção no ambiente produtivo. Características predominantes da equipe: Equipe acolhedora, solidária, com foco no resultado.Responsabilidades e atribuiçõesResponsabilidadesDesenvolver e manter aplicações web e mobile utilizando Vue.js e React Native.Projetar e implementar APIs e serviços backend com Node.js, garantindo alta performance e escalabilidade.Utilizar Docker para criação e gerenciamento de contêineres e Kubernetes (K8) para orquestração de contêineres.Trabalhar com bancos de dados MySQL e MongoDB, garantindo a integridade e eficiência dos dados.Desenvolver e manter arquiteturas baseadas em micro serviços, garantindo comunicação síncrona e assíncrona eficiente.Escrever e manter testes unitários e testes de ponta a ponta (E2E).Requisitos e qualificaçõesRequisitosExperiência comprovada como desenvolvedor full stack.Experiência com Docker e Kubernetes para conteinerização e orquestração.Conhecimento sólido de bancos de dados MySQL e MongoDB.Experiência com Redis.Familiaridade com serviços da AWS, incluindo EC2, S3, Lambda e RDS.Conhecimento prático de MQTT, RabbitMQ e Amazon SQS.Experiência com arquiteturas de micro serviços.Competência na escrita de testes unitários e E2E para garantir a qualidade do código.Será um diferencial se você tiverCertificações em tecnologias relacionadas, como AWS Certified Developer, Docker Certified Associate, etc.Experiência com outras linguagens de programaçãoExperiência com aplicações mobile nas principais plataformas (Apple Store e Play Store)Conhecimento em práticas de DevOps e CI/CD.Experiência em metodologias ágeis e ferramentas de gerenciamento de projetos, como Jira.Informações adicionaisContratação: PJRemotoFull time",confidencial2024,vacancy_type_autonomous,2024-06-30T00:00:00.000Z,True,,,Brasil,https://confidencial2024.gupy.io/job/eyJqb2JJZCI6NzMwNTM4NSwic291cmNlIjoiZ3VweV9wb3J0YWwifQ==?jobBoardSource=gupy_portal,True,remote,True
