job_id,published_date,title,description,career_page_name,type,application_deadline,is_remote_work,city,state,country,job_url,disabilities,workplace_type,submitted
6690596,2024-01-30T17:07:02.508Z,Senior Back end Developer [JAVA] ,"Quem somos:A Dentsu World Services (DWS) é parte do grupo Dentsu, presente em mais de 140 países e conta com mais de 50.000 pessoas comprometidas com nossa missão. No Brasil, em Porto Alegre/RS, atuamos como centro de tecnologia, inovação e design do grupo. Possuímos parceria com diversas agências do grupo e estamos empenhados em entregar soluções criativas e inovadoras aos nossos clientes, atendendo a projetos de desenvolvimento web e mobile. Embora tenhamos nosso escritório físico, por acreditarmos numa conexão sem fronteiras, temos pessoas espalhadas por todo o país que compões os times da DWS Brazil.Os DWSianes se integram a times multiculturais e que contam com pessoas de diversos países, levando o trabalho em grupo a um nível mais elevado e significativo. Assim, a diversidade de ideias contribui para a construção de tecnologias que revolucionam o mercado. Muitos desafios, aprendizado e crescimento esperam você na DWS Brazil!#vemserumDWSiane Estamos em busca de uma pessoa desenvolvedora back end em JAVA para apoiar no desenvolvimento de nossas soluções.Responsabilidades e atribuiçõesComo será sua rotina?Você será responsável por:Desenvolver soluções utilizando JavaEE e spring boot; Analisar, desenvolver e testar aplicações, utilizando metodologia e procedimentos adequados para sua implantação;Desenvolver, integrar manter APIs para integração de Sistemas;Apoiar nas definições técnicas e funcionais embasadas nas necessidades de negócioDocumentar todo o processo de desenvolvimento do código; Criar relatórios de status e possíveis problemas para o Project Manager;Participar de reuniões técnicas e cerimônias do projeto.Requisitos e qualificaçõesPara essa posição é importante que você tenha:﻿Experiência com programação em Java (JDK);Domínio de conceitos para programação orientado a objetos;Experiência com conceito de padrões de arquitetura;Conhecimento em GIt ou Subeversion;Habilidades com frameworks open source (Hibertnate, Velocity, etc);Conhecimento em aplicações Web e protocolos HTTP;Experiência com banco de dados relacionais (Oracle, MySQL, etc);Experiência com pelo menos um IDE (Eclipse, Intellij IEDA, etc);Experiência com Gradle, Mavel ou ANT e integração contínua; Conhecimento em conceitos ORM ou experiência com implementação (Hibernate ou outra JPA);Conhecimentos no idioma inglês, comunicação verbal e escrita em nível avançado.Informações adicionaisAqui você vai encontrar (Nossos benefícios):Todo o equipamento necessário para seu trabalho (notebook e periféricos);Plano de saúde e odontológico;Seguro de vida;Mental health program;Anywhere office - flexibilidade para trabalhar de onde precisar;VR/VA (cartão de benefícios Flash);Auxílio home office (cartão de benefícios Flash);Auxílio mobilidade (cartão de benefícios Flash);Programa de mentoria para desenvolvimento e acompanhamento de carreira;Participação nas tracks de desenvolvimento (investimento em cursos e etc) e acesso a nossa plataforma gratuita com muitos cursos para self Learning; Aulas de inglês com professor particular; Awesomeness Committee - envio de mimos temáticos e exclusivos; Gympass; Horário flexível (40h semanais); Day off no dia do aniversário; Appreciation - Programa de reconhecimento com possibilidade de doar e receber 'dentsu dolars' mensalmente; Atuação 100% remota ou híbrida (a sua escolha).",Dentsu World Services Brazil,vacancy_type_talent_pool,,True,,,Brasil,https://dwsbrazil.gupy.io/job/eyJqb2JJZCI6NjY5MDU5Niwic291cmNlIjoiZ3VweV9wb3J0YWwifQ==?jobBoardSource=gupy_portal,True,remote,True
6689822,2024-01-30T16:47:54.681Z,Desenvolvedor Back-end Pleno,"Sobre o Reclame AQUIO Reclame AQUI é a maior plataforma de solução de conflitos entre consumidores e empresas da América Latina! Durante 20 anos de história, temos ajudado a tornar mais simples, fácil e transparente esse relacionamento. Todos os dias, recebemos a visita de milhões de consumidores que pesquisam a reputação e o atendimento das marcas e as experiências de outros consumidores.Somos referência em reputação e confiança nas relações de consumo! Além de um grande gerador de dados, com informações valiosas e únicas de jornadas e experiências de compra que contribuem, inclusive, para que as empresas evoluam no seu processo de atendimento.#VemSerRA #QueroCrescerComRA #oRAéMeuLugar Trabalhamos com pessoas que:- Querem mudar o mundo e gostam de ajudar as pessoas;- Pensam diferente, mas respeitam as diferenças;- Sejam criativas para solucionar e superar os desafios do dia a dia;- Não têm medo de mudanças;- Sabem o seu valor e são gratas;- Acreditam que através da confiança, reputação e transparência é possível melhorar as relações de consumo.Aqui nossos colaboradores são protagonistas e têm a liberdade de criar, transformar, compartilhar, aprender e é isso que nos faz SER FODA! Por isso, todo mundo que entra para nosso time, se torna um Trustmaker!Como diz nosso primeiro mandamento, ""As empresas são feitas por pessoas"", e aqui no RA a gente tem o compromisso de respeitar a pluralidade da nossa gente e tornar a nossa empresa cada vez mais representativa. Sendo assim, buscamos contratar pessoas independente de gênero, raça, idade, orientação sexual ou deficiência. #EuSouRA #RASouEuResponsabilidades e atribuiçõesQual a missão do cargo?Garantir o resultado desenvolvimento dos softwares/aplicativos conforme o projeto em andamento, assegurando que os processos de desenvolvimento sejam assertivos e atinjam o objetivo traçado, visando atender às necessidades dos clientes internos e externos.Quais serão suas responsabilidades?- Escrever consistentemente código pronto para produção que é facilmente testável, facilmente entendido por outros desenvolvedores e que leva em conta os casos extremos e os erros;- Entender quando é apropriado deixar comentários, mas tende para o código auto documentado; - Compreende a pirâmide de testes e escreve testes de unidade, bem como testes de nível superior de acordo com ela. Sempre escreve testes para lidar com casos de borda e erros esperados normalmente, bem como caminhos felizes; - Proficiente no uso de depuração sistemática para diagnosticar todos os problemas localizados em um único serviço. Usa depuração sistemática para diagnosticar problemas entre serviços, às vezes com a ajuda de engenheiros mais experientes. Requisitos e qualificaçõesO que esperamos de você?- Experiência em Java, Spring Boot ou Quarkus;- Kubernetes;- Cloud (GCP, AWS ou WIS);-Buscar desenvolvimento contínuo de novas linguagens como GoLang e etc. Informações adicionaisQuais são os nossos benefícios?🩺 Plano de Saúde🦷 Plano Odontológico❤️ Seguro de Vida🍔 Vale Refeição 🛒 Vale Alimentação 💻 Home Office🏡 Auxílio Home Office 🍼 Auxílio Creche🥳 Day off no aniversário💰 Empréstimo Consignado💵 PLR💙 Apoio médico, psicológico e nutricional🎓 UnicoSkill🏋️ Gympass",Reclame AQUI,vacancy_type_effective,,True,,,Brasil,https://reclame-aqui.gupy.io/job/eyJqb2JJZCI6NjY4OTgyMiwic291cmNlIjoiZ3VweV9wb3J0YWwifQ==?jobBoardSource=gupy_portal,True,remote,True
6693026,2024-01-30T20:55:43.158Z,Full Stack Developer Sr,"Nosso time Tech está crescendo! Venha fazer parte.Como Pessoa Desenvolvedora Full Stack você fará parte do nosso time de Tecnologia.  Será responsável por desenvolver e testar funcionalidade, componente e sistemas. Responsabilidades e atribuiçõesEm seu dia a dia, você será responsável por trabalhar com:Desenvolvimento de funcionalidades e soluções back-end;Implementação e manutenção de APIs (Application Programming Interfaces) para integração com sistemas externos.Escrever o código, realiza testes unitários e integração para garantir a qualidade do código.Colaboração com a equipe de front-end e outros desenvolvedores para garantir a integração correta dos sistemas.Resolução de problemas e depuração de código.Documentação do código e das soluções desenvolvidas.Acompanhamento das tendências e melhores práticas do desenvolvimento back-end.Requisitos e qualificaçõesPara essa vaga é necessário ter os seguintes conhecimentos:Linguagens de Programação:  - C# &gt; Avançado - JavaScript &gt; Avançado - HTML5, CSS3 &gt; Avançado  Frameworks:  - Blazor &gt; Básico - Razor &gt; Intermediário- React &gt; Intermediário - MVC 5.0 ou Superior &gt; Avançado - .NET 6.0 ou Superior &gt; Avançado - Scrum  Banco de Dados:  - SQL Server &gt; Intermediário - MongoDB &gt; Intermediário - CosmosDB &gt; Intermediário  Softwares e IDE´s:  - Visual Studio 2022 (superior) &gt; Intermediário - Visual Code &gt; Intermediário Demais conhecimentos:  - Clean Architecture &gt; Intermediário  - Github &gt; Intermediário Diferencial:CI/CDInformações adicionaisEtapas do Processo SeletivoPrezamos por um processo seletivo eficiente e descomplicado. Para essa vaga são essas etapas:-Inscrição/triagem;-Bate Papo com Gente &amp; Gestão;-Bate Papo Técnico com a Liderança Direta;Local:Nosso time de tecnologia trabalha remotamente, mas se você precisar ir ao escritório, estamos em São Paulo, Vila Olímpia.Benefícios:-Vale Refeição/Alimentação flexíveis - cartão Swille;-Assistência Médica;-Assistência Odontológica-Seguro de Vida;-Auxílio home office;-TotalPass;-Vittude;-Benefício dia do profissional de consórcio;-Taxa 0% em nossos produtos ( somente para colaboradores);-PPR - de acordo com metas estabelecidas no programa anual.E mais...-Parceria com instituição de ensino com desconto para cursos de Pós graduação;-Parceria com Sesc.",Mycon,vacancy_type_effective,,True,,,Brasil,https://mycon.gupy.io/job/eyJqb2JJZCI6NjY5MzAyNiwic291cmNlIjoiZ3VweV9wb3J0YWwifQ==?jobBoardSource=gupy_portal,True,remote,True
6672420,2024-01-30T20:41:26.188Z,Desenvolvedor(a) Full Stack .Net PL/SR,"O propósito é o que nos guia e nos faz avançar! Conectar o nosso propósito ao seu é o que transforma a pecuária de ponta a ponta. Por isso, queremos catalisar a transformação tecnológica no agronegócio brasileiro e mundial com informação de confiança que gera sustentabilidade e inteligência estratégica. 🚀🐂Se você quer crescer junto com a gente, tem uma oportunidade que pode ser para você!Estamos com vaga para Desenvolvedor Full Stack .NET, confira logo abaixo as informações! 👇Responsabilidades e atribuiçõesDesenvolver aplicações com as tecnologias da framework .NET (ASP, C#, Core, WPF, Windows Forms);Atuar em melhoria de performance e correções de bugs das aplicações .NET;Gerar relatórios com ferramentas de design de relatórios da Ponta e consultas em SQL;Desenvolver APIs REST para aplicações backend com autenticação usando JWT e com documentação embarcada Swagger;Documentar aplicações em código, readme (markdown), diagramas (se complexo).Requisitos e qualificaçõesPara isso, é importante que você tenha conhecimento em:Framework NET Core MVC e ASP.MVC;Orientação a Objetos e Padrões de Projetos;Versionamento com GIT;Intermediário de SQL;Framework Net Core MVC 3.1;Scrum / Kanban (Jira).E será considerado diferencial se você tiver conhecimento em:Javascript;SQLFramework;ASP.MVC (Net Framework);Desktop WPF (MVVM) (Net Framework);MicroORM Dapper;PostgreSQL; SQLite;Visual Studio 2022;Linux Server e Windows Desktop;Documentação com Confluence.Informações adicionaisInformações:👩‍💻 Local de trabalho: Home Office👉 Modelo de Contrato: CLTNossos benefícios são incríveis, olha só! 👇🍕 Vale Alimentação/Refeição no cartão Flash: você escolhe se vai usar no mercado ou em restaurantes;💰 Ajuda de Custo Home Office;🔒 Seguro de Vida;🏥 Plano de Saúde;🦷 Plano Odontológico;🥳 Dayoff no mês do aniversário + um crédito no cartão Flash de presente pra aproveitar da forma como quiser!;🧘 Gympass: Pra você e seus dependentes cuidarem da saúde física e mental;🎯 E a chance de você crescer aqui dentro é grande: temos plano de carreira!Deu match? Então se inscreve aí! 💚#VemPraPonta",Ponta,vacancy_type_effective,2024-02-18T00:00:00.000Z,True,,,Brasil,https://vempraponta.gupy.io/job/eyJqb2JJZCI6NjY3MjQyMCwic291cmNlIjoiZ3VweV9wb3J0YWwifQ==?jobBoardSource=gupy_portal,True,remote,True
6678283,2024-01-30T19:00:06.322Z,Desenvolvedor Full Stack Senior,"Somos uma startup apaixonada por tecnologia, inovação e pessoas!Desenvolvemos uma plataforma que ajuda as empresas a planejar, monitorar e automatizar o seu supply chain global. Organizamos as informações do comércio global e transformamos a maneira como as empresas fazem negócios.A LogComex está voando!!! Atualmente, já somos mais de 300 Loggers! Acreditamos que a tecnologia é o meio para conectar o mundo. Somos autoridade e referência naquilo que fazemos. Somos a tecnologia que move o comércio global. E aí, topa revolucionar o comércio exterior com a gente?Responsabilidades e atribuiçõesVocê irá...Manter o funcionamento dos sistemas em produção;Realizar manutenções no sistema;Desenvolvimento com testes unitários;Desenvolver e implementar em PHP, Python e VueJS;Utilizar Framework Laravel e Lumen;Desenvolver novos produtos utilizando estrutura de micro serviços;Desenvolvimento de código com alta disponibilidade;Utilizar Docker para fazer conteinerização de ambiente de desenvolvimento;Utilizar o Git para versionamento de código;Trabalhar com o Jira;Utilizar metodologias ágeis para apoiar as atividades;Requisitos e qualificaçõesProcuramos pessoas com conhecimento em...Conhecimento na linguagem de programação PHP básico;Experiências com integração por API'S.Será legal se você conhecer...Framework Laravel;Banco de dados Postgres;Docker, Node.js e Vue,js.Informações adicionaisNossos Benefícios:💻Auxílio Home Office 🚌Vale transporte;🥗Vale refeição R$ 40,00;🤩Plano de saúde Unimed com abrangência Nacional; 😁Plano odontológico Odontoprev; 📘Inglês in company;🎭Vale Cultura;❤️Seguro de vida - Bradesco; 🏊‍♀GymPass;🧠Keikein (plataforma de apoio psicológico e nutricional);💊Convênio farmácia Panvel;🤑Empréstimo pessoal pela Creditas;🤰Programa Empresa Cidadã; Mimos: (sim, porque somos destes!) ⏰Horário flexível (para estimular sua qualidade de vida);🎓Desconto em instituições de ensino;🍎Frutas para consumo na empresa;🎮Ambiente descontraído, cheio de desafios e campeonatos de videogame;👕Sem dress code: aqui você pode ser você;💆Massagem in company;🏖️Day off de aniversário;🎁Presente de aniversário;🏆Presentes incríveis a cada ano de Logger;🤝Recruta Loggers (programa de indicação com bonificação $).",Logcomex,vacancy_type_effective,,True,,,Brasil,https://logcomex.gupy.io/job/eyJqb2JJZCI6NjY3ODI4Mywic291cmNlIjoiZ3VweV9wb3J0YWwifQ==?jobBoardSource=gupy_portal,False,remote,True
6689178,2024-01-30T16:15:52.548Z,Pessoa Desenvolvedor Full Stack Node/React - SENIOR,"A FCamara está em busca de uma Pessoa Desenvolvedor Full Stack Node/React, para atuar em um de nossos clientes do segmento Health, uma empresa que tem uma rede de centros médicos que oferece consultas médicas, exames e serviços de saúde. Uma empresa inovadora, moderna, atrelada à tecnologia, que proporciona a seus mais de 1000 Profissionais de Saúde ganhos de eficiência, produtividade e desfecho clínico.Responsabilidades e atribuições- Criar funcionalidades de grande escala pensando na performance e segurança;- Avaliar e discutir requisitos;- Apoiar o time tecnicamente quando necessário;Experiência com as seguintes ferramentas:- Desenvolvimento de aplicações NodeJS/TypeScriptt- Conhecimento de Frameworks como Express e NestJS- Conhecimentos em bancos de dados SQL e NoSQL- Desenvolvimento com SPA React JS- Vivencia em frameworks ágeis Requisitos e qualificaçõesDesejáveis:- Conhecimento com Docker- Conhecimentos em Aplicativos- Conhecimentos Arquitetural de Plataforma- Atenção para qualidade de código e design patterns;- Conhecimentos de conceitos de Cloud como Orquestrador, Buckets, Pipeline, VM, Mensageria e Funtions- Conhecimento de serviços GCP como VM, PubSub, Cloud Build etc.",VENHA SER #SANGUELARANJA 🧡🚀,vacancy_type_effective,,True,,,Brasil,https://fcamara.gupy.io/job/eyJqb2JJZCI6NjY4OTE3OCwic291cmNlIjoiZ3VweV9wb3J0YWwifQ==?jobBoardSource=gupy_portal,True,remote,True
6686908,2024-01-30T21:33:15.346Z,FullStack Developer,"¡Sé parte de Stefanini!​En Stefanini somos más de 30.000 genios, conectados desde 41 países, haciendo lo que les apasiona y co-creando un futuro mejor.​Responsabilidades y atribucionesResponsabilidades:   Programación Funcional·      Java Intermedio JDK&gt;8·      Spring Framework&gt;4·      Spring Boot//Microservicios·      Spring MLI·      Arquitectura de microservicios/Patrones·      Gitlab·      Jenkings/Jfrog/SonaQube·      Node JS/NPM·      Metodologías Ágiles/Scrum/Jira/Confluence·      Base de datos Oracle/sqlserver/Mongo·      Docker·      SSH·      OpenSSL       GitRequisitos y calificacionesImportante contar con: Conocimiento en sprint framework Conocimiento en Spring bootConocimiento en sprint en MLI WebsphereMobil React Native ﻿ node, Kafka, Kubernetes  Docker LinuxInformaciones adicionalesResolución de problemasPensamiento crítico y creativoProactivoEmpático",STEFANINI LATAM,vacancy_type_effective,,False,Cdmx,,México,https://stefaninilatam.gupy.io/job/eyJqb2JJZCI6NjY4NjkwOCwic291cmNlIjoiZ3VweV9wb3J0YWwifQ==?jobBoardSource=gupy_portal,True,hybrid,True
6693059,2024-01-30T21:01:18.635Z,Senior Software Engineer - Fullstack ,"A Kanastra provê serviços pautados em soluções com software e produtos em nuvem, focado em fluxos de integrações e interfaces que simplificam a operação da infraestrutura de fundos de investimentos em ativos alternativos.O time de data products &amp; platform tem um papel chave na macro arquitetura de sistemas da Kanastra, provendo produtos e serviços de dados. Essa posição integrará esse time garantindo que a squad tenha autonomia para realizar entregas de produtos digitais de ponta a ponta (complementando com conhecimentos de backend e frontend principalmente).Nosso processoAplicaçãoEntrevista com peopleAplicação de teste (ao vivo)Entrevista de fit culturalEntrevista com o hiring managerOferta de empregoResponsabilidades e atribuiçõesDesenvolver componentes de software a partir de problemas e metas alinhados com stakeholders dentro da organização.Registrar, planejar e desenhar as soluções propostas em conjunto com o planejamento da equipe.Prover suporte de alto nível para entender, alinhar e corrigir bugs e erros que venham a acontecer nas soluções implementadas.Aderir às nossas melhores praticas das metodologias de desenvolvimento, documentação, implementação e comunicação dentro da organização.Permear uma cultura inclusiva, ouvindo e aportando feedback, e ajudar o desenvolvimento de membros com menos experiência na equipe.Requisitos e qualificaçõesExperiencia desenvolvendo API's REST, preferencialmente com Python ou PHP ou TypeScript/JavaScript.Conhecimentos de JavaScript, idealmente experiencia com React.js.Sólidos conhecimentos em Git, idealmente usando GitHub.Experiencia com domain-driven design.Experiencia utilizando banco de dados relacionais e não relacionais.Hábito de escrever testes de integração e unitários.Saber trabalhar com Continuous Deployment.Conhecer e utilizar Docker (containerização).Fundamentos sólidos em programação imperativa e orientada a objetos.Fundamentos sólidos em algoritmos e estrutura de dados.Se espera que o candidato tenha experiencia desenvolvendo APIs REST e consumindo essas APIs usando JavaScript em uma Single Page Application.Habilidade de tomar requisitos em aberto e ambíguos e transformá-los em uma solução dentro da aplicação.Conhecimentos básicos de Machine Learning e algoritmos de inteligencia artificialConhecimentos básicos sobre Prompt Engineering e funcionamento em alto nível de Large Language ModelsConhecimentos profundos em FastAPI/Python, Django/Python, e Laravel/PHPPrática com Google Cloud Provider e Cloud RunConhecimento em Linux Shell ScriptingImprescindível conhecimentos em JS, preferencialmente React.JsInformações adicionaisVaga híbrida para as cidades de Uberlândia/MG e São Paulo/SP",Kanastra ,vacancy_type_effective,,False,Uberlândia,Minas Gerais,Brasil,https://kanastra.gupy.io/job/eyJqb2JJZCI6NjY5MzA1OSwic291cmNlIjoiZ3VweV9wb3J0YWwifQ==?jobBoardSource=gupy_portal,False,hybrid,True
6690704,2024-01-30T19:18:33.249Z,Pessoa Desenvolvedora Fullstack Senior,"A FCamara está em busca de uma Pessoa Desenvolvedora FullStack Senior para atuar em parceria com uma empresa do segmento de Varejo dentro do setor de Utilidades, com o objetivo de dar apoio em todos os sistemas no que tange a arquitetura e desenvolvimento.Responsabilidades e atribuições Desenvolvimento de sistemas; Code review; Refinamento técnico; Planejar e coordenar atividades técnicas; Promover inovação tecnológica; Definição de novas arquiteturasRequisitos e qualificaçõesHard Skill: Maven, TFS, Bitbucket, HTML 5, CSS 3, Angular, Angular, Java, Websphere e API RestSoft Skill: - Participar de reuniões técnicas para passagem de informações para os clientes- Experiência em projetos ágeisInformações adicionais",VENHA SER #SANGUELARANJA 🧡🚀,vacancy_type_outsource,,True,,,Brasil,https://fcamara.gupy.io/job/eyJqb2JJZCI6NjY5MDcwNCwic291cmNlIjoiZ3VweV9wb3J0YWwifQ==?jobBoardSource=gupy_portal,False,remote,True
6687331,2024-01-30T19:04:31.249Z,Pessoa Desenvolvedora FullStack Sênior,"A FCamara está em busca de uma pessoa Desenvolvedora Fullstack React e Node, para atuar em parceria com uma grande plataforma digital de serviços educacionais ( EdTech ) com múltiplos produtos e serviços para consumidores, a qual oferta com rapidez e eficiência nno ensino voltado a medicina.Responsabilidades e atribuições•	Desenvolvimento de aplicações Full Stack;•	Manutenção de sistemas de integração para correção de falhas/erros;•	Implementação de melhorias;•	Atuar como parte da equipe ágil;•	Desenvolver, implantar e operar aplicações na cultura DevOps;•	Otimizar a aplicação para melhor velocidade e escalabilidade;•	Garantir a validação dos dados fornecidos pelos usuários;•	Criar código e bibliotecas reutilizáveis para uso futuro;•	Colaborar com outros membros da equipe, Engenheiros, PO, QA, Designers, Scrum Master e Tech Leader para resolver os desafios existentes.Requisitos e qualificaçõesHard Skills•	Fortes atuação com as tecnologias com back-end Node com express e com front-end React e NetJs;•	Experiência com Mensageria;•	Desejável algum conhecimento de Go e SolidJS•	Vivência como versionamento Git, utilizando o GitFlow para organização dos códigos;•	Experiência com TDD para testes unitários e de integração;Soft Skills• Boa Comunicação• Criatividade• Colaboração• Pensamento Crítico• Autonomia• Trabalho em Equipe• Gestão de Tempo• ProtagonismoInformações adicionais",VENHA SER #SANGUELARANJA 🧡🚀,vacancy_type_outsource,,True,,,Brasil,https://fcamara.gupy.io/job/eyJqb2JJZCI6NjY4NzMzMSwic291cmNlIjoiZ3VweV9wb3J0YWwifQ==?jobBoardSource=gupy_portal,True,remote,True
6689381,2024-01-30T16:10:09.773Z,Pessoa Desenvolvedora FullStack Node Sênior,"A FCamara está em busca de uma Pessoa Desenvolvedor FullStack Node Sênior para atuar em uma das maiores empresas da América Latina líder no mercado em exames diagnósticos clínicos.Responsabilidades e atribuiçõesHard-Skill   - Node.Js    - Kubernetes e docker   - Qualidade       - Testes unitários       - e2e       - Boas praticas       - design pattern   - Segurança   - Perfomance   - Observabilidade (dynatrace, elastic, etc)   - Banco de dados relacionais (Postgres/MySql/SqlServer) / NoSQL / chave-valor   - Cloud: Experiencia em algumas das 3 grandes (AWS ou GCP ou AZ)   - Microserviços   - Git   - CI-CDRequisitos e qualificações Desejáveis:       - TypeScript       - GraphQL       - NestJS       - KafkaSoft-skill   - Já ter trabalhado com scrum ou metodologias ageis   - Experiencia em atuar no modelo remoto   - Já ter trabalhado em grandes times e times multidisciplinares   - Conhecimento em arquitetura de aplicação/solução   - Elaboração de documentação ",VENHA SER #SANGUELARANJA 🧡🚀,vacancy_type_effective,,False,São Paulo,São Paulo,Brasil,https://fcamara.gupy.io/job/eyJqb2JJZCI6NjY4OTM4MSwic291cmNlIjoiZ3VweV9wb3J0YWwifQ==?jobBoardSource=gupy_portal,True,hybrid,True
