job_id,published_date,title,description,career_page_name,type,application_deadline,is_remote_work,city,state,country,job_url,disabilities,workplace_type,submitted
6677521,2024-01-30T17:57:39.537Z,Especialista de Dados e Analitycs II (QSTMA),"Entregar nossos produtos com qualidade, satisfazendo nossos clientes e protegendo a imagem do Grupo Boticário faz parte da nossa essência e do nosso propósito de existir. A Gerencia da Qualidade preza pelas normas internacionais de qualidade e total conformidade com a legislação e faz tudo isso de maneira a levar aos nossos clientes a beleza embalada em cada um dos nossos produtos.Responsabilidades e atribuiçõesLiderar estruturação da Jornada de Dados da Diretoria de QEC (Qualidade, Excelência e Cuidado) junto aos stakeholder internos e às áreas parceiras;Mapear e analisar criticamente as necessidades de dados de toda Diretoria de QEC, refinar as iniciativas priorizadas junto às áreas, levantar requisitos, necessidades e dependências;Colaborar com as partes interessadas internas e externas para definir a estratégia de produtos de dados que atenda às necessidades dos clientes e esteja alinhada com os objetivos da empresa;Garantir evolução, estruturação e disponibilidade de dados de QEC dentro das ferramentas oficiais de Tech disponibilizando assim dados entruturados e confiáveis para todos os stakeholders e focais que atuam em estratégia self service;Gerenciar o ciclo de vida completo do desenvolvimento de produtos de dados (sprint a sprint): Extração, armazenamento, integridade e segurança dos dados;Liderar como frente de negócio squad de dados para garantir a qualidade e a eficiência no desenvolvimento;Implementar processos eficazes garantindo a melhoria contínua;Participar ativamente de construções de OKRs do seu contexto/jornada de dados sendo responsável por definir roadmap, estratégia, objetivos, visão e iniciativas alinhadas com as estratégias de negócio, de outros produtos do ecossistema, além das necessidades do usuário;Trabalhar em estreita colaboração com a equipe de QEC e demais stakeholders;Buscar continuamente oportunidades de aprimoramento dos produtos de dados existentes.Fomentar ativamente, com propostas, projetos e programas a Cultura Data Driven dentro da Diretoria conectada com a estratégia do GB.Requisitos e qualificaçõesNível Superior Completo em Ciência de Dados, Economia, Engenharia, TI e áreas afinsPós Graduação em Ciência de Dados, Banco de Dados, Programação e afinsExperiência de mais de 3 anos atuando na liderança de projetos estruturantes, jornada de dados e implementação de Business Inteligence;Sólida experiência em análise de dados, linguagens de programação, banco, integrações com sistemas e bussines inteligence ( SQL, Big Query, Tableau, Python, )Sólida experiência no uso de ferramentas e metodologias de gestão de projetos, em especial métodos ágeis;Conhecimento em ferramentas do Google;Modelo de trabalho híbrido: Curitiba ou SP. Informações adicionaisO Grupo Boticário promove a diversidade e queremos conosco pessoas que mudem o jogo e façam bonito, independente do gênero, raça, orientação sexual, religião, nacionalidade, idade ou deficiência.Nos preocupamos com o bem-estar das nossas pessoas, por isso oferecemos um pacote de benefícios que permitem uma vida mais saudável e completa.Nossa jornada de trabalho tem carga horária flexível e sustentável. Vai trabalhar em modelo híbrido ou remoto? Oferecemos o auxílio home-office.Todo mundo merece um momento para cuidar da alimentação, certo? Aqui você poderá contar com o vale refeição e/ou vale alimentação (conforme elegibilidade), mas se você for trabalhar em uma das nossas fábricas ou centros de distribuição temos restaurante;Tá, mas e a sua saúde? Para nós a sua saúde é prioridade, aqui oferecemos plano de saúde e programas com foco em saúde e bem estar:Central de Saúde 24hA Família CresceuAtendimento Social2ª Opinião MédicaTelemedicina - dentro do plano de saúdePsicologia on-lineOrientação JurídicaOrientação FinanceiraOrientação PsicológicaEntre nós - apoio a vítimas de violênciaRodas de Conversa com foco físico e emocionalCuidado com o colaborador durante o afastamentoCampanhas de prevenção em saúdeVacinação gratuita contra gripe para colaboradores e dependentesExames periódicosAvaliação ergonômicaTambém nos preocupamos com a sua segurança financeira e de sua família, garantindo cobertura de previdência privada, empréstimos com taxas diferenciadas e seguro de vida.Sabe a vida fitness? Deixa com o Gympass;E as crianças? Disponibilizamos o Auxílio para o Material Escolar;Falando em crianças, aqui no Grupo Boticário, acreditamos que todos possuem o direito a uma licença parental igualitária. Por isso oferecemos 120 dias de Licença Parental para papais e mamães;Todo mundo faz aniversário e, já que você está de parabéns, oferecemos o Day Off de Aniversário.Desconto de até 40% em nossos produtos! Agora sim viu vantagem, né? Além de convênios e parcerias diversas através da Associação de Colaboradores.Tá afim de fazer o bem? Aqui no GB proporcionamos oportunidades de participar em várias ações de voluntariado.Se identifica com o nosso jeito? Então vem fazer beleza com a gente!",Grupo Boticário,vacancy_type_effective,2024-02-03T00:00:00.000Z,False,São José dos Pinhais,Paraná,Brasil,https://grupoboticario.gupy.io/job/eyJqb2JJZCI6NjY3NzUyMSwic291cmNlIjoiZ3VweV9wb3J0YWwifQ==?jobBoardSource=gupy_portal,True,hybrid,True
6664571,2024-01-30T17:57:38.416Z,Pessoa Analista de Governança de Dados Sênior,"A Caju é uma empresa brasileira de tecnologia, que busca dar mais sabor à vida profissional, transformando a relação entre empresas e colaboradores por meio de soluções inovadoras e seguras. Hoje contamos com um único cartão para multi benefícios, despesas, premiação, e também uma plataforma para gestão de colaboradores.Continuamos crescendo o nosso time, buscando por novos talentos que queiram transformar o mundo de benefícios com soluções inovadoras. Aqui na Caju, aprendemos sempre, e nos tornamos cada vez melhores em um ambiente colaborativo e divertido!São muito bem-vindas candidaturas de pessoas negras, mulheres, indígenas, LGBTQIA+, ou outros grupos minorizados. 🧡Inscreva-se e conheça mais sobre nosso time 🧡Responsabilidades e atribuiçõesEstratégia de governança de dados: Definir e implementar a estratégia geral de governança de dados. Colaborar com as partes interessadas internas para entender os requisitos, identificar as metas de governança de dados e definir os processos necessários para atingir essas metas.Desenvolvimento de políticas e procedimentos: Desenvolver políticas, padrões e procedimentos para governar a coleta, armazenamento, acesso, uso e descarte de dados. Essas políticas garantem que as melhores práticas sejam seguidas em relação à qualidade, privacidade, segurança e conformidade regulatória dos dados.Monitoramento e conformidade: Responsável por monitorar o cumprimento das políticas e procedimentos de governança de dados em toda a organização. Isso pode envolver a realização de auditorias, revisões periódicas e avaliações de conformidade para garantir que as diretrizes estabelecidas sejam seguidas e que quaisquer problemas ou desvios sejam identificados e resolvidos.Gerenciamento de metadados: Desenvolve e mantém a eficiência do sistema de gerenciamento de metadados. Isso inclui a definição de padrões de metadados, a criação de catálogos de dados e a documentação de informações essenciais sobre os dados, como origem, significado, estrutura e relacionamentos.Colaboração interdepartamental: Atua como ponto focal para todas as questões relacionadas à governança de dados e colabora com equipes multidisciplinares em toda a organização. Isso inclui trabalhar em estreita colaboração com os departamentos de Tech, segurança da informação, LGPD e áreas de negócio para garantir que as práticas de governança de dados sejam integradas em todos os processos e sistemas.Melhoria contínua: O analista está constantemente envolvido em atividades de melhoria contínua para aprimorar a governança de dados na organização. Isso pode envolver a identificação de áreas de risco, a implementação de soluções e a realização de treinamentos para conscientização e educação dos funcionários sobre a importância da governança de dados.Requisitos e qualificaçõesExperiência em governança de dados, com foco em estratégia, políticas e conformidade.Conhecimento sólido de regulamentos e padrões relevantes, como a Lei Geral de Proteção de Dados (LGPD) e em frameworks como Dama DMBOK.Familiaridade com ferramentas e tecnologias de gerenciamento de metadados, governança de dados e qualidade de dados (Amundsen, OneTrust e Databricks Unity Catalog)Capacidade de trabalhar em equipe, colaborar com diferentes áreas da organização e liderar projetos de governança de dados.Informações adicionais💳 Cartão Caju, com mais liberdade para usar seus benefícios (Refeição, Alimentação, Mobilidade, Saúde, Home Office, Cultura e Educação);🏥 Plano de Saúde sem coparticipação;🧘🏿‍♀️ Zenklub, com consultas onlines com terapeutas e coaches para cuidar da sua saúde mental;🏋🏿‍♀️ Gympass🗣️ Aqui também estimulamos o aprendizado de idiomas, com a parceria da Rosetta Stone;💆🏽 Dia de recarregar - day off; 🧑🏿‍⚕️ Conexa Saúde - consulta médica online;👶🏿 Auxílio Creche;📚 Parceria com Alura;👨🏿‍💻 Trabalho Remoto, para você trabalhar de onde quiser dentro do Brasil;💻 Oferecemos equipamento de trabalho;🚀 Muitas possibilidades de crescimento - temos muito a crescer e esperamos fortemente que você nos ajude com isso!A Caju é uma empresa brasileira e aceita pessoas de todas as regiões do país.Trabalhamos em um modelo 100% remoto(quem tiver interesse de conhecer ou trabalhar no escritório, localizado em São Paulo, estaremos de portas abertas) Se interessou? #VemSerCaju 🧡",Caju Benefícios,vacancy_type_effective,2024-02-06T00:00:00.000Z,True,,,Brasil,https://caju.gupy.io/job/eyJqb2JJZCI6NjY2NDU3MSwic291cmNlIjoiZ3VweV9wb3J0YWwifQ==?jobBoardSource=gupy_portal,True,remote,True
6655123,2024-01-30T17:01:07.656Z,Analista de Dados Jr,"Nosso objetivo é transformar dados em informações relevantes para a companhia, auxiliando o negócio na tomada de decisão data-driven.O nosso candidato ideal tem a capacidade de aliar o entendimento do funcionamento do nosso negócio a um olhar analítico, somando a isso uma boa capacidade de manipulação de dados.Responsabilidades e atribuições·        Gerar e manipular dados usando em SQL, desenvolver análises qualitativas e quantitativas;·        Utilização de dados para o desenvolvimento de estudos, segmentações, levantar hipóteses/testes e realizar o acompanhamento de métricas de resultados;·        Utilização de dados para gerar insights que direcionem a tomada de decisão e colaborem com a estratégia do negócio·        Elaboração e manutenção de relatórios gerenciais de performance e KPI´sRequisitos e qualificações·        Manipulação de dados em SQL;·        Pacote Office (especialmente Excel e PowerPoint);·        Boa comunicação e posicionamento e saiba construir relacionamentos;·        Seja organizado, tenha senso de dono e visão críticaInformações adicionaisSerá considerado diferencial experiência prévia em instituições financeiras ou com produtos financeiros",Digio,vacancy_type_effective,,True,,,Brasil,https://digio.gupy.io/job/eyJqb2JJZCI6NjY1NTEyMywic291cmNlIjoiZ3VweV9wb3J0YWwifQ==?jobBoardSource=gupy_portal,False,remote,True
6607967,2024-01-30T16:11:31.025Z,Analista de Dados - Planejamento,"Especialista AminoScience da área de Planejamento.Ajinomoto do Brasil faz parte do Grupo Ajinomoto líder mundial em aminoácidos.Contribuiremos para o bem-estar de todos os seres humanos, da nossa sociedade e do nosso planeta com a ""Ciência dos Aminoácidos"".Vamos muito além dos temperos. Somos referência em aminoácidos e estamos na mesa da sua casa, no restaurante, no agronegócio, na nutrição animal, nos suplementos, nos cosméticos, e nos medicamentos.A AminoScience é uma divisão de negócios da Ajinomoto, com o objetivo de produzir e comercializar aminoácidos e seus derivados como matéria prima para diversos segmentos, como, por exemplo, indústria alimentícia e de bebidas, nutrição clínica e esportiva, farmacêutica, cosmética, limpeza, veterinária, química e nutrição animal. Para atender a todos estes mercados a divisão AminoScience se subdivide em quatro áreas de negócios: Aminoácidos, Especialidades Químicas, Nutrição Animal e Nutrição Esportiva.A área de Planejamento atua para as quatro áreas de negócio, atendendo e se adequando a todas as particularidades que cada segmento necessita.Para isso buscamos profissionais comprometidos e com conhecimento técnico para afazer parte da nossa equipe.Responsabilidades e atribuiçõesAtuar na área de Planejamento da divisão AminoScience da Ajinomoto;Atualizar os relatórios mensais de vendas das áreas de negócios de Aminoácidos (AA), Especialidades Químicas (SC), Nutrição Esportiva (SN) e Nutrição Animal (AN) da divisão AminoScience;Garantir a acuracidade dos dados para análises e acompanhamentos dos resultados da divisão.Atender aos prazos de entrega dos materiais;Atualizar materiais de apresentação de resultado de vendas;Dar suporte nos processos de Budget, Rolling Forecast, Roadmap, na preparação, atualização, desenvolvimento de materiais de análise e simulação que envolvem estes processos;Atender a demais demandas e projetos internos e/ou externos que envolvem o time de Planejamento da divisão AminoScience;Busca por melhoria contínua através de desenvolvimento de projetos que visam aprimorar e otimizar processos e relatórios da divisão.Requisitos e qualificaçõesEnsino Superior Completo em Exatas (Ex.: Administração, Engenharia, etc...);Conhecimento avançado em Pacote Office, principalmente Excel;Inglês - Nível intermediário;Experiência de 2 a 3 anos atuando na área de planejamento de negócio, comercial, administração de vendas ou Customer Service; Desejável conhecimento de estrutura de P&amp;L e experiência em inteligência de mercado, planejamento estratégico, mapeamento de processo e elaboração de indicadores.Conhecimentos desejáveis:Conhecimento em SAP, principalmente nos módulos SD/ S4 Hana, Analytics, IBP;Conhecimento em Power BI - Intermediário;ISO 9000 e 14000.Informações adicionaisBenefícios:Assistência Médica;Assistência odontológica;Ticket Alimentação;Seguro de vida;Gympass;Parcerias educacionais;Participação nos Lucros e Resultados;Vale Transporte.Local de trabalho:Vila Mariana/SP (Próximo à estação Paraíso do Metrô). 				Trabalho híbrido (Home Office 3x por semana)",Ajinomoto do Brasil,vacancy_type_effective,,False,São Paulo,São Paulo,Brasil,https://ajinomotoabr.gupy.io/job/eyJqb2JJZCI6NjYwNzk2Nywic291cmNlIjoiZ3VweV9wb3J0YWwifQ==?jobBoardSource=gupy_portal,False,hybrid,True
6671167,2024-01-30T15:32:39.702Z,Pessoa Engenheira de Dados,"Sobre a empresa:A Ewally nasceu com o intuito de levar serviços de bancarização para a linha de frente do mercado, desburocratizando seu acesso a serviços financeiros. Nos apropriamos de nossa paixão por Inovação, e a combinação entre Infraestrutura + Tecnologia + Regulatório, e nos tornamos uma Instituição de Pagamentos.Desde então, proporcionamos excelência e uma revolução no consumo de produtos e serviços financeiros às empresas, por meio da criação de seu próprio ecossistema financeiro, incorporando pagamentos, viabilizando crédito e melhorando a experiência de clientes e pessoas usuárias!Sobre a posição:Você irá atuar junto à equipe de dados da Ewally, na criação e aprimoramento de pipelines eficientes para a extração, transformação e carga de dados, visando garantir a qualidade e a fluidez do fluxo de informações. Além disso, você irá se dedicar também na manutenção da sincronia entre os bancos de dados de análise e operacional, implementando práticas rigorosas de governança de dados para assegurar a confiabilidade das informações utilizadas nas tomadas de decisão estratégicas da Ewally.﻿Compromisso com Diversidade, Equidade e Inclusão:Aqui na Ewally acreditamos que para se investir na sociedade, é preciso refletir em nosso time o futuro que desejamos alcançar, proporcionando equidade e respeito! Dessa forma, todas pessoas são bem vindas a se candidatar em nossas posições sem distinção de raça, cor, idade, religião, orientação sexual, identidade ou expressão de gênero, nacionalidade ou deficiência! 🏳️‍🌈🏳️‍⚧️♿✊🏾Responsabilidades e atribuiçõesConstrução e manutenção de ETL de dados; Otimização e monitoramento dos custos de processos de dados existentes; Garantir a atualidade, fidelidade e integridade dos bancos de dados de análise com os bancos de dados operacionais.Requisitos e qualificaçõesSuperior completo em ciência da computação, engenharia da computação, ou áreas afins. Experiência atuando com: Python Avançado, Spark, SQL Avançado, NoSQL, AWS, CI/CDInformações adicionais✈️ Empresa Be Anywhere💳 Benefício Flexível da Swile🏥 Plano de Saúde (Allianz Saúde, sem custo para os colaboradores.)🏋️‍♀️ Gympass📚 Lingopass (35% de desconto para os cursos de Inglês, Espanhol e Francês)🎂 Birthday Off🎢 SESC",Ewally,vacancy_type_effective,,True,,,Brasil,https://ewally.gupy.io/job/eyJqb2JJZCI6NjY3MTE2Nywic291cmNlIjoiZ3VweV9wb3J0YWwifQ==?jobBoardSource=gupy_portal,True,remote,True
6686893,2024-01-30T18:44:10.568Z,Data Engineer,"¡Sé parte de Stefanini!​En Stefanini somos más de 30.000 genios, conectados desde 41 países, haciendo lo que les apasiona y co-creando un futuro mejor.​Responsabilidades y atribucionesResponsable de liderar o asistir en la obtención de requisitos para el proyecto/proyectos asignados.                                                                                                                                                                  Colaborar estrechamente con el equipo de Data Analytics y otros equipos para comprender las necesidades de los proyectos. Realizando entrevistas, análisis de flujo de trabajo, análisis de procesos y sesiones de observación.                                                                                                                Recopilar, limpiar y preparar datos para su posterio analisis desarrollado del punto 2.                    Realizar análisis exploratorios y estadísticos de los datos para identificar patrones, tendencias y relaciones.                                                                                                                                                                      Traducir los resultados del análisis en recomendaciones y acciones concretas para mejorar los procesos y tomar decisiones informadas.                                                                              Elaboracion de reporte de estatus / Avances de los proyectos asignados / Comunicados / One pager                                                                                                                                                                                  Participar en el diseño e implementación de sistemas y herramientas de visualización de datos para facilitar la comprensión y comunicación de los resultado                                                                                                                                                                        Requisitos y calificacionesExperiencia como Business Analysis. 2-3 años                   Experiencia reciente entrevistando a usuarios de negocio, recopilando informes y requisitos de KPI 3-4 años                      Experiencia comprobada de trabajar en desarrollo de producto de datos (análisis, escritura de queries, integración de fuentes de datos (Back y Front)).                                                                            Experiencia comprobada en documentación de requisitos, procesos y flujos de trabajo.               Capacidad de participar y realizar sesiones de levantamiento de información y presentar hallazgos finales.                                                                                                                                                                                      Traducir requisitos funcionales a ingenieros de datos y BI para el desarrollo de soluciones.          Capacidad para trabajar en equipo y colaborar con diferentes áreas y perfiles profesionales.       Habilidades de comunicación efectiva para traducir los resultados del análisis en recomendaciones claras y comprensibles.                                                                                                                                              Orientación a resultados y capacidad para trabajar en entornos dinámicos y bajo presión.           Cocimiento avanzado de lenguajes de programación como Python, R, SQL, Oracle, BQ, Denodo, Ymls y Datastage                                                                                                                                                         Idiomas  Inglés conversacional               Conocimiento de visualización de datos y capacidad para comunicar los resultados de manera clara y efectiva                                                                                                                                                 Habilidad para trabajar en equipo, colaborar con otros departamentos y tener un enfoque orientado a la resolución de problemas y la mejora continua.                                                                            Conocimiento y planeación de metodologías Agile, SCRUM.                                                                      Autodidacta, proactivo y autogestionable con la capacidad de levantar riesgos en tiempo.                                               SQL,Oracle, BQ, Denodo, Ymls y Datastage - Avanzado                                                                 Herramientas BI (Looker , Tableau, Power BI, etc) Deseable                                                                        Python Avanzado                                                                          Conocimiento de analítica avanzada Avanzado                                                                Confluence, Jira, Paquetería Office Avanzado                                                                                  ",STEFANINI LATAM,vacancy_type_effective,,True,,,México,https://stefaninilatam.gupy.io/job/eyJqb2JJZCI6NjY4Njg5Mywic291cmNlIjoiZ3VweV9wb3J0YWwifQ==?jobBoardSource=gupy_portal,True,remote,True
