job_id,published_date,title,description,career_page_name,type,application_deadline,is_remote_work,city,state,country,job_url,disabilities,workplace_type,submitted
7244088,2024-05-31T14:21:08.453Z,Dev .Net Core Sênior (100% remoto),"A NAVA está em busca de uma Pessoa Desenvolvedora .NET Core SR para fazer parte do nosso time de pessoas incríveis!  Por que trabalhar na NAVA?Somos uma empresa de tecnologia que atende as maiores companhias dos setores financeiro, seguros, meios de pagamento, telecomunicações, energia e varejo do país. Inspiramos nossos times a criar soluções para que essas companhias transformem e impactem positivamente o mundo.  Temos um time curioso, criativo, energético e inspirador, com grande foco nas pessoas para gerar inovação, transformação e crescimento. Dentro de um ambiente dinâmico e ágil, o nosso time está em expansão para acompanhar o crescimento exponencial da NAVA e dos nossos Clientes. ﻿Acolhemos as diferenças porque acreditamos que um ambiente diverso contribui para a inovação e uma sociedade mais justa e equânime e convidamos você à assumir esse compromisso junto com a gente.Responsabilidades e atribuiçõesComo será o seu dia a dia?Escrever código limpo, eficiente e escalável;Projetar e implementar arquiteturas de software robustas e modulares que atendam aos requisitos específicos do projeto.Desenvolver e integrar APIs e serviços web para comunicação com outros sistemas e aplicações.Trabalhar com bancos de dados para armazenar, recuperar e gerenciar dados.Testar e depurar o código para garantir que ele funcione conforme o esperado e seja livre de bugs.Manter e atualizar os softwares existentes para garantir que eles estejam funcionando corretamente e atendam às necessidades dos usuários.Corrigir bugs e resolver problemas relatados pelos usuários.Implementar novas funcionalidades e aprimoramentos de acordo com as necessidades do negócio.Documentar o código e os softwares para facilitar a compreensão e a manutenção por outros desenvolvedores.Requisitos e qualificaçõesO que esperamos de você?• Analisar, evoluir e manter sistemas de alta escalabilidade, disponibilidade e performance, resilientes e orientados a eventos;• Colaborar com ideias que possam melhorar nossos sistemas e a vida dos nossos usuários;• Estar disposto a aprender e a ensinar;• Estar sempre atento a oportunidades para melhorar o código e nossos processos;• Interagir com a equipe de negócio no esclarecimento e definição dos requisitos dos sistemas;• Atuar na modernização das aplicações, buscando novas soluções e performance;• Buscar continuamente melhorias no time em que trabalha, no fluxo de trabalho e em vocêDesejável:• Experiência avançada desenvolvimento backend com .NET Framework, .NET Core, Entity Framework;• Experiência Avançada - Aplicações monolíticas, de micro serviços: reativas, síncronas e assíncronas.• Experiência em modelagem de APIs REST;• Boa Experiência em Mensageria com RabbitMQ ou similares;• Boa Experiência com Docker e Kubernets;• Experiência avançada com banco de dados relacional;• Experiência em práticas de DevSecOps;• Conhecimento e atuação com AWS• Conhecimento e Atuação com Camunda• Conhecimento de design patterns, TDD e DDD;Diferencial:• Experiência pratica com banco de dados não relacional;• Conhecimento em testes automatizados;• Conhecimento em Javascript Cross-browser support, jQuery, HTML e Angular 2+ e CSS.Informações adicionaisHorário de trabalho: ComercialModelo de trabalho para este projeto/cliente: RemotoLocal de trabalho: BrasilAlém de ser uma empresa certificada Great Place to Work, você vai encontrar na NAVA: ✅ Oportunidades de carreira 🚀✅ Liberdade para escrever seu próprio código 🏆✅ Diversidade e diferentes formas de ver o mundo 🌈✅ Comunidades que incentivam o crescimento de todos 📚✅ Treinamento In Company 💻✅ Um time incrível 😎✅ Empresa engajada no Pacto Global da ONU 💪🏼✅ Projetos inovadores 💡✅ Alta avaliação no Glassdoor 📣 ",NAVA | Technology for Business,vacancy_type_effective,2024-06-28T00:00:00.000Z,True,,,Brasil,https://nava.gupy.io/job/eyJqb2JJZCI6NzI0NDA4OCwic291cmNlIjoiZ3VweV9wb3J0YWwifQ==?jobBoardSource=gupy_portal,True,remote,True
7242878,2024-05-30T20:29:16.368Z,Front End Developer,"¡Sé parte de Stefanini!​En Stefanini somos más de 30.000 genios, conectados desde 41 países, haciendo lo que les apasiona y co-creando un futuro mejor.Responsabilidades y atribucionesColaborar con equipo de Producto y TI para definir y refinar el sprint backlog o alcance de los requerimientos funcionales y técnicos.Analizar y diseñar soluciones apoyado en herramientas de diseño y arquitectura, para exponer y lograr la validación del equipo.Participar en el desarrollo de aplicaciones web, desde la creación de interfaces de usuario y la integración con otras aplicaciones.Realizar revisión de pares y revisión de logs, bugs o alguna refactorización de las aplicaciones.Participar en los despliegues a producción y en el soporte post producción.Requisitos y calificacionesRequisitos obligatrios:Desarrollo web: JavaScript, TypeScript, HTML5/CSSExperiencia en uso de Frameworks: ReactExperiencia de desarrollo con patrones de arquitectura como MVC, MVP y MVVM.Conocimiento de integración con APIs RESTful y MicroserviciosExperiencia con BD: SQL Server, Deseable: Postgres y MongoExperiencia trabajando con Scrum u otros frameworks de agilidad.Experiencia en AWS CloudRequerimientos deseables:Conocimiento de Herramientas Git, Jira y FigmaIngles técnico, nivel intermedio",STEFANINI LATAM,vacancy_type_temporary,,True,,,Peru,https://stefaninilatam.gupy.io/job/eyJqb2JJZCI6NzI0Mjg3OCwic291cmNlIjoiZ3VweV9wb3J0YWwifQ==?jobBoardSource=gupy_portal,True,remote,True
7242113,2024-05-30T20:26:48.109Z,Front End Developer,"¡Sé parte de Stefanini!​En Stefanini somos más de 30.000 genios, conectados desde 41 países, haciendo lo que les apasiona y co-creando un futuro mejor.Responsabilidades y atribucionesColaborar con equipo de Producto y TI para definir y refinar el sprint backlog o alcance de los requerimientos funcionales y técnicos.Analizar y diseñar soluciones apoyado en herramientas de diseño y arquitectura, para exponer y lograr la validación del equipo.Participar en el desarrollo de aplicaciones web, desde la creación de interfaces de usuario y la integración con otras aplicaciones.Realizar revisión de pares y revisión de logs, bugs o alguna refactorización de las aplicaciones.Participar en los despliegues a producción y en el soporte post producción.Requisitos y calificacionesRequisitos obligatrios:Desarrollo web: JavaScript, TypeScript, HTML5/CSSExperiencia en uso de Frameworks: ReactExperiencia de desarrollo con patrones de arquitectura como MVC, MVP y MVVM.Conocimiento de integración con APIs RESTful y MicroserviciosExperiencia con BD: SQL Server, Deseable: Postgres y MongoExperiencia trabajando con Scrum u otros frameworks de agilidad.Experiencia en AWS CloudRequerimientos deseables:Conocimiento de Herramientas Git, Jira y FigmaIngles técnico, nivel intermedio",STEFANINI LATAM,vacancy_type_temporary,,True,,,Peru,https://stefaninilatam.gupy.io/job/eyJqb2JJZCI6NzI0MjExMywic291cmNlIjoiZ3VweV9wb3J0YWwifQ==?jobBoardSource=gupy_portal,True,remote,True
7192987,2024-05-31T17:41:35.487Z,Analista de Desenvolvimento de Software - Full Stack,"Quer marcar presença na área tech em um Ecossistema de Tecnologia que não para de crescer?!Então, venha escrever esta história com a gente e ser um novo InventER!!! 🚀💛 Queremos encontrar alguém que consiga agregar valor na nossa área de Novos Produtos, ajudando a criar e manter soluções incríveis e disruptivas. Somos uma empresa que otimiza a performance de pessoas e empresas 💪🏽💪🏽💪🏽 A Invent Software é uma organização que se dedica a construir soluções inteligentes e que atua em todo o Brasil por meio de parceiros. Se você procura um lugar onde pode ser você mesmo e poderá ter desenvolvimento contínuo, venha com a gente!!! 🤩💪🏼 Gosta do desafio?Confira o que esperamos para essa posição ⬇️Responsabilidades e atribuiçõesEsse colaborador terá como responsabilidade:Desenvolver e manter aplicações web robustas e escaláveis, atuando tanto no front-end quanto no back-end.Criar e otimizar APIs eficientes e seguras, garantindo a integração com diversos serviços e plataformas.Colaborar com equipes multidisciplinares para definir, projetar e entregar novas funcionalidades.Implementar boas práticas de desenvolvimento, incluindo testes automatizados e revisão de código.Monitorar e melhorar o desempenho das aplicações, identificando e solucionando gargalos e bugs.Participar ativamente de reuniões de planejamento e de revisão, contribuindo com ideias e sugestões para a melhoria contínua dos produtos.Garantir a qualidade do código, aderindo a padrões de desenvolvimento e utilizando ferramentas adequadas.Requisitos e qualificaçõesConhecimentos sólidos em Docker, HTML 5, CSS 3, React, Python, Node.js, AWS, API Gateway, Lambda, SQL e NoSQL.Prática em desenvolvimento de APIs eficientes e escaláveis.Habilidades em desenvolvimento front-end (React, HTML 5, CSS 3) e back-end (Python, Node.js).Familiaridade com ambientes de nuvem, especialmente AWS, e seus principais serviços.Capacidade de se adaptar rapidamente a novas tecnologias e metodologias de desenvolvimento.Superior completo na área de tecnologiaSerá um diferencial conhecimento em:Prática com frameworks e bibliotecas adicionais como Redux, Next.js, ou similares.Conhecimento em metodologias ágeis, como Scrum ou Kanban.Habilidades em DevOps e conhecimento em CI/CD.Participação ativa em comunidades de desenvolvimento e contribuição para projetos open-source.Certificações em AWS ou outras plataformas de nuvem.Informações adicionais🍽 Vale Alimentação;🚌 Vale Transporte;🚑 Assistência Médica;🦷 Assistência Odontológica;🚀 Desenvolvimento Profissional🎉 Ambiente descontraído🏆 Reconhecimento🤸🏽 Ginástica laboral📚 Bolsa de estudos*⏰ Carga horária: 44h semanais das 08h às 18h de Segunda a Sexta✅ Vaga efetiva CLT",Invent Software,vacancy_type_effective,2024-06-20T00:00:00.000Z,False,Goiânia,Goiás,Brasil,https://inventsoftware.gupy.io/job/eyJqb2JJZCI6NzE5Mjk4Nywic291cmNlIjoiZ3VweV9wb3J0YWwifQ==?jobBoardSource=gupy_portal,True,hybrid,True
7242492,2024-05-30T17:29:11.454Z,Desarrollador Fullstack Jr,"¡Sé parte de Stefanini!​En Stefanini somos más de 30.000 genios, conectados desde 41 países, haciendo lo que les apasiona y co-creando un futuro mejor.​Responsabilidades y atribucionesExperiencia 1 a 2 años como Desarrollador JavaConocimiento en entornos bancarios (deseable)Control, seguimiento y desarrollo completo de los requerimientos del cliente, desde el análisis, diseño, construcción, pruebas y liberación.Conocimientos necesarios:Nube AWS: EKS, Lambda, API Gateway, otros…Bases de datos: SQL, Oracle.Conocimiento aplicado de Spring boot.Conocimiento aplicado de Angular.Desarrollo de integraciones con JavaScript, Node Js o Typescript, manejo de BD manejo de Frameworks * Angular * Quarkus * Spring Boot.Java, versión 8 Y 11 Spring/SpringBoot Python Hibernate JavaScript PL/SQL HTML5 C++ CSS3 Git CSS3 Primefaces ReactRequisitos y calificacionesMínimo tecnólogo o profesional Ingeniería de Sistemas, Ingeniería Electrónica, carreras afines o tecnólogo titulado en carreras afines.Mínimo un (1) año de experiencia en desarrollo según los skills deseados.Capacidad de análisis y resolución de problemas.Capacidad de trabajo en equipo.Capacidad de comunicación efectiva.Capacidad de aprendizaje continuo.AutogestiónCapacidad de toma de decisiones.AutoaprendizajeInnovador",STEFANINI LATAM,vacancy_type_effective,,False,Bogota,,Colômbia,https://stefaninilatam.gupy.io/job/eyJqb2JJZCI6NzI0MjQ5Miwic291cmNlIjoiZ3VweV9wb3J0YWwifQ==?jobBoardSource=gupy_portal,True,hybrid,True
7239661,2024-05-30T13:11:09.017Z,FullStack Developer,"¡Sé parte de Stefanini!​En Stefanini somos más de 30.000 genios, conectados desde 41 países, haciendo lo que les apasiona y co-creando un futuro mejor.​Responsabilidades y atribucionesDescripción del Puesto:Estamos buscando un Desarrollador Full Stack talentoso y experimentado para unirse a nuestro equipo de desarrollo de software en el sector de la aviación. Este rol es fundamental para el diseño, desarrollo e implementación de soluciones tecnológicas que optimicen nuestras operaciones y mejoren la experiencia del cliente.Responsabilidades:Desarrollar y mantener aplicaciones web utilizando Vue.js (versiones 2 y 3) para el frontend y Node.js con NestJS para el backend.Diseñar y gestionar bases de datos MongoDB, asegurando la eficiencia y escalabilidad.Implementar y mantener sistemas de mensajería y colas utilizando RabbitMQ.Desarrollar y consumir APIs para integraciones con sistemas internos y externos.Participar en la arquitectura y diseño de soluciones basadas en eventos.Colaborar estrechamente con otros desarrolladores, diseñadores y partes interesadas para definir y cumplir con los requisitos del proyecto.Realizar pruebas unitarias e integrales para asegurar la calidad y funcionalidad del código.Mantenerse actualizado con las últimas tendencias y tecnologías en desarrollo de software.Requisitos:Experiencia comprobada en desarrollo Full Stack con Vue.js (versiones 2 y 3), Node.js y NestJS.Conocimiento sólido de bases de datos MongoDB y sistemas de mensajería RabbitMQ.Experiencia en el desarrollo y consumo de APIs RESTful y/o GraphQL.Familiaridad con arquitecturas basadas en eventos.Capacidad para trabajar de manera independiente y en equipo, gestionando múltiples tareas en un entorno dinámico.Habilidades de comunicación efectiva y resolución de problemas.Dominio del inglés y español, tanto escrito como hablado.Conocimientos Opcionales:Experiencia con Sabre o sistemas similares en el sector de la aviación.Requisitos y calificacionesImportante contar con: ·    ¿Años de experiencia?·    Tecnologías Necesarias·    Idioma·    Certificaciones",STEFANINI LATAM,vacancy_legal_entity,,True,,,Chile,https://stefaninilatam.gupy.io/job/eyJqb2JJZCI6NzIzOTY2MSwic291cmNlIjoiZ3VweV9wb3J0YWwifQ==?jobBoardSource=gupy_portal,True,remote,True
7146935,2024-05-31T17:55:00.399Z,Arquitetura de Software Sr - Segmento Tecnologia ,"O que vamos construir juntos?Estamos à procura de profissionais nexialistas que tenham um mindset (mentalidade) voltada para práticas ágeis no desenvolvimento, sejam verdadeiros software craftsman (artesão de software) e que considerem esses princípios como fundamentais em seus valores, da mesma forma como são para nós.Nosso time é preocupado em propor as melhores soluções baseado em excelência técnica, pensando em alternativas que agreguem valor, com mindset ágil e cultura de colaboração. Nós respeitamos a diversidade e acreditamos que times diversos contribuem para construir ideias mais inovadoras.A atuação é em um time de referência onde esse time é composto das seguintes competências: Arquitetura, Segurança de Aplicações, DevOps, SRE, Cloud e Automação/Qualidade;Responsabilidades e atribuiçõesNos ajude a desenhar a solução!A atuação é estratégica, você será responsável por definir e promover a cultura técnica da DB - uso das melhores práticas no desenvolvimento de software e integrações de componentes/soluções cloud. A atuação pode ser imersa nos times técnicos ou contribuindo de maneira cross na DB, além de apoiar clientes, negócios e ser o mentor de outras pessoas técnicas.Requisitos e qualificaçõesRequisitos para se candidatar a vaga:Atuação totalmente hands-on;Compreender tecnologia, linguagens e frameworks como ferramentas, estando disposto a estudar temas que vão além do seu conhecimento;Modelagem orientada ao domínio (Domain Driven e Design);Boas práticas de design de código (TDD, Modelagem rica, KISS, YAGNI, DRY, SOLID, Clean Code, Design Patterns..);Modelagem de arquitetura (Clean Architecture, Hexagonal architecture e Onion Architecture) e fundamentos de sistemas distribuidos - modelagem de microsserviços e arquitetura orientada a eventos;Mindset Lean / Arquitetura Mínima Viável (MVA);Piramide de testes e automação de testes em todas as camadas - qualidade interna/externa;Práticas de uma cultura DevOps, atuando na automação de infraestrutura - CI, CD e IaC, contribuindo com a agilidade de entrega do software em produção;Conhecimento de métricas que influenciam as boas práticas de engenharia de software - Complexidade ciclomática, cognitiva, lead time, deploy frequency..Visão sistêmica e pensamento estratégico para tomadas de decisões;Pensamento focado em produto, indo além de questões técnicas;Experiência em alguma cloud pública (AWS, Google ou Azure) e orquestradores de containers (Ex: Kubernetes);Será legal se você tiver:Práticas de Site Reliability Engineering;Práticas de segurança como SAST, DAST, Autenticação/Autorização..Fluência em Inglês será um diferencial;Disponibilidade para atuar de forma híbrida em São Paulo;Informações adicionaisPor aqui você terá:Remuneração compatível com o mercado;Vale Refeição;Vale Transporte;Plano de Saúde e Odontológico;Subsídio para o home-office;Seguro de Vida;Horário flexível;Dresscode: seja você;TotalPass: cuidado com a sua Saúde física e mental);Incentivo certificações;",DB,vacancy_type_effective,2024-07-31T00:00:00.000Z,False,São Paulo,São Paulo,Brasil,https://db.gupy.io/job/eyJqb2JJZCI6NzE0NjkzNSwic291cmNlIjoiZ3VweV9wb3J0YWwifQ==?jobBoardSource=gupy_portal,True,hybrid,True
7155866,2024-05-31T17:00:08.685Z,Pl/Sr Software Engineer (.Net),"Somos a Iteris.Uma empresa de tecnologia que desde 2009 integra o humano e o tecnológico visando agregar cada vez mais valor para a transformação digital dos nossos clientes.Já somos mais de 900 pessoas apaixonadas por tecnologia e unidas por laços reais, que acreditam que a excelência nos resultados é a soma das qualidades técnicas e comportamentais.Somos Next-Gen IT Services e queremos que você faça parte do nosso futuro.#VemFazerAcontecer com a gente!Responsabilidades e atribuiçõesNessa posição, sua missão será:Compreender o negócio e a necessidade do cliente, de forma a desenvolver a aplicação que melhor atenda aos seus desafios, dentro do prazo estipulado.Requisitos e qualificaçõesO que você precisa conhecer?.NET Full Framework.NET 4.8, 6.0/8.0DapperEntity FrameworkDesenvolvimento de APIs RESTfulTestes Unitários (Xunit, Nsubstitute, FluentValidation)Git, GitFlowBanco de dados relacionais (SQL Server) e não relacionais (Redis)Informações adicionaisAcreditamos em um potencial independentemente de gênero, raça, idade, religião, deficiências, aspectos culturais ou políticos.Benefícios que oferecemos:Cesta de benefícios flexível para distribuir livremente entre VR e VA;Assistência Médica Premium nacional;Assistência Odontológica;Subsídio de Certificações;PLR;Gympass;Auxílio-creche;Seguro de Vida;Day Off no mês de aniversário;Plano de Carreira;Comunidades de Prática.",Iteris,vacancy_type_effective,2024-06-30T00:00:00.000Z,False,São Paulo,São Paulo,Brasil,https://iteris.gupy.io/job/eyJqb2JJZCI6NzE1NTg2Niwic291cmNlIjoiZ3VweV9wb3J0YWwifQ==?jobBoardSource=gupy_portal,True,hybrid,True
7243094,2024-05-31T10:20:35.218Z,Estágio em Testes de Software (Telecom)  ,"Por que fazer parte do #PosiTime?Acreditamos que a tecnologia existe para impulsionar vidas, por isso, todos os dias construímos novas soluções que tornam a vida das pessoas melhor e mais inteligente! Ágeis, vibrantes, ousados, inovadores, diversos, conectados, dinâmicos, empreendedores e resilientes: mais que uma equipe, somos o #PosiTime.Se você se identifica com o nosso propósito, e procura um lugar para crescer e somar, te esperamos de braços abertos!Responsabilidades e atribuições• Executar testes de software Android - telecomunicações (3G, 4G, 5G);• Operar simulador de RF;• Reportar falhas para equipe de desenvolvimento e fornecedores chineses;• Análise de logs e resultados de testes.Requisitos e qualificações• Superior cursando em Engenharia Eletrônica ou Engenharia de Telecomunicação;• Estar cursando a partir do 3° período da faculdade;• Excel Intermediário;• Inglês Básico;•Disponibilidade para modelo híbrido (3x presencial).Informações adicionaisConheça alguns dos benefícios que o #PosiTime tem: ​** Buscamos oferecer os melhores benefícios ao #PosiTime, que podem variar de acordo com o contrato e local de trabalho. Qualidade de Vida🏥 Planos de saúde e odontológico🧘🏿‍♀️ Zenklub: plataforma de saúde e bem estar, incluindo atendimento psicológico🧑🏿‍⚕️ Casa da Saúde: consultas médias e odontológicas, além de exames clínicos🏋🏿‍♀️ Gympass🍴 Refeitório ou 🍕Vale Refeição💊 Desconto Farmácia🚑 Emergências Médicas: convênio com o plano de saúde para atendimento em casa ou pelo telefone👨🏿‍💻 Horário Semi-Flexível🏠 Trabalho Híbrido👶 Auxílio Creche e Kit Maternidade Carreira e Educação🚀 Descontos na Universidade Positivo (UP) - para colaboradores e dependentes📖 Desconto em cursos do Centro de Idiomas - UP📒 Saber Mais: Portal de Desenvolvimento Profissional👧 Descontos no Colégio Positivo para filhos de colaboradores Finanças💰 PPR👉🏻 Good Card: convênio aceito em mais de 130 mil estabelecimentos✔️ Seguro de Vida💵 Empréstimo Consignado💲Previdência Privada Transporte🚌 Vale Transporte ou 🚗 Estacionamento Descontos Exclusivos💻 Parceiro Positivo: site com descontos em nossos produtos",Positivo Tecnologia,vacancy_type_internship,,False,Curitiba,Paraná,Brasil,https://positivotecnologia.gupy.io/job/eyJqb2JJZCI6NzI0MzA5NCwic291cmNlIjoiZ3VweV9wb3J0YWwifQ==?jobBoardSource=gupy_portal,True,hybrid,True
7245536,2024-05-31T18:25:58.562Z,Profissional SRE/DEVOPS Sênior,"Somos a maior multinacional brasileira e estamos entre as 100 maiores empresas de TI do mundo.Estamos presentes em 41 países com +30k colaboradores. A Stefanini tem como principal objetivo auxiliar os clientes a encontrar, por meio de soluções personalizadas, a maneira ideal para alcançar seus desafios, impulsionando a inovação digital.E queremos mais!Responsabilidades e atribuiçõesConhecimentos Técnicos Necessários:- Arquitetura de Cloud;- Ferramenta de Observability (Dynatrace, Datadog, Grafana);- IaC (Terraform, CloudFormation);- Ferramentas de CI/CD;- Práticas de FinOps.- Desejável certificação AWS. Conhecimentos de Soft Skills:- Sentimento de Dono;- Pensamento crítico e solução de problemas;- Senso de Urgência;- Trabalho em equipe;- Capacidade de aprendizado contínuo.",Stefanini Group,vacancy_type_effective,,True,,,Brasil,https://stefanini.gupy.io/job/eyJqb2JJZCI6NzI0NTUzNiwic291cmNlIjoiZ3VweV9wb3J0YWwifQ==?jobBoardSource=gupy_portal,True,remote,True
7242011,2024-05-30T15:28:15.268Z,Desarrollador DevOps,"¡Sé parte de Stefanini! En Stefanini somos más de 30.000 genios, conectados desde 41 países, haciendo lo que les apasiona y co-creando un futuro mejor.¡Seguro no te quieres quedar fuera!¡Desarrollador DevOps!﻿¿Por qué te elegiremos? ¡Porque los desafíos que asumirás reflejan tus ambiciones!Responsabilidades y atribucionesDescripción del puestoBuscamos un ingeniero DevOps para ayudarnos a crear sistemas funcionales que mejoren la experiencia de los clientes. Entre las responsabilidades del ingeniero DevOps se incluyen actualizaciones de productos, identificación de problemas de producción e implementación de integraciones que satisfagan las necesidades de los clientes. Si tienes una buena formación en ingeniería de software y estás familiarizado con Ruby o Python, nos gustaría conocerte. En última instancia, deberás ejecutar y automatizar procesos operativos de manera rápida, precisa y segura. ResponsabilidadesImplementar las integraciones solicitadas por los clientesRealizar actualizaciones y correccionesOfrecer soporte técnico de nivel 2Crear herramientas para reducir la aparición de errores y mejorar la experiencia de los clientesDesarrollar software para integrarlo con sistemas internos de «back-end»Realizar análisis de causa raíz en los errores de producciónInvestigar y resolver problemas técnicosDesarrollar secuencias de comando para automatizar la visualizaciónDiseñar procedimientos para la solución de problemas y el mantenimiento de sistemasRequisitos y calificacionesRequisitosExperiencia laboral como ingeniero DevOps o en un puesto de ingeniería de software similarConocimiento práctico de bases de datos y SQLBuena actitud para solucionar problemasEspíritu de equipoGrado en ciencias informáticas, ingeniería o en un campo relacionado",STEFANINI LATAM,vacancy_legal_entity,,True,,,Honduras,https://stefaninilatam.gupy.io/job/eyJqb2JJZCI6NzI0MjAxMSwic291cmNlIjoiZ3VweV9wb3J0YWwifQ==?jobBoardSource=gupy_portal,True,remote,True
