job_id,published_date,title,description,career_page_name,type,application_deadline,is_remote_work,city,state,country,job_url,disabilities,workplace_type,submitted
7104210,2024-05-07T17:34:25.690Z,VR | Clientes Especialista Sistemas TI I Front-End ,"Quer fazer parte de uma empresa que cresce exponencialmente, revoluciona o mercado com suas inovações e se preocupa com as pessoas?Então chegou a sua hora e o desafio é daqueles que dá frio na barriga! Vamos revolucionar ainda mais um segmento que passa por inúmeras transformações e melhorar a vida de milhões de brasileiros e suas famílias.Esse é o momento de fazer acontecer. Venha fazer parte do nosso time!Procuramos uma pessoa Especialista I - Front-End para nosso time de Clientes PJ - Estabelecimentos, da VR Benefícios.Responsabilidades e atribuiçõesProver soluções diversas através do desenvolvimento de sistemas complexos, apoiando quando necessário no desenho técnico e na definição de tecnologias e ferramentas à serem utilizadas;Apoiar em pesquisa e aplicação de novas tecnologias visando a inovação no desenvolvimento de soluções;Trazer as melhores ferramentas e práticas de mercado a fim de viabilizar a criação de protótipos, MVPs e evolução dos produtos;Buscar a melhoria contínua do processo de desenvolvimento e evolução das soluções, sendo referência nos times com os quais trabalha e provendo assessoria e aconselhamento especializado quando necessário.Requisitos e qualificaçõesSuperior completo em Ciências de Computação, Sistemas de Informação, ou áreas afins;Experiência com desenvolvimento Frontend em geral (mínimo 7 anos);Sólidos conhecimentos em Javascript;Sólidos conhecimentos em React JS;Ter atuado com aplicações Microfrontend (Module Federation);Pré processadores de estilo (SASS, Stitches, Styled Components, etc);Experiência em ferramentas de gerenciamento de estado da aplicação (Context API, Redux, Redux Saga, etc);Experiência e vivência em times voltados a construção, sustentação e evolução de produtos;Conhecimentos em controle de versão no Git e gerenciamento de dependências;Experiência com desenvolvimento de testes automatizados;Integrações com APIs RESTful;Typescript;Experiência em reuso de padrões (""Design System / Whitelabel"").DIFERENCIALVivência em metodologias ágeis;Especialização ou MBA na área de atuação;Conhecimento em análises de performance;Webpack;Next JS;Acessibilidade na web (A11y);Angular JS (1.x);Gulp.Informações adicionaisO que a VR Benefícios te oferece?Vale RefeiçãoVale AlimentaçãoAuxílio Capacitação MensalVale CulturaAssistência MédicaAssistência OdontológicaSeguro de VidaConvênio com farmáciaPrograma de Participação de ResultadosHorário FlexívelAuxílio Home Office MensalTotal PassParceria com a ZenklubAuxílio Creche/BabáPrograma de Bem-Estar e Saúde: Bem Me QueroLicenças remuneradas:- Licença maternidade de 180 dias e Licença paternidade de 20 dias- Licença casamento de até 10 dias corridos- Licença aniversário, dia dos Pais e dia das Mães de 1 dia- Licença Falecimento de até 15 dias corridosA VR acredita que a diversidade transforma o mundo. Todas as nossas oportunidades também são para PCDs (Pessoas com Deficiências). Se você atende os requisitos e tem interesse na posição, candidate-se!",VR,vacancy_type_effective,,True,São Paulo,São Paulo,Brasil,https://vr.gupy.io/job/eyJqb2JJZCI6NzEwNDIxMCwic291cmNlIjoiZ3VweV9wb3J0YWwifQ==?jobBoardSource=gupy_portal,True,remote,True
7129682,2024-05-07T15:33:24.544Z,Pessoa Desenvolvedora Jr  (Back- end) ,"DESCRIÇÃO DA VAGAVem pra NÚCLEAJá imaginou se os meios de pagamento parassem de funcionar? Pois é, isso nem passa pela nossa cabeça, porque trabalhamos com inovação, confiabilidade e tecnologia de ponta para que você, pequenas ou grandes empresas possam fazer suas transações com total segurança e agilidade, a qualquer hora do dia ou da noite.Nosso ambiente é feito de gente movida pela vontade de interagir de forma colaborativa e disposta a se desafiar todos os dias. Estamos cheios de energia para continuar transformando o mercado financeiro. Temos muito Orgulho de Ser NÚCLEA.Sobre a NÚCLEAhttps://www.nuclea.com.br/Para todas as posições consideramos diversidade e inclusão.Na Núclea, valorizamos muito o respeito e a diversidade em nossas equipes, aqui, acreditamos que nossas diferenças são nossas maiores forças.De acordo com nossos valores, as pessoas estão no centro do nosso negócio e somente elas são capazes de movimentar a economia digital em benefício de toda a sociedade.Essa é a chance para você mudar a sua vida, corra e se inscreva!Responsabilidades e atribuiçõesApoiar Analistas de Sistemas TI nas definições técnicas, através de reuniões, levantamento de dados e análise de impacto garantindo a qualidade e coerência dos requisitos.Garantir a qualidade dos softwares implementando as melhores práticas de testes de software, junto a equipe de Qualidade Assegurada(QA) para correção de falhas, erros e defeitos com o objetivo de verificar e validar a entrega dos produtos finais aos participantes, Soluções e Apoio ao Participante (SAP), Monitoramento IMFAcompanhar e apoiar a execução das mudanças através de conferências, validando a efetividade dos procedimentos e garantindo que o objetivo proposto foi atingidoGarantir a gestão de configuração através do controle das releases e promoção dos pacotes, utilizando as ferramentas disponibilizadas pela Área de Qualidade, garantindo a evolução, integridade e continuidade do código-fonte dos produtos.Suporte a área de CDE Clientes e Líder de Técnico através do atendimento de eventos e incidentes a fim de atender as dúvidas, problemas e demais solicitaçõesRequisitos e qualificaçõesJava SE, Java EE, JUnit - IntermediárioSpring - BásicoBanco de Dados (DML, DDL, Oracle, SQL, DB2) - IntermediárioSistema Operacional (Linux, UNIX,) - BásicoControlador de Versão (GIT) - BásicoXML, XSD, Json - BásicoHTML, JavaScript, CSS, Angular 8+ - BásicoWebservice (SOA, REST) – Básico Conhecimentos desejáveis(opcionais)Websphere Application Server, JBoss, Websphere MQMaven, Nexus, Jenkins, SonarPython, Shell ScriptRUP, UMLTeste de Perfomance, Junit Segurança (Criptografia, Certificado Digital, Protocolo SPB) Connect Direct, XFB, CFTClean ArchitectureMetodologia ágil/ScrumModelagem de dadosAngular 2+/Javascript/TypescriptSpringboot/Microsserviços/RestInformações adicionaisModelo de Trabalho Home First (Maior parte Home Office com frequência mínima quinzenal no escritório)Salário compatível com o mercado - CLTBenefícios:Convênio Médico e OdontológicoVale Refeição/ Alimentação - CajuSeguro de VidaAuxilio educaçãoAuxilio homefirstPLRPrevidência PrivadaAuxílio creche",Núclea,vacancy_type_effective,,False,São Paulo,São Paulo,Brasil,https://nuclea.gupy.io/job/eyJqb2JJZCI6NzEyOTY4Miwic291cmNlIjoiZ3VweV9wb3J0YWwifQ==?jobBoardSource=gupy_portal,True,hybrid,True
6919345,2024-05-08T12:11:59.517Z,Engenheiro(a) de Software Full Stack Sênior,"Se você tem paixão por inovação e busca trabalhar em um ambiente que promove agilidade, colaboração e desafiados, esta pode ser a sua oportunidade! O Asaas ajuda empresas a gerir e automatizar seus processos financeiros e a melhorar o relacionamento com os seus clientes. Nossa conta digital é completa e reúne em um único lugar o envio e recebimento de cobranças, automação de comunicação por diversos canais e gestão de recebíveis descomplicada!Para nosso time de Engenharia, buscamos pessoas talentosas e capazes de construir sistemas complexos e de alta qualidade.Você estará diretamente em envolvimento com o negócio da empresa através da construção e manutenção de nossos sistemas. Nosso principal pilar é a qualidade daquilo que entregamos, entendemos que o importante é fazer bem feito ao invés de fazer rápido. Focamos na simplicidade da solução, nas entregas em pequenas partes e na autonomia das pessoas desenvolvedoras, a partir de um trabalho colaborativo.A maioria de nossas aplicações são construídas em Java, sendo necessário o interesse em atuar com essa tecnologia! Buscamos profissionais com habilidades de engenharia de software e abertura para novos aprendizados!Se interessou pela oportunidade mas não reside em Joinville? Não tem problema, possibilitamos o trabalho remoto/home office.Responsabilidades e atribuiçõesTransformar lógica de negócio em código de alta qualidade, respeitando os padrões e práticas estabelecidos; Participar da definição e implementação de novas funcionalidades e correção de bugs; Compreender e discutir os problemas e soluções propostas, buscando sempre a melhor solução técnica para os desafios encontrados;Revisar o código entregue pelos colegas de equipe;Dividir grandes entregas em pequenos entregáveis coesos;Monitorar a solução implementada em produção, avaliando erros, performance e disponibilidade; Colaborar com melhorias ou novos padrões na base de conhecimento da Engenharia.Requisitos e qualificaçõesExperiência com desenvolvimento WEB; Experiência com programação orientada a objetos e integração entre serviços via APIs Rest;Conhecimentos em HTML, CSS e Javascript; Vivência com algum banco de dados relacional; Conhecimento do pipeline de Deploy e versionamento de código com Git;Compreensão de boas práticas, padrões e princípios de Engenharia de Software;Inglês técnico.DiferenciaisEnsino superior em andamento em TI, Ciências da Computação ou áreas correlatas;Conhecimento avançado em Grails e suas diferentes versões.Informações adicionaisCarga horária de 8h por dia (segunda à sexta-feira - não compensamos os sábados);Contratação CLT.",Asaas,vacancy_type_effective,,True,,,Brasil,https://asaas.gupy.io/job/eyJqb2JJZCI6NjkxOTM0NSwic291cmNlIjoiZ3VweV9wb3J0YWwifQ==?jobBoardSource=gupy_portal,True,remote,True
7132012,2024-05-07T19:56:50.517Z,Desarrollador Full Stack,"¡Sé parte de Stefanini!​En Stefanini somos más de 30.000 genios, conectados desde 41 países, haciendo lo que les apasiona y co-creando un futuro mejor.Responsabilidades y atribucionesDesarrollo de software, bajo marco Scrum para proyectos.Amplia experiencia en lineamientos de desarrollo, infraestructura y arquitectura para desarrollo con Java, Angular 8 a más, implementando building blocks para la reutilización del código y aplicación de buenas prácticas de programación.Experiencia en Angular, NodeJs, interacción con GitHub y AWS, conocimientos: IaC, APIS, Lambdas, monitoreo proactivo, elastic search, GrafanaRequisitos y calificacionesProfesional de las carreras de Ingeniería de Sistemas o afines.4 años de experiencia en posiciones similares.",STEFANINI LATAM,vacancy_type_effective,,True,,,Colômbia,https://stefaninilatam.gupy.io/job/eyJqb2JJZCI6NzEzMjAxMiwic291cmNlIjoiZ3VweV9wb3J0YWwifQ==?jobBoardSource=gupy_portal,False,remote,True
7131987,2024-05-07T19:54:31.869Z,Desarrollador Full Stack ,"¡Sé parte de Stefanini!​En Stefanini somos más de 30.000 genios, conectados desde 41 países, haciendo lo que les apasiona y co-creando un futuro mejor.Responsabilidades y atribucionesDesarrollo de software, bajo marco Scrum para proyectos.Amplia experiencia en lineamientos de desarrollo, infraestructura y arquitectura para desarrollo con Java, Angular 8 a más, implementando building blocks para la reutilización del código y aplicación de buenas prácticas de programación.Experiencia en Angular, NodeJs, interacción con GitHub y AWS, conocimientos: IaC, APIS, Lambdas, monitoreo proactivo, elastic search, GrafanaRequisitos y calificacionesProfesional de las carreras de Ingeniería de Sistemas o afines.4 años de experiencia en posiciones similares.",STEFANINI LATAM,vacancy_type_effective,,True,,,Colômbia,https://stefaninilatam.gupy.io/job/eyJqb2JJZCI6NzEzMTk4Nywic291cmNlIjoiZ3VweV9wb3J0YWwifQ==?jobBoardSource=gupy_portal,False,remote,True
7109959,2024-05-07T19:02:00.081Z,DESENVOLVEDOR FULL STACK SR,"Somos a maior multinacional brasileira e estamos entre as 100 maiores empresas de TI do mundo.Estamos presentes em 41 países com +30k colaboradores. A Stefanini tem como principal objetivo auxiliar os clientes a encontrar, por meio de soluções personalizadas, a maneira ideal para alcançar seus desafios, impulsionando a inovação digital.E queremos mais!Responsabilidades e atribuiçõesProficiência em linguagens de programação como C#, utilizando o framework .NET Core e ASP.NET.Experiência com desenvolvimento front-end, incluindo HTML, CSS, JavaScript e frameworks como Angular ou React.Conhecimento em arquitetura de microserviços e design de APIs RESTful.Habilidade para implementar e manter bases de dados SQL (ex.: SQL Server, PostgreSQL) e NoSQL (ex.: MongoDB).Experiência com ferramentas de desenvolvimento de software, controle de versão (Git) e integração/entrega contínua (CI/CD).Familiaridade com práticas de DevOps, incluindo o uso de Docker e Kubernetes.Projetar e desenvolver soluções robustas e eficientes para a camada back-end utilizando .NET.Integrar soluções de front-end com APIs e serviços back-end, assegurando a comunicação fluida entre cliente e servidor.Gerenciar e otimizar bases de dados, garantindo performance e segurança.Contribuir para todas as fases do ciclo de vida do desenvolvimento de software, desde a concepção até a implantação e manutenção.Revisar código, implementar melhores práticas de programação e participar de sessões de code review.Requisitos e qualificaçõesEnsino Superior Completa.Certificações em .NET ou tecnologias relacionadas.Cursos avançados em segurança da informação, arquitetura de sistemas e cloud computing.Domínio de conceitos de OOP (Programação Orientada a Objetos) e padrões de design.Familiaridade com metodologias ágeis, como Scrum e Kanban.Conhecimento em testes unitários e testes automatizados.Experiência com segurança de aplicações, incluindo conhecimentos de vulnerabilidades comuns e suas soluções.Informações adicionaisO que te oferecemos:🍛 Vale Alimentação ou Vale Refeição;👨🏼‍🎓 Desconto em cursos, universidades e instituições de idiomas; 📚 Academia Stefanini - plataforma com cursos online, gratuitos, atualizados e com certificado; 🗣 Mentoring;🏫 Auxílio Creche; 💉 Clube de vantagens para consultas e exames;🏥 Assistência Médica;🦷Assistência Odontológica; 💰 Clube de vantagens e descontos nos melhores estabelecimentos;👂🏾 Atendimento psicológico online ao colaborador e seus dependentes;🛫 Clube de viagens;🐶 Convênio para Pet;e muito mais...",Stefanini Group,vacancy_type_effective,,False,Barueri,São Paulo,Brasil,https://stefanini.gupy.io/job/eyJqb2JJZCI6NzEwOTk1OSwic291cmNlIjoiZ3VweV9wb3J0YWwifQ==?jobBoardSource=gupy_portal,True,hybrid,True
7124307,2024-05-07T13:08:27.089Z,7124307 - Desenvolvedor Full Stack (Node.js) Sr,"Com 25 anos de experiência no mercado de Tecnologia da Informação, a MTP é uma empresa multinacional com mais de 1.000 colaboradores espalhados em mais de 11 unidades em nível global, o que nos permite promover o crescimento e intercâmbio profissional. A MTP é líder no fornecimento de serviços e soluções de TI com foco em Quality Assurance. Possuímos mais de 10 certificações, incluindo o TMMI - level 5, o mais alto nível da categoria. Oferecendo um dos mais amplos portfólios, entregamos soluções inovadoras e flexíveis para ajudar empresas a resolver seus desafios mais complexos. Atuando em projetos em mais de 14 países, tais como: Alemanha, Reino Unido, Japão, Suécia, Coréia do Sul, Moçambique, Guatemala, Argentina, Chile, Peru, entre outros.Responsabilidades e atribuiçõesYou'll work across the full stack using a range of web technologies including node.js, typescript, AWS producing clean, scalable code, integrating backend data and designing functional, user-friendly UIs and web layouts using HTML and CSS and React js.In this Role You'll be working on the R&amp;D department of Bayer helping automate business workflows. Requisitos e qualificações Requirements: • BS/MS degree in Computer Science, similar technical field of study or equivalent practical experience. • Experience as a node.js full stack developer • Experience designing and implementing large, scalable web applications and api's • Strong Experience in AWS. • Experience in Lambdas, S3, SQS, SNS, Kafka, Step Functions in AWS. • Experience with front-end web technologies (e.g., HTML5, CSS3, JavaScript, ReactJs) • Unit &amp; Integration testing • Experience building highly scalable Rest APIs hosted on could environment • Strong Experience designing databases in PostgreSQL, Oracle • Strong use of source control like GIT and understanding of GIT workflow • Cloud-first development experience with automated, continuous delivery deploymentsTop must have skills: • A minimum of 3 years of experience • Node.js Development • AWS • React or AngularInformações adicionaisAtuação: Home OfficeBenefícios:Plano de saúde;Plano odontológico;Vale alimentação;Vale refeição;Vale mobilidade;Vale cultura;Vale saúde;Vale educação;Seguro de vida;Auxílio creche;Descontos em parceiros.",MTP Métodos e Tecnologia – Brasil,vacancy_type_effective,,True,,,Brasil,https://mtpbrasil.gupy.io/job/eyJqb2JJZCI6NzEyNDMwNywic291cmNlIjoiZ3VweV9wb3J0YWwifQ==?jobBoardSource=gupy_portal,False,remote,True
7128449,2024-05-07T13:55:09.177Z,[067] Pessoa Desenvolvedora Fullstack Sênior,"Você é uma pessoa apaixonada por desenvolvimento de software e busca um ambiente de trabalho estimulante, onde sua criatividade e habilidades técnicas possam evoluir continuamente? Então, vem somar com a gente! 🚀✨ Estamos em busca de uma Pessoa Desenvolvedora Fullstack Sênior para somar com nossa equipe supimpa. Aqui, valorizamos a liberdade e a responsabilidade, encorajando você a trazer suas ideias inovadoras para solucionar desafios de maneira única. 😍✨ Acreditamos que a soma de expertises e paixão são a chave para o sucesso, e você terá a oportunidade de colaborar com profissionais incríveis que compartilham o mesmo entusiasmo pelo que fazem. 🙌✨ Venha fazer parte do nosso time e aproveitar um ambiente de trabalho colaborativo com somas constantes que farão sua carreira evoluir 🚀Sua jornada de sucesso começa aqui! Nossa soma, sua evolução #vemserilegra 🧡💜💛+++ Conheça mais sobre o processo seletivo em nosso playbook: encurtador.com.br/bvS89Responsabilidades e atribuiçõesDesenvolver e manter aplicações web robustas utilizando Typescript como linguagem principal;Colaborar com equipes multidisciplinares para entender requisitos de negócios e traduzi-los em soluções técnicas eficientes;Implementar e otimizar APIs RESTful usando Node.js e NestJS para garantir alto desempenho e escalabilidade;Projetar e desenvolver interfaces de usuário responsivas e intuitivas com React, seguindo as melhores práticas de UX/UI;Realizar testes unitários e integração contínua para garantir a qualidade do código e a estabilidade das aplicações;Participar ativamente de revisões de código, fornecendo feedback construtivo e contribuindo para a melhoria contínua do processo de desenvolvimento.Requisitos e qualificaçõesGraduação completa nas áreas de Engenharia de Computação, Ciências da Computação, Análise e Desenvolvimento de Sistemas ou correlatas; Experiência mínima de 5 anos comprovada em desenvolvimento Fullstack, com foco em Typescript, Node.js, React e NestJS;Profundo conhecimento em arquitetura de software e design de padrões, como MVC e SOLID;Familiaridade com bancos de dados relacionais (NoSQL, MySQL, MongoDB etc.);Habilidade para escrever código limpo, legível e modular, seguindo princípios de desenvolvimento ágil;Capacidade de solucionar problemas de forma criativa e eficiente, demonstrando pensamento analítico e habilidades de resolução de problemas;Excelentes habilidades de comunicação e colaboração, capazes de trabalhar efetivamente em equipe e se comunicar com partes interessadas técnicas e não técnicas.Informações adicionaisO que oferecemos:🩺 Assistência Médica (RS: Unimed | Demais Estados: Bradesco Saúde);🦷 Assistência Odontológica (RS: Odontoprev | Demais Estados: Bradesco);🏡 Auxílio Home Office;🍽 Vale alimentação e Vale refeição (Alelo);🧠 Zenklub (2 sessões gratuitas por mês, desconto nas demais);💪 Wellhub;📖 Apoio em cursos e certificações;🎯 Udemy for Business;👩‍🎓 Convênio com Instituições de ensino;🧘‍♀️ Programa Taking care, everywhere (saúde mental e bem-estar);🌍 Flexibilidade (anywhere office).",ilegra,vacancy_type_effective,,True,,,Brasil,https://ilegra.gupy.io/job/eyJqb2JJZCI6NzEyODQ0OSwic291cmNlIjoiZ3VweV9wb3J0YWwifQ==?jobBoardSource=gupy_portal,True,remote,True
7128253,2024-05-07T13:24:16.122Z,Desenvolvedor FullStack PHP - Pleno,"Entendemos que a nossa missão é guiar empresas rumo à transformação digital, preparando-as para os novos desafios e mudanças do cenário atual!Temos o propósito de gerar conexões confiáveis entre pessoas e tecnologias.A Trade Technology conta com uma equipe diversificada e altamente capacitada, oferecendo Consultoria on demand, soluções efetivas, flexíveis e qualificadas em TI, softwares de inteligência cognitiva e infraestrutura, objetivando simplificar a gestão de negócio dos nossos clientes.Responsabilidades e atribuiçõesComo DEV Trade você irá atuar em times multidisciplinares e colaborativos para o desenvolvimento de nossos sistemas.Irá analisar e compreender as exigências e funcionalidades que o sistema e aplicação deverá executar de acordo com os requisitos definidos. Desenvolver a codificação para as camadas de front e back-End, com integrações com apis de mercado, efetuar os testes unitários e acompanhar os testes e ajustes com os usuários.Assegurar que a aplicação entregue, esteja em conformidade com a arquitetura concordada, garantindo a qualidade e exigências definidas com o cliente.Requisitos e qualificaçõesExperiência em programação;Conhecimento nas linguagens/Frameworks: PHP, Laravel, Angular, HTML/CSS;Conhecimento em Banco de Dados: PostgreSQL e MongoDB;Conhecimento em GIT;É necessário ter concluído ou estar cursando graduação em Tecnologia da Informação, Ciência da Computação, Engenharia da Computação, Sistemas de Informação, Análise e Desenvolvimento de Sistemas ou áreas afins.DiferencialExperiência em microserviços;Experiência em RPA;Experiência em DevOps;Experiência em AWS (EC2 e S3).Informações adicionaisVaga CLTContratação HO ou Híbrido para Maringá-PR.Benefícios:Incentivo a CapacitaçãoA sede pelo conhecimento faz parte do nosso dia-a-dia! Incentivamos a capacitação dos nossos colaboradores e apoiamos sua trajetória em eventos e jornadas de certificação.Incentivamos a capacitação dos nossos colaboradores e apoiamos seu crescimento oferecendo participação em eventos e certificações.Somos parceiros IBM, Oracle, Microsoft e de outros players do mercado de tecnologia, o que garante acesso às plataformas de treinamento online mais renomadas do mundo todo.Vale Alimentação e RefeiçãoFlexível - Flash CartõesPara manter as energias necessárias para realizar os desafios diários você recebe um cartão com créditos mensais para utilizar em lanchonetes, restaurantes, mercados e estabelecimentos cooperados.Plano de SaúdeZelamos pelo seu bem-estar e para isso oferecemos um plano de saúde corporativo.Plano OdontológicoNossos colaboradores recebem um plano odontológico 100% para realizar os mais diversos procedimentos dentais. Mais motivos para sorrir! Assim como o plano de saúde, também oferecemos aos nossos colaboradores, plano odontológico sem custos algum de mensalidade.Plano de CarreiraPlanejar o futuro faz parte da ideologia da Trade Technology. Através da definição de metas a curto/ médio e longo prazo e uma política de feedbacks, estimulamos o crescimento profissional dos nossos colaboradores. Definimos metas de curto a longo prazo e estabelecemos feedbacks periódicos para que o progresso de todos seja pleno e contínuo.R2D2Recebemos créditos galácticos, nossa própria moeda, criada para dar acesso à geladeira mais amada do pedaço que carinhosamente chamamos de R2D2, repleta de refris, energéticos, águas e sucos.Os créditos galácticos também abrem os portais do freezer Gela Boca, e quem resiste a um sorvetinho pós almoço!Seguro de VidaTodos os colaboradores da Trade Technology contam com seguro de vida ativo, custeado completamente pela empresa.BonificaçãoA cada semestre, de acordo com as entregas e indicadores de cada área, realizamos as bonificações dos times como forma de reconhecer todos o empenho e dedicação envolvidos no período.Plataforma de gestão de pessoasUtilizamos a plataforma Qulture.Rocks para incentivar nossa cultura de feedbackÉ pelo Qulture que alinhamos nossas prioridades semanais, fazemos e recebemos elogios, marcamos reuniões de metas, gestão de OKRS e planos de desenvolvimento com nossos gestores. Essa plataforma auxilia gestores, RH e todos os colaboradores para que não desviem de seus objetivos, de modo intuitivo, fácil e divertido.﻿Área:Informática, TI, Internet e Telecomunicação",Trade Technology,vacancy_type_effective,,True,,,Brasil,https://tradetechnology.gupy.io/job/eyJqb2JJZCI6NzEyODI1Mywic291cmNlIjoiZ3VweV9wb3J0YWwifQ==?jobBoardSource=gupy_portal,True,remote,True
