job_id,published_date,title,description,career_page_name,type,application_deadline,is_remote_work,city,state,country,job_url,disabilities,workplace_type,submitted
7219114,2024-06-03T18:43:27.730Z,Analista de Dados - Oracle IQ,"Ser MJVer 🤝 é estar em um dos melhores lugares para trabalhar. Nós sabemos que na construção de uma sociedade mais forte a evolução deve vir de dentro para fora. Por isso, um ambiente acolhedor e com o sentimento constante de pertencimento é fundamental para o crescimento individual e coletivo. O esforço é de todos nós, e as conquistas também. Porque ser um MJVer é bem mais do que ser um colaborador: é sobre fazer parte. Somos colaborativos, ágeis, plurais, criativos e inovadores. Somos MJV!  Saiba mais em Quem Somos: https://www.mjvinnovation.com/pt-br/quem-somos/Responsabilidades e atribuiçõesAnalista de Oracle Infinity IQ - PlenoExperiência sólida na análise de dados, ser proficiente no uso da plataforma Oracle Infinity IQ, e capaz de transformar dados em insights acionáveis que melhorem nossas estratégias de marketing e operações de negócios.Responsabilidades:Configurar e gerenciar a plataforma Oracle Infinity IQ para otimizar a coleta e análise de dados.Desenvolver, implementar e manter dashboards e relatórios personalizados que suportem as necessidades de negócios.Analisar grandes volumes de dados e fornecer insights detalhados para melhorar a experiência do cliente e as operações de marketing.Colaborar com equipes de marketing, vendas e TI para garantir que as iniciativas de análise de dados estejam alinhadas com os objetivos estratégicos da empresa.Identificar tendências, padrões e oportunidades nos dados para recomendar ações estratégicas.Automatizar processos de coleta e análise de dados utilizando linguagens de programação e scripts (SQL, Python).Garantir a qualidade e integridade dos dados coletados e analisados.Requisitos e qualificaçõesExperiência de 3 a 5 anos em análise de dados, inteligência de negócios, ou funções similares.Experiência comprovada com a plataforma Oracle Infinity IQ.Proficiência em algumas das ferramentas de BI como Tableau, Power BI ou Oracle Analytics Cloud.Habilidade em linguagens de programação e scripts, como SQL, Python, ou R.Forte capacidade analítica com atenção aos detalhes e habilidade de resolver problemas complexos.Capacidade de trabalhar de forma colaborativa em um ambiente de equipe multifuncional.Experiência em marketing digital e compreensão de estratégias de marketing será um diferencial.Diferenciais:Certificações Oracle relevantes (Oracle Business Intelligence Foundation Suite 11g, Oracle Analytics Cloud).Certificações adicionais em análise de dados, como Certified Analytics Professional (CAP).Experiência em integração de dados de múltiplas fontes (APIs, bases de dados, ferramentas de CRM).Informações adicionais💪🏽 TotalPass;🍕 Vale Refeição;👨🏾‍ 🤝‍👩🏽‍🤝‍👩🏼 Seguro de vida em grupo;🏨 Plano de saúde e odontológico - Amil;🗣️ Grupos de idiomas;✈ People Mobility: damos uma forcinha para pessoas que tem interesse e disponibilidade de atuar em projetos desafiadores em outros estados e países;💻 Ações de treinamento: palestras, fóruns, trocas e conversas de conhecimentos relativos ao nosso negócio. Estamos em constante conexão para aprender mais e juntos;💲 Parcerias: quer desconto? Temos um grupo onde divulgamos parcerias com instituições de ensino, escolas de idiomas, academias, restaurantes, produtos e outros serviços;👉 Programa +MJVer: programa interno de indicação onde você indica um colega para trabalhar conosco e se esse relacionamento der match, você ganha um prêmio;💡 Co-criação: conectamos talentos para gerar soluções completas. Colaboração está no nosso sangue.",MJV Technology & Innovation,vacancy_type_effective,,False,São Paulo,São Paulo,Brasil,https://mjvcarreiras.gupy.io/job/eyJqb2JJZCI6NzIxOTExNCwic291cmNlIjoiZ3VweV9wb3J0YWwifQ==?jobBoardSource=gupy_portal,False,on-site,True
7245091,2024-06-03T18:40:23.085Z,Analista de Suporte Windows (Banco de Talentos),"Prestação de serviços de suporte presencial visando implementar e manter o ambiente do CONTRATANTE em plena operação. Analisar e antecipar possíveis soluções para potenciais problemas relacionados com o uso de recursos tecnológicos/produtos do Windows Data Center.Responsabilidades e atribuiçõesManter e administrar os recursos dos sistemas operacionais de servidores Windows no datacenter, incluindo análise, sustentação e planejamento de melhorias e atualizações contínuas do ambiente.Gerenciar sistemas na plataforma Microsoft para garantir total funcionalidade e compatibilidade. Instalar, configurar e manter servidores de DHCP, DNS, Active Directory, IIS, SQL Server com Always On, File Server (NFS &amp; SMB), NPS, SharePoint, Suíte System Center (com foco em System Center Configuration Manager, System Center Service Manager, System Center Orchestrator, System Center Operation Manager Enterprise Project Management), Ofice OnLine Server, Windows Failover Cluster, KMS e NLB.Administrar e demonstrar conhecimento sólido em Azure Active Directory.Utilizar PowerShell para construir e manter scripts de automação de tarefas.Demonstrar conhecimento avançado dos protocolos HTTP, SSL, FTP, NFS, SMB/CIFS, TCP, IP, SSH, ICMP, VRRP, RADIUS, NTP, UDP, TELNET, RDP, RPC, POP3, IMAP, SMTP e LDAP para autenticação de usuários.Assegurar o cumprimento das políticas e procedimentos de segurança da informação definidos.Transmitir conhecimento técnico de ferramentas, soluções, novas tecnologias, padrões e metodologias utilizadas, além de fornecer testes e emitir pareceres técnicos sobre soluções propostas.Fornecer suporte a clientes externos e internos, em nível III de suporte, garantindo a total funcionalidade e disponibilidade dos serviços.Colaborar com fornecedores no desenvolvimento, teste e avaliação de soluções solicitadas.Analisar a disponibilidade e tolerância a falhas em ambientes de Cluster. Atender pronta e corretamente as solicitações dos clientes, dentro do SLA determinado.Participar das manutenções preventivas e corretivas do ambiente computacional (Changes). Auxiliar e apoiar tecnicamente demais equipes e N1 e N2; Avaliar o desempenho de sistemas computacionais Windows.Demonstrar conhecimento avançado em Virtualização, Ambientes em Cluster, Ambientes de Alta Disponibilidade e Noções de Arquiteturas de Hardware de Computadores (SCSI, RAID, HBA).Criar e manter procedimentos técnicos atualizados. Elaborar e manter documentação do ambiente computacional e relatórios.Estabelecer/recomendar políticas e procedimentos para a utilização do sistema e serviços.Executar outros serviços relacionados administração de sistemas operacionais e serviços Windows.Requisitos e qualificaçõesFormação Acadêmica:Superior na área de Tecnologia da Informação, com curso devidamente reconhecido pelo Ministério da Educação;Cursos/Certificação:Microsoft® Certified Solutions Expert: Cloud Platform and Infrastructure;Curso em FundamentoExperiência Profissional:· Conhecimentos avançados em ambientes Windows;· Experiência comprovada na especialidade citada.· Experiência comprovada  em atividades relacionadas a mecanismos de pelo menos 2 atividades listadas abaixo:.   Administração Avançada de Servidores Microsoft Windows;   Implementação e Manutenção de Active Directory;   Implementação e Manutenção de Microsoft Exchange;   Office 365;s em DevOps;Informações adicionaisNossos benefícios:Plano de saúde Hapvida, Bradesco ou Unimed (aplicáveis de acordo com a região);Plano odontológico Hapvida Odonto ou Bradesco Dental;Vale Alimentação ou Refeição;Seguro de vida 100% custeado pela Lanlink;Vale transporte;Gympass;Auster;Convênio farmácia;Convênio faculdades;Plataforma de Educação Corporativa;Kit Bem-vindo ao mundo bebê;Plataforma Moodar.",Lanlink Informática,vacancy_type_talent_pool,,False,Goiânia,Goiás,Brasil,https://vempralanlink.gupy.io/job/eyJqb2JJZCI6NzI0NTA5MSwic291cmNlIjoiZ3VweV9wb3J0YWwifQ==?jobBoardSource=gupy_portal,True,on-site,True
7251897,2024-06-03T18:40:19.999Z,ANALISTA DE PROCESSOS / CONTROLES INTERNOS SENIOR | RJ,"Granado | Phebo abre as portas para você!Estamos em busca de um Analista de Processos e Controles Internos Sr. para fazer parte da nossa equipe. Se você é uma pessoa organizada, dinâmica e comprometida, esta pode ser a oportunidade perfeita para você. Como Analista de Processos e Controles Internos Sr, você será responsável por mapear os processos atuais das áreas operacionais administrativo e/ou estratégicos da empresa, bem como propor o desenho de fluxos, visando identificar melhorias, otimizar processos, mitigar riscos e criar / revisar os instrumentos normativos do Grupo Granado/Phebo.Responsabilidades e atribuiçõesConduzir análises detalhadas dos processos existentes para identificar oportunidades de melhoria.Desenvolver mapas de processos claros e compreensíveis.Propor e implementar melhorias nos processos para aumentar a eficiência e a eficácia.Colaborar com as partes interessadas para garantir a aceitação e a implementação bem-sucedida das melhorias.Utilizar ferramentas de modelagem para criar representações visuais dos processos atuais e propostos.Desenvolver e/ou atualizar os instrumentos normativos da empresa visando garantir a consistência nos processos.Criar manuais e guias para treinamento e referência.Garantir o armazenamento e divulgação dos instrumentos normativos da organização.Monitorar e avaliar continuamente o desempenho dos processos implementados.Identificar desvios e propor ajustes conforme necessário.Colaborar com as equipes para mitigar resistência e maximizar a adoção de mudanças.Monitorar e Fornecer orientação e treinamento aos colaboradores da organização sobre os instrumentos normativos, promovendo uma cultura de conformidade.Trabalhar em conjunto com as diversas áreas da empresa para entender suas necessidades e integrar processos de forma eficaz e eficiente.Requisitos e qualificaçõesBacharelado em Administração, Engenharia de Produção ou área relacionada.Proficiência em ferramentas de modelagem de processos (ex.: BMPN).Experiência na utilização da plataforma Bizagi;Experiência em análise de dados e uso de ferramentas analíticas.Conhecimento em metodologias de melhoria de processos, como Lean ou Six Sigma.Pacote Office Avançado.Inglês avançado.Fortes habilidades de comunicação e facilitação.Capacidade de influenciar e colaborar efetivamente em todos os níveis da organização.Boa escrita e organização.Informações adicionaisAmbiente de trabalho integrado, alegre e positivo.Horário flexível, para driblar os horários de pico!Vale-Refeição para bater aquele papo legal e descontraído com os seus colegas enquanto degusta as iguarias.Plano de saúde, odontológico e seguro de vida para garantir o seu bem-estar e o da sua família. Mente sã em corpo são, sempre.Sabe todos aqueles produtos maravilhosos da Granado e da Phebo? Você poderá comprar com desconto exclusivo!Quer se desenvolver? Nosso ambiente é um estímulo a criatividade e ao desenvolvimento. Também apoiamos o aprimoramento através do Programa de o Educação Continuada com subsídios para cursos de aperfeiçoamento, graduação, pós-graduação e idiomas.Programa de Participação nos Resultados. Valorizamos e incentivamos o compromisso de quem constrói junto conosco!",Granado - Desde 1870,vacancy_type_effective,,False,Rio de Janeiro,Rio de Janeiro,Brasil,https://granado.gupy.io/job/eyJqb2JJZCI6NzI1MTg5Nywic291cmNlIjoiZ3VweV9wb3J0YWwifQ==?jobBoardSource=gupy_portal,True,on-site,True
7248289,2024-06-03T18:41:04.957Z,ESPECIALISTA EM ANALISE DE DADOS I,"A Mobi7, pertencente ao grupo Localiza, é a líder em IOT e telemetria no Brasil. Estamos na vanguarda do desenvolvimento tecnológico, trabalhando incessantemente para melhorar a mobilidade urbana e impactar positivamente a sociedade através de soluções inovadoras.  Temos uma plataforma de gestão de frotas corporativas, criada para monitorar e otimizar o uso de veículos leves ou pesados. E esse é só o começo 😉Responsabilidades e atribuiçõesEstamos em busca de um Especialista em Análise de Dados experiente para integrar nosso time de tecnologia. O candidato ideal será responsável por extrair, transformar e analisar grandes volumes de dados, utilizando ferramentas da AWS e Power BI para gerar insights que suportem a tomada de decisão estratégica.O QUE VOCÊ IRÁ FAZER COMO ESPECIALISTA EM ANALISE DE DADOS:	• Criar e gerenciar dashboards e relatórios interativos no Power BI.	• Analisar dados de telemetria e outras fontes para identificar tendências e oportunidades de melhoria.	• Colaborar com equipes multifuncionais para entender requisitos de negócios e traduzir em soluções de dados.	• Garantir a qualidade e integridade dos dados através de práticas robustas de governança de dados.Requisitos e qualificaçõesO QUE PRECISAMOS: 	• Graduação em Ciência de Dados, Engenharia de Computação, Sistemas de Informação ou áreas correlatas.	• Experiência comprovada em análise de dados, preferencialmente no setor de telemetria ou automotivo.	• Proficiência em AWS, incluindo serviços como S3, RDS, Glue, Athena.	• Experiência com Power BI, incluindo DAX e a criação de dashboards complexos.	• Conhecimento em SQL para extração e manipulação de dados.	• Habilidade para trabalhar de forma independente e em equipe, com excelente comunicação e habilidades analíticas.	• Experiência com ferramentas de versionamento de código, como Git.DIFERENCIAIS:﻿	• Certificações AWS e Power BI.	• Conhecimento em Python ou R para análise de dados.	• Experiência com metodologias ágeis e ferramentas de gerenciamento de projetos como Azure Devops.Informações adicionaisParticipação nos LucrosCarro CorporativoVale AlimentaçãoVale RefeiçãoConvênio MédicoConvênio OdontológicoGympassPrevidência PrivadaVale TransporteAllyaAcesso ilimitado a diversos cursos da nossa Universidade LocalizaProgramas internos de treinamento e desenvolvimentoDesconto em compra e aluguel de veículosViva a experiência de ser Localiza&amp;Co e venha construir o futuro da mobilidade conosco!",Mobi7,vacancy_type_effective,,True,Curitiba,Paraná,,https://mobi7.gupy.io/job/eyJqb2JJZCI6NzI0ODI4OSwic291cmNlIjoiZ3VweV9wb3J0YWwifQ==?jobBoardSource=gupy_portal,False,remote,True
7251494,2024-06-03T18:26:20.022Z,Cientista de Dados - SR,"Se você tem o espírito criativo e inovador e quer trabalhar em um dos maiores institutos de ciência e tecnologia do Brasil essa é a sua chance! Venha conhecer o SiDi, e saiba mais sobre esta oportunidade. Estamos em busca de profissionais que tenham experiência em Ciência de Dados para fazerem parte do nosso time. O profissional irá trabalhar, no seu dia-a-dia, com dados de diversas fontes e dos mais variados tipos, construindo soluções através de técnicas de análise de dados, modelos de machine learning, reports e dashboards.Será necessário, além de habilidades técnicas, possuir pontos fortes como: trabalho em equipe, pró atividade, dinamismo e boa comunicação.Responsabilidades e atribuiçõesParticipar da criação e validação de hipóteses de negócio com base em dados; Participar da criação, alteração e propor o uso de algoritmos e ferramentas de análise e transformação de dados; Implementar serviços para o gerenciamento de grande quantidade de dados de fontes diversas; Participar da criação de repositórios de dados e/ou arquitetura de dados (base de dados estruturadas, não estruturadas, lago de dados, etc.); Participar da criação de consultas complexas de forma otimizada (sql, non-sql, etc), em termos de rapidez de acesso, desempenho computacional, manutenibilidade, etc;Prover visualização de dados para diferentes tipos de público (operacional, estratégico, gerencial, etc.);Trabalhar junto aos times de desenvolvimento de projetos alinhando a arquitetura dos sistemas/serviços com as necessidades de análise de dados;Compartilhar e disseminar o conhecimento com as equipes de projetos.Requisitos e qualificaçõesO que esperamos de você:Desenvolvimento de software (análise de requisitos, arquitetura, design, codificação, testes e deploy da solução);Já ter trabalhado com métodos ágeis (Scrum, Kanban, Lean, etc);Ferramentas de controle de versão como GIT, SVN, etc;Experiência em aprendizado de máquina (Machine Learning, Deep Learning)Experiência em mineração de dados complexos - SQL, NoSQL, etc.Ter trabalhado com as seguintes linguagens de programação de scripts (Python, Ruby, etc).Experiência em ferramentas de visualização de dados (Tableau, PowerBI, QuickSight, etc).Será considerado diferencial:Conhecimento em computação na nuvem (AWS, Azure, Google Cloud, etc.).Conhecimento em redes neurais.Conhecimento em Big Data - Hadoop, MapReduce, etc.Formação Acadêmica:Graduação completa nos cursos de Engenharia da Computação ou áreas correlatasIdiomas:Fundamental ter bom nível de inglês para escrita/leitura/conversação para interação com times do exterior (Coréia, Canadá, USA)Informações adicionaisOportunidade para Campinas/SP em regime de trabalho Híbrido (idas semanais ao escritório)O que esperamos de todos os #SiDiers:Abrir a mente para o novoManter diálogo aberto e diretoDesenvolver-se continuamenteFazer o melhor, sempreConstruir em parceriaPensar grande, fazer rápido O que oferecemos? • Qualidade de vida: Jornada de 40 horas semanais com regime CLT e horário flexível• Bem-Estar: Gympass, Ginástica Laboral, Massagista e Apoio Psicológico• Saúde: Convênio Médico e Odontológico para você e sua família• Filhos: Auxílio creche para os miniSiDiers, licença-maternidade de 120 dias e licença-paternidade estendida• Futuro:  Aqui, o SiDi investe com vocês na Previdência Privada• Educação: Programa de incentivo para a continuidade dos estudos e especialização, incentivo para que nossos SiDiers se tornem fluentes em outras línguas e ciclos de palestras semanais sobre trend topics mundiais• Alimentação: Vale Refeição e Vale Alimentação flexíveis• Transporte: Vale-transporte e/ou estacionamento para quem for trabalhar no escritório• Reconhecimento: Bônus anual por desempenho e premiações para SiDiers que fizeram algo incrível• Diversidade: Comitês sobre Bem-estar, Diversidade, Saúde Mental, Social, Sustentabilidade e Inclusão das mulheres na tecnologia• Escritórios Modernos: Ambientes descontraídos e colaborativos com espaços de convivência, sala de descompressão, copas, máquina de café e snacks, etc• Ainda quer mais? Dezenas de parcerias com benefícios e descontos! Para nós, inclusão não é apenas somar mais um ao nosso time, é somar diferenças e particularidades. É justamente dessa mistura de técnicas, habilidades e histórias que nos inspiramos para fazer diferentes pontos de vista olharem para um mesmo horizonte, sempre para frente.Trabalhamos em um ambiente de oportunidades iguais, independente de gênero, orientação sexual, religião ou deficiência. Todas as nossas vagas estão disponíveis para PCDs.CÓDIGO DA VAGA: 3623 - N3",SiDi,vacancy_type_effective,,False,Campinas,São Paulo,Brasil,https://sidi.gupy.io/job/eyJqb2JJZCI6NzI1MTQ5NCwic291cmNlIjoiZ3VweV9wb3J0YWwifQ==?jobBoardSource=gupy_portal,True,hybrid,True
7104905,2024-06-03T18:24:53.653Z,Analista de Dados Pleno,"Quer fazer parte de um time alta performance? A Neogrid é um ecossistema de tecnologia e inteligência de dados que ajuda a empresas a venderem mais, com mais margem 🚀Estamos em busca de pessoas com foco em performance, capazes de se guiar por métricas de negócios reais e acionáveis, e que nos ajude a impactar o mundo do varejo, da indústria, da tecnologia e dos consumidores 👩‍💻Na Neogrid, temos o desafio de entregar os melhores resultados com dedicação e excelência, nos superando cada vez mais todos os dias!Aqui, você terá a oportunidade de entregar o seu valor, ajudando os maiores players do mercado nacional a manter suas empresas no ritmo dos consumidores!Se você se identificou, temos o desafio certo para você!Responsabilidades e atribuiçõesNesta oportunidade, você irá: Interagir com os geradores e receptores de dados para entender e atuar em questões de qualidade de dados e processos da nossa cadeia de serviços;Mapear e documentar as regras de qualidade de dados junto às áreas de negócio e de produtos;Evoluir os padrões e métricas para a qualidade dos dados;Criar plano de ação para atuar sob os ofensores de qualidade de dados;Contribuir com o Time de Governança de Dados para construção de processos;Entender a melhor forma de explorar os dados, buscando atender as demandas das áreas parceiras de Estratégia e Cobrança nas quais daremos suporte a dados;Construir visões gráficas dos resultados encontrados, que facilitem o entendimento das áreas e dos executivos, colaborando com as decisões de negócio tomadas;Mapear, estruturar e disponibilizar as informações de performance e indicadores para as áreas de apoio e operações;Analisar acompanhamentos de performance operacional do negócio;Desenvolver estudos que oriente as tendências operacionais, por meio da mensuração de resultados e comparativos para tomada de decisão, visando a obtenção da melhor eficiência para o negócio;Atualizar materiais de reuniões, analisando as informações e fornecendo suporte nesses fóruns. Requisitos e qualificaçõesPara isso, esperamos que você tenha:Conhecimento em SQL;Conhecimento em Power BI;Experiência com análise de dados;Conhecimento em Pacote Office;Habilidade para trabalhar em equipe;Gosto por desafios, resolução de problemas e facilidade de aprendizado;Experiência no desenvolvimento, publicação e engajamento de stakeholders em políticas e processos;Habilidade para construir narrativas e comunicar o valor das atividades de governança de dados para toda a empresa.Será um plus se você tiver: Experiência com metodologias ágeis e OKR;Experiência como Business Analyst ou outros papéis em áreas de negócio.Informações adicionaisPor que fazer parte do nosso time? 💚❤️💜💙Acreditamos no poder da diversidade, que amplia, inclui e faz crescer. Crescer a liberdade, a inovação e as oportunidades. e pensando nas nossas pessoas: 🌍 Nossas oportunidades são Remotas ou Híbridas! O nosso modelo de trabalho varia conforme a função.⏰ Aqui temos Flexibilidade em nosso Horário de Trabalho! 🏥 Cuidamos da sua saúde! Com nosso Plano de Saúde, Plano Odontológico, e Seguro de Vida (todos extensíveis a dependentes legais).💊 Tá com aquela dor? Temos Auxílio Medicamento, que também é extensível para filhos e filhas!🚍 Disponibilizamos Vale Transporte ou Auxílio Estacionamento para você que mora nas cidades em que nosso ecossistema está presente!🍔 Quer fazer um lanchinho ou as compras do mês? Com nosso Vale Alimentação/Refeição flexível, em cartão Flash, é você quem manda.💰 Está buscando aquele descontão? Aqui temos Clube de Vantagens!🏋️ E o shape, como fica? Deixa com o Gympass.🏖️ Bora tirar aquela folga? No mês do seu aniversário, você terá o dia da sua escolha para descansar como quiser.👨‍🎓 Temos a UNICO SKILL, solução educacional de capacitações externas para o desenvolvimento contínuo de Neogriders que podem escolher o que estudar, com opções de Graduação, MBA/Pós, Idiomas e Cursos Livres!🏫 Cuidamos de você e da sua família! Fornecemos Auxílio Creche e Licença Parental Estendida de 6 meses para mamães e de 30 dias para papais.📓 Quer se manter atualizado sobre o negócio e os produtos da empresa e ganhar brindes por isso? Temos a YOU, nossa Universidade Corporativa.📈 Queremos que você se desenvolva! Por isso, temos PDI (Plano de Desenvolvimento Individual), para você desenhar seus próximos passos com a gente, e Avaliações de Desempenho, para que você tenha clareza sobre o que esperamos de você.🧸 O NeoBaby é o nosso programa parental para recém mamães e papais!💵 Temos Programa de Indicação! Nos ajude a encontrar mais pessoas para ajudar a Neogrid a continuar crescendo e ganhe uma grana por isso. Se o seu propósito conversa com o nosso, vem crescer com a gente!",Neogrid Carreiras,vacancy_type_effective,,True,,,Brasil,https://neogridcarreiras.gupy.io/job/eyJqb2JJZCI6NzEwNDkwNSwic291cmNlIjoiZ3VweV9wb3J0YWwifQ==?jobBoardSource=gupy_portal,True,remote,True
