job_id,published_date,title,description,career_page_name,type,application_deadline,is_remote_work,city,state,country,job_url,disabilities,workplace_type,submitted
6897444,2024-03-26T19:26:04.234Z,Pessoa Desenvolvedora Fullstack React Native/ReactJS/NodeJS Analista II (ESG),"O que é o gb.tech?  Somos o time de tecnologia do GB e nosso espírito inquieto nos faz estar sempre de olho nas tendências futuras. A tecnologia é fundamental para revolucionar toda a nossa jornada, da pesquisa e desenvolvimento de produtos até a venda final para nossos consumidores - e é através dela que estamos construindo o melhor e maior ecossistema de beleza para o mundo.  Cada novo processo, lançamento e solução exigem eficiência, habilidade e inovação. Só assim é possível manter a velocidade e o dinamismo do nosso crescimento e entregar beleza em cada canto do Brasil e em mais de 15 países. E é isso que o time do gb.tech está fazendo no Grupo Boticário. Temos o compromisso em construir um ambiente cada vez mais diverso e inclusivo. Valorizamos a Diversidade e estamos comprometidos com a promoção da inclusão e equidade em nossos times.Como parte da nossa estratégia em prol da diversidade e inclusão, buscamos a representatividade da sociedade em nossos times. Por isso, temos vagas destinadas aos grupos minorizados priorizados em nossa estratégia: pessoas com deficiência, pessoas negras (pretas e pardas), mulheres (cis e trans), pessoas da comunidade LGBTQIA+ e pessoas 50+.Essa ação faz parte de uma estratégia ligada aos nossos compromissos e fortalecimento de nossa cultura equânime.Conheça mais sobre nossos compromissos em: https://www.umabelezadefuturo.com.br Responsabilidades e atribuiçõesComo vai ser o seu dia? ﻿Atuará na Squad de ESG TECH Social como desenvolvedor Analista II, será responsável pelo desenvolvimento de novos produtos e features do escopo Social da companhia, utilizando boas práticas no desenvolvimento de uma aplicação manutenível e escalável, com domínio e afinidade com mobile e frontend e também possibilidade de apoio em backend.Desenvolver ou evoluir features tanto no Mobile e FrontEnd e apoio em BackEnd;Escrever um código legível e reutilizável,Identificar e registrar bloqueios no desenvolvimento de suas atividades;Participar de reuniões de planejamento e refinamento;Documentar o código;. Seguir o fluxo de trabalho e acordos da squad;Contribuir com as discussões técnicas de construção do produto;Estar atento aos avanços do mercado e a temática de sustentabilidade, buscando trazer inovação para as mesas de discussão;Apoiar desenvolvedores menos experientes durante sua jornada como colaborador;Trabalhar de forma colaborativa, usando de boa comunicação e praticando feedback com pares e líderes;Se apaixonar pela resolução de problemas e buscar as melhores soluções;Praticar a escuta ativa e gosta de aprender sempre coisas novasSuportar a fase de sustentação do produto atuando em eventuais correções bugs;Requisitos e qualificações O que você precisa ter ou saber?Experiência de desenvolvimento com React Native e React/NextJs.Experiência de desenvolvimento com TypescriptExperiência com Expo. Experiência com documentação de componente com storybook.Experiência com BFF e GraphQL;Experiência com deploy na App Store e Play Store. Conhecimentos em ferramentas de monitoramento ou analytics para aplicativo(Google Analytics).Conhecimento do ciclo de vida de uma plataforma. Expertise com usabilidade e gerenciamento de memória.Conhecimento em boas práticas de performance mobile; Clean Code.Conhecimento em Design Patterns; Algoritmos e estrutura de dados;Experiência com Continuous Deployment (Github Actions) e Fastlane;Ser propositivo e colaborativo com o time de desenvolvimento;Entendimento da pirâmide de testes e conhecimento de boas práticas de qualidade como TDD e BDD;Experiência com produtos digitais;Vivência em times ágeis (Scrum, Kanban, XP);Boa capacidade analítica;Ter afinidade e interesse no tema de sustentabilidade;Informações adicionaisNOSSOS BENEFÍCIOSJá falamos que o Grupo Boticário é o melhor e maior ecossistema de beleza, né? E quando falamos dos Benefícios, oferecemos um pacote super diferenciado e pensado para estar presente em todos os momentos da vida dos colaboradores.Confere só um resumo dos benefícios* que temos por aqui:Alimentação-Vale Refeição-Vale Alimentação-Auxílio Natal  Bem-Estar e Qualidade de vida -Gympass-Meu Pet Club (plano de saúde para pets)-Auxílio home office (modelos híbrido e remoto)-Desconto de até 40% em nossos produtos-Associação para colaboradores (convênios e parcerias, loja multimarcas, academias total pass, cursos e muito mais!)-Programa de Viagens e Hospedagens (Travel Cash)-Day off de aniversárioFamília - Auxílio Educação Infantil- Nutrição Infantil- Auxílio Babá- Kit Educação-Orientação jurídica, psicológica e social- Apoio País Atípicos-Licença Parental estendida (180 dias para mães e 120 dias para pais)Saúde -Assistência médica e odontológica-Auxílio Medicamentos-Vale saúde para familiares -Plataforma de psicoterapiaSeguridade -Seguro de Vida -Previdência Privada-Empréstimos consignados Mobilidade -Vale Combustível -Vale Transporte e Estacionamento (modelos híbrido e presencial)*Pacote de benefícios conforme regras de elegibilidade",gb.tech,vacancy_type_effective,2024-04-30T00:00:00.000Z,True,,,Brasil,https://gbtech.gupy.io/job/eyJqb2JJZCI6Njg5NzQ0NCwic291cmNlIjoiZ3VweV9wb3J0YWwifQ==?jobBoardSource=gupy_portal,True,remote,True
6915190,2024-03-27T12:19:27.287Z,Pessoa Engenheira de Software - Front End Jr | Afirmativa para pessoas negras,"Sobre a Elo Somos uma empresa 100% Brasileira!A Elo é uma das principais empresas de tecnologia de pagamentos no Brasil. Com mais de dez anos de história e mais de 43 milhões de cartões ativos em parceria com 38 emissores. Com nosso DNA brasileiro e inovador, temos a missão de fomentar a inclusão de Pagamentos digitais no Brasil.  Oferecemos um portfólio completo de cartões de crédito, débito, pré-pagos e especializados para pessoas e empresas. Além disso, desenhamos soluções customizadas para empresas, seja por meio das nossas plataformas de tokenização e de prevenção a fraudes, pagamentos por aproximação via QR Code e NFC, ou nossa consultoria especializada em gerar mais negócios para os nossos parceiros.Respeitamos as individualidades e promovemos uma cultura inclusiva, que busca a equidade e valoriza as diferenças (ex: Gênero, Religião, PcD, LGBTQIAP+, Raça e Etnia). Todas as nossas vagas respeitam esse compromisso.Quer mais informações sobre a Elo? Acesse: https://www.elo.com.br/Curtiu? Então vem saber mais sobre o desafio que temos pra você! ❤️💙💛Nosso time de Engenharia ﻿Somos responsáveis por desenvolver sistemas de pagamento seguros e eficientes. Nossos engenheiros trabalham com tecnologias modernas, agilidade e práticas de desenvolvimento de software para criar soluções inovadoras, garantir a integridade dos dados e a proteção contra fraudes. Além disso, eles colaboram com equipes multidisciplinares para melhorar a experiência do usuário e impulsionar a inovação em meios de pagamentos. Responsabilidades e atribuiçõesComo Engenheiro(a) de Software Jr você vai: Atuar no desenvolvimento de novas soluções;Habilitar outras áreas para publicação de conteúdo e gestão de páginas de produtos;Trabalhar na sustentação de canais, áreas de engajamento e inovação Elo;Atuar com APIs, microfrontends e diversas arquiteturas de software.Requisitos e qualificaçõesPara esse desafio precisamos que você:Experiência com Java Script;Experiência com Typescript;Experiência com React;Experiência na criação de componentes para reuso;Conhecimento de versionamento de código com GIT;Experiência no uso de metodologias ágeis e todos os seus ritos;Conhecimento de Node, aplicações REST para realizar a integração de sistemas;Conhecimento no uso do Framework Next;Experiência na criação de testes unitários.Além disso será diferencial se você:Conhecer Design System;Possuir experiência com Copilot;Tailwind CSS.Informações adicionaisPara trabalhar na Elo, buscamos pessoas que:Tenham atitude protagonista e empenham-se em superar resultados;Respondem rapidamente às mudanças, com foco e simplicidade na execução de seu trabalho;Jogam muito bem em time, compartilhando conhecimento e reconhecendo o desempenho e importância de cada colega;Valorizam o diálogo aberto e feedbacks honestos;Isso traduz bem nossos valores de cultura, que são: “Sou Coragem, Sou Responsa e Sou Comunidade”.Aqui na Elo, cultura é DNA. E nosso DNA é como a gente: Bem brasileiro e impulsiona nosso jeito único de fazer as coisas.Confere aqui nossos benefícios e facilidades:Programa de Participação nos Resultados (PPR);Assistência médica (Bradesco);Assistência odontológica Opcional (Bradesco);Seguro de vida (Banco do Brasil);Previdência privada opcional (Podendo contribuir com até 7.8% do salário e a participação da Elo entre 100% e 200% de acordo com regras);Vale refeição/alimentação de R$ 1.800,00;Cartão Natal R$750,00;Auxílio Home Office (R$ 200,00 para modelo híbrido e R$300,00 para modelo remoto);Auxílio Mobilidade, Vale Transporte ou reembolso Fretado;Reembolso de pedágio;Estacionamento gratuito em nosso escritório de Barueri;Auxílio Creche para mães e pais;Auxílio Cultura (Benefício a ser usado em teatro, cinema ou livrarias);Licença parentalidade estendida (para casais homoafetivos, pais, adotantes e etc.);Day off de aniversário;Zenklub (Psicoterapia - até 4 sessões ao mês pagas integralmente pela Elo);Gympass (Rede de academias e estúdios para práticas esportivas).Importante:Nossa empresa oferece três tipos de formas de trabalho: híbrido, presencial e totalmente remoto, mas vale ressaltar que o modelo de trabalho adotado pode variar de acordo com a dinâmica e as necessidades específicas de cada área da empresa.Nosso escritório fica localizado em Barueri/SP na Alameda Xingu, 512 - Alphaville Industrial. ",Elo,vacancy_type_effective,,True,,,Brasil,https://vempraelo.gupy.io/job/eyJqb2JJZCI6NjkxNTE5MCwic291cmNlIjoiZ3VweV9wb3J0YWwifQ==?jobBoardSource=gupy_portal,False,remote,True
6920569,2024-03-27T12:15:09.179Z,Pessoa Engenheiro de Software - Front End Pl ,"Sobre a Elo Somos uma empresa 100% Brasileira!A Elo é uma das principais empresas de tecnologia de pagamentos no Brasil. Com mais de dez anos de história e mais de 43 milhões de cartões ativos em parceria com 38 emissores. Com nosso DNA brasileiro e inovador, temos a missão de fomentar a inclusão de Pagamentos digitais no Brasil.  Oferecemos um portfólio completo de cartões de crédito, débito, pré-pagos e especializados para pessoas e empresas. Além disso, desenhamos soluções customizadas para empresas, seja por meio das nossas plataformas de tokenização e de prevenção a fraudes, pagamentos por aproximação via QR Code e NFC, ou nossa consultoria especializada em gerar mais negócios para os nossos parceiros.Respeitamos as individualidades e promovemos uma cultura inclusiva, que busca a equidade e valoriza as diferenças (ex: Gênero, Religião, PcD, LGBTQIAP+, Raça e Etnia). Todas as nossas vagas respeitam esse compromisso.Quer mais informações sobre a Elo? Acesse: https://www.elo.com.br/Curtiu? Então vem saber mais sobre o desafio que temos pra você! ❤️💙💛Nosso time de Engenharia ﻿Somos responsáveis por desenvolver sistemas de pagamento seguros e eficientes. Nossos engenheiros trabalham com tecnologias modernas, agilidade e práticas de desenvolvimento de software para criar soluções inovadoras, garantir a integridade dos dados e a proteção contra fraudes. Além disso, eles colaboram com equipes multidisciplinares para melhorar a experiência do usuário e impulsionar a inovação em meios de pagamentos. Responsabilidades e atribuiçõesComo Engenheiro(a) de Software Pl você vai: Atuar no desenvolvimento de novas soluções;Habilitar outras áreas para publicação de conteúdo e gestão de páginas de produtos;Trabalhar na sustentação de canais, áreas de engajamento e inovação Elo;Atuar com APIs, microfrontends e diversas arquiteturas de software.Requisitos e qualificaçõesPara esse desafio precisamos que você:Experiência com Java Script;Experiência com Typescript;Experiência com React;Experiência na criação de componentes para reuso;Conhecimento de versionamento de código com GIT;Experiência no uso de metodologias ágeis e todos os seus ritos;Conhecimento de Node, aplicações REST para realizar a integração de sistemas;Conhecimento no uso do Framework Next;Experiência na criação de testes unitários.Além disso será diferencial se você:Conhecer Design System;Possuir experiência com Copilot;Tailwind CSS;Experiência com implantação dos diversos tipos de Microfrontends. Informações adicionaisPara trabalhar na Elo, buscamos pessoas que:Tenham atitude protagonista e empenham-se em superar resultados;Respondem rapidamente às mudanças, com foco e simplicidade na execução de seu trabalho;Jogam muito bem em time, compartilhando conhecimento e reconhecendo o desempenho e importância de cada colega;Valorizam o diálogo aberto e feedbacks honestos;Isso traduz bem nossos valores de cultura, que são: “Sou Coragem, Sou Responsa e Sou Comunidade”.Aqui na Elo, cultura é DNA. E nosso DNA é como a gente: Bem brasileiro e impulsiona nosso jeito único de fazer as coisas.Confere aqui nossos benefícios e facilidades:Programa de Participação nos Resultados (PPR);Assistência médica (Bradesco);Assistência odontológica Opcional (Bradesco);Seguro de vida (Banco do Brasil);Previdência privada opcional (Podendo contribuir com até 7.8% do salário e a participação da Elo entre 100% e 200% de acordo com regras);Vale refeição/alimentação de R$ 1.800,00;Cartão Natal R$750,00;Auxílio Home Office (R$ 200,00 para modelo híbrido e R$300,00 para modelo remoto);Auxílio Mobilidade, Vale Transporte ou reembolso Fretado;Reembolso de pedágio;Estacionamento gratuito em nosso escritório de Barueri;Auxílio Creche para mães e pais;Auxílio Cultura (Benefício a ser usado em teatro, cinema ou livrarias);Licença parentalidade estendida (para casais homoafetivos, pais, adotantes e etc.);Day off de aniversário;Zenklub (Psicoterapia - até 4 sessões ao mês pagas integralmente pela Elo);Gympass (Rede de academias e estúdios para práticas esportivas).Importante:Nossa empresa oferece três tipos de formas de trabalho: híbrido, presencial e totalmente remoto, mas vale ressaltar que o modelo de trabalho adotado pode variar de acordo com a dinâmica e as necessidades específicas de cada área da empresa.Nosso escritório fica localizado em Barueri/SP na Alameda Xingu, 512 - Alphaville Industrial. ",Elo,vacancy_type_effective,,True,,,Brasil,https://vempraelo.gupy.io/job/eyJqb2JJZCI6NjkyMDU2OSwic291cmNlIjoiZ3VweV9wb3J0YWwifQ==?jobBoardSource=gupy_portal,False,remote,True
6846889,2024-03-26T20:54:59.153Z,Pessoa Engenheira de Software Sênior - (Front End - ReactJs),"O propósito de Inteligência Comercial é entregar de maneira ágil, soluções de tecnologia que proporcionem as melhores ofertas comerciais para cada pessoa, maximizando rentabilidade para a Via. Atuamos nos seguintes contextos funcionais: Precificação de Produtos e Fretes, Ofertas, Dinâmicas Promocionais, Catálogo de Produtos, Feed, Sortimento e Bonificação. Você atuará na Squad Catálogo de Produtos, cuja missão é ser uma plataforma focada na gestão eficiente de produtos.Estamos buscando uma Pessoa Desenvolvedora Front-End Sênior para se juntar à nossa equipe de desenvolvimento. Como parte da nossa equipe, você fará parte de uma Squad de desenvolvimento, trabalhando em conjunto para projetar, desenvolver e manter interfaces e recursos complexos para aplicativos web que atendam às necessidades de design, funcionalidade e complexidade dos usuários finais.Responsabilidades e atribuições✔ Desenvolvimento e manutenção de aplicações web usando ReactJS com TypeScript; ✔ Colaborar com designers e equipe de back-end para implementar soluções de interface de usuário eficazes e atraentes; ✔ Escrever testes de unidade usando React Testing Library para garantir a qualidade do código; ✔ Utilizar CSS in JS, preferencialmente Stitches, para criar componentes de UI reutilizáveis e fáceis de manter; ✔ Usar Context API para gerenciar o estado da aplicação de forma eficiente e escalável; ✔ Usar SWR (React Query) para gerenciar o estado da aplicação e tornar o aplicativo mais rápido e eficiente;✔ Demonstrar habilidades sólidas em acessibilidade e implementar recursos de acessibilidade de acordo com os padrões WCAG. Requisitos e qualificaçõesCom certeza você tem que ter: ✔ Experiência profissional comprovada em desenvolvimento ReactJS com TypeScript; ✔ Experiência comprovada em testes usando Jest ou Vitest com React Testing Library; ✔ Experiência em desenvolvimento de componentes de UI com CSS in JS, preferencialmente Stitches;✔ Experiência em gerenciamento de estado da aplicação usando Context API e SWR (React Query); ✔ Excelente habilidade de resolução de problemas e solução de bugs; ✔ Familiaridade com metodologias ágeis. Seria muito legal se você tivesse (diferenciais): ✔ Experiência com micro front-ends. ✔ Implementação de recursos de acessibilidade de acordo com os padrões WCAG;✔ Se você tem paixão por desenvolvimento ReactJS, é pró-ativo, gosta de trabalhar em equipe e busca constantemente aprender e se aprimorar, então essa pode ser a oportunidade perfeita para você! Estamos ansiosos para receber sua candidaturaInformações adicionaisAqui você encontrará:Um ambiente dinâmico e em crescimento acelerado que permite muita autonomia!Atuação 100% remotaSalário CompetitivoBônus anual de acordo com atingimento de resultadosAssistência Médica e OdontológicaVale RefeiçãoPrevidência PrivadaSeguro de VidaAssistência FuneralSuporte social e psicológico gratuitoExtensão da Licença Maternidade - 180 diasExtensão da Licença Paternidade - 20 diasIncentivo à prática de atividade física: Gympass e Total PassDr. Via Saúde: Telemedicina 100% online, sem limite de uso e sem coparticipação Via de Descontos: Plataforma de descontos de até 70% em produtos e serviços dos mais variados segmentos em aproximadamente 2.000 parceiros em todo Brasil e América Latina#VEMPROGRUPOCASASBAHIA",Tecnologia Grupo Casas Bahia,vacancy_type_effective,,True,,,Brasil,https://tecnologiagrupocasasbahia.gupy.io/job/eyJqb2JJZCI6Njg0Njg4OSwic291cmNlIjoiZ3VweV9wb3J0YWwifQ==?jobBoardSource=gupy_portal,True,remote,True
6896520,2024-03-26T19:57:00.897Z,Anl. Engenharia de Software Sênior (Front-End),"O que faz a área de Engenharia de Software (Hub de Vendas) na Porto?A área de tecnologia do HUB Vendas tem como principal desafio transformar o mercado de Seguros através de uma plataforma de vendas 100% digital com todos os produtos e serviços Porto em um só lugar. Responsabilidades e atribuiçõesAtuar na liderança técnica junto a squad, sendo responsável pelas decisões e definições técnicas;Elevar o nível das práticas de teste e de qualidade de código do time prevenindo o acúmulo de dívida técnica, provendo insights em code reviews;Mantém a comunicação garantindo que os sistemas críticos construídos pelo time estejam bem documentados e compartilhando aprendizados;Acompanhar a execução junto ao time e fazer as negociações necessárias com outras áreas para tratamento de integrações e dependências;Buscar por inovações no mercado que se apliquem a nossa realidade;Prezar pela qualidade do código criado seguindo as boas práticas de desenvolvimento;Compreender as necessidades do negócio da Porto e propor soluções eficazes;Desenvolver sistemas com tecnologia de ponta, escaláveis e de alta resiliência;Incentivar e melhorar as práticas ágeis;Criar, validar e otimizar a arquitetura para front-end;Escrever testes unitários e automatizados.Requisitos e qualificaçõesSólida experiência como desenvolvedor front-end e vivência com back-end;Experiência sólida com Typescript;Experiência com ecossistema React/NextJS;Conhecimento em integração de sistemas utilizando serviços e/ou APIs (Rest, GraphQL);Prática na criação de testes unitários automatizados e testes de integração;Boas práticas de Git;Conhecimento Clean Code;Metodologia Ágil (Scrum e Kanban); Desejável:Cria e mantém documentação clara, concisa e completa dos sistemas críticos para garantir sua sustentação a longo prazo;Conhecimento em serviços AWS;Ferramentas de monitoramento e alertas (Kibana, Grafana, AppDynamics, Dynatrace);Ferramentas colaborativas (Jira e Confluence).Informações adicionaisBenefíciosVale Alimentação e Refeição: Seu VR e VA são flexíveis, para que você atenda às suas necessidades e defina a melhor maneira de utilizá-los;Vale-Transporte: Para nos encontrarmos na Porto;Serviços de Transporte: Para o seu conforto e segurança no trajeto até o nosso escritório, disponibilizamos vans nas principais estações de acesso à Porto: Luz, Barra Funda, Santa Cecília e Júlio Prestes;Plano de Saúde, Odontológico e Seguro de Vida: Para que você possa se cuidar, e também cuidar de seus dependentes;Participação nos Lucros - PLR: Pois sabemos que só vamos crescer, se crescermos juntos;Porto em Ação: Programa complementar à PLR, disponibilizando anualmente, até 2025, uma porcentagem de valor do seu salário em ações da Porto;Pais, mães e filhos: Auxílio creche ou babá, para cuidar do seu bem mais precioso;Previdência Privada - PortoPrev: Para você garantir um futuro mais tranquilo;Gympass: Para você possa se exercitar e cuidar da sua saúde física em diversas academias, onde estiver;Bolsa de estudos; Para você começar uma graduação ou que sonha em fazer uma segunda faculdade ou pós-graduação.Cursos de Idiomas: Subsídio para cursos de Inglês e Espanhol;Programa Saúde Integral: Série de benefícios e iniciativas para te apoiar a encontrar equilíbrio de forma integral, através de três pilares: saúde mental, saúde física e saúde financeira;Desconto em Produtos e Serviços: Para que você possa desfrutar dos produtos e serviços deste nosso ecossistema gigante;Local de trabalho: Centro de São Paulo Modelo de Trabalho: Flexível",Porto,vacancy_type_effective,2024-04-16T00:00:00.000Z,False,São Paulo,São Paulo,Brasil,https://porto.gupy.io/job/eyJqb2JJZCI6Njg5NjUyMCwic291cmNlIjoiZ3VweV9wb3J0YWwifQ==?jobBoardSource=gupy_portal,True,hybrid,True
6940320,2024-03-26T20:52:51.643Z,Back office de Relacionamento,"É a pessoa responsável por todo atendimento prestado ao cliente após a efetivação do seguro com o intuito de manter o relacionamento e gerar novas oportunidade de negócios, trabalha na área de relacionamento, focado no pós vendas de clientes ativos. Requisitos e qualificaçõesNivel superior: Cursando ou Concluído;Conhecimento do pacote office;Ter afinidade com tecnologia; Ter gestão de tempo; Ter resiliência e empatia; Ser organizado, comunicativo, ousado; Gostar muito de aprender; Ter habilidade com processo; Ser excelente em redigir e-mail; Gostar de cuidar de pessoas. Informações adicionaisJornada de Trabalho:de segunda à sexta-feira;entrada às 09h, e saída às 18h;Benefícios:Vale Alimentação: R$ 805,00; 60% do plano de saúde Bradesco; Plano Odontológico; Seguro de Vida; Vale Transporte; Programa de Participação nos Lucros e Campanhas. ",Nossas oportunidades!,vacancy_type_effective,2024-04-03T00:00:00.000Z,False,Belém,Pará,Brasil,https://juntosconectandodiferencas.gupy.io/job/eyJqb2JJZCI6Njk0MDMyMCwic291cmNlIjoiZ3VweV9wb3J0YWwifQ==?jobBoardSource=gupy_portal,False,on-site,True
