job_id,published_date,title,description,career_page_name,type,application_deadline,is_remote_work,city,state,country,job_url,disabilities,workplace_type,submitted
7261911,2024-06-20T14:21:00.363Z,Cientista de Dados - Especialista,"Há mais de 90 anos, o Banco Bmg vem construindo uma trajetória de conquistas, onde o cliente é o protagonista. ​Somos campeões na oferta de consignado, proporcionando acesso ao crédito com juros mais baixos a milhões de brasileiros. Contamos com agências, franquias e um aplicativo, onde milhões de clientes acessam um mundo de soluções financeiras, na palma da mão. Além disso, possuímos a maior rede de correspondentes bancários do país, contribuindo para o placar de crescimento econômico local e espalhando oportunidades por todo o território nacional.​​Aqui no Bmg, nós vestimos a camisa e nos dedicamos para executar cada jogada com excelência, com um jeito todo nosso de ser e de fazer negócios, o Jeito Bmg.​Trabalhamos para promover uma cultura diversa, que busca a equidade, valorizando as diferentes perspectivas. Isso se traduz em Gênero, Religião, Pessoas com Deficiência, LGBTQIAP+, acima dos 50 anos, Etnia e diversidade de experiências, tornando o nosso ambiente mais inclusivo e respeitoso, buscando cada vez mais aumentar a pluralidade dos times.Responsabilidades e atribuiçõesDesenvolver, validar e implementar modelos e algoritmos de aprendizado de máquina.Trabalhar com grandes conjuntos de dados e resolver problemas complexos de análise de dados.Colaborar com equipes multifuncionais para entender as necessidades do negócio e fornecer soluções baseadas em dados.Apresentar informações usando técnicas de visualização de dados.Manter-se atualizado sobre as últimas tendências e técnicas em ciência de dados.Requisitos e qualificaçõesExperiência mínima de 5 anos como Cientista de Dados ou papel similar.Profundo conhecimento de linguagens de programação como Python.Experiência com bancos de dados SQL e NoSQL.Experiência com ferramentas de aprendizado de máquina (como TensorFlow ou PyTorch) e frameworks voltados a ciência de dados.Fortes habilidades analíticas e habilidade para trabalhar com dados complexos.Excelentes habilidades de comunicação e capacidade de explicar conceitos complexos de maneira clara e concisa.Informações adicionaisBenefícios, saúde e bem-estar Plano de saúde sem mensalidade e Telemedicina;Plano odontológico;Vale Refeição e Alimentação;Seguro de vida;Previdência privada;Remuneração variável anual (bônus) competitiva;PPR - Programa de Participação nos Resultados;Único Skill (Benefício Educação gratuito);Bicicletário e vestiário;Auxílio creche;Auxílio internet;Programas de qualidade de vida;Ambulatório;Programa da Gestante;Licença Maternidade e Paternidade estendida;Psicologia Viva - Sessões de terapia online gratuita;PAP - Programa de assessoria financeira, jurídica e psicológica;Gympass - Desconto em academias;Frutas todos os dias;Day Off de Aniversário;Dress Code Flexível;Modelo híbrido de trabalho. E aí? Quer vestir a camisa e brilhar em campo com um banco presente na vida de milhões de brasileiros e reconhecido como um dos melhores lugares para se trabalhar? #VamosPraCima",Banco Bmg,vacancy_type_effective,,False,São Paulo,São Paulo,Brasil,https://bmg.gupy.io/job/eyJqb2JJZCI6NzI2MTkxMSwic291cmNlIjoiZ3VweV9wb3J0YWwifQ==?jobBoardSource=gupy_portal,True,hybrid,True
7315673,2024-06-20T14:07:58.346Z,PESSOA ANALISTA RELACIONAMENTO JUNIOR - FOCO EM DADOS E POWER BI - EXCLUSIVA PARA PESSOAS COM DEFICIÊNCIA,"AQUI SUA CARREIRA COMEÇA GRANDE.VENHA SER UMA PESSOA ANALISTA RELACIONAMENTO JUNIOR - FOCO EM DADOS E POWER BI - EXCLUSIVA PARA PESSOAS COM DEFICIÊNCIA NA YDUQS.Temos um projeto grandioso e que requer um time com disposição para pensar de forma original, disruptiva, e com objetivo de resolver as grandes questões de hoje na educação: acesso, tecnologia, customização e o sucesso dos nossos alunos.Somos uma companhia cheia de energia, que já nasceu gigante e com resultados extraordinários.Venha fazer parte desse time!VENHA TRANSFORMAR VIDAS. INCLUSIVE A SUA.Responsabilidades e atribuiçõesOs principais desafios como PESSOA ANALISTA RELACIONAMENTO JUNIOR - FOCO EM DADOS E POWER BI - EXCLUSIVA PARA PESSOAS COM DEFICIÊNCIA são:Desenvolvimento e implementação de soluções de BI que permitam uma análise aprofundada dos resultados corporativos.Projetar, desenvolver e implementar dashboards interativos e relatórios eficazes.Utilizar ferramentas de BI para apresentar dados de maneira clara e compreensível.Identificar e implementar melhorias para otimizar o desempenho dos dashboards e relatórios.Trabalhar em conjunto com as equipes de negócios para entender os KPIs cruciais e os insights necessários.Requisitos e qualificaçõesBuscamos profissionais com:Ensino superior completo em áreas da TI; Capacidade para construção de Dashboards;Capacidade analítica para dados; Conhecimento e habilidades com ferramentas como SQL, modelagem de dados e Power BI; Habilidades intermediárias com pacote office; Informações adicionaisLocal de Trabalho: Av. Venezuela, 43 - Saúde, RJHorário de Jornada: 09h às 19h de segunda a quinta e das 09h às 18h às sextasNa YDUQS você vai encontrar:Bolsas de estudo de até 100% para colaboradores, dependentes legais e agregados (pai, mãe e irmãos (as). Permitindo até três bolsas simultâneas;Assistência médica com subsídio integral para o colaborador e parcial para sua família, com o colaborador responsável pela coparticipação;Assistência odontológica opcional, para cuidar da sua saúde bucal;Vale Alimentação ou Vale Refeição com opção de escolha para se adequar às suas necessidades;Gympass ou Totalpass para opções flexíveis de academias;Bem-estar e clube de vantagens com programa dedicado e vantagens exclusivas;Dresscode flexível para promover a nossa diversidade;Seguro de vida;Convênio com o SESC;Universidade Corporativa no nosso portal exclusivo, Educare;Oportunidades de crescimento, hoje mais de 60% das vagas são fechadas com processo de seleção interno.💻 Modelo de trabalho híbrido para todos os escritórios corporativos da companhia.🤰 Trabalho remoto (home office) estendido para as mães e pais recém-chegados da licença maternidade e paternidade por até 3 meses, de acordo com a função desenvolvida.🎓Acreditamos na excelência do nosso ensino e, por isso, valorizamos os egressos das nossas instituições em nossos processos seletivos.👩🏽‍🦽 Mais inclusão: essa vaga também é destinada a pessoas com deficiência.DIVERSIDADE: A YDUQS valoriza a diversidade e as informações adicionais prestadas nos campos de diversidade são muito importantes para nós, por isso pedimos para que não deixe de responder.",YDUQS,vacancy_type_effective,,False,Rio de Janeiro,Rio de Janeiro,Brasil,https://yduqs.gupy.io/job/eyJqb2JJZCI6NzMxNTY3Mywic291cmNlIjoiZ3VweV9wb3J0YWwifQ==?jobBoardSource=gupy_portal,False,hybrid,True
7328577,2024-06-20T14:25:48.219Z,Desenvolvedor RPA - Python - PL,"A Maxxi é uma empresa jovem e cheia de energia. Nascemos nessa nova era representada pela diversidade de ideias e inovação contínua e por isso seguimos crescendo em ritmo acelerado e em constante transformação.Estamos buscando talentos para compor nosso time de Desenvolvimento de RPAs (Robotic Process Automation) em Python.O seu trabalho será desenvolver robôs para automação de processos usando a tecnologia Python, testando e apoiando as validações com as área de negócio e garantindo a qualidade de todo o trabalho executado.Responsabilidades e atribuiçõesExperiência no uso de ferramentas de RPA.Capacidade de projetar fluxos de trabalho de automação eficientes e lógicos, levando em consideração os requisitos e objetivos do projeto.Capacidade de identificar e automatizar tarefas repetitivas e baseadas em regras usando RPA interagindo com aplicativos de desktop, web ou sistemas legados.Habilidade para integrar diferentes sistemas e aplicativos, como bancos de dados, APIs e serviços da web, com as automações RPA.Compreensão dos ciclos de vida de desenvolvimento de software.Forte capacidade de entender o contexto do código, a base de código e sua relação com os objetivos de negócios.Capacidade de trabalhar de forma independente e em equipe.Excelente capacidade analítica e de resolução de problemas.Mentalidade de crescimento e disposição para aprender novas habilidades, tecnologias e estruturas.Requisitos e qualificaçõesRequisitos:Conhecimento da tecnologia Python;Conhecimento em RPA;Conhecer as diferentes camadas que compõem um software;Conhecimento de arquitetura Cloud, principalmente Azure e AWS;Conhecimento de protocolos de envio (SFTP, por exemplo);Ter trabalhado em projetos com metodologia Agile (Scrum, Kanban).Diferencial:Conhecer a plataforma BotCity;Informações adicionais#VEMPRAMAXXIA Maxxi é uma consultoria de tecnologia que trabalha com os clientes para resolver seus problemas de dados e de negócios, otimizando operações e atuando fortemente por seu sucesso. Criativos e criadores, buscamos sempre a excelência pela inovação!Estamos sempre à procura de talentos que busquem desafios e crescimento profissional para completar o nosso time. Buscamos os melhores talentos onde eles estiverem.Venha fazer parte desse time!BENEFÍCIOS CLTAuxílio estudo;Plano de saúde;Plano odontológico;Vale Refeição (cartão Swile);Bônus anual conforme performance;Seguro de vida;Day-off aniversario;TotalPass;Auxílio creche;Auxílio home office.Trabalho Remoto.Benefícios PJ Consulte-nos.",Maxxidata ,vacancy_type_effective,,True,,,Brasil,https://maxxioportunidades.gupy.io/job/eyJqb2JJZCI6NzMyODU3Nywic291cmNlIjoiZ3VweV9wb3J0YWwifQ==?jobBoardSource=gupy_portal,True,remote,True
7328987,2024-06-20T14:23:38.946Z,Desenvolvedor RPA - Python - SR,"A Maxxi é uma empresa jovem e cheia de energia. Nascemos nessa nova era representada pela diversidade de ideias e inovação contínua e por isso seguimos crescendo em ritmo acelerado e em constante transformação.Estamos buscando talentos para compor nosso time de Desenvolvimento de RPAs (Robotic Process Automation) em Python. O seu trabalho será desenvolver robôs para automação de processos usando a tecnologia Python, testando e apoiando as validações com as área de negócio e garantindo a qualidade de todo o trabalho executado.Responsabilidades e atribuiçõesExperiência no uso de ferramentas de RPA.Capacidade de projetar fluxos de trabalho de automação eficientes e lógicos, levando em consideração os requisitos e objetivos do projeto.Capacidade de identificar e automatizar tarefas repetitivas e baseadas em regras usando RPA interagindo com aplicativos de desktop, web ou sistemas legados.Habilidade para integrar diferentes sistemas e aplicativos, como bancos de dados, APIs e serviços da web, com as automações RPA.Compreensão dos ciclos de vida de desenvolvimento de software.Forte capacidade de entender o contexto do código, a base de código e sua relação com os objetivos de negócios.Capacidade de trabalhar de forma independente e em equipe.Excelente capacidade analítica e de resolução de problemas.Mentalidade de crescimento e disposição para aprender novas habilidades, tecnologias e estruturas.Requisitos e qualificaçõesRequisitos:Conhecimento da tecnologia Python;Conhecimento em RPA;Conhecer as diferentes camadas que compõem um software;Conhecimento de arquitetura Cloud, principalmente Azure e AWS;Conhecimento de protocolos de envio (SFTP, por exemplo);Ter trabalhado em projetos com metodologia Agile (Scrum, Kanban). Diferencial:Conhecer a plataforma BotCity;Informações adicionais#VEMPRAMAXXIA Maxxi é uma consultoria de tecnologia que trabalha com os clientes para resolver seus problemas de dados e de negócios, otimizando operações e atuando fortemente por seu sucesso. Criativos e criadores, buscamos sempre a excelência pela inovação!Estamos sempre à procura de talentos que busquem desafios e crescimento profissional para completar o nosso time. Buscamos os melhores talentos onde eles estiverem.Venha fazer parte desse time!BENEFÍCIOS CLTAuxílio estudo;Plano de saúde;Plano odontológico;Vale Refeição (cartão Swile);Bônus anual conforme performance;Seguro de vida;Day-off aniversario;TotalPass;Auxílio creche;Auxílio home office.Trabalho Remoto.Benefícios PJ Consulte-nos.",Maxxidata ,vacancy_type_effective,,True,,,Brasil,https://maxxioportunidades.gupy.io/job/eyJqb2JJZCI6NzMyODk4Nywic291cmNlIjoiZ3VweV9wb3J0YWwifQ==?jobBoardSource=gupy_portal,True,remote,True
7312907,2024-06-20T13:03:42.907Z,Pleno/Senior Software Engineer (Python),"Somos a Iteris.Uma empresa de tecnologia que desde 2009 integra o humano e o tecnológico visando agregar cada vez mais valor para a transformação digital dos nossos clientes.Já somos mais de 900 pessoas apaixonadas por tecnologia e unidas por laços reais, que acreditam que a excelência nos resultados é a soma das qualidades técnicas e comportamentais.Somos Next-Gen IT Services e queremos que você faça parte do nosso futuro.#VemFazerAcontecer com a gente!Responsabilidades e atribuiçõesÉ Desenvolvedor Python? Então #VemFazerAcontecer com a gente.Nessa posição, sua missão será:Compreender o negócio e a necessidade do cliente, de forma a desenvolver a aplicação que melhor atenda aos seus desafios, dentro do prazo estipulado.Requisitos e qualificaçõesO que você precisa conhecer?Python com fastAPIReact(diferencial)Frameworks (Django, Pyramid, etc)Mensageria (Service Bus, Kafka, etc)Testes unitários (Robot, PyTest, Unittest etc)Git, GitFlowDesenvolvimento de APIs RESTfulBanco de dados relacionais (SQL Server, Oracle, MySQL, PostgreSQL) e não relacionais (Redis, MongoDB, DynamoDB)Cloud (AWS)Informações adicionaisAcreditamos em um potencial independentemente de gênero, raça, idade, religião, deficiências, aspectos culturais ou políticos.Benefícios que oferecemos:Cesta de benefícios flexível para distribuir livremente entre VR e VA;Assistência Médica Premium nacional;Assistência Odontológica;Subsídio de Certificações;PLR;Gympass;Auxílio-creche;Seguro de Vida;Day Off no mês de aniversário;Plano de Carreira;Comunidades de Prática.",Iteris,vacancy_type_effective,,True,,,Brasil,https://iteris.gupy.io/job/eyJqb2JJZCI6NzMxMjkwNywic291cmNlIjoiZ3VweV9wb3J0YWwifQ==?jobBoardSource=gupy_portal,True,remote,True
7318521,2024-06-20T17:03:12.996Z,Data Governance | Specialist,".Responsabilidades e atribuiçõesDesenvolver e implementar políticas de governança de dados, incluindo padrões de qualidade de dados, segurança e conformidade;Atuar como defensor da Governança de Dados dentro da organização, promovendo melhores práticas e a cultura de gestão de dados;Desenvolver e conduzir treinamentos e workshops sobre governança de dados para colaboradores;Trabalhar em estreita colaboração com equipes de TI e Negócio para alinhar as estratégias de dados com os objetivos da Organização;Monitorar e auditar a qualidade dos dados, identificando e corrigindo problemas de inconsistência e imprecisão;Gerenciar o ciclo de vida dos dados; Garantir a conformidade com regulamentações relevantes, como LGPD e GDPR;Criar e manter a documentação de governança de dados, incluindo políticas, procedimentos e fluxos de trabalho.Requisitos e qualificaçõesExperiência em governança de dados, preferencialmente em projetos de data lake ou big data;Conhecimento sólido em políticas e práticas de governança de dados, incluindo qualidade de dados, segurança de dados e gestão de metadados;Conhecimento em padrões da indústria para governança de dados (ex: DAMA);Habilidade para comunicar de forma eficaz conceitos técnicos e benefícios de negócios para diferentes públicos, incluindo alta diretoria;Excelência em análise de dados e resolução de problemas;Proatividade, organização e atenção aos detalhes.Diferencial: Certificações em governança de dados.Não possui todos os requisitos para a vaga?Está tudo bem! Na Compass UOL, estimulamos o desenvolvimento contínuo de novos talentos e transformamos desafios em oportunidades.Informações adicionais#remote""remote""",Compass.UOL,vacancy_type_effective,,True,,,Brasil,https://compass.gupy.io/job/eyJqb2JJZCI6NzMxODUyMSwic291cmNlIjoiZ3VweV9wb3J0YWwifQ==?jobBoardSource=gupy_portal,True,remote,True
7341757,2024-06-20T16:26:31.394Z,Estagiário em Data Analytics,"Nascemos para transformar a vida de milhares de pessoas, provendo as ferramentas e o caminho para quem enfrenta a indiferença e supera cada obstáculo para conquistar os seus sonhos.Trabalhamos com propósito, senso de urgência e dor de dono. Somos uma das startups que cresce mais rápido em toda a América Latina.Já são mais de62.000 clientes alugando nossas motos e mais de 5.000 empresas utilizando o Mottu Entregas como solução de delivery – para realizar mais de 1.000.000 entregas mensalmente, em São Paulo, Campinas, Curitiba, Belo Horizonte, Cidade do México e outras 50 cidades do Brasil.Grandes investidores já acreditam no nosso sonho, como Base Partners, Crankstart e Tiger Global. E você, quer construir a Mottu conosco?Você quer aprender a trabalhar com autonomia, profundidade, utilizando dados e tecnologia para atingir as soluções desejáveis? Está em busca de crescimento acelerado de carreira? Então essa oportunidade é para você.Responsabilidades e atribuiçõesResponsabilidades:Realizar buscas em base de dados nativas SQL, PostgreSQL e GoogleSQL para obtenção de dados;Fazer análises e propor soluções escaláveis baseadas em dados;Acompanhar as soluções oferecidas e identificar seus impactos a longo prazo;Requisitos e qualificaçõesRequisitos:Estar cursando graduação em Administração, Economia, Engenharias, Física ou Ciência da Computação;Perfil analítico orientado a negócios;Organização;Disponibilidade de horário;Vaga 100% presencial;",Mottu,vacancy_type_internship,,False,São Paulo,São Paulo,Brasil,https://vagasmottu.gupy.io/job/eyJqb2JJZCI6NzM0MTc1Nywic291cmNlIjoiZ3VweV9wb3J0YWwifQ==?jobBoardSource=gupy_portal,False,on-site,True
7339156,2024-06-19T22:31:12.316Z,Desenvolvedor(a) PL/SR | Data Analytics,"Somos ávidos por tecnologia, criatividade e desafios.Se você gosta de desafios, aprendizado constante e valoriza as conexões pessoais, junte-se a nós!O QUE BUSCAMOS?Buscamos Desenvolvedores Data Analytics, em níveis de carreira pleno e sênior, que queiram trabalhar conosco em um ambiente descontraído e animado, com aprendizado diário no desenvolvimento de grandes projetos, junto a grandes clientes nacionais e internacionais. Temos escritórios em Maringá, São Paulo e Chicago (EUA), mas você pode trabalhar de forma remota.O QUE ESSE PROFISSIONAL IRÁ FAZER?Manutenção em bases de dados de analytics, sua rotina de atualização e integridade dos dadosCriação de novos reports e dashboards em Data Studio, e manutenção dos existentesDesenvolvimento de manutenção de relatórios em Google Sheets a partir de scripts trazendo dados de diversas basesManutenção e execução de melhorias em sistemas AccessO QUE É NECESSÁRIO PARA A POSIÇÃO?Conhecimento e experiência com as seguintes ferramentas e tecnologias: Snowflake, Pentaho, Google Data Studio, MS Access, Python e SQLO QUE SERIA UM DIFERENCIAL?Inglês avançadoQUAIS SÃO OS BENEFÍCIOS?Cartão flexível (VR/VA)Plano de SaúdePlano OdontológicoPLRSeguro de vidaAuxílio home officeWellhub (antigo Gympass)Apoio PassPrograma de indicação de funcionáriosConvênios de descontos com universidades, escolas de idiomas e restaurantesPara ver mais sobre, acesse o link logo abaixo 🤩Responsabilidades e atribuiçõesRequisitos e qualificaçõesInformações adicionais",Objective (Brazil),vacancy_type_effective,,True,,,Brasil,https://objective.gupy.io/job/eyJqb2JJZCI6NzMzOTE1Niwic291cmNlIjoiZ3VweV9wb3J0YWwifQ==?jobBoardSource=gupy_portal,True,remote,True
7337300,2024-06-19T19:31:37.194Z,Pessoa Data Scientist Sênior,"Estamos buscando uma pessoa que ouse protagonizar ocupando a posição de Data Scientist. 💜Junte-se à Datum e faça parte da 6ª melhor empresa para trabalhar no Rio Grande do Sul e a 28ª do Brasil pelo GPTW!Responsabilidades e atribuições Estamos procurando um cientista de dados com habilidades para solucionar problemas e projetar pipelines que sejam facilmente reprodutíveis em várias plataformas.O candidato deve ter conhecimento das stacks de desenvolvimento do mercado e contribuir para a melhoria das plataformas de Analytics. Requisitos e qualificaçõesExperiência prévia como Cientista de dadosEspecialista em técnica avançada de Inteligência Artificial.Conhecimento em Linguagens: Python, SQL;Ferramentas: principais pacotes de análise de dados, aprendizado de máquina e pesquisa operacional: Pandas, NumPy, Matplotlib, Scikit-learn, Keras, OR-Tools;Domínio em estatística: estatística básica, variáveis aleatórias contínuas e discretas, função densidade de probabilidade, propriedades das distribuições, principais distribuições, testes de hipóteses;Conhecimento em aprendizado de máquina: criação de modelos supervisionados e não supervisionados;Conhecimento de bancos de dados: modelo de banco de dados relacional, sintaxe de SQL, álgebra relacional (join, group by, order by), chaves primárias, secundárias e estrangeiras;Experiência comprovada em Ferramentas da Microsoft;Experiência comprovada em metodologias ágeis.Informações adicionaisNossos datunianos usufruem de benefícios e programas que atendem diversas áreas da vida.Para sua saúde, oferecemos assistência médica e odontológica sem coparticipação em exames e consultas.Seguro de vidaQuer mais bem-estar? Oferecemos Gympass, Zenklub (com duas sessões gratuitas por mês) e ginástica laboral para dar aquela alongada durante o expediente.Quando bater aquela fome, utilize nosso benefício de alimentação Caju para fazer compras em qualquer supermercado ou restaurante.Ama viajar? Aqui temos o Férias &amp; Co, um benefício que te ajuda a viabilizar aquela viagem dos sonhos.Tem filhos? Temos auxílio creche.Quer aprender um novo idioma? Temos parceria com a escola CCAA, com descontos de até 40% nos cursos, e também o English Live que oferece 30% de desconto na mensalidade.Para deixar seu ambiente de trabalho com a sua cara, conte com o nosso auxílio home office.Quer protagonizar? Participe do Protagonistas, nosso game da vida real, e ganhe prêmios incríveis!",Datum TI,vacancy_type_effective,,True,,,Brasil,https://datum.gupy.io/job/eyJqb2JJZCI6NzMzNzMwMCwic291cmNlIjoiZ3VweV9wb3J0YWwifQ==?jobBoardSource=gupy_portal,True,remote,True
7337586,2024-06-19T19:10:41.296Z,Data Analyst,"Volkswagen Group Services is a Volkswagen Group company oriented towards working for Group companies worldwide. We provide services in the areas of production, logistics, data engineering (IT), engineering, quality, business services, human resources, communication and administrative and financial services. We are focused on our clients’ activities and take responsibility for carrying them out on their behalf.Volkswagen Group Services was founded in April 2001 in Wolfsburg, Germany under the name AutoVision, and was renamed Volkswagen Group Services in 2018.The new name reflects the strategic orientation of the Group as a whole, including its brands and companies. Currently we have offices in seven European locations. In 2023 we started our South America operation, with our first headquarters in Brazil.Responsabilidades e atribuiçõesMain responsibilities:• As a Business Intelligence Developer, you will be responsible for the design and implementation of dashboards and reports as well as ETL processes and data models.• Your tasks will include the analysis and integration of new data sources.• You will independently develop new business intelligence use cases and optimize existing use cases in cooperation with the specialist departments.• The documentation of apps and developments is also part of your area of responsibility.• Managing and clustering requirements is the goal you always have in mind.Requisitos e qualificaçõesQualification:• You have training in the field of computer science or a comparable qualification.• In your career to date, you have already gained extensive experience and knowledge in the BI environment and in working with relational databases, SQL and data modeling.• You also have extensive knowledge of QlikSense, Tableau, PowerBI or comparable tools.• Agile project work is fun for you.• Since our projects currently take place in a German-speaking environment, we require business-fluent German language skills (from level C1).• You find it easy to use the English language.• You are particularly distinguished by your pronounced customer- and team-oriented way of working as well as your very good analytical and communication skills.Informações adicionaisHiring CLT, hybrid format, being necessary the presence in our office in Morumbi, São Paulo/SP, 2 or 3x per week.",Volkswagen Group Services South America,vacancy_type_effective,2024-08-20T00:00:00.000Z,False,São Paulo,São Paulo,Brasil,https://vwgs-sam.gupy.io/job/eyJqb2JJZCI6NzMzNzU4Niwic291cmNlIjoiZ3VweV9wb3J0YWwifQ==?jobBoardSource=gupy_portal,True,hybrid,True
