job_id,published_date,title,description,career_page_name,type,application_deadline,is_remote_work,city,state,country,job_url,disabilities,workplace_type,submitted
7340263,2024-06-20T12:24:07.596Z,Pessoa Desenvolvedora Front-end React,"A ioasys é especialista em criar soluções únicas para empresas ousadas. Somos experts em trazer o melhor do universo digital para nossos clientes e transformar, repensar e evoluir a sociedade. Ajudamos marcas a inovar seguindo os princípios de metodologia ágil e abordagem centrada no usuário.Fazemos parte do Grupo Alpargatas, uma empresa centenária, global e inovadora. Caminhando juntos, desenvolvemos soluções de ponta a ponta, promovendo a transformação digital de grandes empresas do mercado nacional e internacional como: Banco Inter, Burger King, BASF, VR Benefícios, LATAM Airlines, Pfizer, Localiza, Fleury, DMCard, Fundação Dom Cabral e Suvinil. Proporcionamos um ambiente dedicado ao crescimento, com profissionais incríveis e de aprendizado constante em escritórios que estimulam a criatividade e produtividade. Você estará em uma equipe horizontal e transparente, que não apenas valoriza suas ideias, mas também espera que você faça parte da construção da empresa com a gente.Acreditamos no nosso trabalho e carregamos no nosso DNA a certeza de que temos o poder de impactar milhões de vidas com cada projeto que executamos. Não somos apenas pensadores, somos realizadores!Para a vaga de Pessoa Desenvolvedora Front-end React, buscamos um profissional que saiba trabalhar em equipe para agregar valor aos nossos projetos. Este profissional ficará responsável pelo desenvolvimento Front-end em React de grandes empresas do mercado nacional e internacional. Logo, espera-se que seja capaz de desenvolver interfaces propostas pela nossa equipe de design, fazendo animações, consumo de APIs e realizando testes (integração).Responsabilidades e atribuições• Manter e criar novas funcionalidades para clientes do mercado nacional e internacional em React;• Otimizar as interfaces para melhorar a performance e garantir a boa usabilidade;• Escrever códigos eficientes, reutilizáveis e de fácil manutenção;• Discutir possíveis soluções entre os times de UX , Back-end e Mobile;• Implementar automatização de testes.Requisitos e qualificações• Forte proficiência em JavaScript, incluindo manipulação de DOM;• Experiência com ferramentas comuns de desenvolvimento de front-end como Babel, Webpack, NPM, etc;﻿• Next.js 12 e Next.js 14;• React Query;• React Hooks;• Versionamento de código (Git);• Metodologias ágeis (Scrum);• Compreensão de React.js e seus princípios fundamentais;• Redux;• Conhecimento de UI e boas noções de UX.Diferenciais:• Capacidade de entender os requisitos de negócios e traduzi-los em requisitos técnicos;• Ter experiência em processos de code review;• Entendimento de Continuous Integration para React;Informações adicionaisRegime CLT ou PJ;Liberdade para exercer suas habilidades em um ambiente dinâmico e horizontal;Jornada flexível;Day Off – Birthday;Talks e Cursos internos ministrados por nossos especialistas;Curso de Inglês (In Company);Zenklub;Descontos de até 75% em produtos Alpa;Licença PET;Gympass;Moeda interna com loja de produtos próprios.Vem com a gente! Se inscreve aí! :)",ioasys,vacancy_type_effective,,True,,,Brasil,https://ioasys.gupy.io/job/eyJqb2JJZCI6NzM0MDI2Mywic291cmNlIjoiZ3VweV9wb3J0YWwifQ==?jobBoardSource=gupy_portal,True,remote,True
7344128,2024-06-20T18:29:50.448Z,Software Engineer Back End Senior,"A Caju é uma empresa brasileira de tecnologia, que busca dar mais sabor à vida profissional, transformando a relação entre empresas e colaboradores por meio de soluções mais inovadoras e seguras como o Cartão Multi Benefícios, Solução em Despesas Corporativas e Premiações.Continuamos crescendo o nosso time de Back-End, e com diversas oportunidades para atuar com todos os nossos produtos.Buscando por novos talentos que queiram transformar o mundo de benefícios com soluções inovadoras. Aqui na Caju, aprendemos sempre, e nos tornamos cada vez melhores em um ambiente colaborativo e divertido!São muito bem-vindas candidaturas de pessoas negras, mulheres, indígenas, LGBTQIA+, ou outros grupos minorizados. 🧡Inscreva-se e conheça mais sobre nosso time 🧡Responsabilidades e atribuiçõesDesenvolvimento de APIs Rest para evolução e manutenção do produto;Garantir a qualidade de código, com testes de unidade e integração;Participação nas discussões de solução e arquitetura;Participação em Code Reviews;Acompanhar deploy.Requisitos e qualificaçõesExperiência anterior como Sênior em desenvolvimento back-end;Experiência com construção e consumo de API Rest;Experiencia com Orientação Objeto e/ou Funcional;Micronaut ou Spring;Micronaut Data ou Hibernate;Teste de unidade e integração;Banco Relacional.Diferenciais:Conhecimento em Kotlin, Java (ou outras linguagens JVM) e C#;Mensageria Assíncrona (Ex. Kafka, Azure, RabbitMQ);Experiência e vivência com TDD;Documentação de API (Ex.: Swagger, OpenApi);Boas práticas de API REST, Solid, Dry;Arquitetura Hexagonal;Datadog ou ferramenta de monitoramento;Docker;Kubernetes;Bancos Relacionais ou não relacionais;AWS;Github Actions;Soft Skills:Buscar aprender todo dia;Ter desenvoltura para atuar de forma independente na área;Ter boas habilidades interpessoais para lidar com pessoas de outras áreas;Pensar em desenvolvimento de ponta a ponta;Resiliência e adaptabilidade; Trabalhamos Com: Paradigma Funcional - Scala &amp; framework ZIO, e Kotlin.Bancos relacional e não relacional - MySQL e DynamoDB;Informações adicionais💳 Cartão Caju, com mais liberdade para usar seus benefícios (Refeição, Alimentação, Mobilidade, Saúde, Home Office, Cultura e Educação);🏥 Plano de Saúde sem coparticipação;🧘🏿‍♀️ Zenklub, com consultas onlines com terapeutas e coaches para cuidar da sua saúde mental;🏋🏿‍♀️ Gympass🗣️ Aqui também estimulamos o aprendizado de idiomas, com a parceria da Rosetta Stone;💆🏽 Dia de recarregar - day off; 🧑🏿‍⚕️ Conexa Saúde - consulta médica online;👶🏿 Auxílio Creche para crianças até 5 anos; 📚 Parceria com Alura;👨🏿‍💻 Trabalho Remoto, para você trabalhar de onde quiser dentro do Brasil;💻 Oferecemos equipamento de trabalho;🚀 Muitas possibilidades de crescimento - temos muito a crescer e esperamos fortemente que você nos ajude com isso!",Caju Benefícios,vacancy_type_effective,,True,,,Brasil,https://caju.gupy.io/job/eyJqb2JJZCI6NzM0NDEyOCwic291cmNlIjoiZ3VweV9wb3J0YWwifQ==?jobBoardSource=gupy_portal,True,remote,True
7343506,2024-06-20T17:34:45.733Z,Analista Back Asset Pl,"Buscamos profissionais que tenham vontade de crescer, colocar a mão na massa e fazer acontecer. Vivemos um momento único, recheado de desafios e oportunidades para agregar ainda mais valor aos nossos clientes. Se você tem esse perfil e essa ambição, inscreva-se nesta vaga e junte-se a nós para construir o futuro do mercado financeiro.#VemSerGenialResponsabilidades e atribuiçõesBoletagem de operações nos sistemas internos e externos.Acompanhamento de liquidações e posições em custódia.Precificação, conferência e análise das carteiras administradas sob gestão.Conferência e análise dos fundos de investimentos sob gestão.Apoio na elaboração de planilhas internas.Apoio na implementação e automatização dos processos.Contato com gestores/administradores externos e confecção de relatórios.Interlocução com as equipes do Comercial, Middle Office, Risco e Gestão Requisitos e qualificaçõesFormado em Economia, Administração, Contabilidade e ou Engenharia.Conhecimentos avançados em Excel / VBA;Inglês intermediário;Desejável experiência com rotinas de BackOffice em bancos, corretoras ou assets;Desejável Certificação CPA-20 ou equivalente;Desejável Power BI;Desejável conhecimento do sistema ABSoftware.Informações adicionaisAssistência MédicaAssistência OdontológicaVale RefeiçãoVale AlimentaçãoSeguro de VidaTotal PassGymPassPLRLocal de trabalho: Av. Brigadeiro Faria Lima / SPModelo de trabalho: CLT",Genial Investimentos,vacancy_type_effective,,False,São Paulo,São Paulo,Brasil,https://genial.gupy.io/job/eyJqb2JJZCI6NzM0MzUwNiwic291cmNlIjoiZ3VweV9wb3J0YWwifQ==?jobBoardSource=gupy_portal,False,on-site,True
7309528,2024-06-20T15:02:40.153Z,7309528 - PESSOA DESENVOLVEDORA PLENO (BACK-END) JAVA,"Nós somos a Quality Digital! Saiba mais sobre a gente:Uma frase que nos define - Somos especialistas em soluções de TI e apaixonados por inovação! 🚀Ao infinito e além - Somos #semfronteiras. Nosso time está espalhado pelo Brasil e pelo mundo 🌎Nossa cultura - Mesmo distantes, estamos juntos 🧡 Temos cerimônias para estarmos mais próximos, compartilhar conhecimento e ficar por dentro das novidades da nossa empresa!Somos diversos - Um dos nossos compromissos é fazer da companhia um ambiente cada vez mais diverso, inclusivo e respeitoso, valorizando e promovendo a pluralidade. Por isso, aqui temos espaço para todas as pessoas, independente de raça, gênero, idade, orientação sexual, crença religiosa ou deficiência. 🏳️‍🌈👩🏾‍🦽Nosso objetivo - Potencializar os negócios dos nossos clientes através de soluções inovadoras e sustentáveis. Topa vir com a gente nessa? 🎯Responsabilidades e atribuiçõesO que buscamos? Um profissional que busque apresentar de forma clara suas necessidades e opiniões, além de receptividade para ouvir, aprender e disseminar o conhecimento adquirido.Como será o seu dia a dia:  Com apoio, irá manter o padrão estabelecido para o codebase em que está atuando; Atuar na resolução de problemas técnicos; Buscar identificar erros, identificar a causa raiz do problema e a solução; Terá conhecimento de testes, métricas, bem como práticas, ferramentas e processos de segurança; Apoiar o time sempre que solicitado; Participar de cerimônias e fóruns necessários para seu desenvolvimento profissional e do grupo.Requisitos e qualificações Microserviços Java Spring Boot, NodeJs; Serão diferenciais importantes ter conhecimento de React, Angular; DB Oracle, SQL, MYSQL. Desenvolvimento de sistemas, testes Unitários com JUnit, verificação de Logs no DataDog, Git; GraphQL, Flutter Python, OpenShift, Kubernetes, Docker, Maven e Filas (JMS, ActiveMQ ou KAFKA); Utilização de cache com REDIS, conhecimento em SOLID, Clean Code e SCRUM.Indispénsável ter experiência com ferramentas de IPAAS (Wevo iPaaS da Jitterbit)VAGA CLT - HOME OFFICESEG A SEX 09H00 AS 18H00OBS.: Hey! Caso você não preencha todos os requisitos da vaga, te convidamos a se candidatar mesmo assim, ok? Faremos uma análise cuidadosa do seu perfil considerando todas as suas qualificações 😉Informações adicionaisO que você vai encontrar aqui:Um ambiente propício para aprendizado e crescimento profissional 🎯Avaliação de desempenho e feedbacks, visando o desenvolvimento contínuo das nossas pessoas 📊Vale alimentação e/ou refeição para suas compras de mercado e refeições 🍴Assistência médica e odontológica para que você e sua família estejam com a saúde em dia 💙Convênio com farmácias para descontos em medicamentos 💊Auxílio creche de acordo com política vigente 🍼Convênio academia para te incentivar a se exercitar 🤸‍♀️🤸‍♂️Parceria com o SESC para programações variadas de cultura e lazer ✈Parcerias para seus estudos de idiomas, tecnologia e plataforma de cursos 📚Empréstimo consignado com taxas atrativas + programa de educação financeira 💰Universidade Corporativa e trilhas de conhecimento com conteúdos diversos de tecnologia, soft skills, tendências de mercado e muito mais 👨‍💻Programa de Indicações com possibilidade de prêmios e bonificações 🎁 Seguro de vida coletivo ⛑",Quality Digital,vacancy_type_effective,,True,,,Brasil,https://qualitydigital.gupy.io/job/eyJqb2JJZCI6NzMwOTUyOCwic291cmNlIjoiZ3VweV9wb3J0YWwifQ==?jobBoardSource=gupy_portal,True,remote,True
6733091,2024-06-20T13:33:01.329Z,Pessoa Engenheira de Software Back-End Pleno/Sênior - Efí,"Quais serão as suas principais atividades:Implementar soluções de backend;Integrar microsserviços com serviços internos e externos;Executar manutenção das soluções existentes;Buscar melhorias e otimizar projetos existentes;Atuar com monitoramento do desempenho de projetos e processos.Requisitos:Ensino Superior completo em Tecnologia da Informação, Ciência da Computação ou área afins;Experiência com análise e desenvolvimento de sistemas;Vivência em PHP;Experiência em JavaScript/TypeScript (Node.js);Conhecimento em MySQL, Git, Restful com JSON;Experiência em testes automatizados (Mocha + Sinon; ou Jest);Conhecimento intermediário de Linux e Docker;Noções de AWS (SQS, SNS, S3, Lambda).Diferenciais:Domain-driven design e SOLID;Conhecimento em testes unitários, e2e, tdd e bddEvent-driven architecture;MongoDB, Redis;Arquitetura de microsserviços;Ter atuado com SRE ou DevOps, conhecendo ferramentas para otimizações e acompanhamento de desempenho de projetos, como New Relic, APMs etc;OAuth;Inglês.Nível da vaga: Pleno/SêniorFaixa salarial: R$ 9.500,00 a R$ 14.000,00Benefícios para você e sua família:Semana de 4 dias. Nossa jornada de trabalho é de 4 dias! Isso mesmo, temos uma carga horária de 32 horas semanais!Plano de saúde Unimed coparticipativo para colaboradores e dependentes (regional, estadual ou nacional);Plano odontológico coparticipativo - MetLife ou OdontoPrev - para colaboradores e dependentes;Um dia de folga para celebrar o seu aniversário com o benefício #SeuDiaEfí;Cartão Eva Card de benefícios flexíveis no valor de R$ 840,00 mensais na categoria alimentação e R$33,70 por dia útil na categoria refeição ou alimentação na empresa;Bolsa de estudos para colaboradores e dependentes de até 17 anos, com subsídio de até 70% do valor, conforme política da empresa;Bolsa de de idiomas para colaboradores, com subsídio de 40 a 70% do valor, conforme política da empresa;Licença maternidade estendida de 7 meses e licença paternidade estendida de 30 dias, acolhendo também mães e pais adotivos;Seguro de vida;Wellhub: (Gympass agora é Wellhub!) Plataforma corporativa de atividade física, com foco na qualidade de vida e bem-estar, que permite acesso à academias e estúdios parceiros para colaboradores e dependentes;Clude: Fale com um médico qualquer hora, em qualquer lugar! Com o clude você tem acesso a atendimento digital e outras soluções de saúde de forma online.Além disso, oferecemos também:Programa de saúde emocional e desconto em atendimento psicológico para colaboradores e dependentes, por meio da plataforma Moodar;Clube de Vantagens com descontos e parcerias exclusivas para colaboradores Efí;Cultura humanizada e colaborativa, permitindo que nossos colaboradores se sintam em casa, por meio de um ambiente de trabalho descontraído e propício ao aprendizado!Responsabilidades e atribuiçõesRequisitos e qualificaçõesInformações adicionais",Efí by Gerencianet,vacancy_type_effective,,True,,,Brasil,https://sejaefi.gupy.io/job/eyJqb2JJZCI6NjczMzA5MSwic291cmNlIjoiZ3VweV9wb3J0YWwifQ==?jobBoardSource=gupy_portal,True,remote,True
7334474,2024-06-19T21:11:04.974Z,Pessoa Desenvolvedora Back-end - Sênior ,"A FCamara está em busca de uma pessoa Desenvolvedora Back-End Sênior.Responsabilidades e atribuições Requisitos e qualificaçõesHard Skills: • Desenvolvedor back-end, especialista em Net Core com no mínimo 5 anos atuando na área de desenvolvimento de software.• Experiência com .NET 5/.NET Core 3+, C#, Identity Server 4, Key Cloak, Git, Azure, AWS;• Experiência com banco de dados relacional (MS SQL e PostgreSQL);• Experiência com desenvolvimento utilizando banco de dados não relacional (Redis, MongoDB)• Conhecimento de Web Services, Entity Framework, Json, Micro Serviços, Linq / Linq to SQL, Web API REST, Consumo de APIs Externas;• Noções avançadas em Orientação a Objeto;• Conhecimento de desenvolvimento de API (API Design);• Noções em Clean Architecture;• Noções de barramento de mensagens (RabbitMQ, ServiceBus);• Noções de desenvolvimento de software utilizando paradigma DDD.Conhecimentos Técnicos Desejáveis:• Experiência com Docker;• Experiência com metodologia ágil (Scrum e XP);• Experiência com programação Orientado a Objetos.Informações adicionais",VENHA SER #SANGUELARANJA 🧡🚀,vacancy_type_effective,,True,,,Brasil,https://fcamara.gupy.io/job/eyJqb2JJZCI6NzMzNDQ3NCwic291cmNlIjoiZ3VweV9wb3J0YWwifQ==?jobBoardSource=gupy_portal,False,remote,True
7037306,2024-06-19T19:52:57.135Z,Desenvolvedor Back-end Júnior - Quitejá,"Somos a QuiteJá (fintech Curitibana do grupo Sinqia), criada por pessoas que querem transformar a negociação de dívidas no Brasil, por meio da digitalização e da humanização no atendimento. 💚Nossa equipe é composta por pessoas cheias de energia ⚡ que se esforçam todos os dias para impactar e melhorar a sua vida. Nosso propósito é descomplicar a vida financeira dos brasileiros.Estamos em busca de um(a) Desenvolvedor(a) Back-end Júnior para fazer parte desse grande time 😎Por aqui valorizamos:😊 Pessoas✨ Criatividade💡 Inovação🚀 Proatividade🔎 Foco👥 Trabalho em equipeResponsabilidades e atribuições● Escrever, documentar e testar códigos de modo eficiente em ambientes de alta disponibilidade e com um baixo tempo de resposta; ● Realizar testes automatizados; ● Realizar testes unitários e integração. ● Implementar soluções.Requisitos e qualificaçõesPara dar #match, essa vaga necessita que atenda alguns requisitos obrigatórios:• Bom conhecimento em Python (Flask, Celery, SQLAlchemy);• MySQL 5 e AWS;• Formação e certificações necessárias:• Trabalhar em um ambiente dinâmico;• Gostar de novas tecnologias;• Fazer as coisas acontecerem;• Criar soluções escaláveis;• Trabalhar de forma colaborativa;• Não ser fechado em uma linguagem de programação. 📌IMPORTANTE: Essa oportunidade é para atuação no escritório da QUITEJÁ - CURITIBA, modalidade PRESENCIAL. 😉",Sinqia,vacancy_type_effective,,False,Curitiba,Paraná,Brasil,https://sinqia.gupy.io/job/eyJqb2JJZCI6NzAzNzMwNiwic291cmNlIjoiZ3VweV9wb3J0YWwifQ==?jobBoardSource=gupy_portal,True,on-site,True
7336272,2024-06-19T19:21:13.277Z,Pessoa Desenvolvedora Back-End | Sênior,"Você gosta de inovação e curte resolver problemas complexos? Nós também! Por isso, estamos em busca de profissionais inovadores e criativos, gostem de atuar em times de alta performance e busquem grandes desafios nas suas carreiras. Aqui, na Viaflow, temos um lugar especial esperando por você! Já pensou em fazer parte de uma equipe engajada em fazer a diferença no cuidar das pessoas? Essa oportunidade é para atuação em um dos nossos clientes do Ramo Educacional. Você encontrará um ambiente super dinâmico, colaborativo, inquieto e voltado para inovação. Trabalho remoto!Responsabilidades e atribuiçõesVocê será responsável por:Construir e desenvolver plataformas para suportar os produtos digitais;Trabalhar com plataforma de alta disponibilidade e escalabilidade;Reinventar a forma de distribuição de conteúdo para os usuários;Trabalhar junto das áreas de negócio, fornecendo as melhores soluções em tecnologia;Codificar, testar, reparar, documentar e implementar sistemas;Estimar entregas com base na documentação;Pesquisar e criar soluções inovadoras para os produtos digitais;Ser responsável pela arquitetura, referente a construção e manutenção da mesma.Aplicar as melhores práticas e técnicas de Segurança da Informação orientadas aos ambientes web;Criar e gerenciar banco de dados, bem como integrá-lo com outras aplicações;Auxiliar a equipe de projeto a estimar esforço e complexidade de atividades a serem desenvolvidasCorrigir eventuais bugs e propor evoluções de software;Contribuir com code review;Produzir código limpo e documentado.Requisitos e qualificaçõesPara ocupar esse cargo, é necessário que você tenha experiência com:Linux;Java (Functions, Consumers, Streams, Optionals);Spring boot;Spring data;Gradle;J2EE;Containers Kubernets e Docker;NoSQL (Mongo);SQL (PostgreSQL e Oracle);Montagem de arquitetura de sistemas;Sistemas escaláveis de alta performance;Microsserviços;Metodologias ágeis (Scrum, Kanban, XP, etc);Notação BPMN;Padrões de arquitetura;Aplicações em nuvem;Git;Testes unitários em Java;Processos de deploy com Bitbucket/GitRunnerSerá um diferencial, se você tiver experiência com: Node;Spring cloud;Tecnologias de integração (Apache Camel ou Spring Integration);Redis;RabbitMQ;Apache Camel;AWS;Nuget;Projetos na área contábil ou financeira. Habilidades interpessoais necessárias: Relacionamento interpessoal;Organização e planejamento;Visão sistêmica;Proatividade e boa comunicação.Informações adicionais🌎 Atuação 100% remota - trabalhe de onde quiser e de onde se sentir confortável; 🚀💼 Contratação por modelo cooperativa - o que te garante uma maior liquidez; 💰🎉 Day off de aniversário - afinal, é dia de festa! 🥳",Viaflow,vacancy_type_effective,,True,,,Brasil,https://viaflow.gupy.io/job/eyJqb2JJZCI6NzMzNjI3Miwic291cmNlIjoiZ3VweV9wb3J0YWwifQ==?jobBoardSource=gupy_portal,True,remote,True
