job_id,published_date,title,description,career_page_name,type,application_deadline,is_remote_work,city,state,country,job_url,disabilities,workplace_type,submitted
6672405,2024-01-25T18:52:32.196Z,Engenheiro de Dados Pleno ( Home Office),"Todo o BrasilJá pensou em contribuir com uma das maiores edtechs do país e fazer a diferença na educação de milhares de pessoas? Somos a Wiser Educação, uma holding que está há mais de 27 anos gerando valor por meio da educação, na vida de nossos alunos e colaboradores. Você já deve conhecer nossas marcas: Wise Up, Wise Up Online, Wiser Sales Platform, Number One, meuSucesso.com, Power House, Buzz Editora, Conquer, Aprova total, BuQme, Eu militar e Vende-C.Responsabilidades e atribuiçõesAtuar na modelagem, extração e tratamento de dados, cooperando para a formação de modelos confiáveis e duradouros;Proporcionar um ambiente de aprendizados para os demais integrantes da equipe, auxiliando na formação e cultura da equipe de Engenharia de Dados;Visão analítica para melhorias nos processos, a fim de obter entregas de qualidade;Monitoramento e otimização dos ambientes Clouds (GCP).Requisitos e qualificaçõesSólida experiência em Linguagens de Programação (preferencialmente Python);Experiência em automação e otimização de fluxos e processos de dados;Conhecimento em Ferramentas de Pipeline de Dados (Apache Airflow, Dataform ou correlatas);Conhecimento em bancos relacionais (PostgreSQL, MySQL e similares);Conhecimento em ambientes e ferramentas de Big Data (Big Query, Redshift, Databricks e similares);Conhecimento em implantação Cloud Functions ou AWS Lambda.É um diferencial se você tiver: Certificação Google Cloud Professional;Conhecimento em Kubernetes;Noções básicas de SRE, Security e DevOps em nuvem;Conhecimento em implantações de modelos de Machine Learning no ambiente GCP.Informações adicionaisO que oferecemos para você na contratação: Contratação CLT; Auxílio Home Office; Auxílio de equipamento de trabalho;Plano de saúde e odontológico Amil, sem coparticipação;Vale refeição ou alimentação;Seguro de vida;Após 3 meses de experiência, você terá acesso a: Acesso gratuito à plataforma Wise Up Online;Descontos na BuzzEditora e meuSucesso.com; Desconto nas Pós- Graduações da Conquer.Buscamos pessoas que compartilhem dos nossos valores: Inovar não é só inventar, mas também se reinventar: Se desafie constantemente e faça diferente.A educação começa de dentro pra fora: Aprendizado é constante, aproveite o conhecimento de quem trabalha com você.Sorrir é algo que levamos a sério: Felicidade combina com a Wiser, vamos celebrar todas as suas conquistas com você.Não dá para voar com uma asa só: Trabalhar em equipe te ajuda a voar mais alto.Faça parte de um ‌movimento‌ ‌educacional‌ ‌que‌ ‌traz‌ ‌soluções ‌inovadoras‌ ‌e‌ ‌empreendedoras. Venha voar com a gente.Nossas vagas são abertas às pessoas com deficiência (PCDs).",Wiser Educação ,vacancy_type_effective,,True,,,Brasil,https://wiser.gupy.io/job/eyJqb2JJZCI6NjY3MjQwNSwic291cmNlIjoiZ3VweV9wb3J0YWwifQ==?jobBoardSource=gupy_portal,True,remote,True
6648925,2024-01-25T18:46:51.497Z,Estagiário de Validação de Dados - Sistemas e Planilhas,"Valorizamos a inovação e excelência, incentivamos a criatividade e apoiamos o desenvolvimento pessoal de cada um, por isso jovens talentos e novas ideias são sempre bem-vindas por aqui.Nosso Programa de Estágio tem duração de no máximo dois anos e ao participar você tem a oportunidade de fazer parte do nosso quadro de colaboradores e desenvolver suas habilidades aqui na Synvia.Para participar do programa, é necessário estar cursando ensino técnico profissionalizante ou ensino superior nas diversas áreas da qual atuamos.VENHA CRESCER PROFISSIONALMENTE AQUI NA SYNVIA!Se você possui um perfil inovador, pensa fora da caixa, e gosta de trabalhar em um ambiente moderno e dinâmico, essa vaga é para você.Vem com a gente melhorar a vida de cada vez mais pessoas. #VemSerSynviaResponsabilidades e atribuiçõesContamos com você para: Auxiliar na validação de sistemas computadorizados e planilhas;Realizar relatórios funcionais dos sistemas baseado em demandas das áreas que o utilizam;Auxiliar na criação de fluxos funcionais de validação.Requisitos e qualificaçõesO que buscamos: Cursando Ciência da Computação, Tecnologia da Informação, Análise e Desenvolvimento de Sistemas, Administração, Gestão Empresarial, Matemática, Estatística ou correlatas;Conhecimento avançado em Excel;Conhecimento intermediário em VBA;Conhecimento intermediário em Python.Informações adicionaisUnidade de trabalho:Paulínia/SP.Escala de trabalho:5x2 - 8h às 15hO que te oferecemos de benefícios:Vale Transporte;Estacionamento (conforme disponibilidade);Plano de Saúde sem custo da mensalidade ao colaborador, com coparticipação de exames e consultas;Plano Odontológico com coparticipação de mensalidade;Seguro de Vida sem custo ao colaborador;Vale alimentação/refeição flexível;Convênio Farmácia;Programa de Vacinação;Remuneração compatível ao mercado;Clube de Parcerias Synvia (Instituições de Ensino, Idiomas, Lazer e Cultura);Modelo de trabalho Híbrido (escolhido junto à liderança);Parceria SESC;Programa saúde física - TotalPass;Day Off – Profissional da saúde;",Synvia,vacancy_type_internship,,False,Paulínia,São Paulo,Brasil,https://synvia.gupy.io/job/eyJqb2JJZCI6NjY0ODkyNSwic291cmNlIjoiZ3VweV9wb3J0YWwifQ==?jobBoardSource=gupy_portal,True,hybrid,True
6672980,2024-01-25T18:08:23.064Z,[Ambev Global Tech] Cientista de Dados Sênior (IA/ML) Banda VI,"Sobre a Vaga: A equipe global de IA da Anheuser-Busch InBev (AB InBev) tem a tarefa de gerar valor para o nosso ecossistema, criando vantagem competitiva por meio de soluções analíticas avançadas alimentadas por ativos de IA. As soluções aproveitam insights contextuais e informações significativas de nossos ativos de dados corporativos e bases de conhecimento, aumentando e promovendo processos de tomada de decisão orientados por dados. Com isso, capacitamos nossa empresa a tomar decisões bem informadas em todo o ecossistema. Como cientista de dados sênior, você trabalhará na interseção de •        Desenvolva soluções analíticas avançadas para criar valor para o nosso ecossistema, concentrando-se na realização de oportunidades de negócios;•        Desenvolvimento, integração e aplicação de soluções de inteligência artificial (incluindo, mas não se limitando a, aprendizado de máquina/aprendizado profundo);•        Criar e aprimorar a engenharia de prompt para realizar tarefas específicas usando o LLM (por exemplo, OpenAI ou outros modelos de código aberto);•        Use e promova as práticas recomendadas de DevOps que incluem o fornecimento de modelos, dados e controle de versão de código;•        Compartilhe conhecimento para formar uma equipe forte com capacidade aprimorada de ser inovadora na criação de soluções analíticas.Além disso, você poderá criar novos recursos de produto de ponta a ponta (por exemplo, desenvolver e implantar, bem como integrar novos modelos servidos em sistemas de produção). Você também analisará e influenciará a inteligência artificial, o projeto de engenharia, a arquitetura e a pilha de tecnologia em vários produtos, fora do seu foco imediato.OLÁ, SOMOS A AMBEV TECH!E ninguém une tecnologia e cerveja como a gente! Temos a missão de transformar o dia a dia da maior cervejaria do planeta. Fazemos isso com um time incrível de pessoas apaixonadas e unidas em um único propósito: mudar o mundo com tecnologia. Buscamos entregar as melhores experiências e trazer soluções ágeis e descomplicadas para fazer a bebida chegar do campo ao copo. Todos os dias, impactamos milhares de pessoas. Cada brinde tem um pouquinho de nós. Essa é a nossa jornada, é o que fazemos e o que somos.Somos feitos de pessoas:Acreditamos na diversidade e no quanto ela é capaz de fazer a gente evoluir. É através da pluralidade de ideias, de experiências e opiniões que conseguimos pensar fora da caixa e trazer soluções inovadoras. Pra gente, diversidade e inclusão são assuntos sérios! Por isso, contamos com um Comitê de Autenticidade Tech para olhar essas questões com muito carinho e responsabilidade.Estamos no mundo todo:Somos GLOBAIS! Integramos o hub de tecnologia global da Anheuser-Busch InBev (AB InBev), uma multinacional formada por um grupo de cervejarias com sede em Leuven, na Bélgica e com outros escritórios globais em diversos países, incluindo Estados Unidos, México, Índia e Brasil.Vem com a gente!Nossas unidades estão presentes em Blumenau (SC), Maringá (PR), São Paulo (SP), Campinas (SP), Jaguariúna (SP), e Sorocaba (SP), e contamos ainda com um time remoto de vários cantos do Brasil! Já somos mais de 1.900 pessoas encarando cada desafio pra fazer diferente, mas queremos ir muito mais longe. Pra chegar lá, precisamos fortalecer nossa equipe! Tá afim de desenvolver produtos e soluções tecnológicas incríveis, transformar o futuro e criar um mundo com mais razões para brindar? Então vem com a gente!We’re here for tech and beer.Responsabilidades e atribuiçõesResponsabilidades:•        Projetar, desenvolver, implementar e integrar aplicativos inovadores de modelo de linguagem (por exemplo, usando o Azure OpenAI e o Redis como banco de dados vetorial);•        Projetar, implementar, testar e aprimorar prompts para instruir o LLM a alcançar os resultados desejados;•        Colaborar com equipes multifuncionais para integrar tecnologias à arquitetura do aplicativo (por exemplo, LangChain, OpenAI Python SDK, LammaIndex, OLamma, entre outros).•        Implementar, integrar e otimizar modelos de aprendizado de máquina para tarefas de processamento de linguagem natural;•        Garantir a escalabilidade, o desempenho e a confiabilidade dos aplicativos de modelos de linguagem;•        Integre e configure ferramentas de observabilidade, como mlflow, langsmith, langfuse, weight and bias, etc., para monitorar e melhorar o desempenho dos aplicativos;•        Colabore com cientistas de dados, engenheiros de dados, engenheiros de aprendizado de máquina e outras equipes técnicas, bem como com as principais partes interessadas, para aprimorar e refinar os modelos de linguagem com base no feedback do usuário e nos requisitos em evolução;•        Mantenha-se informado sobre as tendências e os avanços do setor em modelos de linguagem, IA e tecnologias relacionadas para trazer oportunidades de inovação para a equipe e a empresa;•        Seja protagonista na construção de um ambiente de evolução colaborativa, ajudando a equipe a reunir as melhores oportunidades e a fornecer a solução analítica adequada para criar valor.Requisitos e qualificaçõesQualificações:•        Capacidade de se comunicar fluentemente em inglês, tanto por escrito quanto por voz;•        Bacharelado ou mestrado em ciência da computação, engenharia, matemática ou em uma área relacionada.•        Experiência comprovada em desenvolvimento e implantação de aplicativos (melhor se estiver utilizando o Azure OpenAI e o Redis como banco de dados vetorial).•        Conhecimento sólido das tecnologias de modelos de linguagem (melhor se incluir LangChain, OpenAI Python SDK, LammaIndex, OLamma).•        Experiência na implementação e otimização de modelos de aprendizado de máquina para processamento de linguagem natural;•        Experiência com ferramentas de observabilidade, como mlflow, langsmith, langfuse, weight, bias, etc;•        Sólidas habilidades de programação em linguagens como pyspark, python e proficiência em estruturas relevantes;•        Experiência em estatística (melhor se estiver inferindo a partir de grandes modelos de linguagem);•        Excelentes habilidades de resolução de problemas e comunicação.Informações adicionaisBenefícios:Vale refeição ou alimentação ifood;Vale transporte;Bônus;Plano de saúde e Telemedicina;Convênio odontológico;Convênio Farmácia;Self Learning (auxílio em cursos, certificações e idiomas);Seguro de vida;Instituto Ambev de Previdência Privada;Auxílio Material Escolar;Cesta de Natal e Kit Congelado;Brinquedos de Natal;Empresa cidadã (licença maternidade e paternidade) e presente do bebê;Desconto mensal em produtos AMBEV;NewValue (clube de benefícios: desconto em lojas parceiras);Banco de horas;Gympass;Fretado;Abono anual referente a um salário.",Ambev Tech,vacancy_type_effective,,False,Campinas,São Paulo,Brasil,https://ambevtech.gupy.io/job/eyJqb2JJZCI6NjY3Mjk4MCwic291cmNlIjoiZ3VweV9wb3J0YWwifQ==?jobBoardSource=gupy_portal,True,hybrid,True
6644862,2024-01-25T13:55:24.790Z,PROFESSOR AUXILIAR I - DESENVOLVIMENTO RAPIDO DE APLICACOES EM PYTHON E ELETRICIDADE APLICADA - ESTÁCIO BELÉM,"AQUI SUA CARREIRA COMEÇA GRANDE.VENHA SER UM DOCENTE NA YDUQS.Temos um projeto grandioso e que requer um time com disposição para pensar de forma original, disruptiva, e com objetivo de resolver as grandes questões de hoje na educação: acesso, tecnologia, customização e o sucesso dos nossos alunos.Somos uma companhia cheia de energia, que já nasceu gigante e com resultados extraordinários.Venha fazer parte desse time!VENHA TRANSFORMAR VIDAS. INCLUSIVE A SUA.Responsabilidades e atribuiçõesOs seus principais desafios como docente são:•            Atuar como agente principal de efetivação da proposta pedagógica de nossas Instituições de Ensino, facilitando o processo de aprendizagem e cumprindo todo o programa da disciplina, o número de aulas previsto, despertando o interesse permanente dos alunos para o estudo, a reflexão e a busca de novos conhecimentos;•            Fazer uso devido do material didático disponível, bem como deve estimular uso do material bibliográfico da disciplina, através da consulta a livros e periódicos existentes na biblioteca, contribuindo para um aprendizado crítico e reflexivo;•            Cumprir os prazos estabelecidos no calendário acadêmico, bem como com as demandas solicitadas por seu respectivo coordenador de curso;•            Registrar, por meio de caderneta eletrônica, a frequência, o conteúdo das aulas, os resultados das atividades acadêmicas dos alunos e demais informações referentes aos componentes curriculares em prazo definido no calendário acadêmico;•            Contribuir para a realização de ações preparatórias para o ENADE;•            Orientar os alunos nos trabalhos de conclusão de curso;      Utilizar metodologias ativas e sala de aula invertida para ministrar as aulas.Requisitos e qualificaçõesBuscamos profissionais com:Requisito A: GRADUAÇÃO EM ENGENHARIA DA COMPUTAÇÃO / CIÊNCIA DA COMPUTAÇÃO;Requisito B: EXPERIÊNCIA DOCENTE;Requisito C - MESTRADO E/OU DOUTORADO.Informações adicionaisLocal de Trabalho: Faculdade Estácio Belém - Av. Gov. José Malcher, 1148 - Nazaré - Belém/PA. Na YDUQS você vai encontrar:Seguro de Vida;Bolsa de Estudos;Assistência Médica Saúde;Assistência Odontológica;  Vale Alimentação;Chance de crescimento, hoje mais de 60% das vagas fechadas são internas.💻 Modelo de trabalho híbrido para todos os escritórios corporativos da companhia.🤰 Trabalho remoto (home office) estendido para as mães recém-chegadas da licença maternidade por até 3 meses, de acordo com a função desenvolvida.🎓Acreditamos na excelência do nosso ensino e, por isso, valorizamos os egressos das nossas instituições em nossos processos seletivos.👩🏽‍🦽 Mais inclusão: essa vaga também é destinada a pessoas com deficiência.DIVERSIDADE: A YDUQS valoriza a diversidade e as informações adicionais prestadas nos campos de diversidade são muito importantes para nós, por isso pedimos para que não deixe de responder.",Estácio,vacancy_type_effective,,False,Belém,Pará,Brasil,https://vempraestacio.gupy.io/job/eyJqb2JJZCI6NjY0NDg2Miwic291cmNlIjoiZ3VweV9wb3J0YWwifQ==?jobBoardSource=gupy_portal,True,on-site,True
6673022,2024-01-25T18:17:28.901Z,Analista Master Data Center PL (qualidade),"Venha fazer parte da #GeraçãoAché!Somos um time diverso, com diferentes competências, experiências, pensamentos, crenças, etnias, idades, gêneros, culturas e conhecimentos, que se somam fazendo do Aché uma empresa de trajetória vencedora.Buscamos profissionais que, assim como nós, buscam incessantemente a excelência, com disposição para evoluir e crescer sempre. Compartilhando dos mesmos valores, trabalhamos pelo propósito de levar mais vida às pessoas onde quer que elas estejam.Inscreva-se!Responsabilidades e atribuiçõesData limite para inscrição: 31/01/2024- Define os fluxos de gestão de dados mestres, elabora os procedimentos e manuais, e ministra treinamentos para áreas de negócio;- Analisa erros e incidentes, define e executa planos de ação, sugerindo melhorias no processo para prevenção de recorrência de desvio;- Participa e realiza reuniões de projetos para entendimento do processo e definição de dados, colaborando na elaboração de regras de negócio;- Elabora e executa os cenários de testes, define e realiza plano de cutover, prepara cargas e valida informações no sistema.- Monitorar indicadores de processo/projeto e atuar com foco na satisfação de clientes internos e externos.Requisitos e qualificaçõesImprescindível - Ensino superior completo em Engenharia, Ciência de Dados, Governança e Gestão de Dados ou áreas afins;- Conhecimento e vivência com ERP SAP;- Experiência em gestão e governança de dados (clientes, fornecedores, materiais diretos e indiretos, e dados produtivos), de preferência em indústria farmacêutica, Química, cosmético ou Suplementos alimentares;- Nível avançado de habilidade em MS Excel.Desejável - Conhecimento em modelagem e relacionamento entre tipos de dados, Power BI e cadastro nacional de produtos GS1/GTIN.Obs.: O Aché valoriza e fomenta a diversidade, abrindo oportunidades para todos com igualdade.Informações adicionaisLocal de trabalho: Guarulhos - Rodovia Presidente Dutra, Km 222 Híbrido 3x presencial (terça, quarta e quinta)Seg a Qui 07h15 as 17h e Sexta 07h15 as 12h15",Aché Laboratórios Farmacêuticos,vacancy_type_effective,2024-01-31T00:00:00.000Z,False,Guarulhos,São Paulo,Brasil,https://vagasache.gupy.io/job/eyJqb2JJZCI6NjY3MzAyMiwic291cmNlIjoiZ3VweV9wb3J0YWwifQ==?jobBoardSource=gupy_portal,True,hybrid,True
6671390,2024-01-25T13:23:31.425Z,Data Architect ,"-Realizar el Assessment de la arquitectura de datos de la compañía -Participar en la definición del roadmap de arquicetura de la compañía -Representar a la compañía en la data architecture community -Apoyar en la implementación de la Allianz Data Platform (ADP) basada en Azure - Evaluar y recomendar tecnologías adecuadas para implementar la arquitectura de datos, incluidos los componentes propios de la ADP - Participar en el análisis, creación de modelos de datos en conjunto con los ingenieros de datos de AZ Tech, incluidos los modelos de datos relativos a la migración a ADP - Soportar la creación del DWH (Datamart) del proceso de onboarding de clientes en SAS en cuanto a modelos de datos. -Apoyar el inventario de fuentes de datos en la compañía y apoyar la implementación de soluciones tipo Datalake.Responsabilidades y atribucionesDe +3 años Experiencia en Azure Data services, Azure Data Lake Storage, Azure SQL Database, Azure Blob storage, Azure Synapse Analytics, Azure Databricks, Databricks y MLOps. - Comocimientos en lenguajes de programación (Python). - Conociminetos en herramientas para ETL. - Conocimientos de diseño, modelamiento de datos y arquitectura en la nube. - Capacidad para trabajar en equipo y liderar de manera efectiva. - Capacidad para comunicarse de manera efectiva con diferentes stakeholders, desde equipos técnicos hasta la alta dirección. - Capacidad para iniciar y sostener intercambios profesionales en inglés con sus pares extranjeros y otros actores internacionales. Ciencias de la Computación, Ingeniería de Sistemas o disciplinas relacionadas. - Título de Maestría en ingeniería de sistemas con formación en Arquitectura de Datos. - Certificaciones en Azure como por ejemplo Azure Fundamentals (AZ-900), Azure Database administrator Associate (AZ-500), Azure Data Engineer Associate (DP-200, DP-201), arquitecto de soluciones experto de Azure (AZ-303, AZ-304)Requisitos y calificaciones",STEFANINI LATAM,vacancy_type_effective,,False,Bogota,,Colômbia,https://stefaninilatam.gupy.io/job/eyJqb2JJZCI6NjY3MTM5MCwic291cmNlIjoiZ3VweV9wb3J0YWwifQ==?jobBoardSource=gupy_portal,True,hybrid,True
