job_id,published_date,title,description,career_page_name,type,application_deadline,is_remote_work,city,state,country,job_url,disabilities,workplace_type,submitted
7300974,2024-06-13T16:18:50.770Z,Estágio Ciência de Dados,"Junte-se à Escalar 🏔️Transforme sua carreira na Escalar! Estamos no mercado há 6 anos, oferecendo soluções de pré-vendas para médias e grandes empresas. Nosso foco é a terceirização de times de prospecção ativa, ajudando negócios B2B a se conectar e crescer. Buscamos pessoas com boa capacidade analítica, vontade de aprender e prontas para transformar oportunidades em resultados.Venha fazer parte do melhor time de pré-vendas do Brasil! Com sede em Belo Horizonte, oferecemos soluções de outsourcing, consultoria, mentoria e treinamento em vendas B2B. Nossa cultura é baseada em compromisso com a verdade, respeito à individualidade, paixão pela excelência e mente em evolução. Trabalhamos de forma híbrida, combinando flexibilidade e colaboração. Já ajudamos mais de 200 empresas a fortalecer suas equipes comerciais. Se você quer crescer, aprender e enfrentar novos desafios, junte-se a nós!Vamos juntos escalar novos horizontes! 🚀Sobre a vaga 🤓Estamos à procura de um estagiário(a) dedicado(a) e detalhista para se juntar ao nosso time de desenvolvimento de leads. O estagiário de dados será responsável pelo mapeamento e busca de leads, além da limpeza, parametrização e importação desses dados em nossos sistemas.Etapas do processo seletivo 🧐1 - Inscrição na vaga2 - Entrevista com o pessoal do Recrutamento e Seleção da Escalar3 - Entrevista com o gestor da empresa contratante4 - ContrataçãoResponsabilidades e atribuiçõesNo estágio você irá aprender ✍Auxilio na busca e parametrização de dados pelo Excel;Importações de dados em sistemas (CRM);Melhoras em processos de mapeamento;Análise e estruturação de estratégias de mercado;Reuniões diárias com líder direto;Acompanhamento no desenvolvimento na área de dados.Requisitos e qualificaçõesRequisitos Obrigatórios (indispensáveis para o dia dia de trabalho) 🤓Cursando superior nas áreas de tecnologia ou engenharias;Se interessar pela área de tecnologia;Visão analítica;Excel básico/intermediário.Será um diferencial 🤓Excel avançado;PowerBI;Entender de programação.Informações adicionais⚡Vantagens de fazer parte do nosso time de Xerpas⚡Bolsa de estágio;Cartão VR Multi;Vale-transporte;Totall Pass (auxílio academia);Modelo de trabalho híbrido - 2 dias semanais remoto e 3 dias presenciais no nosso escritório;PAE (auxilio psicológico);Evento mensal de cultura.",Grupo Escalar,vacancy_type_effective,,False,Belo Horizonte,Minas Gerais,Brasil,https://grupoescalar.gupy.io/job/eyJqb2JJZCI6NzMwMDk3NCwic291cmNlIjoiZ3VweV9wb3J0YWwifQ==?jobBoardSource=gupy_portal,False,hybrid,True
7287497,2024-06-13T15:58:09.669Z,ADMINISTRADOR DE BANCO DE DADOS PL,"Somos a maior multinacional brasileira e estamos entre as 100 maiores empresas de TI do mundo.Estamos presentes em 41 países com +30k colaboradores. A Stefanini tem como principal objetivo auxiliar os clientes a encontrar, por meio de soluções personalizadas, a maneira ideal para alcançar seus desafios, impulsionando a inovação digital.E queremos mais!Responsabilidades e atribuiçõesResponsabilidades:Instalar e configurar instâncias do SQL Server;Realizar tarefas de manutenção, como backups, restaurações, atualizações e monitoramento de desempenho;Monitorar a saúde do banco de dados;Apoiar no desenvolvimento e implementação de políticas, procedimentos e padrões relacionados ao banco de dados;Documentar atividades e decisões técnicas.Requisitos e qualificaçõesRequisitos:Ensino superior completo na área de Tecnologia;Conhecimento em Oracle e MySql, conhecimento em Zabbix;Conhecimento em SQL Server e Transact-SQL;Conhecimento em princípios de segurança de banco de dados e outros SGBD's como Oracle e MySql;Familiaridade com ferramentas de backup e recuperação de SQL Server.Informações adicionaisO que te oferecemos:🍛 Vale Alimentação ou Vale Refeição;👨🏼‍🎓 Desconto em cursos, universidades e instituições de idiomas; 📚 Academia Stefanini - plataforma com cursos online, gratuitos, atualizados e com certificado; 🗣 Mentoring;🏫 Auxílio Creche; 💉 Clube de vantagens para consultas e exames;🏥 Assistência Médica;🦷Assistência Odontológica; 💰 Clube de vantagens e descontos nos melhores estabelecimentos;👂🏾 Atendimento psicológico online ao colaborador e seus dependentes;🛫 Clube de viagens;🐶 Convênio para Pet;e muito mais...",Stefanini Group,vacancy_type_effective,,False,São Paulo,São Paulo,Brasil,https://stefanini.gupy.io/job/eyJqb2JJZCI6NzI4NzQ5Nywic291cmNlIjoiZ3VweV9wb3J0YWwifQ==?jobBoardSource=gupy_portal,True,on-site,True
7304670,2024-06-13T13:35:48.814Z,Consultor de Inteligência de Dados,"A Diretoria de Tecnologia e Transformação Digital do Grupo Marista está em busca de um profissional que compartilhe dos nossos valores e queira contribuir para uma sociedade mais justa e inclusiva, estamos empenhados em criar um ambiente de trabalho acolhedor, onde todas as vozes são ouvidas e valorizadas.  A gerência de Inteligência de Dados é responsável pela elaboração de soluções e produtos baseados dados para o Grupo Marista.O trabalho deste time engloba todas as etapas da criação de produtos de dados para a PUCPR, desde o auxílio na concepção do escopo, captura e tratamento de dados, construção de visualizações e implementação de modelos preditivos.Buscamos pessoas criativas, que queiram aprender e compartilhar conhecimento, que pensem fora da caixa e possam partir de um problema e chegar até a solução através dos dados. Responsabilidades e atribuiçõesPlanejar e desenvolver Dashboards e Relatórios em Power BI, aplicando design e técnicas de modelagem.Evoluir constantemente a arquitetura de dados cloud, visando eficiência, qualidade e confiabilidade.Implementar e evoluir processos ETL e pipelines de dados, data warehouse e data marts.Implementar modelos dimensionais de dados para atender as necessidades do negócio.Executar, acompanhar e liderar atividades técnicas em projetos de data analytics.Atuar na higienização e enriquecimento das bases de dados. Requisitos e qualificaçõesGraduação em Sistemas de Informação, Ciência da Computação e áreas afins.Pós-graduação, desejável em Big Data, BI, Data Science, Engenharias e áreas afins.Experiência em ingestão, transformação e processos de carga de dados.Experiência em ferramentas de visualização, como Power BI, QlikView entre outras.Conhecimento avançado em ferramentas de visualização, principalmente Power BI.Conhecimento avançado sobre modelos de dados e técnicas de modelagem.Experiência em operação de camada analítica em Cloud (Azure).Domínio de ferramentas tradicionais de ETL e RDBMSs.Informações adicionaisO que vai encontrar por aqui: Plano de Saúde Unimed: Com coparticipação, proporcionando cobertura médica e acesso a uma rede credenciada de qualidade.Plano Odontológico OdontoPrev: Cobertura nacional, com desconto das mensalidades na folha de pagamento.Incentivo à Educação: Valorização do desenvolvimento profissional e pessoal dos colaboradores, com incentivos para especialização, extensão, idiomas e pós-graduação na PUCPR.Alimentação: Subsídio para alimentação nos dias de trabalho, com desconto simbólico na folha de pagamento.Reembolso Creche: Auxílio para despesas com creche para colaboradores com filhos nos primeiros meses de vida.Previdência PrivadaSeguro de VidaVale Transporte Empréstimo Consignado em parceria com Banco BradescoGympass: Acesso a diversas academias com desconto das mensalidades na folha de pagamento.Programa Conte Comigo: Equipe multidisciplinar disponível para suporte social, orientação jurídica (exceto trabalhista), consultoria financeira e previdenciária.Psicologia Viva: Acesso a sessões de teleatendimento com especialistas em saúde mental, com isenção de duas consultas ao mês;Clube de Vantagens: Parcerias com empresas de diversas áreas, oferecendo descontos especiais em serviços e produtos. Salário: nossa proposta salarial leva em consideração vários pontos que serão avaliados ao longo do processo, por isso, ele será definido no decorrer das etapas, mas caso seja um processo que o salário seja determinado informaremos no momento da entrevista.Horário: Segunda a sexta, das 8h às 17h24. Se você deseja fazer parte de uma equipe que influencia o mundo de amanhã, queremos te conhecer. Junte-se a nós e #SejaMarista. ",Grupo Marista,vacancy_type_effective,2024-06-30T00:00:00.000Z,False,Curitiba,Paraná,Brasil,https://corporativogrupomarista.gupy.io/job/eyJqb2JJZCI6NzMwNDY3MCwic291cmNlIjoiZ3VweV9wb3J0YWwifQ==?jobBoardSource=gupy_portal,True,hybrid,True
7304153,2024-06-13T12:46:23.037Z,Cientista de Dados JR - Especialista I RP 1086177,"Vamos juntos mudar o mundo?  Você valoriza a Ética acima de tudo, tem Visão Compartilhada, acredita na Sustentabilidade Sistêmica, em entregar resultados com Excelência e é apaixonado por Inovação?﻿Se a sua resposta foi SIM, então nós queremos conhecer você! Responsabilidades e atribuiçõesDescrição SumáriaImplementação e treinamento de modelos de deep learning; Desenvolvimento de interface gráfica/dashboard com React; Criação de APIs; Elaboração de documentação técnica.Requisitos e qualificaçõesConhecimentos Técnicos RequeridosExperiência em desenvolvimento de modelos/algoritmos Deep Learning ; Experiência em previsão de séries temporais ; Experiência desenvolvimento Python; Conhecimento em React Conhecimento dos fundamentos da Ciência da Computação, como design orientado a objetos, design de algoritmos, estruturas de dados, resolução de problemas e análise de complexidade;Conhecimentos DesejáveisDesejável graduação em Engenharia, preferencialmente na área Computação, ou cursos afins. Desejável pós-graduação Lato Sensu ou Stricto Sensu, com tese no tema de Inteligência Artificial ou afins. Experiência em rede adversária generativa (Generative adversarial networks - GANs); Experiência na cadeia produtiva de O&amp;G (up stream); Conhecimento em MLOps, Microservices; Experiência desenvolvimento em API; Conhecimento em Conteiners, CI/CD; Conhecimento Metodologia Ágil; Leitura avançada em inglês – o candidato deve ser capaz de pesquisar e estudar artigos científicos em inglês.Informações adicionaisEssa é uma vaga de Contrato por Tempo Indeterminado (Efetivo).Sendo assim, essa é a nossa proposta salarial e benefícios para a vaga em questão com esse tipo de vínculo:Avaliaremos a pretensão salarial;Vale Transporte;Vale Alimentação/Refeição;Plano de Saúde, extensivo a dependentes;Vitalmed para atendimento de urgência e emergência domiciliar, extensivo a dependentes;Seguro contra Acidentes Pessoais;Convênio SESI - Programa Odontológico;Plano de Previdência Privada;Benefício Previdenciário (em casos de afastamento, o sistema FIEB complementa o suporte financeiro não oferecido pelo INSS);Auxílio Creche exclusivo para mulheres; Rede de parceiros CIEB - Convênios e Parcerias com academias, escolas de idiomas, espaços de eventos, seguradoras de veículos, hotéis, entre outros.Unindustria - Portal com várias capacitações online e gratuitas para o colaborador.Descontos nos cursos SENAI e SENAI CIMATEC para colaboradores e dependentes. Após 1 ano, pode haver ajuda no custeio de treinamento de longa duração, tais como Graduação, Especializações, Mestrado e Doutorado em qualquer Instituição, de acordo com o cargo e função exercido. Quer fazer parte da nossa Instituição e mudar o mundo conosco? Inscreva-se já em nossa vaga e venha fazer parte do nosso time! Estamos te aguardando! Vem ser SENAI CIMATEC!",SENAI CIMATEC ,vacancy_type_effective,,False,Salvador,Bahia,Brasil,https://senaicimatec.gupy.io/job/eyJqb2JJZCI6NzMwNDE1Mywic291cmNlIjoiZ3VweV9wb3J0YWwifQ==?jobBoardSource=gupy_portal,False,hybrid,True
7304097,2024-06-13T12:40:11.742Z,Cientista de Dados JR - Especialista I RP 992458,"Vamos juntos mudar o mundo?  Você valoriza a Ética acima de tudo, tem Visão Compartilhada, acredita na Sustentabilidade Sistêmica, em entregar resultados com Excelência e é apaixonado por Inovação?﻿Se a sua resposta foi SIM, então nós queremos conhecer você! Responsabilidades e atribuiçõesDescrição SumáriaDesenvolver e implementar algoritmos de IA para análise e previsão de séries temporais; Integrar modelos de IA em sistema de software existente ou em desenvolvimento;Colaborar com a equipe de desenvolvimento de software para garantir a eficiente implementação dos modelos; Realizar testes e validar a precisão dos modelos implementados; Fornecer suporte técnico e resolver problemas relacionados à implementação de modelos de IA.Requisitos e qualificaçõesConhecimentos Técnicos RequeridosHabilidade em desenvolvimento e implementação de modelos de IA, especialmente em análise de séries temporais; Conhecimento em linguagens de programação, como Python e R; Habilidade em realizar integração de modelos de IA em sistemas de software utilizando APIs, bibliotecas ou ferramentas específicas; Familiaridade com frameworks de IA, como TensorFlow, PyTorch e scikit-learn;Habilidades de resolução de problemas e capacidade de trabalhar de forma colaborativa em equipe.Informações adicionaisEssa é uma vaga de Contrato por Tempo Indeterminado (Efetivo).Sendo assim, essa é a nossa proposta salarial e benefícios para a vaga em questão com esse tipo de vínculo:Avaliaremos a pretensão salarial;Vale Transporte;Vale Alimentação/Refeição;Plano de Saúde, extensivo a dependentes;Vitalmed para atendimento de urgência e emergência domiciliar, extensivo a dependentes;Seguro contra Acidentes Pessoais;Convênio SESI - Programa Odontológico;Plano de Previdência Privada;Benefício Previdenciário (em casos de afastamento, o sistema FIEB complementa o suporte financeiro não oferecido pelo INSS);Auxílio Creche exclusivo para mulheres; Rede de parceiros CIEB - Convênios e Parcerias com academias, escolas de idiomas, espaços de eventos, seguradoras de veículos, hotéis, entre outros.Unindustria - Portal com várias capacitações online e gratuitas para o colaborador.Descontos nos cursos SENAI e SENAI CIMATEC para colaboradores e dependentes. Após 1 ano, pode haver ajuda no custeio de treinamento de longa duração, tais como Graduação, Especializações, Mestrado e Doutorado em qualquer Instituição, de acordo com o cargo e função exercido. Quer fazer parte da nossa Instituição e mudar o mundo conosco? Inscreva-se já em nossa vaga e venha fazer parte do nosso time! Estamos te aguardando! Vem ser SENAI CIMATEC!",SENAI CIMATEC ,vacancy_type_effective,,False,Salvador,Bahia,Brasil,https://senaicimatec.gupy.io/job/eyJqb2JJZCI6NzMwNDA5Nywic291cmNlIjoiZ3VweV9wb3J0YWwifQ==?jobBoardSource=gupy_portal,True,hybrid,True
7303778,2024-06-13T12:29:48.510Z,Analista de Dados Sênior ,"Na Vivo Vita temos uma paixão: transformar a vida de nossos colaboradores para que sua experiência de trabalho seja única!Buscamos transformar talento em resultado, criatividade em prática e expectativas em realidade com um ambiente de trabalho colaborativo, flexível, integrado e dedicado às pessoas!Estamos comprometidos em trazer aos nossos colaboradores toda tecnologia e treinamento para aprimorar suas habilidades técnicas e comportamentais.Venha digitalizar seu DNA conosco!!Responsabilidades e atribuiçõesDescrição de atividades:Liderar equipe de analistas de dados (BI), analisar e interpretar dados de sistemas do grupo VIVO para fornecer insights e apoio à tomada de decisões estratégicas. As suas principais atividades incluem:Liderar a equipe de analista de dados, administrar as demandas e reportar a gestão imediata;Coleta de dados: Coletar dados de várias fontes, como bancos de dados, planilhas e sistemas de gestão (ITSM, API, JSON, etc) .Limpeza e organização de dados: Tratar, limpar e organizar os dados para garantir sua qualidade e integridade.Análise de dados: Utilizando ferramentas de diversas de BI, o profissional analisa os dados para identificar padrões, tendências e insights relevantes para a organização.Criação de relatórios e dashboards: Desenvolver relatórios e dashboards interativos para apresentar visualmente os resultados da análise de dados.Apoio à tomada de decisões: Com base nas análises realizadas, fornecer suporte à tomada de decisões estratégicas, ajudando a direcionar as ações da empresa.Monitoramento de indicadores de desempenho: Produzir e monitorar os indicadores-chave de desempenho (KPIs) da organização para avaliar o impacto das decisões tomadas. Identificação de oportunidades de melhoria: Identificar oportunidades de melhoria nos processos e operações da empresa com base nos dados analisados. Elaborar reports SLM aos clientes da VIVO, baseado nas regras de negócios e contratos de serviço, dentro do prazo estipulado; Atender demandas internas para a geração de Reports e dashboards customizadas.Competências extras:- Atuar em todo o ciclo de desenvolvimento de soluções de BI (Reuniões para entendimento do escopo do projeto, elaboração dos requisitos funcionais, desenvolvimento e apresentação dos entregáveis - BI)Competências comportamentais:Além das habilidades técnicas necessárias, é mandatório que o analista de BI tenha as seguintes características comportamentais:Requisitos e qualificaçõesRequisitos;Mandatório o conhecimento AVANÇADO ferramenta Power BI (*Para análise avançada e criação de dashboards interativos). Domínio em SQL: Capacidade avançada de escrever consultas SQL complexas, otimizar consultas e manipular grandes volumes de dados de forma eficiente.Experiência em modelagem de dados avançada: Conhecimento avançado em modelagem de dados dimensionais, star schema, snowflake schema e design de cubos OLAP.Expertise em ETL e integração de dados: Experiência em desenvolver processos ETL complexos, integrar dados de fontes distintas e heterogêneas e garantir a qualidade dos dados.Conhecimento nível INTERMEDIÁRIO nas linguagens de programação Python;Conhecimento INTERMEDIÁRIO em estatística e análise de dados: Experiência em aplicar técnicas estatísticas avançadas, modelagem preditiva e análise de séries temporais para obter insights mais profundos dos dados.Desejável:Boa comunicação em Inglês.Ter experiência anterior comprovada na liderança de equipes de análise de dados.Informações adicionaisBenefícios de um Vitalent:Vale refeição (Flash Benefícios);Assistência Médica e Assistência Odontológica (extensível aos dependentes),Seguro de vida;Day Off no mês do aniversário;PLRPrevidência PrivadaUma oferta exclusiva da Vivo, com desconto especial em linha fixa, banda larga, TV e apps;Ambiente dinâmico, colaborativo e inovador: para conseguir acompanhar o mercado e continuar inovando, nosso ritmo é acelerado e nossa curva de aprendizado é muito alta.",Vivo Vita,vacancy_type_effective,,False,São Paulo,São Paulo,Brasil,https://vivovita.gupy.io/job/eyJqb2JJZCI6NzMwMzc3OCwic291cmNlIjoiZ3VweV9wb3J0YWwifQ==?jobBoardSource=gupy_portal,True,hybrid,True
7278187,2024-06-13T14:28:34.557Z,CVLB | ESPECIALISTA BIG DATA  (TI),"Como é trabalhar no GRUPO CVLB?Somos uma empresa inclusiva e diversa, cheia de oportunidades de crescimento, clima alegre e descontraído.Para que tudo dê certo nas lojas, um time enorme trabalha na administração e no centro de distribuição. Isso significa que há muito espaço para quem quer fazer parte do nosso super time!Seguimos juntos, sonhando &amp; realizando ainda mais! ❤️💛Responsabilidades e atribuições🎯 Qual será sua tarefa no Grupo CVLB?Será responsável por desenvolver e manter pipelines de dados eficientes e escaláveis usando Google Cloud Platform (GCP);Projetar, implementar e otimizar arquiteturas de banco de dados;Integrar dados de múltiplas fontes em uma solução DataLake;Garantir a qualidade, consistência e segurança dos dados;Implementar e monitorar processos de ETL/ELT utilizando Airflow (Composer), DataFlow e DataProc;Criar e manter documentação técnica e relatórios detalhados;Converter procedures SQL para Python (DAGs no Airflow).Requisitos e qualificações📝 Para conquistar um lugar no time de talentos do Grupo CVLB, você precisa:Bacharelado em Ciência da Computação, Engenharia, Matemática, Estatística ou área relacionada;Mínimo de 3 anos de experiência em dados (Engenharia e Adminisração);Proficiência em linguagens de programação como Python e SQL;Conhecimento em bancos de dados relacionais e não relacionais;Conhecimento em Google Cloud Platform (GCP), especialmente BigQuery, SQL Server, Airflow (Composer) e Pyspark;Experiência com ferramentas de ETL/ELT;Conhecimento em cloud computing e ferramentas relacionadas;Será um diferencial possuir certificações em Google Cloud Platform;Será um diferencial ter experiência em Machine Learning e Inteligência Artificial;Será um diferencial ter conhecimento em ferramentas de visualização de dados (e.g., PowerBI, Looker);Excelentes habilidades de resolução de problemas e atenção aos detalhes;Capacidade de comunicação. trabalho em equipe e autogestão.Informações adicionais📌 Além do ótimo clima para trabalhar e se desenvolver, oferecemos:🩺 Assistência médica;🦷 Assistência odontológica;❤️ Seguro de vida;🍴 Vale alimentação e/ou refeição;🛒 Cesta básica;🚌 Vale transporte;👶🏽 Auxílio creche;💰 Prêmio anual - de acordo com a performance individual e corporativa;🏋🏻‍♀️ TotalPass;🎂 Folga de aniversário;🛍️ Descontos em nossas lojas;👨🏽‍💻 Plano de carreira;📚 Parcerias para desconto em cursos e graduação.♿Lembramos que nossas oportunidades são para todos! Aqui no Grupo CVLB somos uma empresa inclusiva! Curtiu? Então candidate-se e venha trabalhar conosco! 🚀",GRUPO CVLB,vacancy_type_effective,,True,,,Brasil,https://grupocvlb.gupy.io/job/eyJqb2JJZCI6NzI3ODE4Nywic291cmNlIjoiZ3VweV9wb3J0YWwifQ==?jobBoardSource=gupy_portal,True,remote,True
7295577,2024-06-12T21:33:49.333Z,Data Engineer Jr.,"¡Sé parte de Stefanini!​En Stefanini somos más de 30.000 genios, conectados desde 41 países, haciendo lo que les apasiona y co-creando un futuro mejor.​Responsabilidades y atribucionesDiseñar, desarrollar y mantener canales de datos y procesos ETL para garantizar el flujo eficiente y confiable de datos desde diversas fuentes a nuestro almacén de datos.Colaborar con científicos de datos, analistas y otras partes interesadas para comprender los requisitos de datos y traducirlos en soluciones técnicas.Realizar modelado de datos y diseño de bases de datos para optimizar el almacenamiento y la recuperación de datos.Implementar procesos de validación y calidad de los datos para garantizar la precisión e integridad de los datos.Supervisar y solucionar problemas de sistemas y canalizaciones de datos para identificar y resolver cualquier problema o cuello de botella.Desarrollar y mantener documentación para procesos, sistemas y mejores prácticas de ingeniería de datos.Manténgase actualizado con las últimas tendencias y tecnologías en ingeniería de datos y recomiende mejoras para mejorar la infraestructura y los sistemas de datos.Requisitos y calificacionesExperiencia comprobada como ingeniero de datos o puesto similar.Fuerte dominio de SQL y experiencia con bases de datos relacionales (por ejemplo, MySQL, PostgreSQL)Dominio de al menos un lenguaje de programación (p. ej., Python, Java, Scala)Experiencia con modelado de datos y principios de diseño de bases de datos.Familiaridad con herramientas y procesos ETL.Conocimiento de plataformas de datos basadas en la nube (por ejemplo, AWS, Azure, Google Cloud)Comprensión de los conceptos y tecnologías de almacenamiento de datos.Excelentes habilidades analíticas y de resolución de problemas.Fuertes habilidades de comunicación y colaboración.Capacidad para trabajar de forma independiente y en un entorno orientado al equipo.Atención al detalle y compromiso de realizar un trabajo de alta calidad.",STEFANINI LATAM,vacancy_type_temporary,,True,,,Peru,https://stefaninilatam.gupy.io/job/eyJqb2JJZCI6NzI5NTU3Nywic291cmNlIjoiZ3VweV9wb3J0YWwifQ==?jobBoardSource=gupy_portal,True,remote,True
