job_id,published_date,title,description,career_page_name,type,application_deadline,is_remote_work,city,state,country,job_url,disabilities,workplace_type,submitted
7250925,2024-06-03T18:07:48.045Z,Cientista de Dados /  Especialista IA/ML,"Sobre a GeoambienteNós aceleramos a transformação digital das empresas, oferecendo soluções tecnológicas deponta. Temos mais de 25 anos de experiência em inteligência de localização.Somos parceiros premier do Google e revendedores oficiais das plataformas Google Cloud,Google Maps e Google Workspace. Temos times de especialistas certificados nas tecnologias eatendemos empresas que são referência de mercado (tanto do setor público quanto privado)na sua jornada de migração para nuvem e na transformação digital para empresas DataDriven.Oferecemos serviços de geotecnologia com os mais elevados padrões no uso desensoriamento remoto, dados geoespaciais e inteligência de localização.Sobre a oportunidade....Estamos buscando um Cientista de Dados, Especialista em IA (Inteligência Artificial) e ML (Machine Learning), com sólida formação em matemática, estatística ou ciência da computação e experiência em Machine Learning.Responsabilidades e atribuiçõesResponsabilidades e Atribuições:Aquisição de Dados: Coletar dados de diversas fontes, sejam elas bancos de dados, APIs ou dados não estruturados.Limpeza e Transformação de Dados: Processar os dados brutos para corrigir inconsistências, tratar valores ausentes e transformar os dados em um formato adequado para análise.Análise Exploratória de Dados (EDA): Utilizar técnicas estatísticas e de visualização para entender as características e padrões presentes nos dados.Identificação de Variáveis Relevantes: Determinar quais características dos dados são mais relevantes para os modelos preditivos.Construção e Customização de Modelos: Atuará com as últimas tecnologias de IA da Google Cloud Platform para construir e customizar modelos.Deploy de Modelos: Realizará a publicação de modelos de IA/ML com recursos da Plataforma GCP.Trabalho em Equipe: irá trabalhar com outros cientistas e engenheiros de dados, bem como desenvolvedores, arquitetos, etc. E também estará constantemente em contato com os clientes e com o time de especialistas do Google, para desenvolvimento dos projetos.Requisitos e qualificaçõesHabilidades técnicas:Sólida formação em matemática, estatística ou ciência da computação: é fundamental ter um bom entendimento de conceitos matemáticos como álgebra linear, cálculo, estatística probabilística e inferencial. Além disso, é importante ter conhecimento em algoritmos, estruturas de dados e linguagens de programação, como Python e R;Experiência em Machine Learning: é necessário ter conhecimento em diferentes algoritmos de Machine Learning, como regressão linear, árvores de decisão, redes neurais artificiais e clustering. Também é importante ter experiência em técnicas de pré-processamento de dados, seleção de variáveis ​​e avaliação de modelos;Habilidades em Programação: proficiência em Python. Além disso, é importante ter conhecimento em bibliotecas de Machine Learning como TensorFlow, PyTorch e scikit-learn, bem como bibliotecas como Pandas para uso de dados;Conhecimento em Cloud Computing: ter conhecimento em Google Cloud Platform para treinar e implantar modelos de Machine Learning, é essencial;Domínio de ferramentas de visualização de dados: Conhecimento em Looker, Looker Studio entre outras ferramentas de visualização de dados é diferencial.Habilidades Técnicas Desejáveis:Big Query: conhecimentos em Big Query e BigQuery ML.Gen AI: conhecimentos básicos em IA Generativa.Certificações: Professional Data Engineer ou Professional IA/ML da GCP.Conhecimento em algoritmos e modelos pré treinados: como Yolo, Gema, entre outros.Habilidades comportamentais:Pensamento crítico e resolução de problemas: ser capaz de analisar problemas complexos, identificar soluções e implementá-las de forma eficaz.Comunicação eficaz: É importante ser capaz de comunicar ideias técnicas de forma clara e concisa para stakeholders técnicos e não técnicos.Trabalho em equipe: O profissional de IA/ML frequentemente trabalha em equipes multidisciplinares. Portanto, é importante ter boas habilidades de trabalho em equipe e ser colaborativo.Aprendizagem contínua: A área de IA/ML está em constante evolução. Assim, é importante ser um profissional proativo e estar sempre buscando aprender novas tecnologias e técnicas.Criatividade: A IA/ML é uma área que oferece muitas oportunidades para inovação. Então, é importante ser um profissional criativo e que esteja sempre buscando novas maneiras de aplicar as tecnologias para resolver problemas reais.Informações adicionaisBenefícios que a GEOAMBIENTE te proporciona! Regime de contratação CLT Remuneração variável Vale refeição Plano de SaúdePlano OdontológicoAuxílio CrecheLicença Paternidade estendidaSeguro de VidaFlexibilidade de horárioTrabalho HíbridoNo Dress CodeInteressou? Tem os requisitos? Candidate-se e faça parte do TIME GEO!",Geoambiente - Google Cloud Premier Partner,vacancy_type_effective,,True,,,Brasil,https://geoambiente.gupy.io/job/eyJqb2JJZCI6NzI1MDkyNSwic291cmNlIjoiZ3VweV9wb3J0YWwifQ==?jobBoardSource=gupy_portal,False,remote,True
7251147,2024-06-03T18:05:33.958Z,Analista de Dados PL - RPA (São Paulo) ,"Estamos em busca de um profissional responsável por projetar, construir, instalar, testar e manter solução de automação de processos de negócio com aplicação de RPA (Robotic Process Automation), combinando diferentes sistemas fontes e arquitetura apropriada que permitam criar fluxo de trabalhos eficientemente automatizados e consistentes. Tudo isso visando melhorar a confiabilidade e a qualidade dos processos de negócio e garantir a entrega de soluções que aumentem a eficiência operacional, reduzindo custos e seguindo as boas práticas de mercadoResponsabilidades e atribuiçõesAvaliar e entender os processos de negócios existentes para identificar áreas adequadas para automação.Projetar, desenvolver e implementar fluxos de trabalho automatizados utilizando ferramentas de RPA.Realizar testes extensivos para garantir a qualidade e a integridade das soluções de automação, além de resolver problemas e bugs quando identificados.Integrar soluções de RPA com sistemas legados, APIs e outras ferramentas de software conforme necessário para garantir a funcionalidade contínua.Criar documentação técnica detalhada, incluindo manuais de usuário e procedimentos operacionais padrão, além de fornecer treinamento para usuários finais quando apropriado.Fornecer suporte técnico contínuo, monitorar o desempenho das soluções de automação e realizar atualizações e manutenção conforme necessário.Trabalhar em estreita colaboração com equipes de negócios, TI, BI e outras partes interessadas para garantir a alinhamento estratégico e a entrega eficaz de soluções de automação.Requisitos e qualificaçõesSuperior completo em Engenharia da Computação, Ciência da Computação, Engenharia de Softwares,sistemas de informações ou áreas relacionadas.Mais de 2 anos de experiência em desenvolvimento de softwares, preferencialmente com foco em automação de processos.Experiência em ferramentas de RPA, como UiPath, Automation Anywhere, Blue Prism, entre outras.Sólidos conhecimentos de programação (Python, C#, vb.net, Java, C++, Scala e etc).Conhecimento em SQL e banco da dadosConhecimento em mapeamento de processosConhecimentos em arquiteturas de sistemas de RPA.Conhecimento em integração de APIs.Desejável certificação em ferramentas de RPA.Desejável experiência em automatizações envolvendo SAP ERP.Capacidade de analisar processos complexos, identificar padrões e propor soluções eficazes de automação.Excelentes habilidades de comunicação verbal e escrita, capacidade de trabalhar em equipe e colaborar efetivamente com diversas partes interessadas.Habilidade em gestão de projetos.Inglês avançado/fluente.“A Faber-Castell reconhece, respeita e valoriza as pessoas e suas singularidades relativas a gênero, raça, orientação sexual, condição de deficiência entre outras características. Essa vaga está aberta a todas as pessoas.”Informações adicionaisAssistência MédicaAssistência OdontológicaDesconto em ProdutosParticipação nos Lucros ou ResultadosSeguro de VidaVale RestauranteVale AlimentaçãoVale Transporte/EstacionamentoReembolso de MedicamentoAuxílio Atividade FísicaAuxilio Ótica",Vagas Faber-Castell Brasil,vacancy_type_effective,2024-07-03T00:00:00.000Z,True,,,Brasil,https://fabercastell.gupy.io/job/eyJqb2JJZCI6NzI1MTE0Nywic291cmNlIjoiZ3VweV9wb3J0YWwifQ==?jobBoardSource=gupy_portal,False,remote,True
7250642,2024-06-03T17:57:36.375Z,Estágio em Análise de Dados (Power BI e Python),"Na Betunel acreditamos que os jovens tem o potencial para transformar a sociedade. Buscamos jovens com brilho nos olhos, determinados e com sede de aprendizagem, se identificou? Então venha fazer parte do nosso time! Nos programas de aprendizagem da Betunel você terá a oportunidade de conhecer na prática diferentes áreas de atuação, tendo contato com profissionais dedicados a prover a melhor experiência possível para nossos clientes.Responsabilidades e atribuiçõesDesenvolvimento e manutenção de dashboards em Power Bi e Excel;Desenvolvimento e manutenção de códigos Python para automatização de rotinas de coletas de dados públicos em sites, e outros para análises estatísticas que apoiarão o processo de previsão de vendas;Acompanhamento no desenvolvimento de novos projetos e ferramentas junto a área de Ti;Executa outras tarefas relacionadas com o cargo, a critério do seu Gerente Executivo.Requisitos e qualificaçõesEnsino superior cursando em Engenharia de Produção, Estatística, Administração, Sistemas de Informação ou em áreas que tenham conexão com análise de dados;Desejável conhecimento em tabulação e análise de dados;Conhecimento avançado em Excel e Power BI;Conhecimento em Python.Informações adicionaisVale Transporte;Vale Alimentação ou Refeição;",betunel-oficial,vacancy_type_internship,,False,Rio de Janeiro,Rio de Janeiro,Brasil,https://betunel.gupy.io/job/eyJqb2JJZCI6NzI1MDY0Miwic291cmNlIjoiZ3VweV9wb3J0YWwifQ==?jobBoardSource=gupy_portal,True,on-site,True
7239010,2024-06-03T16:58:11.319Z,Administrador(a) de Dados II,"Se você quer colocar seu talento em expansão, embarque com a gente nessa jornada de oportunidades, desenvolvimento e muita cooperação para mover você em direção a um universo a ser explorado!Responsabilidades e atribuiçõesAtuará na definição dos padrões relacionados a Banco de Dados através da documentação, publicação e divulgação aos times, visando orientar a implementação das estruturas de dados dos produtos/domínios;Garantir que o modelo lógico e físico de dados seja descrito e implementado corretamente, através de validações dos padrões estabelecidos visando a aderência das implementações as boas práticas e arquitetura de referencia;Atuar na construção dos Fluxos de Dados, através da representação gráfica, estruturada e sistemática, visando o correto entendimento do fluxo das informações entre os produtos/domínios;Criar e manter os artefatos para administração de dados (diagramas de modelo de dados, dicionário de dados, catálogo de dados, scripts de DDL);Efetuar a gestão do ciclo de vida dos dados, através de análises dos dados existentes para otimizar os custos e espaços de armazenamento;Atuar nas etapas de Planejamento Planning e Design do SDLC, no processo de Quality Assurance (QA) e na Governança de Dados.Requisitos e qualificaçõesÉ essencial:- Vivência em modelagem de dados;- Experiência na execução de projetos de tecnologia;- Ter atuado com Metodologia Ágeis e Gestão de Projetos- Ter conhecimento em padrões de Governança de Dados;- Ter vivência com Modelos e Processos de Administração de Dados;- Ter conhecimento com Padrões de Banco de Dados, incluindo linguagem SQL;- Entendimento dos Modelos de Integrações Sistêmicas (APIs, eventos, mensagerias, ETL/ELT, CDC)É diferencial:- Vivência em padrões de Dados Analíticos;- Entendimento dos modelos de arquitetura padrão C4, Fluxograma e Modelo de Dados;Informações adicionaisO QUE TAMBÉM TEMOS POR AQUI...• Assistência Médica – se precisar é bom ter• Assistência Odontológica – porque amamos sorrisos por aqui• Programa Renascer – uma vida renasce a outra• Datas Significativas – a gente ama sentir o que faz sentido• Investimento em Educação – estamos com você na jornada do aprendizado ;)• Participação nos Resultados – construímos juntos, celebramos juntos no dia do Perten-ser!• Plano de Desenvolvimento Individual – valorizamos seu protagonismo de carreira• Previdência Privada – gostamos de pensar nas possibilidades do futuro• Seguro de Vida – importante, né! rs• Tempo Juntos – reconhecemos quem gosta de estar conosco• Vale Refeição e/ou Alimentação – uma delícia!• Vale Transporte – sem descontos ? sim.• Auxílio infantil/babá – porque seu Baby merece ficar em um lugar seguro e acolhedor.",Central Ailos,vacancy_type_effective,2024-06-11T00:00:00.000Z,False,Blumenau,Santa Catarina,Brasil,https://centralailos.gupy.io/job/eyJqb2JJZCI6NzIzOTAxMCwic291cmNlIjoiZ3VweV9wb3J0YWwifQ==?jobBoardSource=gupy_portal,True,on-site,True
7224467,2024-06-03T16:55:20.672Z,Engenheiro de Dados ,"Sobre a Nitro Química:A Nitro Química é uma empresa globalmente reconhecida no setor químico, comprometida com a inovação e a sustentabilidade. Com um legado de mais de 80 anos, nossa missão é transformar e entregar soluções químicas de alto desempenho, impactando positivamente a vida das pessoas e o meio ambiente. Nossa cultura é baseada em valores sólidos, como ética, respeito, segurança e excelência. Valorizamos o trabalho em equipe, a inovação e a melhoria contínua, proporcionando um ambiente de trabalho dinâmico e acolhedor para nossos colaboradores.Objetivo da Posição:Buscamos um(a) Engenheiro de Dados talentoso(a) para arquitetar, desenvolver e manter produtos de dados na solução Databricks e Power BI, alinhado às demandas da nossa Área de Dados. Este profissional será essencial para impulsionar nossas iniciativas de transformação digital e otimização de processos.Responsabilidades e atribuiçõesGestão do Ambiente Cloud/Azure: Monitorar continuamente o consumo de dados na Azure, aplicando melhores práticas de otimização e gestão de plataforma e consumo.Arquitetura da Solução Databricks: Gerenciar e desenhar interfaces dos diversos sistemas integrados ao Databricks, além da organização dos dados dentro da solução.Desenvolvimento de Novos Produtos de Dados: Construir novos produtos de dados no Databricks, desde a ingestão de dados nos sistemas de origem, desenvolvimento das regras de negócio, criação de documentação até a construção de dashboards no Power BI.Requisitos e qualificaçõesRequisitos e Qualificações:Formação/Experiência: Ensino Superior completo em Engenharia, Ciência da Computação ou áreas correlatas.Idiomas: Inglês intermediário.Experiência como Engenheiro e/ou Arquiteto de Dados.Conhecimento Específico:Infraestrutura de CloudAmbiente AzureDesenvolvimento e gestão de soluções Datalake house, idealmente com DatabricksPower BIProgramação em Python e SQLDiferencial: Conhecimento em IA e Machine Learning.Competências Comportamentais:Inovação, criatividade e trabalho em equipeCapacidade analíticaBoa capacidade de comunicação para atendimento dos clientes internosProatividade e busca por melhoria contínuaInformações adicionaisOportunidades de desenvolvimento profissional e capacitaçõesAmbiente de trabalho colaborativo e inovador",Nitro,vacancy_type_effective,2024-06-08T00:00:00.000Z,False,São Paulo,São Paulo,Brasil,https://nitro.gupy.io/job/eyJqb2JJZCI6NzIyNDQ2Nywic291cmNlIjoiZ3VweV9wb3J0YWwifQ==?jobBoardSource=gupy_portal,False,hybrid,True
7251622,2024-06-03T18:36:12.987Z,Pessoa Engenheira de Software Sênior Python ,"Vem ser Ituber &amp; vem fazer Itaú_ O Itaú é a marca mais valiosa do Brasil, a melhor empresa para trabalhar segundo o Great Place to Work e o maior banco da América Latina. Nós impactamos diariamente mais de 60 milhões de clientes em 18 países. Somos feitos de pessoas e acreditamos que ter um quadro com pluralidade de origens, culturas, crenças, experiências, raças, deficiências, gêneros, orientações afetivo-sexuais e gerações ampliam as perspectivas e contribuem para um clima de respeito e valorização das diferenças. Não queremos você apenas por achar que tem a nossa cara. Queremos ter um pouco da sua também! Responsabilidades e atribuiçõesO que você precisa para ser um Ituber? Estamos buscando pessoas que queiram se desenvolver e aprender constantemente, compartilhando, colaborando, inovando e entregando valor para todos os nossos clientes. Aqui a gente não sabe tudo, a gente vai de turma_Requisitos e qualificaçõesOportunidade atuar na engenharia de software da comunidade de Riscos e Tesouraria do Banco Itaú. Somos a área responsável por definir, implementar, sustentar e evoluir o ecossistema de softwares que são base para essa grande estrutura. Ambiente de negcios dinâmico, em jornada de transformação Ágil e com uma forte agenda de modernização.Como é o dia a dia de um Ituber nessa área? Trabalhar com um time altamente qualificado para construir, evoluir e manter aplicações robustasAplicar melhores práticas de Engenharia de SoftwareConstruir desenho de solução, direcionamento técnico e implementação.Trabalhar com uma arquitetura orientada a eventos, com foco no qualidade.Propor e promover evoluções de Arquitetura.Definir e implementar evoluções em cloud pública (AWS).Fazer a gestão técnica de fornecedores externos (SaaS) e sua integração com sistemas internos.Informações adicionaisAo se tornar um Ituber você tem_ • Vale Transporte• Vale Refeição (Restaurantes) / Vale Alimentação (Supermercados)• Convênio médico e odontológico• Seguro de Vida• PLR – Participação nos Lucros e Resultados (Mediante resultados do banco)• Previdência privada• Descontos exclusivos em nossos produtos financeiros• Licença maternidade estendida &amp; paternidade• Auxílio Creche / Babá (para papais e mamães)• Incentivo a estudos• GymPass ou TotalPass• Acesso aos Clubes Itaú (Guarapiranga / Itanhaém e São Sebastião)• + Algumas vantagens que você pode conhecer durante o processo*Estimulamos candidaturas de pessoas com deficiência em todas as nossas posições, sendo assim, sinta-se à vontade para se candidatar em vagas sinalizadas como exclusivas ou não para pessoas com deficiência. Somos comprometidos com a inclusão e valorizamos a diversidade. #VemProItaú #VemSerItuber",Itaú Unibanco,vacancy_type_effective,,False,Sao Paulo,São Paulo,Brasil,https://vemproitau.gupy.io/job/eyJqb2JJZCI6NzI1MTYyMiwic291cmNlIjoiZ3VweV9wb3J0YWwifQ==?jobBoardSource=gupy_portal,True,hybrid,True
7249199,2024-06-03T13:58:39.283Z,[Ambev Global Tech] Data Platform Engineer,"O principal objetivo é identificar as necessidades da empresa relacionadas à ciência de dados, a fim de construir uma plataforma de autoatendimento de alto desempenho para Cientistas de Dados, para que possam construir excelentes pipelines de modelos de Machine Learning de forma simples e com abstrações prontas para confiabilidade, escalabilidade, performance, segurança, qualidade, perfilagem, documentação, linhagem, entre outros.Responsabilidades e atribuiçõesConstrução de infraestrutura para reduzir o tempo necessário para que um modelo simples ou complexo vá do início à produção;Monitoramento do status dos modelos usando técnicas estatísticas avançadas;Aumentar a capacidade de fazer modelagem offline/online (baixa latência);Construção de ferramentas para implantação automática de modelos;Participar da entrega de modelos e produtos de dados que estejam bem documentados, modelado e de fácil compreensão;Correção e avaliação de código, defendendo as melhores práticas de desenvolvimento de software com foco em engenharia e excelência operacional;Suporte N2 e N3 de bibliotecas, ferramentas e serviços.Requisitos e qualificaçõesExperiência com modelos e capacidade de entender as ferramentas utilizadas pelos cientistas de dados;- Experiência em matemática/estatística;Experiência com ferramentas de orquestração de dados (Airflow, Dagster, Prefect);Ser proficiente em Python, ou uma das principais linguagens de programação, e ser apaixonado por escrever código limpo e sustentável;Entender tecnologias, soluções e conceitos de Big Data (Spark, Trino, Hive, Iceberg, Delta Lake, Hudi) e múltiplas linguagens (YAML, Python), entendendo como criar integração entre elas;Conhecimento de frameworks como Keras, PyTorch, Tensorflow e o uso de frameworks populares de MLOps como Kubeflow, MLFlow e DataRobot;Excelentes habilidades de comunicação, compartilhando proativamente e buscando contexto para colaborar com diferentes equipes para entender os frameworks e modelos criados.Informações adicionaisVale refeição ou alimentação ifood;Vale transporte;Bônus;Plano de saúde e Telemedicina;Convênio odontológico;Convênio Farmácia;Self Learning (auxílio em cursos, certificações e idiomas);Seguro de vida;Instituto Ambev de Previdência Privada;Auxílio Material Escolar;Cesta de Natal e Kit Congelado;Brinquedos de Natal;Empresa cidadã (licença maternidade e paternidade) e presente do bebê;Desconto mensal em produtos AMBEV;Banco de horas;Gympass;Fretado;Abono anual referente a um salário.",Ambev Tech,vacancy_type_effective,,False,Campinas,São Paulo,Brasil,https://ambevtech.gupy.io/job/eyJqb2JJZCI6NzI0OTE5OSwic291cmNlIjoiZ3VweV9wb3J0YWwifQ==?jobBoardSource=gupy_portal,True,hybrid,True
7173556,2024-06-03T18:50:06.775Z,GRUPO SOMA | SomaLabs | Desenvolvedor Fullstack Sênior ,"Inquietos e Acelerados. Criativos ou Cartesianos. Talentosos e Autodidatas. Artesanais ou Tecnológicos.Não importa: gostamos de diversidade e de quem está aqui para agregar.Porque GENTE É O QUE SOMA. O Desenvolvedor Front End irá facilitar a comunicação digital do Grupo Soma.         QUER FAZER PARTE DESTA JORNADA COM A GENTE?Responsabilidades e atribuiçõesDesenvolver novas interfaces gráficas;Garantir otimizações de performance de ferramentas existentes;Garantir consultas a APIs (Interface de Programação de Aplicativos);Garantir o uso de melhores práticas para o desenvolvimento do front-end dos nossos sites;Garantir a migração para estrutura de componentização da intercace;Garantir que o código desenvolvido interna e externamente esteja bem documentado;Documentar algoritmos no código;Apoiar o treinamento de novos colaboradores.Requisitos e qualificaçõesConhecimentos em Javascript, CSS, HTML;Conhecimentos em React.js;Conhecimento com processadores de estilo (less e sass);Conhecimentos em webpack, gulp ou grunt;Conhecimento em Microserviços;Gitflow.Desejável:Vue.js;Conhecimento em API (Rest e GraphQL);Conhecimento de SQL (MySql e SqlServer);",GRUPO SOMA,vacancy_type_effective,,False,Rio de Janeiro,Rio de Janeiro,Brasil,https://gruposoma.gupy.io/job/eyJqb2JJZCI6NzE3MzU1Niwic291cmNlIjoiZ3VweV9wb3J0YWwifQ==?jobBoardSource=gupy_portal,True,hybrid,True
