job_id,published_date,title,description,career_page_name,type,application_deadline,is_remote_work,city,state,country,job_url,disabilities,workplace_type,submitted
8307420,2024-12-16T21:11:33.204Z,Analista de Dados SQL,"Se você é um profissional com perfil analítico, organizado e que gosta de desafios, venha fazer parte do nosso time! Estamos em busca de um Desenvolvedor de Dados que combine habilidades técnicas em programação com experiência em bancos de dados. Esse profissional será responsável por transformar dados brutos em análises acionáveis, utilizando técnicas avançadas de programação em Python e SQL, além de outras ferramentas de manipulação de dados.Se você tem experiência prática em desenvolvimento, adora criar soluções eficientes e trabalhar em um ambiente dinâmico, venha fazer parte da nossa equipe!Essa posição é ideal para quem aprecia trabalhar com autonomia, proatividade e tem facilidade para trabalhar em um ambiente dinâmico e inovador. Responsabilidades e atribuiçõesResponsabilidades:Desenvolver pipelines de dados e scripts automatizados para extração, transformação e carregamento (ETL);Criar e gerenciar bancos de dados utilizando SQL, BigQuery, Oracle e outras tecnologias;Programar scripts e soluções em Python para análise e manipulação de grandes volumes de dados;Construir dashboards e painéis de BI integrando fontes diversas;Diagnosticar e resolver problemas relacionados a dados e sistemas;Trabalhar diretamente com clientes e equipes internas para levantar requisitos e implementar soluções eficientes.Experiência esperada:Experiência prática em programação com Python e SQL (mínimo 2 anos);Experiência em manipulação e limpeza de dados em grandes volumes;Experiência em C# ou outras linguagens de programação é um diferencial;Experiência na área de varejo ou indústria é um diferencial.Requisitos e qualificaçõesRequisitos obrigatórios:Conhecimento em bancos de dados relacionais (MySQL, PostgreSQL, Oracle ou BigQuery);Habilidade de criar pipelines ETL e otimizar consultas SQL;Familiaridade com ferramentas de BI (Power BI, Tableau ou similares);Capacidade de autogestão e entrega de resultados.Diferenciais:Conhecimento em análise estatística ou machine learning;Certificações em Python ou banco de dados;Possuir notebook próprio de qualidade.Informações adicionaisBenefícios de trabalhar conosco:Ambiente inovador, com autonomia para implementar ideias;R$ 1.300,00 de ajuda de custo;Oportunidade de trabalhar em projetos estratégicos que impactam grandes negócios;Cultura de aprendizado contínuo e crescimento profissional.Local: Capoeiras, Florianópolis – SCModelo de trabalho: Híbrido (mínimo 3x por semana presencial)Horário: FlexívelModelo de contratação: CooperativaRemuneração: A negociar",DNA Recursos Humanos,vacancy_type_effective,2025-02-14T00:00:00.000Z,False,Florianópolis,Santa Catarina,Brasil,https://dna-recursos-humanos.gupy.io/job/eyJqb2JJZCI6ODMwNzQyMCwic291cmNlIjoiZ3VweV9wb3J0YWwifQ==?jobBoardSource=gupy_portal,True,on-site,True
8307006,2024-12-16T18:16:09.306Z,ESPECIALISTA DE DADOS - MERCADO LIVRE,"Somos o Grupo Energisa! Com mais de cem anos de história, a Energisa é o maior grupo privado com controle 100% nacional do setor elétrico brasileiro. Nosso portfólio diversificado abrange distribuidoras, concessões de transmissão, geração de grande porte renovável, uma marca inovadora de soluções energéticas – a (re)energisa –, com geração distribuída por fonte renovável, comercialização de energia no mercado livre e serviços de valor agregado, além de uma central de serviços compartilhados, uma empresa de contact center e a fintech Voltz, a primeira do nosso setor no mercado de contas digitais. Recentemente, diversificamos nosso portfólio com a inclusão da distribuição de gás natural, através da aquisição da ES Gás. Transformamos, através de nossos mais de 17.000 colaboradores, energia em conforto e desenvolvimento para mais de 20 milhões de pessoas. Acreditamos na força da diversidade e da pluralidade para gerar inovação e atingir resultados incríveis. Aqui todos são muito bem-vindos! Quer fazer parte desta história? Confere se esta oportunidade tem match com o seu perfil e vem conosco participar desta jornada de seleção!Responsabilidades e atribuiçõesHABILIDADES COMPORTAMENTAIS:Analítico, Pensamento Crítico, Análise de Dados, Experiência em Report, Organizado;Pensamento Crítico: Questionamentos, Reconhecimento de padrões, simplificação da complexidade);REQUISITOS TÉCNICOS:- Limpeza e Preparação de Dados: Limpar, transformar e preparar os dados utilizando Excel para análise, garantindo sua integridade, consistência, qualidade e confiabilidade;- Sintetização das informações em bases de dados e construção de dashboards/relatórios gerenciais e relatórios analíticos;- Análise de dados transformando grandes volumes de dados em insights estratégicos- Elaboração de Apresentações (Power Point) com conclusões em relação a performance dos negócios para tomada de decisões da Administração;- Se reunir com diferentes áreas da empresa de forma a buscar informações que complementem os relatórios financeiros;Usar Power BI (de modo estratégico)Usar Excel Avançado (de modo estratégico)-Transformar dados brutos e não estruturados com habilidade que ultrapassa o uso das ferramentas Excel e BI.-Adotar uma mentalidade voltada para resolver problemas e gerar valor;-Compreender o contexto (regras do negócio, perguntas certas, contexto dos dados – o que está acontecendo na empresa?- Consolidar projeções junto a área de Negócio Mercado Livre de Energia portando deve ter conhecimento de Mercado LivreRequisitos e qualificaçõesPossuir disponibilidade de residir em RIO DE JANEIRO.Ter experiência no mercado livre de energia.Estar com ensino superior concluído.Informações adicionaisAs PESSOAS são nossa maior ENERGIA. Pensando em seu bem-estar, oferecemos um leque de benefícios. Da só uma conferida no que você terá: • Vale alimentação ou Refeição para fazer as compras para sua casa ou comer no seu restaurante preferido; • Plano de saúde e odontológico para você e sua família; • Previdência privada para sua reserva financeira e investimentos; • Auxílio Creche para te apoiar nos primeiros anos com seus filhos; • Seguro de Vida, para dar mais tranquilidade a você e a quem você ama; • Participação nos lucros, como incentivo pelo seu trabalho e resultados; • Programas de qualidade de vida que garantem o bem-estar e promovem a saúde dos nossos colaboradores; • Programas de Bolsa de Estudo para te apoiar em qualificação profissional; • Gympass que te dá acesso a mais de 18 mil academias no Brasil. Se você possui os pré requisitos da vaga, faça sua candidatura e fique atento nas dicas: • Durante a jornada do processo de seleção, a comunicação será via e-mail ou por telefone. Certifique que seus dados estão atualizados e fique de olho na sua caixa de e-mail, sem esquecer da caixa de spam. Fique atento nas ligações, os nossos telefones corporativos possuem variação de DDD. • Caso receba um feedback negativo, não desanime, fique atento a outras oportunidades.",Energisa,vacancy_type_effective,2025-02-14T00:00:00.000Z,False,Rio de Janeiro,Rio de Janeiro,Brasil,https://grupoenergisa.gupy.io/job/eyJqb2JJZCI6ODMwNzAwNiwic291cmNlIjoiZ3VweV9wb3J0YWwifQ==?jobBoardSource=gupy_portal,True,hybrid,True
8211401,2024-12-16T16:46:53.500Z,Pessoa Desenvolvedora Python Sr - Cód. 1401,"Somos um dos maiores ecossistemas de Negócios SaaS do país e pioneiros na Transformação Digital do setor público. Especialista em simplificar complexidades e criar softwares que solucionam as principais dores dos setores que atuamos, assim, promovemos transformações fundamentais na vida das pessoas.  Possuímos um portfólio de mais de 19 marcas – essa posição é para atuar na solução de Inteligência Artificial para Procuradorias de Justiça.Responsabilidades e atribuiçõesDesenvolvimento e Implementação: trabalhar no design e codificação de soluções de IA/RPA, garantindo que atendam aos padrões de qualidade, alta disponibilidade e escalabilidade. Analisar as demandas de produto e técnicas, propondo as melhores práticas.Qualidade de código: Manter um código de alta qualidade, adotando boas práticas de clean code e testes automatizados.Monitoramento e melhoria contínua: Analisar o desempenho das aplicações e mensurar o uso dos produtos, propondo e implementando melhorias contínuas e soluções inovadoras para otimizar os produtos.Colaboração: Interagir com outros times (produto, UX/UI e operações) para garantir o alinhamento e a eficácia das soluções desenvolvidas.Suporte ao time: Oferecer suporte e mentoria a desenvolvedores juniores, promovendo o crescimento da equipe.Requisitos e qualificaçõesExperiência comprovada no desenvolvimento de aplicações de inteligência artificial.Proficiência em linguagens de programação como Python, R, .Net ou Java.Conhecimentos em processamento de linguagem natural (NLP) e análise de texto.Docker, APIs REST, CI/CD, Elastik Stack, ETL, construção e avaliação de modelos preditivos usando machine learning e ambientes AWS e Azure.Experiência com bibliotecas e frameworks como TensorFlow, PyTorch, Scikit-learn, Keras, entre outros.Familiaridade com bancos de dados relacionais e não-relacionais.Experiência em sistemas de versionamento de código, como Git.  Você irá se destacar se tiver:Conhecimento em inteligência artificial aplicada ao setor jurídico.Vivência em times ágeis (Scrum, Kanban, etc).Bom conhecimento no ciclo de desenvolvimento de um software; Atualizado com as últimas tendências e inovações em IA.Informações adicionaisModelo de trabalho: Esta vaga aceita candidaturas no modelo de trabalho 100% remoto.Benefícios:Vale-alimentação/Vale-refeição; ​Plano de saúde e odontológico; ​Auxílio Home Office;Bônus anual por resultados; ​Voucher para Kit Setup;Seguro de vida;Day Off aniversário;Programa de promoção à saúde e bem-estar;​Parcerias e descontos.​Um dos nossos pilares é a valorização das pessoas e temos orgulho de dizer que somos uma empresa que apoia a diversidade e inclusão. Sendo assim, consideramos todos os candidatos para as nossas vagas, sem distinção de raça, cor, religião, gênero e identidade de gênero, nacionalidade, deficiência, orientação sexual, ascendência, idade, etc.​",Softplan,vacancy_type_effective,2025-01-26T00:00:00.000Z,True,,,Brasil,https://softplan.gupy.io/job/eyJqb2JJZCI6ODIxMTQwMSwic291cmNlIjoiZ3VweV9wb3J0YWwifQ==?jobBoardSource=gupy_portal,False,remote,True
8308071,2024-12-16T19:57:00.474Z,Data Analyst,"A diretoria de Data &amp; Analytics na Blip é responsável por suprir a empresa com informações estratégicas, empoderá-la na geração de conhecimento, guiá-la em tomadas de decisão data-driven e impulsionar a inovação através dos dados. Tendo, desta forma, um papel muito importante na evolução da Blip.Sua área de Data For Services tem como missão gerar valor para nossos clientes por meio da implementação de serviços de dados de alto valor agregado, com foco em diagnósticos aplicados, análises preditivas e prescritivas; Impulsionando intencionalmente o aumento da satisfação do cliente, a evolução da análise desde o design na plataforma e a hiper personalização para nossos clientes-alvo.Como Data Analyst Sênior é esperado que você seja referência técnica para a especialidade no que tange análise de dados e práticas DataOps, suportando as dúvidas, compartilhando conhecimento, ao mesmo tempo, conduzindo melhorias de processo e acompanhando tendências do setor. Se você é uma Pessoa com Deficiência (PcD), saiba que todas as vagas da Blip também são inclusivas. Estamos esperando sua inscrição! 🚀Responsabilidades e atribuiçõesQual será seu papel no time?Criar, disponibilizar, evoluir e sustentar informações através de produtos de dados, baseado na necessidade do negócio; idealizando, criando e aprimorando dashboards e scripts customizados de envio de dados avançados para o monitoramento dos indicadores de negócio;Contribuir nas discussões sobre armazenamento de informações e pipelines de dados para dar suporte a relatórios analíticos avançados, análise e exploração de dados, utilizando várias tecnologias de dados e visualização.Trabalhar em estreita colaboração com as equipes de analytics engineer e data product managers para identificar aprimoramentos dos processos e alinhar essas mudanças às práticas da equipe.Colaborar com as partes interessadas, fornecendo orientação, dados e suporte analítico para o desenvolvimento de novas análises e ferramentas em apoio a iniciativas estratégicas.Sugerir/Colaborar/Desenvolver e facilitar iniciativas junto ao time de governança de dados para garantir a integridade dos dados em sistemas distribuídos.Estimular e promover práticas de DataOps no desenvolvimento dos produtos de dados.Sugerir/Colaborar/Conduzir experimentos, inovações e resolução de problemas complexos,Sugerir/Colaborar/Promover uma cultura analítica e de decisão data-driven em Blip, através de oficinas, workshops e repasses de produtos de análise de dados;Sugerir/Colaborar/Promover e disseminar boas práticas de governança e qualidade de dados.Disseminar conhecimento, dar suporte nas entregas produzidas pela equipe.Requisitos e qualificaçõesO que esperamos de você:Conhecimento em elaboração de query em SQL;Conhecimento especializado em conceitos de banco de dados/modelagem de dados, habilidades em SQL, proficiência em ajuste de desempenho de consultas;Conhecimento em análise exploratória de dados;Conhecimento em desenvolvimento de soluções do Power BI desktopConhecimento em desenvolvimento de soluções do Power BI Desktop e Service visando otimização e organização de recursos com uso em grande escala;Conhecimento em Python e Spark para processamento de grande volume de dados;Conhecimento em tecnologia GIT;Conhecimento em data visualization e storytelling;Conhecimento em modelagem estatística.Domínio em práticas de pair teste aplicado a dados;Trabalhar bem em um ambiente de equipe e ser capaz de estabelecer parcerias com membros da equipe técnica e comercial.Ser capaz de traduzir a linguagem técnica para as necessidades não técnicas;Habilidades de colaboração, comunicação, liderança e organização;Curiosidade.E será um diferencial se você:Experiência na utilização de alguma plataforma de dados em nuvem Azure;Experiência na utilização do DataBricks;Conhecimento em Machine Learning.Informações adicionaisVantagens e benefíciosNada básico que amamos:Vale Alimentação ou Refeição no valor de R$968,00 fixo (inclusive nas férias);Vale transporte para modelos de trabalhos híbrido ou presencial;Day-off: dia de folga pelo seu aniversário;Auxílio home office para modelos de trabalho remoto ou híbrido;Modelos de trabalho 100% remoto, híbrido ou presencial;Bonificação anual de acordo com resultados da empresa e políticas vigentes;Vale Cultura para usar em livrarias, papelarias, comprar livros, ingressos de teatro, shows, cinema e mais; Reembolso do registro da troca do nome social para pessoas trans;Empréstimo Consignado: parceria com alguns bancos que facilita na contratação de um empréstimo consignado;No dress code.Saúde e bem-estar:Assistência médica de cobertura nacional para Blippers e dependente em sistema coparticipativo;Assistência odontológica para Blippers e dependentes;Wellhub Gympass para Blippers e dependentes: plataforma que dá acesso a academias, estúdios e apps de bem-estar para você cuidar da sua saúde;Psicologia viva: plataforma de atendimentos psicológicos online com coparticipação;Seguro de vida sem custo para Blippers;Horário flexível: nosso regime de 40h semanais pode ser feito em horário flexível, desde que alinhados com a sua liderança;Família:Licença estendida para todas as pessoas gestantes (180 dias) e para todas as pessoas que assumem responsabilidade parental (30 dias), extensível para papais e mamães que adotarem ou obtiverem a guarda judicial da criança e para casais homoafetivos;Auxílio creche para crianças até 71 meses;Auxílio mensal para Baby Blippers com deficiência para tratamento e/ou escola especializada;Auxílio recém-nascido de R$1.000,00, válido também nos casos de adoção.Carreira e formação:Apoio em capacitações, conforme as políticas de elegibilidade e alinhamentos das áreas;Lifelong Learning: contamos com a Degreed, uma das maiores plataformas de aprendizagem do mundo com acesso a conteúdos ilimitados sobre diversos temas;Galena: descontos em graduações e cursos de desenvolvimento em instituições educacionais.",Blip,vacancy_type_effective,2025-02-14T00:00:00.000Z,True,,,Brasil,https://blip.gupy.io/job/eyJqb2JJZCI6ODMwODA3MSwic291cmNlIjoiZ3VweV9wb3J0YWwifQ==?jobBoardSource=gupy_portal,True,remote,True
8304144,2024-12-16T19:25:42.426Z,Especialista de Automatización y Datos,"﻿Estamos en la búsqueda de un especialista que combine experiencia en Robotic Process Automation (RPA) con Blue Prism y conocimientos en Google Cloud Platform (GCP). El objetivo principal es automatizar la extracción de datos desde diversas fuentes mediante RPA y gestionar su integración en un modelo de datos basado en BigQuery. Este rol requiere un perfil híbrido que sea capaz de ejecutar procesos de RPA mientras trabaja en la manipulación e integración de datos en GCP. ¡Sé parte de Stefanini!​En Stefanini somos más de 30.000 genios, conectados desde 41 países, haciendo lo que les apasiona y co-creando un futuro mejor.​Responsabilidades y atribucionesAutomatización de Procesos (RPA):Diseñar, desarrollar e implementar flujos automatizados utilizando Blue Prism.Automatizar la extracción de datos desde páginas web y otras fuentes externas.Monitorear y optimizar procesos RPA para asegurar su funcionamiento continuo.Integración de Datos en GCP:Preparar y cargar los datos extraídos en Google Cloud Storage (Buckets).Gestionar y transformar los datos utilizando BigQuery.Desarrollar procedimientos almacenados y funciones específicas en BigQuery.Configurar y administrar Cloud Run y Cloud Scheduler para procesos automatizados.Participar en la implementación de pipelines utilizando DataFlow (si es requerido).Soporte y Mejora de Procesos:Colaborar en la creación de tablas, vistas y funciones en BigQuery.Solventar problemas técnicos relacionados con la integración de RPA y GCP.Asegurar la calidad y consistencia de los datos procesados.Proponer mejoras en la arquitectura y automatización de procesos.Requisitos y calificacionesRPA:Experiencia comprobable en el desarrollo de soluciones RPA utilizando Blue Prism (+2 años - Excluyente)Conocimiento para la extracción de datos estructurados y no estructurados. (Excluyente)Capacidad para integrar flujos RPA con plataformas externas. (Excluyente) Google Cloud Platform (GCP):Conocimiento intermedio en el uso de BigQuery (consultas SQL, funciones, vistas). (Excluyente)Conocimientos de Cloud Storage (buckets) para el manejo de archivos y datos. (Excluyente)Conocimiento de Cloud Run y Cloud Scheduler para la ejecución y programación de tareas. (No excluyente)Conocimientos básicos de DataFlow para el diseño de pipelines (No excluyente)Conocimiento intermedio con Python y Google Cloud SDK. (Excluyente)General:Conocimientos básicos de modelos de datos y estructuras relacionales.Habilidad para documentar procesos técnicos y flujos de trabajo.Experiencia en proyectos híbridos que involucren RPA y plataformas cloud. Habilidades Blandas:Colaboración: Capacidad para trabajar con equipos multifuncionales, incluyendo analistas de datos y arquitectos cloud.Resolución de problemas: Enfoque lógico y estructurado para abordar desafíos técnicos.Comunicación: Habilidad para explicar conceptos técnicos a audiencias no técnicas.Adaptabilidad: Facilidad para aprender nuevas tecnologías y herramientas según las necesidades del proyecto. Requisitos Deseables:Experiencia previa en proyectos de integración entre RPA y GCP.Conocimiento de herramientas de visualización como Looker o Tableau (si es necesario reportar datos procesados).Familiaridad con la administración de permisos y roles en GCP.Informaciones adicionalesBeneficios StefaniniLunes a viernes 09:00 a 18:30 hrs.",STEFANINI LATAM,vacancy_type_temporary,2025-02-14T00:00:00.000Z,False,Las Condes,,Chile,https://stefaninilatam.gupy.io/job/eyJqb2JJZCI6ODMwNDE0NCwic291cmNlIjoiZ3VweV9wb3J0YWwifQ==?jobBoardSource=gupy_portal,True,hybrid,True
