job_id,published_date,title,description,career_page_name,type,application_deadline,is_remote_work,city,state,country,job_url,disabilities,workplace_type,submitted
8310506,2024-12-17T12:17:27.759Z,Pessoa Desenvolvedora Java Pleno ,"A SoftExpert é a empresa líder de mercado em soluções de software para a gestão integrada da conformidade, inovação e transformação digital de processos. E uma grande empresa possui grandes números: são mais de 550 colaboradores, mais de 2 mil clientes e 300 mil usuários, em mais de 40 países ao redor do mundo! Completamos 28 anos e nosso sonho é atingir todos os países do globo com nossas soluções. Por isso o nosso lema é #WeAreExpertsAndGlobal   A Oportunidade  Estamos em busca de profissionais com experiência em JAVA, que sejam criativos, inovadores e solucionadores de problemas.    Sua missão será integrar uma das squads do time de arquitetura e framework da SoftExpert, trabalhando na evolução da arquitetura do produto e requisitos que não são de negócio. Dentro do time de tecnologia, a atuação será direcionada à camada de serviços, requisitos de segurança, stack de desenvolvimento, Analytics ou requisitos de colaboração.    Responsabilidades e atribuiçõesAvaliar, discutir e definir proposta de soluções arquiteturais de sistemas e propor melhorias, promovendo coesoes técnicas e consistentes ao produto;Planejar e executar solucoes para plataforma de microsservicos;Interagir com outras equipes para garantir integrações da ferramenta e produtos;Cuidar da monitoração do ambiente e criar ações proativas que garantem a saúde do produto;Atuar no atendimento de chamados para correção de bugs e dúvidas com o cliente;Apoiar em code reviews e cross tests;Elaboração de documentações técnicas;Levantamento dos requisitos para o desenvolvimento de novas features;Colaboração com decisões de arquiteturas.Requisitos e qualificaçõesExperiência sólida utilizando JavaApi's RESTConhecimento em Testes UnitáriosConceitos de SOLID e Clean CodeBancos de dados relacionais e não relacionais (PostgreSQL, SQLServer, Oracle)Conhecimento em GitComandos básicos de LinuxConhecimento de CI/CDConhecimento de Containers (Docker)Conhecimento de Mensageria e Arquitetura de EventosConhecimento de Arquitetura Cloud (AWS)Conhecimento de Metodologia Ágil - Scrum. Você irá se diferenciar se tiver: Idioma Inglês;Superior completo ou em andamento em Sistemas de Informação, Tecnologia ou afins;Conhecimento em ferramentas de performance, APM, logs e outras linguagens de programação.Conhecimento em:Experiência com PHP BigData QuarkusSparkDockerJasper ReportsAWSDockerJUnit e MockitoInformações adicionais🩺Plano de Saúde Sulamérica: Sem mensalidade para o titular e coparticipação de apenas 30%🤑Bônus Anual: Reconhecemos e valorizamos o seu esforço com um bônus anual especial🍎Vale-Refeição ou Vale-Alimentação: Desfrute de refeições sem desconto em folha, com um benefício de R$800,00👩‍🏫Auxílio Educação: Bolsas de estudos para idiomas, graduação, pós ou especializações, com reembolso mensal de até 70%🏋🏽‍♂️TotalPass: Acesso à rede de academias, psicológos e nutricionista em todo o Brasil com um desconto exclusivo🦷Plano Odontológico: Escolha entre três opções de planos abrangentes para cuidar do seu sorriso em todo o Brasil🎁Indicação Premiada: Indique um amigo e receba até R$1.000,00💻Cursos Online Gratuitos: Aprimore suas habilidades com cursos 100% gratuitos, desenvolvidos pela SoftExpert🏅Capacitações Internas e Externas: Investimos no seu crescimento com programas de capacitação💊Convênio Farmácia💟Seguro de Vida",Carreiras SoftExpert,vacancy_type_effective,2025-02-15T00:00:00.000Z,True,,,Brasil,https://softexpert.gupy.io/job/eyJqb2JJZCI6ODMxMDUwNiwic291cmNlIjoiZ3VweV9wb3J0YWwifQ==?jobBoardSource=gupy_portal,True,remote,True
8141112,2024-12-17T01:16:29.056Z,Desenvolvedor Sênior - Outsystems,"💚 Sobre a TrueChangeJá pensou em trabalhar com uma tecnologia do futuro?Low-code é uma nova forma de desenvolvimento de aplicações que tem conquistado cada vez mais espaço no mercado, não é à toa que a TrueChange vem crescendo em ritmo super acelerado. Temos colaboradores espalhados por diversas cidades do país, e clientes dos mais diversos segmentos de atuação.Somos uma equipe incrível e apaixonada pelo que fazemos. Aqui você vai encontrar um ambiente leve e acolhedor, conhecer pessoas legais e ainda fazer mais do que colegas de trabalho: você fará amigos.Se você está disposto a conhecer uma tecnologia e uma empresa que vai agregar ainda mais valor à sua trajetória profissional, então a TrueChange é o seu lugar! Vem com a gente digitalizar o mundo com low-code :)Responsabilidades e atribuições💻 Para esta vaga, você terá as seguintes responsabilidades:Atuar durante todo ciclo de vida do desenvolvimento de software para entregar um produto robusto;Desenvolver fluxogramas, layouts e documentação para identificar necessidades e soluçõesEscrever códigos bem estruturados, eficientes e testáveis;Desenvolver planos de verificação de softwares e procedimentos de garantia de qualidade.Integrar componentes de software em um sistema de softwares totalmente funcional;Produzir especificações técnicas que determinem a viabilidade da solução;Participar de forma ativa dos ritos da metodologia durante o projeto;Integrar componentes e soluções de software para viabilizar o desenvolvimento da aplicação.Habilidade de estimar tarefas e contribuir para o planejamento das entregas.Comunicação clara, para interagir com stakeholders técnicos e não técnicos.Capacidade de mentorar desenvolvedores juniores e contribuir para o crescimento da equipe.Perfil orientado a resolução de problemas e inovação, com foco em otimizar processos e melhorar a eficiência.Habilidade para trabalhar de forma autônoma e liderar projetos end-to-end.Habilidade em modelagem de dados, lógica de negócios e automação de processos.Requisitos e qualificações📚 Para se candidatar, precisamos que você tenha os seguintes requisitos:Atuação anterior como Desenvolvedor de Software.Será um diferencial, qualificação em: Gestão de Requisitos, Padrões de Projeto, Banco de Dados, Metodologias Ágeis, C#, JAVA, JavaScript, React.Inglês técnico ou intermediário é necessário.Certificações específicas em plataformas low-code;Experiência com integração de sistemas e uso de APIs REST e SOAP.Informações adicionaisAgora se liga nas vantagens de ser um Truechanger:🩺 Para você cuidar da sua saúde, plano de saúde e odontológico Bradesco Top Nacional;​🥗 Para comer bem, auxílio alimentação por mês no cartão multibenefícios Swile (inclusive nas férias);🌎 Bora dominar o mundo? Temos programa de incentivo ao aprendizado de idiomas (inglês e espanhol);👶Auxílio creche/babá, para os filhos ficarem bem-cuidados enquanto os papais e mamães trabalham;💪 Wellhub e TotalPass para você cuidar da sua qualidade de vida e bem-estar;🤸‍♀️ Encontros semanais para realização de Ginástica Laboral;🧘‍♂️ Para cuidar da mente, parcerias com plataformas para apoio psicológico e aulas de meditação;🩺 (Esperamos que nunca precise!) Seguro de Vida para deixar sua família tranquila caso aconteça alguma coisa;💻 Auxílio home office, para trabalhar com um setup incrível;🎂 Dayoff no seu aniversário, afinal você precisa comemorar! \o/;👓 Auxílio lente para você trocar as lentes dos seus óculos sempre que precisar;🤝 Descontos em instituições de ensino e opções de lazer com nosso programa de Parcerias;😎 Programa de Indicações, você trás um amigo que dá match com a True e recebe uma bonificação com a efetivação dele;💰 Precisando de ajudinha extra? Oferecemos Empréstimo Consignado.Ah, e nossas vagas são destinadas a todas as pessoas, independentemente de qualquer fator, perfil ou característica :)",TrueChange,vacancy_type_effective,2025-01-13T00:00:00.000Z,False,Recife,Pernambuco,Brasil,https://truechange.gupy.io/job/eyJqb2JJZCI6ODE0MTExMiwic291cmNlIjoiZ3VweV9wb3J0YWwifQ==?jobBoardSource=gupy_portal,True,on-site,True
8308627,2024-12-16T20:58:16.656Z,Desenvolvedor Fullstack SR Java/Angular ,"A NAVA está em busca de um Desenvolvedor Sênior Java e Angular para fazer parte do nosso time de pessoas incríveis!  Por que trabalhar na NAVA?Somos uma empresa de tecnologia que atende as maiores companhias dos setores financeiro, seguros, meios de pagamento, telecomunicações, energia e varejo do país. Inspiramos nossos times a criar soluções para que essas companhias transformem e impactem positivamente o mundo.  Temos um time curioso, criativo, energético e inspirador, com grande foco nas pessoas para gerar inovação, transformação e crescimento. Dentro de um ambiente dinâmico e ágil, o nosso time está em expansão para acompanhar o crescimento exponencial da NAVA e dos nossos Clientes. ﻿Acolhemos as diferenças porque acreditamos que um ambiente diverso contribui para a inovação e uma sociedade mais justa e equânime e convidamos você à assumir esse compromisso junto com a gente.Responsabilidades e atribuiçõesComo será o seu dia a dia?Profissional com sólida experiência no desenvolvimento de soluções completas e escaláveis, atuando no front-end e back-end. Expertise em criação de aplicações robustas, com foco em alta performance, segurança e manutenção. Competência em liderar projetos e equipes técnicas, colaborando em ambientes ágeis e orientados à entrega contínua.Requisitos e qualificaçõesConhecimentos Técnicos: Conhecimento sólido em Java, JavaScript, TypeScript, HTML e CSS Frameworks Spring Boot, Angular e outras tecnologias relevantes. Conhecimentos em bancos de dados (SQL, Sybase, MySql) Conhecimento em ferramentas de CI CD (GIT, Bitbucket, Jira, Jenkins e Urban Code) Containers (Docker, Kubernetes, outros) Microserviços Conhecimento em microsserviços e APIs REST. Plataformas Cloud (Google, Azure, AWS) Métodos Ágeis﻿Informações adicionaisHorário de trabalho: COMERCIALModelo de trabalho para este projeto/cliente: REMOTOAlém de ser uma empresa certificada Great Place to Work, você vai encontrar na NAVA: ✅ Oportunidades de carreira 🚀✅ Liberdade para escrever seu próprio código 🏆✅ Diversidade e diferentes formas de ver o mundo 🌈✅ Comunidades que incentivam o crescimento de todos 📚✅ Treinamento In Company 💻✅ Um time incrível 😎✅ Empresa engajada no Pacto Global da ONU 💪🏼✅ Projetos inovadores 💡✅ Alta avaliação no Glassdoor 📣 ",NAVA | Technology for Business,vacancy_type_effective,2025-02-14T00:00:00.000Z,True,,,Brasil,https://nava.gupy.io/job/eyJqb2JJZCI6ODMwODYyNywic291cmNlIjoiZ3VweV9wb3J0YWwifQ==?jobBoardSource=gupy_portal,True,remote,True
8307715,2024-12-16T19:52:40.939Z,Desenvolvedora Full Stack Senior - Operação e Sustentação ,"Vice-Presidência: CHIEF INFORMATION OFFICERDiretoria: Infra Estrutura e Operações TechLocal de Trabalho: SP - presencial 2x por semana e 3x semana remoto.Somos o time produção, responsável por garantir a estabilidade e qualidade do sistema em produção.Dentro da nossa área você terá a oportunidade de prender e crescer na área de desenvolvimento Full Stack, com um foco especial em garantir a estabilidade e a continuidade das aplicações em produção, contribuindo para o sucesso das operações de sustentação.Possuímos um ambiente de aprendizado com mentoria e suporte técnico com profissionais mais experientes, promovendo o crescimento técnico e profissional em operações.Oportunidades de crescimento dentro da empresa, com caminhos claros para progressão de carreira dentro da área de sustentação e operação.Cultura de inovação e incentivo ao desenvolvimento contínuo, com um forte foco em capacitação e desenvolvimento pessoal voltado para a operação.Nossa área acompanha a entrega de projetos em produçao, codifica, testa e/ou personaliza soluções para atender às exigências do cliente com base em especificações detalhadas dos consultores de tecnologia/sistemas, a partir dos itens gerados após implantação do projeto em produção.Responsabilidades e atribuiçõesResponsabilidades:• Desenvolver e manter funcionalidades de sistemas voltadas para a operação e sustentação, utilizando Node.js, Python, Flutter e tecnologias NoSQL, com foco na robustez e escalabilidade das aplicações em produção.• Tratar e resolver incidentes funcionais e críticos que possam afetar a continuidade das operações, agindo com rapidez e precisão para minimizar impactos e restaurar a normalidade.• Acompanhar e implementar mudanças na infraestrutura e no código, garantindo que todas as modificações sejam bem planejadas, documentadas e comunicadas, seguindo as melhores práticas de gerenciamento de mudanças.• Trabalhar em escala de plantão para garantir suporte contínuo e resposta imediata a incidentes críticos, assegurando que o sistema esteja sempre disponível e operacional.• Colaborar com a equipe para garantir a qualidade, a entrega contínua das soluções e a implementação de melhorias contínuas na infraestrutura, utilizando as melhores práticas de DevOps.• Contribuir para a automatização de processos operacionais, auxiliando na criação de pipelines de CI/CD, monitoramento e práticas DevOps para melhorar a eficiência e a resposta a incidentes.• Trabalhar em equipe para adotar e implementar novas tecnologias e conceitos modernos de arquitetura como Domain-Driven Design (DDD), assegurando que as soluções desenvolvidas sejam altamente adaptáveis e alinhadas às necessidades do negócio.Requisitos e qualificaçõesImportante* SUPERIOR COMPLETO - CERTIFICADO CONCLUSÃORequisitos Técnicos:• Conhecimento sólido em Node.js, Python, Flutter e bancos de dados NoSQL (MongoDB), com experiência na resolução de problemas em ambientes de produção.• Experiência com KAFKA, Redis, e Azure, especialmente na manutenção e otimização de integrações para operações contínuas.• Familiaridade com práticas Agile, conceitos de DevOps, e ferramentas de automação como Jenkins, Ansible, ou Terraform, com foco em sustentação.• Experiência em monitoramento e gestão de operações utilizando ferramentas como ELK (Elasticsearch, Logstash, Kibana) e ServiceNow.• Conhecimento em arquitetura de software com foco em Domain-Driven Design (DDD) e sua aplicação em ambientes de sustentação.Habilidades Interpessoais:• Capacidade de colaborar efetivamente com outras equipes, especialmente em situações de resolução de incidentes críticos e funcionais.• Comunicação clara e eficaz, essencial para a gestão de operações e coordenação durante crises e mudanças planejadas.• Proatividade na resolução de problemas e gestão eficaz de prioridades em um ambiente de sustentação dinâmico, especialmente durante escalas de plantão.Experiência Desejada:• 5 anos ou mais de experiência em desenvolvimento Full Stack, com foco em sistemas de alta disponibilidade, sustentação e operações críticas.• Experiência em trabalhar em ambientes Agile e DevOps, contribuindo para a melhoria contínua das operações e infraestrutura.Objetivos do Cargo:• Assegurar a estabilidade e alta disponibilidade das aplicações em produção, garantindo que as soluções atendam às necessidades de operação e sustentação, com alta eficiência e segurança, mesmo em situações críticas.Benefícios e Oportunidades:• Desenvolvimento de carreira em um ambiente dinâmico e colaborativo, com oportunidades de especialização em sustentação e operação.• Participação em projetos desafiadores que exigem uma abordagem proativa e focada na continuidade das operações.• Benefícios competitivos e suporte ao desenvolvimento profissional, com foco em crescimento técnico e de carreira dentro da área de operações.Informações adicionaisNa Vivo não medimos esforços em apoiar e valorizar nossos colaboradores! Não são apenas excelentes benefícios, mas também flexíveis. Veja o que ofereceremos* para você:·      Escolher o benefício ideal para você e seus dependentes, numa plataforma digital com diversas categorias de Academia, VR, VA, Auxilio Farmácia, Assistência Médica, Odontológica e Seguro de Vida;·     ·     Celular corporativo. Sim, um smartphone novinho para você!·     ·     Plano de voz e Dados ilimitado! Sim, ilimitado! O 5G da Vivo é até 10 vezes mais rápido!·     ·     Uma oferta exclusiva da Vivo, com desconto especial em linha fixa, banda larga, TV e apps;·     ·     Terá direito a receber Bônus ou PPR anual;·     ·     Planejará seu futuro através do plano de Previdência Privada;·     ·     Tem filhos? Terá direito a um subsídio para ajudar nas despesas com escola, creche ou babá;·     ·     Viver em um ambiente que respeitará sua personalidade, seu estilo de se vestir, seu jeito de ser e poderá ser autêntico. #VemdeVocê·     ·     Trabalhar remotamente até 3 vezes por semana. #Mobility·     ·     Ter flexibilidade de horário;·     ·     Aproveitar um dia de folga (Day off) para comemorar seu aniversário;·     ·     Participar de um dos maiores programas de voluntariado corporativo para você transformar o mundo;·     ·     Usufruir do nosso Programa de Desenvolvimento Educacional que oferece parcerias em instituições de ensino com desconto; certificações e cursos online;·     ·     Potencializar sua carreira por meio do nosso Programa de Recrutamento Interno, no Brasil ou fora, afinal estamos presentes em mais de 17 países! #VivoMinhaCarreira E tem muito mais! Mas, você tem que se candidatar para saber...*De acordo com a política de elegibilidade determinada pela empresa.#VEMPRAVIVO Todas as nossas vagas são elegíveis a pessoas com deficiência e/ou reabilitados. Temos uma cultura que valoriza a diversidade, as diferenças e o potencial das pessoas! ",Vivo Digital,vacancy_type_effective,2024-12-17T00:00:00.000Z,False,São Paulo,São Paulo,Brasil,https://vivodigital.gupy.io/job/eyJqb2JJZCI6ODMwNzcxNSwic291cmNlIjoiZ3VweV9wb3J0YWwifQ==?jobBoardSource=gupy_portal,True,hybrid,True
8064089,2024-12-16T21:07:07.745Z,PROFESSOR ASSISTENTE I - PROJETO FRONT-END - IBMEC BARRA E CENTRO,"AQUI SUA CARREIRA COMEÇA GRANDE.VENHA SER UM PROFESSOR ASSISTENTE I NO IBMEC.Temos um projeto grandioso e que requer um time com disposição para pensar de forma original, disruptiva, e com objetivo de resolver as grandes questões de hoje na educação: acesso, tecnologia, customização e o sucesso dos nossos alunos.Somos uma companhia cheia de energia, que já nasceu gigante e com resultados extraordinários.Venha fazer parte desse time!VENHA TRANSFORMAR VIDAS. INCLUSIVE A SUA.Responsabilidades e atribuiçõesOs principais desafios como Professor Adjunto I são:Atuar como agente principal de efetivação da proposta pedagógica de nossas Instituições de Ensino, facilitando o processo de aprendizagem e cumprindo todo o programa da disciplina, o número de aulas previsto, despertando o interesse permanente dos alunos para o estudo, a reflexão e a busca de novos conhecimentos;Fazer uso devido do material didático disponível, bem como deve estimular uso do material bibliográfico da disciplina, através da consulta a livros e periódicos existentes na biblioteca, contribuindo para um aprendizado crítico e reflexivo;Cumprir os prazos estabelecidos no calendário acadêmico, bem como com as demandas solicitadas por seu respectivo coordenador de curso;Registrar, por meio de caderneta eletrônica, a frequência, o conteúdo das aulas, os resultados das atividades acadêmicas dos alunos e demais informações referentes aos componentes curriculares em prazo definido no calendário acadêmico;Contribuir para a realização de ações preparatórias para o ENADE;Orientar os alunos nos trabalhos de conclusão de curso;Utilizar metodologias ativas e sala de aula invertida para ministrar as aulas.Requisitos e qualificaçõesBuscamos profissionais com:Titulação: MESTRADO OU DOUTORADO;Mandatório Bacharelado/Especialização: GRADUAÇÃO NA ÁREA DE TECNOLOGIA;Capacidade de comunicação, relacionamento com o aluno, adaptação e flexibilidade;Atualização e domínio de conhecimentos teóricos e práticos referentes ao tema;Domínio da ferramenta Microsoft Teams;É indispensável que o candidato tenha currículo Lattes atualizado, este é um dos critérios de eliminação.Observação: A sua alocação preferencial será na unidade que você será contratado e sua disponibilidade de horas deverá se manter nessa unidade.Informações adicionais🎓Acreditamos na excelência do nosso ensino e, por isso, valorizamos os egressos das nossas instituições em nossos processos seletivos.👩🏽‍🦽 Mais inclusão: essa vaga também é destinada a pessoas com deficiência.DIVERSIDADE: A YDUQS valoriza a diversidade e as informações adicionais prestadas nos campos de diversidade são muito importantes para nós, por isso pedimos para que não deixe de responder.",Ibmec,vacancy_type_lecturer,2024-12-31T00:00:00.000Z,False,Rio de Janeiro,Rio de Janeiro,Brasil,https://ibmec.gupy.io/job/eyJqb2JJZCI6ODA2NDA4OSwic291cmNlIjoiZ3VweV9wb3J0YWwifQ==?jobBoardSource=gupy_portal,True,on-site,True
8310953,2024-12-17T13:04:03.842Z,Fullstack Developer PL - EXPRESSO CHAPECÓ,"Atuar na construção e sustentação de soluções de software nas mais diversas plataformas de mercado, utilizando linguagens de programação, bancos de dados, servidores e qualquer recurso de tecnologia necessária para o desenvolvimento de sistemas completos, a fim de contribuir com a sustentabilidade do negócio. Desenvolver, implantar e monitorar os indicadores de desempenho e qualidade da área, fim de contribuir com a sustentabilidade do negócio.Responsabilidades e atribuições•Atuar no desenvolvimento de softwares utilizando-se das linguagens de programação e tecnologias consolidadas de mercado, aplicando metodologias de arquitetura e padrões, seguindo especificações técnicas a fim de atender a necessidade do negócio.• Aplicar as boas práticas de segurança e proteção de dados, seguindo a política de desenvolvimento seguro, garantindo o atendimento das normas de segurança da informação e LGPD (Lei Geral de Proteção de Dados);• Criar e manter documentação técnica dos softwares desenvolvidos na ferramenta GitLab e outras, sempre que necessário, para manter a fonte de pesquisa da área atualizada;• Monitorar a solução entregue, pelo tempo necessário até a estabilização de acordo com a complexidade do software, através de checagens diária no banco de dados e ambiente de produção, para assegurar o resultado esperado;• Colaborar com o desempenho da área, através dos indicadores desenvolvidos, agindo para proativamente para solucionar e reportar à equipe em caso de inconformidades;• Contribuir na construção dos indicadores de desempenho e de qualidade da área através das ferramentas disponíveis a fim de subsidiar a equipe na tomada de ação para a resolução de incidentes;• Desenvolver novos softwares, correções e melhorias em rotinas de softwares existentes, através das metodologias e boas práticas aplicadas no setor para proporcionar entregas de maior qualidade;• Apoiar e acompanhar as atividades realizadas pelo nível JR, a fim de contribuir com o desenvolvimento da equipe e o atendimento dos procedimentos e padrões da área, contribuindo com a agilidade e qualidade das entregas;• Atender e respeitar procedimentos padrões e de segurança do trabalho na empresa e nos estabelecimentos terceiros (clientes).Requisitos e qualificaçõesEscolaridade: Superior na área de Tecnologia da Informação;Experiência na área de tecnologia da informação na função de Fullstack Developer ou afins;Conhecimento em linguagens de programação para web, desktop e mobile;Conhecimento em banco dedados relacionais e NoSQL;Conhecimentos de padrões de arquitetura e projeto, desenvolvimento e testes de softwares.Informações adicionais",Expresso São Miguel,vacancy_type_effective,2025-02-15T00:00:00.000Z,True,Chapecó,Santa Catarina,Brasil,https://sejaesm.gupy.io/job/eyJqb2JJZCI6ODMxMDk1Mywic291cmNlIjoiZ3VweV9wb3J0YWwifQ==?jobBoardSource=gupy_portal,True,remote,True
