job_id,published_date,title,description,career_page_name,type,application_deadline,is_remote_work,city,state,country,job_url,disabilities,workplace_type,submitted
8290428,2024-12-16T18:28:12.757Z,Pessoa Gerente de Data Analytics,"Sobre a AlmapBBDOQUEM SOMOS!#1 Agência Global da Década - Cannes Lions. Somos uma potência de criatividade e negócios que se reinventa todos os dias. Acreditamos que a criatividade é protagonista na geração de valor para as marcas, no crescimento dos negócios dos clientes e, não menos importante, na transformação das pessoas. Porque as pessoas são o centro da cultura da agência.Aqui na AlmapBBDO estimulamos um ambiente cada vez mais plural que permita trocas e aprendizados. Convidamos pessoas negras, LGBTQIAPN+, com deficiência, mulheres e vindas de diferentes níveis socioeconômicos, regiões e universidades do país a fazer parte do nosso time. Este é o nosso horizonte definitivo, visto por todas as equipes de nossa agência. E é assim que construímos, dia após dia, um ambiente diverso e uma grande ideia chamada AlmapBBDO.Venha fazer parte do nosso time!Responsabilidades e atribuiçõesEssa posição tem duas principais funções:(1) ser um atendimento de dados, tanto para o cliente externo quanto interno(2) acompanhar, de perto, a performance das campanhas e a efetividade das estratégias, através de técnicas de análise de dados, aplicadas ao contexto da publicidade.Gestão e desenvolvimento de equipe, com suporte da coordenação, garantindo as melhores condições de trabalho para que eles possam gerar inteligência acionável através de dados e soluções de tecnologia. 75% gestão, 25% entregas próprias.Papel ativo na investigação de problemas e na busca por alavancas de crescimento para as marcas e e-commerce atendidos, utilizando as diversas ferramentas disponíveis;Gestão de eelacionamento com clientes, áreas internas, outras agências do grupo, além de parceiros dentro e fora do Brasil;Liderar projetos lateralmente, com demais disciplinas de dados e tecnologia como Engenharia de Dados, Social Insights, Martech e Pesquisa de Mídia.Aplicar as metodologias de gestão de projetos já consagradas no dia a dia e implementá-las quando não houver;Garantir que a equipe está cumprindo com as entregas, com o prazo e qualidade esperada pelo cliente;Participar e contribuir para as atividades de troca de conhecimento e team building, que são elaboradas para toda a área de Dados e Martech.Manter crescimento de relevância em uma operação de dados que já é consolidada;Contribuir ativamente para o avanço nas agendas de automação e utilização de inteligência artificial;Garantir que tiramos o maior proveito das ferramentas que são contratadas pelo cliente;Conduzir os clientes pelos melhores caminhos, em termos de criação de soluções e governança do ambiente de dados;Fomentar a capacitação do time orientada a evolução nos estágios da carreira.Requisitos e qualificaçõesSólida experiência na área e como gestor(a) de pessoas;Boa comunicação verbal e escrita em português e inglês;Habilidade de relacionamento, com comunicação clara, adaptabilidade, senso de urgência;Capacidade de priorização e antecipação de problemas, além de profundo conhecimento do negócio do cliente;Capacidade de dialogar com clientes de diferentes segmentos, como CPG, Finance, Travel, Auto, etc.Conhecimento de estratégia de negócios e marketing, dinâmica de operação de tecnologia em agências de publicidade;Curiosidade infinita e forte habilidades de análise exploratória;Sólida experiência em análise de dados voltada a performance de campanhas, sobretudo digitais;Amplo repertório acerca de ferramentas voltadas ao trabalho de gestão, otimização e mensuração de campanhas, além de ferramentas de automação de jornada, personalização, testes e fontes de dados não usuais.Conhecimento prático de aplicação de estatística no contexto do Marketing: análises descritivas, inferenciais, testes de hipótese, clusterização, segmentação, projeções;Compreensão dos contextos pago e orgânico, pré e pós-clique; conhecimento em plataformas do mercado voltadas a web analytics, buy side platforms, CDPs, DMPs, Ad Verification, etc;Conhecimento conceitual de ferramentas tradicionalmente utilizadas por agências de publicidade como ComScore, TGI, Monitor;Vivência em agências de publicidade, para facilitação do relacionamento com demais áreas;Habilidade de concepção e planejamento de visualizações de dados, para gerar requisitos ao time de Engenharia;Vivência com metodologia ágil e ferramentas de gestão de projetos como Jira/Hive.Informações adicionaisClima bastante amigável, time trabalha em parceria com demais áreas e o departamento de dados que já tem mais de 70 pessoas, o que gera uma troca de conhecimentos relevante, além de permitir suporte em momentos de maior volume de demandas; Interação direta com os times de mídia e de engenharia / data Science no dia a dia.Clientes bastante relevantes, de relação sólida e de confiança conosco, pelo bom trabalho entregue até aqui. O clima também é bastante amigável, apesar das cobranças naturais. Existem pontos de maior exigência e necessidade de dedicação principalmente em momentos chave das campanhas.",AlmapBBDO,vacancy_type_effective,2025-02-10T00:00:00.000Z,False,São Paulo,São Paulo,Brasil,https://almapbbdo.gupy.io/job/eyJqb2JJZCI6ODI5MDQyOCwic291cmNlIjoiZ3VweV9wb3J0YWwifQ==?jobBoardSource=gupy_portal,True,hybrid,True
8297433,2024-12-16T18:10:39.445Z,Pessoa Analista Pleno de Data Analytics,"Sobre a EnergyBBDOQUEM SOMOS!Somos um modelo de agência integrada da BBDO no Brasil que atende e se adapta às necessidades de cada cliente, unindo a expertise da rede de agências mais premiada do mundo com operações ágeis e flexíveis. Nossa metodologia já nasceu com integração de dados, métricas e monitoramentos, mas sempre com um só foco: insights verdadeiros e humanos, que movam pessoas e transformem marcas.Aqui na EnergyBBDO estimulamos um ambiente cada vez mais plural que permita trocas e aprendizados. Convidamos pessoas negras, LGBTQIAPN+, com deficiência, mulheres e vindas de diferentes níveis socioeconômicos, regiões e universidades do país a fazer parte do nosso time. Este é o nosso horizonte definitivo, visto por todas as equipes de nossa agência. E é assim que construímos, dia após dia, um ambiente diverso.Venha fazer parte do nosso time!Responsabilidades e atribuiçõesAcompanhamento próximo e suporte à operação de mídia;Interação com times do cliente durante a participação de projetos;Apresentação de relatórios e análises para o cliente e demais times da agência;Colaborar com o planejamento estratégico aplicando pensamento crítico abrangente em relação à marca do cliente, suas ações e cenário competitivo, através dos dados disponíveis;Aumentar massa de dados disponíveis atuando em conjunto com equipe de engenharia de dados;Traduzir as necessidades analíticas em especificações de projetos para os especialistas (data solutions, data engineering, martech, social insights, research, etc);Participar das estratégias de canais, audiências e budget;Apresentar aos clientes com suporte dos especialistas (social, research, etc) em uma narrativa clara e compreensível para pessoas leigas (bom storytelling PPT/Keynote);Requisitos e qualificaçõesConhecimento e experiência com Google Analytics, ferramentas de app como firebase, appsflyer e ferramentas de marketing digital: plataformas de mídia, redes sociais, plataformas de audiência;Experiência prévia com implementação e análise de dados com GA - diferencial ter a certificação;Abordagem propositiva para identificar e resolver problemas relacionados ao tema;Conhecimento intermediário / avançado em ferramentas de visualização de Dados: PowerBI/Looker Studio;Excel Avançado;Conceitos de marketing como jornada, funil de conversão, atribuição;Métricas de mídia on e off, métricas de aquisição e de negócios (desejável);Manipulação de dados não estruturados e semiestruturados;Conceito de dados primários, secundários e de terceiros.Inglês avançado para conversaçãoInformações adicionais",EnergyBBDO,vacancy_type_effective,,False,São Paulo,São Paulo,Brasil,https://energybbdo.gupy.io/job/eyJqb2JJZCI6ODI5NzQzMywic291cmNlIjoiZ3VweV9wb3J0YWwifQ==?jobBoardSource=gupy_portal,True,hybrid,True
8296098,2024-12-16T17:42:01.430Z,Pessoa Gerente de Data Analytics,"Sobre a AlmapBBDOQUEM SOMOS!#1 Agência Global da Década - Cannes Lions. Somos uma potência de criatividade e negócios que se reinventa todos os dias. Acreditamos que a criatividade é protagonista na geração de valor para as marcas, no crescimento dos negócios dos clientes e, não menos importante, na transformação das pessoas. Porque as pessoas são o centro da cultura da agência.Aqui na AlmapBBDO estimulamos um ambiente cada vez mais plural que permita trocas e aprendizados. Convidamos pessoas negras, LGBTQIAPN+, com deficiência, mulheres e vindas de diferentes níveis socioeconômicos, regiões e universidades do país a fazer parte do nosso time. Este é o nosso horizonte definitivo, visto por todas as equipes de nossa agência. E é assim que construímos, dia após dia, um ambiente diverso e uma grande ideia chamada AlmapBBDO.Venha fazer parte do nosso time!Responsabilidades e atribuiçõesGestão e desenvolvimento de equipe, com suporte da coordenação, garantindo as melhores condições de trabalho para que eles possam gerar inteligência acionável através de dados e soluções de tecnologia. 75% gestão, 25% entregas próprias.Papel ativo na investigação de problemas e na busca por alavancas de crescimento para as marcas e e-commerce atendidos, utilizando as diversas ferramentas disponíveis;Gestão de relacionamento com clientes, áreas internas, outras agências do grupo, além de parceiros dentro e fora do Brasil;Liderar projetos lateralmente, com demais disciplinas de dados e tecnologia como Engenharia de Dados, Social Insights, Martech e Pesquisa de Mídia.Aplicar as metodologias de gestão de projetos já consagradas no dia a dia e implementá-las quando não houver;Garantir que a equipe está cumprindo com as entregas, com o prazo e qualidade esperada pelo cliente;Participar e contribuir para as atividades de troca de conhecimento e team building, que são elaboradas para toda a área de Dados e Martech.Manter crescimento de relevância em uma operação de dados que já é consolidada;Contribuir ativamente para o avanço nas agendas de automação e utilização de inteligência artificial;Garantir que tiramos o maior proveito das ferramentas que são contratadas pelo cliente;Conduzir os clientes pelos melhores caminhos, em termos de criação de soluções e governança do ambiente de dados;Fomentar a capacitação do time orientada a evolução nos estágios da carreira.Requisitos e qualificaçõesSólida experiência na área e como gestor(a) de pessoas;Boa comunicação verbal e escrita em português e inglês (mandatório);Habilidade de relacionamento, com comunicação clara, adaptabilidade, senso de urgência;Capacidade de priorização e antecipação de problemas, além de profundo conhecimento do negócio do cliente;Capacidade de dialogar com clientes de diferentes segmentos, como CPG, Finance, Travel, Auto, etc.Conhecimento de estratégia de negócios e marketing, dinâmica de operação de tecnologia em agências de publicidade;Curiosidade infinita e forte habilidades de análise exploratória;Sólida experiência em análise de dados voltada a performance de campanhas, sobretudo digitais;Amplo repertório acerca de ferramentas voltadas ao trabalho de gestão, otimização e mensuração de campanhas, além de ferramentas de automação de jornada, personalização, testes e fontes de dados não usuais.Conhecimento prático de aplicação de estatística no contexto do Marketing: análises descritivas, inferenciais, testes de hipótese, clusterização, segmentação, projeções;Compreensão dos contextos pago e orgânico, pré e pós-clique; conhecimento em plataformas do mercado voltadas a web analytics, buy side platforms, CDPs, DMPs, Ad Verification, etc;Conhecimento conceitual de ferramentas tradicionalmente utilizadas por agências de publicidade como ComScore, TGI, Monitor;Vivência em agências de publicidade, para facilitação do relacionamento com demais áreas;Habilidade de concepção e planejamento de visualizações de dados, para gerar requisitos ao time de Engenharia;Vivência com metodologia ágil e ferramentas de gestão de projetos como Jira/Hive.",AlmapBBDO,vacancy_type_effective,2025-02-11T00:00:00.000Z,False,São Paulo,São Paulo,Brasil,https://almapbbdo.gupy.io/job/eyJqb2JJZCI6ODI5NjA5OCwic291cmNlIjoiZ3VweV9wb3J0YWwifQ==?jobBoardSource=gupy_portal,True,hybrid,True
8297813,2024-12-17T13:26:29.770Z,Desenvolvedor Mainframe Sênior,"Somos aproximadamente 50k Minsaiters no Mundo e mais de 7k Minsaiters no Brasil e estamos presentes nas maiores empresas em todos os setores. Nossa estrutura permite participar de projetos globais e proporciona um ambiente colaborativo que nos certifica em GreatPlacesToWork e planos diferenciados para Jovens Profissionais também reconhecidos pela Employers for Youth. Responsabilidades e atribuiçõesSintaxe e Semântica: Compreensão profunda da estrutura da linguagem, incluindo comandos, cláusulas, tipos de dados e operadores;Estruturas de Dados: Conhecimento de tabelas, arrays e registros, e como manipulá-los eficientemente;Procedimentos e Funções: Habilidade em definir e utilizar sub-rotinas para modularizar o código;Manipulação de Arquivos: Experiência em ler, gravar e atualizar arquivos sequenciais, indexados e relativos;Depuração e Resolução de Problemas: Capacidade de identificar e corrigir erros no código COBOL.Sistemas Mainframe/Sistemas Operacionais: Familiaridade com z/OS, IBM i, ou outros sistemas que hospedam aplicações COBOL;JCL (Job Control Language): Habilidade em escrever scripts JCL para executar programas COBOL e gerenciar recursos;Utilitários de Mainframe: Conhecimento de ferramentas como File Manager, Sort, e IDCAMS para manipular dados;Banco de Dados: Experiência com bancos de dados como DB2, IMS DB, ou VSAM, incluindo SQL para acesso a dados.Requisitos e qualificaçõesRequisitos Obrigatórios:Domínio da Linguagem COBOL;CICS (Customer Information Control System): Conhecimento de CICS para desenvolvimento de aplicações transacionais online;Linguagens de Scripting: Familiaridade com REXX ou CLIST para automatizar tarefas;Ferramentas de Modernização: Experiência com ferramentas que auxiliam na migração ou modernização de aplicações COBOL;Visual Age para escrita de programas CICS on-line.Conhecimentos Desejáveis:Banco de Dados Oracle;Comandos ROSCOE;Endevor;Ter passado por áreas de Seguros ou Seguro Saúde.Informações adicionaisTRABALHE NA MINSAIT Modelo de contratação CLT.Plano de Saúde subsidiado pela empresa para o titular.Opção de inclusão de dependentes no Plano de Saúde com desconto em folha de pagamento.Assistência Odontológica (opcional).Opção de inclusão de dependentes no Plano de Assistência Odontológica com desconto em folha de pagamento.Vale Refeição no cartão Flash Benefícios.Vale Transporte (opcional).POP - Programa de Orientação Pessoal que visa oferecer suporte emocional e aconselhamento com orientação confidencial nas áreas psicológica, jurídica, financeira, social e pet sem custo para titular e dependentes legais.Plataforma de Saúde Wellhub-Gympass (Acesso a mais de 700 academias em todo o Brasil com planos descontado em folha de pagamento).Parcerias com grandes marcas de consumo.Convênio com o SESC para titular e dependentes.Convênios para descontos com instituições de ensino (graduação e pós-graduação) e escola de idiomas.Seguro de vida em grupo. Nosso compromisso com a diversidade é um elemento-chave da nossa cultura: Igualdade de oportunidades, respeito pelas pessoas e não discriminação são princípios de atuação para todos os profissionais da Minsait. Integramos o Bloomberg Gender-Equality Index (GEI) 2021 em termos de diversidade e igualdade de gênero.",Minsait an Indra Company,vacancy_type_effective,2025-02-11T00:00:00.000Z,True,,,Brasil,https://minsait.gupy.io/job/eyJqb2JJZCI6ODI5NzgxMywic291cmNlIjoiZ3VweV9wb3J0YWwifQ==?jobBoardSource=gupy_portal,True,remote,True
8274715,2024-12-17T13:07:55.406Z,Pessoa Desenvolvedora Ruby PL/SR | Híbrido SP,"A Youse esta contratando uma pessoa Especialista em Desenvolvimento Ruby.Responsabilidades e atribuições📝 Como vai ser o seu dia a dia? Desenvolver e manter APIs RESTful, principalmente em Ruby on Rails, garantindo alta disponibilidade e escalabilidadeAtuar em uma arquitetura de microserviços, integrando aplicações e serviços por meio de mensageria (RabbitMQ)Trabalhar com tecnologias de cloud computing (AWS) e bancos de dados como Postgres e Redis, contribuindo para a otimização de performance e confiabilidadeIdentificar e solucionar problemas de desempenho, analisando métricas, logs e implementando melhorias constantesGarantir a segurança e a qualidade do código através de testes (unitários, integração, carga) e práticas de codificação segurasParticipar de planejamento ágil, revisões de código e contribuir com as melhores práticas de desenvolvimentoDocumentar APIs, processos técnicos e compartilhar conhecimento com o time, apoiando o crescimento e a maturidade da equipeRequisitos e qualificações💡 Se liga no que precisa ter/saber:Experiência sólida com Ruby on Rails, ou forte experiência em Python (Django, Flask, FastAPI) e interesse em migrar para Ruby on RailsDomínio na criação e manutenção de APIs RESTful e familiaridade com GraphQLVivência com bancos de dados relacionais (Postgres) e não-relacionais (Redis)Conhecimento avançado em escalabilidade, otimização de performance e arquitetura de microserviçosSólida compreensão de práticas de segurança em desenvolvimento de softwareExperiência com mensageria (RabbitMQ) e integrações em ambientes complexosVivência em ambientes que utilizam metodologias ágeis (Scrum, Kanban), TDD e pipelines de CI/CDBoa comunicação, proatividade em mentorar colegas, capacidade de compartilhar conhecimento e promover um ambiente de aprendizado contínuoInformações adicionaisInformações adicionais:Modelo de Trabalho: Híbrido (3x Presencial e 2x remoto)Jornada: 7h30/diaRegime de Contratação: CLTLocal: Pinheiros/SP",Youse Seguros,vacancy_type_effective,2025-03-31T00:00:00.000Z,False,São Paulo,São Paulo,Brasil,https://vagas-youse.gupy.io/job/eyJqb2JJZCI6ODI3NDcxNSwic291cmNlIjoiZ3VweV9wb3J0YWwifQ==?jobBoardSource=gupy_portal,True,hybrid,True
8307799,2024-12-17T13:00:23.063Z,Pessoa Desenvolvedora FullStack Sênior,"A FCamara está em busca de uma pessoa Desenvolvedor Fullstack Sênior. Para atuar em parceria com uma empresa líder de pesquisas globais especialista em medição mais precisa, análises para uma compreensão verdadeira da sociedade, dos mercados e das pessoas.Responsabilidades e atribuiçõesProgramar scripts para coleta de dados para pesquisas de mercado.Programar a revisão de bancos de dados (qualidade do script através de testes e validação).Desenvolvimento de questionários na linguagem ASKIA.Propor melhorias e eficiências nos projetos sob sua responsabilidade.Colaborar em equipes globais para assegurar a eficiência e o sucesso dos projetos.Requisitos e qualificaçõesHard Skill:▪ Graduação completa;▪ Inglês intermediário para avançado pois vai atuar em um projeto internacional nos Estados Unidos;▪ Diferencial conhecimento em ferramenta Askia;▪ Conhecimento em Python, revisão de banco de dados, pesquisa de mercado, vai atuar em uma migração do projeto ""auto conect"";▪ Stack:- Angular 2+ (HTML, CSS, Typescript)- C# WebApi (.Net Framework e .Net Core)- Banco de dados SQL Server, T-SQL. Trabalhando na arquitetura de base de dados- Metodologia ágil SCRUM e KANBAN- Git (GitHub)- Jira Soft Skill:▪ Pro atividade;▪ Boa comunicação;▪ Gostar de trabalhar em equipe;▪ Gostar de carros é um diferencial.",VENHA SER #SANGUELARANJA 🧡🚀,vacancy_type_temporary,2025-02-14T00:00:00.000Z,False,São Paulo,São Paulo,Brasil,https://fcamara.gupy.io/job/eyJqb2JJZCI6ODMwNzc5OSwic291cmNlIjoiZ3VweV9wb3J0YWwifQ==?jobBoardSource=gupy_portal,True,hybrid,True
8307793,2024-12-17T12:54:53.694Z,Pessoa Desenvolvedora Node.js Senior,"A FCamara apoiando empresas disruptivas por meio de soluções digitais completas e escaláveis alinhadas às principais tendências e necessidades do mercado. Temos uma cultura poderosa, conectados de ponta a ponta, colaborativos, ágeis e flexíveis para encarar o novo, transparentes em nossas ações e unidos por um grande propósito: Revolucionar negócios e impactar pessoas, resolvendo desafios complexos através da nossa cultura e tecnologia. Além disso, somos certificados pela GPTW pelo segundo ano consecutivo, sendo uma das melhores empresas para se trabalhar no Brasil.Próximos dos clientes, apaixonados por tecnologia e pessoas (sim, aqui pensamos na sua evolução e carreira, vamos te desenvolver e cuidar da sua trilha de capacitação). Acreditamos na diversidade, equidade e inclusão de profissionais independente da sua deficiência, raça/ etnia, religião, gênero, orientação sexual, origem e constituição de família.Responsabilidades e atribuiçõesAtuar no desenvolvimento de software, escrevendo códigos para desenvolver aplicativos, programas e sistemas de software, seguindo as especificações e requisitos do projeto; Efetuar testes nos softwares desenvolvidos, identificando e corrigindo problemas, bugs e falhas no código, garantindo a qualidade da entrega, cumprimento de prazos e satisfação do cliente Certsys; Documentar códigos desenvolvidos, visando facilitar a manutenção e atualização posterior dos produtos; Desenvolver soluções de software de alta qualidade, garantindo que o código seja eficiente, escalável e manutenível; Acompanhar e monitorar os sistemas em produção para identificar problemas e implementar soluções. Requisitos e qualificaçõesFormação superior completa em Tecnologia da Informação, Engenharia da Computação, Sistemas de Informação, Ciências da Computação ou similares (desejável); Experiência em Node e Javascript/Typescript - mínimo 3 anos (imprescindível); Vivencia com integração utilizando APIs (imprescindível); Experiência com Metodologias Tradicional e Ágil (desejável); Conhecimento Intermediário em Bancos de Dados (imprescindível); Experiência em IBM Watson ou outras plataformas de IA (exemplos: Zenvia, Twilio, Blip, Microsoft)  (diferencial); Experiência em Mongo DB (desejável); Informações adicionais",VENHA SER #SANGUELARANJA 🧡🚀,vacancy_type_effective,2025-02-14T00:00:00.000Z,True,,,Brasil,https://fcamara.gupy.io/job/eyJqb2JJZCI6ODMwNzc5Mywic291cmNlIjoiZ3VweV9wb3J0YWwifQ==?jobBoardSource=gupy_portal,True,remote,True
8308767,2024-12-17T12:37:20.636Z,Pessoa Desenvolvedora Backend Java + Node (Microserviços) - Sênior,"A FCamara está em busca de uma PESSOA DESENVOLVEDORA BACKEND JAVA MICROSERVIÇOS- SÊNIOR para atuar em uma empresa líder no mercado brasileiro de farmácia, referência em Saúde e Bem-estar com mais 2.000 lojas em todos os estados brasileiros.Responsabilidades e atribuiçõesJAVA 11 ao 17NODEMAVENSPRING FRAMEWORKMENSAGERIA (RABBIR E/OU KAFKA)MICROSERVIÇOSRESTGRAPHQLTESTES UNITÁRIOS COM JUNIT E MOCKITOBD RELACIONAL E NÃO-RELACIONAL (ORACLE) PL/SQLSWAGGERJIRAMETODOLOGIA ÁGIL Requisitos e qualificaçõesHard Skills:BDDREDISKUBERNETSAPI DESIGNGITLABCI/CDSOBARQUBE Informações adicionaisRequisitos Imprescindíveis:               - Experiência anterior em desenvolvimento de sistemas atuando fortemente com Java (11 ao 17) e AWS.               - Experiência anterior em desenvolvimento de sistemas atuando fortemente com Node e AWS.               - Fundamentos sólidos em design orientado a objetos, estruturas de dados, algoritmos e resolução de problemas;               - Experiência em projetar e desenvolver integrações baseadas em API, arquitetura de microserviços;               - Conhecimentos avançados com Spring Framework ou similar;               - Experiência com Filas (RabbitMQ e/ou Kafka);               - Experiência com bancos relacionais e não relacionais (Oracle)               - Experiência com api gateway               - Experiência com GraphQl               - Experiência com JPA               - Experiência com Hibernate               - Experiência de trabalho em ambiente e frameworks ágeis;               - Experiência em trabalhar com microsserviços;               •⁠  ⁠Tempo mínimo de experiência: 5 anos               Qual será a sua missão:   - Projetar, criar e manter soluções web de front e backend, integrações e microsserviços para nossos produtos e soluções;   - Compreender os requisitos de negócios funcionais e refinar os requisitos técnicos, soluções;   - Contribuir para a adoção de arquitetura de software, padrões de código teste desempenho segurança e novas tecnologias;   - Participar ativamente dos Rituais Scrum (Planejamento, Diário, Revisão, Retrospectiva);  - Alcance a entrega no prazo sem comprometer a qualidade;   - Ser capaz de oferecer soluções de backend;",VENHA SER #SANGUELARANJA 🧡🚀,vacancy_type_effective,2025-02-14T00:00:00.000Z,True,,,Brasil,https://fcamara.gupy.io/job/eyJqb2JJZCI6ODMwODc2Nywic291cmNlIjoiZ3VweV9wb3J0YWwifQ==?jobBoardSource=gupy_portal,True,remote,True
