job_id,published_date,title,description,career_page_name,type,application_deadline,is_remote_work,city,state,country,job_url,disabilities,workplace_type,submitted
6874705,2024-03-12T19:58:31.278Z,Especialista II - Software - RP 978126,"Vamos juntos mudar o mundo?  Você valoriza a Ética acima de tudo, tem Visão Compartilhada, acredita na Sustentabilidade Sistêmica, em entregar resultados com Excelência e é apaixonado por Inovação?﻿Se a sua resposta foi SIM, então nós queremos conhecer você! Responsabilidades e atribuiçõesDescrição SumáriaAtuar no processo de análise, desenvolvimento e validação de componentes que trabalham em conjunto num sistema robótico autônomoMetas e Objetivos Estratégicos Levantamento de requisitos funcionais através de documentação de fornecedores e/ou clienteDesenvolvimento de código limpo de reutilizável; - Validação de código em simulação e ambiente real Documentação do código desenvolvido.Requisitos e qualificaçõesConhecimentos Técnicos Requeridos- Experiência desenvolvimento em C++  Experiência desenvolvimento Python   Conhecimento em Linux. Conhecimento em Google test.  Desenvolvimento de software com orientação a objeto. Conversação em INGLÊS Conhecimentos Desejáveis- Graduado em Engenharia, preferencialmente na área Computação, ou cursos afins. - Experiência em ROS (desejável &gt;= 1 ano) - Conhecimento em protocolos de comunicação: UDP, serial. - Conhecimento em integração de sensores.Informações adicionaisEssa é uma vaga de Contrato por Tempo Indeterminado (Efetivo).Sendo assim, essa é a nossa proposta salarial e benefícios para a vaga em questão com esse tipo de vínculo:Salário Proposto;Vale Transporte;Vale Alimentação/Refeição;Plano de Saúde, extensivo a dependentes;Vitalmed para atendimento de urgência e emergência domiciliar, extensivo a dependentes;Seguro contra Acidentes Pessoais;Convênio SESI - Programa Odontológico;Plano de Previdência Privada;Benefício Previdenciário (em casos de afastamento, o sistema FIEB complementa o suporte financeiro não oferecido pelo INSS);Auxílio Creche exclusivo para mulheres; Rede de parceiros CIEB - Convênios e Parcerias com academias, escolas de idiomas, espaços de eventos, seguradoras de veículos, hotéis, entre outros.Unindustria - Portal com várias capacitações online e gratuitas para o colaborador.Descontos nos cursos SENAI e SENAI CIMATEC para colaboradores e dependentes. Após 1 ano, pode haver ajuda no custeio de treinamento de longa duração, tais como Graduação, Especializações, Mestrado e Doutorado em qualquer Instituição, de acordo com o cargo e função exercido. Quer fazer parte da nossa Instituição e mudar o mundo conosco? Inscreva-se já em nossa vaga e venha fazer parte do nosso time! Estamos te aguardando! Vem ser SENAI CIMATEC!",SENAI CIMATEC ,vacancy_type_effective,,False,Salvador,Bahia,Brasil,https://senaicimatec.gupy.io/job/eyJqb2JJZCI6Njg3NDcwNSwic291cmNlIjoiZ3VweV9wb3J0YWwifQ==?jobBoardSource=gupy_portal,False,hybrid,True
6719144,2024-03-12T19:53:17.417Z,BACKEND  SOFTWARE ENGINEER SENIOR (HÍBRIDO CAMPINAS/SP),"Empresa contratante: HypeFlame Tecnologia e Big Data LTDAModelo de trabalho: Híbrido (1 dia/semana) em Campinas/SPAqui no Agibank você terá que:Exercer a liderança técnica da equipe;Propor evoluções tecnológicas nos sistemas;Monitorar a execução das boas práticas de desenvolvimento de sistemas;Validar nível de testes existentes nos projetos;Monitorar o desempenho e performance dos sistemas das aplicações;Antecipar-se a oportunidades e problemas, agindo com rapidez e eficácia, desenvolvendo soluções de forma preventiva;Auxiliar na orientação dos desenvolvedores mais novos e contribuir nas tomadas de decisão do projeto;Atuar na integração e interface entre as aplicações de back-end e front-end;Atuar no planejamento e levantamento de requisitos e limitações técnicas para melhoria da performance e escalabilidade das aplicações;Orientar tecnicamente as etapas de iniciação, planejamento, execução, controle e encerramento dos projetos, monitorando a qualidade, funcionalidades, progressos e desvios no back-end.Requisitos e qualificaçõesJava 8+;SpringBoot;Spring Framework;RabbitMQ;Gitlab;REST;Testes unitários e cobertura de testes;Junit 5;Microserviços;MongoDB;JenkinsGraduação completa ou em andamento em Engenharia da Computação, Ciência da Computação ou correlatas.É desejável pra gente, mas não é obrigatório, ok?SonarqubeRedisJiraMySQLCamundaOpenSearch/KibanaDynatraceGrafanaInformações adicionaisAlguns benefícios, facilidades e parcerias pra você curtir a jornada com a gente 😊:Vale-refeição e/ou alimentação;Plano de saúde com isenção em exames preventivos 1 vez ao ano;Plano odontológico;Total Pass, pra atividade física e bem-estar;Programa de Participação nos Resultados (PPR) seguindo as regras estabelecidas anualmente;Programa de sócios do Agi, o Tô de Dono/a;Universidade interna, a Uni Agi;Folga de presente no mês do seu aniversário;Pesquisa semanal de clima, a Sem Climão;Avaliação de performance;Teleatendimento psicológico e médico gratuito, com o Conexão Saúde;Licença-maternidade de 6 meses e licença-paternidade de 20 dias;Dr. Pet: possibilidade fazer plano de saúde para o seu pet com até 20% de desconto;Auxílio-creche.",Tecnologia - Agibank,vacancy_type_effective,,False,Campinas,São Paulo,Brasil,https://tecnologia-agibank.gupy.io/job/eyJqb2JJZCI6NjcxOTE0NCwic291cmNlIjoiZ3VweV9wb3J0YWwifQ==?jobBoardSource=gupy_portal,True,hybrid,True
6836884,2024-03-12T19:51:43.270Z,Estágio em Integração de Software,"PcDs são sempre bem-vindas.Buscamos pessoas apaixonadas por tecnologia. Alguém que se motive por desafios e atue com autonomia. Precisa gostar de trabalhar em equipe e possuir espírito colaborativo.Responsabilidades e atribuições- Apoio na análise, investigação e depuração de funcionalidades / problemas de software do sistema operacional Android para smartphones com ampla atuação em validação e triagem de software. - Apoio às correções de software dos smartphones desenvolvidos; - Realizar testes de verificação e de estabilidade de software; - Desenvolvimento e testes de funcionalidade e ferramentas que possam apoiar e agilizar o andamento dos projetos.Requisitos e qualificações- Formação superior em andamento em Engenharia/Ciência da Computação, Sistemas de Informação ou similar; - Gostar de análise, investigação e testes de problemas; - Conhecimentos em Android é um diferencial - Inglês intermediário para conversação, escrita e leitura. - Ter perfil analítico e investigativo, visando a qualidade final dos produtos gerados; - Ter conhecimento em linguagens de programação, especialmente JAVA e/ou Python.Informações adicionais“O Instituto de Pesquisas Eldorado valoriza um ambiente diversificado e se orgulha de ser uma organização que oferece oportunidades de forma igualitária. Todos que se candidatarem serão avaliados, independentemente de raça, deficiência, cor, religião, sexo, identidade ou expressão de gênero, orientação sexual, nacionalidade ou idade”.",Instituto de Pesquisas ELDORADO,vacancy_type_internship,,False,Manaus,Amazonas,Brasil,https://institutoeldorado.gupy.io/job/eyJqb2JJZCI6NjgzNjg4NCwic291cmNlIjoiZ3VweV9wb3J0YWwifQ==?jobBoardSource=gupy_portal,False,on-site,True
6840773,2024-03-12T19:42:50.009Z,CIDC - Estágio em Desenvolvimento de Software,"O Inatel está recrutando estudante para estagiar em projetos de desenvolvimento de software voltados para o suporte à projetos de comunicações móveis, no Competence &amp; Innovation Development Center - CIDC.Responsabilidades e atribuiçõesParticipar do desenvolvimento do projeto de performance e análise de dados de redes de telecomunicações;Realizar atividades de testes e desenvolvimento de software.Requisitos e qualificaçõesEstar matriculado em curso superior em áreas de tecnologia;Conhecimento em Python, PHP, HTML, CSS e Java Script;Disponibilidade de 40 horas semanais.Seria interessante se você tivesse ou soubesse:Inglês avançado para leitura e escrita.Informações adicionaisLocal de trabalho: As atividades serão realizadas no Campus do Inatel, em Santa Rita do Sapucaí - MG.",Inatel ,vacancy_type_internship,,False,Santa Rita do Sapucaí,Minas Gerais,Brasil,https://inatel.gupy.io/job/eyJqb2JJZCI6Njg0MDc3Mywic291cmNlIjoiZ3VweV9wb3J0YWwifQ==?jobBoardSource=gupy_portal,True,on-site,True
6665858,2024-03-12T21:40:33.635Z,Pessoa Engenheira SRE (Devops/AIOps),"Somos uma empresa de tecnologia movida por nossa paixão por animais de estimação! 💜Nosso trabalho diário é tornar a vida dos pais dos animais de estimação mais fácil por meio de uma experiência única de aprender, fazer compras e consumir o que eles precisam, a qualquer hora. Sempre centrado no que é melhor para a felicidade e saúde dos animais de estimação.A Petlove já é a maior empresa de tecnologia na indústria pet do Brasil. Recentemente, adicionamos ao nosso portfólio empresas estratégicas como DogHero, VetSmart, Vetus e Porto.pet para animais de estimação, a fim de perseguir nossa visão de criar o maior ecossistema de animais de estimação do Brasil.Temos muito orgulho de já ter atendido mais de 5 milhões de clientes em todo o país, mas ainda estamos famintos pelo que vem por aí (o Brasil tem mais de 48 milhões de domicílios com animais de estimação). Se você está procurando uma oportunidade única na vida, adora tecnologia e é realmente apaixonado por animais de estimação, somos perfeitos um para o outro!Responsabilidades e atribuiçõesAtuar dentro do time de Enegenheiros de Infraestrutura e Cloud (SRE), sendo responsável por:Definições de Arquitetura de InfraestruturaImplementar solução baseada em código visando automações e eficiência, incluindo soluções em AI;Planejamento do crescimento sustentávelde Cloud (AWS/GCP)Operação da infraestrutura de sistemas distribuídos e stacks de dadaosInteragir e apoiar times de desenvolvimento e de Engenharia de DadosAtuar na implementação de soluções relacionadas a Segurança da InformaçãoElaborar e implementar soluções de CI/CDRequisitos e qualificaçõesExperiência em infra as code, desejável Crossplane;Experiência em arquitetura de aplicações distribuídas/microserviços;Experiência em construção de esteiras de CI/CD;Experiência em automação de tarefas usando Python, Golang, Node.js, Shell Script;Experiência em desenvolvimento com Python (diferencial conhecimento libs para Machine Learning: scikit-learn, TensorFlow, PyTorch, etc);Experiência em desenvolvimento de aplicações usando arquitetura REST;Interesse em desenvolver frentes de AIOps (automações de infraestrutura e observabilidade usando Inteligência Artificial);Desejável vivência atuando como desenvolvedor ou ter projetos atuando nessa frente;Conhecimento em Kubernetes, principalmente GKE;Capacidade de se adaptar a linguagens de programação como Golang, Node.js;Conhecimento das Boas Práticas de Segurança em Cloud;Vivência em ambientes de Cloud Computing (GCP/AWS);Vivência em operação e manutenção de ambientes de missão crítica; Conhecimento em TCP/IP e Networking (definição de VPCs, VPNs, Regras de Firewall);Conhecimento e vivência operacional com bancos de dados MySQL, PostgreSQL;Conhecimento em ferramentas e frameworkers de monitoria (Datadog, Grafana, Prometheus, OpenTelemetry);Conhecimento em processo de Troubleshooting em aplicações distribuídas;Capacidade de propor, planejar e executar a implementação de arquiteturas sustentáveis;Capacidade de trabalhar inserido em contextos de squads/times e em pair-job;Desejável conhecimento em bases de dados NoSQL;Desejável conhecimento em stack de Elastic Search;Desejável conhecimentos sobre LGPD e mecanismos de proteção de dados sensíveis;Desejável conhecimento em Chaos Engineering;Desejável conhecimento em Edge Stacks e CDNs (preferencialmente Cloudflare);Desejável vivência em ambiente com processos ágeis;Desejável conhecimento em MLOps;Prestatividade e responsabilidade;  Inglês instrumental (leitura de documentações);Informações adicionaisNosso jeito de trabalharNa Petlove nós somos apaixonados por pets e por pessoas. Por isso, buscamos garantir que somos inclusivos e formamos times diversos, sempre procurando refletir em nossas decisões nosso compromisso com esse tema! Consideramos enriquecedor contratar pessoas com deficiência, de gêneros e orientação sexual diversas, incluindo todas as etnias e religiões, além de todas as idades e demais marcadores de identidade. Temos certeza que só assim formaremos times inconformados, ágeis e comprometidos com o nosso propósito. Por que você vai amar ser um Petlover? Muitos benefícios - Plano de saúde e plano odontológico Unimed seguros para titular e dependentes (sem desconto) e com coparticipação- Seguro de vida até 24x do salário (sem desconto)- Cartão de Benefícios Flexível: você escolhe se vai usar no mercado ou em restaurantes!- Estamos em formato híbrido: oferecemos auxílio home office para ajudar você com os gastos do dia a dia fora do escritório- Programa Todos Sócios- Licença maternidade de 6 meses- Licença paternidade de 3 meses- PLR - atrelado às metas- Convênio farmácia- Escritório Pet FriendlyValorizamos seu bem-estar - Oferecemos duas plataformas de atividades físicas: Gympass- Programa Cuidar + que proporciona mais bem estar e qualidade de vida para os colaboradoresTe damos mimos de aniversário - Créditos no site da Petlove (R$ 100,00) para serem utilizados no mês do seu aniversário- Day off em qualquer dia do mês, para você aproveitar como quiser.Cuidamos dos seus pets - Apoiamos a adoção responsável! Oferecemos Licença PETernidade de 2 dias para Petlovers que adotarem um pet- Plano de saúde para seu pet para todos os colaboradores- Descontos em todas as compras de produtos no nosso site e app: 15% em compras avulsas, 20% para compradores recorrentes e 30% para compras de marcas exclusivas- Crédito de R$ 400 anuais para utilizar na DogHero, podendo escolher entre hospedagem, pet sitter e creche.Mas afinal, o que é ser Petlover?Ser Petlover é colocar o bem-estar e a felicidade dos pets como prioridade, sempre.Ser Petlover é valorizar o risco calculado, fazer o que diz e agir com velocidade.Ser Petlover é atrair, reter e desenvolver os melhores talentos.Ser Petlover é experimentar e se esforçar para inovar constantemente.Ser Petlover é trabalhar colaborativamente para construir nossa visão comum.Ser Petlover é ser eficiente, ágil e simplificar.Ser Petlover é valorizar a diversidade e a construção de um ambiente cada vez mais inclusivo.Se identificou? Então vem pra cá!",Grupo Petlove,vacancy_type_effective,2024-03-21T00:00:00.000Z,True,,,Brasil,https://petlove.gupy.io/job/eyJqb2JJZCI6NjY2NTg1OCwic291cmNlIjoiZ3VweV9wb3J0YWwifQ==?jobBoardSource=gupy_portal,True,remote,True
6874111,2024-03-12T19:25:19.291Z,Analista de Infraestrutura/DevOps,"Nossa estratégia principal é simplificar a Tecnologia da Informação dos nossos parceiros, simplificando os processos através do desenvolvimento e implementação de sistemas de tecnologia da informação eficientes. Com isso é possível garantir a qualidade, reduzir riscos e custos e proporcionar aumento de produtividadeEstamos à procura de um Analista de Infraestrutura/DevOps altamente qualificado para se juntar à nossa equipe de TI dinâmica e inovadora. Se você é um profissional apaixonado por entender as necessidades dos clientes, que gosta de trabalhar em equipe, sempre buscando crescimento e que consigam ter uma visão de futuro, enxergando fora da caixa. Essa é sua oportunidade!Responsabilidades e atribuiçõesSerá responsável por sustentar e modernizar uma infraestrutura local, aplicando as práticas de Infraestrutura como Código e DevOps;Capacidade de superar com facilidade os problemas que aparecem;Experiência em interpretação de documentos oficiais;Experiência em documentar e evidenciar atividades de forma clara e precisa;Requisitos e qualificaçõesEnsino Superior Completo na área de Tecnologia da Informação;Nível intermediário em Inglês;Conhecimento intermediário em Sistema Operacional Linux;Conhecimento básico em Redes de Computadores;Conhecimento em Infraestrutura Básica (AD-DS, DNS, DHCP);Conhecimento em Git;Conhecimento em Shell Script;Conhecimento em Conteinerização;Conhecimento em Orquestração de Contêineres;Conhecimento em Pipelines, CI, CD e/ou Ansible;Conhecimento em alguma Linguagem de Programação;Conhecimento Básico em Virtualização;Conhecimento Básico em Backup e Restore;Conhecimento Básico em Monitoria;Conhecimento de Clusters;Informações adicionaisTrabalho presencial no clienteContratação PJ ",Argo Inteligência Digital - Trabalhe Conosco,vacancy_type_outsource,,False,Cuiabá,Mato Grosso,Brasil,https://argotrabalheconosco.gupy.io/job/eyJqb2JJZCI6Njg3NDExMSwic291cmNlIjoiZ3VweV9wb3J0YWwifQ==?jobBoardSource=gupy_portal,True,on-site,True
6797412,2024-03-13T19:14:42.719Z,Basel - Analista de Benefícios,"Se você é uma pessoa proativa, organizada e adora trabalhar com análise e otimização de processos administrativos, temos uma oportunidade para você!Se você se identifica com a vaga e quer fazer parte de uma equipe motivada e em constante evolução, se aplique agora mesmo!Responsabilidades e atribuiçõesOs desafios que você vai ter:Prestar esclarecimentos sobre dúvidas de coberturas, limites e prazos;Intermediar liberações de atendimento médico-hospitalar, observando respectivas exigências das operadoras, tais como DUT (diretrizes de utilização), pedido de envio de laudos médicos ou de exames complementares;Orientar e direcionar a seguradora, demandas de prévia de reembolso e prazos de ressarcimento;Atuar junto a cliente, eventuais ausências de pagamento de faturas e consequente suspensão de atendimento, informado pela operadora, financeiro Itsseg ou outro canal;Acompanhar pagamento, baixa do título e desbloqueio do atendimento (quando ocorrido);Demandar pedidos de prorrogação de vencimentos, cuja fatura tenha sido enviada no prazo pactuado;Direcionar a equipe operacional interna, solicitações de 2ª via de fatura e cartões;Acionar portador Itsseg (eventual) para retirar/entregar documentos;Enviar checklist de documentos exigidos pela seguradora para proceder reembolso de atendimento médico-hospitalar ou ressarcimento do montante segurado no benefício vida em grupo;Notificar cliente e/ou acompanhar retorno de pendências de documentos identificadas ou solicitadas pelas operadoras nos processos de reembolso, movimentação e ressarcimento do seguro de vida;Orientar como proceder em caso de assistência funeral e viagem;Retornar demandas recebidas via e-mail em no máximo 24h úteis do recebimento;Registrar todos os atendimentos realizados, no módulo operacional Itsseg;Comunicar imediatamente a coordenação, acerca de qualquer incidência ou informação relevante observada no atendimento;Requisitos e qualificaçõesSeria importante você apresentar:Conhecimento do pacote office (word, excel intermediário); Desejável conhecer rotinas operacionais de benefícios:Imprescindível conhecer rotinas operacionais de benefícios;Superior cursandoInformações adicionaisBenefíciosAssistência Médica;Assistência Odontológica;Vale-Refeição ou Vale-Alimentação;Vale-Transporte;Seguro de Vida;Participação nos Lucros e Resultados; Além Desses Benefícios, OferecemosÓtimo clima de trabalho, ambiente leve, acolhedor e dinâmico;Day-off no dia do seu aniversário;Cartão farmácia;Clube de Vantagens (parcerias diversas com descontos exclusivos);Parceria com Sesc;Desconto em nossos produtos (seguros);Desconto em ingressos de cinema;Total Pass (Convênio Academia);Auster - Fortalecimento do equilíbrio emocional;Horário de trabalho: A DefinirLocal de trabalho: Rio de Janeiro -RJ ", IT'SSEG COMPANY,vacancy_type_effective,,False,Rio de Janeiro,Rio de Janeiro,Brasil,https://itsseg-company.gupy.io/job/eyJqb2JJZCI6Njc5NzQxMiwic291cmNlIjoiZ3VweV9wb3J0YWwifQ==?jobBoardSource=gupy_portal,False,on-site,True
6854585,2024-03-13T19:13:13.493Z,ANALISTA DE CULTURA II - TECNICA EM DESENHO - CEU Freguesia do Ó,"Se você se identifica com as áreas da educação, cultura, esporte e terceiro-setor, confira as vagas abertas para fazer parte do time do Instituto Baccarelli.Responsabilidades e atribuiçõesRESPONSABILIDADES E ATRIBUIÇÕESMinistrar aulas de desenho para iniciantes.Ministrar aulas de artes visuais para crianças de 4 à 6 anos.Requisitos e qualificaçõesProfissional com domínio sobre as técnicas de desenho;Profissional com domínio sobre as técnicas de modelagem;Experiência em transmitir o conhecimento para iniciantes.Informações adicionaisConheça nossos benefícios: Vale transporte;Vale alimentaçãoDay off de Aniversário;",INSTITUTO BACCARELLI ,vacancy_legal_entity,,False,São Paulo,São Paulo,Brasil,https://institutobaccarelli.gupy.io/job/eyJqb2JJZCI6Njg1NDU4NSwic291cmNlIjoiZ3VweV9wb3J0YWwifQ==?jobBoardSource=gupy_portal,True,on-site,True
