job_id,published_date,title,description,career_page_name,type,application_deadline,is_remote_work,city,state,country,job_url,disabilities,workplace_type,submitted
6878697,2024-03-13T16:09:34.424Z,Data Integration Analyst Junior," 🔎 #Conheça um pouco sobre a área: A área de Growth Operations é a responsável pela definição de processos, indicadores,  integrações e data quality de dados internos para o apoio na tomada de decisão das áreas geradoras de receita da Cortex (marketing, geração de demanda, vendas e pós-vendas). A pessoa no cargo de Data Integration Analyst (Analista de Integração de Dados) irá apoiar na construção e manutenção de integrações garantindo que o fluxo de dados entre todas as ferramentas das áreas de receita da empresa estejam com fluxos de envio e recebimento de estáveis, funcionais e com dados corretos para utilização nos painéis de tomada de decisão e automações de atividades.Responsabilidades e atribuições 🎯#Desafios que você vai encontrar:Auxiliar no desenvolvimento e implementação de pipelines de dados para integração de sistemas.Contribuir para a criação de soluções escaláveis visando a qualidade e consistência dos dados.Colaborar ativamente com equipes multidisciplinares para entender e atender às necessidades de integração de dados.Participar na proposição e implementação de melhorias nos processos de integração de dados.Requisitos e qualificações✔️ #Conhecimentos importantes para a posição:Prática em Python, com alguma experiência ou envolvimento em algum projeto.Experiência prática em SQL, com alguma experiência ou envolvimento em 1 projeto.Noções de ETL e ELT, com alguma experiência ou envolvimento em 1 projeto.Familiaridade com arquitetura de dados em nuvem, com alguma experiência, participação em algum projeto ou estudo.⭐ Diferencial para a posição:Noção de modelagem multidimensional (Snowflake e Star Schema).Conhecimento em modelagem relacional (SQL, SGBD).Conhecimento básico em Git e Github, com 3 meses de experiência ou envolvimento em 1 projeto.Informações adicionais💜 #PraVocê Nossos Beneficios:PraVocê no dia a dia 🌞:Vale Refeição ou Alimentação; Gympass; Auxílio home-office; Flexibilidade de horários e locações.PraVocê &amp; Família👩‍👩‍👧‍👦:Plano de Saúde e Plano Odontológico; Auxílio-creche (até os 5 anos completos da criança); Licença-Maternidade, Paternidade e Adotante Estendidas (#todasasfamíliasimportam); Seguro de Vida;Day Off de Aniversário (Um dia de folga para tirar no dia ou durante o mês do seu aniversário.);Dia da Família (Um dia de folga para mamães e papais tirarem entre os meses de maio e agosto e aproveitar como quiserem.);Pausa Mental (Uma semana corrida de folga em JANEIRO para que descansem e recarreguem as baterias.).PraVocê AINDA MAIS🔝:● Senso de propósito ao fazer parte de um time que está construindo algo que será perene e trará frutos para a sociedade, seja a Cortex em si enquanto ""startup"" em rápido crescimento que gerará cada vez mais empregos, seja o produto Plataforma Cortex, que será usado por cada vez mais usuários no Brasil e exterior. ● Ambiente de trabalho descontraído, jovem, empreendedor e meritocrático, sem espaço para política.. ;-) ● Oportunidade de desenvolvimento de carreira e crescimento numa empresa que não para de crescer. Valorizamos, cultivamos e respeitamos as diferenças, por isso proporcionamos um ambiente aberto e inclusivo. Todas as nossas posições são elegíveis para pessoas com deficiência.",Cortex,vacancy_type_effective,,True,,,Brasil,https://cortex.gupy.io/job/eyJqb2JJZCI6Njg3ODY5Nywic291cmNlIjoiZ3VweV9wb3J0YWwifQ==?jobBoardSource=gupy_portal,True,remote,True
6873009,2024-03-13T15:11:28.364Z,Analista de Bases de Datos ,"¡Sé parte de Stefanini!​En Stefanini somos más de 30.000 genios, conectados desde 41 países, haciendo lo que les apasiona y co-creando un futuro mejor.​Responsabilidades y atribucionesEl Analista de Bases de Datos desempeña un papel fundamental en el soporte y la gestión de las bases de datos de una organización. Este profesional proporciona asistencia en la administración, monitoreo y mantenimiento de las bases de datos, así como en la resolución de problemas y en la garantía de la integridad y disponibilidad de los datos. Trabaja bajo la supervisión de administradores de bases de datos más experimentados para aprender y desarrollar habilidades en el manejo eficiente de sistemas de bases de datos.Responsabilidades:Soporte en la Administración: Asistir en la instalación, configuración y actualización de bases de datos según sea necesario.Monitoreo y Mantenimiento: Ayudar en el monitoreo del rendimiento de las bases de datos y en la ejecución de tareas de mantenimiento periódicas, como copias de seguridad, recuperación de desastres y optimización de consultas.Gestión de Usuarios: Colaborar en la creación, modificación y eliminación de usuarios de la base de datos, así como en la asignación de permisos y roles según las políticas de seguridad establecidas.Resolución de Problemas: Asistir en la identificación y resolución de problemas de bases de datos, investigando y diagnosticando errores, fallos o problemas de rendimiento.Apoyo en la Seguridad: Contribuir a la implementación y mantenimiento de políticas de seguridad de bases de datos, incluyendo la gestión de contraseñas y la aplicación de controles de acceso.Documentación: Ayudar en la creación y actualización de documentación técnica, incluyendo procedimientos de instalación, configuración y mantenimiento de bases de datos.Colaboración Interdepartamental: Trabajar en estrecha colaboración con otros equipos de TI, como desarrollo de aplicaciones, soporte de sistemas y seguridad de la información, para garantizar la integridad y disponibilidad de los datos.Aprendizaje Continuo: Participar en actividades de formación y desarrollo profesional para mejorar las habilidades técnicas y adquirir conocimientos sobre las últimas tecnologías y tendencias en bases de datos.Requisitos y calificacionesBachiller o grado universitario en Informática, Ingeniería de Sistemas o campo relacionado.Conocimientos básicos de bases de datos relacionales y lenguajes de consulta como SQL.Familiaridad con sistemas de gestión de bases de datos como Oracle, MySQL, SQL Server u otros.Habilidades de resolución de problemas y capacidad para trabajar en equipo.Buena comunicación verbal y escrita.Capacidad para aprender rápidamente y adaptarse a entornos dinámicos.Compromiso con la mejora continua y el desarrollo profesional.",STEFANINI LATAM,vacancy_type_temporary,,False,Lima,,Peru,https://stefaninilatam.gupy.io/job/eyJqb2JJZCI6Njg3MzAwOSwic291cmNlIjoiZ3VweV9wb3J0YWwifQ==?jobBoardSource=gupy_portal,True,hybrid,True
6873213,2024-03-13T14:56:14.475Z,Administrador Base de Datos Oracle,"¡Sé parte de Stefanini!​En Stefanini somos más de 30.000 genios, conectados desde 41 países, haciendo lo que les apasiona y co-creando un futuro mejor.​Responsabilidades y atribucionesEl Administrador de Bases de Datos Oracle, SQL Server y MySQL es un profesional experimentado en la gestión y administración de sistemas de bases de datos de diferentes plataformas. Con más de cinco años de experiencia en el campo, este rol se centra en liderar y ejecutar proyectos de implementación, optimización, seguridad y mantenimiento de bases de datos en entornos empresariales complejos. El administrador senior es responsable de garantizar la disponibilidad, integridad, seguridad y rendimiento óptimo de las bases de datos críticas para las operaciones comerciales.Responsabilidades:Diseño e Implementación: Liderar el diseño e implementación de arquitecturas de bases de datos eficientes y escalables en entornos Oracle, SQL Server y MySQL, teniendo en cuenta las necesidades actuales y futuras del negocio.Optimización de Rendimiento: Identificar y resolver problemas de rendimiento de bases de datos mediante la optimización de consultas, ajuste de configuraciones y uso de herramientas de monitoreo y diagnóstico avanzadas.Gestión de Seguridad: Desarrollar e implementar políticas de seguridad robustas para proteger la integridad y confidencialidad de los datos almacenados en las bases de datos, incluyendo la gestión de usuarios, roles, privilegios y auditorías.Mantenimiento y Actualización: Realizar tareas de mantenimiento regular, como copias de seguridad, restauraciones, aplicaciones de parches y actualizaciones de versiones, garantizando la continuidad del servicio y la adopción de las últimas características y mejoras.Resolución de Problemas: Investigar y resolver problemas complejos de bases de datos, incluyendo errores de sistema, fallos de rendimiento, corrupción de datos y recuperación de desastres, minimizando el impacto en las operaciones comerciales.Planificación de Capacidades: Evaluar y planificar las necesidades futuras de capacidad de las bases de datos, anticipando el crecimiento del negocio y proponiendo soluciones escalables y rentables.Colaboración Interdepartamental: Trabajar en estrecha colaboración con otros equipos de TI, como desarrollo de aplicaciones, redes y seguridad de la información, para garantizar la integridad y disponibilidad de los datos y aplicar las mejores prácticas en toda la organización.Mentoría y Desarrollo: Brindar orientación y capacitación a analistas y administradores junior de bases de datos, compartiendo conocimientos y experiencias para fomentar su crecimiento profesional y mejorar la eficacia del equipo.Requisitos y calificacionesMás de cinco años de experiencia en la administración de bases de datos Oracle, SQL Server y MySQL en entornos empresariales.Grado universitario en Informática, Ingeniería de Sistemas o campo relacionado.Certificaciones relevantes en administración de bases de datos, como Oracle Certified Professional (OCP), Microsoft Certified: Azure Database Administrator Associate, o MySQL Database Administrator. (Deseable)Profundo conocimiento de arquitecturas de bases de datos, modelado de datos, lenguajes de consulta SQL y herramientas de administración.Habilidades avanzadas en optimización de rendimiento, seguridad de bases de datos, alta disponibilidad y recuperación de desastres.Excelentes habilidades de resolución de problemas, comunicación y trabajo en equipo.Compromiso con la actualización continua de habilidades y conocimientos en un entorno tecnológico en constante evolución.",STEFANINI LATAM,vacancy_type_temporary,,False,Lima,,Peru,https://stefaninilatam.gupy.io/job/eyJqb2JJZCI6Njg3MzIxMywic291cmNlIjoiZ3VweV9wb3J0YWwifQ==?jobBoardSource=gupy_portal,True,hybrid,True
6880428,2024-03-13T19:09:33.026Z,PESSOA DESENVOLVEDORA BACKEND SR - 14316,"Venha fazer parte de uma empresa que ama transformar com tecnologia e abraça a diversidade em todas as suas formas!Responsabilidades e atribuiçõesRequisitos e qualificaçõesDesenvolvimento e manutenção no sistemas legados legados e nova plataforma.Participação ativa junto ao time squad no entendimento de problemas e solução Participação ativa nos ritos ágeis Garantia de qualidade e cobertura de código conforme as diretrizes técnicas do banco Entendimento arquitetural dos sistemas, nuvem e processos de TI do bancoConhecimento Técnico 1. Framework: SpringBoot,SpringBatch, Camel,Dataflow, JPA,Hibernate, JUnit,2. Linguagem:Java, Node,Flutter3. Arquitetura:microserviços,orientada a eventos Kafka4. Banco de Dados: Sybase, MySql, Oracle, SqlServer 5. API's: CAAPI e APIGEE's 6. Versionamento: Git e GitFlow 7. CI/CD: Jekins e Kubernets 8. Cloud: GCP (Google Cloud Platform) 9. Mensageria: RabbitMQ e MemoryStore 10. Telemetria: Dynatrace, Kibana 11. Agilidade: Scrum, Kanban e JIRA Informações adicionaisDesejável: Conhecimento em seguros",Spread Tecnologia,vacancy_type_effective,,False,São Paulo,São Paulo,Brasil,https://spread.gupy.io/job/eyJqb2JJZCI6Njg4MDQyOCwic291cmNlIjoiZ3VweV9wb3J0YWwifQ==?jobBoardSource=gupy_portal,True,hybrid,True
6880418,2024-03-13T19:03:25.213Z,DESENVOLVEDOR FULL STACK REACT/.NET,"Temos duas oportunidades para DESENVOLVEDOR FULL STACK  ! #VEMPRATORRA!Responsabilidades e atribuiçõesResponsável por analisar os requisitos do PLANO DE PRODUTO ou ORDENS DE SERVIÇO, avaliando as necessidades e demandas das novas funcionalidades do sistema, entrevistando os envolvidos para realizar a especificação de requisitos bem como as sugestões de soluções para o problema em questão. Realizar o desenvolvimento de soluções desde a camada back-end a camada front-end considerando boas práticas e conceitos de mercado.Interpretar a demanda e necessidade de cliente, participando de reuniões de entendimento a fim de especificar um requisito;Trabalhar conforme os requisitos estabelecidos pelos clientes, regras, padrões e metodologias conforme governança de TI;Realizar alinhamentos com time de TI local e global, para validação de estratégias em temas ligados implantação de novas tecnologias e softwares;Executar outras atividades correlatas, conforme orientação superior.Realizar desenvolvimento de soluções back-endRealizar desenvolvimento de aplicações front-endRealizar levantamento de oportunidades de performance &amp; tunning;Executar outras atividades correlatas, conforme orientação superior.Requisitos e qualificaçõesEnsino Superior completo em Ciências da Computação, Sistemas da Informação, Engenharia De Software, Matemática e áreas afins;Conhecimento em Pacote OfficeDe 05 a 07 anos em cargos anteriores como Full StackConhecimentos em banco de dados: SQL Server (obrigatório)Conhecimentos em SQL Developer (queries, procedures, views, funções, triggers) (obrigatório)Conhecimentos em ETL (obrigatório)Conhecimentos em Serviços e Apis (obrigatório)Conhecimento em Desenvolvimento Front-end, back-end (Full Stack)Conhecimento em linguagens de marcação de Html, CSSConhecimento em linguagem de programação Javascript , C# e JqueryConhecimento sobre boas práticas de UX (Experiência do usuário)Conhecimento em ambiente cloud (AWS, Azure, Google Cloud)Conhecimento em Infraestrutura (Servidores e Telecom)Experiência com plataformas Low/ No CodeDesejável conhecimento em ERP (Linx)Desejável conhecimento em sistemas de WMSDesejável conhecimento no sistema ZeusRetail (Zanthus)Desejável conhecimento em sistemas de WMSDesejável conhecimento em sistemas de WMSInformações adicionaisEstamos em frente ao metrô brigadeiro na Av. Paulista, 407;Poder ser quem você é, não temos Dress Code!;44 horas semanais, de segunda a sexta-feira;1 dia remoto, e 4 dias presenciais;Totalpass;Vale refeição ou alimentação;Vale transporte;Vale farmácia com desconto em folha;Assistência odontológica;Assistência médica;Gratificação anual;Descanso programado de ponte de feríado20% de desconto nas compras presenciais e onlinesSaída antecipada no dia do aniversárioCozinha equipada para alimentação;Política de treinamento e desenvolvimento;Plataforma de treinamento varejo;Parcerias educacionais;",Lojas Torra,vacancy_type_effective,,False,São Paulo,São Paulo,Brasil,https://lojastorra.gupy.io/job/eyJqb2JJZCI6Njg4MDQxOCwic291cmNlIjoiZ3VweV9wb3J0YWwifQ==?jobBoardSource=gupy_portal,True,on-site,True
6880264,2024-03-13T19:00:40.515Z,PESSOA DESENVOLVEDORA BACKEND SR - 14314,"Venha fazer parte de uma empresa que ama transformar com tecnologia e abraça a diversidade em todas as suas formas!Responsabilidades e atribuiçõesRequisitos e qualificaçõesDesenvolvimento e manutenção no sistemas legados legados e nova plataforma. Participação ativa junto ao time squad no entendimento de problemas e solução Participação ativa nos ritos ágeis Garantia de qualidade e cobertura de código conforme as diretrizes técnicas do banco Entendimento arquitetural dos sistemas, nuvem e processos de TI do bancoConhecimento Técnico 1. Framework: Spring Boot,Spring Batch, Camel, Dataflow, JPA, Hibernate, JUnit, 2. Linguagem: Java, Node, Flutter 3. Arquitetura: microserviços, orientada a eventos Kafka 4. Banco de Dados: Sybase, MySql, Oracle, SqlServer 5. API's: CAAPI e APIGEE's 6. Versionamento: Git e GitFlow 7. CI/CD: Jekins e Kubernets 8. Cloud: GCP (Google Cloud Platform) 9. Mensageria: RabbitMQ e MemoryStore 10. Telemetria: Dynatrace, Kibana 11. Agilidade: Scrum, Kanban e JIRA Informações adicionaisDesejável: Conhecimento em seguros. ",Spread Tecnologia,vacancy_type_effective,,False,São Paulo,São Paulo,Brasil,https://spread.gupy.io/job/eyJqb2JJZCI6Njg4MDI2NCwic291cmNlIjoiZ3VweV9wb3J0YWwifQ==?jobBoardSource=gupy_portal,True,hybrid,True
6880187,2024-03-13T18:52:31.596Z,Pessoa Desenvolvedora Java (Back-End) + Elasticsearch,"A Pessoa Desenvolvedora Java (Back-End) + Elasticsearch será orientado à criação de novas funcionalidades de back-end, criação de testes unitários e de integração, além da identificação e correção de bugs. Trabalhará principalmente com as tecnologias Java e PHP, onde nossas aplicações se comunicam via HTTP/HTTPS e armazenam dados em bases relacionais.Responsabilidades e atribuiçõesDesenvolver serviços backend escaláveis de alta performance;Monitorar e analisar dados das nossas aplicações para conseguir entender como melhorar a performance;Desenvolver e integrar sistemas web escaláveis e de alta disponibilidade;Pensar em soluções junto com a área de produtos para entregar funcionalidades de alta qualidade para os usuários;Pesquisar e trazer para soluções do dia a dia novidades e alternativas aos processos e ferramentas existentes, buscando sempre a adoção de tecnologias de ponta, ideais para nossos desafios de negócio.Requisitos e qualificaçõesObrigatóriosExperiência avançada em linguagem Java;Experiência com banco de dados Elasticsearch;Experiência com banco de dados PostgreSQL;Experiência com testes unitários em JUnit;Experiência com ferramentas de versionamento de código Git;Experiência no desenvolvimento de APIs em REST;Experiência com ciclo de desenvolvimento CI/CD (desenvolvimento, testes, integração, deploy e monitoramento);Proativo e comunicativo;Espírito de equipe.DesejáveisDesejável experiência em linguagem PHP;Desejável experiência com JavaScript, TypeScript, Bootstrap e VueJS;Desejável experiência com CSS e SASS;Desejável familiaridade com Docker e Kubernetes;Conhecer conceitos de aplicações distribuídas, transações, pub/sub, client/server;Diferencial experiência com Web Scraping;Diferencial experiência com Clean Code/Clean Architecture;Diferencial experiência com desenvolvimento de aplicações Android ou iOS em Flutter.Informações adicionaisNossos Benefícios:Benefício alimentação flexível;Plano Odontológico;Plano de Saúde Nacional (SulAmérica) - ﻿Plano de Saúde Nacional (Unimed/SC);Acesso a Plataforma de Saúde Emocional;Seguro de Vida Corporativo;Tarifa diferenciada para o curso de inglês na Escola Rockfeller/ 4you2 (Aulas Onlines);Estruturação de ambiente de trabalho remoto;Desenvolvimento pessoal acelerado com Plano de Carreira estruturado e Plano de Desenvolvimento Individual.Bom ambiente de trabalho e troca de experiências com pessoas talentosas.Conhecer o ecossistema de Startups;Day-off no dia de aniversário;No dress code (Pode trabalhar de bermuda, camiseta, chinelo, kilt, burca, como se sentir melhor);Biblioteca Corporativa;Plataforma de Treinamentos EAD.﻿Detalhes da Vaga:Tempo Integral (Dedicação Exclusiva);Modalidade de Trabalho: Remota;Jornada de Trabalho: Segunda a Sexta-feira;Carga Horária: 44 Horas Semanais.",Effecti,vacancy_type_effective,,True,,,Brasil,https://effecti.gupy.io/job/eyJqb2JJZCI6Njg4MDE4Nywic291cmNlIjoiZ3VweV9wb3J0YWwifQ==?jobBoardSource=gupy_portal,True,remote,True
6879977,2024-03-13T18:34:51.942Z,Desenvolvedor de Sistemas - PHP 2024,"A FÁCIL TECNOLOGIA é uma empresa de tecnologia que atua no mercado de desenvolvimento de softwares desde o ano de 2005, com ação pautada na tecnologia da informação e redesenho de processos, produzindo soluções inteligentes, robustas e seguras.Valorizamos as relações, o diálogo franco e o trabalho em equipe. Estimulamos as qualidades e o potencial dos nossos profissionais, para que cada um deles tenha oportunidades de aprendizagem e crescimento.O que você vai fazer por aqui? Buscamos pessoas que sejam apaixonadas por construir aplicações distribuídas e de alta performance e escaláveis para milhões de novos usuários em todo o mundo !!!!Buscamos pessoas com os seguintes conhecimentos:PHP (estruturado e orientado a objeto)Programação reativa;Atenção para qualidade de código e design patterns;Metodologias ágeis;Versionamento de códigos utilizando git.Desenvolvimento com testes unitários e testes de integração;Conhecimento em Design System (elaborando e utilizando);Uso de ferramentas de apoio (Jira, GitHub, etc )Responsabilidades e atribuiçõesProgramar, codificar e testar sistemas conforme planejamento do Gestor da área, além de realizar manutenção nos sistemas existentes sempre com vistas à segurança da informação; Realizar o levantamento de requisitos de software, buscando compreender o problema a ser resolvido;Especificar os requisitos de software, analisando detalhadamente os dados do levantamento de requisitos a fim de consolidar o modelo da solução, além de realizar a validação do modelo bem como a verificação de conformidade com as necessidades da área;Projetar os softwares seguindo rigorosamente a arquitetura do sistema, linguagem de programação, sistema gerenciador de banco de dados (SGBD), padrão de interface gráfica e padrões de segurança da informação definidos pela Diretoria de Tecnologia;Desenvolver softwares conforme orientação do Gestor da área, codificando o sistema a partir do projeto e planejamento anteriores;Executar testes sobre o software, módulos ou funcionalidades desenvolvidas considerando as especificações de requisitos;Gerar relatórios de testes identificando informações relevantes sobre o comportamento e possíveis erros encontrados no software;Implantar sistemas considerando a instalação do ambiente de produção, importação/exportação de dados.Zelar pelos procedimentos e normas de segurança da informação no que diz respeito ao escopo de sua posição.Requisitos e qualificaçõesComportamentos:ProativoTrabalho em equipeOrganizaçãoComunicabilidadeCursos:Engenharia da ComputaçãoSistemas de InformaçãoCiências da ComputaçãoAnálise e Desenvolvimento de SistemasSistemas para InternetHabilidadesPostgreSQLJava ScriptSistema Operacional LinuxGITHTML5CSS3PHPJQueryJiraInformações adicionaisConhecimentos em Sistemas Operacionais - LinuxExperiência: Entre 1 e 3 anos",Trabalhe conosco!,vacancy_type_effective,2024-04-02T00:00:00.000Z,False,João Pessoa,Paraíba,Brasil,https://facilsolucoes.gupy.io/job/eyJqb2JJZCI6Njg3OTk3Nywic291cmNlIjoiZ3VweV9wb3J0YWwifQ==?jobBoardSource=gupy_portal,False,hybrid,True
