job_id,published_date,title,description,career_page_name,type,application_deadline,is_remote_work,city,state,country,job_url,disabilities,workplace_type,submitted
7332509,2024-06-19T21:20:01.289Z,FullStack Developer,"¡Sé parte de Stefanini!​En Stefanini somos más de 30.000 genios, conectados desde 41 países, haciendo lo que les apasiona y co-creando un futuro mejor.​Responsabilidades y atribucionesDesarrollar y mantener aplicaciones utilizando marcos y lenguajes de programación modernos.Colaborar con diseñadores, gerentes de producto y otras partes interesadas para recopilar requisitos y traducirlos en especificaciones técnicas.Diseñar e implementar interfaces y experiencias fáciles de usar.Escriba código limpio, eficiente y mantenibleRealizar pruebas y depuraciones exhaustivas para garantizar la calidad y confiabilidad de las aplicaciones de software.Solucionar y resolver problemas informados por los usuarios o identificados durante las pruebas.Manténgase actualizado con las tendencias de la industria y las mejores prácticas en desarrollo web.Participar en revisiones de código para garantizar el cumplimiento de los estándares de codificación y las mejores prácticas.Colaborar con equipos multifuncionales para garantizar la entrega exitosa de proyectos.Contribuir a la mejora continua de los procesos y herramientas de desarrollo.Requisitos y calificacionesImportante contar con:4 a 5 años de experiencia a másConocimientos de:Angular 7 a másNet Core 6Java (spring boot 8) (Deseable)SQL y Oracle",STEFANINI LATAM,vacancy_type_temporary,,True,,,Peru,https://stefaninilatam.gupy.io/job/eyJqb2JJZCI6NzMzMjUwOSwic291cmNlIjoiZ3VweV9wb3J0YWwifQ==?jobBoardSource=gupy_portal,True,remote,True
7334004,2024-06-19T21:05:03.646Z,Pessoa Desenvolvedora Fullstack - Sênior ,"A FCamara está em busca de uma Pessoa Desenvolvedora Full Stack - Senior, para atuar em parceria com um banco múltiplo, com sólida base de clientes no segmento Corporate, com ofertas de produtos financeirosResponsabilidades e atribuições•	Desenvolvimento de aplicações Full Stack;•	Manutenção de sistemas de integração para correção de falhas/erros;•	Implementação de melhorias;•	Atuar como parte da equipe ágil;•	Desenvolver, implantar e operar aplicações na cultura DevOps;•	Otimizar a aplicação para melhor velocidade e escalabilidade;•	Garantir a validação dos dados fornecidos pelos usuários;•	Criar código e bibliotecas reutilizáveis para uso futuro;•	Colaborar com outros membros da equipe, Engenheiros, PO, QA, Designers, Scrum Master e Tech Leader para resolver os desafios existentes.Requisitos e qualificaçõesHard Skills•	Desenvolvimento de serviços com Web Api e Windows Services•	Front-end com Angular•	Programação assincrona, API RESTful, Azure DevOps, Clean Code, Git e vivência no desenvolvimento ágil;•	Desejável conhecimento em Service Bus e/ou Mensagerias;•	SQL Server;•	Experiência com banco de dados com PostgreSQL e MongoDB;•	Vivência como versionamento Git, utilizando o GitFlow para organização dos códigos;•	Experiência com TDD para testes unitários e de integração;•	Experiência em desenvolvimento com projetos de sistemas legados e cloud, de Tesouraria e/ou Backoffice, preferenciamente em instituições financeiras;•	Experiência com .Net Core e .NET FrameworkSoft Skills• Boa Comunicação• Criatividade• Colaboração• Pensamento Crítico• Autonomia• Trabalho em Equipe• Gestão de Tempo• ProtagonismoInformações adicionais",VENHA SER #SANGUELARANJA 🧡🚀,vacancy_type_effective,,True,,,Brasil,https://fcamara.gupy.io/job/eyJqb2JJZCI6NzMzNDAwNCwic291cmNlIjoiZ3VweV9wb3J0YWwifQ==?jobBoardSource=gupy_portal,False,remote,True
7337807,2024-06-19T20:43:44.553Z,Pessoa Desenvolvedora Fullstack - Pleno,"A FCamara está em busca de uma pessoa Desenvolvedora Fullstack Pleno.Responsabilidades e atribuiçõesDesenvolvimento de aplicações em .NET 7;Participação em todo o ciclo de desenvolvimento, desde o levantamento de requisitos até a entrega final e sustentação;Autonomia para definição da abordagem de design e arquitetura na resolução de problemas;Ownership da infraestrutura e pipelines das aplicações;Contato direto com áreas de negócio e stakeholders. Requisitos e qualificaçõesHard Skills:C# (.NET 7);ASP.NET Core Web APIs;SQL (SQL Server);RabbitMQ;React/Redis;Windows Forms (com DevExpress);Conhecimentos de mercado financeiro (diferencial).Soft Skills: Raciocínio lógico e capacidade analítica;Boa Comunicação;Espírito de equipe e capacidade de resolução de conflitos;Ter capacidade de comunicação com diversos perfis de stakeholders;Habilidade de trabalhar em equipes ágeis e multidisciplinares;Criatividade e pro-atividade para imaginar diferentes cenários de uso das aplicações;Organização.",VENHA SER #SANGUELARANJA 🧡🚀,vacancy_type_effective,,True,,,Brasil,https://fcamara.gupy.io/job/eyJqb2JJZCI6NzMzNzgwNywic291cmNlIjoiZ3VweV9wb3J0YWwifQ==?jobBoardSource=gupy_portal,False,remote,True
7342342,2024-06-20T18:35:26.051Z,Junior Software Engineer | Stilingue by Blip,"Na área de Customer Success &amp; Professional Services (CSPS), nosso time de desenvolvimento é essencial na entrega de serviços dos produtos do suite da Stilingue by Blip. Somos um time multidisciplinar e trabalhamos para desenvolver soluções, sejam elas customizações ou projetos, que atendam as necessidades dos clientes, gerando ainda mais resultados em sua operação.Como Junior Software Engineer, você desempenhará um papel fundamental no desenvolvimento de soluções escaláveis, utilizando diversas linguagens de programação e padrões de projeto. Você terá oportunidade de atuar de forma Full Stack, se envolvendo em diversos desafios e expandir suas habilidades como pessoa desenvolvedora de software.Se você é uma Pessoa com Deficiência (PcD) ou Neurodivergente, saiba que todas as vagas da Blip também são inclusivas. Estamos esperando sua inscrição!Responsabilidades e atribuiçõesQual será o seu papel no time?Implementar novas soluções baseada em regras de negócio voltadas às necessidades dos clientes;Realizar a manutenção das soluções existentes nos Produtos Stilingue by Blip;Criar documentações e fluxos das soluções entregues;Realizar testes das soluções desenvolvidas;Trabalhar em conjunto com outros especialistas com o objetivo identificar possíveis pontos de melhoria na entrega e evolução nos processos internos;Participar de cerimônias de reuniões diárias, planejamento e de feedback, seja do time ou dos processos do time;Participar, quando necessário, de reuniões com os clientes para entender melhor a dor que a solução resolve ou tirar dúvidas técnicas.Requisitos e qualificaçõesO que esperamos de você:Conhecimento em desenvolvimento de software;Conhecimento em Java e/ou Python e/ou Javascript (VueJS);Habilidade em resolução de problemas;Conhecimento em Metodologias Ágeis (Scrum, Kanban);Capacidade de adaptar-se a novas tecnologias e desafios;Criatividade para propor novas soluções.Será um diferencial se você tiver:Conhecimento em Spring Framework;Conhecimento em Cloud (GCP e/ou Azure);Conhecimento em Git e Github;Conhecimento em banco de dados relacionais e não-relacionais.Informações adicionaisVantagens e benefíciosNada básico que amamos:Vale Alimentação ou Refeição no valor de R$968,00 fixo (inclusive nas férias);Vale transporte;Day-off de aniversário;Auxílio home office para modelos 100% home office e híbrido;Bonificação anual de acordo com resultados da empresa e políticas vigentes;Vale Cultura para usar em livrarias, papelarias, comprar livros, ingressos de teatro, shows, cinema e mais; Reembolso do registro da troca do nome social para pessoas trans;Empréstimo Consignado: parceria com alguns bancos que facilita na contratação de um empréstimo consignado;Saúde e bem-estar:Assistência médica de cobertura nacional para Blippers e dependentes, coparticipativo e com desconto de R$1,00 em folha;Assistência odontológica;Modelos de trabalho 100% remoto, híbrido ou presencial;Gympass, maior rede de academias, estúdios e apps de bem-estar para você cuidar da sua saúde física;Psicologia viva, a plataforma de atendimentos psicológicos online;Seguro de vida;Horário flexível, nosso regime de 40h semanais pode ser feito em horário flexível desde que alinhados com a liderança;No dress code.Família:Licença maternidade estendida de 180 dias e parental de 30 dias, extensível para papais e mamães que adotarem ou obtiverem a guarda judicial da criança e para casais homoafetivos;Assistência especial aos Blippers que tiverem filhos com deficiência;Auxílio criança: cartão de R$1000 para que as famílias usufruam desse momento tão único em sua plenitude.Carreira e formação:Apoio em capacitações, conforme as políticas de elegibilidade e alinhamentos das áreas;Lifelong Learning, contamos com a Degreed, uma das maiores plataformas de aprendizagem do mundo com acesso a conteúdos ilimitados sobre diversos temas;Blip Idiomas, oferecemos curso gratuito de inglês e espanhol pela plataforma GoFluent;Edupass benefício de descontos em plataformas e instituições educacionais.",Blip,vacancy_type_effective,,True,,,Brasil,https://blip.gupy.io/job/eyJqb2JJZCI6NzM0MjM0Miwic291cmNlIjoiZ3VweV9wb3J0YWwifQ==?jobBoardSource=gupy_portal,True,remote,True
7287857,2024-06-20T18:12:46.513Z,SOFTWARE DEVELOPER III | | SALESFORCE (Remoto),"LOCALIZASomos uma empresa presente no futuro. Em nossa história, sempre trouxemos para o agora ideias que pareciam existir somente anos à frente. Enxergamos o amanhã pelas lentes do nosso espírito empreendedor.Construir o futuro da mobilidade é um propósito que impulsiona nossa habilidade de protagonizar e o nosso talento em fazer acontecer. Para cumprir o nosso propósito, precisamos de gente. Gente como nossos colaboradores, clientes, franqueados, fornecedores, investidores, sociedade e parceiros, que, juntos, pensam e criam formas inteligentes de ir e vir. O QUE VOCÊ IRÁ FAZER COMO SOFTWARE DEVELOPER III | SALESFORCEImplementar e sustentar o ambiente Salesforce, realizando o desenvolvimento de novas funcionalidades, correções, qualidade, integração de dados, performance, disponibilidade, qualidade e segurança, visando o cumprimento das metas definidas pela Companhia.  O QUE PRECISAMOSGostar de programar;Se preocupar com excelência técnica e boas práticas de programação - Aqui nos preocupamos bastante com design patterns e boas práticas de arquitetura (Clean code, SOLID, TDD, etc.);  Ter experiência nas nuvens Service e Sales, tais como a implementação de fluxos de casos (Entitlement, Milestones, Email-to-Case, etc); Ter experiência na plataforma Salesforce, tais como triggers, componentes (VFP, Aura e LWC), fluxos de automação (Flow, Workflow, Process Builder, etc); Ter experiência no desenvolvimento de APIs (Rest, SOAP e Bulk); Responsabilidades e atribuiçõesRequisitos e qualificaçõesConhecimento em Experience Cloud; Formação em TI.Informações adicionaisBENEFÍCIOS PARA VOCÊ ·        Dress code: como você é!·        Desconto especial no aluguel de carros e compra de veículos seminovos·        Gympass·        Jornada flexível·        Participação nos Lucros e Resultados (PLR)·        Plano de Saúde·        Plano Odontológico·        Previdência Privada·        Restaurante na sede da empresa·        Rede de benefícios e descontos Allya·        Seguro de Vida·        Vale Alimentação·        Vale Transporte·        E mais: Universidade Localiza (treinamentos presenciais/online para seu desenvolvimento); Programa de Apoio a Gestantes; Programa Acolher com orientações psicológicas, financeiras e jurídicas; Consultórios médicos para atendimentos emergenciais; Central exclusiva de atendimento ao colaborador; Serviços internos na sede (Academia, Esmalteria, Banco, Copiadora e Lanchonete); Ambientes de trabalho open space, dentre outros.",Localiza&Co,vacancy_type_effective,,True,Belo Horizonte,Minas Gerais,Brasil,https://localiza.gupy.io/job/eyJqb2JJZCI6NzI4Nzg1Nywic291cmNlIjoiZ3VweV9wb3J0YWwifQ==?jobBoardSource=gupy_portal,True,remote,True
7341077,2024-06-20T17:57:47.138Z,[002] Pessoa Arquiteta de Software ,"Você é uma pessoa apaixonada por desenvolvimento de software e busca um ambiente de trabalho estimulante, onde sua criatividade e habilidades técnicas possam evoluir continuamente? Então, vem somar com a gente! 🚀✨ Estamos em busca de uma Pessoa Arquiteta de Software para somar com nossa equipe supimpa. Aqui, valorizamos a liberdade e a responsabilidade, encorajando você a trazer suas ideias inovadoras para solucionar desafios de maneira única. 😍✨ Acreditamos que a soma de expertises e paixão são a chave para o sucesso, e você terá a oportunidade de colaborar com profissionais incríveis que compartilham o mesmo entusiasmo pelo que fazem. 🙌✨ Venha fazer parte do nosso time e aproveitar um ambiente de trabalho colaborativo com somas constantes que farão sua carreira evoluir 🚀Sua jornada de sucesso começa aqui! Nossa soma, sua evolução #vemserilegra 🧡💜💛+++ Conheça mais sobre o processo seletivo em nosso playbook: encurtador.com.br/bvS89Responsabilidades e atribuiçõesDesenvolvimento de Arquitetura: Projetar e implementar a arquitetura de sistemas complexos, assegurando a escalabilidade, performance e segurança das soluções;Liderança Técnica: Atuar como líder técnico, orientando e mentorando equipes de desenvolvimento para garantir a aderência aos padrões arquiteturais e boas práticas de engenharia de software;Análise de Requisitos: Colaborar com stakeholders para entender e definir os requisitos técnicos e funcionais dos projetos, traduzindo-os em especificações claras e detalhadas;Avaliação de Tecnologias: Pesquisar e avaliar novas tecnologias e ferramentas, recomendando aquelas que melhor se alinham às necessidades do projeto e aos objetivos estratégicos da empresa;Governança e Padrões: Estabelecer e manter padrões de arquitetura e governança tecnológica, promovendo a consistência e qualidade através de guidelines e revisões de código;Gestão de Riscos e Problemas: Identificar e mitigar riscos técnicos, além de resolver problemas complexos que possam surgir durante o ciclo de vida do desenvolvimento de software.Requisitos e qualificaçõesTer no mínimo 6 anos de experiência com arquitetura de software;Ter conhecimento avançado em linguagem de programação Java;Ter conhecimento de ferramentas BPM;Ter conhecimento avançado em framework Spring;Ter experiência no desenvolvimento de sistemas distribuídos;Ter experiência no desenvolvimento de micro serviços;Possuir conhecimento de API's Rest;Possuir conhecimento de desenvolvimento de sistemas batch (Spring batch, Spring Dataflow);Ter conhecimento em banco de dados relacionais (Oracle, Mysql, PostgreSql);Ter conhecimento em banco de dados não relacionais (MongoDB, DynamoDB, Redis);Ter experiência em ferramentas CI/CD (Jenkins, Gitlab CI);Possuir conhecimento em versionamento de código utilizando Git;Ter experiência na utilização de serviços cloud na AWS (S3, RDS, EC2, EKS, SNS, SQS, etc);Ter conhecimento de ferramentas de observability (Dynatrace, Grafana, Prometheus, ELK);Ter experiência no desenvolvimento de sistemas utilizando mensageria (Kafka, RabbitMQ).Informações adicionaisO que oferecemos:🩺 Assistência Médica (RS: Unimed | Demais Estados: Bradesco Saúde);🦷 Assistência Odontológica (RS: Odontoprev | Demais Estados: Bradesco);🏡 Auxílio Home Office;🍽 Vale alimentação e Vale refeição (Alelo);🧠 Zenklub (2 sessões gratuitas por mês, desconto nas demais);💪 Wellhub;📖 Apoio em cursos e certificações;🎯 Udemy for Business;👩‍🎓 Convênio com Instituições de ensino;🧘‍♀️ Programa Taking care, everywhere (saúde mental e bem-estar);🌍 Flexibilidade (anywhere office).",ilegra,vacancy_type_effective,,True,,,Brasil,https://ilegra.gupy.io/job/eyJqb2JJZCI6NzM0MTA3Nywic291cmNlIjoiZ3VweV9wb3J0YWwifQ==?jobBoardSource=gupy_portal,True,remote,True
7056277,2024-06-20T17:17:36.843Z,Software Engineer II,"Você está em busca de uma oportunidade emocionante para trabalhar com tecnologia e inovação no coração da Amazônia? Então você veio ao lugar certo! Na Bemol Digital, estamos à procura de profissionais talentosos e apaixonados que desejam fazer parte de nossa equipe. Nosso objetivo é liderar a transformação do mercado de tecnologia no Norte do país, fornecendo acesso a serviços digitais conectados à marca Bemol. Se você está procurando por um ambiente de trabalho onde possa ser autêntico e verdadeiro consigo mesmo, nós temos o lugar ideal para você. Na Bemol Digital, valorizamos a diversidade e estamos comprometidos em criar um ambiente inclusivo onde as pessoas possam se desenvolver e crescer. Além da paixão por construir produtos digitais, buscamos indivíduos com um conjunto de habilidades interpessoais que consideramos essenciais para se juntar à nossa equipe. Se você possui as seguintes competências, então você está alinhado com a nossa proposta: Comunicação eficaz: capacidade de transmitir ideias de forma clara e concisa, tanto verbalmente quanto por escrito. Trabalho em equipe: habilidade de colaborar e trabalhar de forma harmoniosa com pessoas de diferentes origens e perspectivas. Adaptabilidade: disposição para se adaptar a mudanças e abraçar novos desafios. Resolução de problemas: habilidade de identificar problemas, analisar opções e implementar soluções eficientes. Orientação para resultados: mentalidade orientada para o cumprimento de metas e entrega de resultados de alta qualidade. Curiosidade e aprendizado contínuo: vontade de explorar novas ideias, aprender novas tecnologias e estar atualizado com as tendências do mercado. Se você se identifica com nossa visão e possui essas habilidades, gostaríamos de conhecê-lo. Junte-se a nós na Bemol Digital e faça parte de uma equipe empolgante que está impulsionando a inovação na região amazônica. Venha construir o futuro conosco! Responsabilidades e atribuiçõesDesenvolver soluções de software em .Net Core;Contribuir em revisão de código;Aplicar princípios SOLID;Requisitos e qualificaçõesConhecimento avançado de programação em C#;Entendimento de arquitetura de microsserviços;Noção básica de Cloud com Azure;Conhecimento avançado de GIT;Experiência com Azure DevOps;Noção de utilização de Markdown;",Bemol Digital,vacancy_type_effective,2024-07-31T00:00:00.000Z,True,,,Brasil,https://bemoldigital.gupy.io/job/eyJqb2JJZCI6NzA1NjI3Nywic291cmNlIjoiZ3VweV9wb3J0YWwifQ==?jobBoardSource=gupy_portal,False,remote,True
7277629,2024-06-20T16:08:32.728Z,Plataforma e Produtos PJ | Especialista em Qualidade de Software (QA) ,"Quer fazer parte de uma empresa que cresce exponencialmente, revoluciona o mercado com suas inovações e se preocupa com as pessoas?Então chegou a sua hora e o desafio é daqueles que dá frio na barriga! Vamos revolucionar ainda mais um segmento que passa por inúmeras transformações e melhorar a vida de milhões de brasileiros e suas famílias.Esse é o momento de fazer acontecer. Venha fazer parte do nosso time!Procuramos uma pessoa Especialista de Qualidade (QA) para nosso time de Tecnologia, da VR. Venha proporcionar as melhores experiências e soluções para os nossos usuários. Responsabilidades e atribuiçõesGarantir a qualidade e padrões gerais de comportamento do produto;Identificar e garantir cenários homologados para automação de testes;Prezar pela qualidade do sistema que está em construção;Atuar com o time de desenvolvimento na garantia de uma entrega de qualidade para nosso cliente;Fortalecer o uso de testes automatizados no seu time;Participar ativamente das cerimônias nas squads acompanhando com visão crítica sob o ponto de vista operacional;Suporte às áreas internas e atendimento aos parceiros externos com cenários e massas de testes;Criar e realizar manutenção de indicadores de testes;Sugerir e trabalhar por melhorias no ambiente Através da análise dos fluxos existentes, atualização de versão e otimização de performance;Para essa vaga, buscamos alguém que vá atuar como especialista de testes de software (QA) dentro de um de nossos esquadrões;Análise de requisitos e levantamento de cenários de testes;Reportar e acompanhar resolução de defeitos;Automatizar testes de APIs, APPs e Portais existentes;Evoluir e executar testes automatizados;Gerar massas de teste;Elaboração de cenários de testes e plano de testes desde a fase inicial dos projetos;Ser uma fonte de divulgação da cultura de qualidade de software no esquadrão;Requisitos e qualificaçõesÉ muito importante para nós que você possua as seguintes habilidades:Capacidade de comunicação clara e objetiva;Voz ativa para apontar possíveis riscos e defeitos nos processos e produtos;Espírito de equipe e capacidade de resolução de conflitos;Criatividade para imaginar diferentes cenários de uso das aplicações;Habilidade de trabalhar em equipes ágeis e multidisciplinares;Elaboração de cenários de testes e plano de testes desde a fase inicial dos projetos;Construção dos testes automatizados durante a execução da sprint.Esperamos que você possua experiência com:Metodologias ágeis de desenvolvimento de software (Scrum, Kanban);Gerenciamento de test cases, bugs e evidências de teste;JIRA para controle de demandas;Testes de API (REST e SOAP);Git para compartilhamento de código;Linguagem de programação Ruby;Framework de automação Cucumber. Você vai se destacar se conhecer: Linguagem de programação Javascript;Framework de automação Cypress;Experiencia com testes de performance (JMeter);Zephyr (Plugin do JIRA para de gerenciamento de testes);Processos e ferramentas de CI/CD.Informações adicionaisO que a VR te oferece? Alimentação Vale refeição sem desconto na folha e disponibilizado no 1° dia útil do mês;Vale alimentação sem desconto mensal em folha e pago inclusive no período de férias; Saúde Plano de Saúde com abrangência nacional (sem mensalidade e podendo ser solicitado no 1º dia na empresa);Plano odontológico com abrangência nacional (sem mensalidade e podendo ser solicitado no 1º dia na empresa);Licença maternidade e paternidade estendida para todas as famílias;Totall Pass, um serviço de acesso a diversas academias no país;Convênio farmácia;Day off + bônus no mês do seu aniversário; Carreira Plano de carreira, cargos e salários;Treinamentos e workshops internos e externos;  Programas Programa de indicação;Programa de ações de saúde e qualidade de vida;Programa de Diversidade e Inclusão para a construção de um ambiente plural;Programa de Assistência Jurídica, Psicológica e Previdenciária (PAE) para você e sua família.﻿",VR,vacancy_type_effective,,True,São Paulo,São Paulo,Brasil,https://vr.gupy.io/job/eyJqb2JJZCI6NzI3NzYyOSwic291cmNlIjoiZ3VweV9wb3J0YWwifQ==?jobBoardSource=gupy_portal,True,remote,True
