job_id,published_date,title,description,career_page_name,type,application_deadline,is_remote_work,city,state,country,job_url,disabilities,workplace_type,submitted
5796626,2024-01-10T20:45:43.758Z,Pessoa Desenvolvedora Júnior,"Quer fazer parte de um time alta performance? A Neogrid é um ecossistema de tecnologia e inteligência de dados que ajuda a empresas a venderem mais, com mais margem 🚀Estamos em busca de pessoas com foco em performance, operando por métricas de negócios reais e acionáveis, e que nos ajude a garantir o desenvolvimento ágil de produtos e tecnologias 👩‍💻Na Neogrid, temos o desafio de entregar os melhores resultados com dedicação e excelência, nos desafiando cada vez mais todos os dias!Aqui, você terá a oportunidade de entregar o seu valor, ajudando os maiores players do mercado nacional no desafio de vender mais, com mais margem!Se você se identificou, temos o desafio certo para você!Responsabilidades e atribuiçõesNesta oportunidade, você irá:Trabalhar sob a orientação de pessoas seniores e líderes de projeto para contribuir no desenvolvimento de softwares;Escrever códigos, realizar testes e depurar aplicativos de software;Participar de revisões de código;Aprender boas práticas por meio de feedbacks;Colaborar com a equipe no desenvolvimento de soluções;Aprender e aplicar boas práticas de desenvolvimento e princípios de design de software;Se atualizar com as tecnologias e linguagens de programação atuais mais relevantes.Requisitos e qualificaçõesPara isso, é importante que você tenha:Conhecimento em programação em Java, Spring boot e SQL, com interesse em aprender e se desenvolver na área;Habilidades de resolução de problemas;Disposição para enfrentar desafios técnicos;Boas habilidades de comunicação e capacidade de trabalhar em equipe;Paixão por tecnologia e pretensão de crescimento profissional na área de desenvolvimento.Será um plus se você tiver:Superior cursando em Análise e Desenvolvimento de Sistemas, Engenharia de Software, ou áreas relacionadas.Python Open APIInformações adicionaisPor que fazer parte do nosso time? 💚❤️💜💙Acreditamos no poder da diversidade, que amplia, inclui e faz crescer. Crescer a liberdade, a inovação e as oportunidades.  e pensando nas nossas pessoas:  🌍 Nossas oportunidades são Remotas ou Híbridas! O nosso modelo de trabalho varia conforme a função.⏰ Aqui temos Flexibilidade em nosso Horário de Trabalho! 🏥 Cuidamos da sua saúde! Com nosso Plano de Saúde, Plano Odontológico, Auxílio Medicamento e Seguro de Vida (todos extensíveis a dependentes legais).🚍 Disponibilizamos Vale Transporte ou Auxílio Estacionamento para você que mora nas cidades em que nosso ecossistema está presente!🍔 Quer fazer um lanchinho ou as compras do mês? Com nosso Vale Alimentação/Refeição flexível, em cartão Flash, é você quem manda.💰 Está buscando aquele descontão? Aqui temos Clube de Vantagens!🏋️ E o shape, como fica? Deixa com o Gympass.🏖️ Bora tirar aquela folga? No mês do seu aniversário, você terá o dia da sua escolha para descansar como quiser.👨‍🎓 Temos a UNICO SKILL, solução educacional de capacitações externas para o desenvolvimento contínuo de Neogriders que podem escolher o que estudar, com opções de Graduação, MBA/Pós, Idiomas e Cursos Livres!🏫 Cuidamos de você e da sua família! Fornecemos Auxílio Creche e Licença Parental Estendida de 6 meses para mamães e de 30 dias para papais.📓 Quer se manter atualizado sobre o negócio e os produtos da empresa e ganhar brindes por isso? Temos a YOU, nossa Universidade Corporativa.📈 Queremos que você se desenvolva! Por isso, temos PDI (Plano de Desenvolvimento Individual), para você desenhar seus próximos passos com a gente, e Avaliações de Desempenho, para que você tenha clareza sobre o que esperamos de você.🧸 O NeoBaby é o nosso programa parental para recém mamães e papais!💵 Temos Programa de Indicação! Nos ajude a encontrar mais pessoas para ajudar a Neogrid a continuar crescendo e ganhe uma grana por isso. Se o seu propósito conversa com o nosso, vem crescer com a gente!",Neogrid Carreiras,vacancy_type_effective,,True,,,Brasil,https://neogridcarreiras.gupy.io/job/eyJqb2JJZCI6NTc5NjYyNiwic291cmNlIjoiZ3VweV9wb3J0YWwifQ==?jobBoardSource=gupy_portal,True,remote,True
6581216,2024-01-10T20:15:55.722Z,Pessoa Desenvolvedora PL (.NET) ,"Desde 2007 trabalhando com inovação, a Certsys se consolidou como uma forte parceira de Transformação Digital, apoiando empresas disruptivas por meio de soluções digitais completas e escaláveis alinhadas às principais tendências e necessidades do mercado. Temos uma cultura poderosa, conectados de ponta a ponta, colaborativos, ágeis e flexíveis para encarar o novo, transparentes em nossas ações e unidos por um grande propósito: Revolucionar negócios e impactar pessoas, resolvendo desafios complexos através da nossa cultura e tecnologia. Além disso, somos certificados pela GPTW pelo segundo ano consecutivo, sendo uma das melhores empresas para se trabalhar no Brasil.Somos a Certsys 🚀🤖Próximos dos clientes, apaixonados por tecnologia e pessoas (sim, aqui pensamos na sua evolução e carreira, vamos te desenvolver e cuidar da sua trilha de capacitação). Acreditamos na diversidade, equidade e inclusão de profissionais independente da sua deficiência, raça/ etnia, religião, gênero, orientação sexual, origem e constituição de família.Responsabilidades e atribuiçõesComo será seu dia a dia:  Participar da análise de requisitos;Colaborar com equipes internas para produzir design e arquitetura de softwares;Escrever códigos “limpos” e escaláveis usando linguagem de programação .NET;Testar e implementar aplicativos e sistemas;Revisar, atualizar, refatorar e depurar códigos;Aprimorar softwares existentes;Desenvolver documentação durante todo o ciclo de vida de desenvolvimento de softwares (SDLC). Requisitos e qualificaçõesDo que você precisa: Experiência comprovada como Desenvolvedor .NET e Angular ou Desenvolvedor de Aplicativos;Familiaridade com a estrutura ASP.NET, SQL Server e padrões de projeto/arquitetura (por exemplo, Model-View-Controller – MVC);Conhecimento de ao menos uma das linguagens .NET (por exemplo, C#, Visual Basic .NET) e HTML5/CSS3;Familiaridade com estilos de arquitetura/APIs (REST, RPC);Compreensão de métodos Ágeis;Excelentes habilidades de resolução de problemas e de comunicação;Auto-organização;Desjável: Bacharelado em Ciência da Computação, Engenharia ou área relacionada;Conhecimento em SQL.. Informações adicionaisCursos e Certificações:Inglês Intermediário;Certificações em .Net;Atuação em Bancos tradicionais e digitais.",Certsys,vacancy_type_effective,2024-01-31T00:00:00.000Z,False,São Paulo,São Paulo,Brasil,https://certsys.gupy.io/job/eyJqb2JJZCI6NjU4MTIxNiwic291cmNlIjoiZ3VweV9wb3J0YWwifQ==?jobBoardSource=gupy_portal,False,on-site,True
6593694,2024-01-10T20:00:33.711Z,Desenvolvedor de Sistemas - SIM TECH,"🚀 Somos amantes da inovação, investimos em tecnologias e soluções que vão alavancar nossos resultados. E para isso buscamos profissionais engajados em fazer um Martins melhor a cada dia, e que estejam dispostos a contribuir de maneira proativa com a transformação digital do melhor atacado do Brasil!!🚀 Se a sua visão está alinhada com a nossa, e você é um profissional que valoriza o relacionamento, o pensamento estratégico e quer ajudar a vender. Vem com a gente, se inscreve na vaga!Responsabilidades e atribuições✨ Realizar o desenvolvimento de funcionalidades de baixa complexidade no ambiente de programação, utilizando linguagem específica e técnicas de codificação, montagem de ambiente, testes unitários e funcionais, baseando-se no levantamento de requisitos visando atender as exigências dos usuários e mercado.✨ Implementar soluções paliativas e definitivas para registros de ocorrências de sistemas de baixo impacto no negócio, implementar alterações no código dos programas com o objetivo de garantir a continuidade e evitando os riscos e prejuízos ao negócio.✨ Realizar testes em condições operacionais simuladas, visando verificar se o programa executa corretamente dentro do especificado e com a performance adequada.Requisitos e qualificações✨ Ensino superior cursando (preferencialmente Sistemas de Informação, Engenharia da Computação, Ciências da Computação).✨ Banco de dados Oracle e SQL.✨ Conhecimentos em linguagem de programação: .NET, C#, Java.✨ Disponibilidade para trabalho presencial em Uberlândia (seg - sex 08:00 às 18:18).Informações adicionais💵 Salário fixo;😍 Convênio médico;😁 Convênio odontológico;💊 Convênio farmácia Vida Link;🏋️ Gympass e academia no Martins;🤑 Previdência privada;🎯 Elegível ao PPR;🚍 Vale Transporte;🍝 Vale alimentação;💻 Equipamento fornecido pela empresa;📚 Plataforma de cursos para contribuir no desenvolvimento da sua carreira.",Martins,vacancy_type_effective,2024-01-15T00:00:00.000Z,False,Uberlândia,Minas Gerais,Brasil,https://tecnologiamartins.gupy.io/job/eyJqb2JJZCI6NjU5MzY5NCwic291cmNlIjoiZ3VweV9wb3J0YWwifQ==?jobBoardSource=gupy_portal,True,on-site,True
6594178,2024-01-11T11:43:12.730Z,Dev Java Sr - Segmento Financeiro,"O que vamos construir juntos?Nesse projeto, trabalharemos juntos na transformação digital em um projeto financeiro focado em inovação.Nosso time é preocupado em propor as melhores soluções baseado em excelência técnica, pensando em alternativas que agreguem valor, com mindset ágil e cultura de colaboração. Buscamos pessoa desenvolvedora Back-end que seja engajado, proativo com disponibilidade e para concepção de novas iniciativas para squads de conta corrente e seguros, para atuar em produto do segmento financeiro.Responsabilidades e atribuiçõesNos ajude a desenhar a solução!Se você chegou até aqui e é uma pessoa que gosta de trabalhar com desenvolvimento, aprecia muito desafios, de implementar soluções baseadas em boas práticas e curte trabalhar em times que respeitam quem você é e as suas opiniões, você está mais perto de integrar nosso time DB.Atividades e posiçãoApoiar tecnicamente a liderança para o alcance das metas e resultados, sendo par do Tech Lead dentro da equipe;Atuar no desenvolvimento de APIs (Rest) e Aplicações (Java);Propor melhorias nas soluções existentes para propiciar melhor desempenho;Integrar o sistema com os novos componentes de software produzidos ou alteradosCriar e manter soluções de APIs e microserviços que serão consumidos;Construir, evoluir e escalar arquiteturas distribuídas e micro-serviços;Entender as necessidades do cliente e buscar soluções simples, de qualidade e escaláveis;Participar de ritos previstos na metodologia ágil;Preparar e executar implantações de sistemas;Solucionar impedimentos que afetem as entregas do time;Requisitos e qualificaçõesJava (Conhecimento em Java 8 ou superior);Spring Boot, Framework, Data, Cloud e Security;Arquitetura de microserviços e orientada a eventos;BBanco de dados (SQL e NoSQL)Testes unitários e testes de integração;Docker;Kubernetes;Kafka;Conceito Cloud;Clean Code;Metodologias ágeis;Conhecimento e experiência em sistemas financeiros, e em especial no Open Finance, serão considerados um diferencial.Requisitos comportamentaisProatividade;Boa comunicação;Sugerir e apoiar a implementação de melhorias nos processos e ferramentas da sua área de atuação;Participar ativamente de grupos internos que fomentem a inovação e a evolução da Instituição; Conhecer e agir de acordo com normas, políticas e valores institucionais.Informações adicionaisRemuneração compatível com o mercado; Vale Refeição; Plano de Saúde e Odontológico; Subsídio para o home-office; Seguro de Vida; Horário flexível; Dresscode: seja você;TotalPass: cuidado com a sua Saúde física e mental;Vaga 100% Remota.",DB,vacancy_type_effective,,True,,,Brasil,https://db.gupy.io/job/eyJqb2JJZCI6NjU5NDE3OCwic291cmNlIjoiZ3VweV9wb3J0YWwifQ==?jobBoardSource=gupy_portal,True,remote,True
6595258,2024-01-10T23:59:50.359Z,DEV JAVA PLENO,"A NAVA está em busca de uma Pessoa Desenvolvedora Java Pleno para fazer parte do nosso time de pessoas incríveis!  Por que trabalhar na NAVA?Somos uma empresa de tecnologia que atende as maiores companhias dos setores financeiro, seguros, meios de pagamento, telecomunicações, energia e varejo do país. Inspiramos nossos times a criar soluções para que essas companhias transformem e impactem positivamente o mundo.  Temos um time curioso, criativo, energético e inspirador, com grande foco nas pessoas para gerar inovação, transformação e crescimento. Dentro de um ambiente dinâmico e ágil, o nosso time está em expansão para acompanhar o crescimento exponencial da NAVA e dos nossos Clientes. Responsabilidades e atribuiçõesComo será o seu dia a dia?Desenvolver aplicações web e mobile utilizando a tecnologia JAVARealizar a manutenção e evolução de aplicações existentes.Trabalhar em conjunto com outros desenvolvedores, analistas e arquitetos de software.Participar de projetos de desenvolvimento de novos produtos e serviços.Manter-se atualizado com as últimas tendências tecnológicas.Requisitos e qualificaçõesO que esperamos de você?Java,Spring MVC,Spring Data,Spring Security,Spring Boot,Hibernate/JPA,MongoDB,Oracle,JDBC,PL/SQL.Informações adicionaisHorário de trabalho: ComercialModelo de trabalho para este projeto/cliente: Híbrido - 2x remotamente e 3x presencialmenteLocal de trabalho: Região da Av. Paulista/SPAlém de ser uma empresa certificada Great Place to Work, você vai encontrar na NAVA: ✅ Oportunidades de carreira 🚀✅ Liberdade para escrever seu próprio código 🏆✅ Diversidade e diferentes formas de ver o mundo 🌈✅ Comunidades que incentivam o crescimento de todos 📚✅ Treinamento In Company 💻✅ Um time incrível 😎✅ Empresa engajada no Pacto Global da ONU 💪🏼✅ Projetos inovadores 💡✅ Alta avaliação no Glassdoor 📣 ",NAVA | Technology for Business,vacancy_type_effective,,False,São Paulo,São Paulo,Brasil,https://nava.gupy.io/job/eyJqb2JJZCI6NjU5NTI1OCwic291cmNlIjoiZ3VweV9wb3J0YWwifQ==?jobBoardSource=gupy_portal,True,hybrid,True
6595246,2024-01-10T23:56:13.469Z,DEV JAVA SÊNIOR,"A NAVA está em busca de uma Pessoa Desenvolvedora Java Sênior para fazer parte do nosso time de pessoas incríveis!  Por que trabalhar na NAVA?Somos uma empresa de tecnologia que atende as maiores companhias dos setores financeiro, seguros, meios de pagamento, telecomunicações, energia e varejo do país. Inspiramos nossos times a criar soluções para que essas companhias transformem e impactem positivamente o mundo.  Temos um time curioso, criativo, energético e inspirador, com grande foco nas pessoas para gerar inovação, transformação e crescimento. Dentro de um ambiente dinâmico e ágil, o nosso time está em expansão para acompanhar o crescimento exponencial da NAVA e dos nossos Clientes. Responsabilidades e atribuiçõesComo será o seu dia a dia?﻿Desenvolver aplicações web e mobile utilizando a tecnologia JAVARealizar a manutenção e evolução de aplicações existentes.Trabalhar em conjunto com outros desenvolvedores, analistas e arquitetos de software.Participar de projetos de desenvolvimento de novos produtos e serviços.Manter-se atualizado com as últimas tendências tecnológicas.Requisitos e qualificaçõesO que esperamos de você?Java,Spring MVC,Spring Data,Spring Security,Spring Boot,Hibernate/JPA,MongoDB,Oracle,JDBC,PL/SQL.Informações adicionaisHorário de trabalho: ComercialModelo de trabalho para este projeto/cliente: Híbrido - 2x remotamente e 3x presencialmenteLocal de trabalho: Região da Av. Paulista/SPAlém de ser uma empresa certificada Great Place to Work, você vai encontrar na NAVA: ✅ Oportunidades de carreira 🚀✅ Liberdade para escrever seu próprio código 🏆✅ Diversidade e diferentes formas de ver o mundo 🌈✅ Comunidades que incentivam o crescimento de todos 📚✅ Treinamento In Company 💻✅ Um time incrível 😎✅ Empresa engajada no Pacto Global da ONU 💪🏼✅ Projetos inovadores 💡✅ Alta avaliação no Glassdoor 📣 ",NAVA | Technology for Business,vacancy_type_effective,,False,São Paulo,São Paulo,Brasil,https://nava.gupy.io/job/eyJqb2JJZCI6NjU5NTI0Niwic291cmNlIjoiZ3VweV9wb3J0YWwifQ==?jobBoardSource=gupy_portal,True,hybrid,True
6595243,2024-01-10T23:47:51.816Z,DEV FRONT-END ANGULAR PLENO,"A NAVA está em busca de uma Pessoa Desenvolvedora Front-End Angular para fazer parte do nosso time de pessoas incríveis!  Por que trabalhar na NAVA?Somos uma empresa de tecnologia que atende as maiores companhias dos setores financeiro, seguros, meios de pagamento, telecomunicações, energia e varejo do país. Inspiramos nossos times a criar soluções para que essas companhias transformem e impactem positivamente o mundo.  Temos um time curioso, criativo, energético e inspirador, com grande foco nas pessoas para gerar inovação, transformação e crescimento. Dentro de um ambiente dinâmico e ágil, o nosso time está em expansão para acompanhar o crescimento exponencial da NAVA e dos nossos Clientes. Responsabilidades e atribuiçõesComo será o seu dia a dia?O Desenvolvedor Front-End terá o papel de participar de toda a vida útil do sistema, deade a criação até a sustentação;Terá como função entender, debater e solucionar as demandas para desenvovimento.Requisitos e qualificaçõesO que esperamos de você?Experiência em tecnologias de desenvolvimento frontend (Javascript ES5+, TypeScript, HTML5 e CSS);Conhecimento no gerenciadores de tarefas (Webpack);Experiência prática com framework e bibliotecas Javascript de mercado Angular 8+;Experiência com pré-processadores CSS (Sass, Less etc);Conhecimento de arquitetura de projetos micro frontend, estrutura de dados, algoritmos e padrões de projeto de software;Domínio em desenvolvimento em orientação a objetos;Testes unitários, BDD e integração;Vivência com arquitetura REST;Ferramentas de versionamento (preferêncialmente git);Conhecimento em Azure DevOps;Conhecimento e vivência em Projetos em Metodologias Ágeis (Scrum, Kanban).Competências Desejadas:Experiência em projetos do ramo financeiro;Experiências com projetos de produtos digitais;Conhecimento básico de UI / UX Designer;Conhecimento em: NodeJS, CI/CD Azure, Docker, GraphQL, AWS: CloudFront, S3, API Gateway e Swagger;Conhecimento em Banco de dados (Oracle, SQL Server)Informações adicionaisHorário de trabalho: ComercialModelo de trabalho para este projeto/cliente: Híbrido - 2x remotamente e 3x presencialmenteLocal de trabalho: Região da Av. Paulista/SPAlém de ser uma empresa certificada Great Place to Work, você vai encontrar na NAVA: ✅ Oportunidades de carreira 🚀✅ Liberdade para escrever seu próprio código 🏆✅ Diversidade e diferentes formas de ver o mundo 🌈✅ Comunidades que incentivam o crescimento de todos 📚✅ Treinamento In Company 💻✅ Um time incrível 😎✅ Empresa engajada no Pacto Global da ONU 💪🏼✅ Projetos inovadores 💡✅ Alta avaliação no Glassdoor 📣 ",NAVA | Technology for Business,vacancy_type_effective,,False,São Paulo,São Paulo,Brasil,https://nava.gupy.io/job/eyJqb2JJZCI6NjU5NTI0Mywic291cmNlIjoiZ3VweV9wb3J0YWwifQ==?jobBoardSource=gupy_portal,True,hybrid,True
6594223,2024-01-10T21:35:27.447Z,Full Stack Developer Sr,"Nosso time Tech está crescendo! Venha fazer parte.Como Pessoa Desenvolvedora Full Stack você fará parte do nosso time de Tecnologia.  Será responsável por desenvolver e testar funcionalidade, componente e sistemas. Responsabilidades e atribuiçõesEm seu dia a dia, você será responsável por trabalhar com:Desenvolvimento de funcionalidades e soluções back-end;Implementação e manutenção de APIs (Application Programming Interfaces) para integração com sistemas externos.Escrever o código, realiza testes unitários e integração para garantir a qualidade do código.Colaboração com a equipe de front-end e outros desenvolvedores para garantir a integração correta dos sistemas.Resolução de problemas e depuração de código.Documentação do código e das soluções desenvolvidas.Acompanhamento das tendências e melhores práticas do desenvolvimento back-end.Requisitos e qualificaçõesPara essa vaga é necessário ter os seguintes conhecimentos:Linguagens de Programação:  - C# &gt; Avançado - JavaScript &gt; Avançado - HTML5, CSS3 &gt; Avançado  Frameworks:  - Blazor &gt; Básico - Razor &gt; Intermediário- React &gt; Intermediário - MVC 5.0 ou Superior &gt; Avançado - .NET 6.0 ou Superior &gt; Avançado - Scrum  Banco de Dados:  - SQL Server &gt; Intermediário - MongoDB &gt; Intermediário - CosmosDB &gt; Intermediário  Softwares e IDE´s:  - Visual Studio 2022 (superior) &gt; Intermediário - Visual Code &gt; Intermediário Demais conhecimentos:  - Clean Architecture &gt; Intermediário  - Github &gt; Intermediário Diferencial:CI/CDInformações adicionaisEtapas do Processo SeletivoPrezamos por um processo seletivo eficiente e descomplicado. Para essa vaga são essas etapas:-Inscrição/triagem;-Bate Papo com Gente &amp; Gestão;-Bate Papo Técnico com a Liderança Direta;Local:Nosso time de tecnologia trabalha remotamente, mas se você precisar ir ao escritório, estamos em São Paulo, Vila Olímpia.Benefícios:-Vale Refeição/Alimentação flexíveis - cartão Swille;-Assistência Médica;-Assistência Odontológica-Seguro de Vida;-Auxílio home office;-TotalPass;-Vittude;-Benefício dia do profissional de consórcio;-Taxa 0% em nossos produtos ( somente para colaboradores);-PPR - de acordo com metas estabelecidas no programa anual.E mais...-Parceria com instituição de ensino com desconto para cursos de Pós graduação;-Parceria com Sesc.",Mycon,vacancy_type_effective,2024-02-29T00:00:00.000Z,True,,,Brasil,https://mycon.gupy.io/job/eyJqb2JJZCI6NjU5NDIyMywic291cmNlIjoiZ3VweV9wb3J0YWwifQ==?jobBoardSource=gupy_portal,True,remote,True
6593529,2024-01-11T12:24:43.744Z,FullStack Developer Angular,"¡Sé parte de Stefanini!​En Stefanini somos más de 30.000 genios, conectados desde 41 países, haciendo lo que les apasiona y co-creando un futuro mejor.​Responsabilidades y atribucionesResponsabilidades:Desarrollar y mantener aplicaciones web utilizando marcos y lenguajes de programación modernos.Colaborar con diseñadores, gerentes de producto y otras partes interesadas para recopilar requisitos y traducirlos en especificaciones técnicas.Diseñar e implementar interfaces y experiencias fáciles de usar.Escriba código limpio, eficiente y mantenibleRealizar pruebas y depuraciones exhaustivas para garantizar la calidad y confiabilidad de las aplicaciones de software.Solucionar y resolver problemas informados por los usuarios o identificados durante las pruebas.Manténgase actualizado con las tendencias de la industria y las mejores prácticas en desarrollo web.Participar en revisiones de código para garantizar el cumplimiento de los estándares de codificación y las mejores prácticas.Colaborar con equipos multifuncionales para garantizar la entrega exitosa de proyectos.Contribuir a la mejora continua de los procesos y herramientas de desarrollo.Requisitos y calificacionesExperienica:Developer FullStack Angular / NestJS- Angular 14+ - NestJS - CI/CD (Cloudbees)- Sonarqube, Checkmarxk (SAST/SCA)- Autogestión- Proactividad y trabajo en equipo- Agilidad- RemotoInformaciones adicionalesCapacidad de Autogestión- Proactividad y trabajo en equipo- Agilidad- Remoto",STEFANINI LATAM,vacancy_type_effective,,False,Santiago,,Chile,https://stefaninilatam.gupy.io/job/eyJqb2JJZCI6NjU5MzUyOSwic291cmNlIjoiZ3VweV9wb3J0YWwifQ==?jobBoardSource=gupy_portal,True,on-site,True
