job_id,published_date,title,description,career_page_name,type,application_deadline,is_remote_work,city,state,country,job_url,disabilities,workplace_type,submitted
7132247,2024-05-07T20:47:44.416Z,Dev Java PL,"A NAVA está em busca de um Dev Java PL para fazer parte do nosso time de pessoas incríveis!  Por que trabalhar na NAVA?Somos uma empresa de tecnologia que atende as maiores companhias dos setores financeiro, seguros, meios de pagamento, telecomunicações, energia e varejo do país. Inspiramos nossos times a criar soluções para que essas companhias transformem e impactem positivamente o mundo.  Temos um time curioso, criativo, energético e inspirador, com grande foco nas pessoas para gerar inovação, transformação e crescimento. Dentro de um ambiente dinâmico e ágil, o nosso time está em expansão para acompanhar o crescimento exponencial da NAVA e dos nossos Clientes. ﻿Acolhemos as diferenças porque acreditamos que um ambiente diverso contribui para a inovação e uma sociedade mais justa e equânime e convidamos você à assumir esse compromisso junto com a gente.Responsabilidades e atribuiçõesComo será o seu dia a dia?Um ambiente desafiador, criativo e com muita demanda que oferece oportunidades para o crescimento e o aprimoramento de conhecimentos. É um ambiente que exige esforço e dedicação.Um ambiente onde os profissionais são constantemente estimulados a aprender e a se desenvolver, são confrontados com problemas e desafios que as fazem a pensar fora da caixa e a encontrar novas soluções. Isso pode ser muito estimulante e gratificante, pois permite que alcancem o seu potencial máximo.Requisitos e qualificaçõesO que esperamos de você?vivência no ramo financeiro.Conhecimentos Técnicos:Profissional atua como Desenvolvedor Java há 5 anos.Possui experiência atuando com : Maven, Jenkins, GIT, Integração contínua, Java, JDBC, JPA, Hibernate, Spring, Spring boot, Spring data, Spring rest, Microsserviços, Apache TomCat, Conhecimento em processosInformações adicionaisHorário de trabalho: 09h00 ás 18h00Modelo de trabalho para este projeto/cliente: híbrida 3x por semana presencialLocal de trabalho: Zona Sul Além de ser uma empresa certificada Great Place to Work, você vai encontrar na NAVA: ✅ Oportunidades de carreira 🚀✅ Liberdade para escrever seu próprio código 🏆✅ Diversidade e diferentes formas de ver o mundo 🌈✅ Comunidades que incentivam o crescimento de todos 📚✅ Treinamento In Company 💻✅ Um time incrível 😎✅ Empresa engajada no Pacto Global da ONU 💪🏼✅ Projetos inovadores 💡✅ Alta avaliação no Glassdoor 📣 ",NAVA | Technology for Business,vacancy_type_effective,2024-06-17T00:00:00.000Z,False,São Paulo,São Paulo,Brasil,https://nava.gupy.io/job/eyJqb2JJZCI6NzEzMjI0Nywic291cmNlIjoiZ3VweV9wb3J0YWwifQ==?jobBoardSource=gupy_portal,True,hybrid,True
7130120,2024-05-07T19:27:00.006Z,DEV Pleno Full Stack,"Estamos em busca de um desenvolvedor Full Stack para apoiar integralmente os projetos desenvolvidos internamente, que tenha atuação no ramo de Fintechs e/ou FIDCs.Você será a pessoa indicada tanto para dar suporte nas atividades de Front-end quanto nas de Back-end. Para fazer bem este trabalho, estamos buscando um perfil que seja flexível e que tenha a capacidade de dialogar com diferentes perfis de profissionais.Em última análise, seu trabalho será parte integrante de nossos esforços para garantir o sucesso da criação, do desenvolvimento e da implementação dos projetos.A Flowinvest é uma companhia especializada em aquisição e gestão de ativos creditícios empresariais.Nós acreditamos no capital no momento certo, na valorização de quem quer crescer.A equipe Flow possui colaboradores que são motivados a serem autênticos e impactarem a sua rede local.Responsabilidades e atribuiçõesEstar em constante contato tanto com os clientes internos e pares, para o levantamento de requisitos e para assegurar que as demandas solicitadas sejam atendidas;Garantir que todas as partes dos projetos estão se desenvolvendo de acordo com o cronograma previamente acordado com o cliente;Programar, codificar e testar as linguagens dos sistemas desenvolvidos;Identificar e corrigir bugs;Realizar a manutenção dos sistemas já existentes;Requisitos e qualificaçõesPré-requisito:Ensino superior completo em T.I. ou Ciências da Computação, Dados, Engenharia da Computação e afins;Certificações na área de desenvolvimento, sendo um diferencial ter o foco em linguagens de programação e mobiles;Experiência com ASP.NET / ASP.NET CORE | JSP/JSTL | Web Service (SOAP) | Windows Forms | Visual Studio, arquitetura em camadas, telerik;Bons conhecimentos em C# | Java | SQL | ORACLE Database;ADO.Net Dapper; SQL Server (Query, Tunning);Bons conhecimentos em JSE/JEE | Hibernate/NHibernate | .NET | MVC;Fortes habilidades de nível especializado em serviços Azure, incluindo serviço PaaS;Fortes habilidades práticas de codificação em Terraform e Groovy para construir pipeline de automação para implantação de recursos, vendas em equipe no Azure;Sólida experiência em engenharia de software;Experiência prática na construção de soluções usando vários serviços do Azure;Experiência prática em uma ou mais linguagens de programação, preferencialmente Python;Experiência prática no desenvolvimento de pipeline de infraestrutura como código agnóstico em nuvem usando Terraforma;Forte compreensão dos processos de desenvolvimento ágil e do conjunto de ferramentas Agile JIRA;Compreensão de microsserviços e desenvolvimento de aplicativos baseados em APIs REST;Compreensão do gerenciamento de código-fonte baseado em GIT, integração contínua;Práticas de Entrega Contínua (CI/CD) usando ferramentas como Bitbucket, Artifactory;Experiência no desenvolvimento de Políticas Azure;Experiência em implantação de plataforma Kubernetes multi-tenant;Compreensão do kernel Linux básico e sistema operacional de servidor de janela;Experiência em trabalhar com scripts bash e PowerShell;Deve ser capaz de resolver problemas de negócios complexos e apresentar recomendações aos gestão de forma eficaz;Bons conhecimentos em consumo de APIs;Ter conhecimento intermediário em inglês técnico;HabilidadesExcelente capacidade de diálogo com diferentes perfis de profissionais;Capacidade de tomar decisões e conduzir o grupo de trabalho / projetos (squads);Estar sempre atualizado sobre as novas tecnologias e tendências do mercado;Conseguir trabalhar com altas demandas;Ser proativo e participativo nas demandas e projetos em desenvolvimento;Formação e ExperiênciasConhecimento em banco de dados SQL;Conhecimento em versionamento de código;Conhecimento em Python;Experiência no segmento bancário, ou Fintechs, ou Fidcs;Experiência em gestão de projetos, Backlogs, metodologias ágeis;Desejável conhecimento em sistema Qprof ou similares;Informações adicionaisRemuneração como PJ - A combinar;Ambiente de trabalho dinâmico e colaborativo;Oportunidade de trabalhar em uma empresa em crescimento, com possibilidade de aprendizado e desenvolvimento profissional.Plataforma de educação para aprimoramento e desenvolvimento pessoal.Café da manhã na empresa;Bônus semestral de até 2 salários;",Flowinvest,vacancy_type_effective,,False,São Paulo,São Paulo,Brasil,https://flowinvest.gupy.io/job/eyJqb2JJZCI6NzEzMDEyMCwic291cmNlIjoiZ3VweV9wb3J0YWwifQ==?jobBoardSource=gupy_portal,False,on-site,True
7130521,2024-05-07T17:38:50.214Z,Dev Fullstack (React & PHP ) Sr - Segmento Financeiro (Híbrido em Lajeado),"O que vamos construir juntos?Nesse projeto, trabalharemos juntos na transformação digital em um projeto financeiro focado em inovação. Nosso time é preocupado em propor as melhores soluções baseado em excelência técnica, pensando em alternativas que agreguem valor, com mindset ágil e cultura de colaboração. Nós respeitamos a diversidade e acreditamos que times diversos contribuem para construir ideias mais inovadoras.Responsabilidades e atribuiçõesNos ajude a desenhar a solução!Se você chegou até aqui e é uma pessoa que gosta de trabalhar com desenvolvimento, aprecia muito desafios, de implementar soluções baseadas em boas práticas e curte trabalhar em times que respeitam quem você é e as suas opiniões, você está MUITO perto de integrar nosso time DB.Requisitos e qualificaçõesRequisitos para se candidatar a vaga:Testes unitários e integrados;Design de código, incluindo Clean Code, SOLID, KISS, YAGNI e DRY;Desenvolvimento ágil: Pair Programming, code review e git flow;Desenvolver APIs RESTful seguindo boas práticas, como uso correto de métodos HTTP, estrutura de URL, tratamento de erros e documentação adequada;Backend: PHP com framework Laravel, Banco de dados não relacional (MongoDB) e relacional (Postgres);Frontend: React com framework Next; Diferenciais:Experiência com ferramentas de CI/CD;Experiência em contextos de serviços distribuídos: Microsserviços e filas;Experiência com modelos arquiteturais (Ex: Arquitetura Limpa);Experiência em Automação com tecnologias E2E - funcional ou API;Informações adicionaisPor aqui você terá:· Vale iFood (alimentação e refeição);​· Aux. Home Office;​· Plano de Saúde; ​· Plano Odontológico;​· Day off de Aniversário;​· Seguro de Vida;​· Licença Maternidade e Paternidade estendida;​· Parcerias Educacionais· Alura· Total Pass - saúde e bem estar;· Cartão Flash;· Programas de Reembolso;",DB,vacancy_type_effective,,False,Lajeado,Rio Grande do Sul,Brasil,https://db.gupy.io/job/eyJqb2JJZCI6NzEzMDUyMSwic291cmNlIjoiZ3VweV9wb3J0YWwifQ==?jobBoardSource=gupy_portal,True,hybrid,True
7129438,2024-05-07T17:11:15.172Z,Dev Sênior - React e React Native (HÍBRIDA),"RELEVO LAB.Somos uma empresa de tecnologia com mais de 6 anos de atuação, vivemos e respiramos tecnologia, batalhamos incansavelmente para ser um lugar incrível para se trabalhar, onde as pessoas são tratadas com igualdade, gostem de trabalhar, se sintam em casa e esse é certamente o lugar onde queremos estar.Estamos à procura de pessoas do bem, comprometidas e que queiram crescer junto com a gente!Se você se enquadra neste perfil, é você que queremos!Responsabilidades e atribuiçõesO contratado estará envolvido em um time com metodologia ágil para a criação de micro apps em React Native. Será responsável por desenhar ou co-desenhar arquiteturas para apps web e garantir que sejam funcionais em dispositivos mobile. Deverá desenvolver com qualidade e segurança desde o início, envolvendo diversos aspectos de testes. Além disso, será responsável pela entrega de assets de apps usando CDNs. Jornada de trabalho: Segunda a Sexta, das 9h às 18h (1h de intervalo para almoço)Tipo de Vaga: HíbridoLocalidade: São Paulo - SPContratação: CLTTempo de alocação: 9 meses com possibilidade de extensão de contratoRequisitos e qualificaçõesO que queremos que você tenha:Experiência com desenvolvimento React e React NativeExperiência com metodologia ágilCriação de micro apps em React NativeNoção de arquiteturasDesenvolvimento para funcionamento em dispositivos mobileDesenvolver com qualidade desde o início, envolvendo mais de um aspecto de testes (unidade, contrato, integrado, comportamento funcional, etc).Preocupação com segurança - OWASP para web e mobileInglês AvançadoDiferencialEntrega de assets de apps usando CDNs - Akamai ou Cloudfront, tendo em vista compressão de arquivos, caching e outras características de produção importantes para o desempenho das UIs.Informações adicionaisO que oferecemos:Pacote de remuneração e benefícios competitivo com o mercado.Gostou? Acesse nossa página de carreira em https://relevo.gupy.io/Super Importante!Se os seus conhecimentos forem aderentes à vaga, é tudo o que importa.Aqui nós abraçamos a diversidade e contratamos pessoas com capacidade e vontade de transformar, independente de qual seja a sua localização, raça, cor, religião, identidade de gênero, orientação sexual ou formação.",Relevo,vacancy_type_effective,,False,São Paulo,São Paulo,Brasil,https://relevo.gupy.io/job/eyJqb2JJZCI6NzEyOTQzOCwic291cmNlIjoiZ3VweV9wb3J0YWwifQ==?jobBoardSource=gupy_portal,True,hybrid,True
7130061,2024-05-07T17:02:26.954Z,Dev Sênior - Node.js (HÍBRIDA),"RELEVO LAB.Somos uma empresa de tecnologia com mais de 6 anos de atuação, vivemos e respiramos tecnologia, batalhamos incansavelmente para ser um lugar incrível para se trabalhar, onde as pessoas são tratadas com igualdade, gostem de trabalhar, se sintam em casa e esse é certamente o lugar onde queremos estar.Estamos à procura de pessoas do bem, comprometidas e que queiram crescer junto com a gente!Se você se enquadra neste perfil, é você que queremos!Responsabilidades e atribuiçõesO contratado estará envolvido em todas as etapas do desenvolvimento de apps web, desde a arquitetura até a entrega final. Isso inclui trabalhar em equipe para fazer entregas rápidas e de qualidade, desenvolver apps que funcionem em dispositivos mobile, realizar vários tipos de testes para garantir a qualidade do produto final, e ter preocupações de segurança desde o início do desenvolvimento. Jornada de trabalho: Segunda a Sexta, das 9h às 18h (1h de intervalo para almoço)Tipo de Vaga: HíbridoLocalidade:  São Paulo-SPContratação: CLTTempo de alocação: 9 meses com possibilidade de extensão de contratoRequisitos e qualificaçõesO que queremos que você tenha:Desenhar arquiteturas para apps web com uso de componentes e comunicação por eventos em javascriptHabilidade de trabalhar em time com entregas rápidas e com qualidade consistente, tendo o desenvolvimento guiado por métricasDesenvolver apps de modo que funcionem em dispositivos mobile quando usadas como componentes embutidos (Webview)Desenvolver com qualidade desde o início, envolvendo mais de um aspecto de testes (unidade, contrato, integrado, comportamento funcional, etc)Desenvolver com preocupações de segurança desde o início, procurando usar OWASP para web e mobile, como referências de segurançaInglês AvançadoDiferenciais:Entrega de assets de apps usando CDNs, como Akamai ou Cloudfront, tendo em vista compressão de arquivos, caching e outras características de produção importantes para o desempenho e usabilidade das UIsInformações adicionaisO que oferecemos:Pacote de remuneração e benefícios competitivo com o mercado.Gostou? Acesse nossa página de carreira em https://relevo.gupy.io/Super Importante!Se os seus conhecimentos forem aderentes à vaga, é tudo o que importa.Aqui nós abraçamos a diversidade e contratamos pessoas com capacidade e vontade de transformar, independente de qual seja a sua localização, raça, cor, religião, identidade de gênero, orientação sexual ou formação.",Relevo,vacancy_type_effective,,False,São Paulo,São Paulo,Brasil,https://relevo.gupy.io/job/eyJqb2JJZCI6NzEzMDA2MSwic291cmNlIjoiZ3VweV9wb3J0YWwifQ==?jobBoardSource=gupy_portal,True,hybrid,True
7129669,2024-05-07T15:27:10.610Z,DEV RPA IBM Operational Decision Manager SR,"A NAVA está em busca de uma Pessoa Desenvolvedor RPA IBM Operational Decision Manager Sênior para fazer parte do nosso time de pessoas incríveis!  Por que trabalhar na NAVA?Somos uma empresa de tecnologia que atende as maiores companhias dos setores financeiro, seguros, meios de pagamento, telecomunicações, energia e varejo do país. Inspiramos nossos times a criar soluções para que essas companhias transformem e impactem positivamente o mundo.  Temos um time curioso, criativo, energético e inspirador, com grande foco nas pessoas para gerar inovação, transformação e crescimento. Dentro de um ambiente dinâmico e ágil, o nosso time está em expansão para acompanhar o crescimento exponencial da NAVA e dos nossos Clientes. ﻿Acolhemos as diferenças porque acreditamos que um ambiente diverso contribui para a inovação e uma sociedade mais justa e equânime e convidamos você à assumir esse compromisso junto com a gente.Responsabilidades e atribuiçõesComo será o seu dia a dia?Desenvolvimento de Soluções RPA ODM: Será responsável pelo desenvolvimento e implementação de soluções de automação de processos usando a plataforma IBM ODM RPA, desde a análise inicial até a entrega final.Integração com CloudPak: Colaborar com equipes de integração para implementar e integrar soluções de automação em ambientes CloudPak, garantindo uma infraestrutura eficiente e escalável.Gestão de Dados: Utilizar seu conhecimento em banco de dados para integrar dados e informações relevantes aos processos automatizados, garantindo precisão e consistência nas operações.Comunicação Efetiva: Interagir com clientes e stakeholders para entender requisitos e expectativas, comunicar progresso do projeto e garantir alinhamento de objetivos.Resolução de Problemas: Aplicar habilidades analíticas para identificar e solucionar problemas complexos durante o desenvolvimento e implementação de soluções RPA.Requisitos e qualificaçõesO que esperamos de você?Experiência comprovada em desenvolvimento RPA IBM Operational Decision Manager;Conhecimento profundo em Automação de Processos de Negócios;Experiência em integração com CloudPak ou outras plataformas de nuvem é altamente desejável;Forte conhecimento em banco de dados para manipulação e integração de dados.Informações adicionaisHorário de trabalho: ComercialModelo de trabalho para este projeto/cliente: RemotoAlém de ser uma empresa certificada Great Place to Work, você vai encontrar na NAVA: ✅ Oportunidades de carreira 🚀✅ Liberdade para escrever seu próprio código 🏆✅ Diversidade e diferentes formas de ver o mundo 🌈✅ Comunidades que incentivam o crescimento de todos 📚✅ Treinamento In Company 💻✅ Um time incrível 😎✅ Empresa engajada no Pacto Global da ONU 💪🏼✅ Projetos inovadores 💡✅ Alta avaliação no Glassdoor 📣 ",NAVA | Technology for Business,vacancy_type_effective,,True,,,Brasil,https://nava.gupy.io/job/eyJqb2JJZCI6NzEyOTY2OSwic291cmNlIjoiZ3VweV9wb3J0YWwifQ==?jobBoardSource=gupy_portal,True,remote,True
7129149,2024-05-07T14:37:56.247Z,DEV JAVA c/ ANGULAR PLENO,"A NAVA está em busca de uma Pessoa Desenvolvedora Java FullStck Pleno para fazer parte do nosso time de pessoas incríveis!  Por que trabalhar na NAVA?Somos uma empresa de tecnologia que atende as maiores companhias dos setores financeiro, seguros, meios de pagamento, telecomunicações, energia e varejo do país. Inspiramos nossos times a criar soluções para que essas companhias transformem e impactem positivamente o mundo.  Temos um time curioso, criativo, energético e inspirador, com grande foco nas pessoas para gerar inovação, transformação e crescimento. Dentro de um ambiente dinâmico e ágil, o nosso time está em expansão para acompanhar o crescimento exponencial da NAVA e dos nossos Clientes. ﻿Acolhemos as diferenças porque acreditamos que um ambiente diverso contribui para a inovação e uma sociedade mais justa e equânime e convidamos você à assumir esse compromisso junto com a gente.Responsabilidades e atribuiçõesComo será o seu dia a dia?﻿Requisitos e qualificaçõesO que esperamos de você?Spring MVC,Spring Data,Spring Security,Spring Boot,JavaAngularHibernate/JPA,MongoDB,Oracle,JDBC,Vue.Js eBootstrapRabbitMQRequisitos desejáveis:PL/SQLDataDogCobertura de testesInformações adicionaisHorário de trabalho: ComercialModelo de trabalho para este projeto/cliente: Híbrido (3 vezes presencialmente e 2 vezes remotamente)Local de trabalho: Região da Av. Paulista (São Paulo/SP)Além de ser uma empresa certificada Great Place to Work, você vai encontrar na NAVA: ✅ Oportunidades de carreira 🚀✅ Liberdade para escrever seu próprio código 🏆✅ Diversidade e diferentes formas de ver o mundo 🌈✅ Comunidades que incentivam o crescimento de todos 📚✅ Treinamento In Company 💻✅ Um time incrível 😎✅ Empresa engajada no Pacto Global da ONU 💪🏼✅ Projetos inovadores 💡✅ Alta avaliação no Glassdoor 📣 ",NAVA | Technology for Business,vacancy_type_effective,,False,São Paulo,São Paulo,Brasil,https://nava.gupy.io/job/eyJqb2JJZCI6NzEyOTE0OSwic291cmNlIjoiZ3VweV9wb3J0YWwifQ==?jobBoardSource=gupy_portal,True,hybrid,True
7127946,2024-05-07T12:41:59.013Z,Engenheiro Dev Mobile Sr.,"A Leega é uma empresa focada no atendimento eficiente e inovador em seus clientes. Isso não poderia ser diferente com o nosso principal combustível: as pessoas!  Nossa cultura é inspiradora e nossos valores estão presentes no dia a dia: ética e transparência, excelência de qualidade, trabalho em equipe, responsabilidade econômica, social e ambiental, relações humanas e credibilidade.Buscamos profissionais inovadores que sejam movidos por desafios e focados em resultados.Se você busca uma empresa dinâmica e parceira e que investe em seus colaboradores através de capacitação constante, a Leega é o lugar para você!Ficaremos muito felizes em ter você em nosso time. Venha fazer parte da nossa história e da construção do nosso futuro. Cadastre-se agora mesmo em nossas vagas!Responsabilidades e atribuiçõesColaborar com times multidisciplinaresParticipar das cerimônias junto com os demais integrantes da equipePossuir visão clara de todo o ciclo de desenvolvimento de softwareElaborar e conduzir refinamentos técnicos juntamente com a equipe de engenheiros e tech lead, avaliando sempre os riscos e impactos das soluções voltadas para desempenho, escalabilidade, segurança etc.Desenvolver e sustentar soluções pertinentes ao escopo do timeAuxiliar e conduzir o processo de release da App LiveloAtuar na concepção e sustentação dos testes automatizadosRequisitos e qualificaçõesEnsino superior completoExperiência em desenvolvimento de aplicativos mobile na linguagem de programação (React Native)Conhecimento em Flipper (ferramenta de depuração de código)Experiênca em Apis RestExperiência em Hooks, Redux, Context APIExperiência com Git e Versionamento de CódigoExperiência de Clean Code, Clean Architecture e ModularizaçãoExperiência com Html e CSSExperiência com Javascript/TypescriptConhecimento em agilidade (Scrum, Kanban)Conhecimento no Firebase (Remote Config)Experiência com observabilidade de software (Dynatrace, Grafana, CrashLytics)Experiência com testes unitáriosExperiência com Selenium, Ruby|Cucumber ou framework semelhante para testes automatizadosConhecimento em padrões de qualidade (Pirâmide de testes)Diferencial:Conhecimento em Design Patterns | SolidConhecimento em Atomic Design | StoryBookExperiência com desenvolvimento Backend (Java Sprint e/ou Node)Conhecimento em arquitetura de microsserviçosConhecimento em bancos de dados relacionais e não relacionaisExperiência com desenvolvimento Frontend (React e/ou Next)Conhecimento em arquitetura de microfrontendsInformações adicionaisProfissional seguirá o calendário de SP100% Remoto",Leega Consultoria,vacancy_type_effective,,True,,,Brasil,https://leega.gupy.io/job/eyJqb2JJZCI6NzEyNzk0Niwic291cmNlIjoiZ3VweV9wb3J0YWwifQ==?jobBoardSource=gupy_portal,False,remote,True
7109958,2024-05-07T18:49:20.606Z,DESENVOLVEDOR FRONT END PL,"Somos a maior multinacional brasileira e estamos entre as 100 maiores empresas de TI do mundo.Estamos presentes em 41 países com +30k colaboradores. A Stefanini tem como principal objetivo auxiliar os clientes a encontrar, por meio de soluções personalizadas, a maneira ideal para alcançar seus desafios, impulsionando a inovação digital.E queremos mais!Responsabilidades e atribuiçõesAtividades:• Participar de reuniões de projeto técnico com líderes técnicos e arquitetos de software e propor novas abordagens.• Participar de convenções de desenvolvimento e definição de padrões para projetos.• Entregar soluções de software de alta qualidade utilizando as melhores práticas, tornando-as eficientes, de manutenção e testáveis.• Participar do design técnico para novos requisitos.• Participar como coaching de equipe e transferência de conhecimento.• Trabalhar em conjunto com outras equipes para melhorar a qualidade do software em todos os níveis (Devops, Architecture,Quality Assurance, Business Analysis).• Participar de cerimônias ágeis (Daily meetings,Planning Retrospective)• Participar de processos de pesquisa e desenvolvimento, desenvolvendo provas de conceitos sobre novas tecnologias.• Para participar da estimativa de histórias de usuários.• Manter comunicação Client-face quando necessário.• Participar do processo de revisão de códigoRequisitos e qualificaçõesEnsino Superior Completa.Informações adicionaisO que te oferecemos:🍛 Vale Alimentação ou Vale Refeição;👨🏼‍🎓 Desconto em cursos, universidades e instituições de idiomas; 📚 Academia Stefanini - plataforma com cursos online, gratuitos, atualizados e com certificado; 🗣 Mentoring;🏫 Auxílio Creche; 💉 Clube de vantagens para consultas e exames;🏥 Assistência Médica;🦷Assistência Odontológica; 💰 Clube de vantagens e descontos nos melhores estabelecimentos;👂🏾 Atendimento psicológico online ao colaborador e seus dependentes;🛫 Clube de viagens;🐶 Convênio para Pet;e muito mais...",Stefanini Group,vacancy_type_effective,,False,Barueri,São Paulo,Brasil,https://stefanini.gupy.io/job/eyJqb2JJZCI6NzEwOTk1OCwic291cmNlIjoiZ3VweV9wb3J0YWwifQ==?jobBoardSource=gupy_portal,True,hybrid,True
