job_id,published_date,title,description,career_page_name,type,application_deadline,is_remote_work,city,state,country,job_url,disabilities,workplace_type,submitted
6693630,2024-03-12T21:04:04.630Z,14489-Analista Desenvolvedor Mobile,"Na Global Hitss, a inovação é o nosso combustível, a curiosidade é o nosso motor e o respeito pelo cliente é o nosso guia. Se você é movido pela paixão em criar soluções tecnológicas disruptivas, se busca constantemente desafios que ampliem os limites do possível e se acredita que colocar o cliente em primeiro lugar é a chave para o sucesso, então você está no lugar certo.Queremos pessoas que se destaquem, que pensem fora da caixa e estejam dispostas a desbravar novos horizontes. Aqui, cada ideia é valorizada, cada pergunta é incentivada e cada desafio é encarado como uma oportunidade de aprendizado e crescimento.Junte-se a nós e faça parte de uma cultura vibrante, onde a inovação é alimentada pela curiosidade incessante e onde o respeito pelo cliente permeia todas as nossas ações. Aqui, você terá a liberdade de explorar suas habilidades, colaborar com mentes brilhantes e transformar o futuro da tecnologia.Se você está pronto para fazer parte de uma empresa que acredita que o talento é a chave para o sucesso, envie seu currículo e junte-se à nossa equipe.Estamos ansiosos para conhecer você e impulsionar juntos a próxima geração de soluções tecnológicas.Venha ser um Hit!Responsabilidades e atribuiçõesPrincipais atribuições:﻿Desenvolver funcionalidades com qualidade e manutenibilidade; Avaliar, discutir e definir arquiteturas de sistemas novos e propor melhorias para os atuais, promovendo a coesão técnica e a consistência dos processos de negócio como base para solucionar os desafios;Atuar com métodos de gestão ágil e com melhoria contínua.Requisitos e qualificaçõesRequisitos necessários:Nível Superior Cursando;Inglês intermediário;Experiência com API level 19;Experiência em realizar a integração com APIs RESTfull;Experiência com a aplicação de versionamento com Git;Experiência com a linguagem Kotlin;Experiência com aplicativos em Android nativo;Experiência do ciclo de vida da plataforma Android;Experiência em Android X. Requisitos desejáveis:Conhecimento da linguagem Java;Conhecimento com a realização de testes (JUnit, Mockito), code review, integração contínua, entre outros.Conhecimento na arquitetura MVVM e Clean Architecture;Conhecimento nas práticas desenvolvimento SOLID, KISS e DRY;Conhecimento em construção de UI personalizada Contribuindo com a evolução do design system;Conhecimento com gerenciador de projeto gradle. Informações adicionaisQuer conhecer todas as nossas vagas? Acesse a nossa página:Global Hitss - Trabalhe Conoscohttps://globalhitss.gupy.io/Importante: Todas as nossas vagas são elegíveis para profissionais com deficiência, equidade de gênero e raça/ etnia.",GLOBAL HITSS,vacancy_type_effective,,False,São Paulo,São Paulo,Brasil,https://globalhitss.gupy.io/job/eyJqb2JJZCI6NjY5MzYzMCwic291cmNlIjoiZ3VweV9wb3J0YWwifQ==?jobBoardSource=gupy_portal,True,hybrid,True
6828582,2024-03-12T20:57:06.378Z,Desenvolvedor Netsuite,"Nesta posição você será responsável por desenvolver scripts Javascript para processamento de dados, criação e edição de interfaces gráficas. Aqui você se reinventa, expande os horizontes, começa sua carreira com grandes evoluções e tem a oportunidade de usar todo o poder dos dados para transformar positivamente a vida das pessoas e empresas. Responsabilidades e atribuiçõesTraduzir requisitos do usuário em soluções técnicasCriar soluções sobre a plataforma NetsuiteTrabalhar em problemas de escopo moderado, onde a análise da situação ou dos dados requer uma revisão de vários fatores de negócioDesenvolvimento de scripts Javascript Criação de Suitlet, Restlet, MapReduce, MassUpdate, Client, UserEvent, Module, Portlet e WorkFlowAction.Criação de registros, formulários, sublistas, buscas salvas e bundles.Requisitos e qualificaçõesEnsino superior em áreas de técnologia.Sólido conhecimento no sistema NetsuiteLinguagem de programação: Javascript e API's REST.Informações adicionaisNossos benefícios:Cuidamos bem dos nossos Quoders, então oferecemos um pacote completo de benefícios:Alimentação, aqui temos VR e VA, flexível, você pode dividir como quiser.Saúde: temos Assistência Médica Bradesco extensível a dependentes , com coparticipação.Assistência Odontológica MetLife.Pensando no seu bem-estar também oferecemos Auxílio Academia.Auxílio Creche para crianças de até 2 anos de idade.Seguro de Vida.PLR Anual que é pago conforme atingimento das metas estabelecidas.Para os Quoders que estão em modelo de trabalho Híbrido oferecemos Auxílio Mobilidade (estacionamento e gasolina), e para quem está remoto temos o Auxílio Home Office.Pensando no seu futuro oferecemos a Previdência Privada, para que você guarde seu dinheiro com segurança.E para o seu Desenvolvimento temos a UniQuod com cursos incríveis, além das parcerias com várias instituições de ensino.Quer ser um Quoder? Então se candidate a nossas vagas e venha fazer parte desse time inovador!!!",Quod,vacancy_type_effective,,True,,,Brasil,https://vempraquod.gupy.io/job/eyJqb2JJZCI6NjgyODU4Miwic291cmNlIjoiZ3VweV9wb3J0YWwifQ==?jobBoardSource=gupy_portal,True,remote,True
6875305,2024-03-12T20:52:00.481Z,Desenvolvedor Front-end (Presencial ) -Pleno ,"Um Desenvolvedor Front-end é um profissional de tecnologia da informação responsável por criar uma interface visual e interativa da plataforma BemAgro. Esse profissional trabalha em conjunto com designers, desenvolvedores back-end e outros membros da equipe para garantir que a experiência do usuário seja a mais agradável e funcional possívelResponsabilidades e atribuições1.       Desenvolvimento de interfaces: Criar layouts atraentes e responsivos usando linguagens de marcação (HTML), estilos (CSS) e interatividade (JavaScript e typeScript), seguindo as diretrizes e designs fornecidos pela equipe de produtos.2.       Otimização de desempenho: Garantir que a plataforma ou aplicativo tenha um carregamento rápido e uma execução suave em diferentes dispositivos e navegadores, buscando sempre o melhor desempenho possível.3.       Responsabilidade: Assegurar que a interface se adapte de forma adequada a diferentes tamanhos de tela, proporcionando uma experiência consistente tanto em computadores de mesa quanto em dispositivos móveis.4.       Testes e resolução de problemas: Realizar testes rigorosos para identificar bugs, problemas de compatibilidade e outras questões relacionadas à interface do usuário, e corrigi-los de maneira eficiente.5.       Colaboração: Trabalhe em equipe, comunique-se com desenvolvedores back-end, designers e outros stakeholders para garantir uma integração harmoniosa das partes e a entrega das soluções de alta qualidade.6.       Aprendizado contínuo: Manter-se atualizado sobre as tendências e inovações no campo do desenvolvimento front-end, buscando constantemente aprimorar suas habilidades técnicas e conhecimento das melhores práticas.Requisitos e qualificações  Conhecimentos técnicos: Domínio das linguagens web, como HTML, CSS e JavaScript.   Experiência prévia: É comum que os candidatos a essa função tenham alguma experiência prévia em desenvolvimento front-end, seja em projetos pessoais ou profissionais.   Habilidades de design: Embora o foco principal seja a implementação da interface, um bom Desenvolvedor Front-end deve ter noções básicas de design para criar layouts atraentes e funcionais.   Resolução de problemas: Capacidade de identificar e resolver problemas de forma eficiente, além de testar e depurar o código para garantir a qualidade do produto.   Conhecimento de protocolos de comunicação como HTTP, HTTPS e REST.   Familiaridade com ferramentas de controle de versão, como Git.   Habilidades de resolução de problemas e depuração de código.   Conhecimento em metodologia ágil.   Domínio com frameworks (Angular) e bibliotecas relevantes (leaflet,turf).Informações adicionaisSalário competitivoBenefícios corporativosOportunidade de trabalhar em uma empresa inovadora",BemAgro,vacancy_type_effective,,False,Ribeirão Preto,São Paulo,Brasil,https://bemagro.gupy.io/job/eyJqb2JJZCI6Njg3NTMwNSwic291cmNlIjoiZ3VweV9wb3J0YWwifQ==?jobBoardSource=gupy_portal,False,on-site,True
6875199,2024-03-12T20:45:00.356Z,DESENVOLVEDOR FULLSTACK PLENO JAVA/ANGULAR,"Ouvir, criar e inspirar a transformação digital dos nossos clientes é o que nos motiva.crDe pessoas para pessoas 😍Acreditamos que, mais do que tecnologia, a transformação digital é sobre como as pessoas conduzem as mudanças nas empresas. E por entender isso, o fator humano é o que nos faz evoluir e modernizar processos.Não é somente mais uma oportunidade ... e sim um convite para você fazer parte dessa história. Somos certificadas pela GPTW e estamos entre as 50 melhores empresas para se trabalhar no Rio de JaneiroNa iBlue Consulting você vai trabalhar com uma equipe multidisciplinar, que é responsável por alavancar o crescimento do negocio através das nossas pessoas. 🚀Responsabilidades e atribuiçõesComo será o seu dia a dia 👩‍💻Utilizar o framework para criar serviços, incluindo a implementação de lógica de negócios, gerenciamento de dados, segurança e integração com outros sistemas.Configurar e gerenciar dependências, incluindo extensões e bibliotecas externas permitidas.Desenvolver APIs RESTful;Realizar testes unitários e de integração para garantir a qualidade e a estabilidade do código.Implantar aplicativos em ambientes de produção;Requisitos e qualificaçõesO que esperamos de você 🧐Ensino superior completo em tecnologia;Back-end: Java (Spring Boot) e Maven Front-end: Angular, Bootstrap, Typescript e Leaflet Banco de dados: Oracle (Dados tabulares) Hospedagem: WildflyGitlab, Docker, Mantis, Trello, Oracle SQL Developer e PgadminDiferenciais:Inglês AvançadoInformações adicionaisO que você terá do lado azul 🚀💙CLT 👇Programa de Sáude e Bem-Estar 🧘‍♀️🧘‍♂️Plano de Saúde Amil (pra você é por nossa conta);Seguro de Vida;Plano de Academias TotalPass.Para apoiar o seu dia a dia 😁Notebook de última geração;Te damos a liberdade de escolha: incluir os valores de VR e VA no cartão Flash modalidade FLEX para você utilizar do jeito que você quiser;Bônus por indicação de candidatos;Bônus Anual: Até um salário, de acordo com sua performance na avaliação de desempenho e atingimento de metas;Convênio Financeira Creditas.Se você é do Rio de Janeiro - Sexta é o dia Happy Hour a partir das 17:00 no nosso escritório.Para sua carreira🚀Avaliação de Desempenho Anual com PDI – Plano de Desenvolvimento Individual;Treinamentos Udemy e SAS; Certificações (AWS, Microsoft e IBM);Parcerias educacionais (com possibilidade de ajuda de custo atrelado a sua avaliação de desempenho e PDI)Trilha de carreira estruturada Y ( aqui você pode escolher o caminho para ser Gestor ou Especialista)",iBlue Consulting,vacancy_type_effective,,True,,,Brasil,https://ibluetech.gupy.io/job/eyJqb2JJZCI6Njg3NTE5OSwic291cmNlIjoiZ3VweV9wb3J0YWwifQ==?jobBoardSource=gupy_portal,True,remote,True
6875143,2024-03-12T20:43:29.530Z,Desenvolvedor Back-end (Presencial ) -Pleno ,"No time Plataforma da BemAgro, nossa missão é viabilizar a agricultura de precisão e construir uma plataforma da próxima geração, que permitirá o planejamento, monitoramento e gerenciamento da lavoura de forma fácil e automatizada. Aqui na BemAgro, temos orgulho de nossa missão. Nós acreditamos no potencial do agronegócio, e sabemos que é a partir dele que o mundo se sustenta. Acreditamos que é possível produzir mais, agredindo menos a natureza. Nosso maior objetivo é permitir a agricultura mais eficiente e sustentável através da tecnologia de ponta e acessível a todos os produtores.Para isso, buscamos uma pessoa Desenvolvedora de Backend que compartilhe do mesmo propósito que o nosso. Alguém faminta pela inovação e pronta para enfrentar desafios de transformar o agronegócio por meio da tecnologia.Junte-se a nós, e vamos transformar o agro do Brasil e do mundo!Responsabilidades e atribuiçõesSuas atividades envolverão desde a pesquisa e entendimento do contexto para o qual a plataforma irá servir, prototipação, desenvolvimento e implantação da plataforma.Buscar pelas melhores soluções para o produto sendo desenvolvido;Ser proativo e estar sempre atento a melhorias contínuas;Manter painel de tarefas atualizado no JIRA;Manter as boas práticas de desenvolvimento e de versionamento GIT;Manter documentado os fluxos e automações desenvolvidas;Ser capaz de comunicar de forma clara e objetiva com stakeholders.Requisitos e qualificaçõesPHP;Framework Laravel;MySQL;Controle de versão (GIT).Habilidade de resolver problemas complexos com transparência, seja de forma autônoma ou em equipe;Aberto a aprender sobre a tecnologia aplicada ao agro;﻿﻿👉 DIFERENCIALExperiência com automação em infraestrutura Cloud (Oracle, AWS);Noção em desenvolvimento FullStack;Experiência com trabalho em equipe;Perfil atento para identificar oportunidades e capacidade de apresentar propostas de soluções.Informações adicionaisSalário competitivoBenefícios corporativosOportunidade de trabalhar em uma empresa inovadora",BemAgro,vacancy_type_effective,,False,Ribeirão Preto,São Paulo,Brasil,https://bemagro.gupy.io/job/eyJqb2JJZCI6Njg3NTE0Mywic291cmNlIjoiZ3VweV9wb3J0YWwifQ==?jobBoardSource=gupy_portal,False,on-site,True
6874628,2024-03-12T19:51:25.923Z,Desenvolvedor .NET C# ,"Seja bem-vindo a WISE!Somos uma empresa que desenvolve soluções em informática para organizações dos mais diversos portes e atividades. Operamos com dinamismo e inovação, oferecendo soluções específicas que otimizam processos, implementam ou reorganizam todo o sistema de informação das empresas. Oferecemos acesso rápido a informações essenciais para a tomada de decisões, gerando mais produtividade, agilizando processos e reduzindo custos para os nossos clientes. Nossa sede está localizada em Curitiba/PR, mas atuamos em todo o Brasil em nossos clientes e através do Home Office.Se Você é engajado, dinâmico, ágil, apaixonado por tecnologia, gosta de fazer a diferença no que faz, busca desenvolvimento profissional constante e uma empresa com bom clima de trabalho. O seu lugar é na WISE!Nossa empresa é voltada para as melhores práticas de desenvolvimento de software. Os projetos da WISE são diversificados e oferecem oportunidade para adquirir novos conhecimentos e atuar com várias tecnologias. Valorizamos novas ideias, criatividade, autonomia, companheirismo e bom humor. Seja Wise e venha fazer parte do nosso time!#vemprawise #sejawise #bewise #desenvolvedordotnetResponsabilidades e atribuiçõesProgramação de software existentes/novos. Análise da demanda e construção de interfaces e programação de APIs. Responsável para projetar e sustentar aplicações dos clientes da Wise. Seguir documentação funcional escrita pelo cliente ou por áreas da empresa.Atuação será prioritariamente em novos projetos, mas eventualmente com tarefas de sustentação.Revisar e refatorar os códigos existentes em códigos de alta qualidade.Projetar e desenhar códigos que sejam confiáveis e reutilizáveis.Garantir a melhor performance e usabilidade das aplicações.Saber identificar e corrigir gargalos, realizar debugs e fixes.Junto com o restante da equipe, ajudar a manter a qualidade, organização e automação de toda a aplicação.Assim, o compromisso com a solução colaborativa dos problemas, designs sofisticados e com a qualidade do produto são essenciais para essa posiçãoRequisitos e qualificaçõesO que você precisa ter para esta função: Domínio nas linguagens C#, ASP.NET Core 5 ou SuperiorSólidos conhecimentos com Entity Framework 6 ou superiorConstrução de soluções RESTfull e uso da ferramenta AutorestExperiência com desenvolvimento de Web API, Rest e SOAPExperiência em SQL Server e MySQLExperiência em VISUAL STUDIO C#Experiência em aplicações MVCExperiência em linguagem ASP.NetExperiência em ferramentas de controle de versão (GIT)Conhecimento de Design Patterns, Testes Unitários, GraylogVivência com metodologias ágeis.Alta capacidade de análise e resolução de problemas.Atuação será prioritariamente em novos projetos, mas eventualmente com tarefas de sustentação.Comportamental: facilidade de trabalho em equipe, iniciativa, dinâmico e responsável.Mínimo de 4 anos de experiência como desenvolvedor.O que é um diferencial: Conhecimento de Docker, Azure e Github/GitlabConhecimentos em arquitetura (para atuação junto às equipes de arquitetura)Vivência com o processos de esteiras CI/CD.Informações adicionaisTrabalho Remoto, mas se você estiver em Curitiba/PR ou região próxima, pode optar também pelo híbrido ou presencial. Remuneração: A combinarCarga horária de prestação de serviço: 8 horas diárias, aproximadamente 168 horas/mês, de segunda à sexta.Contratação PJ (Pessoa Jurídica)Incentivo a obtenção à CertificaçõesTreinamentosHorário flexívelNo Dress Code",Wise,vacancy_legal_entity,,True,,,Brasil,https://wises.gupy.io/job/eyJqb2JJZCI6Njg3NDYyOCwic291cmNlIjoiZ3VweV9wb3J0YWwifQ==?jobBoardSource=gupy_portal,True,remote,True
6874496,2024-03-12T19:46:05.655Z,"PESSOA DESENVOLVEDORA NODE PLENO (AFIRMATIVA PARA PCD, PESSOAS TRANS E PESSOAS NEGRAS)","A Área de New Ventures da ClearSale tem a missão de explorar novas oportunidades de negócio. É um centro de empreendedorismo tecnológico que busca resolver novos problemas, gerando ainda mais valor e confiança entre o mercado e o consumidor. Buscamos hoje uma pessoa Desenvolvedora Node para compor o nosso time!Na ClearSale, temos compromisso com diversidade, equidade e inclusão, e queremos criar um ambiente de trabalho representativo, assim como a sociedade plural em que vivemos. Por isso, esta é uma posição afirmativa para PCD, pessoas trans e pessoas negras. Responsabilidades e atribuiçõesAtividades:Desenvolvimento de backend em Javascript e Typescript (Node.js); Participação nas cerimônias do squad; Design de novos ou melhoria em sistemas e arquiteturas; Discussões técnicas de melhoria de performance e novas tecnologias.Requisitos e qualificaçõesVem com a gente se você é uma pessoa que:É inquieta(o) e apaixonada(o) pela solução de problemas, sem medo de ter iniciativas para encontrar; É participativa(o) no trabalho em equipe (acreditamos muito em ""nós"" ao invés de ""eu""); Tem paixão por tecnologia, design e curiosidade por inovação, novas técnicas e desenvolvimento contínuo; Tem dinamismo e comprometimento com suas entregas; É relacional, tem interesse e motivação para se comunicar entre squads e clientes; É flexível e com vontade de aprender. O que você precisa para participar do processo seletivo:Ensino superior relacionado a tecnologia (completo ou em curso); Conhecimento em Javascript, Typescript e Node.js; Vivência com desenvolvimento de APIs (express, fastify, koa.js ou equivalentes); Vivência com testes unitários e integrado (Jest, Mocha, Jasmine); Conhecimento em banco de dados MongoDB, ou outra base de dados NoSQL; Conhecimento em orientação a objetos, design patterns e arquitetura de software; Conhecimento de processo Ágil (Scrum).Será um diferencial se você tiver conhecimento, interesse ou experiência em: Experiência com Docker; Experiência com AWS, Cloud; Experiência com Terraform (Infraestrutura como código); Experiência com scrap de webiste (puppeteer, playwright).Informações adicionaisBenefícios Oferecidos:PLR (Participação nos Lucros e Resultados);Vale Refeição ou Vale Alimentação;Auxílio Creche para crianças até 4 anos e 11 meses;Seguro de Vida;Gympass;Sesc;Cartão Multibenefícios Alelo – (com desconto na compra de diversos itens na rede credenciada, incluindo medicamentos em diversas redes de farmácias);Assistência Médica e Odontológica Bradesco.Benefícios adicionais com atividades disponíveis na Clearsale:Aulas de teatro;Política Educacional para Graduação e Pós Graduação;Programa eu Saudável (Acompanhamento de saúde e bem estar);Programa Primeiros Laços (Acompanhamento Gestacional);Licenças Maternidade e Paternidade estendida;Palestras de desenvolvimento pessoal e profissional.",ClearSale,vacancy_type_effective,2024-05-12T00:00:00.000Z,True,,,Brasil,https://clearsale.gupy.io/job/eyJqb2JJZCI6Njg3NDQ5Niwic291cmNlIjoiZ3VweV9wb3J0YWwifQ==?jobBoardSource=gupy_portal,True,remote,True
