job_id,published_date,title,description,career_page_name,type,application_deadline,is_remote_work,city,state,country,job_url,disabilities,workplace_type,submitted
6934007,2024-03-26T19:59:45.799Z,Data Governance Analyst,"Nossa nave tem um lugar reservado pra você! Vamos, juntos, impactar bilhões de vidas com dados? 🚀Somos um time de apaixonados por tecnologia com diferentes graus de experiência e conhecimento, diversas origens e, principalmente, 100% motivados a levar inovação e inteligência para nossos clientes por meio das principais plataformas do mercado.Aqui, valorizamos as pessoas e a diversidade em todas as suas formas, e queremos avançar cada vez mais na construção e fortalecimento de um ambiente diverso e inclusivo. Vem compartilhar desse sonho conosco! #VemPraSemantix 💜Responsabilidades e atribuiçõesProfissional responsável por:• Criação e Administração de Políticas de Dados: Responsável por formular, implementar e atualizar políticas e diretrizes de governança de dados para assegurar a aderência às normas e leis de privacidade e segurança de dados.• Monitoramento da Qualidade dos Dados: Encarregado de supervisionar e assegurar a qualidade dos dados, detectando e corrigindo quaisquer erros ou discrepâncias.• Gestão de Acesso aos Dados: Administrar os privilégios e permissões de acesso aos dados para vários usuários e setores dentro da empresa.• Auditorias de Dados: Realiza auditorias internas de dados de forma regular para confirmar a precisão, qualidade e integridade dos dados.• Processos de Governança de Dados: Mapeamento e modelagem dos processos de gestão de dados, levando em consideração todo o ciclo de vida dos dados.• Conhecimento em Melhores Práticas de Governança de Dados: Familiaridade com as melhores práticas do mercado em Governança de Dados, como por exemplo, Dama Dmbok.• Conhecimento em Metodologias Ágeis: Conhecimento em metodologias ágeis para mapeamento de processos.• Projetos de Governança de Dados: Participação de projetos que envolvem a implementação de Governança de Dados.Requisitos e qualificaçõesConhecimentos imprescindíveis:Unity Catalog - DatabricksPurview (ou outra ferramenta de Catálogo de Dados)Azure DevopsSQLConhecimento das novas legislações e regulações sobre uso de dados;Domínio de ferramentas de análise e gestão de dados;Perfil comportamental esperado:Proatividade;Boa comunicação;Capacidade de atuar com prazos;Trabalho em equipe.Informações adicionaisObservação: Posição remota, mas precisa retirar a máquina no cliente em São Paulo, Rio de Janeiro ou Paraná (Curitiba)Conheça os nossos benefícios:💰 Salário compatível com o mercado;        🍎 Caju (cartão flexível) com a recarga de R$ 1.060/mês;  🚑 Plano de Saúde Bradesco;🦷 Plano Odontológico Bradesco;    💜 Seguro de Vida;   🏋🏽‍♂️ Gympass; 👶🏼 Auxílio Creche para mamães e papais;    💰 PLR;          🧠 Learning – área focada no desenvolvimento de hard e soft skills;           📖 Parceria com instituições de ensino e política de reembolso;           💭 Aulas de inglês e espanhol (in company) com a Rosetta Stone - após 03 meses de empresa;       🚀 Plano de Carreira;  🛒 Desconto em produtos de um portal parceiro;          👥 Programa Indique um Talento – Premiação por indicação de colaboradores.",Semantix,vacancy_type_effective,,True,,,Brasil,https://semantix.gupy.io/job/eyJqb2JJZCI6NjkzNDAwNywic291cmNlIjoiZ3VweV9wb3J0YWwifQ==?jobBoardSource=gupy_portal,True,remote,True
6941654,2024-03-26T21:13:30.082Z,Desenvolvedor III,"NOSSO TIME DE TECNOLOGIA  Nossa cultura é de desenvolvimento e tecnologia, desde o 1º dia da empresa, é baseada em metodologias ágeis, decisões baseadas em dados, e evolução constante da experiência do cliente.  Estamos buscando uma pessoa para fazer parte do time de Tecnologia, reportando diretamente ao Head de Tecnologia de Informação.  Este(a) profissional irá apoiar o time no desenvolvimento e manutenção de softwares dentro de um contexto de fintech. Buscamos uma pessoa que constrói o lugar onde quer estar.  Muito importante que o profissional tenha espírito empreendedor, e que consiga gerar empatia, entender as necessidades dos clientes corporativos e ajudá-los a solucionar seus problemas. Responsabilidades e atribuiçõesComo esperamos que VOCÊ MAXIMIZE sua performance:Desenvolvimento de sistemas: Desenho, implantação e manutenção de sistemas escaláveis e resilientes. Desenvolvimento dentro das melhores práticas de programação de software. Colaboração dentro do squad no entendimento dos requisitos. Liderança técnica: Colaborar com o ambiente do time ajudando na mentoria dos juniores e estagiários. Participação no code review garantindo a qualidade e padronização dos códigos implementados. Arquitetura e design: Contribuir na definição da arquitetura de soluções. Desenhar e implementar com base na arquitetura definida. Resolução de problemas: Capacidade de análise e resolução de problemas complexos. Identificação e implementação de soluções definitivas e/ou de contorno. Requisitos e qualificaçõesO que é MUITO IMPORTANTE que você seja: Nível superior em Ciência da computação, engenharia de software ou cursos relacionados (desejável); 5+ anos de experiência em desenvolvimento de sistemas; Forte experiência em Java ou C#, banco de dados relacional e não relacional; Experiência em JavaScript, TypeScript, NextJS, NestJS, Python, Node JS, GITLab, Infra as a Code (Terraform).  Experiência em cloud pública (preferencialmente AWS). Informações adicionaisNOSSOS BENEFÍCIOS:  Vale-refeição e Vale-transporte; Plano de Saúde e Odontológico; Seguro de Vida; Crédito consignado; Auxílio creche;Programa de indicação. E OUTRAS VANTAGENS:  Day OFF de aniversário;Cupom iFood de aniversário;Fliperama;Chá, café e balas à vontade; ",Ali Crédito,vacancy_type_effective,,False,São Paulo,São Paulo,Brasil,https://ali.gupy.io/job/eyJqb2JJZCI6Njk0MTY1NCwic291cmNlIjoiZ3VweV9wb3J0YWwifQ==?jobBoardSource=gupy_portal,True,hybrid,True
6940994,2024-03-26T21:00:00.802Z,Desenvolvedor Especialista Salesforce ,"Somos mais que uma máquina, somos pessoas que transformam e criam infinitas possibilidades.Trabalhamos para simplificar e impulsionar negócios para todas as pessoas, oferecendo soluções financeiras inteligentes. Aqui, investimos em tecnologia, promovemos desenvolvimento e fomentamos a inovação para criar novos caminhos possíveis e gerar impacto positivo no mundo.Na Cielo, a gente trabalha com autonomia para escrever nossa própria jornada, liberdade para ser quem a gente é, e a oportunidade de fazer acontecer. Somos um time que sonha no plural, oferecendo uma experiência completa e focando no bem-estar físico e mental de nossos mais de 6.000 colaboradores e suas famílias.Acreditamos na inclusão e acolhimento de todas as pessoas, com suas singularidades e diversidade de vivências.Bora realizar seus sonhos com a gente! Juntos com você, em infinitas possibilidades.#VemPraCima #VemPraCieloResponsabilidades e atribuiçõesTrabalhar com Salesforce Field Services e Salesforce Service Cloud, desenvolvendo novas funcionalidades e mantendo funcionalidades já em produção;Trabalhar de maneira integrada com os times de desenvolvimento de Sistemas, Infra, Telecom, Segurança, Arquitetura e Negócios, garantindo a sinergia das entregas;Garantir a satisfação dos clientes internos e externos através da entrega dos projetos e manutenções dentro do escopo, qualidade e prazo acordado;Solução de incidentes e problemas de sistemas, identificando solução de contorno, diagnóstico de causa-raiz;Propor soluções sistêmicas eficientes, performáticas, flexíveis e que atendam o negócio;Criar/manter atualizada a documentação técnica e manual de usuários dos sistemas sob sua responsabilidade;Revisar continuamente os processos e procedimentos de atendimento, visando a otimização dos recursos;Trabalhar com fornecedores através da contratação de serviços e acompanhamento de SLAs.Requisitos e qualificaçõesO que o #TimeCielo espera de você?Superior Completo (Ciência da Computação, Análise de Sistemas, Engenharia da computação ou outros cursos relacionados);Experiência comprovada de desenvolvimento Salesforce (Flow, LWC/Aura, APEX);Experiência na administração de ORGs Salesforce;Resiliência e disciplina para respeitar processos internos;Capacidade de navegar em diferentes áreas da empresa;Inglês intermediário.O que aumenta as suas chances?Experiência anterior com módulo Field Service da Salesforce (grande diferencial);Experiência no setor de logística;Certificações Salesforce;Boa pontuação na Trailhead;Experiência com Mulesoft.Informações adicionaisPor que viver infinitas possibilidades ao nosso lado?Assistência Médica e OdontológicaRemuneração Variável Anual (PPR)Auxílio Refeição e AlimentaçãoHome-office (modelo híbrido)Auxílio Trabalho RemotoSeguro de VidaPrevidência PrivadaCanal de apoio à especialistas (nutrição, psicologia, ginecologia, etc)Campanha de VacinaçãoEdupass (Plataforma de estudo e desconto em instituições parceiras)Gympass (Auxílio Academia e Bem-estar)Programa de Gestação SaudávelLicença Maternidade e Paternidade estendidaAuxílio CrecheDress Code FlexívelHorário FlexívelSexta-curtaAlmoço estendido (1h30)",Cielo,vacancy_type_effective,2024-04-08T00:00:00.000Z,False,Barueri,São Paulo,Brasil,https://cielo.gupy.io/job/eyJqb2JJZCI6Njk0MDk5NCwic291cmNlIjoiZ3VweV9wb3J0YWwifQ==?jobBoardSource=gupy_portal,True,hybrid,True
6941629,2024-03-26T20:59:12.881Z,Desenvolvedor II,"NOSSO TIME DE TECNOLOGIA  Nossa cultura é de desenvolvimento e tecnologia, desde o 1º dia da empresa, é baseada em metodologias ágeis, decisões baseadas em dados, e evolução constante da experiência do cliente.  Estamos buscando uma pessoa para fazer parte do time de Tecnologia, reportando diretamente ao Head de Tecnologia de Informação.  Este(a) profissional irá apoiar o time no desenvolvimento e manutenção de softwares dentro de um contexto de fintech. Buscamos uma pessoa que constrói o lugar onde quer estar.  Muito importante que o profissional tenha espírito empreendedor, e que consiga gerar empatia, entender as necessidades dos clientes corporativos e ajudá-los a solucionar seus problemas. Responsabilidades e atribuiçõesComo esperamos que VOCÊ MAXIMIZE sua performance:Desenvolvimento de sistemas: Implantação e manutenção de sistemas escaláveis e resilientes. Desenvolvimento dentro das melhores práticas de programação de software. Colaboração dentro do squad no entendimento dos requisitos. ﻿Resolução de problemas: Capacidade de análise e resolução de problemas. Identificação e implementação de soluções de contorno e /ou definitivas. Requisitos e qualificaçõesO que é MUITO IMPORTANTE que você seja: ﻿Nível superior em Ciência da computação, engenharia de software ou cursos relacionados (desejável); 2+ anos de experiência em desenvolvimento de sistemas; Forte experiência em Java ou C#, banco de dados relacional e não relacional; Experiência em JavaScript, TypeScript, NextJS, NestJS, Python, Node JS, GITLab, Infra as a Code (Terraform).  Experiência em cloud pública (preferencialmente AWS). Informações adicionaisNOSSOS BENEFÍCIOS:  Vale-refeição e Vale-transporte; Plano de Saúde e Odontológico; Seguro de Vida; Crédito consignado; Auxílio creche;Programa de indicação. E OUTRAS VANTAGENS:  Day OFF de aniversário;Cupom iFood de aniversário;No dress code; Fliperama;Chá, café e balas à vontade; ",Ali Crédito,vacancy_type_effective,,False,São Paulo,São Paulo,Brasil,https://ali.gupy.io/job/eyJqb2JJZCI6Njk0MTYyOSwic291cmNlIjoiZ3VweV9wb3J0YWwifQ==?jobBoardSource=gupy_portal,True,hybrid,True
6939879,2024-03-26T20:40:28.530Z,Desenvolvedor(a) Pleno | Node.js (Híbrido - BH),"A Onfly é uma startup focada em ajudar as empresas a viajarem melhor!Democratizar a gestão de viagens, reembolsos, descontos em passagens, hotéis e locação de carros em uma experiência completa e simples é foco do nosso negócio.Somos um dos melhores lugares para se trabalhar no Brasil (inclusive somos uma das empresas do Great Place to work)!Para que alcancemos a meta de crescer exponencialmente, buscamos pessoas que sejam apaixonadas por tecnologia, que desejam estar em um time de alta performance e que queiram crescer muuuuito.Para a vaga de Desenvolvedor(a) Pleno | Node.js, buscamos um(a) profissional que será responsável por cuidar nossas APIs de integração usando Node.js, por isso buscamos alguém que seja dinâmico(a), que saiba trabalhar em equipe e que se conecte com nossa cultura e valores.Responsabilidades e atribuiçõesRequisitos e qualificaçõesNode.js;TypeScript;Experiência em API Rest;Conhecimento avançado em orientação à objetos;Armazenamento de dados em MySQL;Atenção para qualidade de código e design patterns;Experiência com metodologias de desenvolvimento ágil Scrum ou Kanban.Informações adicionaisRegime Híbrido de trabalho (2 dias na semana presenciais e o restante remoto);Horário de trabalho flexível;Vale refeição em cartão flexível R$30 (sem desconto de 6%);Vale transporte em cartão flexível (sem desconto de 6%);Plano de Saúde Unimed, sem coparticipação e sem mensalidade para o Onflyer (por nossa conta :D);Plano Odontológico (desconto na mensalidade)Desconto Farmácia;No dress code;Benefício de Psicoterapia on-line (Vittude);Benefícios de academia! (Gympass);Bolsa de 90% para estudos de idiomas;Descontos em Graduações e Pós-graduações (UNA e UNIBH);Pacote de descontos Clube Certo sem valor de mensalidade;Assistência Funeral (Grupo Zelo);Licença Maternidade/Paternidade estendida;Onhappy (plataforma exclusiva para viajar com desconto para qualquer lugar do Brasil);Seguro de vida.",Novas oportunidades na Onfly!,vacancy_type_effective,2024-12-31T00:00:00.000Z,False,Belo Horizonte,Minas Gerais,Brasil,https://onfly.gupy.io/job/eyJqb2JJZCI6NjkzOTg3OSwic291cmNlIjoiZ3VweV9wb3J0YWwifQ==?jobBoardSource=gupy_portal,False,hybrid,True
6847358,2024-03-26T20:38:12.503Z,Pessoa Desenvolvedora de Software Sênior - Backend (Vaga Afirmativa para Mulheres),"Quer fazer parte de uma das mais relevantes empresas do mercado brasileiro? Nós, da OLX Brasil, estamos de portas abertas para você!Somos uma empresa 100% digital, com tecnologia desenvolvida localmente e líder no mercado de compra e venda online. Nos tornamos a marca que melhor representa a economia circular no país. Hoje contamos com dois escritórios nas cidades de Rio de Janeiro e São Paulo.Responsabilidades e atribuiçõesNessa posição de Pessoa Desenvolvedora de Software Sênior, você vai somar ao time de Notificações que tem como objetivo entregar a melhor experiência de comunicação para nossos usuários e times internos.No dia a dia você vai:Colaborar com equipes multifuncionais para planejar, criar e fornecer recursos de alta qualidade;Orientar os membros da equipe por meio de práticas como programação em pares e revisões de código;Reestruturar e refatorar os sistemas existentes;Ajudar a projetar a visão de longo prazo de nossa tecnologia e novas arquiteturas de componentes;Promover as melhores práticas para melhorar a qualidade do nosso código e processos;Conduzir decisões técnicas dentro da equipe.Requisitos e qualificaçõesE o que você precisa ter? Ensino Superior Completo em Engenharia da computação, Análise de sistemas ou áreas correlatas;Sólido conhecimento em design patterns de aplicações (principalmente APIs e mensageria) e versionamento de código;Experiência com infraestrutura em nuvem na AWS;Sólidos conhecimentos em NodeJS (javascript e/ou typescript);Conhecimento em GoLang;Familiaridade com esteiras de CI/CD, Docker e Terraform.Informações adicionaisNossa Cultura e Nosso Jeito | Mais sobre a OLX Brasil:Nosso propósito é ""Empoderar os brasileiros para realizarem seus sonhos, reinventando o modelo de consumo"". Fazemos isso digitalizando a jornada de compra e venda dos nossos usuários, fortalecendo o consumo consciente e transformando a forma como nos conectamos e nos relacionamos.Para nossas oportunidades, valorizamos a autonomia e incentivamos o protagonismo. Acreditamos que você é corresponsável pela melhor escolha, em busca de uma boa experiência. Afinal, para nós uma boa experiência é a que fica! Não fazemos distinção de cor, nacionalidade, identidade de gênero, se o profissional possui alguma deficiência ou não… o que importa é ter as habilidades necessárias para cada função e ter garra para aproveitar os desafios e para aprender todos os dias. Aqui, damos espaço para você ser quem você é, sem julgamentos e preconceitos.Valorizamos, desenvolvemos e reconhecemos as pessoas para que cresçam e vivam o seu melhor junto com a gente, sempre com respeito, empatia e foco no feedback contínuo.Benefícios:Remuneração compatível com o mercado;Plano de SaúdePlano OdontológicoPrevidência PrivadaBenefícios flexíveis que se adaptam às suas necessidades;Auxílio alimentação;Aconselhamento financeiro;Clube de vantagens;Auxílio Home Office;Auxílio Mobilidade;Auxílio Criança;Seguro de Vida;Licenças estendidas;Incentivo ao esporte, qualidade de vida e bem estar;Empréstimo consignado com taxas reduzidas.Candidate-se e venha fazer parte dessa transformação conosco!",Grupo OLX,vacancy_type_effective,,False,Rio de Janeiro,Rio de Janeiro,Brasil,https://vemserolxbrasil.gupy.io/job/eyJqb2JJZCI6Njg0NzM1OCwic291cmNlIjoiZ3VweV9wb3J0YWwifQ==?jobBoardSource=gupy_portal,True,hybrid,True
6941025,2024-03-26T20:05:43.593Z,Desenvolvedor Full Stack Pleno (Java/React),"Vem!  Vem fazer parte de um time que tem ""brilhar"" no nome, na marca, nas pessoas e no poder de suas ideias reunidas em uma razão de existir. Vem fazer parte de um time que tem como propósito desenvolver poder tecnológico em Data &amp; Analytics para organizações e pessoas alcançarem sua melhor performance.  Nossa busca por inovar é incessante. Nossa demanda por pessoas com vontade de transformar é constante. Nossa determinação por oferecer o melhor a cada cliente é vital. Porque queremos crescer e brilhar juntos. Junto com você!  Vem fazer parte do time Niteo como Desenvolvedor Full Stack Pleno! #brilhajuntoResponsabilidades e atribuiçõesContribuir ativamente para o desenvolvimento e entrega de soluções de software de alta qualidade, utilizando tecnologias Java e frameworks modernos. Você será responsável por desenvolver e manter funcionalidades de sistemas, seguindo padrões de codificação, boas práticas de desenvolvimento e colaborando com as equipes multidisciplinares para atender às necessidades do negócio.Responsabilidades:Desenvolver e implementar funcionalidades de sistemas, seguindo as especificações técnicas e requisitos de negócios.Colaborar com equipes multidisciplinares para entender e analisar requisitos, participando ativamente de discussões de design e planejamento técnico.Contribuir para a revisão de código, garantindo a qualidade, consistência e aderência aos padrões de codificação estabelecidos.Participar do processo de testes, incluindo a elaboração e execução de testes unitários e integrados para garantir a qualidade do software.Realizar manutenção e correção de bugs em sistemas existentes, identificando e resolvendo problemas de forma eficiente.Aprender e se desenvolver constantemente, buscando aprimorar suas habilidades técnicas e acompanhar as tendências do mercado.Colaborar com a documentação técnica, fornecendo informações relevantes sobre implementações e integrações realizadas.Requisitos e qualificaçõesExperiência sólida em desenvolvimento Java, com conhecimento prático em frameworks como Spring Boot para a construção de soluções baseadas em microserviços.Familiaridade com conceitos de autenticação e autorização, incluindo o uso de JSON Web Tokens (JWT) e integração com Azure AD B2C.Conhecimento básico em Apache Kafka para implementação de pipelines de eventos e mensagens.Capacidade de trabalhar com React para desenvolvimento de interfaces de usuário dinâmicas.Conhecimento prático em contêineres Docker e noções básicas de orquestração de contêineres com Kubernetes.Familiaridade com a implementação e integração de sistemas de busca distribuídos, como ElasticSearch.Habilidade em documentação de APIs utilizando Swagger.Informações adicionaisVem brilhar com a Niteo!Aqui nosso trabalho é 100% remoto, você pode trabalhar de onde quiser!",Niteo Technologies,vacancy_legal_entity,,True,,,Brasil,https://niteo.gupy.io/job/eyJqb2JJZCI6Njk0MTAyNSwic291cmNlIjoiZ3VweV9wb3J0YWwifQ==?jobBoardSource=gupy_portal,True,remote,True
6940935,2024-03-26T19:55:53.941Z,Desenvolvedor Full Stack Sênior (Java/React),"Vem!  Vem fazer parte de um time que tem ""brilhar"" no nome, na marca, nas pessoas e no poder de suas ideias reunidas em uma razão de existir. Vem fazer parte de um time que tem como propósito desenvolver poder tecnológico em Data &amp; Analytics para organizações e pessoas alcançarem sua melhor performance.  Nossa busca por inovar é incessante. Nossa demanda por pessoas com vontade de transformar é constante. Nossa determinação por oferecer o melhor a cada cliente é vital. Porque queremos crescer e brilhar juntos. Junto com você!  Vem fazer parte do time Niteo como Desenvolvedor Full Stack Sênior! #brilhajuntoResponsabilidades e atribuiçõesLiderar o desenvolvimento e a entrega de soluções de software robustas e escaláveis, utilizando tecnologias baseadas em Java. Você será responsável por projetar, implementar e manter sistemas de alta qualidade que atendam aos requisitos de negócios e às melhores práticas de desenvolvimento. Responsabilidades: Desenvolver e implementar funcionalidades de alta complexidade em sistemas baseados em microserviços, garantindo a qualidade do código e a aderência aos requisitos de negócios.Colaborar com arquitetos e equipes de desenvolvimento para projetar soluções técnicas eficazes e escaláveis.Participar ativamente de revisões de código, fornecendo feedback construtivo e garantindo a aderência aos padrões de codificação.Identificar e resolver problemas de desempenho e escalabilidade em sistemas Java, garantindo que as soluções sejam eficientes e responsivas.Integrar sistemas utilizando APIs RESTful e implementar segurança em nível de aplicativo usando práticas recomendadas.Trabalhar em estreita colaboração com equipes de teste para garantir a qualidade e a estabilidade do software, quando necessário.Participar ativamente na avaliação de novas tecnologias e ferramentas, contribuindo para a evolução da pilha tecnológica da empresa.Requisitos e qualificaçõesExperiência extensiva em desenvolvimento Java, incluindo o uso de frameworks como Spring Boot e Spring Cloud para construir aplicativos de microserviços.Proficiência em autenticação e autorização, com conhecimento sólido em JSON Web Tokens (JWT) e integração com Azure AD B2C.Experiência em desenvolvimento de aplicativos de mensageria usando Apache KafkaFamiliaridade com o desenvolvimento de interfaces de usuário dinâmicas e responsivas usando React.Conhecimento avançado em contêineres Docker e orquestração de contêineres com Kubernetes.Experiência em implementação e integração de sistemas de busca distribuídos, como ElasticSearch.Habilidade em documentação de APIs usando Swagger.Informações adicionaisVem brilhar com a Niteo!Aqui nosso trabalho é 100% remoto, você pode trabalhar de onde quiser!",Niteo Technologies,vacancy_legal_entity,,True,,,Brasil,https://niteo.gupy.io/job/eyJqb2JJZCI6Njk0MDkzNSwic291cmNlIjoiZ3VweV9wb3J0YWwifQ==?jobBoardSource=gupy_portal,True,remote,True
