job_id,published_date,title,description,career_page_name,type,application_deadline,is_remote_work,city,state,country,job_url,disabilities,workplace_type,submitted
6583926,2024-01-10T20:08:30.946Z,ESPECIALISTA CIENTISTA DADOS I,"A Omni Somos uma empresa em constante transformaçãoA Omni, presente há 29 anos no mercado, é uma instituição sólida e reconhecida por possui um dos melhores serviços de crédito do Brasil. Temos orgulho da nossa importância para pessoas com menor acesso a crédito. Por isso, empenhamos toda dedicação e responsabilidade para seguirmos adiante sempre, melhorando a Vida das Pessoas Nos dedicamos ao desenvolvimento contínuo dos nossos colaboradores. Cultivamos relacionamentos com proximidade para criar vínculos com lealdade e parceria, com forte senso de fazer o que é correto, em um ambiente de respeito e cordialidade. Somos uma empresa humanizada e valorizamos a diversidade de nossos colaboradores como uma verdadeira força, e essa força só poderá ser utilizada se fizermos com que todos sintam que realmente podem ser eles mesmos no dia a dia, independentemente de sua etnia, religião, orientação sexual, gênero, deficiência ou qualquer outra característica pessoal. Cultura Omni O que vivemos diariamente e temos orgulho de ser!                  PropósitoOMNIZAR!Omnizar é... Fazer o melhor hoje para o amanhã ser ainda melhor!					VisãoSer o seu melhor parceiro em soluções financeiras.					ValoresAgir de modo empreendedor;Garantir eficiência;Respeitar nossas parcerias;Ter senso de justiça;Trabalhar pra valer.  Se você se identifica com este ambiente e se considera, colaborativo, integrador e transformador, venha fazer parte do nosso time.Responsabilidades e atribuiçõesPara isso, veja abaixo mais detalhes do que procuramos, dos desafios que temos e o que você precisará possuir de conhecimento para fazer parte disso! 👇Responsabilidades e atribuições: O profissional irá atuar na estrutura de Data Science da Omni&amp;CO, contribuindo com incremento de eficiência e competitividade de todas as áreas da instituição. Nosso trabalho do dia a dia gira em torno do desenvolvimento e acompanhamento de soluções e modelos analíticos, além de busca contínua por inovação técnica e de novos dados.Requisitos e qualificaçõesRequisitos e qualificações: - É imprescindível ter superior completo/cursando em Estatística, Matemática, Física, Ciências da Computação, Engenharia ou cursos de exatas correlatos;- Conhecimentos em técnicas de modelagem como Regressão Logística, Árvores de Decisão, Machine Learning, entre outras;- Conhecimentos em R ou Python;- Boa capacidade para identificar e propor soluções para problemas, garantindo a aplicabilidade das soluções;- SQL;- Boa comunicação, habilidade de transmitir análises complexas de forma simples para as áreas de negócios;- Ter experiência em áreas de modelagem no setor financeiro será considerado um diferencial.Informações adicionaisNossos benefícios:Auxilio creche;Modelo de trabalho híbrido 3x2Vale alimentação e vale refeição;Vale transporte;Assistência médica e Odontológica;Seguro de vida;Programa de bem estar e saúde;Day off no dia do seu aniversário;Participação nos lucros;Sem dress code: você pode se vestir como preferir;Horário de trabalho Flexível;Entre outros.",Omni ,vacancy_type_effective,,True,,,Brasil,https://vemseromni.gupy.io/job/eyJqb2JJZCI6NjU4MzkyNiwic291cmNlIjoiZ3VweV9wb3J0YWwifQ==?jobBoardSource=gupy_portal,True,remote,True
6596313,2024-01-11T12:17:22.653Z,Data Engineer III (Marketing) - Bradesco,"Acreditamos que é possível desafiar o futuro com pessoas e tecnologia, e reconhecemos nas pessoas, especialmente, um dos mais importantes motivos de nosso sucesso. Assim, proporcionamos aos nossos colaboradores um ambiente seguro, diverso e inclusivo, que inspira confiança, promove e estimula o desenvolvimento pessoal e profissional.Trazendo um pouco mais da nossa história de contribuição e impacto na sociedade, com pioneirismo e inovação, o Bradesco surgiu com o propósito de democratizar o acesso aos serviços bancários no Brasil. Nesses 79 anos, sempre ao lado dos brasileiros, nos tornamos uma das maiores Organizações do país, formada por empresas e fundações que oferecem produtos e serviços que vão de soluções financeiras a seguros, saúde e educação.E estamos sempre em busca de pessoas dispostas a fazer a diferença na vida de milhões de brasileiros, contribuindo para o desenvolvimento da sociedade.Responsabilidades e atribuiçõesEntendimento dos requisitos de negócio;Desenvolvimento dos pipelines de dados;Teste integrado das bases de dados;Desenvolvimento de amostra para validação com gestores;Desenvolvimento de plano de implantação;Desenvolvimento de jobs de automação;Acompanhamento Implantação;Validação dos dados;Acompanhamento da estabilização do job em Produção;Sustentação pós implantação;Identifica e trata requisitos e testes não funcionais para a solução técnica.Requisitos e qualificaçõesComunicação, Proatividade, Accountability, Liderança Técnica de time;Entre 4 e 6 anos de experiência como Engenheiro de Dados.Habilidades Técnicas:Mapeamento de dados ETL;Modelagem de dados (dimensional/relacional);SQL (essencial);Big data e ecossistema hadoop, Python, PySpark, Shell, HQL, Git, Bamboo, Bitbucket, Spark/Hive (preferencialmente);Implementação de processos de validação de integridade/qualidade de dados e alertas;Garante a aplicação do framework de testes automatizados;Cloud Azure:o   Databrickso   Otimizações de Cloud (FinOps operacional - fazer se preocupando com custo)o   Storageo   CosmosDB-MongoDB (bancos não relacionais) e Kakfa (Confuent).o   Certificações desejáveis: AZ-203 &gt; DP-900 &gt; AZ-900.Informações adicionaisO que nós oferecemos:Contratação CLT;💰 Remuneração - Aderente às melhores práticas de mercado;💰 PLR;🥗 Auxílios - Refeição, 🥗 Alimentação, 🥗 13ª Cesta e Transporte;🩺 Saúde - Plano de saúde, odontológico e seguro de vida, além de descontos em farmácias;🏛 Previdência – Plano opcional e exclusivo para funcionários, com participação financeira da Organização Bradesco;😀 Bem-Estar - O programa interno Viva Bem Bradesco conta com diversas iniciativas para prevenção de doenças e promoção de hábitos, atitudes e comportamentos saudáveis, além de oferecer orientação e aconselhamento para resolução de problemas pessoais, familiares, legais e financeiros;📚 Capacitação e Certificação - Por meio da Universidade Corporativa Bradesco, a Unibrad, investimos no aprendizado pessoal e profissional do nosso time, promovendo soluções de aprendizagem e parcerias com instituições de ensino;🎯 Isenção de Tarifas – Cesta de serviços bancários exclusiva, com descontos e condições especiais em diversos produtos e serviços da Organização Bradesco;👨‍👩‍👧‍👦 Mães, Pais e Filhos - Auxílio Creche/Babá, licença paternidade e licença maternidade estendida, além de acompanhamento assistencial da gestação até o pós-parto;🚗 Modelo de Trabalho Híbrido.",Page Outsourcing Brasil,vacancy_type_effective,,False,Osasco,São Paulo,Brasil,https://pageoutsourcingbr.gupy.io/job/eyJqb2JJZCI6NjU5NjMxMywic291cmNlIjoiZ3VweV9wb3J0YWwifQ==?jobBoardSource=gupy_portal,True,hybrid,True
6581673,2024-01-11T11:31:50.670Z,Product Data Analytics ,"A Omni Somos uma empresa em constante transformaçãoA Omni, presente há 29 anos no mercado, é uma instituição sólida e reconhecida por possui um dos melhores serviços de crédito do Brasil. Temos orgulho da nossa importância para pessoas com menor acesso a crédito. Por isso, empenhamos toda dedicação e responsabilidade para seguirmos adiante sempre, melhorando a Vida das Pessoas Nos dedicamos ao desenvolvimento contínuo dos nossos colaboradores. Cultivamos relacionamentos com proximidade para criar vínculos com lealdade e parceria, com forte senso de fazer o que é correto, em um ambiente de respeito e cordialidade. Somos uma empresa humanizada e valorizamos a diversidade de nossos colaboradores como uma verdadeira força, e essa força só poderá ser utilizada se fizermos com que todos sintam que realmente podem ser eles mesmos no dia a dia, independentemente de sua etnia, religião, orientação sexual, gênero, deficiência ou qualquer outra característica pessoal. Cultura Omni O que vivemos diariamente e temos orgulho de ser!                  PropósitoOMNIZAR!Omnizar é... Fazer o melhor hoje para o amanhã ser ainda melhor!					VisãoSer o seu melhor parceiro em soluções financeiras.					ValoresAgir de modo empreendedor;Garantir eficiência;Respeitar nossas parcerias;Ter senso de justiça;Trabalhar pra valer.  Se você se identifica com este ambiente e se considera, colaborativo, integrador e transformador, venha fazer parte do nosso time. Responsabilidades e atribuiçõesSerá responsável pelos indicadores que apoiam a estratégia de alavancagem de negócios junto a Growth, através de propósitos focados na Transformação e Inovação em toda cadeia de valor do cliente.Atuar junto aos times negocios, garantindo e fomentando a cultura da-driven;Desenvolver dashboards, inidicadores e funil de vendas que permitam analisar a performance dos produtos e relacionamento cliente, através de ferramentas de analytics;Realizar análises complexas que envolvem grandes quantidades de dados, a fim de medir a performance, como também, gerar insights de negócios;Preparar e/ou especificar a estrutura de dados necessária para análises;Estudos e pesquisa do mercado para definição de estratégias de vendas;Geração de dados e métricas como alavancas de experimentações e gatilhos de conversão de vendas;Entregas com alto valor agregado, promovendo novas oportunidades de negócios que possam surgir;Planejar, implementar e mensurar testes de hipóteses (testes A/B e multivariados/experimentações), apoiando na tomada de decisão;Desenvolver análises e visões de Funis e Cohorts (comportamento do cliente com características semelhantes) para auxiliar no entendimento da experiência do usuário;Modelagem, análise e utilização de dados para estudos, insights e recomendações aos times de negócios;Requisitos e qualificaçõesExperiência em análise de dados em múltiplos ferramentais- Data Studio, Excel avançado, Google Analytcs, SAS, Firebase, Oracel SQL, GoogleTag manager, GooglePlay Console, Google Optimise HotJar;Conhecimento em frameworks de metodologias ágeis de trabalho e desenvolvimento;Curiosidade em conhecer as regras de negócios do produto;Senso crítico com capacidade de analisar informações e sugerir soluções;Mapeamento e criação de mapa de coleta;Informações adicionaisNossos benefícios:Auxilio creche;Modelo de trabalho híbrido 3x2Vale alimentação e vale refeição;Vale transporte;Assistência médica e Odontológica;Seguro de vida;Programa de bem estar e saúde;Day off no dia do seu aniversário;Participação nos lucros;Sem dress code: você pode se vestir como preferir;Horário de trabalho Flexível;Entre outros.",Omni ,vacancy_type_effective,,False,São Paulo,São Paulo,Brasil,https://vemseromni.gupy.io/job/eyJqb2JJZCI6NjU4MTY3Mywic291cmNlIjoiZ3VweV9wb3J0YWwifQ==?jobBoardSource=gupy_portal,True,hybrid,True
6595349,2024-01-11T02:24:55.654Z,Senior Data Engineer - USA,"We're a digital platform for total well-being. We help our community feel their best in body and mind through on-demand yoga, meditation, Pilates, and fitness classes with world-class teachersResponsabilidades e atribuiçõesData Engineer plays an important role in our mission and vision to connect people through self-care so that, together, we can heal ourselves and our planet. Support the company's data strategy and work with the Data Team implementing data pipelines, dashboards, models, and AI/ML projects as needed. This role will be responsible for enabling data-driven decisions across the company by sourcing accurate data, building scalable infrastructure, and delivering analytics with predictive modeling. Use various methods to transform raw data into useful data systems, ultimately supporting the team to implement methods to improve data reliability, quality, and relevance. Come join us, it’ll be fun!Requisitos e qualificaçõesRequired QualificationsUpper-intermediate to fluent speaking and writing English. Able to have a real-time conversation.5+ years of full-time hands-on Data Engineering experience.4+ years of full-time hands-on SQL experience.4+ years of full-time hands-on Python experience.Experience designing, developing, and maintaining Extract, Transform, Load (ETL) pipelines, ensuring data quality and integrity throughout the ETL process.Experience managing and maintaining data warehouse performance to meet organizational requirements.Deep understanding of conversion, retention, and engagement metrics.Experience with data visualization tools such as Tableau, MixPanel, Google Looker.Knowledge of data engineering and data warehousing concepts, including RedShift, Redshift Spectrum, AWS Glue, AWS Lambda.Excellent communication and presentation skills to convey technical concepts to non-technical stakeholders.Ability to work collaboratively in cross-functional teams and lead projects from ideation to implementation.Experience mentoring junior data engineers and guiding best practices in modeling and analysis.Ability to communicate clearly, and proactively with the team.Able to respect and support cultural policies, values and processes.Always strives to support colleagues through positive collaboration.Ability to treat each team member with respect.Receptive to change and open to feedback.Nice to havePySpark experience.Experience in user subscription data.Bachelor's or Master's degree in Computer Science, Statistics, Mathematics, or a related field.Experience in Data Science, Machine Learning, and Statistical ModelingSAS experience.Knowledge and experience in utilizing advanced table formatting such as Delta, Hudi, or Iceberg.Experience building ML Models for new Product Features &amp; Fraud.Experience with Open Source Data Visualization tools.Experience with Databricks, Reverse ETL.Bachelor’s degree in Computer Science or equivalent demonstrated ability. Informações adicionaisWhat’s in it for youLearn and evolve your skills using the latest and greatest technology tools in a rapidity growing company.Learn from the best engineers. We constantly challenge the status quo and invent new ways of building a great product.Flexible hours. Just join daily standups, sprint planning, and retrospectivemeetings. Other than that, you're in control of your own schedule.I00% remote. Work anywhere, whether it is remotely in the comfort of your home, in a shared co-working space, in an RV on the beach, or while being a nomad in another country.Work on challenging problems, innovate, impacting lots of people's lives for the better while having fun doing it.",Job Opportunities,vacancy_legal_entity,,True,,,Brasil,https://gobettirh.gupy.io/job/eyJqb2JJZCI6NjU5NTM0OSwic291cmNlIjoiZ3VweV9wb3J0YWwifQ==?jobBoardSource=gupy_portal,True,remote,True
6594640,2024-01-10T21:21:40.459Z,Gerente de Unidad de Negocios de Datos y Analítica ,"¡Sé parte de Stefanini!​En Stefanini somos más de 30.000 genios, conectados desde 41 países, haciendo lo que les apasiona y co-creando un futuro mejor.​Estamos buscando un Gerente experimentado y visionario de la Unidad de Negocios de Datos y Analítica para liderar nuestra división de Datos y Analítica. En este rol crucial, será responsable de gestionar la Ganancia y Pérdida (P&amp;L) de la Unidad de Negocios de Datos y Analítica, definir la estrategia comercial, impulsar iniciativas de lanzamiento al mercado y garantizar la exitosa entrega de proyectos de datos y analítica, incluyendo integración de datos, analítica avanzada y soluciones de inteligencia empresarial.Responsabilidades y atribucionesPoseer y gestionar el P&amp;L de la Unidad de Negocios de Datos y Analítica, con enfoque en el crecimiento de ingresos, rentabilidad y gestión de costos.- Desarrollar y ejecutar estrategias para alcanzar objetivos financieros y un crecimiento sostenible a largo plazo.- Supervisar el rendimiento financiero, identificar desviaciones e implementar acciones correctivas cuando sea - Definir la estrategia comercial para servicios de datos y analítica, incluyendo precios, paquetes y posicionamiento en el mercado.- Identificar y priorizar mercados objetivo, segmentos de la industria y perfiles de clientes.- Colaborar con los equipos de ventas y marketing para impulsar campañas de lanzamiento al mercado y actividades de generación de oportunidades. - Supervisar la entrega integral de proyectos de datos y analítica, garantizando que se completen a tiempo, dentro del alcance y dentro del presupuesto.- Gestionar un equipo de directores de proyectos, científicos de datos y analistas para lograr la excelencia en la ejecución de proyectos.- Fomentar una cultura de mejora continua y aseguramiento de calidad en la entrega de servicios.Requisitos y calificaciones- Título universitario en Ciencia de Datos, Negocios o un campo relacionado (se prefiere un título de maestría).- Experiencia probada en la gestión de servicios de datos y analítica o una unidad de negocio similar, con un historial de logro de objetivos financieros.- Amplia comprensión de las tecnologías de datos y analítica, incluyendo almacenamiento de datos, visualización de datos y aprendizaje automático.- Excelentes habilidades de liderazgo, pensamiento estratégico y toma de decisiones.- Habilidades excepcionales de comunicación y capacidad para interactuar con los clientes de manera efectiva.- Certificación en gestión de proyectos (por ejemplo, PMP) es una ventaja.",STEFANINI LATAM,vacancy_type_effective,,True,,,México,https://stefaninilatam.gupy.io/job/eyJqb2JJZCI6NjU5NDY0MCwic291cmNlIjoiZ3VweV9wb3J0YWwifQ==?jobBoardSource=gupy_portal,True,remote,True
6589462,2024-01-11T12:19:54.073Z,Desenvolvedor Vue.js PL,"Somos uma desenvolvedora de projetos de softwares corporativos com especialização no segmento de serviços financeiros e administradoras de consórcio. No mercado desde 2012 adquirimos grande experiência no lançamento de plataformas mobile de força de vendas. Já tendo desenvolvido projetos dos mais variados tamanhos e contabilizando dezenas de milhares de usuários ativos em nossos softwares.Responsabilidades e atribuiçõesComo desenvolvedor Full Stack - Pleno (Laravel 10 + Vue 2), você desempenhará um importante papel contribuindo com a equipe de desenvolvimento, implementando novas funcionalidades de acordo com os requisitos definidos, apoiando a equipe de qualidade com a correção de defeitos. Também será parte da rotina reuniões de planejamento/acompanhamento, Code Review e apoio técnico ao cliente.",Stefanini Group,vacancy_type_effective,,True,,,Brasil,https://stefanini.gupy.io/job/eyJqb2JJZCI6NjU4OTQ2Miwic291cmNlIjoiZ3VweV9wb3J0YWwifQ==?jobBoardSource=gupy_portal,True,remote,True
6596101,2024-01-11T12:08:46.305Z,Pessoa Desenvolvedora Full Stack Sênior (Híbrido/SP) ,"Nós somos a BHS!Temos aproximadamente 28 anos de experiência no mercado ofertando soluções modernas de TI.Reconhecida como a MELHOR empresa para se trabalhar em MG e no Brasil pelo GPTW - Great Place to Work. O que a gente espera de você?· Habilidade de relacionamento com pessoas de diferentes áreas e de diversos níveis de hierarquia;· Autogerenciamento;· Capacidade de cumprir compromissos, assumir obrigações e responsabilidade por suas ações;· Habilidade de buscar constantemente maneiras melhores e mais eficientes de realizar tarefas ou resolver problemas.;· Alguém que queira fazer parte de projetos incríveis no ramo financeiro e tenha muita vontade de aprender, ensinar e crescer junto com a BHS.Responsabilidades e atribuiçõesSuas atividades serão:· Desenvolvendo sistemas minuciosos que lidam com alto volume de dados;· Atuar em Backend e Frontend, no processamento e geração de arquivos do ramo de pagamentos e financeiro;· Desenvolvimento de melhorias, criação e sustentação de sistemas.Requisitos e qualificaçõesBuscamos uma pessoa que possua experiências com:· C#/NET;· Net Framework/Core;· Asp Net MVC;· Net Core 2.1 ou superior;· Princípios de Programação Orientado a Objeto (POO);· Testes unitários e automatizados, garantindo a qualidade dos códigos;· Angular e React;· Aplicação de boas práticas (Designer Patterns, SOLID, Clean Code)· Proficiência em controle de versão como Git; · Uso de ferramentas Visual Studio e/ou Visual Studio Code;· Banco de dados relacional (SQL Server) e não relacional (MongoDB).Diferenciais:· Experiência no ramo financeiro ou de pagamentos. Informações adicionaisO que você pode esperar de nós?· Plano de saúde e Assistência Odontológica;· Vale Refeição/ Alimentação no cartão Flash, sem descontos;· Vate transporte ou auxilio mobilidade para o seu deslocamento; · Auxílio Híbrido mensal, sem descontos;· Programa de indicações! Você e a sua indicação saem ganhando;· Gympass para você se exercitar;· Participação nos lucros;· Licença Maternidade/Paternidade estendida;· Parceria com o SESC que oferece acesso a teatro, dança, hotéis, passeios, entre outras atividades;· Seguro de vida, sem desconto nenhum para o colaborador;· Crédito Consignado: parceria com a Creditas que facilita na contratação de um empréstimo consignado;· Parcerias e convênios diversos (Universidades, escolas de Idioma, academias, clínicas de saúde...);· Incentivos à educação e ao desenvolvimento (Pós-Graduações, certificações, treinamentos e até inglês);· Programas de conteúdo, como o Deu Match! e uma rotina com aprendizado colaborativo constante;· Cultura de Feedback contínuo, com: Feedbacks semestrais, 1:1, PDI (Plano de Desenvolvimento Individual) e BHS Experience. Buscamos a inclusão da diversidade no nosso dia a dia e acreditamos que equipes plurais têm melhor desempenho. Todas as pessoas são bem-vindas.#vempraBHS #somosBHS #LI-Hybrid Processo Seletivo . Terá um primeiro contato com o recrutador a fim de entender se nossa oportunidade dá o match com o seu momento de carreira; . Bate papo com alguém do nosso time de Gestão de Pessoas para te conhecer melhor e apresentar nossa oportunidade; . Entrevista técnica com a liderança da área;A BHS promove o melhor ambiente para se trabalhar e com bastante conteúdo sobre diversidade. Venha ser um B.Techer 💙🚀 Veja nossa avaliação no Glassdor (4.4 Estrelas e 92% recomendado para outras pessoas) ",Somos BHS 💙,vacancy_type_effective,,False,São Paulo,São Paulo,Brasil,https://bhs.gupy.io/job/eyJqb2JJZCI6NjU5NjEwMSwic291cmNlIjoiZ3VweV9wb3J0YWwifQ==?jobBoardSource=gupy_portal,True,hybrid,True
6541565,2024-01-11T12:07:22.217Z,Pessoa Desenvolvedora de Mercado (Mossoró - RN),"A PESSOA DESENVOLVEDORA DE MERCADO que atua no Grupo Brisanet capacita nosso time de vendas, para atuar com o nosso serviço 5G.O nosso time comercial é formado por pessoas colaboradoras determinadas e apaixonadas por desafios! Se você também possui senso de trabalho em equipe e encanta seus clientes, a Brisanet é o seu lugar! Vamos velejar rumo ao futuro! #VemSerBrisanet 💙🧡Responsabilidades e atribuiçõesComo será o seu dia a dia?Promover eventos e participar de demonstrações dos serviços;Capacitar equipe de vendedores da carteira de clientes;Agir de maneira estratégica na disseminação da marcar;Acompanhar o processo da venda, do orçamento à instalação, prestando suporte na resolução de pendências;Realizar inspeções certificando que o contrato com cada Ponto de Venda está sendo cumprido;Fixar materiais promocionais em lugares estratégicos, previamente acordados com a gerência de cada PDV;Atingir as metas definidas pelo time comercial para os PDVs que estão sob gestão;Posicionar o material de trade estrategicamente, de modo a atrair clientes.Requisitos e qualificaçõesO que buscamos nesse perfil?Ensino médio completoVicência com atendimento ao clienteExperiência com técnicas de vendas e atendimento ao cliente;Informática Básica;Noções de Redes e Manutenção de computadores;Conhecimento Geográfico;CNH - Categoria A.Será um diferencial no seu perfil: Técnicas de Persuasão;Pacotes MS Office (Word, Excel, Power Point).Informações adicionaisNo Grupo Brisanet você vai encontrar:Cultura de trabalho que respeita e valoriza as pessoas;Eventos internos que abordam temas diversos;Meio colaborativo que valoriza o desenvolvimento pessoal e profissional; Ambiente horizontal e vertical, ou seja, você é o protagonista de sua carreira! Plano de Saúde Coparticipativo pela Unimed;Plano Odontológico pela Odontoart;Descontos em Instituições de Ensino Superior de até 60%;Seguro de Vida;Descontos de até 50% nos serviços Brisanet de internet, Telefonia Fixa e TV por assinatura (após o período de experiência);Desconto de até 35% no BrisaMusic;Alimentação (Através do aplicativo Flash, Alelo ou Refeitório);Vale Transporte.",Grupo Brisanet,vacancy_type_effective,,False,Mossoró,Rio Grande do Norte,Brasil,https://brisanet.gupy.io/job/eyJqb2JJZCI6NjU0MTU2NSwic291cmNlIjoiZ3VweV9wb3J0YWwifQ==?jobBoardSource=gupy_portal,True,on-site,True
