job_id,published_date,title,description,career_page_name,type,application_deadline,is_remote_work,city,state,country,job_url,disabilities,workplace_type,submitted
7243942,2024-05-31T14:02:39.486Z,Data Engineer Semi Sr.,"¡Sé parte de Stefanini! En Stefanini somos más de 30.000 genios, conectados desde 41 países, haciendo lo que les apasiona y co-creando un futuro mejor. ¡Seguro no te quieres quedar fuera! ¡Data Engineer Semi Sr.! ¿Por qué te elegiremos? ¡Porque los desafíos que asumirás reflejan tus ambiciones!Responsabilidades y atribucionesExperiencia en desarrollo de bases de datos relacionales, incluido PL/SQL. (Obligatorio)Experiencia en desarrollo ETL. (Obligatorio) Con herramientas Pentaho, talend u ODI.Experiencia con Postgres, Oracle, Teradata y/o otros RDBMS. (Obligatorio).Conocimiento de Hadoop, Hive, Spark y herramientas en la nube, como Databricks, Azure ADF y PowerBI y similares. (Deseable)Experiencia con metodologías de desarrollo ágil. (Obligatorio)Requisitos y calificacionesProfesional de las carreras de Ing. de Sistemas, Ing. de Software, Ing. Informática y/o carreras afines.Es deseable el manejo de Ingles y portugués.",STEFANINI LATAM,vacancy_type_effective,,True,,,Colômbia,https://stefaninilatam.gupy.io/job/eyJqb2JJZCI6NzI0Mzk0Miwic291cmNlIjoiZ3VweV9wb3J0YWwifQ==?jobBoardSource=gupy_portal,True,remote,True
7245362,2024-05-31T17:55:15.018Z,Desenvolvedor(a) - Pleno,"A Celk é uma empresa especialista em gestão de saúde pública que está no mercado há 14 anos. Somos focados em transformar a saúde pública do Brasil!Estamos presente em todo país, e oferecemos soluções que conectam toda a rede de atenção à saúde do cidadão, através de um software flexível, portátil e seguro, para compor uma gestão muito mais integrada e inteligente.Responsabilidades e atribuiçõesO(a) Desenvolvedor(a) apoia na gestão de dados e no funcionamento lógico de sistemas, diagnostica falhas e depura aplicativos, cria códigos e bibliotecas reutilizáveis para uso futuro. Apoia com ideias de soluções, objetivando a evolução técnica dos produtos da empresa.Responsabilidades:•	Participar ativamente do time do desenvolvimento;•	Criar componentes para o desenvolvimento de novos produtos;•	Fornecer manutenção, suporte e melhorias contínuas ao sistema legado;•	Especificar documentações técnicas das soluções Celk;•	Criar, planejar e executar testes;•	Analisar e corrigir bugs;•	Revisar código, identificar problemas na base e aplicar melhorias;•	Fazer análise de causa raiz em problemas de produção e apoiar na implementação de soluções para que eles não voltem a acontecer;•	Utilizar e disseminar boas práticas de programação e padrões de desenvolvimento;•	Modelar, estruturar e manipular dados em bancos de dados;•	Apoiar no processo de passagem de conhecimento;•	Realizar integração dos sistemas Celk;•	Registrar os resultados dos trabalhos, alimentando indicadores da área;Requisitos e qualificaçõesEnsino Superior concluído na área de Ciências da Computação, ADS, Sistemas da informação, Engenharias ou áreas correlatas;Conhecimento de Lógica de programação;Conhecimento com Estruturas de programação;Conhecimento com Versionamento;Conhecimento com banco de dados relacional e não relacional;Experiência em Java, Spring Boot, APIs REST e SOAP, Hibernate, testes unitários, Jasper, Mavem, ferramentas AWS e Gitlab (desejável).Informações adicionaisBenefícios:Assistência médicaAssistência odontológicaSeguro de vidaVale-Refeição/AlimentaçãoDay Off no dia do aniversárioWellhub (Antiga Gympass)Jornada: Home OfficeDe Segunda à Sexta, das 8h às 17h (40 horas semanais)",Celk Sistemas,vacancy_type_effective,,True,,,Brasil,https://celksistemas.gupy.io/job/eyJqb2JJZCI6NzI0NTM2Miwic291cmNlIjoiZ3VweV9wb3J0YWwifQ==?jobBoardSource=gupy_portal,True,remote,True
7239970,2024-05-31T17:20:41.127Z,Pessoa Desenvolvedora Java Fullstack (Pleno),"Nós, da Knewin, somos líderes na América Latina quando se trata de ajudar empresas e marcas a gerenciar sua reputação e presença online através de análises de dados. Com mais de 2000 clientes, nosso objetivo é conectar nossos parceiros com seu público-alvo, visando conquistar sua preferência e alcançar resultados excepcionais para seus negócios. Valorizamos uma cultura que prioriza a agilidade, a flexibilidade e a satisfação do cliente, enquanto acreditamos no potencial transformador da tecnologia, do conhecimento e, principalmente, das pessoas.Responsabilidades e atribuiçõesRealizar a manutenção e evolução dos sistemas que estão sob responsabilidade do time;Interagir com os dados em bases relacionais e não relacionais;Definir e criar padrões de desenvolvimento para o time;Executar testes manuais e/ou automatizados para garantir o atendimento do escopo solicitado;Criar e manter uma documentação mínima para garantir a disseminação do conhecimento necessário para a execução das atividades;Fazer avaliações técnicas de alterações e evoluções nos sistemas, analisando a viabilidade e o esforço, levando sempre em consideração a escalabilidade, estabilidade e segurança da informação;Interagir com a área de negócios para esclarecimento de requisitos, executar as análises necessárias e orientar o time sobre como proceder com as análises;Executar o deploy dos sistemas e apoiar o time na execução do mesmo;Monitorar novas tendências e tecnologias para planejar e desenvolver aplicações e serviços modernos a fim de atender e melhorar a eficiência dos produtos da empresa.Requisitos e qualificaçõesCompetências e experiências obrigatórias:Experiência na funçãoJava avançadoVueJSQuarkus ou Spring frameworkGithub actions ou outro sistema de integração contínuaDockerCompetências desejáveis:JooqLiquibaseInformações adicionais",Knewin,vacancy_type_effective,,True,,,Brasil,https://knewin.gupy.io/job/eyJqb2JJZCI6NzIzOTk3MCwic291cmNlIjoiZ3VweV9wb3J0YWwifQ==?jobBoardSource=gupy_portal,True,remote,True
7244995,2024-05-31T17:06:18.310Z,Desenvolvedor  PL/SQL,"# Quem somos? 📲A 3CON é enabler de inovação e transformação digital, construindo soluções de impacto para os negócios, que combinam estratégia, design, engenharia de software e performance. Oferecemos um ecossistema de soluções, serviços e parcerias de impacto para os negócios. Aqui na 3CON você terá oportunidade de atuar com empresas de grande porte por todo o Brasil, aliando as mais modernas tecnologias aos negócios, gerando resultados expressivos para nossos clientes.# O que estamos buscando? 💻Estamos em busca de um(a) Desenvolvedor PL/SQL para atuar em uma das maiores empresas varejista farmacêutica do Brasil! 😉Responsabilidades e atribuiçõesPossuir habilidades de comunicação para se comunicar com os usuários, capacidade de explicar problemas técnicos de maneira clara e precisa;Possuir habilidades de resolução de problemas para identificar e solucionar problemas com sistemas de TI;Possuir habilidades de organização de informação, lógica, etc.Requisitos e qualificaçõesEspecialista em Tecnologia da Informação (TI) com conhecimentos fiscal/tributário;Desenvolvimento em PL/SQL, Java (BackEnd);Manutenção e suporte de Sistemas de Informação;Regras Fiscais, Emissão de NF e rotinas fiscais.Informações adicionais# O que oferecemos? 😍Convênio Médico + Convênio Odontológico + Vale Refeição + Seguro de Vida + Auxílio Creche + Treinamentos + Incentivo à Certificação + Parceria com Universidades + Parceria com Escolas de Línguas + No dress code + Ambiente de Trabalho Digital + Possibilidade de Home Office + Ambiente descontraído + Seguro de Vida + Utilização de Tecnologia de Ponta e muito mais!Tem esse conhecimento? Gostou da vaga? 😊Faça parte desse time❗️Por aqui a criatividade e a inovação têm cadeira cativa em nosso dia a dia. A ideia principal é pensar além, antecipar tendências e focar na experiência do usuário.",3CON | IT & Digital,vacancy_type_effective,,True,,,Brasil,https://trescon.gupy.io/job/eyJqb2JJZCI6NzI0NDk5NSwic291cmNlIjoiZ3VweV9wb3J0YWwifQ==?jobBoardSource=gupy_portal,True,remote,True
7244858,2024-05-31T16:51:23.479Z,Desenvolvedor Java Back End (APIs),"Somos a maior multinacional brasileira e estamos entre as 100 maiores empresas de TI do mundo.Estamos presentes em 41 países com +30k colaboradores. A Stefanini tem como principal objetivo auxiliar os clientes a encontrar, por meio de soluções personalizadas, a maneira ideal para alcançar seus desafios, impulsionando a inovação digital.E queremos mais!Responsabilidades e atribuiçõesO que esperamos que você realize:Desenvolver e manter APIs robustas e escaláveis utilizando Java e o framework Spring MVC.Trabalhar com as versões mais recentes do Java, incluindo Java 8, 11 e 17, para garantir a eficiência e a compatibilidade do código.Implementar e otimizar serviços utilizando Docker para ambientes de desenvolvimento e produção.Gerenciar instâncias EC2 e utilizar conceitos de Serverless quando aplicável.Colaborar com a equipe no desenvolvimento de soluções utilizando ElasticSearch, GIT e outras tecnologias relacionadas.Utilizar Spring Boot e Spring Data para simplificar o desenvolvimento e a integração de aplicações.Projetar e implementar APIs RESTful de alto desempenho.Experiência com JSF Primefaces para o desenvolvimento de interfaces de usuário.Escrever testes unitários eficazes utilizando JUnit, SpringRunner e WebMvcTest.Trabalhar com sistemas de mensageria, como JMS, RabbitMQ e Kafka.Conhecimento básico de Pipeline Jenkins para integração contínua.Requisitos e qualificaçõesO que precisamos que você tenha de conhecimento:Requisitos essenciais:Experiência comprovada em desenvolvimento Java e Spring Framework MVC.Proficiência em Java 8+, 11 e 17, com sólido entendimento de boas práticas de desenvolvimento.Conhecimento em Docker, EC2 e outras tecnologias de virtualização.Familiaridade com Serverless, ElasticSearch, GIT e outras ferramentas de desenvolvimento colaborativo.Experiência em Spring Boot e Spring Data.Experiência em design de APIs RESTful e práticas de Clean Code.Capacidade de trabalhar de forma colaborativa, responsável e autogerenciada.Forte habilidade em escrever testes unitários de qualidade.Diferenciais:Experiência com Cloud AWS e suas principais serviços.Conhecimento em NodeJS.Familiaridade com ferramentas de monitoramento como Grafana e Kibana.Conhecimento em Javascript, Swagger e metodologias ágeis.Informações adicionaisO que te oferecemos:Ambiente de trabalho inovador e colaborativo.Oportunidade de aprendizado e crescimento profissional.Benefícios competitivos e remuneração compatível com o mercado.",Stefanini Group,vacancy_type_effective,,True,,,Brasil,https://stefanini.gupy.io/job/eyJqb2JJZCI6NzI0NDg1OCwic291cmNlIjoiZ3VweV9wb3J0YWwifQ==?jobBoardSource=gupy_portal,True,remote,True
7244769,2024-05-31T16:31:06.956Z,Pessoa Desenvolvedora FrontEnd React Sênior,"Estamos buscando uma pessoa que ouse protagonizar ocupando a posição de Pessoa Desenvolvedora FrontEnd React Sênior . 💜Junte-se à Datum e faça parte da 6ª melhor empresa para trabalhar no Rio Grande do Sul e a 28ª do Brasil pelo GPTW!Responsabilidades e atribuiçõesDesenvolvedor Frontend Senior, com foco em React.js e boa experiência em Node.js, para atuar na criação de novas features, manutenção das funcionalidades e correções de bugs do novo;O profissional deve ser capaz de propor novas soluções que visem a melhoria e otimização dos sistemas web mantidos pela tribo;Participação ativa nos ritos do modelo de trabalho, code-reviews, pair programmings e elaboração de documentações;Contribuir na construção de Software sustentável e escalável;Planejar e integrar os recursos de Frontend em colaboração com outros integrantes do time de desenvolvimento, experiência e produto;Utilizar as melhores práticas de engenharia de software.Requisitos e qualificaçõesMandatória experiência em desenvolvimento Frontend na tecnologia React, configurações, padrões e boas práticas de desenvolvimento;Sólida Experiência em Node.js;Experiência com versionamento de código em Git. Gitflow e fluxo de desenvolvimento utilizando pipeline (esteira) CI/CD;Desenvolvimento limpo, organizado, sempre aplicando boas práticas, conceitos de performance e segurança em primeiro lugar;Vivência em metodologias ágeis e participação em seus ritos e dinâmicas, Scrum/Kanban.Diferencial: Conhecimento em React Native.Informações adicionaisNossos datunianos usufruem de benefícios e programas que atendem diversas áreas da vida.Para sua saúde, oferecemos assistência médica e odontológica sem coparticipação em exames e consultas.Seguro de vidaQuer mais bem-estar? Oferecemos Gympass, Zenklub (com duas sessões gratuitas por mês) e ginástica laboral para dar aquela alongada durante o expediente.Quando bater aquela fome, utilize nosso benefício de alimentação Caju para fazer compras em qualquer supermercado ou restaurante.Ama viajar? Aqui temos o Férias &amp; Co, um benefício que te ajuda a viabilizar aquela viagem dos sonhos.Tem filhos? Temos auxílio creche.Quer aprender um novo idioma? Temos parceria com a escola CCAA, com descontos de até 40% nos cursos, e também o English Live que oferece 30% de desconto na mensalidade.Para deixar seu ambiente de trabalho com a sua cara, conte com o nosso auxílio home office.Quer protagonizar? Participe do Protagonistas, nosso game da vida real, e ganhe prêmios incríveis!",Datum TI,vacancy_type_effective,,True,,,Brasil,https://datum.gupy.io/job/eyJqb2JJZCI6NzI0NDc2OSwic291cmNlIjoiZ3VweV9wb3J0YWwifQ==?jobBoardSource=gupy_portal,True,remote,True
7165626,2024-05-31T15:01:08.826Z, Pessoa Desenvolvedora Front-end (Angular),"Estamos procurando um(a) Desenvolvedor Front-end (Angular) motivado(a) e experiente para se juntar à nossa equipe de tecnologia. A Nossa vaga para Desenvolvedor Front-end (Angular) é para atuar com um grande cliente da área de seguros.A pessoa contratada vai trabalhar com uma equipe multidisciplinar e atuar com o planejamento e execução de projetos que podem envolver produtos, serviços, estratégia ou processos.Responsabilidades e atribuiçõesDesenvolver interfaces em angular conforme os requisitos técnicos mencionados e garantir a qualidade do código entregue;Conhecimento no desenvolvimento de projetos baseados em Metodologia Ágil (desejável).Possuir autonomia com as tarefas;Participar ativamente desde o desenvolvimento até a implantação da solução;Pró atividade;Organização.Requisitos e qualificaçõesExperiência com framework Angular com Ionic: V.5.6.11;Necessário conhecimento Angular/core: V.10.2.5 e Node.js: V.16.19.1, Firebase;Conhecimento complementar nas ferramentas Jira, octane, Confluence; SCRUM, Kanban;Desejável conhecimento no Software Android Studio.Requisito diferencial: entender de tecnologias legadas.",MJV Technology & Innovation,vacancy_type_effective,,True,,,Brasil,https://mjvcarreiras.gupy.io/job/eyJqb2JJZCI6NzE2NTYyNiwic291cmNlIjoiZ3VweV9wb3J0YWwifQ==?jobBoardSource=gupy_portal,False,remote,True
7243860,2024-05-31T14:34:52.868Z,Pessoa Desenvolvedora Back end Java Sênior ,"A FCamara em parceria com a Certsys que se consolidou como uma forte parceira de Transformação Digital, apoiando empresas disruptivas por meio de soluções digitais completas e escaláveis alinhadas às principais tendências e necessidades do mercado. Temos uma cultura poderosa, conectados de ponta a ponta, colaborativos, ágeis e flexíveis para encarar o novo, transparentes em nossas ações e unidos por um grande propósito: Revolucionar negócios e impactar pessoas, resolvendo desafios complexos através da nossa cultura e tecnologia. Além disso, somos certificados pela GPTW pelo segundo ano consecutivo, sendo uma das melhores empresas para se trabalhar no Brasil.Próximos dos clientes, apaixonados por tecnologia e pessoas (sim, aqui pensamos na sua evolução e carreira, vamos te desenvolver e cuidar da sua trilha de capacitação). Acreditamos na diversidade, equidade e inclusão de profissionais independente da sua deficiência, raça/ etnia, religião, gênero, orientação sexual, origem e constituição de família.Responsabilidades e atribuiçõesAtuar no desenvolvimento de software, escrevendo códigos para desenvolver aplicativos, programas e sistemas de software, seguindo as especificações e requisitos do projeto; Efetuar testes nos softwares desenvolvidos, identificando e corrigindo problemas, bugs e falhas no código, garantindo a qualidade da entrega, cumprimento de prazos e satisfação do cliente Certsys; Documentar códigos desenvolvidos, visando facilitar a manutenção e atualização posterior dos produtos; Auxiliar a equipe de desenvolvimento, fornecendo orientação técnica e liderança na entrega de soluções de alta qualidade; Desenvolver soluções de software de alta qualidade, garantindo que o código seja eficiente, escalável e manutenível; Pesquisar e Adotar novas tecnologias para melhorar o desempenho e a eficiência do software; Acompanhar e monitorar os sistemas em produção para identificar problemas e implementar soluções. Do que você precisa:  Formação superior completa em Tecnologia da Informação, Engenharia da Computação, Sistemas de Informação, Ciências da Computação ou similares (desejável); Conhecimento intermediário em Linguagens de Programação (desejável); Conhecimento Intermediário em Frameworks e Tecnologias (desejável); Conhecimento avançado em Bancos de Dados (desejável); Conhecimento avançado em Metodologias Ágeis (desejável); Experiência com Repositório (exemplo: GIT) (desejável); Experiência com Cloud (desejável). Requisitos e qualificaçõesCursos e Certificações: Certificação em Linguagem de Programação (desejável); Certificação em Cloud (desejável); Certificação em Metodologia Ágil (desejável). Informações adicionais",VENHA SER #SANGUELARANJA 🧡🚀,vacancy_type_effective,,True,,,Brasil,https://fcamara.gupy.io/job/eyJqb2JJZCI6NzI0Mzg2MCwic291cmNlIjoiZ3VweV9wb3J0YWwifQ==?jobBoardSource=gupy_portal,True,remote,True
7240519,2024-05-31T14:30:43.299Z,Pessoa desenvolvedor(a) Backend - Sênior,"A FCamara está em busca de uma Pessoa desenvolvedor(a) Backend - Sênior para atuar em uma das maiores empresas da América Latina líder no mercado em exames diagnósticos clínicos.Responsabilidades e atribuiçõesDesenvolver e manter aplicações backendProjetar, implementar e manter APIs RESTful e Graph QLTrabalhar com arquiteturas de micro serviçosImplementar e gerenciar ambientes de contêineres utilizando KubernetesIntegrar e gerenciar sistemas de mensageria usando KafkaGarantir a qualidade do código por meio de testes unitários e revisões de códigoColabora com times multifuncionais para definir, projetar e lançar novas funcionalidadesMonitorar e melhorar o desempenho de sistemas e serviços Requisitos e qualificaçõesHard Skills: Experiência sólida em desenvolvimento backend com Node JS e TypescriptExperiência prática na implementação de API Graph QLexperiência com Docker e Kubernetes para gerenciamento e orquestração de contêineresConhecimento em Apache Kafka para a construção de pipelines de dados e sistemas de mensageriaCompreensão profunda de diferentes tipos de arquitetura de sistemas, incluindo monolítica, micro serviços, serverless, entre outrasExperiência com desenvolvimento e integração de APISExperiência com banco de dados relacionais e não relacionaisConhecimento em práticas de DevOps e CI/CDInformações adicionais",VENHA SER #SANGUELARANJA 🧡🚀,vacancy_legal_entity,,False,São Paulo,São Paulo,Brasil,https://fcamara.gupy.io/job/eyJqb2JJZCI6NzI0MDUxOSwic291cmNlIjoiZ3VweV9wb3J0YWwifQ==?jobBoardSource=gupy_portal,True,hybrid,True
7243496,2024-05-31T13:19:09.273Z,DESENVOLVEDOR MOBILE PL,"Somos a maior multinacional brasileira e estamos entre as 100 maiores empresas de TI do mundo.Estamos presentes em 41 países com +30k colaboradores. A Stefanini tem como principal objetivo auxiliar os clientes a encontrar, por meio de soluções personalizadas, a maneira ideal para alcançar seus desafios, impulsionando a inovação digital.E queremos mais!Responsabilidades e atribuiçõesO que esperamos que você realize:Responsabilidades:Desenvolver aplicativos moveis Android de alta qualidade, seguindo os padroes de design e boas praticas de programacao.Colaborar com designers, analistas e outros desenvolvedores para definir, projetar e lancar novas funcionalidades.Realizar testes e depuracao de aplicativos para garantir a qualidade e estabilidade.Manter-se atualizado com as tendencias e tecnologias do mercado Android.Requisitos e qualificaçõesRequisitos:Experiencia comprovada no desenvolvimento de aplicativos Android usando Java ou Kotlin.Conhecimento solido de arquiteturas de aplicativos moveis, como MVP, MVVM ou Clean Architecture.Familiaridade com ferramentas de controle de versao, como Git.Experiencia com integracao de APIs RESTful e servicos web.Capacidade de trabalhar de forma colaborativa em equipe, comunicar-se de forma eficaz e resolver problemas de forma criativa.Ensino Superior Completa.Informações adicionaisO que te oferecemos:🍛 Vale Alimentação ou Vale Refeição;👨🏼‍🎓 Desconto em cursos, universidades e instituições de idiomas; 📚 Academia Stefanini - plataforma com cursos online, gratuitos, atualizados e com certificado; 🗣 Mentoring;🏫 Auxílio Creche; 💉 Clube de vantagens para consultas e exames;🏥 Assistência Médica;🦷Assistência Odontológica; 💰 Clube de vantagens e descontos nos melhores estabelecimentos;👂🏾 Atendimento psicológico online ao colaborador e seus dependentes;🛫 Clube de viagens;🐶 Convênio para Pet;e muito mais...",Stefanini Group,vacancy_type_effective,,True,,,Brasil,https://stefanini.gupy.io/job/eyJqb2JJZCI6NzI0MzQ5Niwic291cmNlIjoiZ3VweV9wb3J0YWwifQ==?jobBoardSource=gupy_portal,True,remote,True
7239555,2024-05-31T12:47:36.569Z,PESSOA DESENVOLVEDORA NODE.JS REACT SR - RHA2677,"Venha fazer parte de uma empresa que ama transformar com tecnologia e abraça a diversidade em todas as suas formas!Responsabilidades e atribuiçõesA Pessoa desenvolvedora será responsável pela criação e evolução de sistemas web, APIs e integrações, tendo a oportunidade de atuar internamente ou em clientes parceiros, contribuindo em todo o ciclo de vida, desde a concepção até a implantação, atuando com metodologias ágeis para entregar uma solução eficiente.Contribuir para o sucesso do produto e o crescimento da equipe;Conhecer as boas práticas de programação das tecnologias utilizadas;Escrever código limpo, de qualidade e de fácil manutenção.Você fará parte de um time de pessoas desenvolvedoras extremamente qualificado, fortemente orientado a resultados e que não tem medo de inovar, trabalhando com boas práticas de desenvolvimento em um ambiente dinâmico que incentiva a autonomia e o aprendizado constante.Requisitos e qualificaçõesImprescindível:NOde.jsReactPostGre SQLExperiência com desenvolvimento de software;Domínio em linguagem de programação (Java) JAVA EEDomínio em SQL Server (T-SQL)Repositório MavenExperiência em Banco de Dados estruturado Oracle (recomenda-se também Postgre,SQL Server);Domínio em Modelagem de Dados Relacional, Dimensional;Front-end: ReactDesenvolvimento de Serviço ( Rest e Soap-UI )Conhecimento em Servidores de Aplicação Ex ( Websphere 8.5 ou equivalente, JBoss )Conhecimento em JUnitConhecimento prático em GITMétodos ágeis (Scrum / SAFE / Kanban)Vivência com esteira de Devops (CI/CD)Formação Superior Completo em TIInformações adicionaisDesejável:PostgreSQLAdministração LinuxAzure CloudElasticSearch",Spread Tecnologia,vacancy_type_effective,,True,,,Brasil,https://spread.gupy.io/job/eyJqb2JJZCI6NzIzOTU1NSwic291cmNlIjoiZ3VweV9wb3J0YWwifQ==?jobBoardSource=gupy_portal,True,remote,True
