job_id,published_date,title,description,career_page_name,type,application_deadline,is_remote_work,city,state,country,job_url,disabilities,workplace_type,submitted
7168188,2024-06-13T18:59:58.693Z,GRUPO SOMA | SomaLabs | Analista de Produtos Digitais Pleno,"Inquietos e Acelerados. Criativos ou Cartesianos. Talentosos e Autodidatas. Artesanais ou Tecnológicos. Não importa: gostamos de diversidade e de quem está aqui para agregar.Porque GENTE É O QUE SOMA. O SomaLabs é a área de Inovação do Grupo Soma. Nossa missão é transformar o Grupo Soma em uma plataforma de tecnologia voltada para o varejo de moda. Somos responsáveis por criar soluções que agreguem valor ao negócio e por produtos que permitam escala e potencialização dentro do Grupo. Atuamos em toda a cadeia de valor do Grupo, desde a criação e desenvolvimento de novas peças das marcas até a experiência final do nosso cliente. Trabalhamos com times multidisciplinares e ágeis, sempre identificando e atuando em oportunidades/problemas com velocidade, fazendo entregas frequentes de forma incremental. Temos muita autonomia e responsabilidade, e focamos em iniciativas de alto valor agregado para o Grupo. O SomaLabs busca pessoas apaixonadas por inovação, que seja inquieta e resiliente. Acreditamos nas pessoas que tem uma excelente comunicação, faz e ajuda as coisas a acontecerem, trabalha em equipe e está sempre aberto a novos aprendizados.  Você irá trabalhar e se relacionar com diversas áreas do Grupo, como comercial das marcas, operações, estilo, atacado e outras áreas de negócios.Responsabilidades e atribuiçõesLevantar necessidades/dores junto às áreas de negócio,Avaliar as iniciativas priorizadas, levantando requisitos e dependências entre as áreas e e outros times de tecnologia,Gestão de Produtos Digitais,Propor soluções e promover alinhamento com técnico e stakeholders,Escrever histórias e realizar quebras no nível que viabilize a ativação de valor de forma incremental,Facilitar cerimônias que façam parte da metodologia adotada pela squad, como, plannings, refinamentos, retrospectivas, entre outras.Colaborar com a comunicação entre equipes e departamentos da empresa para entender suas necessidades e garantir que as soluções de tecnologia atendam a essas necessidades.Gerenciar conflitos que possam surgir dentro da equipe de tecnologia ou entre a equipe de tecnologia e outros departamentos da organização. Isso envolve a identificação rápida dos problemas, a avaliação das causas raiz e o desenvolvimento de soluções práticas e eficazes para resolvê-los.Responsável por gerar, manter e atualizar backlog e produzir visão de roadmap de curto, médio e longo prazo,Realizar priorizações com base em engenharia de valor utilizando fatos e dados e apoiar as áreas de negócio na tomada de decisão,Garantir o bom andamento das tarefas, manter as ferramentas de gestão atualizadas e comunicar o andamento a todas as partes interessadas (reports),Zelar pela manutenção e precisão das documentações do produto que irá atuar,Adaptar-se rapidamente quando as prioridades ou situações mudam,Trabalhar com autonomia, porém sem individualismo, aproveitando os diversos perfis profissionais do time para potencializar suas entregas.Requisitos e qualificaçõesTer trabalhado com produtos digitais como Product Owner, Product Manager, Product Operations ou em funções similares;Experiência com metodologias ágeis (Scrum, Kanban e/ou outras);Habilidade de se comunicar de forma clara e objetiva por meio de escrita, fala e apresentações;Habilidade de construir relacionamentos e trabalhar de forma colaborativa com times e stakeholders diversos;Atuar com protagonismo para puxar iniciativas e soluções de problemas,Vivência com melhoria de processos, produtos ou serviços,Habilidades organizacionais e de gerenciamento de tempo.Boa capacidade de planejamento e organização;Postura provocativa e disposta a questionar o status quo com pares e lideranças da área de produtos e áreas correlacionadas.Informações adicionaisRegime e horárioHíbrido e flexível;BenefíciosVale alimentação/refeição;Plano de saúde e odontológico;Flexível (alimentação, refeição e mobilidade);Gympass;Licença parental;Day off no dia do aniversário;Desconto nas marcas do grupo;",GRUPO SOMA,vacancy_type_effective,,False,Rio de Janeiro,Rio de Janeiro,Brasil,https://gruposoma.gupy.io/job/eyJqb2JJZCI6NzE2ODE4OCwic291cmNlIjoiZ3VweV9wb3J0YWwifQ==?jobBoardSource=gupy_portal,True,hybrid,True
6557016,2024-06-13T18:59:05.209Z,Analista de TI Pleno | Windows,"Analista de TI Pleno voltado para Windows.Responsabilidades e atribuiçõesPrincipais responsabilidades:Fazer atuação proativa dos ambientes transacionais dos clientes, atuando nos desvios de comportamento do ambiente de infraestrutura, dentro do seu campo de atuação e buscando a estabilização:Tratar incidentes, solicitações, problemas e mudanças.Identificar eventuais problemas na infraestrutura dos clientes, efetuar a devida comunicação a liderança e Customer Success, atuar para reestabelecer o ambiente.Atuação em degradações e/ou Crises que são processos de priorização com o objetivo de reestabelecer o ambiente e minimizar impactos ao cliente.Documentar e evidenciar adequadamente as atuações efetuadas em incidentes, solicitações, degradações, crises e tarefas de mudanças.Realizar aceite de ambientes.Executar checklists proativos para identificação de possíveis futuros problemas nos ambientes.Identificar e eventualmente implementar oportunidades de melhoria para redução de volumetria ou melhoria de qualidade nas atividades executadas.Analisar e definir a solução mais adequada para os incidentes identificados, realizando acionamento de analistas com senioridade maior para apoio, caso se faça necessário, visando solucionar os incidentes dentro dos prazos estabelecidos em contrato.Trabalhar em conformidade com as melhores práticas do ITIL.Acompanhar os indicadores e métricas de desempenho da área.Requisitos e qualificaçõesRequisitos obrigatórios:Curso Superior Completo;Conhecimento avançado em Virtualização (Hyper-v e SCCM) e conhecimentos em Vmware;Conhecimento em Double-Take;Experiência comprovada em troubleshooting;Conhecimento avançado em políticas e processo de backup;Experiência com Tuning e performance de Sistemas Operacionais Windows Server;Conhecimento de Infraestrutura (SO, Storage e Redes) são diferenciais;Necessário Certificação em nuvem; Conhecimento em ferramentas de monitoração, Zabbix, Nagios e Ninsoft;Conhecimento em ferramentas de automação e Devops, como Salt, Jenkins, GIT, desenvolvimento de scripts powershell;Conhecimento técnico do idioma inglês, fluência no idioma será considerado um diferencial;Conhecimento em metodologias ITIL, ITSM (Sennsr-it e Service Now) e processos de governança.Requisitos desejáveis:- Conhecimento/ Experiência no suporte Técnico Nível 3 em Gestão de Ambientes e Implementação de Projetos;- Conhecimento/ Experiência na instalação, Manutenção e Atualização de Ambientes com base em Servidores com Sistemas Operacionais Windows Server;- Conhecimento/ Experiência na instalação, Configuração, Migração e Criação de novos Ambientes de acordo com as melhores práticas do mercado;- Conhecimento/ Experiência na implementação de Melhorias, automações e documentações em ambientes baseados em Sistemas Operacionais Windows Server;- Conhecimento/ Experiência em administração e Controle de Atividades em ambientes de missão crítica.Informações adicionaisO que oferecemos para você? ✔Vale Refeição ou Alimentação; ✔Assistência médica e Odontológica; ✔Convênio Farmácia (descontos na compra de medicamentos); ✔Seguro de Vida; ✔Convênio Academia;✔TIVIT Club (descontos e parcerias com as melhores lojas);✔PAC - Programa de aceleração de carreira; ✔Reembolso para certificações; ✔MOBIFLIX – Nossa academia corporativa tem cursos presenciais e online, alinhados as novas tendências do mercado de tecnologia; ✔Plataforma online de crédito consignado, a TIVIT te ajuda a realizar os seus objetivos pessoais como reforma no seu apê/casa, financiar estudos e quitar dívidas, de acordo com as regras e políticas da cia; ✔Programa de Apoio Pessoal com orientação psicológica, financeira e jurídica em parceria com a Alelo. Acreditamos que o presente é plural e a inclusão transforma, por isso, todas as pessoas são bem-vindas em nossas vagas, para promovermos um ambiente de trabalho inclusivo, de respeito, justiça e equidade. Topa embarcar nesse desafio com a gente?  #vemserTIVIT",TIVIT,vacancy_type_effective,2024-07-13T00:00:00.000Z,False,Campinas,São Paulo,Brasil,https://tivit.gupy.io/job/eyJqb2JJZCI6NjU1NzAxNiwic291cmNlIjoiZ3VweV9wb3J0YWwifQ==?jobBoardSource=gupy_portal,False,hybrid,True
7307806,2024-06-13T18:54:35.559Z,Analista de Operações Cripto Pl,"Que tal fazer parte da construção do futuro da economia digital?Democratizar o acesso cripto a milhares de pessoas e deixar sua marca em uma revolução que não tem mais volta?Topa? Então vem ser MBmaker!Aqui você tem a autonomia e o espaço para inovar, contribuir e aprender com um time formado pelos melhores profissionais do mercado.Tudo em um ambiente que valoriza a colaboração, a pluralidade, a diversidade de pessoas, experiências, perfis…Aqui no MB, a gente revoluciona. A gente Make o Futuro. Bora? vemproMB #vemserMBmaker #eumakeagenterevolucionaResponsabilidades e atribuiçõesO que você vai fazer? Operacionalizar e monitorar diversas atividades do dia a dia, como Pré-Listagem e Alavancagem, com o objetivo de manter o equilíbrio e a saúde da operação;﻿Atendimento de chamados relacionados a Operações Cripto;Acompanhar alterações realizadas e sugerir mudanças e melhorias necessárias para o business;Apoiar no levantamento de indicadores;Contribuir com as diversas áreas da empresa para identificar oportunidades de melhoria e solucionar problemas operacionais;Manter comunicação com áreas parceiras;Requisitos e qualificaçõesO que precisamos que você tenha? Superior Completo;Excel intermediário;Conhecimentos intermediário em ferramentas de BI (análise de dados);Diferencial: Conhecimento em ferramentas de IA e programação em Python;Diferenciais:Passagens por Instituições Financeiras;Formação preferencialmente na áreas de Engenharia, Administrativa ou Financeira;Informações adicionaisA GENTE CUIDA DE CADA MBMAKER E SUAS FAMÍLIAS!Plano de saúde: ampla cobertura nacional, telemedicina e acesso aos melhores hospitais e laboratórios, incluindo dependentes.Plano Odontológico: cobertura nacional válida para você e seus dependentes cuidarem da sua saúde bucal.Dr. Pet: isso mesmo, família aqui inclui seus amigos pets também! Plano de saúde veterinário para você cuidar da saúde do seu melhor amigo.Auxílio-creche ou babá: para filhos de até 60 meses. Licença-maternidade estendida de 6 meses.Licença-paternidade estendida de 20 dias.Seguro de vida: cobertura completa para cuidar de quem realmente importa: você.PLR: participação nos lucros e resultados alinhados com o nosso negócio.LIBERDADE E FLEXIBILIDADE PARA VOCÊ!Beneflex: por meio do cartão Caju, nosso time recebe um crédito mensal para usar da forma que quiser: como alimentação, refeição, home office, mobilidade ou saúde. Remote first: aqui você tem a opção de trabalhar de onde quiser - esse é o #nossojeitodetrabalhar! Somos remote first, então escolha aonde prefere estar - em casa, no nosso escritório em SP ou nos nossos coworkings parceiros - We Work e Beer or Coffee - com cerca de 800 espaços espalhados por todo BrasilGympass: para que nosso time e seus familiares escolham a atividade física que quiserem praticar, e cuidem da saúde física e mental todos os dias!Day off de Aniversário: escolha o melhor dia para celebrar no mês do seu aniversário! #MBirthdayoff.#maisumanoMB: a cada ano que completa aqui na nossa jornada, você ganha uma camiseta incrível da nossa MB Store.SEJA CRIPTOAprenda sobre cripto: tenha acesso a todos os cursos disponíveis na plataforma Blockchain Academy.Taxa especial: invista no MB e tenha taxas incríveis e diferenciadas.",Oportunidade Mercado Bitcoin,vacancy_type_effective,2024-09-30T00:00:00.000Z,True,,,Brasil,https://mb.gupy.io/job/eyJqb2JJZCI6NzMwNzgwNiwic291cmNlIjoiZ3VweV9wb3J0YWwifQ==?jobBoardSource=gupy_portal,True,remote,True
7237866,2024-06-13T18:53:23.107Z,Analista de Supervisão Pleno - monitoramento das mesas de operações,"Nós movemos o mercado financeiro para o futuro, impulsionando negócios e potencializar a economia do país. Com o maior hub de dados e informações do cenário financeiro brasileiro, lideramos iniciativas que realmente importam: defendemos os interesses dos nossos parceiros e investidores, fornecemos ferramentas analíticas e dados, educamos investidores e certificamos profissionais, além de estabelecermos regras para as instituições do mercado financeiro e de capitais. 💛Mas o que você vai encontrar quando se juntar a este time supercompetente? Na ANBIMA, o ambiente respira a[PT1] [VTS2]  cultura digital, colaboração, transparência e abertura são o ar que respiramos. Provocamos o desenvolvimento pessoal e profissional para enfrentar os desafios do mercado, com um propósito claro de transformação e impacto social. Responsabilidades e atribuiçõesVocê será responsável por:Supervisionar as atividades de negociação de produtos de renda fixa e derivativos em mercado de balcão, desempenhadas por mesas de operações de bancos e corretoras;Avaliar a adequação da formalização de operações e das estruturas, sistemas e fluxos relacionados às atividades das mesas de operações;Acompanhar, de forma contínua, as operações de Debêntures, CRI e CRA realizadas pelo mercado e identificar operações atípicas e que possam apresentar indícios de descumprimento aos dispositivos da Autorregulação;Conduzir investigações relacionadas à indícios de descumprimento às regras de autorregulação da associação, observadas a partir da aplicação de filtros estatísticos sobre dados da indústria, análise de documentos e processos, denúncias etc;Elaborar de relatórios técnicos de análise, com conclusão sobre a existência de descumprimentos às regras de autorregulação cometidos por instituições participantes da ANBIMA;Elaborar e realizar apresentações sobre as atividades desempenhadas, para subsidiar os organismos internos na tomada de decisão sobre abertura de eventuais processos de autorregulação;Criar cartas de orientação ao mercado e acompanhar a implementação de planos de ação para regularização de processos das instituições supervisionadas.Requisitos e qualificaçõesContamos que você traga:Conhecimento do mercado financeiro: taxas de juros, câmbio, renda fixa, derivativos, etc.Conhecimento das atividades de estruturação e negociação dos produtos de renda fixa e derivativos de balcão.Conhecimento sobre precificação de títulos de renda fixa e derivativos.Ótima capacidade de redação e visão macro de processos.Bom Raciocínio Lógico e capacidade de análise de riscos. Informações adicionaisConfira nossos benefícios:- Salário Competitivo - Vale Refeição- Vale Alimentação; - Assistência Médica; - Assistência Odontológica; - Modelo de trabalho híbrido; - Seguro de Vida;- Previdência Privada; - Auxílio Home Office; - Licença Parental de 6 meses para todos os colaboradores da ANBIMA;- 13° de Bolsa Auxílio; -Auxílio Funeral; - Parcerias, Day Off de aniversário e muito mais...Local de trabalho: Nosso escritório fica na região de Pinheiros próximo da estação de trem. Estamos trabalhando de forma hibrida, escritório (3x por semana) e home-office (2x por semana). ",ANBIMA  ,vacancy_type_effective,,False,São Paulo,São Paulo,Brasil,https://anbima.gupy.io/job/eyJqb2JJZCI6NzIzNzg2Niwic291cmNlIjoiZ3VweV9wb3J0YWwifQ==?jobBoardSource=gupy_portal,False,hybrid,True
7304963,2024-06-13T18:53:11.009Z,ANALISTA DE RH- FOCO RECRUTAMENTO E SELEÇÃO,"Responsável: por analisar, implantar e realizar políticas e procedimentos de recrutamento e pré-seleção por meio de processos seletivos internos ou externos, propor e implementar programas de treinamento e desenvolvimento pessoal, apresentar a pré-seleção aos responsáveis da área para seleção final, elaborar anúncios de recrutamento para os meios de comunicações. Realização de implantação de unidade, treinamento e desenvolvimento, dentre outras atividades.NECESSÁRIO DISPONIBILIDADE TOTAL PARA VIAGEMResponsabilidades e atribuiçõesResponsável: por analisar, implantar e realizar políticas e procedimentos de recrutamento e pré-seleção por meio de processos seletivos internos ou externos, propor e implementar programas de treinamento e desenvolvimento pessoal, apresentar a pré-seleção aos responsáveis da área para seleção final, elaborar anúncios de recrutamento para os meios de comunicações. Realização de implantação de unidade, treinamento e desenvolvimento, dentre outras atividades.NECESSÁRIO DISPONIBILIDADE TOTAL PARA VIAGEMRequisitos e qualificaçõesResponsável: por analisar, implantar e realizar políticas e procedimentos de recrutamento e pré-seleção por meio de processos seletivos internos ou externos, propor e implementar programas de treinamento e desenvolvimento pessoal, apresentar a pré-seleção aos responsáveis da área para seleção final, elaborar anúncios de recrutamento para os meios de comunicações. Realização de implantação de unidade, treinamento e desenvolvimento, dentre outras atividades.NECESSÁRIO DISPONIBILIDADE TOTAL PARA VIAGEMInformações adicionaisResponsável: por analisar, implantar e realizar políticas e procedimentos de recrutamento e pré-seleção por meio de processos seletivos internos ou externos, propor e implementar programas de treinamento e desenvolvimento pessoal, apresentar a pré-seleção aos responsáveis da área para seleção final, elaborar anúncios de recrutamento para os meios de comunicações. Realização de implantação de unidade, treinamento e desenvolvimento, dentre outras atividades.NECESSÁRIO DISPONIBILIDADE TOTAL PARA VIAGEM",GRSA,vacancy_type_effective,,False,Joinville,Santa Catarina,Brasil,https://grsa.gupy.io/job/eyJqb2JJZCI6NzMwNDk2Mywic291cmNlIjoiZ3VweV9wb3J0YWwifQ==?jobBoardSource=gupy_portal,True,on-site,True
7298203,2024-06-13T18:51:15.637Z,ANALISTA - SERVICE DESK TRILÍNGUE- GOIÂNIA/GO - STAFF,"Somos a Tahto, uma empresa com uma nova mentalidade de negócios, que usa a tecnologia não apenas para criar soluções de atendimento ao cliente, mas para manter o ser humano no centro de tudo o que fazemos. Somos mais de 8 mil colaboradores espalhados em 5 estados do Brasil, pessoas de todas as diversidades, culturas, raças, gêneros, e que são valorizadas pela sua história.Para compor ainda mais esse time de sucesso, buscamos talentos que nos ajudem a ser uma empresa protagonista em transformar a vida de pessoas com soluções em tecnologia e inovações, sempre com muito tato, empatia e qualidade. Se você tem esse perfil e é movido por desafios e novas conquistas, venha fazer parte do nosso time!A Tahto valoriza o potencial dos seus colaboradores e por isso conta com um programa de oportunidades internas, voltado para quem busca crescimento e desenvolvimento profissional. Você pode ser um deles!""Contamos com o seu calor humano e a sua atitude imaginativa para juntos escrevermos uma nova história. A Tahto é tecnologia, calor humano, criatividade. A Tahto somos nós!#soutahtoResponsabilidades e atribuiçõesExecutar procedimentos necessários para resoluções dos problemas;Categorizar os tickets de acordo com as dúvidas dos clientes;Realizar análises preliminares ou solucionar problemas, se necessário, e encaminhando-os à equipe relevante quando necessário;Traduzir o conteúdo da consulta do Espanhol ou Português para Inglês e documentando-o como uma nota privada no ticket antes de qualquer transferência;Executar demais atividades correlacionadas a função.Requisitos e qualificaçõesEnsino superior cursando ou completo;Preferencialmente Graduação em áreas de Informática ou áreas correlatas ao exercício da função;Conhecimento intermediário em comunicação escrita e oral claras, concisas e eficazes nos três idiomas (inglês, espanhol, português);Conhecimento básico em ITIL: Familiaridade com as melhores práticas do ITIL (Biblioteca de Infraestrutura de Tecnologia da Informação) e estruturas de gerenciamento de serviços de TI;Conhecimento básico em Rede: Conhecimento de conceitos de rede como TCP/IP, DNS, DHCP, VPN e firewalls;Conhecimento básico em Sistemas Operacionais: Familiaridade com sistemas operacionais comuns, como Windows,Mac OSe Linux;Conhecimento básico em Computação em nuvem: Compreensão de plataformas em nuvem como Amazon Web Services (AWS), Microsoft Azure ou Google Cloud Platform (GCP);Conhecimento básico em tecnologias web (JavaScript, HTML, CSS).Competências comportamentais:Foco no cliente;Empatia;Adaptação rápida a novas ferramentas e produtos;Capacidade de colaboração para resolver problemas comerciais e tecnológicos;Comunicação.Informações adicionaisBenefícios: Auxílio Creche por filho até 05 anos completos;Auxílio Filho Excepcional - Até 95% do salário mínimo vigente;Plano de Saúde e Odontológico;Seguro de vida;Vale Transporte;Vale Alimentação e / ou Refeição;PPR - Programa de Participação nos Resultados;A concessão dos benefícios condicionados a um conjunto de requisitos, que serão informados no ato da contratação.",Tahto - Staff e Executivo #VemSerTahto,vacancy_type_effective,2024-06-28T00:00:00.000Z,False,Goiânia,Goiás,Brasil,https://vemsertahto.gupy.io/job/eyJqb2JJZCI6NzI5ODIwMywic291cmNlIjoiZ3VweV9wb3J0YWwifQ==?jobBoardSource=gupy_portal,True,on-site,True
7307481,2024-06-13T18:50:25.858Z,Analista de Segurança da Informação Pleno,"O SBT busca mais um SBTista para fazer parte da família! Aqui as oportunidades são iguais para todos! Com forte convicção em nosso potencial quando trabalhamos juntos, estimulamos um ambiente de colaboração e parceria. Valorizamos os nossos colaboradores e prezamos pelo desenvolvimento e aprendizado de quem faz parte da emissora. Reconhecemos que cada um desempenha um papel fundamental para sermos o SBT. Você se identifica com a oportunidade e nossa cultura? Então, ""Vem pra cá, vem pra cá""!Responsabilidades e atribuiçõesComo Analista de Segurança da Informação, você vai:Apoiar no processo de tratamento de incidentes e problemas de Segurança da informação;Apoiar no ciclo de vida e gestão das ferramentas de segurança da informação (Antimalware, Gestão de Vulnerabilidades, CSPM, entre outros);Gerir indicadores de projetos e chamados;Fomentar a cultura de segurança, auxiliando na produção de materiais informativos e treinamentos corporativos;Apoiar de forma consultiva, as demais áreas da companhia, na adoção de boas práticas de segurança da informação;Apoiar na construção de mapeamentos de risco, elaboração de normas e procedimentos relacionados à segurança da informação;Apoiar na análise de risco e revisão do ciclo de vida de identidades;Apoiar a adoção das melhores práticas de segurança da informação nos processos de TV.Requisitos e qualificaçõesPara a posição, você precisa ter: Graduação em Segurança da Informação, Tecnologia da Informação ou outras áreas afins;Conhecimento em Cloud Security (GCP/AWS/Azure);Inglês usual para escrita, leitura e conversação;Boa capacidade de comunicação escrita e verbal;Disciplina para gestão de múltiplas demandas e visão de prioridade;Visão crítica e criativa, orientada à melhoria contínua;Excelente relacionamento interpessoal e trabalho em equipe;Disponibilidade para atuar presencialmente no SBT (Osasco/SP).Você sai na frente se tiver:Certificações em Segurança da Informação, em especial ISO27001 e Security;Certificações de Governança tais como COBIT, ITIL ou afins;Proficiência em Inglês.Informações adicionaisAlém de poder trabalhar na TV mais Feliz do Brasil, você vai receber:Salário alinhado às práticas de mercado;Vale Refeição;Vale Alimentação;Gympass;Assistências Médica e Odontológica para você, cônjuge e filhos;Vale Transporte, Estacionamento e/ou Fretados disponíveis em diversas regiões;Previdência Privada;Seguro de Vida;Auxílio Creche;Facilidades no próprio CDT como Salão de Beleza, Banco, Praça de Alimentação para aquele lanchinho da tarde, Ambulatório para consultas com médicos de diversas especialidades, além de poder realizar alguns exames clínicos;Programas de apoio psicológico, nutricional e ergonomia;Treinamentos, lives e outros conteúdos para turbinar o conhecimento;Acesso ao Clube SBT, com descontos em produtos, lazer, cursos, etc.",#SejaSBT,vacancy_type_effective,,False,Osasco,São Paulo,Brasil,https://sejasbt.gupy.io/job/eyJqb2JJZCI6NzMwNzQ4MSwic291cmNlIjoiZ3VweV9wb3J0YWwifQ==?jobBoardSource=gupy_portal,True,on-site,True
