job_id,published_date,title,description,career_page_name,type,application_deadline,is_remote_work,city,state,country,job_url,disabilities,workplace_type,submitted
6688952,2024-02-01T19:29:17.446Z,Analista de Logística II - Indicadores e Dados (Last Mile B2B) - Vaga afirmativa para pessoas negras ,"No Grupo Boticário, trabalhamos com muita agilidade, inquietação e brilho nos olhos; buscamos sucesso de forma responsável e nutrimos nossas relações! Aqui na área de Logística, você terá a oportunidade de estar em uma estrutura que vive o processo de sonhar com um produto até vê-lo entregue ao consumidor. Uma área que se desafia constantemente quando o assunto é multimarcas e multicanais.Temos a preocupação em desenhar estratégias que atendam nossas Unidades de Negócio, Parceiros e Consumidores, respeitando suas particularidades e suportando o crescimento exponencial da companhia, para que assim possamos continuar distribuindo beleza pelo mundo!Responsabilidades e atribuiçõesGerar análises e manter dashboards para Logística no Canal Indireto B2B.Atuar proativamente nas operações de atendimento Last Mile (Direto e Indireto).Promover soluções e assegurar o acompanhamento e execução de oportunidades identificadas nos processos e indicadores.Realizar análises, controles e melhorias em indicadores logísticos.Construir, alimentar e extrair relatórios utilizando planilhas.Identificar informações necessárias para controle de indicadores na base de dados.Elaborar materiais para apresentações executivas.Requisitos e qualificaçõesSuperior completo;Habilidade e domínio de ferramentas Google;Experiência com Análise de dados e construção de cenários;Será um diferencial já ter trabalhado em logística de distribuição.Conhecimento em ferramentas lean e ágil será diferencial.Informações adicionaisO Grupo Boticário promove a diversidade e queremos conosco pessoas que mudem o jogo e façam bonito, independente do gênero, raça, orientação sexual, religião, nacionalidade, idade ou deficiência.Nos preocupamos com o bem-estar das nossas pessoas, por isso oferecemos um pacote de benefícios que permitem uma vida mais saudável e completa.Nossa jornada de trabalho tem carga horária flexível e sustentável. Vai trabalhar em modelo híbrido ou remoto? Oferecemos o auxílio home-office.Todo mundo merece um momento para cuidar da alimentação, certo? Aqui você poderá contar com o vale refeição e/ou vale alimentação (conforme elegibilidade), mas se você for trabalhar em uma das nossas fábricas ou centros de distribuição temos restaurante;Tá, mas e a sua saúde? Para nós a sua saúde é prioridade, aqui oferecemos plano de saúde e programas com foco em saúde e bem estar:Central de Saúde 24hA Família CresceuAtendimento Social2ª Opinião MédicaTelemedicina - dentro do plano de saúdePsicologia on-lineOrientação JurídicaOrientação FinanceiraOrientação PsicológicaEntre nós - apoio a vítimas de violênciaRodas de Conversa com foco físico e emocionalCuidado com o colaborador durante o afastamentoCampanhas de prevenção em saúdeVacinação gratuita contra gripe para colaboradores e dependentesExames periódicosAvaliação ergonômicaTambém nos preocupamos com a sua segurança financeira e de sua família, garantindo cobertura de previdência privada, empréstimos com taxas diferenciadas e seguro de vida.Sabe a vida fitness? Deixa com o Gympass;E as crianças? Disponibilizamos o Auxílio para o Material Escolar;Falando em crianças, aqui no Grupo Boticário, acreditamos que todos possuem o direito a uma licença parental igualitária. Por isso oferecemos 120 dias de Licença Parental para papais e mamães;Todo mundo faz aniversário e, já que você está de parabéns, oferecemos o Day Off de Aniversário.Desconto de até 40% em nossos produtos! Agora sim viu vantagem, né? Além de convênios e parcerias diversas através da Associação de Colaboradores.Tá afim de fazer o bem? Aqui no GB proporcionamos oportunidades de participar em várias ações de voluntariado.Se identifica com o nosso jeito? Então vem fazer beleza com a gente!",Grupo Boticário,vacancy_type_effective,2024-02-06T00:00:00.000Z,False,Curitiba,Paraná,Brasil,https://grupoboticario.gupy.io/job/eyJqb2JJZCI6NjY4ODk1Miwic291cmNlIjoiZ3VweV9wb3J0YWwifQ==?jobBoardSource=gupy_portal,False,hybrid,True
6703147,2024-02-01T19:07:34.272Z,Analista de Dados ,"Você se identifica com a área de Tecnologia? Gosta de projetos que envolvam sustentação e dados?﻿Estamos em busca de um Analista de Dados para fortalecer nossa equipe. O profissional desempenhará um papel crucial nas análises de dados, Desenvolvendo e aprimorando dashboards e relatórios, automatizando e otimizando soluções de dados por meio da criação de pipelines e workflows, enquanto atua como ponto focal para disseminar a cultura de Dados e MIS, buscando constantemente a evolução dos relatórios com novas ferramentas e abordagens inovadoras.Se você quer desenvolver uma carreira desafiadora e fazer parte de uma equipe dinâmica, nós queremos te conhecer! Conheça nossa história:A nossa história começa em 1994, na Argentina, quando a GIF se estabeleceu como fornecedora estratégica para empresas. Na mesma época, houve uma expansão comercial significativa, que foi acompanhada por um aumento de casos de fraudes. Foi nesse momento que a assumimos a responsabilidade de garantir a segurança das empresas e entramos em ação. Ao longo desses quase 30 anos, a GIF tem trabalhado incansavelmente na prevenção, detecção e combate às fraudes corporativas. Uma história marcada por confiança, dedicação, colaboração, transparência e respeito.Responsabilidades e atribuiçõesO que você fará no dia a dia:Dar visibilidade às principais métricas com Dashboards e relatórios;Automação e otimização de solução de dados, criar pipelines e workflows de tarefas.Criação e tratamento de bases de dados, criação e automatização de processos e relatórios;Ser ponto focal e difusor da cultura de Dados e MIS;Buscar constantemente a evolução dos relatórios através de novas ferramentas e visões diferenciadas;Elaborar dashboards para análises gerenciais e acompanhamento de indicadores, utilizando Power BI.Otimizar e automatizar planilhas e controles manuais para aumentar a eficiência operacional.Analisar, modelar, administrar e integrar bancos de dados, bem como os sistemas associados, garantindo aderência ao padrão de segurança de informação, arquitetura e dados;Requisitos e qualificaçõesÉ importante que você tenha:Experiência comprovada em manipulação de dados utilizando Python, Power BI, SQL Server;Experiência em estudos de análise de dados, construção de relatórios e indicadores;Experiência de pelo menos 3 anos na área de MIS/BI;Importante que saiba realizar extração, manipulação e análise de base de dados;Conhecimentos em estatística e validação técnica de testes/dados;Vivência na automatização de relatórios e processos.Informações adicionaisBenefícios:Vale RefeiçãoVale AlimentaçãoVale TransporteAssistência médicaAssistência odontológicaSeguro de vidaGympassAuxílio educaçãoAuxílio home-officePlataforma de cursos onlineDay off (dia do aniversário)Jornada flexívelModelo híbrido de trabalho (1x presencial/semana)",GIF International,vacancy_type_effective,,False,São Paulo,São Paulo,Brasil,https://gifinternational.gupy.io/job/eyJqb2JJZCI6NjcwMzE0Nywic291cmNlIjoiZ3VweV9wb3J0YWwifQ==?jobBoardSource=gupy_portal,True,hybrid,True
6695857,2024-02-01T18:37:52.873Z,ANALISTA DE LOGÍSTICA SR (FOCO EM DADOS) - CD Oba Hortifruti Sumaré ,"Quer trabalhar em uma empresa feita por gente, onde você terá chance para se desenvolver e mostrar o seu melhor?Então essa oportunidade é para você! #ObacarreirasResponsabilidades e atribuiçõesEstratificar e analisar dados estratégicos de logística;Criar Reports para tomada de decisão;Elaborar dashboards analíticos;Elaborar e desdobrar plano de ação para melhorar os indicadores ou processos;Participar da construção de novos processos da área.Requisitos e qualificaçõesSuperior completo (Administração de empresas, Logística);Conhecimento em Excell e Power Point avançado;Conhecimento em Power BI;Conhecimento WMS ( Sistema de Gerenciamento de Armazém).Informações adicionaisAssistência Médica;Assistência Odontológica (Opcional);Restaurante na empresa;Vale-transporte;Telemedicina;Programa de benefícios ( New Value);Desconto de 20% em FLV e Floricultura;Ofertas Exclusivas;Empréstimo consignado;Convênio Sesc;Voucher de Natal;Convênio Univers ( Farmácia);Horário: Segunda Sexta das 07h00 às 16h00, e Sábado das 07h00 as 11h00. (Presencial).",Oba Hortifruti,vacancy_type_effective,,False,Sumaré,São Paulo,Brasil,https://obahortifruti.gupy.io/job/eyJqb2JJZCI6NjY5NTg1Nywic291cmNlIjoiZ3VweV9wb3J0YWwifQ==?jobBoardSource=gupy_portal,False,on-site,True
6696439,2024-02-01T18:26:07.820Z,Assistente de Dados,"Será responsável pela elaboração, desenvolvimento, construção e manutenção de paineis/dashboards voltados para a gestão de resultados financeiros da unidade de incentivo, bem como para visões necessárias a projetos de clientes.Responsabilidades e atribuiçõesCriação, desenvolvimento e manutenção de paineis de dados, gráficos, tabelas, etc, para clientes e para gestão própria da Unidade de Incentivo;Interação com as áreas necessárias à execução dessas atividades;Interação com a área de negócios para alinhamento sobre as demandas e entregas;Sugestões de painéis, cruzamentos, estudos e análises;Requisitos e qualificaçõesPower BI;Excel;Power Point;Gestão de banco de dados e tabelas;",Vertem,vacancy_type_effective,,False,Barueri,São Paulo,Brasil,https://queroservertem.gupy.io/job/eyJqb2JJZCI6NjY5NjQzOSwic291cmNlIjoiZ3VweV9wb3J0YWwifQ==?jobBoardSource=gupy_portal,True,on-site,True
6704501,2024-02-01T21:52:21.245Z,Desenvolvedor Python,"A partir de 2019, a Pecista iniciou sua expansão com a marca Kaizen, criada para aumentar a proximidade com as oficinas e atender a pessoa física. Hoje já contamos com quatro unidades: Asa Norte, Ceilândia, Gama e SOF Sul, e não vamos parar por aí!Queremos estar no Brasil inteiro, transformando o segmento de autopeças. Isso porque nossa cultura prega um serviço de excelência, buscando sempre trazer inovações, aumentando a proposta de valor para os nossos clientes. E sabemos que só conseguiremos atingir isso com as pessoas certas.Assim, estamos contratando alguém para compor nosso time de E-commerce! Alguém que não se contenta com apenas bons resultados e que esteja com vontade de arregaçar as mangas para se desenvolver e chegar aonde for preciso.Além disso, por estarmos em constante crescimento, essa pessoa, ao se destacar, têm grandes chances de crescimento dentro do nosso grupo!Responsabilidades e atribuiçõesAqui, você irá aprender como vender e operar por trás do maior e-commerce de autopeças do DF. As suas responsabilidades e atribuições serão desde criar anúncios efetivos que vendem à bater os pedidos no nosso sistema e lidar com a logística dos marketplaces mais rápidos do Brasil.   Desenvolvimento de programas e planejamentos estratégicos voltados para aumentar a eficiência do comércio; Tratamento de Banco de Dados SQL; Gerenciamento de equipes; Aplicação de programas voltados para growth hacking; Automatização de processos em geral; Criação de anúncios de forma massiva usando Excel e outras plataformas;  Requisitos e qualificações Requisitos e qualificações:   Conhecimento em Python; Saber Excel;	  Diferenciais:	 Ter empreendido ou participado do MEJ; Conhecimento em JavaScript. Cursos de engenharia automotiva ou outras são diferenciais, mas não pré-requisitos; Intraempreendedorismo. Informações adicionaisHorário de trabalho: 44 horas semanaisSalário: R$ 3.180,00Benefícios:Vale transporte;Vale Alimentação/Refeição no valor de R$ 18,00 por dia;Cesta Básica;Plano Odontológico;Plano de Saúde;Seguro de vida em grupo;Venda de Produtos para funcionários;Cesta de Natal + brinquedo para quem tem filhos;Convênio com SESC;Kit fralda;Programa de indicação;",Kaizen - A Casa da Autopeça,vacancy_type_effective,,False,Guará,Distrito Federal,Brasil,https://kaizen.gupy.io/job/eyJqb2JJZCI6NjcwNDUwMSwic291cmNlIjoiZ3VweV9wb3J0YWwifQ==?jobBoardSource=gupy_portal,True,on-site,True
6700297,2024-02-01T15:20:13.527Z,Pessoa Engenheira de Dados com Python ,"A Minsait é uma companhia global de tecnologia com mais de 23 anos de atuação no Brasil, focada em inovação e líder em A Minsait, uma empresa do grupo Indra Company. É a maior empresa espanhola de Transformação Digital, presente em mais de 100 países e há quase 30 anos no Brasil. Combinamos nossa experiência em cloud, segurança, payments e phygital com a tecnologia mais inovadora para impulsionar nossos negócios, gerando um impacto positivo na sociedade.Somos aproximadamente 50k Minsaiters no Mundo e mais de 9k Minsaiters no Brasil e estamos presentes nas maiores empresas em todos os setores. Nossa estrutura permite participar de projetos globais e proporciona um ambiente colaborativo que nos certifica em GreatPlacesToWork e planos diferenciados para Jovens Profisionais também reconhecidos pela Employers for Youth.Nosso objetivo é liderar uma revolução tecnológica mais sustentável. Venha ser um Minsaiter!Responsabilidades e atribuiçõesPrincipais Frameworks: Django, Pandas e Selenium.Sólidos conhecimentos em integração de sistemas utilizando APISólidos conhecimentos em SQL server Desejável conhecimentos em Big Data.Requisitos e qualificaçõesFormação completa em TI;                   Conhecimento sólidos em SQL server ;Informações adicionaisModelo de contratação CLTPlano de Saúde subsidiado pela empresa para o titularOpção de inclusão de dependentes no Plano de Saúde com desconto em folha com desconto em folha de pagamentoAssistência Odontológica (opcional)Opção de inclusão de dependentes no Plano de Assistência Odontológica com desconto em folha de pagamentoVale Refeição OU AlimentaçãoVale Transporte (opcional)Gympass (Acesso a mais de 700 academias em todo o Brasil com planos a partir de R$ 29,90 descontado em folha de pagamento)Opção de inclusão de dependentes no Gympass (até 03 dependentes - pago via cartão de crédito)Parcerias com grandes marcas de consumoConvênios para descontos com instituições de ensino (graduação e pós-graduação) e escola de idiomasSeguro de vida em grupo.“ Nosso compromisso com a diversidade é um elemento-chave da nossa cultura: Igualdade de oportunidades, respeito pelas pessoas e não discriminação são princípios de atuação para todos os profissionais da Minsait. Integramos o Bloomberg Gender-Equality Index (GEI) 2021 em termos de diversidade e igualdade de gênero"".Todas as vagas são abertas também para PCDs.”",Minsait an Indra Company,vacancy_type_temporary,,True,,,Brasil,https://minsait.gupy.io/job/eyJqb2JJZCI6NjcwMDI5Nywic291cmNlIjoiZ3VweV9wb3J0YWwifQ==?jobBoardSource=gupy_portal,True,remote,True
6693157,2024-02-01T21:14:09.478Z,Analytics Engineer (Data Analyst) - Sênior/Especialista,"A Cadastra é uma empresa global de soluções de marketing, estratégia de negócios, tecnologia, dados e analytics, entrega resultados exponenciais em vendas por meios de canais digitais. Pioneira e líder em search engine marketing no Brasil, é a única empresa na América Latina a oferecer soluções de ponta a ponta em Transformação Digital. Com mais de 20 anos de experiência, o nosso know-how é multidisciplinar, dinâmico e sempre atual entre as áreas de Business &amp; Strategy, Performance &amp; Growth, Engaging Experince, Data &amp; Analytics, Content &amp; Creativity e Transformative Engineering.Nosso Time é composto por pessoas com iniciativa, que tomam decisões e têm alto grau de comprometimento. Somos curiosos, inquietos e gostamos de abraçar mudanças, pautados sempre por honestidade, respeito e transparência no que fazemos. Estamos crescendo aceleradamente, transformando pessoas e negócios com o que fazemos.Responsabilidades e atribuiçõesNo nosso Data Hub você terá o desafio de:Refinar e documentar as iniciativas priorizadas junto às áreas de negócio, levantando requisitos, necessidades e dependências;Apoiar a tomada de decisão utilizando dados, orientando as áreas sobre a forma mais adequada de consumo e qual o dado mais adequado para cada situação de negócio;Modelar tabelas, pipelines de dados e outras soluções técnicas;Criar e definir modelagens de repositórios de dados da instituição tais como (Data Lakes, DataWareHouses, Bases relacionais e não relacionais);Desenvolver estratégias de aquisição de dados (históricos e online), recuperação de informação, implementação de pipelines de processamentos de dados e armazenamento de dados;Desenvolver relatórios automatizados usando ferramentas de visualização de dados;Manter repositórios de dados seguros e pipelines de integração confiáveis e escaláveis;Trabalhar com autonomia, porém sem individualismo, aproveitando os diversos perfis profissionais do time para potencializar suas entregas;Colaborar nos alinhamentos, reuniões e cerimônias junto ao cliente.Requisitos e qualificaçõesO que a Cadastra espera de você:Conhecimentos sólidos nos conceitos de Big Data;Experiência utilizando SQL e Python;Conhecimento sólidos em engenharia de dados utilizando ambientes Cloud, preferencialmente GCP (Google Cloud Plataform);Experiência na construção de relatórios / dashboards utilizando ferramentas de Data Viz, preferencialmente Tableau e Power Bi;Experiência com Metodologias Ágeis e ferramentas de gestão de tarefas, preferencialmente Jira.Experiência com UX&amp;UI e Figma são um diferencial.Informações adicionaisO que oferecemos:Vale alimentação e refeição no cartão Caju🥗Auxílio Home-Office no cartão Caju 💳Plano de saúde de acordo com a sua localidade 🩺Plano odontológico de acordo com a sua localidade 🦷Day off de aniversário + valor depositado no cartão Caju🎉Licença-maternidade e paternidade estendida 🍼Participação nos lucros (PLR) 💰Seguro de vida 🧡Auxílio creche 👶Bônus por indicação 💰",Cadastra ,vacancy_type_effective,,True,,,Brasil,https://cadastra.gupy.io/job/eyJqb2JJZCI6NjY5MzE1Nywic291cmNlIjoiZ3VweV9wb3J0YWwifQ==?jobBoardSource=gupy_portal,True,remote,True
6693220,2024-02-01T21:06:22.548Z,Analytics Engineer (Data Analyst) - Jr,"A Cadastra é uma empresa global de soluções de marketing, estratégia de negócios, tecnologia, dados e analytics, entrega resultados exponenciais em vendas por meios de canais digitais. Pioneira e líder em search engine marketing no Brasil, é a única empresa na América Latina a oferecer soluções de ponta a ponta em Transformação Digital. Com mais de 20 anos de experiência, o nosso know-how é multidisciplinar, dinâmico e sempre atual entre as áreas de Business &amp; Strategy, Performance &amp; Growth, Engaging Experince, Data &amp; Analytics, Content &amp; Creativity e Transformative Engineering.Nosso Time é composto por pessoas com iniciativa, que tomam decisões e têm alto grau de comprometimento. Somos curiosos, inquietos e gostamos de abraçar mudanças, pautados sempre por honestidade, respeito e transparência no que fazemos. Estamos crescendo aceleradamente, transformando pessoas e negócios com o que fazemos.Responsabilidades e atribuiçõesNo nosso Data Hub você terá o desafio de:Refinar e documentar as iniciativas priorizadas junto às áreas de negócio, levantando requisitos, necessidades e dependências;Apoiar a tomada de decisão utilizando dados, orientando as áreas sobre a forma mais adequada de consumo e qual o dado mais adequado para cada situação de negócio;Modelar tabelas, pipelines de dados e outras soluções técnicas;Criar e definir modelagens de repositórios de dados da instituição tais como (Data Lakes, DataWareHouses, Bases relacionais e não relacionais);Desenvolver estratégias de aquisição de dados (históricos e online), recuperação de informação, implementação de pipelines de processamentos de dados e armazenamento de dados;Desenvolver relatórios automatizados usando ferramentas de visualização de dados;Manter repositórios de dados seguros e pipelines de integração confiáveis e escaláveis;Trabalhar com autonomia, porém sem individualismo, aproveitando os diversos perfis profissionais do time para potencializar suas entregas;Colaborar nos alinhamentos, reuniões e cerimônias junto ao cliente.Requisitos e qualificaçõesO que a Cadastra espera de você:Conhecimento nos conceitos de Big Data;Conhecimento em SQL e Python;Conhecimento em engenharia de dados utilizando ambientes Cloud, preferencialmente GCP (Google Cloud Plataform);Conhecimento na construção de relatórios / dashboards utilizando ferramentas de Data Viz, preferencialmente Tableau e Power Bi;Conhecimento das Metodologias Ágeis e ferramentas de gestão de tarefas, preferencialmente Jira.Informações adicionaisO que oferecemos:﻿Vale alimentação e refeição no cartão Caju🥗Auxílio Home-Office no cartão Caju 💳Plano de saúde de acordo com a sua localidade 🩺Plano odontológico de acordo com a sua localidade 🦷Day off de aniversário + valor depositado no cartão Caju🎉Licença-maternidade e paternidade estendida 🍼Participação nos lucros (PLR) 💰Seguro de vida 🧡Auxílio creche 👶Bônus por indicação 💰Vale-transporte 🚍",Cadastra ,vacancy_type_effective,,True,,,Brasil,https://cadastra.gupy.io/job/eyJqb2JJZCI6NjY5MzIyMCwic291cmNlIjoiZ3VweV9wb3J0YWwifQ==?jobBoardSource=gupy_portal,True,remote,True
6702692,2024-02-01T18:08:55.690Z,Data Engineer Specialist,"Responsável pelos processos de dados da organização, para que sejam coletados, processados e armazenados de forma eficiente, segura e escalável, avaliando e selecionando ferramentas e tecnologias, conduzindo projetos, fornecendo soluções escaláveis, eficientes e seguras para a empresa.Responsabilidades e atribuiçõesLiderar a arquitetura, design e implementação de sistemas de dados de ponta a ponta, desde a coleta até a análise de dados, incluindo a definição de requisitos, seleção de tecnologias, integração de sistemas e desenvolvimento de fluxos de trabalho;Identificar e solucionar problemas de desempenho e integridade de dados, utilizando técnicas avançadas de análise de dados e ferramentas de monitoramento para garantir que os dados estejam sempre disponíveis, precisos e confiáveis;Conduzir a implementação de práticas de desenvolvimento de software e processos de integração contínua e entrega contínua para sistemas de dados, garantindo que as alterações sejam feitas de maneira consistente, segura e automatizada;Participar do processo de planejamento estratégico de dados da empresa, ajudando a definir a visão e a estratégia de dados de longo prazo e alinhando as iniciativas de dados com os objetivos de negócios da empresa;Fornecer soluções de dados escaláveis e eficientes que permitam que a empresa atenda a requisitos regulatórios e de conformidade, como a proteção de dados pessoais e informações financeiras.Requisitos e qualificaçõesFormação Superior, preferencialmente em Ciência da Computação, Engenharia de Computação, Tecnologia da Informação;Experiência mínima de 2 anos em projetos em ambientes Cloud;Experiência mínima de 5 anos na área de análise e gerenciamento de dados;Conhecimento em banco de dados NoSQL e SQL;Técnicas de Análise e Modelagem de Dados – Avançado;Ambientes Cloud (AWS, Azure, Google Cloud) focado nas soluçoes de dados (AWS Glue, AWS EMR, AWS Redshift, AWS Athena, AWS Kinesis);Metodologia ágil de trabalho, DevOpsLinguagens - SQL, Python - AvançadoTecnologias de processamento de dados distribuído (Spark, Kafka)- Avançado;Provisionamento de infraestrutura em via código (Terraform);Inglês - IntermediárioInformações adicionaisBenefíciosContrato CLTVR (R$ 909,48/ mês);VA (R$ 702,82 / mês);Plano de Saúde Bradesco;Plano Odontológico Bradesco;PLR;Vale Cesta de Natal Alelo;Auxílio creche ou Babá (R$ 460,79 até 6 anos);Licença maternidade de 6 meses e paternidade de 20 dias;Day off no dia do seu aniversário;Antecipação do 13º no mês de maio.",Pottencial Seguradora,vacancy_type_effective,,False,Belo Horizonte,Minas Gerais,Brasil,https://pottencial.gupy.io/job/eyJqb2JJZCI6NjcwMjY5Miwic291cmNlIjoiZ3VweV9wb3J0YWwifQ==?jobBoardSource=gupy_portal,True,hybrid,True
