job_id,published_date,title,description,career_page_name,type,application_deadline,is_remote_work,city,state,country,job_url,disabilities,workplace_type,submitted
7250079,2024-06-03T15:20:51.554Z,Desenvolvedor Pleno ,"Na Vivo Vita temos uma paixão: transformar a vida de nossos colaboradores para que sua experiência de trabalho seja única!Buscamos transformar talento em resultado, criatividade em prática e expectativas em realidade com um ambiente de trabalho colaborativo, flexível, integrado e dedicado às pessoas!Estamos comprometidos em trazer aos nossos colaboradores toda tecnologia e treinamento para aprimorar suas habilidades técnicas e comportamentais.Venha digitalizar seu DNA conosco!!Responsabilidades e atribuiçõesDesenvolver e implantar softwares; dimensionando requisitos e funcionalidades, especificando sua arquitetura, escolhendo ferramentas de desenvolvimento, especificando programas e codificando aplicativos. Pesquisar novas tendências em tecnologia.Atuar em todo o ciclo de desenvolvimento envolvendo, avaliação de requisitos, arquitetura, codificação, verificação e manutenção.Realizar investigações técnicas, verificando a viabilidade do desenvolvimento de funcionalidades inovadoras.Experiência em design e construção de ferramentas com formato de portal.Realizar sustentação, evolução e integração de ferramentas internas da áreaTrabalhar em ambiente colaborativo e dinâmico, atuando em equipes virtuais com o uso de metodologias de desenvolvimento ágeis.Compartilhar conhecimento e experiência com os demais membros da equipe, demonstrando boas práticas relacionadas a arquitetura de software e codificação.Atuar no gerenciamento de produtos, a partir da criação de histórias de usuários e definições de requisitos.Interagir eventualmente com clientes na discussão e solução de questões técnicas.Produzir códigos claros e eficientes, baseando-se nas especificações previamente levantadas.Testar e implementar programas e sistemas, garantindo sua aplicabilidade e segurança.Efetuar correções e melhorias nos softwares existentes, ajustando-os conforme o surgimento de necessidades e/ou atualizações tecnológicas.Projetar algoritmos e fluxogramas, atuando em conjunto com os demais desenvolvedores.Identificar e solucionar problemas, além de depurar e atualizar os softwares existentes.Agrupar e avaliar os feedbacks de usuários, recomendando e executando melhorias.Elaborar documentação técnica para referências e relatórios.Atender e realizar outras atividades profissionais correlatas e inerentes ao cargo, conforme orientação e solicitação do Superior imediato.Requisitos e qualificações Conhecimentos no framework Angular (NÍVEL: Intermediário) Desenvolvimento C# WebAPI / Net.Core (NÍVEL: Intermediário) Domínio em gerenciamentos de repositórios - GIT (NÍVEL: Intermediário) Experiência em realizar integrações entre sistemas  (NÍVEL: Avançado) Conhecimentos em orientação a objetos  (NÍVEL: Avançado) Desenvolvimento de software (NÍVEL: Avançado) Conhecimento em Entity framework  (NÍVEL: Intermediário) Conhecimentos em REST API e SOAP (NÍVEL: Intermediário) Construção e realização de testes (NÍVEL: Intermediário) Conhecimentos em desenvolvimento e modelagem em banco de dados SQL Server (NÍVEL: Avançado) Conhecimento em testes de qualidade (NÍVEL: Intermediário) (NÍVEL: Básico / D)Informações adicionaisBenefícios de um Vitalent:Vale refeição (Flash Benefícios);Assistência MédicaAssistência OdontológicaSeguro de vida;Day Off no mês do aniversário;PLRPrevidência PrivadaUma oferta exclusiva da Vivo, com deDesconto especial em linha fixa, banda larga, TV e apps;Local de trabalho - São Paulo - Morumbi",Vivo Vita,vacancy_type_effective,,False,São Paulo,São Paulo,Brasil,https://vivovita.gupy.io/job/eyJqb2JJZCI6NzI1MDA3OSwic291cmNlIjoiZ3VweV9wb3J0YWwifQ==?jobBoardSource=gupy_portal,True,hybrid,True
7251603,2024-06-03T18:09:48.120Z,Dev Java Pleno - BH ,"A NAVA está em busca de uma Pessoa Desenvolvedor Java Pleno para fazer parte do nosso time de pessoas incríveis!  Por que trabalhar na NAVA?Somos uma empresa de tecnologia que atende as maiores companhias dos setores financeiro, seguros, meios de pagamento, telecomunicações, energia e varejo do país. Inspiramos nossos times a criar soluções para que essas companhias transformem e impactem positivamente o mundo.  Temos um time curioso, criativo, energético e inspirador, com grande foco nas pessoas para gerar inovação, transformação e crescimento. Dentro de um ambiente dinâmico e ágil, o nosso time está em expansão para acompanhar o crescimento exponencial da NAVA e dos nossos Clientes. ﻿Acolhemos as diferenças porque acreditamos que um ambiente diverso contribui para a inovação e uma sociedade mais justa e equânime e convidamos você à assumir esse compromisso junto com a gente.Responsabilidades e atribuiçõesComo será o seu dia a dia?Implementar software e soluções utilizando tecnologias de mercado para alavancar e suportar os negócios;Garantir a identificação de ações para melhoria contínua, buscando soluções criativas para proporcionar alta disponibilidade e segurança nas evoluções e sustentações dos sistemas;Atuar no desenvolvimento e aplicação de novos projetos e processos, assegurando sua devida implantação.Requisitos e qualificaçõesFormação:Ensino Superior CompletoConhecimentos Técnicos:Experiência (3 anos ou mais) em desenvolvimento em sistemas e plataformas Java;Domínio do protocolo HTTP REST e desenho de APIs;Conhecimento do protocolo gRPC, protobuf;Experiência com desenvolvimento em sistemas Linux;Domínio em desenvolvimento orientado a objetos;Domínio de padrões de design projeto e melhores práticas;Experiência com projetos em modelagem DDD e arquitetura hexagonal;Conhecimento de filas de mensagens (Kafka, RabbitMQ, padrão PubSub);Experiência com integração e desenvolvimento em Cloud (AWS);Linguagens: Java 11, 17, Micronaut, SprintBoot;Conhecimento em Banco de dados (Postgre, Oracle, MongoDB);Experiência com modelagem de dependências;Conhecimento e vivência em Projetos em Metodologias Ágeis (Scrum, Kanban).﻿Será considerado diferencial se você tiver:Experiência em projetos de meios de pagamento (adquirëncia);Experiência com diagramação de arquitetura de sistemas;Experiência com engenharia reversa;Domínio de padrões arquitetura de microserviços: CQRS, SAGA;Linguagens: Go, Python e C++;Ferramentas: NewRelic, ELK, AWS ParameterStore, AWS Secrets Manager, AWS; MSK, AWS SQS, AWS SNS, AWS EKS, AWS Elastic Cache (Redis), Aurora RDS, AWS; DocumentDB, Azure DevOps, GitLab, Sonar, TerraformExperiência com BDD e automação de testes.""Informações adicionaisHorário de trabalho: De Segunda á sexta das 9h00 ás 18h00 Modelo de trabalho para este projeto/cliente: Hibrido, 3 vezes por semana no escritórioLocal de trabalho: Belo Horizonte MGAlém de ser uma empresa certificada Great Place to Work, você vai encontrar na NAVA: ✅ Oportunidades de carreira 🚀✅ Liberdade para escrever seu próprio código 🏆✅ Diversidade e diferentes formas de ver o mundo 🌈✅ Comunidades que incentivam o crescimento de todos 📚✅ Treinamento In Company 💻✅ Um time incrível 😎✅ Empresa engajada no Pacto Global da ONU 💪🏼✅ Projetos inovadores 💡✅ Alta avaliação no Glassdoor 📣 ",NAVA | Technology for Business,vacancy_type_effective,2024-07-08T00:00:00.000Z,False,Belo Horizonte,Minas Gerais,Brasil,https://nava.gupy.io/job/eyJqb2JJZCI6NzI1MTYwMywic291cmNlIjoiZ3VweV9wb3J0YWwifQ==?jobBoardSource=gupy_portal,True,hybrid,True
7250699,2024-06-03T18:05:47.462Z,Dev Java Pleno - BH,"A NAVA está em busca de uma Pessoa Desenvolvedor Java Pleno para fazer parte do nosso time de pessoas incríveis!  Por que trabalhar na NAVA?Somos uma empresa de tecnologia que atende as maiores companhias dos setores financeiro, seguros, meios de pagamento, telecomunicações, energia e varejo do país. Inspiramos nossos times a criar soluções para que essas companhias transformem e impactem positivamente o mundo.  Temos um time curioso, criativo, energético e inspirador, com grande foco nas pessoas para gerar inovação, transformação e crescimento. Dentro de um ambiente dinâmico e ágil, o nosso time está em expansão para acompanhar o crescimento exponencial da NAVA e dos nossos Clientes. ﻿Acolhemos as diferenças porque acreditamos que um ambiente diverso contribui para a inovação e uma sociedade mais justa e equânime e convidamos você à assumir esse compromisso junto com a gente.Responsabilidades e atribuiçõesComo será o seu dia a dia?Implementar software e soluções utilizando tecnologias de mercado para alavancar e suportar os negócios;Garantir a identificação de ações para melhoria contínua, buscando soluções criativas para proporcionar alta disponibilidade e segurança nas evoluções e sustentações dos sistemas;Atuar no desenvolvimento e aplicação de novos projetos e processos, assegurando sua devida implantação.Requisitos e qualificaçõesFormação:Ensino Superior CompletoConhecimentos Técnicos:Experiência (3 anos ou mais) em desenvolvimento em sistemas e plataformas Java;Domínio do protocolo HTTP REST e desenho de APIs;Conhecimento do protocolo gRPC, protobuf;Experiência com desenvolvimento em sistemas Linux;Domínio em desenvolvimento orientado a objetos;Domínio de padrões de design projeto e melhores práticas;Experiência com projetos em modelagem DDD e arquitetura hexagonal;Conhecimento de filas de mensagens (Kafka, RabbitMQ, padrão PubSub);Experiência com integração e desenvolvimento em Cloud (AWS);Linguagens: Java 11, 17, Micronaut, SprintBoot;Conhecimento em Banco de dados (Postgre, Oracle, MongoDB);Experiência com modelagem de dependências;Conhecimento e vivência em Projetos em Metodologias Ágeis (Scrum, Kanban).﻿Será considerado diferencial se você tiver:Experiência em projetos de meios de pagamento (adquirëncia);Experiência com diagramação de arquitetura de sistemas;Experiência com engenharia reversa;Domínio de padrões arquitetura de microserviços: CQRS, SAGA;Linguagens: Go, Python e C++;Ferramentas: NewRelic, ELK, AWS ParameterStore, AWS Secrets Manager, AWS; MSK, AWS SQS, AWS SNS, AWS EKS, AWS Elastic Cache (Redis), Aurora RDS, AWS; DocumentDB, Azure DevOps, GitLab, Sonar, TerraformExperiência com BDD e automação de testes.""Informações adicionaisHorário de trabalho: De Segunda á sexta das 9h00 ás 18h00 Modelo de trabalho para este projeto/cliente: Hibrido, 3 vezes por semana no escritórioLocal de trabalho: Belo Horizonte MGAlém de ser uma empresa certificada Great Place to Work, você vai encontrar na NAVA: ✅ Oportunidades de carreira 🚀✅ Liberdade para escrever seu próprio código 🏆✅ Diversidade e diferentes formas de ver o mundo 🌈✅ Comunidades que incentivam o crescimento de todos 📚✅ Treinamento In Company 💻✅ Um time incrível 😎✅ Empresa engajada no Pacto Global da ONU 💪🏼✅ Projetos inovadores 💡✅ Alta avaliação no Glassdoor 📣 ",NAVA | Technology for Business,vacancy_type_effective,2024-07-08T00:00:00.000Z,False,Belo Horizonte,Minas Gerais,Brasil,https://nava.gupy.io/job/eyJqb2JJZCI6NzI1MDY5OSwic291cmNlIjoiZ3VweV9wb3J0YWwifQ==?jobBoardSource=gupy_portal,True,hybrid,True
7248573,2024-06-03T13:02:54.068Z,DEV JAVA SÊNIOR,"A NAVA está em busca de uma Pessoa Desenvolvedora Java Sênior para fazer parte do nosso time de pessoas incríveis!  Por que trabalhar na NAVA?Somos uma empresa de tecnologia que atende as maiores companhias dos setores financeiro, seguros, meios de pagamento, telecomunicações, energia e varejo do país. Inspiramos nossos times a criar soluções para que essas companhias transformem e impactem positivamente o mundo.  Temos um time curioso, criativo, energético e inspirador, com grande foco nas pessoas para gerar inovação, transformação e crescimento. Dentro de um ambiente dinâmico e ágil, o nosso time está em expansão para acompanhar o crescimento exponencial da NAVA e dos nossos Clientes. ﻿Acolhemos as diferenças porque acreditamos que um ambiente diverso contribui para a inovação e uma sociedade mais justa e equânime e convidamos você à assumir esse compromisso junto com a gente.Responsabilidades e atribuiçõesComo será o seu dia a dia?Projetar, desenvolver e manter aplicativos e sistemas Java de alta qualidade.Escrever código limpo, escalável e eficiente, seguindo os padrões de codificação e melhores práticas da indústria.Participar na definição da arquitetura de software e design de sistemas.Analisar e traduzir requisitos de negócios em especificações técnicas detalhadas.Desenvolver e executar testes unitários e de integração.Identificar e corrigir bugs e problemas de desempenho.Realizar revisões de código para garantir a qualidade e aderência aos padrões de desenvolvimento.Orientar e fornecer feedback a desenvolvedores juniores e intermediários.Requisitos e qualificaçõesO que esperamos de você?Java,Spring MVC,Spring Data,Spring Security,Spring Boot,Hibernate/JPA,MongoDB,Oracle,JDBC,PL/SQL.Informações adicionaisHorário de trabalho: ComercialModelo de trabalho para este projeto/cliente: Híbrido (1 vez a cada 15 dias)Local de trabalho: Av. Paulista - Próximo a estação brigadeiro do metrô.Além de ser uma empresa certificada Great Place to Work, você vai encontrar na NAVA: ✅ Oportunidades de carreira 🚀✅ Liberdade para escrever seu próprio código 🏆✅ Diversidade e diferentes formas de ver o mundo 🌈✅ Comunidades que incentivam o crescimento de todos 📚✅ Treinamento In Company 💻✅ Um time incrível 😎✅ Empresa engajada no Pacto Global da ONU 💪🏼✅ Projetos inovadores 💡✅ Alta avaliação no Glassdoor 📣 ",NAVA | Technology for Business,vacancy_type_effective,,False,São Paulo,São Paulo,Brasil,https://nava.gupy.io/job/eyJqb2JJZCI6NzI0ODU3Mywic291cmNlIjoiZ3VweV9wb3J0YWwifQ==?jobBoardSource=gupy_portal,True,hybrid,True
7251466,2024-06-03T17:55:49.001Z,Back End Developer,"¡Sé parte de Stefanini!En Stefanini somos más de 30.000 genios, conectados desde 41 países, haciendo lo que les apasiona y co-creando un futuro mejor.¡Seguro no te quieres quedar fuera!  Responsabilidades y atribucionesExperiencia con Spring boot (JAVA), SQL: Postgres, bigQuery, Kafka o MQ Rabbit, GCP, Open API, API RESTRequisitos y calificacionesInformaciones adicionales",STEFANINI LATAM,vacancy_type_effective,,False,Santiago,,Chile,https://stefaninilatam.gupy.io/job/eyJqb2JJZCI6NzI1MTQ2Niwic291cmNlIjoiZ3VweV9wb3J0YWwifQ==?jobBoardSource=gupy_portal,True,hybrid,True
7251431,2024-06-03T17:52:44.597Z,Back End Developer,"¡Sé parte de Stefanini!En Stefanini somos más de 30.000 genios, conectados desde 41 países, haciendo lo que les apasiona y co-creando un futuro mejor.¡Seguro no te quieres quedar fuera!  Responsabilidades y atribucionesExperiencia con Spring boot (JAVA), SQL: Postgres, bigQuery, Kafka o MQ Rabbit, GCP, Open API, API RESTRequisitos y calificacionesInformaciones adicionales",STEFANINI LATAM,vacancy_type_effective,,False,Santiago,,Chile,https://stefaninilatam.gupy.io/job/eyJqb2JJZCI6NzI1MTQzMSwic291cmNlIjoiZ3VweV9wb3J0YWwifQ==?jobBoardSource=gupy_portal,True,hybrid,True
7244751,2024-06-03T14:35:42.858Z,Pessoa Desenvolvedora Back-End .Net Core - Pleno ,"A FCamara está em busca de uma Pessoa Desenvolvedora .NET Core Pleno, para trabalhar com um banco que entende as necessidades, inova nas soluções e atende com excelência os seus clientes. Estão em um momento de grande evolução de serviços, com forte entrada em soluções digitais para mercado de câmbio (PF e PJ) e serviços de FX as a Service para fintechs e parceiros do mercado financeiro.Responsabilidades e atribuiçõesDesenvolver e manter aplicações backend robustas, seguras e escaláveis utilizando .NET Core + SQLServer Projetar e implementar infraestrutura na AWS, atendendo aos requisitos técnicos e às melhores práticas de segurança e escalabilidade.Implementar estratégias de mitigação para lidar com possíveis riscos associados à segurança, performance e disponibilidade do sistema.Escrever testes unitários e de integração para assegurar a qualidade e a confiabilidade do código.Trabalhar em colaboração com equipes de frontend, design e produto para criar soluções integradas e eficazes.Manter-se atualizado com as últimas tendências e melhores práticas em desenvolvimento backend e AWS.Requisitos e qualificaçõesExperiência profissional em desenvolvimento backend, com sólida experiência em .NET CoreForte conhecimento em arquitetura orientada a microsserviço e event driven (orientada a eventos).Experiência comprovada com AWS (Lambda, DynamoDB, API Gateway, SQS).Capacidade de implementar estratégias de mitigação, realizar monitoramento eficaz das aplicações e Troubleshooting (diferencial conhecimento em Datadog).Experiência em escrever testes unitários e compreensão dos princípios de teste de software.Uso de DEVOPS com GITConhecimento adicional em Node ou Razor será considerado um diferencial.Conhecimento no segmento bancário, core banking principalmente meios de pagamento será um diferencial.Informações adicionais",VENHA SER #SANGUELARANJA 🧡🚀,vacancy_type_effective,,False,São Paulo,São Paulo,Brasil,https://fcamara.gupy.io/job/eyJqb2JJZCI6NzI0NDc1MSwic291cmNlIjoiZ3VweV9wb3J0YWwifQ==?jobBoardSource=gupy_portal,False,hybrid,True
7241609,2024-06-03T13:46:26.847Z,Back Office - Administrativo - Cobrança,"Nós somos a NWSoluções, somos especialistas em ajudar pessoas como você a superar desafios financeiros. Com atuação em todo o Brasil, nossa entrega vai da fase amigável à jurídica e nossa abordagem na recuperação de créditos destaca-se pela consistência e parceria sólida que temos com nossos clientes.Acreditamos no poder transformador da empatia, destacando-nos por nossa eficácia e transparência. E para nós, desafios são apenas uma das maneiras de mostrarmos a força da nossa comunidade em ação.#vempraNWSolucoes#SomosNWResponsabilidades e atribuiçõesAcompanhar e organizar as renegociações, para envio de documento e postagem no banco;Atualizar dados para relatório de inadimplentes e enviar proposta de quitação aos clientes;Apoiar na conciliação de pagamentos;Prestar atendimento aos clientes para esclarecimento de dúvidas. Requisitos e qualificaçõesEnsino médio completo;Pacote Office;Vivência em Negociação e Recuperação de Crédito.Informações adicionais",NW Soluções,vacancy_type_effective,,False,São Paulo,São Paulo,Brasil,https://nwsolucoes.gupy.io/job/eyJqb2JJZCI6NzI0MTYwOSwic291cmNlIjoiZ3VweV9wb3J0YWwifQ==?jobBoardSource=gupy_portal,False,on-site,True
7243633,2024-06-03T12:45:46.191Z,Analista de Faturamento - Back Office,"Sobre a Soul MallsSomos uma empresa com atuação em planejamento, gestão, desenvolvimento e comercialização de empreendimentos comerciais em diversos estados do Brasil.Acreditamos que nossos empreendimentos possuem alma, vocação e que os melhores resultados são fruto da gestão que valoriza as potencialidades e diferenciais de cada um. Reunimos em nosso portfólio dezenas de shoppings centers, greenfields, expansões e outros conceitos como centros gastronômicos, liderados por um time de excelência que reúne conhecimento, energia e paixão pelo que faz, agindo como dono, de forma próxima e comprometida com o dia-a-dia do negócio.Buscamos a maximização dos resultados sustentáveis de longo prazo, por meio de uma gestão eficiente e profissional, processos estruturados e sensibilidade mercadológica.Vem com a gente FAZER PARTE DESSA HISTÓRIA!Responsabilidades e atribuiçõesSobre a oportunidade:A área de Faturamento tem como objetivo executar as atividades de faturamento e cadastro, assegurando que os processos sejam realizados com qualidade e de acordo com os prazos estipulados, assim como dentro das normas estabelecidas pela empresa e da legislação vigente. Como Analista de Faturamento, na Soul Malls, você irá:Realizar o cadastro dos contratos de lojistas, bem como documentos diversos, mantendo a base atualizada de acordo com os pedidos de alteração;Executar o faturamento de aluguel, mídias e eventos, encargos condominiais e FPP (Fundo de Promoção e Propaganda) de cada shopping, de acordo com a base de cadastro de contrato e valores de orçamento, rateio, despesas complementares e vendas informadas, mantendo a comunicação direta com os mesmos;Auxiliar os shoppings nas dúvidas sobre o processo de faturamento e recebimento e apresentar as rotinas necessárias da área;Manusear diariamente arquivos eletrônicos de remessa entre sistema e banco, por meio do sistema TM, visando garantir que boletos sejam registrados no banco, bem como para realizar a reconciliação bancária;Analisar o faturamento, recebimento e inadimplência e apontar discrepâncias ou valores críticos para a liderança;Enviar para a liderança a análise de problemas dos faturamentos e recebimentos sob sua responsabilidade;Manter as bases atualizadas de mapas de faturamento e recebimento para envio à controladoria;Dar suporte à controladoria, com relação as dúvidas de lançamentos da área de faturamento;Manter relatórios e bases do sistema atualizadas de acordo com os dados recebidos;Cumprir com os prazos (SLAs) da área, visando ter os chamados dos shoppings (faturamento, cadastro, abono, etc) em dia;Manter canal de comunicação constante com o banco e com a TM sobre registro de boletos para suporte e resolução de problemas;Realizar o fechamento e apresentação mensal dos indicadores sob sua responsabilidade para a supervisão da área;Envio de update semanal (acontecimentos ocorridos) para a supervisão da área;Realizar análise da base de acordo com os chamados de abonos (cobrança a mais), visando manter a base limpa;Executar outras atividades compatíveis com a natureza da função.Requisitos e qualificaçõesRequisito(s) Obrigatório(s):Formação superior completa em Economia, Administração, Ciências Contábeis ou afins;Experiência em faturamento e contas a receber;Pacote office / Excel intermediárioInformações adicionaisRegime de Contratação: CLT;Modalidade: Presencial;Horário e Escala: Segunda à sexta-feira 9:00 às 18:00Nossos benefícios:Além de trabalhar em uma empresa em constante crescimento, focada em impulsionar talentos, por aqui você também terá:🍝 Vale Refeição e/ou Alimentação;🚌 Vale Transporte;🏥Plano de Saúde e Odontológico;🥳 Day-off no seu aniversário para você curtir muito;💙 Seguro de Vida.Quer saber mais? Vem acompanhar a gente!Site: www.soulmalls.com.brPortal de Carreiras: https://soulmalls.gupy.io/Instagram: www.instagram.com/soul_mallsLinkedIn: https://www.linkedin.com/company/soul-malls#vemprasoul#vemprotimesoul#orgulhodesersoul",Soul Malls,vacancy_type_effective,,False,Rio de Janeiro,Rio de Janeiro,Brasil,https://soulmalls.gupy.io/job/eyJqb2JJZCI6NzI0MzYzMywic291cmNlIjoiZ3VweV9wb3J0YWwifQ==?jobBoardSource=gupy_portal,True,on-site,True
7248326,2024-06-03T12:40:09.831Z,Desenvolvedor (a) Back end Java Sênior,"A FCamara está em busca de um(a) Desenvolvedor(a) Back-end para atuar em parceria com uma grande plataforma digital de serviços financeiros com múltiplos produtos e serviços para consumidores, que também conta com produtos de empréstimos pessoais distribuídos por meio de parcerias com as principais fintechs do país. Sua proposta de valor é ser uma plataforma agnóstica de serviços financeiros com a solidez de um banco e agilidade de uma fintech.Responsabilidades e atribuições•	Projetar e construir serviços utilizando a linguagem Java;•	Colaborar com equipes multidisciplinares para definir, projetar e entregar novos recursos;•	Acompanhar todo o ciclo de vida dos serviços (conceito, projeto, testes, lançamento e suporte);•	Assegurar que aplicativos novos e antigos satisfaçam aos padrões de qualidade;•	Realizar testes unitários de código quanto à robustez, incluindo casos extremos, usabilidade, acessibilidade e confiabilidade geral;•	Descobrir, avaliar e implementar continuamente novas tecnologias para maximizar a eficiência de desenvolvimento.Requisitos e qualificaçõesHard Skill:•	Arquitetura baseada em micro serviços;•	Metodologias Ágeis de Projetos (Scrum / Kanban);•	Java;•	Stack Spring;•	Testes Unitários e de Integração;•	Git e Gitflow;•	Containers baseados Docker;•	Jenkins;•	AWS: API Gateway, Lambda, Fargate, ECS, RDS, SQS, SNS, Secrets Manager, Elasticache (Redis).Soft Skill:•	Ser comprometido e engajado na proposição e evolução das soluções tanto do ponto de vista técnico, do negócio e da experiência oferecida ao usuário.•	Ter boa capacidade de interação e comunicação com pessoas técnicas e não técnicas.Seria legal se você tivesse:•	Experiência com desenvolvimento de aplicações móveis;•	Experiência com desenvolvimento baseado em event sourcing;•	Experiência com Play Framework;•	Conhecimento em NodeJS/Python/Golang/Groovy;•	Experiência com Terraform.Informações adicionais",VENHA SER #SANGUELARANJA 🧡🚀,vacancy_type_effective,,True,,,Brasil,https://fcamara.gupy.io/job/eyJqb2JJZCI6NzI0ODMyNiwic291cmNlIjoiZ3VweV9wb3J0YWwifQ==?jobBoardSource=gupy_portal,True,remote,True
